,Sno.,Proposal No.,File No.,Project Name,Company,Proposal Status,Project Type,View
7,317,SIA/BR/MIN/128507/2019,,"Brick Earth Mining Project of Area 1.21 Ha or 3.00 Acres M/s AH Bricks at Mauza- Chhatu Bathua, P.S + Block- Phulwaria, District- Gopalganj, State- Bihar",MS AH BRICKS,Delisted,EC,
8,318,SIA/BR/MIN/137606/2020,,Brick Earth Mining Project M/s Sona Bricks,RAJESH KUMAR BHAGALPUR,Delisted,EC,
9,319,SIA/BR/MIN/145793/2020,,BRICK EARTH MINING PROJECT FOR M/S PMB EET UDYOG MAUZA DUMRANWAN,M/S P M B EET UDYOG PROP SUVELAL PRASAD,Delisted,EC,
10,320,SIA/BR/MIN/147267/2020,,"Brick Earth Mining Project at Village- Hariharpur Lalgarh, P.O- Hariharpur Lalgarh, P.S- Barharia, District- Siwan (Bihar)",M/S SIR INT UDYOG,Delisted,EC,
1,321,SIA/BR/INFRA2/402400/2022,SIA/8(a)/2051/2022,Kirti Raman Residency,KIRTI SAGAR CONSTRUCTION PRIVATE LIMITED,Agenda Uploaded by SEAC,EC,
2,322,SIA/BR/MIN/141153/2020,,"Proposed Brick Earth Mining Project of Area 1.62 Hectare Or 4.00 Acre K Lal at  Mauza-  Padmaul,  P.S-  Mainatand,  Block-    Mainatand, District-West Champaran, State  -  Bihar",K LAL,Delisted,EC,
3,323,SIA/BR/MIN/66269/2017,SIA/1(a)/577/18,Sand Mining Project at Dumri Sand Ghat on Barnar River.,WESTLINK TRADING PRIVATE LIMITED,Delisted,EC,
4,324,SIA/BR/MIN/127013/2019,,"Simariya M/S –Maa Bricks Earth Mining Project ,Mauza- Simariya,tana no-500, khata no.-118,38,400&391. Plot no.-1037, 1057, 1048, &1049. Area-2.48Ac (1.00 ha.)For production capacity 4662 TPA,P.S.-Bara",M/S MAA BRICKS PROP:-RAM PRAVESH RAY,Delisted,EC,
5,325,SIA/BR/MIN/61244/2016,SIA/1(a)/406/16,Dihwar(NTPC Barh) Ghat on river Ganga,BROADSON COMODITIES PVT LTD,EC Granted,EC,
6,326,SIA/BR/MIN/61245/2016,SIA/1(a)/407/16,Sand Mining Project at Brahpur Ghat on river Ganga,BROADSON COMODITIES PVT LTD,EC Granted,EC,
7,327,SIA/BR/MIN/143648/2020,,ORDINARY CLAY BSCPL INFRASTRUCTURE LTD MAUZA MANNUPUR KHARRA HAYAGHAT DARBHANGA AREA 8.70 Ac,BSCPL INFRASTRUCTURE LTD. MAUZA MANNUPUR KHARRA AREA 8.70 AC,Delisted,EC,
8,328,SIA/BR/MIN/138356/2020,,"SARDAHAN SAND GHAT (CHILAUNI RIVER), APPLICANT- MR. SUJEET KUMAR, AREA- 1.8 HA, VILL.- DHALHA GARHIYA (NORTH), DIST.- SUPAUL , BIHAR","MR. SUJEET KUMAR, DISTRICT- SUPAUL, BIHAR",Delisted,EC,
9,329,SIA/BR/MIN/140893/2020,,"Brick Earth Mining Project at village-Andauli, P.o-Andauli, P.s-Saksohra, Dist-Patna",M/S ARCHANA INT UDYOG,Delisted,EC,
10,330,SIA/BR/IND2/19502/2017,,INDIAN OIL CORPORATION LTD,INDIAN OIL CORPORATION LIMITED PATNA,Delisted,EC,
1,331,SIA/BR/MIN/31554/2015,SIA/1(a)/26/2015,BRICK CLAY MINING PROJECT- PAWAN INT UDYOG,PAWAN INT UDYOG,Delisted,EC,
2,332,SIA/BR/MIN/134252/2019,,"Brick Earth Mining Project of Area 3.00 Acres or 1.21 Hectare M/S RKJ BRICKS at Mauza- Jabdaul Asram Brindavan, P.S: Chanpatiya, District-West Champaran, State - Bihar",M/S RKJ BRICKS,Delisted,EC,
3,333,SIA/BR/MIN/130671/2019,,Proposed Brick Earth Mining Project,D.R.C BRICKS,Delisted,EC,
4,334,SIA/BR/MIN/136307/2020,,S.B.M BRICKS,S.B.M BRICKS,Delisted,EC,
5,335,SIA/BR/MIN/132912/2019,,Pradhan Int Bhatta Udyog,PRADHAN INT BHATTA UDYOG,Delisted,EC,
6,336,SIA/BR/MIS/170829/2020,SIA/8(a)/1238/2020,Sai Creative Enclave at Patna,SHREE OM SAI & SATYARISHI,EC Granted,EC,
7,337,SIA/BR/MIN/66269/2017,SIA/1(a)/577/18,Sand Mining Project at Dumri Sand Ghat on Barnar River.,WESTLINK TRADING PRIVATE LIMITED,Delisted,EC,
8,338,SIA/BR/MIN/60516/2016,SIA/1(a)/379/16,"Sand Mining Project at Sharwan Dumri on River Falgu, district Jehanabad, Bihar",BANSHIDHAR CONSTRUCTION PVT LTD,EC Granted,EC,
9,339,SIA/BR/MIN/60659/2016,SIA/1(a)/388/16,Sand Mining Project at Farahangpur Ghat on river Son,BROADSON COMODITIES PVT LTD,EC Granted,EC,
10,340,SIA/BR/MIN/141153/2020,,"Proposed Brick Earth Mining Project of Area 1.62 Hectare Or 4.00 Acre K Lal at  Mauza-  Padmaul,  P.S-  Mainatand,  Block-    Mainatand, District-West Champaran, State  -  Bihar",K LAL,Delisted,EC,
1,341,SIA/BR/MIN/69941/2017,,Proposed Sand Mining Project at Kanjiar Sand Ghat on Lilajan River.,WESTLINK TRADING PRIVATE LIMITED,Delisted,EC,
2,342,SIA/BR/MIS/181412/2020,SIA/8(a)/1269/2020,"Proposed Residential Building “H2O City” Mauza-Neora, Tehsil-Bihta, District- Patna, Bihar by M/s Anshul Homes Pvt. Ltd.",M/S ANSHUL HOMES PVT. LTD.,EC Granted,EC,
3,343,SIA/BR/MIN/126441/2019,,"Achhechak & Kalyanpur (Khata No – 02, 23, 12 & 01. Khasra/Plot(s) No. 464, 465, 465/685, 603, 41, 1, 7, 40, 34 & 76) soil brick mining project.",M/S SHREE RAM BRICKS,Delisted,EC,
4,344,SIA/BR/MIN/66031/2017,SIA/1(a)/544/18,Sand Mining Project at Sharma Sand Ghat (Block no-11) on Kiul River.,WESTLINK TRADING PRIVATE LIMITED,Delisted,EC,
5,345,SIA/BR/MIN/66081/2017,SIA/1(A)/564/18,Sand Mining Project at Badibag Sand Ghat on Kiul River.,WESTLINK TRADING PRIVATE LIMITED,Delisted,EC,
6,346,SIA/BR/MIN/162288/2020,,BRICK EARTH MINING PROJECT FOR M/S BIHAR INT UDYOG UNIT III MAUZA PASHURAMPUR PARASI KALER ARWAL AREA 2.72 Ac 1.10 Ha,BRICK EARTH MINING PROJECT FOR M/S BIHAR INT UDYOG UNIT- III PROP MD MANWER ALAM,Delisted,EC,
7,347,SIA/BR/IND/19010/2016,SIA/3(b)/336/16,Bihar cement Plant - A Unit of Shree Cement Limited,Shree Cement Ltd.,EC Granted,EC,
8,348,SIA/BR/MIN/41681/2019,,SUGAULI & CHAND PARSA BALU GHAT,VINAY KUMAR   DISTRICT EAST CHAMPARAN,Pending at PP due to eds,EC,
9,349,SIA/BR/MIN/48475/2016,,"River Sand (Minor Mineral) Mining Project for Rivers , Mahiyama Ghat,  in Bhagalpur District of Bihar",MS SAINIK FOOD PVT LTD,Delisted,EC,
10,350,SIA/BR/MIN/132658/2019,,"Antaur M/S BHARAT INT UDYOG project, for   Production Capacity 4848.48 TPA, Mine Area, 2.57 Ac 1.04 Ha, Mauza – Antaur (Shahdullahpur), Thana No.- 156, Khata No. 270, 335, 349, 98 & 750. Plot No. 2501",M/S BHARAT INT UDYOG PROP RAJEEV KUMAR,Delisted,EC,
1,351,SIA/BR/MIN/33741/2019,,Pipra Balu Ghat,VINAY  KUMAR,Pending at PP due to eds,EC,
2,352,SIA/BR/MIN/167383/2020,,BRICK EARTH MINING PROJECT FOR M/S BIHAR INT UDYOG UNIT I MAUZA HASANPUR PIPRA ARWAL AREA 2.54 Ac,M/S BIHAR INT UDYOG UNIT I PROP MD MANWER ALAM,Delisted,EC,
3,353,SIA/BR/MIN/31474/2019,SIA/1(a)/634/19,"Sand mining project at Bindaul ghat 1 on Son river over an area of 24.9 ha in district Patna, Bihar",BROADSON COMODITIES PVT LTD,EC Granted,EC,
4,354,SIA/BR/MIN/34641/2019,,Hasuaha Ghat on Burhi Gandak River,VINAY  KUMAR,Pending at PP due to eds,EC,
5,355,SIA/BR/MIS/197832/2021,SIA/8(a)/1273/2021,Proposed VIRAAT RAMAYANA MANDIR at East Champaran (Bihar),SRI  MAHAVIR  STHAN  NYAS  SAMITY,EC Granted,EC,
6,356,SIA/BR/MIS/178125/2020,SIA/8(A)/1263/2020,"Government Medical College & Hospital, Jamui, Bihar",DEPARTMENT OF HEALTH GOVERMENT OF BIHAR,Delisted,EC,
7,357,SIA/BR/MIN/71320/2017,,"Sand Mining Project at Rupsapur Sand Ghat on Buddh River Anchal-Tekari, Dist-Gaya, Bihar",WESTLINK TRADING PRIVATE LIMITED,Delisted,EC,
8,358,SIA/BR/MIN/71322/2017,,"Sand Mining Project at Sirampur-Barawan sand Ghat on Buddh River, Anchal- Sherghati, Dist-Gaya, Bihar",WESTLINK TRADING PRIVATE LIMITED,Delisted,EC,
9,359,SIA/BR/MIN/133715/2019,,"Proposed Brick Earth Mining Project of Area 4.74Acres or 1.91 Hectare for M/s Shiv Shankar Int Udyog at Mauza-Gorakhari, P.O- Gorakhari, P.S – Bikram, Block- Bikram, District- Patna, State – Bihar",M/S SHIV SHANKAR INT UDYOG,Delisted,EC,
10,360,SIA/BR/MIN/31666/2015,SIA/1(a)/46/2015,M/s Om Bricks,BANWARI YADAV,Delisted,EC,
1,361,SIA/BR/MIN/64376/2017,SIA/1(a)/468/17,Sand Mining Project at Hardavan Ghat on Lilajan River,WESTLINK TRADING PRIVATE LIMITED,EC Granted,EC,
2,362,SIA/BR/MIN/64379/2017,SIA/1(a)/483/17,Sand Mining Project at Kukiyasin Sand Ghat on Falgu River,WESTLINK TRADING PRIVATE LIMITED,EC Granted,EC,
3,363,SIA/BR/MIS/261716/2022,SIA/8(a)/2035/2022,Green Homes (Project of Shital Buildtech Darbhanga),SHITAL BUILDTECH DARBHANGA,Delisted,EC,
4,364,SIA/BR/MIS/178125/2020,SIA/8(A)/1263/2020,"Government Medical College & Hospital, Jamui, Bihar",DEPARTMENT OF HEALTH GOVERMENT OF BIHAR,Delisted,EC,
5,365,SIA/BR/MIN/34988/2019,,Dighiya Dudhela Sand Ghat on Koshi   River,SUJEET KUMAR,Pending at PP due to eds,EC,
6,366,SIA/BR/MIN/66028/2017,SIA/1(a)/566/18,Sand Mining Project at Birdaban Sand Ghat (Block no-3) on Kiul River.,WESTLINK TRADING PRIVATE LIMITED,Delisted,EC,
7,367,SIA/BR/MIN/66041/2017,SIA/1(a)/547/18,"Sand mining project at Gurdih  Sand Ghat (Block no-4), Lakhisarai",WESTLINK TRADING PRIVATE LIMITED,Delisted,EC,
8,368,SIA/BR/MIN/66045/2017,SIA/1(a)/545/18,"Sand mining project at Maliya Sand Ghat (Block no-10) on Kiul river, Lakhisarai",WESTLINK TRADING PRIVATE LIMITED,Delisted,EC,
9,369,SIA/BR/MIN/136410/2020,,M/s Maa Bricks Field,M/S MAA BRICKS FIELD,Delisted,EC,
10,370,SIA/BR/MIN/145088/2020,,"Proposed Brick Earth Mining Project of Area 1.35 Hectare Or 3.33 Acre M/s Jay Guru Dev Int Udyog  at  Vill/Mauza-  Garhatha Khurd, P.O-  Barhampur, P.S + Block- Barhampur, District- Buxar, State - Bih",M/S JAI GURU DEV INT UDYOG,Delisted,EC,
1,371,SIA/BR/MIN/130584/2019,,Brick  Earth  Mining Project  for  M/s Guru Kripa  Bricks,M/S GURU KRIPA BRICKS,Delisted,EC,
2,372,SIA/BR/IND/19030/2016,SIA/3(a)/220/16,Balmukund Concast Ltd (Expansion Project),BALMUKUND CONCAST LIMITED,EC Granted,EC,
3,373,SIA/BR/MIN/31242/2015,3502,BRICK CLAY MINING PROJECT-PRINCE BRICKS-B2,SHIVAM BRICKS,Delisted,EC,
4,374,SIA/BR/MIS/279226/2022,SIA/8(a)/2038/2022,"Government Medical College and Hospital at Arrah, Bhojpur Bihar.",DEPARTMENT OF HEALTH GOVERMENT OF BIHAR,EC Granted,EC,
5,375,SIA/BR/MIN/147251/2020,,"Brick Earth Mining Project at Village- Navtoli, P.O- Auraha, P.S- Laukahi, District- Madhubani(Bihar)",M/S AMAN INT UDYOG,Delisted,EC,
6,376,SIA/BR/MIN/34551/2019,,Proposed Sand Mining Project of area 4.80 ha at Ramdiri Ghat on Ganga River of District- Begusarai of State- Bihar,RADHA SWAMI AUTOMOBILES,Pending at PP due to eds,EC,
7,377,SIA/BR/MIN/35409/2019,,"Proposed Brick Earth Mining Project of Area  3.0 Acres or  1.21 Hectare for M/s  K.B.C  Bricks  (Radha)  at Mauza-  Daulatpur, P.S-  Fatuha,  Block-  Fatuha,  District-  Patna,  State- Bihar.",KBC BRICKS,Pending at PP due to eds,EC,
8,378,SIA/BR/MIN/35429/2019,,"Proposed Brick Earth Mining Project of Area  3.0 Acres or  1.21 Hectare for M/s  Radha Bricks at Mauza- Madhopur Fathehpur, P.S- Didarganj, Block- Patna Sadar, District-  Patna, State- Bihar",MS RADHA BRICKS,Pending at PP due to eds,EC,
9,379,SIA/BR/MIN/35707/2019,,"BRICK EARTH PROJECT AT MAUZA – KUMREL & MADHUKARPUR, P.O- BARHARA, P.S - BELHAR, ANCHAL- BELHAR, DISTRICT-BANKA(BIHAR)",GGH BRICKS,Pending at PP due to eds,EC,
10,380,SIA/BR/MIN/130932/2019,,M/S. RAHUL BRICKS,M/S. RAHUL BRICKS,Delisted,EC,
1,381,SIA/BR/MIN/31437/2019,SIA/1(a)/643/19,"Sand mining project at Karbasin Nonaur ghat on Son river in district Bhojpur, Bihar",BROADSON COMODITIES PVT LTD,EC Granted,EC,
2,382,SIA/BR/MIN/137465/2020,,SEPL bricks pvt.ltd,M/S SEPL BRICKS,Delisted,EC,
3,383,SIA/BR/MIN/129864/2019,,Sand Mining Project at  Kanshar  Sand Ghat (4.85 Ha.) on Baghmati riverbed in Sitamarhi district of Bihar,NAVEENKUMAR SITAMARHI,Delisted,EC,
4,384,SIA/BR/MIN/74843/2018,,"Stone  Mining  Project  at  Village:  Chakandara / Barari,  Block- Chewra, District: 
Shekhpura,  State: Bihar",NATRAJ IRON & CASTINGS PVT. LTD,Delisted,EC,
5,385,SIA/BR/MIN/146134/2020,,ORDINARY CLAY MINING PROJECT FOR BSCPL INFRASTRUCTURE LTD MAUZA DAHAWA KHAIRI KHUTAHA,BSCPL INFRASTRUCTURE LTD MAUZA DAHAWA KHAIRI KHUTHA AREA 12.33 AC,Delisted,EC,
6,386,SIA/BR/MIN/34204/2019,,Chilauni Sand Ghat on Chilauni Sirpur River,SUJEET KUMAR,Pending at PP due to eds,EC,
7,387,SIA/BR/MIN/71234/2017,,Sand Mining Project at Jamuna Sand Ghat,WESTLINK TRADING PRIVATE LIMITED,Delisted,EC,
8,388,SIA/BR/MIN/34225/2019,,Tula Patti Sand Ghat on Tilawe River,SUJEET KUMAR,Pending at PP due to eds,EC,
9,389,SIA/BR/MIN/47524/2019,,"Brick Earth Mining Project atVillage- Pawani, P.O- Pawani, P.S – Muffassil Buxar, District- Buxar(Bihar)",M/S SWASTIK ENT UDYOG,Delisted,EC,
10,390,SIA/BR/MIS/128384/2019,SIA/8(a)/864/19,PARIVAHAN PARISAR,BIHAR STATE ROAD TRANSPORT CORPORATION,EC Granted,EC,
1,391,SIA/BR/MIN/144846/2020,,BRICK EARTH MINING PROJECT FOR M/S JAY BRICKS WORKS MAUZA JAGARNATHPUR HATHAURI BOCHAHAN MUZAFFARPUR AREA 2.83 Ac,M/S JAY BRICKS WORKS PROP SHASHI BHUSHAN KUMAR,Delisted,EC,
2,392,SIA/BR/MIN/162925/2020,,Brick Kiln Soil Mining Project,JAI GURU BRICKS,Delisted,EC,
3,393,SIA/BR/MIN/162933/2020,,B2 ALL COMMO TRADE PVT. LTD.-Brick Earth Mining project,B2 ALL COMMO TRADE PVT. LTD.,Delisted,EC,
4,394,SIA/BR/MIN/33690/2019,,Amha Laukaha Sand Ghat on Tilawe River,SUJEET KUMAR,Pending at PP due to eds,EC,
5,395,SIA/BR/MIN/33763/2019,,Sangrampur Balu Ghat,VINAY  KUMAR,Pending at PP due to eds,EC,
6,396,SIA/BR/MIN/200215/2021,,Ms P. S. Int Udyog,P S INT UDYOG,Delisted,EC,
7,397,SIA/BR/MIN/137023/2020,,"Samastipur (Khasra/Plot(s) No. 662, 684, 650, 645, 622, 626 & 627) soil brick mining project.",M/S JAYSHREE INT UDYOG,Delisted,EC,
8,398,SIA/BR/MIN/60619/2016,SIA/1(a)/372/16,"Proposed Sand Mining Project of Area 15 Ha at Nayagaon Rajapur Ghat on Ganga
River of District- Saran of State- Bihar",BROADSON COMODITIES PVT LTD,Delisted,EC,
9,399,SIA/BR/MIN/136312/2020,,"Brick Earth Mining Project at Village- Maujipur, P.O- Nadithana, P.S - Nadithana, District-Patna(Bihar)",M/S RADHA BRICKS,Delisted,EC,
10,400,SIA/BR/MIN/60746/2016,SIA/1(a)/393/16,Sand Mining Project at Mokama & Chintamanichak Ghat on River Ganga,BROADSON COMODITIES PVT LTD,EC Granted,EC,
1,401,SIA/BR/MIN/64400/2017,SIA/1(a)/479/17,Sand Mining Project at Upadhyay Sand Ghat on Lilajan River.,WESTLINK TRADING PRIVATE LIMITED,EC Granted,EC,
2,402,SIA/BR/MIN/127991/2019,,"Ganga Prasad (Khasra/Plot(s) No. 573, 487, 603 & 649) soil brick mining project.",M/S RAJA.BRICKS,Delisted,EC,
3,403,SIA/BR/MIN/61868/2017,SIA/1(a)/432/17,"Sand Mining Project at Dakra-Bhapatia Ghat on Tilawe River, Village Bhapatia, District- Saharsa, Bihar",CHANDAN KUMAR,EC Granted,EC,
4,404,SIA/BR/MIN/138779/2020,,"Brick Earth Mining Project of Area 2.80 Acres or 1.13 Hectare M/s Neyaz Bricks at Mauza- Pipra Pakri, P.O - Pipra, P.S-Bettiah Muffashil, Block- Bettiah, District-West Champaran, State - Bihar",M/S NEYAZ BRICKS,Delisted,EC,
5,405,SIA/BR/MIN/140955/2020,,ORDINARY CLAY MINING PROJECT FOR BSCPL INFRASTRUCTURE LTD,BSCPL INFRASTRUCTURE LTD MAUZA JAKHAR AREA 12.27 AC,Delisted,EC,
6,406,SIA/BR/MIN/35637/2019,,"Proposed Brick Earth Mining Project of Area 2.28 Acres or 0.92 Hectare M/s Mahal  Bricks  at Mauza + P.O- Sherpur, P.S + Block- Maner, District- Patna, State- Bihar",MS MAHAL BRICKS,Pending at PP due to eds,EC,
7,407,SIA/BR/MIN/129931/2019,,"proposed Brick Earth Mining Project at Vill: Sukumarpur, P.O- Jafrabad, P.S- Raghopur, District- Vaishali, State- Bihar, Area: 1.18 Ha of M/s Radha Bricks",RADHABRICKS,Delisted,EC,
8,408,SIA/BR/MIN/131459/2019,,"CHAKIA M/S TARA INT UDYOG with production capacity 4708.62 TPA at Mauza- Chakia, Thana No.- 157, Khata No. 118. Plot No. 1205, 1141, 1143 & 1229. Area,2.50 Ac, 1.01 Ha, P.S. + Circle- Dehri on Sone, D",M/S TARA INT UDYOG PRAT:-IFTAKHARAHMAD,Delisted,EC,
9,409,SIA/BR/MIN/132692/2019,,"M/s. SWASTIC BRICKS Project, For Production Capacity – 3629.70 cum (or 5081.58 TPA), Area-1.09Ha  (2.70Ac), Thana No.- 137, Khata  No. 147, Mauza - Bhergawan P.S. + Circle - Dhanarua, District- Patna,",SADAN KISHOR PRASAD,Delisted,EC,
10,410,SIA/BR/MIN/137987/2020,,"ODINARY CLAY MINING PROJECT FOR BSCPL INFRASTRUCTURE LTD. MAUZA PARWAN, HATHAURI, SHIVAJI NAGAR, SAMASTIPUR AREA- 11.42 Ac, 4.62 Ha",BSCPL INFRASTRUCTURE LTD. MAUZA PARWANA AREA 11.42 AC,Delisted,EC,
1,411,SIA/BR/MIS/19429/2015,SIA/7(da)/02/16,"Common Biomedical Waste Treatment Facility at Bela Industrial Area, Muzaffarpur district, Bihar",MEDICARE ENVIRONMENTAL MANAGEMENT PRIVATE LIMITED,EC Granted,EC,
2,412,SIA/BR/NCP/63065/2017,,"Proposed Construction of Flyover (4 Lane carriageway) connecting Mithapur Flyover to Bhikhari Thakur (Yarpur) Flyover via             R. Block Junction in Patna Town, Bihar",BIHAR RAJYA PUL NIRMAN NIGAM LIMITED,Delisted,EC,
3,413,SIA/BR/MIN/145649/2020,,"Bricks Earth Mining Project at Mauza- Gundi, P.o.- Saraiya, P.S.- Krishnagarh/Saraiya, Dist.-Bhojpur (Bihar)",M/A- NUTAN BRICKS,Delisted,EC,
4,414,SIA/BR/IND2/19540/2016,SIA/6(b)/332/16,HINDUSTAN PETROLEUM CORPORATION LIMITED,Hindustan Petroleum Corporation Limited,EC Granted,EC,
5,415,SIA/BR/MIN/65385/2017,SIA/1(a)/518/17,Sand Mining Project at Chotiya II Sand Ghat on Mohana River.,WESTLINK TRADING PRIVATE LIMITED,EC Granted,EC,
6,416,SIA/BR/MIS/280088/2022,SIA/8(a)/2039/2022,Proposed Residential Building “ The Emperor” by Hira Panna Infra Projects LLP,HIRA PANNA INFRAPROJECTS LLP,EC Granted,EC,
7,417,SIA/BR/MIN/130689/2019,,"Proposed Brick Earth Mining Project of Area 3.00 Acres or 1.21 Hectare for M/s Ganesh Bricks Manufacturing at Mauza-Sirshi, P.O-Samyagarh, P.S- Goshwari, Block- Pandarkh, District- Patna, State- Bihar",M/S GANESH BRICKS MANUFACTURING,Delisted,EC,
8,418,SIA/BR/MIN/131222/2019,,M/s J. HIND BRICKS,M/ S. J. HJND BRICKS,Delisted,EC,
9,419,SIA/BR/MIN/34525/2019,,Belwa Balu Ghat on Baghmati River,VINAY  KUMAR,Pending at PP due to eds,EC,
10,420,SIA/BR/NCP/30736/2017,SIA/8(b)/604/19,Sai City and Assortia Commercial Complex,SRI ANU ANAND CONSTRUCTION PVT. LTD,EC Granted,EC,
1,421,SIA/BR/MIS/29945/2015,3405,Soil Mining Project,SINGH AND COMPANY,Delisted,EC,
2,422,SIA/BR/MIN/129802/2019,,"Rupauli (Khasra/Plot(s) No. 8119, 8118, 8196, 8098, 8112, 8084, 8313, 8314, 8272, 8273, 8274 & 1352) soil brick mining project.",M/S R.N.S. TRADERS ( SAMRAT ),Delisted,EC,
3,423,SIA/BR/MIN/130287/2019,,Brick Earth Mining Project for M/S Sun Bricks,BRICK EARTH MINING PROJECT FOR M/S SUN BRICKS,Delisted,EC,
4,424,SIA/BR/MIN/130293/2019,,Brick Earth Mining Project M/s. Vikash Int Udyog,M/S VIKASH INT UDYOG,Delisted,EC,
5,425,SIA/BR/MIN/30939/2015,SIA/1(a)/04/2015,STONE MINING PROJECT-NECL-B2,NAVAYUGA ENGINEERING COMPANY LTD,Delisted,EC,
6,426,SIA/BR/MIN/141153/2020,,"Proposed Brick Earth Mining Project of Area 1.62 Hectare Or 4.00 Acre K Lal at  Mauza-  Padmaul,  P.S-  Mainatand,  Block-    Mainatand, District-West Champaran, State  -  Bihar",K LAL,Delisted,EC,
7,427,SIA/BR/MIN/74845/2018,,"Stone  Mining  Project  at  Village:  Barari,   District:   Shekhpura, State: Bihar",NATRAJ ENGINEERS PVT. LTD,Delisted,EC,
8,428,SIA/BR/MIN/31576/2015,SIA/1(a)/29/2015,BRICK CLAY MINING PROJECT- GANESH INT UDYOG,GANESH INT UDYOG,Delisted,EC,
9,429,SIA/BR/MIN/132912/2019,,Pradhan Int Bhatta Udyog,PRADHAN INT BHATTA UDYOG,Delisted,EC,
10,430,SIA/BR/MIS/170829/2020,SIA/8(a)/1238/2020,Sai Creative Enclave at Patna,SHREE OM SAI & SATYARISHI,EC Granted,EC,
1,431,SIA/BR/MIN/33618/2019,,Jitwarpur Sand Ghat on Bagra River,KATYAYNI CONTRACTORS PVT. LTD.,Pending at PP due to eds,EC,
2,432,SIA/BR/MIN/31363/2015,SIA/1(a)/13/2015,L.B.F Bricks Udyog,YADUNANDAN CHAUHAN,Delisted,EC,
3,433,SIA/BR/MIN/66277/2017,,Sand Mining Project at Narodih Sand Ghat on Gajhi River.,WESTLINK TRADING PRIVATE LIMITED,Delisted,EC,
4,434,SIA/BR/MIN/135396/2020,,"Bagha Kusmar (Khasra No. 2392, 3081, 3080, 2535, 2387, 2381, 2391 , 2394, 2392 ) soil brick mining project",M/S GANESH INT UDYOG,Delisted,EC,
5,435,SIA/BR/MIN/60637/2016,SIA/1(a)/376/16,"Proposed Sand Mining Project of Area 23.0 Ha at Bhagwatpur Ghat on Son River of
District- Bhojpur of State- Bihar",BROADSON COMODITIES PVT LTD,EC Granted,EC,
6,436,SIA/BR/MIN/60669/2016,SIA/1(a)/395/16,Sand Mining Project at Digha & Kurji Ghat on river Ganga,BROADSON COMODITIES PVT LTD,EC Granted,EC,
7,437,SIA/BR/MIN/31421/2015,SIA/1(a)/16/2015,Soni Int Udyog,REYAJ AHMAD,Delisted,EC,
8,438,SIA/BR/MIN/31461/2015,SIA/1(a)/17/2015,India Int Udyog,RAVIN KUMAR RAI,Delisted,EC,
9,439,SIA/BR/MIN/66114/2017,SIA/1(a)/594/18,Sand Mining Project at Lakhanpur Sand Ghat on River kiul,WESTLINK TRADING PRIVATE LIMITED,Delisted,EC,
10,440,SIA/BR/MIN/138011/2020,,"ORDINARY CLAY MINING PROJECT FOR SAINITU CONSTRUCTION PVT. LTD. MAUZA PILKHI RAJGIR NALANDA AREA 11.52 Ac, 4.66 Ha",SAINITU CONSTRUCTION PVT. LTD. DIRECTOR KANHAIYA KUMAR,Delisted,EC,
1,441,SIA/BR/MIN/34204/2019,,Chilauni Sand Ghat on Chilauni Sirpur River,SUJEET KUMAR,Pending at PP due to eds,EC,
2,442,SIA/BR/MIN/51136/2020,,Final EIA report of Jamui Kiul 9 Balu ghat,M/S RAJIV KUMAR SINGH HUF,Delisted,EC,
3,443,SIA/BR/MIN/31448/2019,SIA/1(a)/640/19,"Sand Mining Project at Mehandaura Brahpur Ghat on Son river in district Bhojpur, Bihar",BROADSON COMODITIES PVT LTD,EC Granted,EC,
4,444,SIA/BR/MIN/143766/2020,,"Brick Earth Project at Mauza- Shivnagar, P.O- Shivnagar, P.S- Tikari, District- Gaya(Bihar)",M/S SARASWATI CONSTRUCTION,Delisted,EC,
5,445,SIA/BR/MIN/60657/2016,SIA/1(a)/386/16,Sand Mining Project at Chilhauns Ghat on River Son,BROADSON COMODITIES PVT LTD,EC Granted,EC,
6,446,SIA/BR/MIN/167210/2020,,BRICK EARTH MINING PROJECT FOR M/S CMD INT UDYOG MAUZA KARWA BALRAM KARPI SONBHADRA BANSHI SURYAPUR ARWAL AREA 3.15,M/S C M D INT UYDOG PROP DEVENDRA KUMAR,Delisted,EC,
7,447,SIA/BR/MIN/30350/2015,3491,Brick Clay Mining Project- Mamta Bricks,MAMTA BRICKS,Delisted,EC,
8,448,SIA/BR/MIN/133884/2019,,"Baghari M/S YOGI ETT UDYOG Earth Mining Projec, Thana No -43 Khata No.-173, Plot No.- 3751 & 3752,Area-0.93 Ha or (2.30 Ac) For production capacity 4335.66 TPA, Mauza- Baghari, P.S.- Sursand ,Circle -",M/S YOGI ETT UDYOG PROPONENT KIRAN DEVI,Delisted,EC,
9,449,SIA/BR/MIN/17978/2015,SIA/1(a)/411/17,Rajauli (Block 5) Building  Stone Mining Project,MS SAINIK FOODS,EC Granted,EC,
10,450,SIA/BR/MIN/136265/2020,,"BRICK EARTH MINING PROJECT FOR M/S A.S.C. BRICKS, MAUZA- GORGOION, KORHA, KATIHAR, AREA- 2.53 Ac, 1.02 Ha",M/S A.S.C. BRICKS PROP MD. UMAR HUSSAIN,Delisted,EC,
1,451,SIA/BR/MIN/33396/2019,,Proposed Sand Mining Project  of 4.9 ha at Siswan ghat on Ghaghra (Sarayu) River of  District-Siwan  of State-Bihar.,M S BALAJI ENTERPRISES,Pending at PP due to eds,EC,
2,452,SIA/BR/MIN/31595/2015,SIA/1(a)/36/2015,Brick Clay Mining Project of M/s Swastik-II Marka  Bricks,SANTOSH KUMAR SINGH,Delisted,EC,
3,453,SIA/BR/MIN/141567/2020,,"Bhelwa, P.S - Gharasahan (Khasra/Plot(s) No. 01) soil brick mining project.",M/S MAA INT. UDYOG,Delisted,EC,
4,454,SIA/BR/MIN/66094/2017,SIA/1(a)/558/18,Sand Mining Project at Garsanda Sand Ghat on Kiul River.,WESTLINK TRADING PRIVATE LIMITED,Delisted,EC,
5,455,SIA/BR/MIN/41878/2019,,Proposed Sand Mining Project of Area 5.0 Ha at Sapahiya Khas (Bishwambharpur) Ghat on Gandak River of District- Gopalganj of State-Bihar.,MR KAMAKHYA MISHRA,Pending at PP due to eds,EC,
6,456,SIA/BR/MIN/137502/2020,,M/S SHANKAR INT UDYOG,M/S SHANKAR INT  UDYOG,Delisted,EC,
7,457,SIA/BR/MIN/49347/2020,,,MS BALAJIENTERPRISES,Pending at PP due to eds,EC,
8,458,SIA/BR/MIN/30640/2015,3465,Brick Clay Mining- S D J Bricks,M/S S.D.J BRICKS,Delisted,EC,
9,459,SIA/BR/MIN/31030/2019,SIA/1(a)/610/19,Raksha Oraiya Sand Ghat (Stretch 8 Block 1) Mining Project,WESTLINK TRADING PRIVATE LIMITED,EC Granted,EC,
10,460,SIA/BR/MIN/38009/2019,,"Report of Brick Earth Mining Project of Area 2.22 Acres or 0.90 Hectare for M/s R.P.S Bricks at Mauza: Lodipur, Sherpur, P.O: Byapur, Sherpur, P.S: Maner, District: Patna, State: Bihar.",MS RPS BRICKS,Pending at PP due to eds,EC,
1,461,SIA/BR/MIN/138832/2020,,"Ordinary Clay bscpl Infrastructure ltd mauza boraj, hathauri, shivaji nagar, samastipur",BSCPL INFRASTRUCTURE LTD MAUZA BORAJ AREA 7.04 AC,Delisted,EC,
2,462,SIA/BR/MIN/35926/2019,,"Mauza- Arap, P.O- Arap, P.S + Block- Bikram, District- Patna, State- Bihar",HOME BRICKS COMPANY,Pending at PP due to eds,EC,
3,463,SIA/BR/MIN/144268/2020,,"Brick Earth Mining Project at Mauza- Pirojgarh, P.O- Tilath, P.S- Ghoghardiha, District- Madhubani (Bihar)",M/S- M.K.B INT UDYOG,Delisted,EC,
4,464,SIA/BR/MIN/130671/2019,,Proposed Brick Earth Mining Project,D.R.C BRICKS,Delisted,EC,
5,465,SIA/BR/MIN/136307/2020,,S.B.M BRICKS,S.B.M BRICKS,Delisted,EC,
6,466,SIA/BR/MIN/31520/2015,SIA/1(a)/24/2015,BRICK CLAY MINING PROJECT- SUN INT UDYOG,SUN INT UDYOG,Delisted,EC,
7,467,SIA/BR/MIN/51709/2020,,Balu Ghat Mining Project (Patna Son 3 Balu Ghat) at Riverbed Of Son River.,SRI BHIM PRASAD,Delisted,EC,
8,468,SIA/BR/MIN/133559/2019,,"Choukari (Khata No. 179, Khasra No. 743 ) soil brick mining project.",M/S K.R.S. BRICKS,Delisted,EC,
9,469,SIA/BR/MIN/134073/2019,,B.T.C INT UDYOG,B.T.C INT UDYOG,Delisted,EC,
10,470,SIA/BR/MIN/135863/2020,,"BRICK EARTH MINING PROJECT FOR M/S BHAWAN INT UDYOG, MAUZA- PABHERA, CIRCLE- DHANARUA, DISTRICT- PATNA, AREA- 2.66 Ac, 1.07 Ha",BHAWAN INT UDYOG PABHERA,Delisted,EC,
1,471,SIA/BR/MIN/60855/2016,SIA/1(a)/400/16,Sand Mining Project at Damriyahi Bakhtiyarpur Ghat on River Ganga,BROADSON COMODITIES PVT LTD,EC Granted,EC,
2,472,SIA/BR/MIN/60867/2016,SIA/1(a)/399/16,Sand Mining Project at Patila Ghat on River Son,BROADSON COMODITIES PVT LTD,EC Granted,EC,
3,473,SIA/BR/IND2/28619/2016,SIA/6(b)/435/17,"Addition of Ethanol/Biodiesel tankage at POL Depot of BPCL, Barauni",BPCL BARAUNI TOP,Delisted,EC,
4,474,SIA/BR/MIN/140893/2020,,"Brick Earth Mining Project at village-Andauli, P.o-Andauli, P.s-Saksohra, Dist-Patna",M/S ARCHANA INT UDYOG,Delisted,EC,
5,475,SIA/BR/IND2/19502/2017,,INDIAN OIL CORPORATION LTD,INDIAN OIL CORPORATION LIMITED PATNA,Delisted,EC,
6,476,SIA/BR/MIN/130616/2019,,"Brick Earth Mining Project at Village- Laro, P.O- Dema, P.S- Mohanpur, District- Gaya(Bihar).",M/S S.G.S INT UDYOG,Delisted,EC,
7,477,SIA/BR/MIN/130748/2019,,"Brick Earth Mining Project of Area 3.61 Acres or 1.46 Hectare for M/S Pankaj Int Udyog at Mauza/Vill- Bilari, P.O- Bilari, P.S + Block- Katarisarai, District- Nalanda, State- Bihar",M/S PANKAJ INT UDYOG,Delisted,EC,
8,478,SIA/BR/MIN/130784/2019,,"Proposed Brick Earth Mining Project of Area 3.89 Acres or 1.58 Hectare for M/s Maa Bricks at Vill- Alipur, P.O- Alipur, P.S- Sigori, Block- Paliganj, District- Patna, State - Bihar",M/S MAABRICKS,Delisted,EC,
9,479,SIA/BR/MIN/130953/2019,,"Bhanachak (Gata No. 598,600,601,602, 603,568,561,606,564) brick earth (soil) mining project.",M/S KUSHWAHA BRICKS INDUSTRIES,Delisted,EC,
