,Sno.,Proposal No.,File No.,Project Name,Company,Proposal Status,Project Type,View
759,760,SIA/KA/MIN/42933/2019,SEIAA 655 MIN 2019,“Building Stone (M-Sand) Quarry” of Sri. Manjunath .K.B.,SRI MANJUNATH K B,Delisted,EC,
760,761,SIA/KA/MIN/1829/2015,SEIAA 1081 MIN 2015,Building Stone Quarry,K S PUTTARAJU BUILDING STONE QUARRY,EC Granted,EC,
761,762,SIA/KA/MIN/1724/2015,SEIAA 1067 MIN 2015,Baragi Sand Block Quarry in Ghataprabha River,MEMBER SECRETARY DISTRICT SAND MONITORING COMMITTEE,EC Granted,EC,
762,763,SIA/KA/MIN/1685/2015,SEIAA 1050 MIN 2015,Shahbad Stone,RAVINDRA REDDY,EC Granted,EC,
763,764,SIA/KA/NCP/2051/2015,SEIAA 147 CON 2015,Nandi Housing Pvt Ltd,NANDI HOUSING PVT LTD,EC Granted,EC,
764,765,SIA/KA/NCP/2978/2015,SEIAA 159 CON 2015,"Proposed Residential Apartments project By M/s. MYHNA PROPERTIES PVT LTD #83, 1st Floor G.P.Plaza Outer Ring Road, Anand Nagar Near Kala Mandir,  Above Karnataka Bank, Marathahalli, Bangalore-560037",MYHNA PROPERTIES PVT LTD,EC Granted,EC,
765,766,SIA/KA/NCP/3533/2015,SEIAA 168 CON 2015,Building Construction project,ULTRATECH ENVIRONMENTAL CONSULTANCY AND LABORATORY,EC Granted,EC,
766,767,SIA/KA/NCP/3079/2015,SEIAA 160 CON 2015,REVANTA,MERUSHIKAR INFRA L L P,EC Granted,EC,
767,768,SIA/KA/MIN/89692/2018,SEIAA 78 MIN 2018,"“Building Stone Quarry” over an extent of 2-14 Acres at Sy No: 14(P), Pura Village, Sira Taluk, Tumkur",MS DRN INFRASTRUCTURE,EC Granted,EC,
768,769,SIA/KA/MIN/92697/2019,SEIAA 108 MIN 2019,"“Building Stone Quarry” of
M/s. Gautham Stone Crusher over an extent of 2-20 Acres under Sy No. 39, Kanivenarayanapura village, Chikkaballapura Taluk Chikkaballapura",GOUTHAM STONE  CLASTER,EC Granted,EC,
769,770,SIA/KA/NCP/51018/2016,SEIAA 40 CON 2016,Prestige Minsk Square,PRESTIGE ESTATES PROJECTS LTD,EC Granted,EC,
770,771,SIA/KA/IND2/171846/2020,SEIAA 61 IND 2020,BONDBAY PHARMACEUTICALS PRIVATE LIMITED,BONDBAY PHARMACEUTICALS PRIVATE LIMITED,Delisted,EC,
771,772,SIA/KA/NCP/17174/2016,SEIAA 142 CON 2016,"Development of Multi Level Car Parking  (MLCP)  for expansion of Intel’s SRR (Intel’s Sarjapur Ring Road) Campus at Deverabeesanahalli, Varthur, Hobli Block, Bangalore South Taluka, Bangalore Urban District, Karnataka",INTEL TECHNOLOGY INDIA PVT LTD,EC Granted,EC,
772,773,SIA/KA/NCP/74149/2018,,"Office (IT/ITES) Building at Sy No.71, Plot NO.l2,
2nd Phase, Doddanekkundi Indsutrial Area, Marathahalli Hobli, Bengaluru",MS  MARUTHI ELECTRODES PVT LTD,DELETE,EC,
773,774,SIA/KA/NCP/74152/2018,,"Office (IT/ITES) Building at Sy No.71, Plot NO.l2,
2nd Phase, Doddanekkundi Indsutrial Area, Marathahalli Hobli, Bengaluru",MS  MARUTHI ELECTRODES PVT LTD,DELETE,EC,
774,775,SIA/KA/MIN/194587/2021,SEIAA 846 MIN 2019,“Dolomite mineral” of M/s. Sri Sangameshwar Mines & Minerals,M/S. SRI   SANGAMESHWAR MINES & MINERALS,EC Granted - Processed offline,EC,
775,776,SIA/KA/MIN/199424/2021,SEIAA 97 MIN 2021,Pink Granite Quarry by Sri. Venketesh. V. Saka,PINK GRANITE QUARRY BY SRI. VENKETESH. V. SAKA,Delisted,EC,
776,777,SIA/KA/MIN/38299/2016,SEIAA 7 MIN 2016,"“Black Granite Quarry” over an extent of 1-04 Acres at Sy No. 223/6, Heradappanahalli village, Kankapura Taluk, Ramanagara District, Karnataka.",H C MINCHU,Rejection Letter Granted,EC,
777,778,SIA/KA/MIN/933/2015,SEIAA 919 MIN 2015,"“Green Granite Quarry” of Sri. Honne Gowda S/o Lanke Gowda, Sy. No: 243, Hongere Village, Shanthigrama Hobli, Hassan Taluk,",HONNE GOWDA,EC Granted,EC,
778,779,SIA/KA/MIN/1147/2015,SEIAA 976 MIN 2015,Channur Sand Quarry Block No 6 in Krishna River,MEMBER SECRETARY DISTRICT SAND MONITORING COMMITTE,EC Granted,EC,
779,780,SIA/KA/IND2/43280/2018,SEIAA 22 IND (VIOL) 2018,EXISTING AND PROPOSED EXPANSION OF BULK DRUGS & INTERMEDIATES PRODUCTS,SN II ASYMMETRIX PVT LTD,EC Granted - Processed offline,EC,
780,781,SIA/KA/MIN/36777/2015,SEIAA 1640 MIN 2015,"“Building Stone Quarry” over an extent of 1-20 Acres at Sy No. 36/8(P), Yalakanur Village, Somwarpet  Taluk , Kodagu District, Karnataka.",SHRI C N SATHISH,EC Granted,EC,
781,782,SIA/KA/MIN/2773/2015,SEIAA 1230 MIN 2015,"“Building Stone Quarry” of  P.S. Anthony Sy No: 06, Yeduru Village,  Mudigere Taluk,  Chikkamagaluru District,  Karnataka",P S ANTHONY,EC Granted,EC,
782,783,SIA/KA/MIN/2642/2015,SEIAA 1221 MIN 2015,BUILDING STONE QUARRY QLA-46,SUJAYKUMAR,EC Granted,EC,
783,784,SIA/KA/MIN/598/2015,SEIAA 895 MIN 2015,Building stone of Yantrodharaka,YANTRODHARAKA,EC Granted,EC,
784,785,SIA/KA/MIN/796/2015,SEIAA 910 MIN 2015,“Building Stone Quarry” of  S.K.Raju,S K RAJU,EC Granted,EC,
785,786,SIA/KA/MIN/682/2015,SEIAA 918 MIN 2015,Building Stone Quarry,MAHAMMODGOUS KHAJI,EC Granted,EC,
786,787,SIA/KA/MIN/1251/2015,SEIAA 983 MIN 2015,"“Building Stone Quarry” of  Sri. Naresh S Nayak at Sy No: 99/9,  Yematti Village, Khalghatgi Taluk, Dharwad District, Karnataka.",NARESH S NAYAK,EC Granted,EC,
787,788,SIA/KA/NCP/38010/2016,SEIAA 1 CON 2016,"proposed residential apartment project by Majestic Property Developers Pvt Ltd at Khatha No 421, Sy No 26/27, Chunchaghatta Village, Uttarahalli Hobli, Bengaluru.",MAJESTIC PROPOERTY DEVELOPERS,EC Granted,EC,
788,789,SIA/KA/MIN/43327/2019,SEIAA 687 MIN 2019,“Ornamental Granite Quarry” of Sri. Dasa,SRI.    DASA,Delisted,EC,
789,790,SIA/KA/MIN/43844/2019,SEIAA 705 MIN 2019,Shahabad Stone(Cherty Lime Stone) Quarry,SRI. ANAND,EC Granted - Processed offline,EC,
790,791,SIA/KA/MIS/202890/2021,SEIAA 29 CON 2021,PROPOSED CONSTRUCTION OF NEW 350 BEDDED SJICS&R HOSPITAL COMPLEX,SRI JAYADEVA INSTITUTE OF CARDIOVASCULAR SCIENCES AND RESEARCH,EC Granted - Processed offline,EC,
791,792,SIA/KA/MIN/239485/2021,SEIAA 632 MIN 2021,Laterite Stone Quarry,SRI. NITHYANANDA,EC Granted,EC,
792,793,SIA/KA/MIS/145739/2020,SEIAA 35 CON 2020,Proposed Residential Apartment,SOBHA LIMITED,WithdrawEC,EC,
793,794,SIA/KA/MIN/43055/2019,SEIAA 663 MIN 2019,Building Stone (Basalt) Quarry of Sri. Riyaz Ahmed,SRI RIYAZ AHMED,EC Granted - Processed offline,EC,
794,795,SIA/KA/MIN/43132/2019,SEIAA 681 MIN 2019,“Ornamental Granite Quarry” of M/s. Four Season Rocks Inc,M/S. FOUR SEASON ROCKS INC,EC Granted - Processed offline,EC,
795,796,SIA/KA/NCP/57461/2016,SEIAA 109 CON 2016,Shriram Santorini,SHRIPROP BUILDERS PVT LTD,EC Granted,EC,
796,797,SIA/KA/IND2/2375/2015,,-1,SYNGENE INTERNATIONAL PRIVATE LIMITED,EC Granted,EC,
797,798,SIA/KA/MIS/56230/2019,SEIAA 130 CON 2019,HUMAN SPACE FLIGHT CENTRE,ISRO HUMAN SPACE FLIGHT CENTRE,EC Granted - Processed offline,EC,
798,799,SIA/KA/MIN/171483/2020,SEIAA 336 MIN 2020,ALUR BUILDING STONE QUARRY,SRI DEVENDRA NAIK S/O SAKRA NAIK,EC Granted - Processed offline,EC,
799,800,SIA/KA/IND2/17607/2016,SEIAA 47 IND 2016,-1,SAI LIFESCIENCES LTD,EC Granted,EC,
800,801,SIA/KA/MIS/63268/2017,SEIAA 53 CON 2017,TAJGVK Yelahanka Hotel,TAJGVK HOTELS & RESORTS LTD,Rejection Letter Granted,EC,
801,802,SIA/KA/NCP/4922/2015,SEIAA 197 CON 2015,Sattallite Commercial Complex”,MANSUN BUILDERS AND DEVELOPERS,EC Granted,EC,
802,803,SIA/KA/MIN/226326/2021,SEIAA 444 MIN 2021,Sirasagi Sand Block,THE HUTTI GOLD MINES COMPANY LIMITED,WithdrawEC,EC,
803,804,SIA/KA/IND2/199324/2021,SEIAA 10 IND 2021,M/s Valli Chemicals,M/S VALLI CHEMICALS,EC Granted - Processed offline,EC,
804,805,SIA/KA/MIN/254655/2022,SEIAA 39 MIN 2022,“Building Stone Quarry” of  Sri. Prasanna Shetty,SRI. PRASANNA SHETTY,ADS by SEAC,EC,
805,806,SIA/KA/NCP/60776/2016,SEIAA 187 CON 2016,"Proposed Residential Apartment project at Sy. No: 58/1, 59/4 & 60, Chikkanayakanahalli Village, Varthur Hobli, Bangalore East Taluk.",M/S. AHAD BUILDERS PRIVATE LTD,EC Granted,EC,
806,807,SIA/KA/MIS/123651/2019,SEIAA 146 CON 2019,Proposed IT Office Building,M/S. JAGANMAYI INFRA SOLUTIONS PRIVATE LIMITED.,EC Granted - Processed offline,EC,
807,808,SIA/KA/MIN/1457/2015,SEIAA 1029 MIN 2015,Building Stone Quarry,SRI MAARIKAMBA KATTADA KALLU GANI GUTTIGEDARARA SANGHA,EC Granted,EC,
808,809,SIA/KA/MIN/1318/2015,SEIAA 1031 MIN 2015,Building Stone Quarry,ASHOK BHANDARY,EC Granted,EC,
809,810,SIA/KA/NCP/73587/2018,SEIAA 54 CON 2018,DEVELOPMENT OF RESIDENTIAL APARTMENT BY SRI R RAJASEKHAR REDDY,DEVELOPMENT OF RESIDENTIAL APARTMENT BY  SRI R RAJASEKHAR REDDY,EC Granted,EC,
810,811,SIA/KA/MIN/126781/2019,SEIAA 793 MIN 2019,M/s Sri Varu Stone Crushers,M/S SRI VARU STONE CRUSHER,EC Granted,EC,
811,812,SIA/KA/MIN/159538/2020,SEIAA 200 MIN 2020,“Ornamental Stone (Pink Granite) Quarry” of Sri. Surendra Gowda Patil,"""ORNAMENTAL STONE (PINK GRANITE) QUARRY"" OF SRI SURENDRA GOWDA PATIL.",EC Granted - Processed offline,EC,
812,813,SIA/KA/MIS/139641/2020,SEIAA 16 CON 2020,M/s. Sai Kalyan Builders and Developers Pvt. Ltd,M/S. SAI KALYAN BUILDERS AND DEVELOPERS PVT. LTD,EC Granted - Processed offline,EC,
813,814,SIA/KA/IND2/37939/2018,SEIAA 48 IND 2018,Sreevari Natural & Dairy Products,SREEVARI NATURAL AND DAIRY PRODUCTS,EC Granted - Processed offline,EC,
814,815,SIA/KA/NCP/30898/2017,,"Embassy Tech Village M/s Vikas Telecom Pvt Ltd (Star Hotels and Office Blocks),  EMBASSY PROPERTY DEVELOPMENTS PVT LTD",EMBASSY PROPERTY DEVELOPMENTS PVT LTD,EC Granted,EC,
815,816,SIA/KA/MIN/95058/2019,,"“Building Stone Quarry” over an extent of 11-13 acres at Sy No. 214/2 & 214/3, Shirahatti Village, Shirahatti Taluk, Gadag",MS SHIVAGANGA STONE CRUSHING AND M SAND INDUSTRIES,Delisted,EC,
816,817,SIA/KA/NCP/57417/2016,SEIAA 105 CON 2016,Providing basic facilities in Chamundi Hill,PUBLIC WORKS DEPARTMENT,EC Granted,EC,
817,818,SIA/KA/NCP/57419/2016,SEIAA 107 CON 2016,Development of Residential Apartment building,DHRUVABERA DEVELOPERS PVT LTD,EC Granted,EC,
818,819,SIA/KA/MIS/115877/2019,SEIAA 121 CON 2019,"Proposed ""Godrej Bhatia"" Residential Apartment Building (1349 Flats)",GODREJ PROJECTS NORTH STAR LLP,SEIAA Meeting Cancelled have to be considered for next Agenda,EC,
819,820,SIA/KA/NCP/50990/2016,SEIAA 42 CON 2016,"Residential apartment at Sy. No.
15/1J5/2,16,17,18/1,18/2,18/3,18/4,18/5,19 /t19 /2,19/3,20,
21/t21/2,22/t22/2,22/3,22/4,27 /1,27/2,28/1,28/2,28/3,28/4,
29/2,29/3 of Avadadenahalli Village, Kasaba Hobalt Anekal Taluk.
Bangalore Rural district",MR ARAVIND GOWDA AND OTHERS,Rejection Letter Granted,EC,
820,821,SIA/KA/MIN/41352/2016,SEIAA 70 MIN 2016,"Building Stone quarry in an extent of 1.00 Acre of Govt. Land bearing Sy. No. 112/1P1, Thannirupanth Village, Belthangadi Taluk in Dakshina Kannada District",SUNITHA,TransferToDEIAA,EC,
821,822,SIA/KA/MIN/2728/2015,SEIAA 1254 MIN 2015,YELLODU GRANITE QUARRY QL.NO.453,OTHERS,EC Granted,EC,
822,823,SIA/KA/MIN/1140/2015,SEIAA 966 MIN 2015,Building Stone Quarry,CHANDRASHEKAR T,EC Granted,EC,
823,824,SIA/KA/MIN/512/2015,SEIAA 885 MIN 2015,Black Granite Quarry,GURUSWAMAPPA,EC Granted,EC,
824,825,SIA/KA/MIN/1090/2015,SEIAA 962 MIN 2015,Building Stone Quarry,GANESH ANNAGOUNI,EC Granted,EC,
825,826,SIA/KA/MIN/2293/2015,SEIAA 1162 MIN 2015,Buiding Stone Quarry (QL No.2579),KBS STONE SUPPLIERS,EC Granted,EC,
826,827,SIA/KA/MIN/2259/2015,SEIAA 1147 MIN 2015,Building Stone Quarry,ULTRATECH ENVIRONMENTAL CONSULTANCY AND LABORATORY,EC Granted,EC,
827,828,SIA/KA/MIN/2122/2015,SEIAA 1134 MIN 2015,Building Stone Quarry”  M/s G K S Stone Crusher,BUILDING STONE QUARRY OF G K S STONE CRUSHER,EC Granted,EC,
828,829,SIA/KA/MIN/2105/2015,SEIAA 1138 MIN 2015,"“Building Stone Quarry” of  M/s. Jenukal Industries at  Sy No: 75,  Murundi Village, Arasikere Taluk, Hassan District, Karnataka 4-00 Acres",G B SIDDESH,EC Granted,EC,
829,830,SIA/KA/NCP/38043/2016,SEIAA 3 CON 2016,"proposed residential apartment project by Smt. H Shailaja at Sy. No. 186/4, Kaggadasapura Village, Varthur Hobli, Bangalore East Taluk, Bengaluru Urban District.",SMT H SHAILAJA,EC Granted,EC,
830,831,SIA/KA/MIN/72455/2018,SEIAA 02 MIN 2018,"“Chick Hanchinala – 2 Block – 2   River Sand Quarry” Adjacent to Sy. No. 19, 20, 21, 22, 23, 25, 26, 27, 28, 29, 30, 31, 32, 33, 34 & 35 in Krishna River bed at Chick Hanchinala Village over an extent of 30-00 Acres (12.14 Ha), Chick Hanchinala Villa",SHIVANAND DANDANNAVAR,EC Granted,EC,
831,832,SIA/KA/MIN/63996/2017,SEIAA 31 MIN 2017,"“Building Stone Quarry” over an extent of 16-00 Acres at Sy No: 59, Hosahalli Village, Tumkur Taluk, Tumkur District, Karnataka",M/S. AKSHAYA M-SAND &  STONE CRUSHERS,EC Granted,EC,
832,833,SIA/KA/IND2/18069/2016,,New Aroma and Speciality Chemical manufacturing facility,ANTHEA AROMATICS PVT LTD,Under examination of SEIAA after SEAC,EC,
833,834,SIA/KA/MIN/89692/2018,SEIAA 78 MIN 2018,"“Building Stone Quarry” over an extent of 2-14 Acres at Sy No: 14(P), Pura Village, Sira Taluk, Tumkur",MS DRN INFRASTRUCTURE,EC Granted,EC,
834,835,SIA/KA/MIS/157002/2020,SEIAA 84 CON 2020,Residential Apartment project,M/S. ABHIGNA CONSTRUCTIONS,EC Granted - Processed offline,EC,
835,836,SIA/KA/MIN/188399/2020,SEIAA 442 MIN 2020,Grey Granite Quarry of Sri. Sathyanarayana Kalal (5.75Ac),GREY GRANITE QUARRY OF SRI. SATHYANARAYANA KALAL(5.75AC),EC Granted - Processed offline,EC,
836,837,SIA/KA/MIN/161774/2020,SEIAA 251 MIN 2020,Building Stone Quarry,SRI. P.B. KARIGOWDA,EC Granted - Processed offline,EC,
837,838,SIA/KA/MIN/130303/2019,SEIAA 824 MIN 2019,YARAGANVI BUILDING STONE( M SAND) QUARRY,M/S R V MINERALS SRI R V PRATHAP              REDDY S/O R V BALA ANJINEYA REDDY,EC Granted - Processed offline,EC,
838,839,SIA/KA/MIN/43005/2018,SEIAA 675 MIN 2019,Building Stone Quarry,SRI. V. SHIVAKUMAR,EC Granted - Processed offline,EC,
839,840,SIA/KA/MIN/43108/2019,SEIAA 679 MIN 2019,“Ornamental Granite Quarry” of Sri. Syed Yusuf,SRI. SYED  YUSUF,EC Granted - Processed offline,EC,
840,841,SIA/KA/MIN/32954/2015,,"“Building Stone Quarry” of Sri. Shivappa at Sy.No.192, Madahalli Village, Gundlupete Taluk, 
Chamarajanagara District, 
Karnataka. QL area: 3-00 Acres",SHIVAPPA,Delisted,EC,
841,842,SIA/KA/MIN/2874/2015,SEIAA 1239 MIN 2015,"“Shahabad Stone Quarry” of  Sri. Konda Nageshwar Rao Sy No: 98, Miryan Village, Chincholi Taluk, Gulbarga District, Karnataka",KONDA NAGESHWAR RAO,EC Granted,EC,
842,843,SIA/KA/MIN/2911/2015,SEIAA 1249 MIN 2015,"“Building Stone Quarry” of   Sri.Rangaswamy S/o Jawaregowda Sy No: 83,  Yareborekaval Village, Hassan Taluk, Hassan District, Karnataka",RANGASWAMY,EC Granted,EC,
843,844,SIA/KA/MIN/2753/2015,SEIAA 1125 MIN 2015,Harapanahalli Building Stone Quarry,SMT UMME HAMMEDA,EC Granted,EC,
844,845,SIA/KA/MIN/2744/2015,SEIAA 1214 MIN 2015,Ucchangidurga Building Stone Quarry,MARULASIDDESHWARA STONE CRUSHER,EC Granted,EC,
845,846,SIA/KA/MIN/2740/2015,SEIAA 1225 MIN 2015,"“Shahabad Stone Quarry” of  Sri. Lachamayya at Kontanapalli Village, Sedam Taluk, Kalburgi District,",SRI LACHAMAYYA,EC Granted,EC,
846,847,SIA/KA/MIN/2272/2015,SEIAA 1150 MIN 2015,River Sand Mining,DISTRICT SAND MONITORING COMMITTEE BELGAUM,EC Granted,EC,
847,848,SIA/KA/MIN/2270/2015,SEIAA 1156 MIN 2015,River Sand Mining,DISTRICT SAND MONITORING COMMITTEE BELGAUM,EC Granted,EC,
848,849,SIA/KA/MIN/2020/2015,SEIAA 1126 MIN 2015,Building stone Quarry (QL No 289),N SUBBARAO,EC Granted,EC,
849,850,SIA/KA/IND2/22468/2016,SEIAA 03 IND 2016,"M/s. Somu Chemicals and Pharmaceuticals Pvt Ltd.,",SOMU CHEMICALS AND PHARMACEUTICALS PVT LTD,EC Granted,EC,
850,851,SIA/KA/NCP/70624/2017,SEIAA 119 CON 2017,Durga Petals,DURGA PROJECTS AND INFRASTRUCTURE PVT LIMITED,EC Granted,EC,
851,852,SIA/KA/MIS/115757/2019,,M/s. 2getherments Pvt. Ltd,M/S. 2GETHERMENTS INFRA PVT LTD,Delisted,EC,
852,853,SIA/KA/MIN/33706/2015,SEIAA 1525 MIN 2015,"“Building Stone Quarry” over an extent of 16-20 Acres at Sy No: 81, Chikkanahalli Village, Bengaluru South Taluk, Bengaluru Urban District, Karnataka.",SHUBBA LAKSHMI STONES,EC Granted,EC,
853,854,SIA/KA/MIN/171293/2020,SEIAA 333 MIN 2020,ALUR BUILDING STONE QUARRY,NANJU S/O NANJUNDAPPA,EC Granted - Processed offline,EC,
854,855,SIA/KA/MIN/1829/2015,SEIAA 1081 MIN 2015,Building Stone Quarry,K S PUTTARAJU BUILDING STONE QUARRY,EC Granted,EC,
855,856,SIA/KA/MIN/1724/2015,SEIAA 1067 MIN 2015,Baragi Sand Block Quarry in Ghataprabha River,MEMBER SECRETARY DISTRICT SAND MONITORING COMMITTEE,EC Granted,EC,
856,857,SIA/KA/MIN/1685/2015,SEIAA 1050 MIN 2015,Shahbad Stone,RAVINDRA REDDY,EC Granted,EC,
857,858,SIA/KA/NCP/2051/2015,SEIAA 147 CON 2015,Nandi Housing Pvt Ltd,NANDI HOUSING PVT LTD,EC Granted,EC,
858,859,SIA/KA/NCP/2978/2015,SEIAA 159 CON 2015,"Proposed Residential Apartments project By M/s. MYHNA PROPERTIES PVT LTD #83, 1st Floor G.P.Plaza Outer Ring Road, Anand Nagar Near Kala Mandir,  Above Karnataka Bank, Marathahalli, Bangalore-560037",MYHNA PROPERTIES PVT LTD,EC Granted,EC,
859,860,SIA/KA/NCP/3533/2015,SEIAA 168 CON 2015,Building Construction project,ULTRATECH ENVIRONMENTAL CONSULTANCY AND LABORATORY,EC Granted,EC,
860,861,SIA/KA/MIN/4040/2015,SEIAA 1415 MIN 2015,"“Building Stone Quarry” of  Sri. Ravindra Appasab Mali Sy No: 6/B/3,  Jainapur Village, Chikkodi Taluk, Belagavi District, Karnataka (1-20Acres )",RAVINDRA APPASAB MALI,EC Granted,EC,
861,862,SIA/KA/NCP/58534/2016,SEIAA 130 CON 2016,Residential Apartment Project,DIVYASREE INFRASTRUCTURE PROJECTS PRIVATE LIMITED,EC Granted,EC,
862,863,SIA/KA/MIN/3629/2015,SEIAA 1341 MIN 2015,"“Building Stone Quarry” of  Sri M. Veeresh Survey No: 110 Thylagere Village,  Devanahally Taluk And Bangalore Rural District,  Karnataka State",M VEERESH,EC Granted,EC,
863,864,SIA/KA/MIN/3427/2015,SEIAA 1297 MIN 2015,Sand Removal from Sand Bar (SB-SH-17) in Sharavathi River,DISTRICT SAND MONITORING COMMITTEE,EC Granted,EC,
864,865,SIA/KA/NCP/85948/2018,SEIAA 166 CON 2018,BOLLINENI ELANZA,BEEKAY DREAMLANDS PVT LTD,EC Granted,EC,
865,866,SIA/KA/MIN/41995/2016,,Balkundi pink granite quarry,VICTOR TECH SOLUTIONS,Delisted,EC,
866,867,SIA/KA/MIN/74109/2018,,"Environmental Clearance for Building Stone/M-Sand Quarry in 18-00 Acres amalgamated area of Govt Land bearing Sy. No. 138/P4, Sathenahalli Village, Nagamangala Taluk, Mandya District, Karnataka.",SRI. K. PUTTEGOWDA,Delisted,EC,
867,868,SIA/KA/MIN/35003/2015,SEIAA 1599 MIN 2015,"""Multicolor Granite Quarry"" of M/s Sri Matha Granites Sy No: 636 (Part), Kanakapura Village, Kanakapura Taluk, Ramanagara District, Karnataka QL area:1-00 Acres",SRI MATHA GRANITES,EC Granted,EC,
868,869,SIA/KA/MIN/217492/2021,SEIAA 302 MIN 2021,Building Stone Quarry,SRI  SURESH SHETTY,EC Granted,EC,
869,870,SIA/KA/MIN/230469/2021,SEIAA 511 MIN 2021,“Nagarahalli Sand Mining Block No – 1” of Sri. Hemagirish G Havinal,SRI.  HEMAGIRISH G HAVINAL,Delisted,EC,
870,871,SIA/KA/MIN/185152/2020,SEIAA 351 MN 2020,“Ordinary Sand Quarry” of  Sri. Rangangouda P Goudar,SRI. RANGANGOUDA P GOUDAR,EC Granted - Processed offline,EC,
871,872,SIA/KA/MIN/1988/2015,SEIAA 1113 MIN 2015,“  KOTAGERE - BLOCK NO. 1 - River Sand Quarry” In  Lakshmana Thirtha River at   Kotagere  village,DISTRICT SAND MONITORING COMMITTEE  KODAGU,EC Granted,EC,
872,873,SIA/KA/MIN/1107/2015,SEIAA 1004 MIN 2015,BUILDINGSTONEQUARRY,AMAN,EC Granted,EC,
873,874,SIA/KA/MIN/1116/2015,SEIAA 1000 MIN 2015,"“Building Stone Quarry” of  Ramesh Basappa Channavar at  Sy No: 99/2K/1,  Karoshi Village, Chikkodi Taluk, Belgaum District, Karnataka",RAMESH BASAPPA CHANNAVAR,EC Granted,EC,
874,875,SIA/KA/MIN/1507/2015,SEIAA 1028 MIN 2015,Building Stone Quarry,AVINASH,EC Granted,EC,
875,876,SIA/KA/MIN/42822/2019,,Ornamental Granite Quarry,M/S DEVI KAMAKSHI GRANITES & STONES,Delisted,EC,
876,877,SIA/KA/IND2/29952/2018,SEIAA 47 IND 2018,M/s. Larson Pharma Pvt. Ltd.,M/S. LARSON PHARMA PRIVATE LIMITED,EC Granted - Processed offline,EC,
877,878,SIA/KA/NCP/56406/2016,SEIAA 96 CON 2016,"Residential apartment at Sy. No: 42/1,  Basapura Village, Begur Hobali, Bangalore South Taluk, Bangalore.",MS REDDY STRUCTUES PVT LTD,EC Granted,EC,
878,879,SIA/KA/RIV/2311/2015,SEIAA 1176 MIN 2015,Karkihalli,SIKANDAR BASHA,EC Granted,EC,
879,880,SIA/KA/MIN/1993/2015,SEIAA 1118 MIN 2015,"“Shahabad Stone Quarry” of  Sri.Syed Riyaz S/o Syed Shahabuddin at  Sy No: 91/2,  Shirolli Village, Chincholi Taluk, Kalaburagi District, Karnataka.",SYED RIYAZ,EC Granted,EC,
880,881,SIA/KA/MIS/177540/2020,SEIAA 131 CON 2020,SRI LAKSHMINARAYANASWAMY CHARITIES,SLN CHARITIES,EC Granted - Processed offline,EC,
881,882,SIA/KA/MIN/32911/2019,SEIAA 208 MIN 2019,Building Stone Quarry,M/S ANJANEYA QUARRY WORKS,EC Granted,EC,
882,883,SIA/KA/MIN/35272/2019,SEIAA 369 MIN 2019,“Building Stone Quarry” of Sri. R Naveen Kumar,SRI. R NAVEEN KUMAR,EC Granted,EC,
883,884,SIA/KA/MIN/32077/2019,SEIAA 173 MIN 2019,“Building Stone Quarry” of  Sri. Shivanand S Ullagaddi,SRI SHIVANAND S ULLAGADDI,EC Granted,EC,
884,885,SIA/KA/NCP/53769/2016,,Akshay Sky mall,AKSHAY MALL,Delisted,EC,
885,886,SIA/KA/MIN/136428/2020,SEIAA 34 MIN 2020,“Building Stone Quarry” of M/s. Sri Swamy Ayyappa Stone Crushers,M/S. SRI SWAMY  AYYAPPA STONE CRUSHERS,EC Granted - Processed offline,EC,
886,887,SIA/KA/MIN/136709/2020,SEIAA 42 MIN 2020,Building Stone Quarry,RAMANAGOUDA L GOUDAR,EC Granted - Processed offline,EC,
887,888,SIA/KA/MIN/167270/2020,SEIAA 294 MIN 2020,BHANDARAGALI GREY GRANITE OF ALTAF HUSAINSAB SHAIKH,BHANDARAGALI GREY GRANITE QUARRY OF ALTAF HUSAINSAB,EC Granted - Processed offline,EC,
888,889,SIA/KA/MIN/167631/2020,SEIAA 296 MIN 2020,Pink Granite Quarry by Ajitkumara S Bora,PINK GRANITE QUARRY BY SRI. AJITKUMAR S BORA,EC Granted - Processed offline,EC,
889,890,SIA/KA/MIS/167654/2020,SEIAA 120 CON 2020,M/s. NVT Quality Lifestyle LLP,M/S. NVT QUALITY LIFESTYLE ESTATE LLP,EC Granted - Processed offline,EC,
890,891,SIA/KA/MIN/36635/2019,SEIAA 416 MIN 2019,"Environmental Clearance for Ordinary River Sand Block No.06 in Varaahi River Bed, 5.70 Acres (2.3067 Ha) Adj. Sy. No. 56 & 174 of Halnadu & Japthi village, Kundapura Taluk, Udupi District, Karnataka.",SRI. H.K. DEVANANDA SHETTY,EC Granted,EC,
891,892,SIA/KA/MIN/32058/2019,SEIAA 175 MIN 2019,“Building Stone Quarry” of Sri. Shankaragouda H Patil,SRI SHANKARGOUDA H PATIL,EC Granted,EC,
892,893,SIA/KA/IND2/167317/2020,SEIAA 56 IND 2020,Bulk Drugs and Intermediates manufacturing,SREEVEN PHARMA PVT LTD,ADS by SEIAA,EC,
893,894,SIA/KA/MIS/167623/2020,SEIAA 38 CON 2021,M/s. Chalet Hotels Limited Modification of Project for Mixed Use Development (Commercial and Residential),M/S. CHALET HOTELS LIMITED,EC Granted,EC,
894,895,SIA/KA/NCP/57890/2016,SEIAA 118 CON 2016,"“Hara Vijaya Heights” at Sy. No. 7/14 (New No. 48), Katha No. 84, Uttarahalli Manavarthe Kaval Village, Uttarahalli Hobli, Bangalore South Taluk, Bangalore",HARA VIJAYA ENTERPRISES,EC Granted,EC,
895,896,SIA/KA/NCP/83158/2018,SEIAA 153 CON 2018,Residential Apartment with Commercial Space and Club House,ALLAM INFINITE INDIA PVT LTD,EC Granted,EC,
896,897,SIA/KA/MIN/3062/2015,SEIAA 1265 MIN 2015,Multi Color Granite,N H SHIVASIDDEGOWDA,EC Granted,EC,
897,898,SIA/KA/NCP/73544/2018,SEIAA 58 CON 2018,MYTHREYI PROMOTERS & DEVELOPERS (P) LTD,MAHESHDEV,EC Granted,EC,
898,899,SIA/KA/MIN/94330/2019,SEIAA 145 MIN 2019,"Environmental Clearance for Building Stone Quarry in 1-20 Acres of Govt. Land bearing Sy. No. 14 Ajjappanahalli Village, Tumkur Taluk & District, Karnataka. (Operating QL. No. 674)",SRI. A. R. DASHARATH,Delisted,EC,
899,900,SIA/KA/MIN/226947/2021,SEIAA 456 MIN 2021,Ordinary Sand Quarry,SRI. SYED IQBAL ALI,EC Granted,EC,
900,901,SIA/KA/MIN/4014/2015,SEIAA 1410 MIN 2015,"“Building Stone Quarry” of  Sri Shivappa Shivappa Madihalli Sy No: 63/2(P),  Bilkundi Village, Gokak Taluk, Belgaum District, Karnataka.",SHIVAPPA SHIVAPPA MADIHALLI,EC Granted,EC,
901,902,SIA/KA/MIN/3873/2015,SEIAA 1384 MIN 2015,"“Sand Quarry” in Hemavathi River Haradur Block 1 adjacent to Sy. No. 87,89,90,91 & 95 - Block no. 1 of Haradur village of Hemavathi River, Arakalagud Taluk, Hassan District, Karnataka.",DISTRICT SAND COMMITTEE HASSAN,EC Granted,EC,
902,903,SIA/KA/MIN/3637/2015,SEIAA 1363 MIN 2015,"“Building Stone Quarry” of  M/s. Bhagya Minerals Sy No: 61(P),  Koluru Village, Bengaluru South Taluk, Bengaluru Urban District, Karnataka.",BHAGYA MINERALS,EC Granted,EC,
903,904,SIA/KA/MIN/3406/2015,SEIAA 1309 MIN 2015,Sand Removal from Sand Bar (SB-AG-08) in Aghanashini River,DISTRICT SAND MONITORING COMMITTEE,EC Granted,EC,
904,905,SIA/KA/MIN/3221/2015,SEIAA 1281 MIN 2015,Building Stone Quarry (QL No.1337),S P SUNDAR RAJU,EC Granted,EC,
905,906,SIA/KA/MIN/224495/2021,SEIAA 363 MIN 2021,"Murrum, Pink Grey Granite quarry",PINK GRANITE QUARRY BY SRI.SIDDAPPA NAGAPPA AVIN,EC Granted,EC,
906,907,SIA/KA/MIN/167859/2020,SEIAA 300 MIN 2020,“Ordinary Sand Quarry” of Sri. Shivanagouda T Patil,SRI. SHIVANAGOUDA T PATIL,EC Granted - Processed offline,EC,
907,908,SIA/KA/MIN/48518/2016,,"“Sand Quarry” at Haravi Cluster 1 in Tungabhadra River bed over an extent of 49.41 Acre, Hadagali Taluk, Bellary District, Karnataka.",DISTRICT SAND MONITORING COMMITTEE BELLARY,Delisted,EC,
908,909,SIA/KA/MIN/169961/2020,SEIAA 322 MIN 2020,“Pink Granite Quarry” of  Sri. Venkatesh V Saka,SRI. VENKATESH  V SAKA,EC Granted - Processed offline,EC,
909,910,SIA/KA/MIN/195245/2021,SEIAA 53 MIN 2021,Building Stone Quarry,SRI. DEEPAK,EC Granted - Processed offline,EC,
910,911,SIA/KA/MIN/1129/2015,SEIAA 972 MN 2015,Channur Sand Quarry Block No 2 in Krishna River,MEMBER SECRETARY DISTRICT SAND MONITORING COMMITTE,EC Granted,EC,
911,912,SIA/KA/MIN/2539/2015,SEIAA 1189 MIN 2015,Chinnakempanahlli Building Stone Quarry,ANJINAPPA S,EC Granted,EC,
912,913,SIA/KA/MIN/755/2015,SEIAA 900 MIN 2015,“Building Stone Quarry” of  Smt. Swarnalatha J Shetty,SMT. SWARNALATHA J SHETTY,EC Granted,EC,
913,914,SIA/KA/MIN/2280/2015,SEIAA 1158 MIN 2015,River Sand Mining,DISTRICT SAND MONITORING COMMITTEE BELGAUM,EC Granted,EC,
914,915,SIA/KA/NCP/3727/2015,SEIAA 177 CON 2015,"Proposed  Residential Apartments  project By M/s. GOYAL HARIYANA REALTY  #206, Barton Centre #84,M.G.Road, Bangalore.",MS GOYAL HARIYAN REALITY,EC Granted,EC,
915,916,SIA/KA/MIN/56786/2016,SEIAA 176 MIN 2016,"Building Stone Quarry in an extent of 11Acres 20Guntas of Govt. Gomala Land, in Aralalusandra Village, Kanakapura Taluk, Ramanagara Dist. KARNATAKA",SHILPA EXPORTS,EC Granted,EC,
