,Sno.,Proposal No.,File No.,Project Name,Company,Proposal Status,Project Type,View
7,938,SIA/BR/MIN/146134/2020,,ORDINARY CLAY MINING PROJECT FOR BSCPL INFRASTRUCTURE LTD MAUZA DAHAWA KHAIRI KHUTAHA,BSCPL INFRASTRUCTURE LTD MAUZA DAHAWA KHAIRI KHUTHA AREA 12.33 AC,Delisted,EC,
8,939,SIA/BR/MIN/136306/2020,,"Proposed Brick Earth Mining Project of Area 1.30 Hectare Or 3.2 Acre M/S F. B. I Bricks at Mauza- Bhanachak, Bakharia, P.S: Majhulia, Block- Majhaulia, District- West Champaran, State – Bihar",M/S F. B. I. BRICKS,Delisted,EC,
9,940,SIA/BR/MIS/61227/2016,SIA/8(a)/417/17,"Proposed Madhubani Medical College at Madhubani, Bihar by Dr. Fayaz Ahmad, President, Milli Trust, Madhubani","DR. FAYAZ AHMAD, PRESIDENT, MILLI TRUST, MADHUBANI",EC Granted,EC,
0,941,SIA/BR/MIS/282267/2022,SIA/8(a)/2042/2022,Revision  and   Expansion of Warehouse Project,M/S ALCASO INFRASPACE PVT LTD,EC Granted,EC,
1,942,SIA/BR/MIN/66029/2017,SIA/1(a)/548/18,Sand Mining Project at Garhi Bishunpur (Block no-2) Ghat on Kiul River.,WESTLINK TRADING PRIVATE LIMITED,Delisted,EC,
2,943,SIA/BR/IND2/48586/2006,"SIA/5(g)/981/2020
SIA/5(j)/981/2020",Magadh Sugar and Energy Ltd (Unit New Swadeshi Sugar Mills),MAGADH SUGAR AND ENERGY LTD,EC Granted,EC,
3,944,SIA/BR/MIN/132104/2019,,"Proposed Brick Earth Mining Project of Area 3.00 Acres or 1.21 Hectare for M/S RADHA BRICKS at Mauza- Madhopur Fathehpur, P.S- Didarganj, Block- Patna Sadar, District- Patna, State- Bihar",M/SRADHA BRICKS,Delisted,EC,
4,945,SIA/BR/MIN/132405/2019,,"Brick Earth Mining Project at Mauza- Dhutauli, P.O- Bhutauli Malpa, P.S- Chautham, Anchal- Chautham, District- Khagaria (Bihar)",M/S GAYTRI BRICKS INT UDYOG,Delisted,EC,
5,946,SIA/BR/MIN/140900/2020,,"Proposed Brick Earth Mining Project of Area 1.79 Hectare Or 4.43 Acre M/S Alok  Int Udyog  at  Mauza-  Piparpanti,  P.S-  Mainatand,  Block-    Mainatand, District-West  Champaran, State - Bihar",M/S ALOK INT UDYOG,Delisted,EC,
6,947,SIA/BR/MIN/141069/2020,,"Mathurapur (Khasra/Plot(s) No. 1538, 1181 & 32) soil brick mining project.",M/S ATITHI BRICKS (A.S.P. MARKA),Delisted,EC,
7,948,SIA/BR/MIN/129955/2019,,"Tilakpur (Khata No. 2943,2979,3035,2942,2980,3034 of Khasra No. 156& 193 )  Brick Earth (Soil) mining project.",M/S K.G.N. BRICKS,Delisted,EC,
8,949,SIA/BR/MIN/167031/2020,,BRICK EARTH MINING PROJECT FOR M/S CMD INT UDYOG MAUZA KARWA BALRAM KARPI SONBHADRA BANSHI SURYAPUR ARWAL AREA 3.15 Ac,M/S C M D INT UYDOG PROP DEVENDRA KUMAR,Delisted,EC,
9,950,SIA/BR/IND/53693/2020,SIA/3(a)/1233/2020,"Dina Iron and Steel Limited (Expansion Project) Mauza- Abdul Rahamapur, Tehsil- Patna City, District- Patna City, State- Bihar",DINA IRON AND STEEL LIMITED,EC Granted,EC,
0,951,SIA/BR/MIN/35429/2019,,"Proposed Brick Earth Mining Project of Area  3.0 Acres or  1.21 Hectare for M/s  Radha Bricks at Mauza- Madhopur Fathehpur, P.S- Didarganj, Block- Patna Sadar, District-  Patna, State- Bihar",MS RADHA BRICKS,Pending at PP due to eds,EC,
1,952,SIA/BR/MIN/35707/2019,,"BRICK EARTH PROJECT AT MAUZA – KUMREL & MADHUKARPUR, P.O- BARHARA, P.S - BELHAR, ANCHAL- BELHAR, DISTRICT-BANKA(BIHAR)",GGH BRICKS,Pending at PP due to eds,EC,
2,953,SIA/BR/MIN/41065/2019,,Balio Sand Ghat (Stretch IV Block III) mining project,WESTLINK TRADING PRIVATE LIMITED,Delisted,EC,
3,954,SIA/BR/MIN/128921/2019,,"Report of Brick Earth Mining Project of Area 2.63 Acer or 1.06 Ha M/s SKM Bricks at Mauza- Tilhar, P.S + Block- Khusropur, District- Patna, State- Bihar.",M/S SKM BRICKS,Delisted,EC,
4,955,SIA/BR/INFRA2/428950/2023,,"Proposed Commercial Building “PALLADIUM MALL” at Pokhara Mohalla, Hajipur, Vaishali,  Bihar.",RAM MERTIYA DEVELOPERS,Pending at PP due to eds,EC,
5,956,SIA/BR/MIN/137489/2020,,M/S Maa Durga Int Udyog,M/S MAA DURGA INT UDYOG,Delisted,EC,
6,957,SIA/BR/MIN/137543/2020,,"DINA PATTI BALU GHAT (PARWANA RIVER), APPLICANT- MR. SUJEET KUMAR,  AREA- 2 HA., VILL.+POST- DINA PATTI, TEHSIL- PEEPRA BAZAR, DISTRICT- SUPAUL (BIHAR)","MR. SUJEET KUMAR, DISTRICT- SUPAUL, BIHAR",Delisted,EC,
7,958,SIA/BR/MIN/66179/2017,SIA/1(a)/596/18,Sand Mining Project at Kiyajori Sand Ghat on Ajay River,WESTLINK TRADING PRIVATE LIMITED,Delisted,EC,
8,959,SIA/BR/MIN/66182/2017,,Sand Mining Project at Dhondiya-Inodih Sand Ghat on Ajay River.,WESTLINK TRADING PRIVATE LIMITED,Delisted,EC,
9,960,SIA/BR/MIN/59805/2016,SIA/1(a)/359/16,Balu/ Sand Mining (Minor Mineral) Category- B2 (M.L. Area- 5.6 ha) with Production Capacity of 45000 TPA at Lal Darwaja Ghat of Ganga River in Tehsil and District: Munger (Bihar).,NM FOOD PRODUCT PVT LTD,EC Granted,EC,
0,961,SIA/BR/MIN/59818/2016,,"Balu/ Sand Mining (Minor Mineral); M.L. Area- 3.2 ha, Cat.- B2 at Khapara Ghat of Mahani River in Tehsil: Sangrampur, District- Munger (Bihar).",NM FOOD PRODUCT PVT LTD,TransferToDEIAA,EC,
1,962,SIA/BR/MIN/142170/2020,,BRICK EARTH MINING PROJECT FOR M/S SHEOGANGA INT UDYOG MAUZA MAHAMMADPUR,M/S SHEOGANGA INT UDYOG PROP ABHISHEK KUMAR,Delisted,EC,
2,963,SIA/BR/MIN/30975/2019,SIA/1(a)/589/18,Balthar & Hanjro Sand Ghat  Mining Project,WESTLINK TRADING PRIVATE LIMITED,EC Granted,EC,
3,964,SIA/BR/MIN/133715/2019,,"Proposed Brick Earth Mining Project of Area 4.74Acres or 1.91 Hectare for M/s Shiv Shankar Int Udyog at Mauza-Gorakhari, P.O- Gorakhari, P.S – Bikram, Block- Bikram, District- Patna, State – Bihar",M/S SHIV SHANKAR INT UDYOG,Delisted,EC,
4,965,SIA/BR/MIN/66028/2017,SIA/1(a)/566/18,Sand Mining Project at Birdaban Sand Ghat (Block no-3) on Kiul River.,WESTLINK TRADING PRIVATE LIMITED,Delisted,EC,
5,966,SIA/BR/MIN/66041/2017,SIA/1(a)/547/18,"Sand mining project at Gurdih  Sand Ghat (Block no-4), Lakhisarai",WESTLINK TRADING PRIVATE LIMITED,Delisted,EC,
6,967,SIA/BR/MIN/66045/2017,SIA/1(a)/545/18,"Sand mining project at Maliya Sand Ghat (Block no-10) on Kiul river, Lakhisarai",WESTLINK TRADING PRIVATE LIMITED,Delisted,EC,
7,968,SIA/BR/MIS/226298/2021,,"Proposed  Expansion  Residential Building    “Star  Galaxy”  at Mauza-Simlimurarpur, Khata No. 89,  Khesra No. 1574 (Part), 1579 & 1580 (Part), 1581,  1594 & 1595, Dist - Patna, Bihar By M/s Sai Shree  Balajee Homes Pvt. Ltd.",M/S SAI SHREE BALAJEE HOMES PVT. LTD.,WithdrawEC,EC,
8,969,SIA/BR/NCP/52882/2020,SIA/8(b)/1259/2020,"Proposed commercial cum residential project of Mundeshwari Multicon Pvt. Ltd at Usri Sarari, Patna",MUNDESHWARI MULTICOM PVT. LTD.,EC Granted,EC,
9,970,SIA/BR/MIN/30501/2015,3453,BRICKS EARTH KILN,SPB BRICKS,Delisted,EC,
0,971,SIA/BR/MIN/36017/2019,,"Report of Brick Earth Mining Project of Area 2.62 Acres or 1.06 Hectare for M/s J.P.S Bricks at Vill/Mauza- Narayanpur,P.O- Narayanpur, P.S + Anchal- Bihta, District- Patna, State: Bihar",MS JPS BRICKS,Pending at PP due to eds,EC,
1,972,SIA/BR/MIN/127922/2019,,"Brick Earth Mining Project of  Area 1.25 Ha or 3.10 Acres M/s Baba Int Udyog  at Mauza- Donrapur, P.O- Siswaniya, P.S + Block- Uchka Gaon, District- Gopalganj, State- Bihar",M/S BABA INT UDYOG,Delisted,EC,
2,973,SIA/BR/MIN/132056/2019,,Yash Deep Bricks,YASH DEEP BRICKS,Delisted,EC,
3,974,SIA/BR/MIN/148587/2020,,M/s Ganga-2 Bricks,M/S GANGA-2 BRICKS,Delisted,EC,
4,975,SIA/BR/MIN/31437/2019,SIA/1(a)/643/19,"Sand mining project at Karbasin Nonaur ghat on Son river in district Bhojpur, Bihar",BROADSON COMODITIES PVT LTD,EC Granted,EC,
5,976,SIA/BR/MIN/137465/2020,,SEPL bricks pvt.ltd,M/S SEPL BRICKS,Delisted,EC,
6,977,SIA/BR/MIN/64398/2017,SIA/1(a)/493/17,Sand Mining Project at Palhat Kalan Ghat on Buddh River,WESTLINK TRADING PRIVATE LIMITED,EC Granted,EC,
7,978,SIA/BR/IND2/198424/2021,SIA/5(j)/1276/2021(EXP.),Harinagar Sugar Mills Ltd.,HARINAGAR SUGAR MILLS LTD,EC Granted,EC,
8,979,SIA/BR/MIN/30965/2019,SIA/1(a)/581/18,kendih Sand Ghat,WESTLINK TRADING PRIVATE LIMITED,EC Granted,EC,
9,980,SIA/BR/MIN/34574/2019,,Proposed Sand Mining Project of area 5.0 ha at Madharapur  Bholanath Ghat on Ganga River of District- Begusarai of State- Bihar,RADHA SWAMI AUTOMOBILES,Pending at PP due to eds,EC,
0,981,SIA/BR/NCP/74851/2018,SIA/8(a)/524/18,"PROPOSED RESIDENTIAL PROJECT
SUNRISE RUPASPUR CITY",SUNRISE SAI DEVELOPERS PVT. LTD.,EC Granted,EC,
1,982,SIA/BR/MIS/29856/2015,SIA/8(a)/61/2015,"Proposed Medical College at Golma, Saharsa, Bihar by Radha Ballabh Medical Foundation Trust.",RADHA BALLABH MEDICAL FOUNDATION TRUST,Delisted,EC,
2,983,SIA/BR/MIN/31710/2015,SIA/1(a)/48/2015,M/s Shivam Int Udyog,UDAY SHANKAR TIWARI,Delisted,EC,
3,984,SIA/BR/MIN/30928/2019,SIA/1(a)/546/18,Ghosi Kundi sand Ghat Mining Project of Area 22.0 ha District Lakhisarai Bihar on Kiul River,WESTLINK TRADING PRIVATE LIMITED,EC Granted,EC,
4,985,SIA/BR/MIN/135623/2020,,"Brick Earth Mining Project at Village- Piparwar, P.O- Maigara, P.S- Maigra, Anchal- Dumariya, District- Gaya (Bihar)",M/S BRT BRICKS,Delisted,EC,
5,986,SIA/BR/MIN/161171/2020,,BRICK EARTH MINING PROJECT FOR M/S ATA BRICKS MAUZA GARHA RANIGANJ ARARIA AREA 3.00 Ac 1.21 Ha,ATA BRICKS PROP UMESH SHARMA,Delisted,EC,
6,987,SIA/BR/MIN/71235/2017,,Sand Mining Project at Kalikasthan Sand Ghat,WESTLINK TRADING PRIVATE LIMITED,Delisted,EC,
7,988,SIA/BR/INFRA2/409087/2022,,Winsome Icon (Commercial cum Residential Building Porject),WINSOME REALTORS,Pending at PP due to eds,EC,
8,989,SIA/BR/MIN/134667/2020,,"SINGHWAHINI M/S SAH INT UDYOG project, for   Production Capacity 5361.30 TPA, Mine Area, 2.86 Acres (1.15 Ha), bearing Revenue Thana No.-63, Khata No.- 135 & 228, Plot No.- 5491, 5504 & 5494 Mauza- Si",M/S SAH INT UDYOG PART DEVENDRA SAH AND VIJAY SAH,Delisted,EC,
9,990,SIA/BR/MIN/136290/2020,,"BRICK EARTH MINING PROJECT FOR M/S TAZ BRICKS MAUZA BARBARI, AZAM NAGAR, KATIHAR, AREA- 2.38 Ac, 0.96 Ha",M/S. TAJ BRICKS PROP MD TAMUR ALAM,Delisted,EC,
0,991,SIA/BR/MIN/143885/2020,,BRICK EARTH MINING PROJECT M/S BHARAT EET UDYOG MAUZA RAMPUR SAIDPUR RUNNI RUNNI SAIDPUR SITAMARHI AREA 2.52,M/S BHARAT EET UDYOG RPOP MERAJ KHAN AREA 2.52,Delisted,EC,
1,992,SIA/BR/MIN/30954/2015,3490,Ratan Int Udyog,AMIT ENVIRO,Delisted,EC,
2,993,SIA/BR/MIN/131486/2019,,Proposed Brick Earth Mining,MS HINDI KAMAL INT,Delisted,EC,
3,994,SIA/BR/MIN/130169/2019,,"MOHANPUR M/s- DADA INT UDYOG Project, For Production Capacity – 9557.1 TPA, Area-2.5ha (5.6 Ac.), Thana no- 194, Khata no- 7/110 Plot no.- 01/240. Mauza- Mohanpur, P.S.-Morkahi, Circle- Alauli, Distri",M/S DADA INT UDYOG,Delisted,EC,
4,995,SIA/BR/MIN/129576/2019,,M/s Anu Bricks,M/S ANU BRICKS,Delisted,EC,
5,996,SIA/BR/MIN/135293/2020,,"BRICK EARTH MINING PROJECT FOR M/S. SANJU BRICKS, MAUZA- BAIKATHPUR, KHUSHRUPUR, PATNA,  AREA- 2.82 Ac, 1.14 Ha","M/S. SANJU BRICKS, PROP- RAJ KUMAR",Delisted,EC,
6,997,SIA/BR/MIN/154986/2020,,Brick Clay Mining,M/S BSCPL INFRASTRUCTURE LTD.,Delisted,EC,
7,998,SIA/BR/MIN/128983/2019,,"Report of Brick Earth Mining Project of Area 3.58 Acres or 1.45 Hectare for M/s at Devi Maa Bricks Mauza-Ganga Chak, P.O + P.S + Block- Bikram, District- Patna, State- Bihar",M/S DEVI MAA BRICKS,Delisted,EC,
8,999,SIA/BR/MIS/123681/2019,SIA/8(a)/700/19,CRESCENT (Residential Building Project of Nutan Construction),NUTAN CONSTRUCTION,EC Granted,EC,
9,1000,SIA/BR/IND/19010/2016,SIA/3(b)/336/16,Bihar cement Plant - A Unit of Shree Cement Limited,Shree Cement Ltd.,EC Granted,EC,
0,1001,SIA/BR/MIN/35578/2019,,"Proposed Brick Earth Mining Project of Area 2.60 Acres or   1.05 Hectare for   M/s  Bol Bam Chimney Bricks Bhatta at   Vill- Karai, P.O: Karai P.S- Naubatpur, District- Patna,  State- Bihar.",MS BOL BAM CHIMNEY BRICKS BHATTA,Pending at PP due to eds,EC,
1,1002,SIA/BR/MIN/30350/2015,3491,Brick Clay Mining Project- Mamta Bricks,MAMTA BRICKS,Delisted,EC,
2,1003,SIA/BR/MIN/31157/2019,SIA/1(a)/526/2018,"Natraj Iron & Castings Pvt. Ltd.  Stone Mining Project at village: Chakandara / Barari, block- chewra, district- Sheikhpura, State: Bihar",NATRAJ IRON & CASTINGS PVT. LTD,EC Granted,EC,
3,1004,SIA/BR/INFRA2/431928/2023,SIA/8(a)/2433/2023,"Proposed Residential Cum Commercial Building “Green Meadows” at Mustafapur, Patna, Bihar",YASH RAJ BUILDERS AND PROMOTERS PRIVATE LIMITED,Agenda Uploaded by SEIAA,EC,
4,1005,SIA/BR/IND2/198424/2021,SIA/5(j)/1276/2021(EXP.),Harinagar Sugar Mills Ltd.,HARINAGAR SUGAR MILLS LTD,EC Granted,EC,
5,1006,SIA/BR/MIN/137583/2020,,"Proposed Brick Earth Mining Project of Area 0.97 Hectare Or 2.39 Acre M/s Jai Int  Udyog  at Mauza-Turki, P.S: Bagaha,  Block- Bagaha 2, District- West Champaran, State  –  Bihar",M/SJAI INT UDYOG,Delisted,EC,
6,1007,SIA/BR/MIN/137865/2020,,"BRICK EARTH MINING PROJECT FOR M/S R D C INT UDYOG, MAUZA MUSAHARI, EKANGARSARAI, DISTRICT NALANDA, AREA 3.17 Ac, 1.28 Ha",M/S R.D.C. INT UDYOG PROP RANJEET KUMAR,Delisted,EC,
7,1008,SIA/BR/MIN/137935/2020,,J SWASTIC S BRICKS,J SWASTIC S BRICKS,Delisted,EC,
8,1009,SIA/BR/MIN/36017/2019,,"Report of Brick Earth Mining Project of Area 2.62 Acres or 1.06 Hectare for M/s J.P.S Bricks at Vill/Mauza- Narayanpur,P.O- Narayanpur, P.S + Anchal- Bihta, District- Patna, State: Bihar",MS JPS BRICKS,Pending at PP due to eds,EC,
9,1010,SIA/BR/IND2/253126/2022,SIA/1(b)/2037/2022,Exploratory drilling of One well in OALP BLOCK GV-ONHP-2021/1,"HSE, FRONTIER BASINS, ONGC, DEHRADUN",EC Granted,EC,
0,1011,SIA/BR/MIN/138826/2020,,"Ordinary clay bscpl infrastructure mauza khirniya , mansi, Khagaria",BSCPL INFRASTRUCTURE LTD. MAUZA KHIRNIYA AREA 12.21 AC 4.94 HA,Delisted,EC,
1,1012,SIA/BR/IND/59209/2020,SIA/3(a)/1272/2020,M/s Tejas Iron & Steel Pvt. Ltd.,M/S TEJAS IRON & STEEL PVT. LTD.,Return to SEIAA(Violation),EC,
2,1013,SIA/BR/MIN/69935/2017,,Proposed Sand Mining Project at Amarut Sand Ghat on Lilajan River.,WESTLINK TRADING PRIVATE LIMITED,Delisted,EC,
3,1014,SIA/BR/MIS/121345/2019,SIA/8(a)/698/19,"Proposed Group Housing “Rose Valley” at Plot No.-370, 371, 372 and 380, Mauza- Nasirpur Tajpur, Thana- Didarganj, District- Patna, Bihar",MS ASHIRWAD ENGICON PRIVATE LIMITED,EC Granted,EC,
4,1015,SIA/BR/MIN/137379/2020,,"Brick Earth Mining Project of Area 4.37 Acres or 1.77 Hectare for M/s RCM Bricks at Vill/Mauza- Matior, P.S- Patauri, Block- Mohanpur, District- Samastipur State - Bihar",M/S RCM BRICKS,Delisted,EC,
5,1016,SIA/BR/MIN/65412/2017,SIA/1(a)/507/17,Sand Mining Project at Maigara Sand Ghat on Sorhar River.,WESTLINK TRADING PRIVATE LIMITED,EC Granted,EC,
6,1017,SIA/BR/MIN/51709/2020,,Balu Ghat Mining Project (Patna Son 3 Balu Ghat) at Riverbed Of Son River.,SRI BHIM PRASAD,Delisted,EC,
7,1018,SIA/BR/MIN/127038/2019,,"Brick Earth Mining project For M/S  Tiwari enterprises at revenue Thana no. 47, Khata No. -113&17, Plot No. -398,420,&412 M.L. Area – 1.13 hect(2.79 Ac.).",TIWARI ENTERPRISES KHARKHOLI,Delisted,EC,
8,1019,SIA/BR/MIN/33802/2019,,Dumaria Balu Ghat,VINAY  KUMAR,Pending at PP due to eds,EC,
9,1020,SIA/BR/MIS/29857/2015,SIA/8(a)/61/2015,"Proposed Medical College at Golma, Saharsa, Bihar by Radha Ballabh Medical Foundation Trust.",RADHA BALLABH MEDICAL FOUNDATION TRUST,Delisted,EC,
0,1021,SIA/BR/MIS/127441/2019,SIA/8(a)/699/19,IOB Galaxy Building,MS ASHIRWAD ENGICON PRIVATE LIMITED,EC Granted,EC,
1,1022,SIA/BR/MIN/59826/2016,SIA/1(a)/354/16,"KUMARSHAR GHAT OF BADHUA RIVER
TEHSIL SANGRAMPUR, DISTRICT MUNGER, BIHAR
M.L. AREA 10.54 HA",NM FOOD PRODUCT PVT LTD,EC Granted,EC,
2,1023,SIA/BR/MIN/149185/2020,,ORDINARY CLAY MINING PROJECT FOR BSCPL INFRASTRUCTURE LTD,BSCPL INFRASTRUCTURE LTD MAUZA DIGHARI & HARDIYA AREA 12.35,Delisted,EC,
3,1024,SIA/BR/MIN/71034/2017,SIA/1(a)/530/18,STONE MINING PROJECT AT BLOCK NO-28,SHRI RAVISHANKAR KUMAR DEOGHAR (JHARKHAND),Delisted,EC,
4,1025,SIA/BR/MIN/144010/2020,,ORDINARY CLAY MINING PROJECT FOR BSCPL INFRASTRUCTURE LTD,BSCPL INFRASTRUCTURE LTD MAUZA SUKHASAN AREA 12.34 AC,Delisted,EC,
5,1026,SIA/BR/MIN/51277/2019,SIA/1(a)/627/19,"Sand mining project at Rupas Ghat on Ganga river over an area of 14.8 ha in district Patna, Bihar",BROADSON COMODITIES PVT LTD,Referred Back to SEAC(A),EC,
6,1027,SIA/BR/MIN/139756/2020,,ORDINARY CLAY MINING PROJECT FOR BSCPL INFRASTRUTURE LTD. MAUZA DIGHARI MANSI CHAUTHAM KHAGARIA,BSCPL INFRASTRUCTURE LTD. MAUZA DIGHARI AREA 11.00 AC,Delisted,EC,
7,1028,SIA/BR/MIS/125023/2019,SIA/8(a)/697/19,"Government Medical College and Hospital at Sitamarhi, Bihar",DEPARTMENT OF HEALTH GOVERMENT OF BIHAR,EC Granted,EC,
8,1029,SIA/BR/MIN/135725/2020,,"CHHAWRA DANO - PIPRA BALU GHAT (TIYAR RIVER), APPLICANT- MR. VINAY KUMAR, AREA- 1.00 HA.,  KHATA NO.- 37, PLOT NO.- 241, 242; DIST.- EAST CHAMPARAN","MOTIHARI SAND DEPOSIT OF EAST CHAMPARAN, BIHAR,  APPLICANT- SHRI VINAY KUMAR",Delisted,EC,
9,1030,SIA/BR/MIN/33432/2019,,Proposed Sand Mining Project of Area 3.70 Ha at Jai Chhapra Ghat  on Ghaghra (Sarayu) River of District-Siwan of State-Bihar,M S BALAJI ENTERPRISES,Pending at PP due to eds,EC,
0,1031,SIA/BR/MIN/31028/2019,SIA/1(a)/611/19,Mandhata Sand Ghat ( Stretch III Block VI) Mining Project,WESTLINK TRADING PRIVATE LIMITED,EC Granted,EC,
1,1032,SIA/BR/MIN/144772/2020,,m/s ss eat udyog,M/S SS EAT UDYOG,Delisted,EC,
2,1033,SIA/BR/MIN/186523/2020,,ORDINARY CLAY MINING PROJECT FOR BSCPL INFRASTRUCTRUE LTD,BSCPL INFRASTRUCTURE LTD. AREA 7.18,Delisted,EC,
3,1034,SIA/BR/MIN/145128/2020,,ORDINARY CLAY MINING PROJECT FOR BSCPL INFRASTRUCTURE LTD MAUZA GHOSRAMA,BSCPL INFRASTRUCTURE LTD. MAUZA GHOSRAMA AREA 12.18 AC,Delisted,EC,
4,1035,SIA/BR/IND/26138/2018,SIA/3(a)/532/18,Kamper Concast Ltd,KAMPER CONCAST LIMITED,EC Granted,EC,
5,1036,SIA/BR/IND/18661/2017,,SHIVSHIVA STEEL PVT LTD,SHIVSHIVA STEEL PVT LTD,Delisted,EC,
6,1037,SIA/BR/MIN/66109/2017,SIA/1(a)/592/18,Sand mining Project at Bhour Sand ghat on River Kiul,WESTLINK TRADING PRIVATE LIMITED,Delisted,EC,
7,1038,SIA/BR/MIN/66116/2017,SIA/1(a)/576/18,Sand Mining Project at Katauna Ghat on Kiul River,WESTLINK TRADING PRIVATE LIMITED,Delisted,EC,
8,1039,SIA/BR/MIN/66119/2017,SIA/1(a)/595/18,Lotun & Ratanpur Balu Ghat on Kiul River,WESTLINK TRADING PRIVATE LIMITED,Delisted,EC,
9,1040,SIA/BR/MIN/66261/2017,SIA/1(a)/573/18,Sand Mining Project at Manjhway sand ghat on River Kiul,WESTLINK TRADING PRIVATE LIMITED,Delisted,EC,
0,1041,SIA/BR/MIN/74976/2018,SIA/1(a)/526/18,"Proposed  Stone  Mining  Project  at  Village:  Chakandara / Barari,  Block- Chewra, District: 
Shekhpura,  State: Bihar",NATRAJ IRON & CASTINGS PVT. LTD,Delisted,EC,
1,1042,SIA/BR/RIV/26099/2016,SIA/1(c)/428/17,"""KUNDAGHAT RESERVOTR scHEME"", District- Jamui, Village:- Sikandra, Tehsil:- Sikandra, District:- Jamui",WATER RESOURCE DEPARTMENT GOVERNMENT OF BIHAR,Delisted,EC,
2,1043,SIA/BR/MIN/71234/2017,,Sand Mining Project at Jamuna Sand Ghat,WESTLINK TRADING PRIVATE LIMITED,Delisted,EC,
3,1044,SIA/BR/MIN/33399/2019,,Proposed Sand Mining Project  of 4.0 ha at Trikalpur ghat on Ghaghra (Sarayu) River of  District-Siwan  of State-Bihar,M S BALAJI ENTERPRISES,Pending at PP due to eds,EC,
4,1045,SIA/BR/MIN/127922/2019,,"Brick Earth Mining Project of  Area 1.25 Ha or 3.10 Acres M/s Baba Int Udyog  at Mauza- Donrapur, P.O- Siswaniya, P.S + Block- Uchka Gaon, District- Gopalganj, State- Bihar",M/S BABA INT UDYOG,Delisted,EC,
5,1046,SIA/BR/MIN/130902/2019,,"BELA SIMRI M/S M.A. BRICKS PROJECT, for   Production Capacity 5081.58 TPA, Mine Area–1.09ha (2.71Ac), Thana No.- 243, Khata No. 18, 196, 205 & 183.Plot No. 1773, 1769, 1573 & 1578. Mauza –Bela Simri P",M/S M.A.BRICKS PROP-VANDANA KUMARI,Delisted,EC,
6,1047,SIA/BR/MIN/34988/2019,,Dighiya Dudhela Sand Ghat on Koshi   River,SUJEET KUMAR,Pending at PP due to eds,EC,
7,1048,SIA/BR/MIN/66126/2017,SIA/1(A)/565/18,Sand Mining Project at Lakhapur Sand Ghat on River Kiul,WESTLINK TRADING PRIVATE LIMITED,Delisted,EC,
8,1049,SIA/BR/MIN/66259/2017,SIA/1(a)/589/18,Sand Mining Project at Balthar & Hanjro Sand Ghat on Barnar River.,WESTLINK TRADING PRIVATE LIMITED,Delisted,EC,
9,1050,SIA/BR/MIN/129931/2019,,"proposed Brick Earth Mining Project at Vill: Sukumarpur, P.O- Jafrabad, P.S- Raghopur, District- Vaishali, State- Bihar, Area: 1.18 Ha of M/s Radha Bricks",RADHABRICKS,Delisted,EC,
0,1051,SIA/BR/MIN/31554/2015,SIA/1(a)/26/2015,BRICK CLAY MINING PROJECT- PAWAN INT UDYOG,PAWAN INT UDYOG,Delisted,EC,
1,1052,SIA/BR/MIN/33572/2019,,Parham Sand Ghat on Ganga River,KATYAYNI CONTRACTORS PVT. LTD.,Pending at PP due to eds,EC,
2,1053,SIA/BR/MIN/51727/2020,,Balu Ghat Mining Project (Patna Son 4 Balu Ghat) at Riverbed Of Son River.,SRI RANJIT KUMAR RAI,Delisted,EC,
3,1054,SIA/BR/MIS/187703/2020,SIA/8(a)/1275/2021(EXP.),"Proposed Expansion and Modification Commercial and residential Building “Orbito/Orbit” at  Mauza- Mustafapur, Pargana - Phulwari, Thana No.-36, Danapur, District- Patna, Bihar by M/s Mundeshwari Multicon Pvt. Ltd.",MUNDESHWARI MULTICOM PVT. LTD.,EC Granted,EC,
4,1055,SIA/BR/MIN/31763/2015,SIA/1(a)/50/2015,,AJAY INT UDYOG,Delisted,EC,
5,1056,SIA/BR/MIS/115168/2019,SIA/8(a)/692/19,"SHRI RAM JANAKI MEDICAL COLLEGE & HOSPITAL AT SAMASTIPUR,  (BIHAR)",DEPARTMENT OF HEALTH GOVERMENT OF BIHAR,EC Granted,EC,
6,1057,SIA/BR/MIN/157455/2020,,ORDINARY CLAY MINING PROJECT FOR BSCPL INFRASTRUCTURE LTD. MAUZA HATHWAN ALAULI KHAGARIA AREA 11.04,BSCPL INFRASTRUCTURE LTD MAUZA HATHWAN AREA 11.04 AC,Delisted,EC,
7,1058,SIA/BR/MIN/137502/2020,,M/S SHANKAR INT UDYOG,M/S SHANKAR INT  UDYOG,Delisted,EC,
8,1059,SIA/BR/MIN/131742/2019,,Proposed Brick Earth Mining,MS JIYA BRICKS,Delisted,EC,
9,1060,SIA/BR/MIN/146455/2020,,"Brick Earth Mining Project at Mauza- Shahpur, P.O- Daudpur, P.S - Shahpur, District- Patna(Bihar)",M/S PUJA BRICKS,Delisted,EC,
0,1061,SIA/BR/MIN/34959/2019,,"Soil  Mining Project of Area 6.054 Acres or 2.45  Hectare  at Vill- Sisai, P.O-Bihra,    P.S-Saharsa, Block- Sattar Katiya, District- Saharsa, State- Bihar for M/s Radha Enterprises",RADHA ENTERPRISES,Pending at PP due to eds,EC,
1,1062,SIA/BR/MIN/157455/2020,,ORDINARY CLAY MINING PROJECT FOR BSCPL INFRASTRUCTURE LTD. MAUZA HATHWAN ALAULI KHAGARIA AREA 11.04,BSCPL INFRASTRUCTURE LTD MAUZA HATHWAN AREA 11.04 AC,Delisted,EC,
2,1063,SIA/BR/MIN/146455/2020,,"Brick Earth Mining Project at Mauza- Shahpur, P.O- Daudpur, P.S - Shahpur, District- Patna(Bihar)",M/S PUJA BRICKS,Delisted,EC,
3,1064,SIA/BR/MIN/146884/2020,,ORDINARY CLAY MINING PROJECT FOR BSCPL INFRASTRUCTURE  LTD.,BSCPL INFRASTRUCTURE LTD MAUZA MADAR AREA 9.36 AC,Delisted,EC,
4,1065,SIA/BR/MIN/34073/2019,,Dagmara Lalman Patti Sand Ghat on Koshi River,SUJEET KUMAR,Pending at PP due to eds,EC,
5,1066,SIA/BR/MIN/66275/2017,SIA/1(a)/591/18,Sand Mining Project at Pakri Sand Ghat on River Kiul,WESTLINK TRADING PRIVATE LIMITED,Delisted,EC,
6,1067,SIA/BR/MIN/156340/2020,,"The proposed Soil mining is at Village- Gothauli, Post- Son Nagar, P.S- Barun, District- Aurangabad (Bihar).",M/S JHAJHARIA - GALVANO - MAXWELL (JV),Delisted,EC,
7,1068,SIA/BR/MIN/17647/2016,SIA/1(a)/414/17,170/2015,C&C CONSTRUCTION LIMITED,EC Granted,EC,
8,1069,SIA/BR/MIN/31763/2015,SIA/1(a)/50/2015,,AJAY INT UDYOG,Delisted,EC,
9,1070,SIA/BR/IND/18661/2017,SIA/3(a)/448/18,SHIVSHIVA STEEL PVT LTD,SHIVSHIVA STEEL PVT LTD,EC Granted,EC,
0,1071,SIA/BR/MIN/145088/2020,,"Proposed Brick Earth Mining Project of Area 1.35 Hectare Or 3.33 Acre M/s Jay Guru Dev Int Udyog  at  Vill/Mauza-  Garhatha Khurd, P.O-  Barhampur, P.S + Block- Barhampur, District- Buxar, State - Bih",M/S JAI GURU DEV INT UDYOG,Delisted,EC,
1,1072,SIA/BR/MIN/64411/2017,SIA/1(a)/486/17,Sand Mining Project at Rajan-II Sand Ghat on Morhar River,WESTLINK TRADING PRIVATE LIMITED,EC Granted,EC,
2,1073,SIA/BR/MIN/65392/2017,SIA/1(a)/519/17,Sand Mining Project at Siinghapur Sand Ghat on Morhar River.,WESTLINK TRADING PRIVATE LIMITED,EC Granted,EC,
3,1074,SIA/BR/MIS/228225/2021,SIA/8(a)/1529/2021,Proposed Mall cum Residential Building “Golden Tower / Residency” by Concicon Construction Pvt. Ltd.,CONCICON CONSTRUCTION PVT. LTD.,EC Granted,EC,
4,1075,SIA/BR/MIN/30975/2019,SIA/1(a)/589/18,Balthar & Hanjro Sand Ghat  Mining Project,WESTLINK TRADING PRIVATE LIMITED,EC Granted,EC,
5,1076,SIA/BR/MIS/17343/2016,SIA/7(h)/341/16,1 MLD Common Effluent Treatment Plant,BIHAR INDUSTRIAL AREA DEVELOPMENT AUTHORITY,EC Granted,EC,
6,1077,SIA/BR/MIN/35637/2019,,"Proposed Brick Earth Mining Project of Area 2.28 Acres or 0.92 Hectare M/s Mahal  Bricks  at Mauza + P.O- Sherpur, P.S + Block- Maner, District- Patna, State- Bihar",MS MAHAL BRICKS,Pending at PP due to eds,EC,
7,1078,SIA/BR/MIN/59818/2016,,"Balu/ Sand Mining (Minor Mineral); M.L. Area- 3.2 ha, Cat.- B2 at Khapara Ghat of Mahani River in Tehsil: Sangrampur, District- Munger (Bihar).",NM FOOD PRODUCT PVT LTD,TransferToDEIAA,EC,
8,1079,SIA/BR/MIN/142170/2020,,BRICK EARTH MINING PROJECT FOR M/S SHEOGANGA INT UDYOG MAUZA MAHAMMADPUR,M/S SHEOGANGA INT UDYOG PROP ABHISHEK KUMAR,Delisted,EC,
9,1080,SIA/BR/MIN/31028/2019,SIA/1(a)/611/19,Mandhata Sand Ghat ( Stretch III Block VI) Mining Project,WESTLINK TRADING PRIVATE LIMITED,EC Granted,EC,
0,1081,SIA/BR/MIN/30954/2015,3490,Ratan Int Udyog,AMIT ENVIRO,Delisted,EC,
1,1082,SIA/BR/MIN/66074/2017,SIA/1(a)/580/18,Sand Mining Project at Sair & Pandeydih Sand Ghat on Ulai River.,WESTLINK TRADING PRIVATE LIMITED,Delisted,EC,
2,1083,SIA/BR/MIN/66082/2017,SIA/1(a)/556/18,Sand Mining Project at Bariyarpur Sand Ghat on Kiul River.,WESTLINK TRADING PRIVATE LIMITED,Delisted,EC,
3,1084,SIA/BR/IND/53747/2019,,M/S Shivshiva Steel Private Limited (SSPL),SHIVSHIVA STEEL PVT LTD,Delisted,EC,
4,1085,SIA/BR/MIN/133884/2019,,"Baghari M/S YOGI ETT UDYOG Earth Mining Projec, Thana No -43 Khata No.-173, Plot No.- 3751 & 3752,Area-0.93 Ha or (2.30 Ac) For production capacity 4335.66 TPA, Mauza- Baghari, P.S.- Sursand ,Circle -",M/S YOGI ETT UDYOG PROPONENT KIRAN DEVI,Delisted,EC,
5,1086,SIA/BR/MIN/134008/2019,,"BRICK EARTH MINING PROJECT FOR M/S. PRASAD BRICKS INDUSTRIES, AT THANA NO. 390 & 392, MAUZA PHULWARIA & HARPURPARI, P.S PHULWARIA, CIRCLE TEGHARA, DISTRICT- BEGUSARAI, AREA 2.44 Ac, 0.98 Ha","M/S. PRASAD BRICKS INDUSTRIES, PROP- VIKASH KUMAR",Delisted,EC,
6,1087,SIA/BR/MIN/136830/2020,,"Brick Earth Mining Project at Village- Chatanwar, P.O- Chatanwar , P.S - Krishna Braham, District-Buxar(Bihar)",M/S- PRADHAN INT BHATTA UDYOG,Delisted,EC,
