,Sno.,Proposal No.,File No.,Project Name,Company,Proposal Status,Project Type,View
0,1,SIA/BR/MIN/70404/2017,SIA/1(a)/529/18,STONE MINING PROJECT AT BLOCK NO-29,RAJ KUMAR SINGH,Delisted,EC,
1,2,SIA/BR/MIN/33247/2019,,Proposed Sand Mining Project of Area 3.5 Ha at Rajwahi Yadavpur  Ghat on Gandak River of District-Gopalganj of State-Bihar,MR KAMAKHYA MISHRA,Pending at PP due to eds,EC,
2,3,SIA/BR/MIN/48478/2016,,"River Sand (Minor Mineral) Mining Project for Madho
Rampur Ghat in Bhagalpur District of Bihar.",MS SAINIK FOOD PVT LTD,Delisted,EC,
3,4,SIA/BR/IND2/47625/2019,SIA/5(g)/863/19,M/s Eastern India Biofuels Pvt. Ltd. (EIBPL),EASTERN INDIA BIOFUELS PRIVATE LIMITED,EC Granted,EC,
4,5,SIA/BR/MIN/143936/2020,,BRICK EARTH MINING PROJECT FOR M/S PREET INT UDYOG MAUZA BAJPATTI ABIDPUR BAJPATTI SITAMARHI AREA 3.06,M/S PREET INT UDYOG PROP BIJENDRA KUMAR AREA 3.06,Delisted,EC,
5,6,SIA/BR/MIN/134167/2019,,"Jirwa M/S. DURGA INT UDYOG  Earth Mining Project, Thana No-207, Khata No. 2009, 2496 &  1386. Plot No. 12019, 11452, 12062, & 12052 Area 1.47 HA (3.65Ac) For production capacity 6853.14  TPA, .Mauza-",M/S DURGA INT UDYOG PROP- RINA BHARATI,Delisted,EC,
6,7,SIA/BR/MIN/140793/2020,,"BRICK EARTH MINING PROJECT FOR MAUZA BARARI HARKESH, UCHAKAGAON, GOPALGANJ, AREA 4.00 Ac, 1.62 Ha",M/S RAJ INT UDYOG PROP RAMESH SINGH,Delisted,EC,
7,8,SIA/BR/MIN/32633/2019,SIA/1(a)/678/19,Sand mining project at Chhapra 4 ghat on Son river over an area of 7.0 ha in district Arwal in Bihar,MOR MUKAT MARKETING PRIVATE LIMITED,Referred Back to SEAC(A),EC,
8,9,SIA/BR/MIN/32593/2019,SIA/1(a)/674/19,Sand mining project at Sonbarsa Makbulpur Alauddin ghat on Son river over an area of 6.0 ha in district Arwal in Bihar,MOR MUKAT MARKETING PRIVATE LIMITED,Referred Back to SEAC(A),EC,
9,10,SIA/BR/MIN/71318/2017,,"Sand Mining Project at Nakti- Mahugain Sand Ghat, on Dhadhar river anchal- Fatehpur, Dist-Gaya, Bihar",WESTLINK TRADING PRIVATE LIMITED,Delisted,EC,
0,11,SIA/BR/MIN/126024/2019,,"Brick earth Mining in Gata No. 150,8,151,151/136,9,10,51,163/3311,163,62,62/1360 in village Pasopur, Tehsil-Bhagwanpur, Dist-Begusarai,Bihar",CHANDRIKA BRICK-INDUSTRIES,Delisted,EC,
1,12,SIA/BR/MIN/30928/2019,SIA/1(a)/546/18,Ghosi Kundi sand Ghat Mining Project of Area 22.0 ha District Lakhisarai Bihar on Kiul River,WESTLINK TRADING PRIVATE LIMITED,EC Granted,EC,
2,13,SIA/BR/MIN/134008/2019,,"BRICK EARTH MINING PROJECT FOR M/S. PRASAD BRICKS INDUSTRIES, AT THANA NO. 390 & 392, MAUZA PHULWARIA & HARPURPARI, P.S PHULWARIA, CIRCLE TEGHARA, DISTRICT- BEGUSARAI, AREA 2.44 Ac, 0.98 Ha","M/S. PRASAD BRICKS INDUSTRIES, PROP- VIKASH KUMAR",Delisted,EC,
3,14,SIA/BR/MIN/136830/2020,,"Brick Earth Mining Project at Village- Chatanwar, P.O- Chatanwar , P.S - Krishna Braham, District-Buxar(Bihar)",M/S- PRADHAN INT BHATTA UDYOG,Delisted,EC,
4,15,SIA/BR/MIN/130425/2019,,"Soil Mining Project of Area 12.00 Acres or 4.858 Hectare for Bishwa Raman Kumar Singh at Mauza-Barauni Malhipur, P.O- Malhipur (BTPF), P.S- Teghra, Block- Barauni, District- Begusarai, State- Bihar",BISHWA RAMAN KUMAR SINGH,Delisted,EC,
5,16,SIA/BR/MIN/417379/2023,,Jalwa Quartz-Quartzite (Silica Stone) Mine,IDIO CONSTRUCTION AND INDUSTRIES INDIA LTD,Under examination of SEIAA,EC,
6,17,SIA/BR/MIN/130417/2019,,"Brick Earth Mining Project at Village- Pitambarpur, P.O- Dumri, P.S- Fatuha, District-Patna (Bihar)",M/S- RIYA BRICKS,Delisted,EC,
7,18,SIA/BR/MIN/71235/2017,,Sand Mining Project at Kalikasthan Sand Ghat,WESTLINK TRADING PRIVATE LIMITED,Delisted,EC,
8,19,SIA/BR/NCP/63452/2017,SIA/8(a)/457/17,"Proposed Lohia Path Chakra at Jawaharlal Nehru Path (Bailey Road) in Between BPSC office (near Lalit Bhawan) and Vidhyut Bhawan in Patna, Bihar",BIHAR RAJYA PUL NIRMAN NIGAM LIMITED,WithdrawEC,EC,
9,20,SIA/BR/MIN/136215/2020,,"Brick Earth Mining Project at Mauza- Chanda, P.O- Dhibra, P.S- Dhibra, Anchal- Dev, District- Aurangabad(Bihar)",M/S SHIVSHAKTI INT UDYOG,Delisted,EC,
0,21,SIA/BR/MIN/60665/2016,SIA/1(a)/385/16,"Sand mining Project, at thekhapar Ghat",BROADSON COMODITIES PVT LTD,EC Granted,EC,
1,22,SIA/BR/MIN/60709/2016,SIA/1(a)/391/16,"Proposed Sand Mining Project of Area 24 Ha at Chilka Tola Ghat on Son River of
District-Patna of State-Bihar",BROADSON COMODITIES PVT LTD,EC Granted,EC,
2,23,SIA/BR/MIS/57883/2016,SIA/8(a)/333/2016,Majestic Construction & Developers Pvt. Ltd.,MAJESTIC CONSTRUCTION AND DEVELOPERS PVT LTD,EC Granted,EC,
3,24,SIA/BR/MIN/35128/2019,,BRICK EARTH MINING FOR MAA SHOBHA BELHAR,SHOBHA BRICKS BELHAR,Delisted,EC,
4,25,SIA/BR/MIN/143776/2020,,ORDINARY CLAY BSCPL INFRASTRUCTURE LTD MINING PROJECT FOR MAUZA KHARARI HAYAGHAT BAHERI DARBHANGA AREA 12.32 Ac,BSCPL INFRASTRUCTURE LTD. MAUZA KHARARI AREA 12.32 AC,Delisted,EC,
5,26,SIA/BR/MIN/144104/2020,,BRICK EARTH MINING PROJECT FOR M/S TRIMURTI EET UDYOG MAUZA BISHUNPUR BELA PARIHAR SITAMARHI AREA 3.09 Ac,M/S TRIMURTI EET UDYOG PROP DINESH RAY,Delisted,EC,
6,27,SIA/BR/MIN/135591/2020,,"BRICK EARTH MINING PROJECT FOR M/S. HERO BRICKS, MAUZA- SONAWAN, DIDARGANJ, SADAR PATNA, PATNA, AREA- 2.50 Ac, 1.01 Ha","M/S. HERO BRICKS, PROP- SURESH PRASAD",Delisted,EC,
7,28,SIA/BR/MIN/71314/2017,,"Sand Mining Projct at Inguni Sand Ghat on Buddh River, Anchal-Paraiya,Dist- Gaya, Bihar",WESTLINK TRADING PRIVATE LIMITED,Delisted,EC,
8,29,SIA/BR/MIN/18872/2015,SIA/1(a)/461/17,"Rajauli (Block 6) Ordinary Stone Mining Project Village: Rajauli, Tehsil-Nawada &  District-Nawada, State-Bihar",MS BSCPL INFRASTRUCTURE LTD,EC Granted,EC,
9,30,SIA/BR/MIN/31363/2015,SIA/1(a)/13/2015,L.B.F Bricks Udyog,YADUNANDAN CHAUHAN,Delisted,EC,
0,31,SIA/BR/MIN/143885/2020,,BRICK EARTH MINING PROJECT M/S BHARAT EET UDYOG MAUZA RAMPUR SAIDPUR RUNNI RUNNI SAIDPUR SITAMARHI AREA 2.52,M/S BHARAT EET UDYOG RPOP MERAJ KHAN AREA 2.52,Delisted,EC,
1,32,SIA/BR/MIN/129768/2019,,"Proposed Brick Earth Mining Project of Area 2.77 Acres or 1.12 Hectare for M/s Hira Bricks at Mauza-Lodipur, P.O-Byapur, P.S + Block-Maner, District-Patna, State-Bihar.",M/S HIRA BRICKS,Delisted,EC,
2,33,SIA/BR/MIN/130178/2019,,Brick Earth Mining Project for M/s A.R.L Bricks,BRICK  EARTH  MINING  PROJECT,Delisted,EC,
3,34,SIA/BR/MIN/30937/2015,SIA/1(a)/02/2015,STONE MINING PROJECT-NECL-B2,NAVAYUGA ENGINEERING COMPANY LTD,Delisted,EC,
4,35,SIA/BR/MIN/31554/2019,SIA/1(a)/628/19,Sand mining project at Gosai Tola on Ganga river over an area of 18 ha in district Patna Bihar,BROADSON COMODITIES PVT LTD,Delisted,EC,
5,36,SIA/BR/MIN/148472/2020,,"Proposed Brick Earth Mining Project of Area 4.08 Acres or 1.65 Hectare for M/S  Shree Kamalia Udyog  at Mauza- Hatho Chak, P.O- Bahadurpur, P.S + Block- Rajauli,   District- Nawada, State - Bihar",M/S SHREE KAMALIA UDYOG,Delisted,EC,
6,37,SIA/BR/MIN/60868/2016,SIA/1(a)/398/16,Sand Mining Project at Hardi Chapra Ghat on river Ganga,BROADSON COMODITIES PVT LTD,EC Granted,EC,
7,38,SIA/BR/MIS/115168/2019,SIA/8(a)/692/19,"SHRI RAM JANAKI MEDICAL COLLEGE & HOSPITAL AT SAMASTIPUR,  (BIHAR)",DEPARTMENT OF HEALTH GOVERMENT OF BIHAR,EC Granted,EC,
8,39,SIA/BR/IND/26138/2018,,Kamper Concast ltd,KAMPER CONCAST LIMITED,EC Granted,EC,
9,40,SIA/BR/MIN/131092/2019,,"Dighaun M/S. N. P. S. INT UDYOG. With production capacity 5081.58 TPA  Mauza - Dighaun, Thana No.- 144, Khata no. 18 & 73. Plot no. 2385 & 29. Area, 2.70 Ac 1.09 ha P.S.- Beldaur, Circle - Beldaur, Di",M/S N.P.S. INT UDYOG PROP:-SARITA DEVI,Delisted,EC,
0,41,SIA/BR/MIN/66279/2017,,Sand Mining Project at Tetrahat Sand Ghat (Block No-12) on River Kiul,WESTLINK TRADING PRIVATE LIMITED,Delisted,EC,
1,42,SIA/BR/MIN/30921/2019,SIA/1(a)/608/19,"Tetarhat Sand Ghat Mining Project of Area 21.50 ha of Lakhisarai District, Bihar on Kiul River",WESTLINK TRADING PRIVATE LIMITED,EC Granted,EC,
2,43,SIA/BR/MIN/30933/2019,SIA/1(a)/549/18,"Nagardar Sand ghat Mining Project of area 23.50 of District Lakhisarai , Bihar On Kiul River",WESTLINK TRADING PRIVATE LIMITED,EC Granted,EC,
3,44,SIA/BR/MIN/48821/2016,,"Karamnasa Ghat (239355 TPA), Area 11.82ha, in District- Buxar (Bihar)",MS KATYAYNI CONTRACTORS PVT LTD,Delisted,EC,
4,45,SIA/BR/MIN/48828/2016,,"River
Sand (Minor Mineral) Mining Project for Baikunthpur Ghat (126967.5 TPA), Area 6.27ha, in District- Buxar (Bihar)",MS KATYAYNI CONTRACTORS PVT LTD,Delisted,EC,
5,46,SIA/BR/MIN/153195/2020,,"Brick Clay Mining Mauza/ Village- Madardih, P.O- Wajirganj, P.S- Wajirganj , District- Gaya (Bihar).",M/S- RADHA BRICKS,Delisted,EC,
6,47,SIA/BR/MIN/41782/2019,,Proposed Sand Mining Project of area 4.20 ha at Mohanpur Ghat on Gandak River of District- Begusarai of State-Bihar,RADHA SWAMI AUTOMOBILES,Pending at PP due to eds,EC,
7,48,SIA/BR/MIN/41879/2019,,Proposed Sand Mining Project of area 5.0 ha at Naokothi Ghat on  Gandak River of District- Begusarai of State- Bihar,RADHA SWAMI AUTOMOBILES,Pending at PP due to eds,EC,
8,49,SIA/BR/IND/59209/2020,SIA/3(a)/1272/2020,M/s Tejas Iron & Steel Pvt. Ltd.,M/S TEJAS IRON & STEEL PVT. LTD.,Return to SEIAA(Violation),EC,
9,50,SIA/BR/MIN/146445/2020,,"Brick Earth Mining Project at Mauza- Shahpur, P.O- Daudpur, P.S - Shahpur, District- Patna(Bihar)",M/S- PUJA BRICKS,Delisted,EC,
0,51,SIA/BR/MIS/224624/2021,SIA/8(a)/1282/2021,"Proposed Residential Building “Kashyap Green City, Phase-2” by Kashyap Green Homes Pvt. Ltd.",KASHYAP GREEN CITY PHASE-2,EC Granted,EC,
1,52,SIA/BR/MIS/172376/2020,SIA/8(a)/1237/2020,Crystal Towers,MUNDESHWARI MULTICOM PVT. LTD.,EC Granted,EC,
2,53,SIA/BR/MIN/31209/2015,SIA/1(a)/06/2015,V.M.B Int Udyog,MANISH KUMAR SINGH,Delisted,EC,
3,54,SIA/BR/MIN/31345/2015,SIA/1(a)/12/2015,A to Z Bricks,VIJAY KUMAR,Delisted,EC,
4,55,SIA/BR/MIN/30896/2019,SIA/1(a)/618/19,"Sand mining project at Jalpura Masaurha ghat over an area of 24.9 ha in district Patna, Bihar",BROADSON COMODITIES PVT LTD,EC Granted,EC,
5,56,SIA/BR/MIN/35849/2019,,"Proposed Brick Earth Mining Project of Area 2.68 Acres or 1.08 Hectare for M/s  Om Sai Bricks at Mauza- Malahi Diara, P.O + P.S + Block- Barh, District- Patna, State- Bihar",MS OM SAI BRICKS,Pending at PP due to eds,EC,
6,57,SIA/BR/MIN/129290/2019,,Sand Mining Project at Simiaahi  Sand Ghat (4.75 Ha.) on Budhnad  riverbed in Sitamarhi district of Bihar,NAVEENKUMAR SITAMARHI,Delisted,EC,
7,58,SIA/BR/MIN/137271/2020,,"Brick Earth Mining Project at Mauza- Salarpur, P.S- Shankarpur, Anchal- Ismailpur, District- Bhagalpur (Bihar)",M/S- SHREESAI BRICKS INDUSTRIES,Delisted,EC,
8,59,SIA/BR/MIN/134020/2019,,"Brick Earth Mining Project at Village- Anjani, P.O- Anjani, P.S- Parsa, District- Saran(Bihar)",M/S- S.K.S BRICKS,Delisted,EC,
9,60,SIA/BR/MIN/134382/2019,,"Brick Earth Mining Project at Village- Bhatandi, P.O- Bharwari, P.S– Rosera, District- Samastipur (Bihar",M/S- RAMAN INT UDYOG,Delisted,EC,
0,61,SIA/BR/MIN/30965/2019,SIA/1(a)/581/18,kendih Sand Ghat,WESTLINK TRADING PRIVATE LIMITED,EC Granted,EC,
1,62,SIA/BR/MIN/33399/2019,,Proposed Sand Mining Project  of 4.0 ha at Trikalpur ghat on Ghaghra (Sarayu) River of  District-Siwan  of State-Bihar,M S BALAJI ENTERPRISES,Pending at PP due to eds,EC,
2,63,SIA/BR/IND2/40509/2018,SIA/5(g)/691/19,"Proposed 100 KLPD molasses based distillery along with 4.0 MW co-generation power plant at Village Bucheya, Tehsil Sidhwalia, District Gopalganj, Bihar by Magadh Sugar & Energy Limited Unit: Bharat Su",MAGADH SUGAR & ENERGY LIMITED UNIT : BHARAT SUGAR MILLS (DISTILLERY DIVISION),EC Granted,EC,
3,64,SIA/BR/MIN/129177/2019,,"Proposed Brick Earth Mining Project of Area 2.41 Acres or 0.97 Hectare for M/s Maa Bricks Manufacturing at Village- Saraia Akopur, P.O- Sorampur, P.S- Phulwari Sharif, District- Patna, State- Bihar",M/S MAA BRICKS MANUFACTURING,Delisted,EC,
4,65,SIA/BR/MIN/75701/2018,SIA/1(a)/535/18,"Proposed Stone Mining Project at  Area-  8.397 Hect or 20.75 Acres  at  Village  - Madurna, Thana: Bhabua, District - Kaimur, (Bihar)",M/S STARNET MARKETING PVT. LIMITED,Delisted,EC,
5,66,SIA/BR/MIN/66115/2017,SIA/1(a)/582/18,Sand Mining Project at Nariyana Chacho Sand Ghat on river Kiul,WESTLINK TRADING PRIVATE LIMITED,Delisted,EC,
6,67,SIA/BR/MIN/30972/2019,SIA/1(a)/575/18,Ghanshyamthan Koluha Sand Ghat mining project,WESTLINK TRADING PRIVATE LIMITED,EC Granted,EC,
7,68,SIA/BR/MIN/64732/2017,SIA/1(a)/463/17,"Sand Mining Project at Sital Patti- Kanp Kapasiya Balu Ghat     
on Tilawe, River, District Saharsa,State-Bihar.",CHANDAN KUMAR,Delisted,EC,
8,69,SIA/BR/MIN/65387/2017,SIA/1(a)/514/17,Sand Mining Project at Maraha Sand Ghat on Buddh River,WESTLINK TRADING PRIVATE LIMITED,EC Granted,EC,
9,70,SIA/BR/MIN/36338/2019,,"Proposed Brick Earth Mining Project of Area 3.94 Acres or 1.59 Hectare M/s Hero Int Udyog at Vill + P.O- Tungi, P.S + Block- Hisua, Dist:- Nawada, State- Bihar.",MS HERO BRICKS,Pending at PP due to eds,EC,
0,71,SIA/BR/MIN/66121/2017,SIA/1(A)/584/18,Sand Mining Project at Panbharwa Sand Ghat on Kiul River,WESTLINK TRADING PRIVATE LIMITED,Delisted,EC,
1,72,SIA/BR/MIN/30152/2015,3434,Brick Clay Mining for Steel Int Udyog,BIMTE CONSULTANCY SERVICES PVT LTD,Delisted,EC,
2,73,SIA/BR/MIN/34325/2019,,Tilathi Sand Ghat on Mirchiyadhar River,SUJEET KUMAR,Pending at PP due to eds,EC,
3,74,SIA/BR/MIN/30913/2019,SIA/1(a)/566/18,Birdaban Sand Ghat Mining Project of Area 18.0 District Lakhisarai Bihar on Kiul River,WESTLINK TRADING PRIVATE LIMITED,EC Granted,EC,
4,75,SIA/BR/MIN/31133/2015,3497,Brick Clay Mining Project- Raj Int Udyog-B2,RAJ INT UDHYOG,Delisted,EC,
5,76,SIA/BR/MIN/31581/2015,SIA/1(a)/31/2015,Brick Clay Mining Project of M/s Sangam Marka  Bricks,OTHERS,Delisted,EC,
6,77,SIA/BR/IND/49750/2019,,Indira Paper Mill Pvt. Ltd. (IPMPL),INDIRA PAPER MILL PVT LTD,Pending at PP due to eds,EC,
7,78,SIA/BR/INFRA2/417444/2023,SIA/8(a)/2311/2023,The Breeze (Residential Building project of Bhavya Construction Private Limited JV),BHAVYA CONSTRUCTION PRIVATE LIMITED JV,EC Granted,EC,
8,79,SIA/BR/MIN/66265/2017,SIA/1(a)/569/18,Sand Mining Project Jugdi Sand Ghat on Barnar River.,WESTLINK TRADING PRIVATE LIMITED,Delisted,EC,
9,80,SIA/BR/MIN/66278/2017,,Sand Mining Project at Raksha Oriya Sand Ghat on Jhanjhi River,WESTLINK TRADING PRIVATE LIMITED,Delisted,EC,
0,81,SIA/BR/MIN/141027/2020,,ORDINARY CLAY MINING PROJECT FOR MAUZA HATHAURI HAYAGHAT BAHERI DARBHANGA AREA 9.87 Ac 3.99 Ha,BSCPL INFRASTRUCTURE LTD. MAUZA HATHAURI AREA 9.87 AC,Delisted,EC,
1,82,SIA/BR/MIN/33572/2019,,Parham Sand Ghat on Ganga River,KATYAYNI CONTRACTORS PVT. LTD.,Pending at PP due to eds,EC,
2,83,SIA/BR/IND/18661/2017,SIA/3(a)/448/18,SHIVSHIVA STEEL PVT LTD,SHIVSHIVA STEEL PVT LTD,EC Granted,EC,
3,84,SIA/BR/MIN/156340/2020,,"The proposed Soil mining is at Village- Gothauli, Post- Son Nagar, P.S- Barun, District- Aurangabad (Bihar).",M/S JHAJHARIA - GALVANO - MAXWELL (JV),Delisted,EC,
4,85,SIA/BR/MIN/133565/2019,,"Proposed Brick Earth Mining Project of Area 3.12 Acres or 1.26 Hectare for M/S VIP Bricks Company at Village- Madhopur, Tehsil- Bakhtiyarpur, P.S + Anchal- Bakhtiyarpur, District- Patna, State- Bihar.",M/S VIPBRICKSCOMPANY,Delisted,EC,
5,86,SIA/BR/MIN/135869/2020,,"Brick Earth Mining Project at Mauza/Village- Fatehpur, P.O- Fatehpur, P.S+Anchal- Fatehpur, District- Gaya (Bihar)",M.S K.B.C INT UDYOG,Delisted,EC,
6,87,SIA/BR/MIN/138866/2020,,"Proposed Brick Earth Mining Project of Area 3.00 Acres or 1.21 Hectare for M/S Hathi Bricks at Village- Jagdishpur, P.O- Dariyapur, P.S - Gangta, Block- Maner, District- Patna, State – Bihar",M/S HATHI BRICKS,Delisted,EC,
7,88,SIA/BR/MIS/256899/2022,SIA/8(a)/1911/2022,Winsome Realtors,WINSOME REALTORS,EC Granted,EC,
8,89,SIA/BR/MIN/129768/2019,,"Proposed Brick Earth Mining Project of Area 2.77 Acres or 1.12 Hectare for M/s Hira Bricks at Mauza-Lodipur, P.O-Byapur, P.S + Block-Maner, District-Patna, State-Bihar.",M/S HIRA BRICKS,Delisted,EC,
9,90,SIA/BR/MIN/130178/2019,,Brick Earth Mining Project for M/s A.R.L Bricks,BRICK  EARTH  MINING  PROJECT,Delisted,EC,
0,91,SIA/BR/MIN/41270/2019,SIA/1(a)/561/18,Sono Sand Ghat,WESTLINK TRADING PRIVATE LIMITED,EC Granted,EC,
1,92,SIA/BR/MIN/34525/2019,,Belwa Balu Ghat on Baghmati River,VINAY  KUMAR,Pending at PP due to eds,EC,
2,93,SIA/BR/MIN/59800/2016,,“SANGRAMPUR OF BELHARNI RIVER”,NM FOOD PRODUCT PVT LTD,TransferToDEIAA,EC,
3,94,SIA/BR/MIN/59807/2016,,"Balu/ Sand Mining (Minor Mineral) Category- B2 (M.L. Area- 4.5 ha) with Production Capacity of 37500 TPA at Parham Ghat of Ganga River in Tehsil: Jamalpur, District: Munger (Bihar).",NM FOOD PRODUCT PVT LTD,TransferToDEIAA,EC,
4,95,SIA/BR/MIN/140089/2020,,ORDINARY CLAY MINING PROJECT FOR BSCPL INFRASTRUCTURE LTD MAUZA KHIRNIYA,BSCPL INFRASTRUCTURE LTD. MAUZA KHIRNIYA AREA 12.21 AC 4.94 HA,Delisted,EC,
5,96,SIA/BR/MIN/61869/2017,SIA/1(a)/431/17,"Sand Mining Project at Nonaiti Balu Ghat on Sursari River, Village-Noniati, District- Saharsa, Bihar",CHANDAN KUMAR,EC Granted,EC,
6,97,SIA/BR/NCP/63065/2017,,"Proposed Construction of Flyover (4 Lane carriageway) connecting Mithapur Flyover to Bhikhari Thakur (Yarpur) Flyover via             R. Block Junction in Patna Town, Bihar",BIHAR RAJYA PUL NIRMAN NIGAM LIMITED,Delisted,EC,
7,98,SIA/BR/NCP/30736/2017,SIA/8(b)/604/19,Sai City and Assortia Commercial Complex,SRI ANU ANAND CONSTRUCTION PVT. LTD,EC Granted,EC,
8,99,SIA/BR/MIN/66266/2017,SIA/1(a)/562/18,Sand mining Project at Pratappur sand ghat on river Kiul,WESTLINK TRADING PRIVATE LIMITED,Delisted,EC,
9,100,SIA/BR/MIN/66270/2017,,Sand Mining Project at Liptawa Sand Ghat on Barnar River.,WESTLINK TRADING PRIVATE LIMITED,Delisted,EC,
0,101,SIA/BR/MIN/34086/2019,,Dina patti Sand Ghat on Parwana River,SUJEET KUMAR,Pending at PP due to eds,EC,
1,102,SIA/BR/MIS/17343/2016,,1 MLD Common Effluent Treatment Plant,BIHAR INDUSTRIAL AREA DEVELOPMENT AUTHORITY,EC Granted,EC,
2,103,SIA/BR/IND/253812/2022,,sdfds,Kali Mandal,Pending at PP due to eds,EC,
3,104,SIA/BR/MIN/160331/2020,,ORDINARY CLAY MINING PROJECT FOR BSCPL INFRASTRUCTURE LTD MAUZA KAJIDUMRA,BSCPL INFRASTRUCTURE LTD MAUZA KAJIDUMRA AREA 12.01 AC,Delisted,EC,
4,105,SIA/BR/MIN/148853/2020,,"Brick Earth Mauza- Baijal Tetaria, P.O- Buniyadganj, P.S- Muffasil, District- Gaya(Bihar)",M/S DBC ENTERPRISES.,Delisted,EC,
5,106,SIA/BR/MIN/31209/2015,SIA/1(a)/06/2015,V.M.B Int Udyog,MANISH KUMAR SINGH,Delisted,EC,
6,107,SIA/BR/MIN/31345/2015,SIA/1(a)/12/2015,A to Z Bricks,VIJAY KUMAR,Delisted,EC,
7,108,SIA/BR/MIN/18872/2015,SIA/1(a)/461/17,"Rajauli (Block 6) Ordinary Stone Mining Project Village: Rajauli, Tehsil-Nawada &  District-Nawada, State-Bihar",MS BSCPL INFRASTRUCTURE LTD,EC Granted,EC,
8,109,SIA/BR/MIN/134020/2019,,"Brick Earth Mining Project at Village- Anjani, P.O- Anjani, P.S- Parsa, District- Saran(Bihar)",M/S- S.K.S BRICKS,Delisted,EC,
9,110,SIA/BR/MIN/134382/2019,,"Brick Earth Mining Project at Village- Bhatandi, P.O- Bharwari, P.S– Rosera, District- Samastipur (Bihar",M/S- RAMAN INT UDYOG,Delisted,EC,
0,111,SIA/BR/MIN/162925/2020,,Brick Kiln Soil Mining Project,JAI GURU BRICKS,Delisted,EC,
1,112,SIA/BR/MIN/162933/2020,,B2 ALL COMMO TRADE PVT. LTD.-Brick Earth Mining project,B2 ALL COMMO TRADE PVT. LTD.,Delisted,EC,
2,113,SIA/BR/IND/19030/2016,SIA/3(a)/220/16,Balmukund Concast Ltd (Expansion Project),BALMUKUND CONCAST LIMITED,EC Granted,EC,
3,114,SIA/BR/MIN/31242/2015,3502,BRICK CLAY MINING PROJECT-PRINCE BRICKS-B2,SHIVAM BRICKS,Delisted,EC,
4,115,SIA/BR/MIN/33417/2019,,Hamzapur  Sand Ghat on Ganga River,KATYAYNI CONTRACTORS PVT. LTD.,Pending at PP due to eds,EC,
5,116,SIA/BR/MIN/33571/2019,,Mohanpur Sand Ghat on Badua River,KATYAYNI CONTRACTORS PVT. LTD.,Pending at PP due to eds,EC,
6,117,SIA/BR/MIN/34391/2019,,Pakri Dayal Balu Ghat on Burhi Gandak River.,VINAY  KUMAR,Pending at PP due to eds,EC,
7,118,SIA/BR/MIN/132658/2019,,"Antaur M/S BHARAT INT UDYOG project, for   Production Capacity 4848.48 TPA, Mine Area, 2.57 Ac 1.04 Ha, Mauza – Antaur (Shahdullahpur), Thana No.- 156, Khata No. 270, 335, 349, 98 & 750. Plot No. 2501",M/S BHARAT INT UDYOG PROP RAJEEV KUMAR,Delisted,EC,
8,119,SIA/BR/MIN/31800/2019,SIA/1(a)/651/19,"Sand mining project at Chandralaya ghat 1 on Gandak river in district Vaishali, Bihar",BANSHIDHAR CONSTRUCTION PRIVATE LIMITED,Rejection Letter Granted,EC,
9,120,SIA/BR/MIN/133677/2019,,"Village- Parwalpur, P.S - Bheja (Khasra/Plot(s) No. 536, 260, 429, 380, 430 & 258) soil brick mining project.",M/S MAA JWALAMUKHI INT UDYOG,Delisted,EC,
0,121,SIA/BR/MIN/31023/2019,SIA/1(a)/623/19,"Sand Mining Project at Haripur & Sadashipur Ghat 1 on Son River in district Bhijpur, Bihar",BROADSON COMODITIES PVT LTD,EC Granted,EC,
1,122,SIA/BR/MIN/150196/2020,,ORDINARY CLAY MINING PROJECT FOR BSCPL INFRASTRUCTURE LTD,BSCPL INFRASTRUCTURE LTD MAUZA HARDIYA AREA 10.67 AC,Delisted,EC,
2,123,SIA/BR/MIN/66032/2017,SIA/1(a)/542/18,Sand Mining Project at Mahisona Sand Ghat (Block no-7) on Kiul River.,WESTLINK TRADING PRIVATE LIMITED,Delisted,EC,
3,124,SIA/BR/MIN/147950/2020,,"Brick Earth Mining Project of Area 3.33 Acres or 1.34 Hectare M/S Sanjay Int Udyog at Mauza- Balia, P.O- Sadhupur, P.S- Ashok Paper Mill, Block-Hayaghat, District- Darbhanga, State- Bihar",M/S SANJAY INT UDYOG,Delisted,EC,
4,125,SIA/BR/MIN/35799/2019,,"Mauza- Malahi Diyara, P.O + P.S + Block: Barh, District- Patna, State - Bihar",MS PRADHAN BRICKS,Pending at PP due to eds,EC,
5,126,SIA/BR/MIS/251819/2022,SIA/8(a)/1853/2022,Proposed Commercial cum Residential Building “Umeed Nagar Township” by Umeed Builder & Constructor Pvt. Ltd.,UMEED BUILDER & CONSTRUCTOR PVT. LTD.,EC Granted,EC,
6,127,SIA/BR/MIN/66113/2017,SIA/1(a)/593/18,Sand Mining Project at Jaljoga Sand Mining Ghat,WESTLINK TRADING PRIVATE LIMITED,Delisted,EC,
7,128,SIA/BR/MIN/66121/2017,SIA/1(A)/584/18,Sand Mining Project at Panbharwa Sand Ghat on Kiul River,WESTLINK TRADING PRIVATE LIMITED,Delisted,EC,
8,129,SIA/BR/MIN/31133/2015,3497,Brick Clay Mining Project- Raj Int Udyog-B2,RAJ INT UDHYOG,Delisted,EC,
9,130,SIA/BR/MIN/31581/2015,SIA/1(a)/31/2015,Brick Clay Mining Project of M/s Sangam Marka  Bricks,OTHERS,Delisted,EC,
0,131,SIA/BR/NCP/79747/2018,SIA/8(a)/601/18,"EC for Proposed EC for Govt. Dental College and Hospital, Village Paithna, Rahui taluka, Nalanda in Bihar","BIHAR MEDICAL SERVICES & INFRASTRUCTURE CORPORATION LTD.,",EC Granted,EC,
1,132,SIA/BR/MIS/86089/2018,SIA/8(a)/599/18,Dr A P J Abdul Kalam Science City,FLYING ELEPHANT STUDIO,EC Granted,EC,
2,133,SIA/BR/MIN/30328/2015,3441,Brick Clay Mining Project- Balmiki Int Udyog,BALMIKI INT UDYOG,Delisted,EC,
3,134,SIA/BR/MIN/143960/2020,,ORDINARY CLAY MINING PROJECT FOR BSCPL INFRASTRUCTURE LTD,BSCPL INFRASTRUCTURE LTD MAUZA CHHATAUNI AREA 7.87 AC,Delisted,EC,
4,135,SIA/BR/MIN/144018/2020,,ORDINARY CLAY MINING PROJECT FOR BSCPL INFRASTRUCTURE LTD,BSCPL INFRASTRUCTURE LTD MAUZA SANTOKH BISHUNPUR AREA 9.70 AC,Delisted,EC,
5,136,SIA/BR/MIN/34061/2019,,Koriyapatti Sand Ghat on Sursar River,SUJEET KUMAR,Pending at PP due to eds,EC,
6,137,SIA/BR/MIN/200052/2021,,M/s N.K. Int Udyog,N.K. INT UDYOG,Delisted,EC,
7,138,SIA/BR/IND/53470/2020,SIA/5(i)/1028/2020,Smrity Paper Mill Private Limited,SMRITY PAPER MILLS PVT LTD,EC Granted,EC,
8,139,SIA/BR/MIN/34602/2019,,Sugauli & Chand Parsa Balu Ghat on Burhi Gandak River,VINAY  KUMAR,Delisted,EC,
9,140,SIA/BR/MIN/59829/2016,SIA/1(a)/350/16,"THAIBAI (1.8 HA.), KHAUHA (1.3HA.), MANIYA (11.7 HA.)
AND RANADHI (8.3 HA.) GHATS OF BADHUA RIVER
TEHSIL TARAPUR AND SANGRAMPUR
DISTRICT MUNGER, BIHAR
M.L. AREA 23.10 HA.,",NM FOOD PRODUCT PVT LTD,EC Granted,EC,
0,141,SIA/BR/MIN/31505/2015,SIA/1(a)/21/2015,BRICK CLAY MINING - R.K BRICKS- B2,R K BRICKS,Delisted,EC,
1,142,SIA/BR/MIN/133871/2019,,"Bhelwa, P.S - Simraha (Khasra/Plot(s) No. 1067, 1154, 1264, 1265, 1266, 1273, 1316 & 1339) soil brick mining project.",M/S SRI LAXMI ENTERPRISES,Delisted,EC,
2,143,SIA/BR/MIN/136820/2020,,"BRICK EARTH MINING PROJECT FOR M/S. A X BRICKS, MAUZA- BRINDAVAN, THAWE, DISTRICT- GOPALGANJ, AREA- 3.42 Ac, 1.38 Ha","M/S. A X BRICKS, PROP- AMIR ALAM, MAUZA-NASIR CHHAPRA",Delisted,EC,
3,144,SIA/BR/MIN/136832/2020,,M/S S R CHIMNEY UDYOG,M/S S R CHIMNEY UDYOG,Delisted,EC,
4,145,SIA/BR/MIN/167200/2020,,ORDINARY CLAY MINING PROJECT FOR BSCPL INFRASTRUCTURE LTD MAUZA RAHIYAR KAUNCHI,BSCPL INFRASTRUCTURE LTD MAZUA RAHIYAR KUANCHI,Delisted,EC,
5,146,SIA/BR/MIN/66271/2017,SIA/1(a)/588/18,Sand Mining Project at Auraia Sand ghat on Sono River.,WESTLINK TRADING PRIVATE LIMITED,Delisted,EC,
6,147,SIA/BR/MIN/66511/2017,,Sand Mining project at Dinari Sand Ghat on Barnar River,WESTLINK TRADING PRIVATE LIMITED,Delisted,EC,
7,148,SIA/BR/MIN/129442/2019,,"Brick Earth Mining Project of Area 1.51 Hectare Or 3.73 Acre M/s Star Int Bhatta at Vill : Tenua, Mauza- Kurari, P.S- Karamchat Block- Rampur, District- Kaimur, State- Bihar",MS STAR INT BHATTA,Delisted,EC,
8,149,SIA/BR/IND/18621/2016,,Balmukund Concast Ltd,BALMUKUND CONCAST LIMITED,Delisted,EC,
9,150,SIA/BR/MIS/64655/2017,SIA/8(a)/464/17,"Venus Paradise, Residential Building Project by Venus Start Construction Pvt. Ltd.",VENUS STAR CONSTRUCTION PVT LTD,EC Granted,EC,
0,151,SIA/BR/MIN/31188/2019,SIA/1(A)/527/2018,"PROPOSED  NATRAJ  ENGINEERS  PVT.  LTD. STONE  MINING PROJECT AT VILLAGE: BARARI, DISTRICT: SHEKHPURA, STATE BIHAR",NATRAJ ENGINEERS PVT. LTD,EC Granted,EC,
1,152,SIA/BR/MIS/195643/2021,,Commercial cum residential project of Mundeshwari Multicon Pvt. Ltd at Usri Sarari Danapur Patna,MUNDESHWARI MULTICOM PVT. LTD.,Delisted,EC,
2,153,SIA/BR/INFRA2/416750/2023,SIA/8(a)/2310/2023,WINSOME ICON (Commercial Cum Residential Building project of M/s Winsome Realtors),WINSOME REALTORS,EC Granted,EC,
3,154,SIA/BR/MIN/48816/2016,,"Amsari (Dumrao) Ghat (52447.5 TPA), Area
2.59 ha, in District- Buxar (Bihar)",MS KATYAYNI CONTRACTORS PVT LTD,Delisted,EC,
4,155,SIA/BR/MIN/71315/2017,,"Sand Mining project at Kusapi sand Ghat on Buddh River, anchal-Tekari Dist-Gaya Bihar",WESTLINK TRADING PRIVATE LIMITED,Delisted,EC,
5,156,SIA/BR/MIS/226768/2021,SIA/8(a)/1284/2021,Proposed Residential Building “Star Galaxy” by M/s Sai Shree Balajee Homes Pvt. Ltd.,M/S SAI SHREE BALAJEE HOMES PVT. LTD.,EC Granted,EC,
