,Sno.,Proposal No.,File No.,Project Name,Company,Proposal Status,Project Type,View
4,264,SIA/UK/MIN/234607/2021,EC-01(216)/2021,Jirmoli RBM Mining Project,JIRMOLI RBM MINING PROJECT,EC Granted,EC,
5,265,SIA/UK/MIN/45671/2019,EC-1(127)/2019,Chamtoli RBM Project,M/S MAANSAROVAR INTERPRISE,Delisted,EC,
6,266,SIA/UK/MIN/218037/2021,EC-01(177)/2021,"Sand, Bajari and Boulder Mining Project”, Khasra No: 2078 mi,  Area- 1.020 ha out of 5.613 ha at Village- Chapad  , Tehsil- Belaghat , District- Nainital , Uttarakhand",KMVN,EC Granted,EC,
7,267,SIA/UK/IND2/202574/2021,EC-09(78)/2021,"M/S Rapport Remedies at E/7-2, U.P.S.I.D.C., Selaqui, Dehradun, Uttarakhand",THE RAPPORT REMEDIES,EC Granted,EC,
8,268,SIA/UK/IND2/42302/2019,E.C- 05(7)/2019,"Environment Clearance for installation of proposed PU Foam manufacturing Unit and seat assembly M/s S. S. Industries located at Village: Fulsunga, Post Transit Camp, Tehsil Rudrapur, District Udham Si",S S INDUSTRIES,Under examination of SEAC manually process,EC,
9,269,SIA/UK/MIN/174945/2020,EC-01(78)/2019,Parth minerals,PARTH MINERALS,EC Granted,EC,
10,270,SIA/UK/MIN/63375/2021,EC-01(166)/2021,"Proposed Khuldoari Baldoari Soapstone Mine (Area: 12.579 ha) at Village Khuldoari Baldoari, Tehsil & District:Bageshwar, Uttarakhand by M/s Uttarakhand Mine Minerals",MS UTTARAKHAND MINE MINERALS,EC Granted,EC,
1,271,SIA/UK/MIS/211926/2021,EC-08(40)/2021,Hotel Project,RAJ KUMAR MITTAL,EC Granted,EC,
2,272,SIA/UK/MIN/39252/2019,E.C- 01(102)/2019,Jaula RBM Project,JAULA RBM PROJECT,Under examination of SEAC manually process,EC,
3,273,SIA/UK/MIS/203797/2021,EC-08(34)/2021,AHILYA & RESORTS,M/S AHILYA HOTEL & RESORT,EC Granted,EC,
4,274,SIA/UK/MIN/235155/2021,,"Environment Clearance for expansion of M/s. Valley Hotel & Resorts project in Central Hope Town, Selaqui Industrial Area, Dehradun",VALLEY HOTEL & RESORT,Delisted,EC,
5,275,SIA/UK/MIS/267602/2022,,Lakshmi Constructions Co.  Ltd,SACHIN TYAGI,Pending at PP due to eds,EC,
6,276,SIA/UK/INFRA2/429564/2023,EC-08(27)/2023,ORIONS HOSPITALITY,RASHMI GARG,EC Granted,EC,
7,277,SIA/UK/MIN/48976/2016,E.C- 1(816)/2016,Pukhrora Soapstone Mine,PUKHRORA SOAPSTONE MINE,EC  has been Granted Manually,EC,
8,278,SIA/UK/MIN/89094/2018,E.C   -1(34)/2019,"Teekh Soap Stone Deposit (Khasra no. 2887, 2888, 3140 and others)",SMT. RAJANI SHAHI,Under examination of SEAC manually process,EC,
9,279,SIA/UK/NCP/60489/2016,,"Environmental Clearance for Proposed 
Aam Wala Tarla Group Housing Project (LIG, MIG, HIG & EWS)” 
located at Khasra No. 102 JHA, Village: Aam Wala Tarala, Teh: Dehradun, Dist.: Dehradun",MUSSORIE DEHRADUN DEVELOPMENT AUTHORITY,Delisted,EC,
10,280,SIA/UK/MIN/411066/2022,EC-01(43)/2023,Sasola Soapstone Mining Project,ASHOK PAL,EC Granted,EC,
1,281,SIA/UK/INFRA2/410800/2022,EC-08(15)/2023,Hotel Terrakotta Risikesh,SURBHI SHOREWALA,EC Granted,EC,
2,282,SIA/UK/MIN/33577/2015,1-(784)/2015,Amba Mines & Minerals,AMBA MINES MINERALS,EC  has been Granted Manually,EC,
3,283,SIA/UK/MIN/50410/2016,"E.C No- 933 -1-(856)/2016
Dated- 3.3.2016","Environmental Clearance for Proposed
Extraction / Collection of Minor Minerals i.e. Sand, Bajri & Boulders from near
Mandakini River Bed (ML Area 1.291 Hectare) at Village – Giwari Gaon
(Parkandi), Tehsil Ukhimath, District Rudraprayag Uttarakhand",MAHAVIR SINGH RAWAT,EC  has been Granted Manually,EC,
4,284,SIA/UK/MIN/66223/2020,EC-01(154)/2021,"Mining of Minor Minerals (Sand, Bajri and Boulder) from the riverbed of Jakhan-1 by M/s Uttarakhand Forest Development Corporation",M/S UTTARAKHAND FOREST DEVELOPMENT CORPORATION,EC Granted,EC,
5,285,SIA/UK/IND/217945/2021,EC-03(04)/2021,"M/s Uttaranchal Ispat (P) Limited at Plot Nos. D-1 to D-8, Pipalia Industrial Area, Village Jagannathpur, Bazpur, District Udham Singh Nagar, Uttarakhand.",M/S UTTARANCHAL ISPAT PVT LTD.,Delisted,EC,
6,286,SIA/UK/MIN/31091/2015,E.C 1-(754)/2015,"Badeu Boulder Mining Project, Pithoragarh",ECON LABORATORY AND CONSULTANCY,EC  has been Granted Manually,EC,
7,287,SIA/UK/MIN/89232/2018,E.C   -1(48)/2019,"Ukroli Sand, Bajri & Boulders Mine, 1.959 Ha",PRIYA AGARWAL,Under examination of SEAC manually process,EC,
8,288,SIA/UK/INFRA2/416228/2023,F.No.-09(24)/2023,"Environment Clearance of proposed stone crusher, screening plant ,Mobile Stone Crusher , mobile screening plant , hot mix plant ready mix plant at Khasra no. 112,75,78,113 Village Center hop town , Tehsil – Vikasnagar, District – Dehradun (Uttarakhand). By AISHA TRADERS (Annexure – I).",AISHA TRADERS,For further consideration(SEAC),EC,
9,289,SIA/UK/IND/64351/2017,,"Manufacturing of Pharmaceutical Formulations (Tablets, Capsules & Oral Liquid Syrup) by Dr. Mittal Laboratories Pvt. Ltd. at Plot No. C-10/2, SARA Industrial Estate Ltd., Village Rampur, Dehradun - Chakrata Road, Selaqui, Dehradun, Uttrakhand",DR MITTAL LABORATORIES PVT LTD,Delisted,EC,
10,290,SIA/UK/MIN/50177/2016,"E.C No- 903-1-(855)/2016
Dated- 1.3.2016",Excavation of Brick Earth,JAMANAIENT UDYOG,EC  has been Granted Manually,EC,
1,291,SIA/UK/MIN/143519/2020,EC- 1(140)/2020,"Mining of Sand, Bajri & Boulder (Minor Minerals) from river bed of Swarna river.",UKFDC,EC Granted,EC,
2,292,SIA/UK/MIN/68837/2020,EC-01(151)/2020,"Kukhai Talli/Malli Limestone Mining Project located at  Village- Kukhai Talli/Malli, Tehsil- Narendranagar, District- Tehri Garhwal, Uttarakhand by Shri Anil Kumar, S/o Shri Satya Prakash",ANIL KUMAR GUPTA,EC Granted,EC,
3,293,SIA/UK/IND2/205739/2021,EC-05(22)/2021,"Environmental Clearance for Proposed API Bulk Drugs & Intermediates Manufacturing Unit by M/s Jams Industries Private Limited at Khasra No. 163/3, 164, 165, Village – Sikandarpur Bhainswal Industrial Area, Tehsil Bhagwanpur, District –Haridwar, Uttar",M/S JAMS INDUSTRIES PRIVATE LIMITED,EC Granted,EC,
4,294,SIA/UK/INFRA2/403627/2022,EC-09(19)/2023,M/S SATYAM SHIVAM SUNDRAM II,SATYAM SHIVAM SUNDRAM STONE CRUSHER PLANT-II,EC Granted,EC,
5,295,SIA/UK/IND3/420319/2023,EC-09(32)/2023,Octis Healthcare Pvt. Ltd.,VAREESH KUMAR,Rejected by SEAC,EC,
6,296,SIA/UK/MIN/9561/2013,,Kanhapur Laifpur Malakpur Sand Mining Project,M/s Grahwal Mandal Vikas Nigam Ltd.,Under examination of SEIAA,EC,
7,297,SIA/UK/IND3/435787/2023,EC-09(69)/2023,VISHAL DARPAN,YOGESH KUMAR,EC Granted,EC,
8,298,SIA/UK/INFRA2/416822/2023,EC-09(28)/2023,Ashirwad Enterprises and Screening Plant,MS ASHIRWAD ENTERPRISES AND SCREENING PLANT,EC Granted,EC,
9,299,SIA/UK/MIN/89342/2018,E.C   -1(46)/2019,"Gair Saneti Soapstone mining project, lease area 4.449 ha, near Village Gair Saneti, Thadaizar and Kurauli Tehsil Dung Nakuri, District – Bageshwar State-Uttarakhand with production capacity of 5,000 TPA soap Stone & 25,444 m3 OB/waste",M/S UTTRAKHAND TALC PRIVATE LIMITED,Under examination of SEAC manually process,EC,
10,300,SIA/UK/INFRA2/449772/2023,EC-09(86)/2023,"Environmental Clearance for Proposed Pharmaceutical Formulation Unit by M/s Verve Human Care Laboratories (A unit of Venor Pharma Limited) at Plot No. H-7 & H-8 IIE SIIDCUL, Selaqui, Dehradun, Uttarakhand",VENOR PHARMA LIMITED,EC Granted,EC,
1,301,SIA/UK/MIS/288132/2022,EC-08(28)/2023,Proposed Construction of Hotel “Hotel Holy Vivasa”(M/s Shivalik Tower),DINESH KOTHARI,For further consideration(SEAC),EC,
2,302,SIA/UK/MIN/189019/2020,EC-1(155)/2020,"Extraction of Sand/Bajri/Boulder at Khasra No- 226g & 263j, area- 0.9240 ha,   at Village - Nehandpur, Pargana – Jwalapur,Tehsil- Laksar, District- Haridwar, Uttarakhand",GURU KRIPA TRADERS,EC Granted,EC,
3,303,SIA/UK/MIN/58696/2020,EC-1(136)/2020,"Sand/Bajri/Boulder at Khasra No- 657/3 Village - Banjarewala Grant, Tehsil- Bhagwanpur, District- Haridwar (Area- 15.0 ha))",BANJAREWALA GRANT RBM PROJECT,EC Granted,EC,
4,304,SIA/UK/MIS/236383/2021,EC-08(51)/2021,"Environmental Clearance for the Proposed expansion of Group Housing Project by M/s Bridge View Estate located at New Khasra No. 124 (Old Khasra No. 231, 232, 233, 234 & 114Kha), Muza Kandoli, Pargana Parwa Doon, Dehradun, Uttarakhand",M/S BRIDGE VIEW ESTATE,EC Granted,EC,
5,305,SIA/UK/MIN/46343/2019,E.C- 01(129)/2019,M/S BADRISH SWAYATT SAHKARITA SAMITI,M/S BADRISH SWAYATT SAHKARITA SAMITI,EC Granted,EC,
6,306,SIA/UK/MIN/39444/2019,E.C- 01(110)/2019,RBM Project,NAGARSAL R RBM PROJECTS,Under examination of SEAC manually process,EC,
7,307,SIA/UK/IND2/192986/2021,EC-9(69)/2021,Proposed Craft Beer Fermentation Unit,M/S GOPHER VENTURES PVT. LTD,EC Granted,EC,
8,308,SIA/UK/MIN/167167/2020,EC-1(157)/2021,Saroda RBM Project,BIRENDRA SINGH,EC Granted,EC,
9,309,SIA/UK/IND3/83123/2022,EC-09(58)/2023,UNI MEDICO LABS,UNI MEDICOLABS,Under examination of SEAC,EC,
10,310,SIA/UK/MIN/50443/2016,"E.C No- 901-1-(863)/2016
Dated- 1.3.2016","Environmental Clearance for the Proposed Digging / Excavation of Minor Minerals i.e. “Brick Earth” for Brick manufacturing from lease area of Village Pipaliya (1.405 Hectare) by M/s Shaan Brick Field, Village – Pipliya No.1, Mahtosh mor, Tehsil – Gad",SHAAN BRICK FIELD,EC  has been Granted Manually,EC,
1,311,SIA/UK/INFRA2/415823/2023,,"Environmental Clearance for the Proposed EWS Housing under Pradhan Mantri Awasiya Yojana by M/s Debikay Systems Private Limited located at Khasra No. 66 & 68/2, Village Beldi, Tehsil Roorkee, District Haridwar, Uttarakhand",DEBIKAY SYSTEMS PRIVATE LIMITED,Request for withdraw,EC,
2,312,SIA/UK/IND2/87687/2018,E.C  -9(04)/2018,"Environmental Clearance for proposed expansion of existing Manufacturing Unit of Appliances i.e. Air Conditioners assembling & Injection Moulding Parts by M/s Amber Enterprises (India) Limited (Unit - 6) at Plot No. A-1/1A, UPSIDC, Industrial Area, S",AMBER ENTERPRISES INDIA LIMITED,Under examination of SEAC manually process,EC,
3,313,SIA/UK/INFRA2/453223/2023,,"CONSTRUCTION OF SATELLITE CENTRE COMPRISING OF 280 BEDDED MULTISPECIALTY HOSPITAL, SR HOSTEL, NURSES HOSTEL,TYPE-4 QTRS, ANCILLARY NON-RESIDENTIAL BUILDINGS E.T.C FOR AIIMS RISHIKESH AT UDHAM SINGH NAGAR ,UTTRAKHAND IN EPC MODE",ALL INDIA INSTITUTE OF MEDICAL SCIENCES RISHIKESH,Under examination of SEIAA,EC,
4,314,SIA/UK/INFRA2/431749/2023,EC-09(62)/2023,Environmental Clearance for Installation of DG Set in LED Bulbs Manufacturing Unit by M/s Dixon Technologies Solutions Private Limited,DIXON TECHNOLOGIES SOLUTIONS PRIVATE LIMITED,EC Granted,EC,
5,315,SIA/UK/MIN/93613/2019,E.C- 1(61)/2019,Jai Singh,JAI SINGH RUDRAPRYAG,Under examination of SEAC manually process,EC,
6,316,SIA/UK/INFRA2/423105/2023,EC-09(37)/2023,Environmental Clearance for short term establishment (Three year Only) of proposed Hot Mix Plant & DG set for construction of NH-72 in the State of Uttarakhand by M/s Ram Kumar Contractor Private Limited,RAM KUMAR CONTRACTOR PRIVATE LIMITED,EC Granted,EC,
7,317,SIA/UK/IND1/420826/2023,,M/s Brij Bihari Concast Private Limited,SANJEEV AGARWAL,Request for withdraw,EC,
8,318,SIA/UK/MIN/9565/2013,,Handul Ukhlet Sand & Boulder Mining Project,M/s Grahwal Mandal Vikas Nigam Ltd.,Rejected - Processed offline,EC,
9,319,SIA/UK/NCP/150734/2020,E.C- 09(59)/2020,"Environment Clearance for Proposed Installation of Hot Mix Plant at Khata No. 00865, Khasra No. 287 Ka, Khata No. 00703, Khasra No. 287 Kha, Khata No. 00121, Khasra No. 287 Ga, Khata No. 00996, Khasra",M/S R. K. HANDA,EC Granted,EC,
10,320,SIA/UK/MIN/53024/2019,EC-1(64)/2019,"Soapstone mining at Village- Jagthali-Bajeena, Tehsil- Kanda, District- Bageshwar, Uttarakhand by Sri. Harish Chandra Kandpal & Sri Kailash Chandra Bhatt",JAGTHALI-BAJEENA SOAPSTONE MINING,EC Granted,EC,
1,321,SIA/UK/MIN/52982/2018,EC-1(42)/2018,"Soapstone mining at Village: Biladi, Tehsil: Bageshwar, District- Bageshwar by M/s Shiv Shakti Mines and Minerals",SHIV SHAKTI,EC Granted,EC,
2,322,SIA/UK/MIN/137386/2020,E.C- 01(134)/2020,Quartzite Boulders Mine For Song Dam Project,"INFRASTRUCTURE (REHAB)DIVISION RISHIKESH, DEHRADUN",Request for withdraw,EC,
3,323,SIA/UK/MIS/211924/2021,EC-08(39)/2021,Ms Ajanta Motel Pvt Ltd,AJANTA MOTEL PVT LTD,EC Granted,EC,
4,324,SIA/UK/NCP/105902/2019,E.C- 9(33)/2019,"Environment Clearance for the Proposed Installation of DG Set and enhancement of Manpower in existing Assembling Unit of Roof Mounted Air Conditioner, Electric Panel, Heat Convectors and Water Cooler",INTEC CORPORATION,Under examination of SEAC manually process,EC,
5,325,SIA/UK/MIN/221111/2021,EC-01(187)/2021,Gobra Sand bajri Boulder Mining Project,SHRI MANMEET SINGH,EC Granted,EC,
6,326,SIA/UK/MIN/415043/2023,EC-01(181)2021,"Sand Bajri & Boulder (Minor-Mineral) mining on the bed of Alkhnanda River, Khasra No: 2152 to 2154, 2196, 2899 to 2914, 3003 to 3005, 3316, 3435  Area - 9.72 ha Village- Naithana, Patti- Chauras, Tehsil -Keertinagar District: TehriGarhwal, Uttarakhand",KILKILESHWAR MINING COMPANY,Rejected by SEIAA,EC,
7,327,SIA/UK/NCP/64943/2017,,"""Sikka Hotel Dehradun"" at Plot No. 10, 11, 12 IT Park, Sahastradhara road, Dehradun, Uttarakhand",SIKKA SUPERB SPAZE PVT LTD,Delisted,EC,
8,328,SIA/UK/MIS/82720/2018,E.C  -8(05)/2018,HIMALAYAN RETREAT INDIA LLP,HIMALAYAN RETREAT INDIA LLP,Under examination of SEAC manually process,EC,
9,329,SIA/UK/INFRA2/440236/2023,EC-08(34)/2023,Proposed Expansion of guest room capacity of existing hotel “Competent palace”.,SAKSHAM JUYAL,EC Granted,EC,
10,330,SIA/UK/MIN/78582/2018,-1(02)/2018,"Bhardwari, Gol, Pokhri Soapstone Mine",MS K S MINERALS,Under examination of SEAC manually process,EC,
1,331,SIA/UK/IND2/87692/2018,,"nvironmental Clearance for proposed expansion of existing project for installation of additional Phosphating & Surface coating, DG set and production line by M/s Amber Enterprises India Limited (Unit - IV)",AMBER ENTERPRISES INDIA LIMITED,Delisted,EC,
2,332,SIA/UK/INFRA2/423102/2023,EC-09(38)/2023,"Environmental Clearance for proposed manufacturing unit of finished soles by M/S Mochiko Shoes Private Limited (Unit V) at Khasra No. 3862, 3863, 3865 and 3958, Village- Lal Tappar Industrial Area, Tehsil Rishikesh, District Dehradun, Uttarakhand.",MOCHIKO SHOES PRIVATE LIMITED,EC Granted,EC,
3,333,SIA/UK/INFRA2/427133/2023,01(24)/2023,Construction of (2B+G+8 floor) Integrated office complex Green Building at Dehradun (Uttarakhand),Central Public Works Department,EC Granted,EC,
4,334,SIA/UK/IND2/86528/2018,E.C  -9(07)/2018,"Environment Clearance of the proposed unit for
assembling of Bicycles, Tricycles and Health
Equipment’s",AMPA CYCLES PVT LTD,Under examination of SEAC manually process,EC,
5,335,SIA/UK/MIN/89251/2018,E.C   -1(51)/2019,"Maholi Soapstone mining project khasra nos.- 11,12,13 and others, lease area 2.469 ha",SHRI SURENDRA SINGH BHORYAL,Under examination of SEAC manually process,EC,
6,336,SIA/UK/MIN/433972/2023,EC-01(45)/2023,Reappraisal of DEIAA EC Sawaar Soapstone Mining Lease,BHUWAN UPADHYAY,For further consideration(SEAC),EC,
7,337,SIA/UK/MIN/440754/2023,EC-01(02)/2022,"Proposed Soapstone Mine (Area 8.529 ha) at Village- Khatigaon & Rangdev, Tehsil & District-Bageshwar, Uttarakhand by Shri Deewan Singh Papola",DIWAN PAPOLA,EC Granted,EC,
8,338,SIA/UK/INFRA2/416230/2023,EC-09(22)/2023,"Environmental Clearance for proposed establishment of 200 TPH Stone Crusher Plant along with DG set by M/s Pachwadun Stone Crusher at Khasra No. 283 Ka, 284 Ka & 285, Village Kainchiwala, Abdullapur, Sahaspur, Tehsil Vikasnagar, District Dehradun, Uttarakhand (Plant Area – 1.0253 Hectare)",PACHWADUN STONE CRUSHER,EC Granted,EC,
9,339,SIA/UK/MIN/89267/2018,E.C   -1(52)/2019,"Surkaligaon Soapstone mining project khasra nos.- 127,128,130 and others, lease area 2.022 ha",SHRI MANOJ KUMAR SHAH,Under examination of SEAC manually process,EC,
10,340,SIA/UK/MIN/30719/2015,1-(751)/2015,Northern India Drug Company,HB CORPORATION,EC  has been Granted Manually,EC,
1,341,SIA/UK/THE/413475/2023,EC-09(20)/2023,"Environmental clearance for proposed expansion of footwear pair manufacturing unit by M/s Campus Activewear Limited at Plot No. C9 & 10, Industrial Area Selaqui, Vikasnagar, Dehradun, Uttrakhand.",CAMPUS ACTIVEWEAR LIMITED,EC Granted,EC,
2,342,SIA/UK/MIN/50445/2016,0,"Environmental Clearance for the Proposed Digging / Excavation of Minor Minerals i.e. “Brick Earth” for Brick manufacturing from lease area of Village Naqibpur urf Ghosipura, Pargana Manglaur (0.963 Hectare) by M/s Doab Bhatta Company",DOAB BHATTA COMPANY,EC  has been Granted Manually,EC,
3,343,SIA/UK/MIN/90178/2018,E.C   -1(36)/2019,M/s Sai Mines and Minerals,SAI MINES AND MINERALS,Under examination of SEAC manually process,EC,
4,344,SIA/UK/MIS/84441/2018,E.C  -9(13)/2018,DPM Hyundai ( A Unit of Patricia holdings Pvt. Ltd.),DPM HYUNDAI,EC Granted - Processed offline,EC,
5,345,SIA/UK/MIN/31692/2015,1-(755)/2015,Baikori Soapstone mine,BAIKORI SOAPSTONE MINE,EC  has been Granted Manually,EC,
6,346,SIA/UK/MIN/31655/2015,1_(770)/2015,River Bed Mining,RIVER BED MINING PROJECT,EC  has been Granted Manually,EC,
7,347,SIA/UK/MIN/446761/2023,EC-01(204)/2021,"Proposed Soapstone mining project (Mining lease Area 2.480 Ha) located at Village: Udiyar, Tehsil: Dugnakuri, District: Bageshwar, State : Uttarakhand by Shri Rajendra Singh S/o Shri Madho Singh",UDIYAR SOAPSTONE MINING PROJECT,EC Granted,EC,
8,348,SIA/UK/MIN/32168/2015,1-(775)/2015,"Extraction /
Collection of Soapstone (Existing Mine) from Uneven Agricultural land (4.049
Hectare) at Village: Dhunga Patli, Tehsil & District – Bageshwar, Uttarakhand.",SUBODH LAL SAH,EC  has been Granted Manually,EC,
9,349,SIA/UK/MIS/82633/2018,E.C  -8(06)/2018,"VALLEY HOTEL & RESORT

NH 72, Central Hope Town, 
Selaqui Industrial Area, 
DEHRA DUN - UTTARKHAND",VALLEY HOTEL & RESORTS,Under examination of SEAC,EC,
10,350,SIA/UK/MIS/42980/2016,E.C- 8(56)/2016,Nilaya Hills Heights,NILAYA HILLS HEIGHTS,Under examination of SEAC,EC,
1,351,SIA/UK/MIN/66237/2017,dgdg,"Proposed Soapstone mining Project, Khasra No. 60, 61, 63, Area: 11.1830Ha, Near Village: Pranmati, Tehsil: Ghat, District: Chamoli, State: Uttarakhand. Applicant: M/s Golcha, Minerals Private Limited.",MS GOLCHA MINERALS PRIVATE LIMITED,Under examination of SEAC,EC,
2,352,SIA/UK/INFRA2/426075/2023,EC-08(20)/2023,Shri Mahant Indresh Cancer Hospital and  research center,SHRI GURU RAM RAI EDUCATION MISSION MANAGING COMMITTEE,EC Granted,EC,
3,353,SIA/UK/IND2/436345/2023,,M/S VK AGGARWAL,V K AGGARWAL,Under examination of SEIAA,EC,
4,354,SIA/UK/MIS/290275/2022,F.No.- 08(11)/2023,CHOICE INN AND MOTELS PVT. LTD.,CHOICE INNS AND MOTELS PRIVATE LIMITED,EC Granted,EC,
5,355,SIA/UK/MIN/83478/2018,E.C  -1(15)/2018,"Proposed Soapstone Mining Project, Khasra No60, 61, 63, Area: 11.1830Hect., Production: 30014 TPA,  Near Village: Pranmati, Tehsil: Ghat, District: Chamoli, State: Uttarakhand of Applicant: M/s Golcha Minerals Pvt. Ltd",MS GOLCHA MINERALS PRIVATE LIMITED,EC Granted - Processed offline,EC,
6,356,SIA/UK/IND2/41568/2016,E.C- 9(61)/2016,Ethereal Aromatics,BAL KRISHNA,EC  has been Granted Manually,EC,
7,357,SIA/UK/INFRA2/439407/2023,EC-08(23)/2023,Environmental Clearance of Existing Group Housing project “Park Belles” along with Proposed Commercial Cum Residential Tower under Violation by M/s Sara Eminent.,SARA EMINENT,EC Granted,EC,
8,358,SIA/UK/MIN/31673/2015,1_(771)/2015,Gulam Soapstone Mine,GULAM PARGARH SOAPSTONE,EC  has been Granted Manually,EC,
9,359,SIA/UK/MIN/47938/2016,E.C- 1(803)/2016,Excavation of Brick Earth,BHAGWATI BRICK FIELD,EC  has been Granted Manually,EC,
10,360,SIA/UK/CMIN/42997/2016,E.C- 1(848)/2016,Brick Earth,BHAGWATI IENT UDYOG,Under examination of SEAC,EC,
1,361,SIA/UK/MIN/50445/2016,0,"Environmental Clearance for the Proposed Digging / Excavation of Minor Minerals i.e. “Brick Earth” for Brick manufacturing from lease area of Village Naqibpur urf Ghosipura, Pargana Manglaur (0.963 Hectare) by M/s Doab Bhatta Company",DOAB BHATTA COMPANY,EC  has been Granted Manually,EC,
2,362,SIA/UK/MIN/90178/2018,E.C   -1(36)/2019,M/s Sai Mines and Minerals,SAI MINES AND MINERALS,Under examination of SEAC manually process,EC,
3,363,SIA/UK/MIS/84441/2018,E.C  -9(13)/2018,DPM Hyundai ( A Unit of Patricia holdings Pvt. Ltd.),DPM HYUNDAI,EC Granted - Processed offline,EC,
4,364,SIA/UK/MIN/31692/2015,1-(755)/2015,Baikori Soapstone mine,BAIKORI SOAPSTONE MINE,EC  has been Granted Manually,EC,
5,365,SIA/UK/MIN/31655/2015,1_(770)/2015,River Bed Mining,RIVER BED MINING PROJECT,EC  has been Granted Manually,EC,
6,366,SIA/UK/MIN/446761/2023,EC-01(204)/2021,"Proposed Soapstone mining project (Mining lease Area 2.480 Ha) located at Village: Udiyar, Tehsil: Dugnakuri, District: Bageshwar, State : Uttarakhand by Shri Rajendra Singh S/o Shri Madho Singh",UDIYAR SOAPSTONE MINING PROJECT,EC Granted,EC,
7,367,SIA/UK/MIN/32168/2015,1-(775)/2015,"Extraction /
Collection of Soapstone (Existing Mine) from Uneven Agricultural land (4.049
Hectare) at Village: Dhunga Patli, Tehsil & District – Bageshwar, Uttarakhand.",SUBODH LAL SAH,EC  has been Granted Manually,EC,
8,368,SIA/UK/MIS/82633/2018,E.C  -8(06)/2018,"VALLEY HOTEL & RESORT

NH 72, Central Hope Town, 
Selaqui Industrial Area, 
DEHRA DUN - UTTARKHAND",VALLEY HOTEL & RESORTS,Under examination of SEAC,EC,
9,369,SIA/UK/MIS/42980/2016,E.C- 8(56)/2016,Nilaya Hills Heights,NILAYA HILLS HEIGHTS,Under examination of SEAC,EC,
10,370,SIA/UK/MIN/9562/2013,,Naugaon Sand & Boulder Mining Project,M/s Grahwal Mandal Vikas Nigam Ltd.,Under examination of SEIAA,EC,
1,371,SIA/UK/INFRA2/427133/2023,01(24)/2023,Construction of (2B+G+8 floor) Integrated office complex Green Building at Dehradun (Uttarakhand),Central Public Works Department,EC Granted,EC,
2,372,SIA/UK/IND2/86528/2018,E.C  -9(07)/2018,"Environment Clearance of the proposed unit for
assembling of Bicycles, Tricycles and Health
Equipment’s",AMPA CYCLES PVT LTD,Under examination of SEAC manually process,EC,
3,373,SIA/UK/MIN/89251/2018,E.C   -1(51)/2019,"Maholi Soapstone mining project khasra nos.- 11,12,13 and others, lease area 2.469 ha",SHRI SURENDRA SINGH BHORYAL,Under examination of SEAC manually process,EC,
4,374,SIA/UK/MIS/48373/2016,E.C- 8(62)/2016,Mohamed Ilyas,MOHAMED ILYAS AND MS ALAMZAHAN,Delisted,EC,
5,375,SIA/UK/MIN/31572/2015,1_(756)/2015,"Proposed
Extraction / Collection of Minor Minerals i.e. Sand/ Bajri /Boulder from own
Barren Land for Construction of Fish Pond (Total Area – 1.962 Hectare) at Village
– Musahibpur Majri, Block–Jwalapur, Tehsil – Laksar, District -Haridwar,
Uttar",FIROZ,EC  has been Granted Manually,EC,
6,376,SIA/UK/MIN/437157/2023,EC-01(202)/2021,"Meravarana Sand, Bajri & Boulder Mining Project on Kailash River, Khasra No. 38 & 41",RAJESH SHARMA,EC Granted,EC,
7,377,SIA/UK/MIN/58881/2016,,"Extraction/Collection of Minor Mineral from Darer River Bed by M/s UKFDC, Dehradun",UKFDC,Delisted,EC,
8,378,SIA/UK/MIN/77861/2018,-1(01)/2018,"“SOAPSTONE MINING” 
AREA- 12.94 Ha, AT VILLAGE- TOLI PATTI, 
TEHSIL- DHARCHULA, DISTRICT- PITHORAGARH, 
STATE- UTTARAKHAND",DEVKI DEVI PANDEY,Under examination of SEAC manually process,EC,
9,379,SIA/UK/NCP/90567/2019,E.C- 8(12)/2019,Govt. Medical College,DIRECTOR MEDICAL EDUCATION,Under examination of SEAC manually process,EC,
10,380,SIA/UK/MIS/59414/2016,,"JURS COUNTRY
The Vardhman Developers 
Village- Jwalapur District- Haridwar.",EKO PRO ENGINEERS PVT LTD,Delisted,EC,
1,381,SIA/UK/NCP/150734/2020,E.C- 09(59)/2020,"Environment Clearance for Proposed Installation of Hot Mix Plant at Khata No. 00865, Khasra No. 287 Ka, Khata No. 00703, Khasra No. 287 Kha, Khata No. 00121, Khasra No. 287 Ga, Khata No. 00996, Khasra",M/S R. K. HANDA,EC Granted,EC,
2,382,SIA/UK/MIN/53024/2019,EC-1(64)/2019,"Soapstone mining at Village- Jagthali-Bajeena, Tehsil- Kanda, District- Bageshwar, Uttarakhand by Sri. Harish Chandra Kandpal & Sri Kailash Chandra Bhatt",JAGTHALI-BAJEENA SOAPSTONE MINING,EC Granted,EC,
3,383,SIA/UK/MIN/60705/2019,EC-1(96)/2019,Naugoan Soapstone Mine,SANDEEP SAH,EC Granted,EC,
4,384,SIA/UK/MIS/200755/2021,EC-09(75)/2021,Rennita Motors,RENNITA MOTORS,EC Granted,EC,
5,385,SIA/UK/IND/216512/2021,EC-03(02)/2021,"M/s Shree Vasu Steels (P) Limited Unit II Khasra no. 375, 376 & 377 Village Mudiyalki, Pargana & Tehsil Roorkee, District Haridwar, Uttarakhand",MS SHREE VASU STEELS PVT LTD UNIT II,Delisted,EC,
6,386,SIA/UK/NCP/202742/2021,E.C- 09(80)/2021,"Environmental clearance for Screening Plant of Limestone/Dolomite Chips and Powder by M/s Ridhi Enterprises at Khasra No. 3846, 3847 & 3848, Industrial Area, Village Lal Tappad, Tehsil – Doiwala, District – Dehradun, Uttarakhand",M/S RIDHI ENTERPRISES,Delisted,EC,
7,387,SIA/UK/NCP/97873/2019,EC- 9(26)/2019,Environment Clearance for installation of DG Set and Enhancement of Man power along with painting facility for Passenger Motor Car Service Centre in the existing complex by M/s Oberai Motors located a,OBERAI MOTORS,Under examination of SEAC manually process,EC,
8,388,SIA/UK/NCP/139085/2020,E.C - 09(53)/2020,"Environmental Clearance for Proposed PET Plastic Recycling Facility to Manufacture PET Flakes & PET Straps at Khasra No. 1045, 1047 & 1048, Village- Koal, Pargana & Tehsil– Narendar Nagar, District– T",BEYOND CLEAN SOLUTION PRIVATE LIMITED,EC Granted,EC,
9,389,SIA/UK/MIS/39302/2012,EC-08(24)/2020,"M/s Windlass Developer Private Limited has proposed to develop “Township project”  at Village – Harrawala, Kuanwala & Balawala, District - Dehradun, Uttarakhand",WINDLASS DEVELOPERS PRIVATE LIMITED,EC Granted,EC,
10,390,SIA/UK/IND2/175420/2020,EC-5(19)/2020,Environmental Clearance for Proposed API Bulk Drugs & Intermediates Manufacturing Unit by M/s. Nueve Healthcare,M/S NUEVE HEALTHCARE,EC Granted,EC,
1,391,SIA/UK/MIN/50444/2016,"E.C No-902-1-(859)/2016
Dated- 1.3.2016","Environmental Clearance for the Proposed Digging / Excavation of Minor Minerals i.e. “Brick Earth” for Brick manufacturing from lease area of Village Haldi (3.431 Hectare) by M/s Gurunanak Brick Field, Village Haldi, Tehsil Khatima, District, Udham S",GURUNANAK BRICK FIELD,EC  has been Granted Manually,EC,
2,392,SIA/UK/MIN/90410/2019,E.C- 1(13)/2018,Govind Singh Rautela,DEHRADUN,Under examination of SEAC,EC,
