,Proposal.No.,File_No,Proposal Name,State,District,Tehsil,Date_1,Date_2,Category,Company,Status,Link,Timeline
316,SIA/WB/IND2/44360/2016,EN/T-II-1/010/2020,"Proposed 200 KLPD Grain Based Distillery along with 5.0 MW Co-Generation Power Plant at Village Jorsha & Teghoria, Tehsil Mejhia, District Bankura (West Bengal) by Ankoor Distilleries Private Limited",West Bengal,Bankura,Mejhia,Date of Submission for TOR: ,Date of Submission for EC: 12 Mar 2020 ,Industrial Projects - 2,ANKOOR DISTILLERIES PRIVATE LIMITED,Delisted,https://environmentclearance.nic.in/TrackState_proposal.aspx?type=EC&status=EC_new&statename=West%20Bengal&pno=SIA/WB/IND2/44360/2016&pid=68475,https://environmentclearance.nic.in/timeline.aspx?pid=SIA/WB/IND2/44360/2016&type=EC&ID=68475
317,SIA/WB/MIS/256086/2022,,Residential Complex,West Bengal,South 24 Parganas,Bishnupur - II,Date of Submission for TOR: ,Date of Submission for EC: 17 Aug 2022 ,INFRA-2, NEW AGE NIRMAN LLP,WithdrawEC,https://environmentclearance.nic.in/TrackState_proposal.aspx?type=EC&status=EC_new&statename=West%20Bengal&pno=SIA/WB/MIS/256086/2022&pid=199060,https://environmentclearance.nic.in/timeline.aspx?pid=SIA/WB/MIS/256086/2022&type=EC&ID=199060
318,SIA/WB/MIN/189940/2020,,M/s Baby Brick Field,West Bengal,Malda,Chanchal - II,Date of Submission for TOR: ,Date of Submission for EC: 06 Jan 2021 ,Non-Coal Mining,M/S BABY BRICK FIELD,Delisted,https://environmentclearance.nic.in/TrackState_proposal.aspx?type=EC&status=EC_new&statename=West%20Bengal&pno=SIA/WB/MIN/189940/2020&pid=152452,https://environmentclearance.nic.in/timeline.aspx?pid=SIA/WB/MIN/189940/2020&type=EC&ID=152452
319,SIA/WB/MIN/265310/2022,,Bataliguri Sand Mine,West Bengal,Darjeeling,Matigara,Date of Submission for TOR: ,Date of Submission for EC: 31 Mar 2022 ,Non-Coal Mining,RINA DUTTA,Delisted,https://environmentclearance.nic.in/TrackState_proposal.aspx?type=EC&status=EC_new&statename=West%20Bengal&pno=SIA/WB/MIN/265310/2022&pid=201473,https://environmentclearance.nic.in/timeline.aspx?pid=SIA/WB/MIN/265310/2022&type=EC&ID=201473
320,SIA/WB/MIN/265318/2022,,Gopiballavpur - II Sand Block MGB - 34 of Animesh Senapati.,West Bengal,Jhargram,Binpur - II,Date of Submission for TOR: ,Date of Submission for EC: 31 Mar 2022 ,Non-Coal Mining,ANIMESH SENAPATI,Delisted,https://environmentclearance.nic.in/TrackState_proposal.aspx?type=EC&status=EC_new&statename=West%20Bengal&pno=SIA/WB/MIN/265318/2022&pid=201476,https://environmentclearance.nic.in/timeline.aspx?pid=SIA/WB/MIN/265318/2022&type=EC&ID=201476
321,SIA/WB/IND3/69003/2021,EN/T-II-1/167/2021,"Expansion of Polymer Grade Product by M/s. Sika India Pvt. Limited at Plot No. F2/1, Vidyasagar Industrial Park, Kharagpur, West Medinipur, West Bengal",West Bengal,West Medinipur,Kharagpur - I,Date of Submission for TOR: ,Date of Submission for EC: 23 Jul 2022 ,Industrial Projects - 3,SIKA INDIA PVT LTD,ADS by SEIAA,https://environmentclearance.nic.in/TrackState_proposal.aspx?type=EC&status=EC_new&statename=West%20Bengal&pno=SIA/WB/IND3/69003/2021&pid=201480,https://environmentclearance.nic.in/timeline.aspx?pid=SIA/WB/IND3/69003/2021&type=EC&ID=201480
322,SIA/WB/MIN/264975/2022,EN/T-II-1/099/2023,Tashuli Sand Mine,West Bengal,Bankura,Patrasayer,Date of Submission for TOR: ,Date of Submission for EC: 30 Mar 2022 ,Non-Coal Mining,MOLLA ABDUL ODUD,Delisted,https://environmentclearance.nic.in/TrackState_proposal.aspx?type=EC&status=EC_new&statename=West%20Bengal&pno=SIA/WB/MIN/264975/2022&pid=201378,https://environmentclearance.nic.in/timeline.aspx?pid=SIA/WB/MIN/264975/2022&type=EC&ID=201378
323,SIA/WB/MIN/195678/2021,EN/T-II-1/033/2021,"River Bed Sand from the ""Kumari River""",West Bengal,Purulia,Barabazar,Date of Submission for TOR: ,Date of Submission for EC: 30 Jan 2021 ,Non-Coal Mining,M/S SRI UTTAM KUMAR MAHATO,Delisted,https://environmentclearance.nic.in/TrackState_proposal.aspx?type=EC&status=EC_new&statename=West%20Bengal&pno=SIA/WB/MIN/195678/2021&pid=162718,https://environmentclearance.nic.in/timeline.aspx?pid=SIA/WB/MIN/195678/2021&type=EC&ID=162718
324,SIA/WB/MIN/194007/2021,EN/T-II-1/126/2021,DHANTALI SAND MINE,West Bengal,Alipurduar,Kumargram,Date of Submission for TOR: ,Date of Submission for EC: 30 Jul 2021 ,Non-Coal Mining,ATIAR RAHAMAN,Delisted,https://environmentclearance.nic.in/TrackState_proposal.aspx?type=EC&status=EC_new&statename=West%20Bengal&pno=SIA/WB/MIN/194007/2021&pid=160300,https://environmentclearance.nic.in/timeline.aspx?pid=SIA/WB/MIN/194007/2021&type=EC&ID=160300
325,SIA/WB/MIN/415690/2023,EN/T-II-1/044/2023,Indas Sand MIne (MIN_BNK_51),West Bengal,,,Date of Submission for EC: 30 Jan 2023 ,Date of Ec Granted : 10 Mar 2023,Non-Coal Mining,WEST BENGAL MINERAL DEVELOPMENT AND TRADING CORPORATION LIMITED,EC Granted,https://environmentclearance.nic.in/TrackState_proposal.aspx?type=EC&status=EC_new&statename=West%20Bengal&pno=SIA/WB/MIN/415690/2023&pid=215866,https://environmentclearance.nic.in/timeline.aspx?pid=SIA/WB/MIN/415690/2023&type=EC&ID=215866
326,SIA/WB/MIN/411077/2022,EN/T-II-1/118/2022,Becharhat Sand Mine on river Damoder,West Bengal,,,Date of Submission for TOR: ,Date of Submission for EC: 18 Dec 2022 ,Non-Coal Mining,PRASANTA KUMAR HAIT,Request for withdraw,https://environmentclearance.nic.in/TrackState_proposal.aspx?type=EC&status=EC_new&statename=West%20Bengal&pno=SIA/WB/MIN/411077/2022&pid=214051,https://environmentclearance.nic.in/timeline.aspx?pid=SIA/WB/MIN/411077/2022&type=EC&ID=214051
327,SIA/WB/INFRA2/449177/2023,,Proposed Mixed Use Project “Vertical City” by M/s West Bengal Housing Infrastructure Development Corporation Ltd. (WBHIDCO),West Bengal,,,Date of Submission for TOR: ,Date of Submission for EC: 17 Oct 2023 ,INFRA-2, WEST BENGAL HOUSING INFRASTRUCTURE DEVELOPMENT CORPORATION LTD.,Query raised by SEIAA and pending at PP,https://environmentclearance.nic.in/TrackState_proposal.aspx?type=EC&status=EC_new&statename=West%20Bengal&pno=SIA/WB/INFRA2/449177/2023&pid=226953,https://environmentclearance.nic.in/timeline.aspx?pid=SIA/WB/INFRA2/449177/2023&type=EC&ID=226953
328,SIA/WB/MIN/423220/2023,EN/T-II-1/341/2023,MIN_DJ_2 Sand Mine,West Bengal,,,Date of Submission for EC: 25 Mar 2023 ,Date of Ec Granted : 28 Apr 2023,Non-Coal Mining,WEST BENGAL MINERAL DEVELOPMENT AND TRADING CORPORATION LIMITED,EC Granted,https://environmentclearance.nic.in/TrackState_proposal.aspx?type=EC&status=EC_new&statename=West%20Bengal&pno=SIA/WB/MIN/423220/2023&pid=218023,https://environmentclearance.nic.in/timeline.aspx?pid=SIA/WB/MIN/423220/2023&type=EC&ID=218023
329,SIA/WB/MIN/264720/2022,EN/T-II-1/147/2023,PAIKPARI SAND MINE,West Bengal,West Medinipur,Medinipur Sadar,Date of Submission for TOR: ,Date of Submission for EC: 30 Mar 2022 ,Non-Coal Mining,ARIJIT DE,Rejection Letter Granted,https://environmentclearance.nic.in/TrackState_proposal.aspx?type=EC&status=EC_new&statename=West%20Bengal&pno=SIA/WB/MIN/264720/2022&pid=201316,https://environmentclearance.nic.in/timeline.aspx?pid=SIA/WB/MIN/264720/2022&type=EC&ID=201316
330,SIA/WB/MIN/265509/2022,,BOGDUAR SAND MINE,West Bengal,Uttar Dinajpur,Kaliaganj,Date of Submission for TOR: ,Date of Submission for EC: 01 Apr 2022 ,Non-Coal Mining,MRINAL ROY,Under examination of SEIAA ,https://environmentclearance.nic.in/TrackState_proposal.aspx?type=EC&status=EC_new&statename=West%20Bengal&pno=SIA/WB/MIN/265509/2022&pid=201528,https://environmentclearance.nic.in/timeline.aspx?pid=SIA/WB/MIN/265509/2022&type=EC&ID=201528
331,SIA/WB/MIS/288286/2022,The documents have not been uploaded. Please uploa,WOODLANDS MULTISPECIALITY  HOSPITAL,West Bengal,Kolkata,Kolkata,Date of Submission for TOR: ,Date of Submission for EC: 31 Aug 2022 ,INFRA-2,WOODLANDS MULTISPECIALITY HOSPITAL LIMITED,WithdrawEC,https://environmentclearance.nic.in/TrackState_proposal.aspx?type=EC&status=EC_new&statename=West%20Bengal&pno=SIA/WB/MIS/288286/2022&pid=210071,https://environmentclearance.nic.in/timeline.aspx?pid=SIA/WB/MIS/288286/2022&type=EC&ID=210071
332,SIA/WB/MIN/440085/2023,EN/T-II-1/498/2023,Sindebong Khasmahal Sand Mine (MIN_KPG_2),West Bengal,,,Date of Submission for EC: 11 Aug 2023 ,Date of Ec Granted : 01 Dec 2023,Non-Coal Mining,WEST BENGAL MINERAL DEVELOPMENT AND TRADING CORPORATION LIMITED,EC Granted,https://environmentclearance.nic.in/TrackState_proposal.aspx?type=EC&status=EC_new&statename=West%20Bengal&pno=SIA/WB/MIN/440085/2023&pid=223886,https://environmentclearance.nic.in/timeline.aspx?pid=SIA/WB/MIN/440085/2023&type=EC&ID=223886
333,SIA/WB/NCP/87142/2018,EN/T-II-1/011/2019,Commercial cum IT/ITES & Mixed Use Development,West Bengal,South 24 Parganas,Thakurpukur Mahestola,Date of Submission for TOR: ,Date of Submission for EC: 23 Jan 2019 ,INFRA-1,P C CHANDA & COMPANY (P) LIMITED,WithdrawEC,https://environmentclearance.nic.in/TrackState_proposal.aspx?type=EC&status=EC_new&statename=West%20Bengal&pno=SIA/WB/NCP/87142/2018&pid=48892,https://environmentclearance.nic.in/timeline.aspx?pid=SIA/WB/NCP/87142/2018&type=EC&ID=48892
334,SIA/WB/INFRA2/441704/2023,EN/T-II-1/526/2023,"CONSTRUCTION OF PROPOSED CONSTRUCTION OF 3 NOS. G+ONE STORIED BUILDING AT BLOCK A,B,C (BUILDING HEIGHT 22.20 M) UNDER GROUP-D  MERCANTILE IN MC – 9, KOLKATA WEST INTERNATIONAL CITY, HOWRAH",West Bengal,,,Date of Submission for TOR: ,Date of Submission for EC: 20 Sep 2023 ,INFRA-2, KOLKATA W INT CITY PRIVATE LIMITED,Agenda Uploaded by SEAC,https://environmentclearance.nic.in/TrackState_proposal.aspx?type=EC&status=EC_new&statename=West%20Bengal&pno=SIA/WB/INFRA2/441704/2023&pid=224409,https://environmentclearance.nic.in/timeline.aspx?pid=SIA/WB/INFRA2/441704/2023&type=EC&ID=224409
335,SIA/WB/MIN/183020/2020,EN/T-II-1/048/2020,KATNA SAND MINE OF M/S DEBRAJ ENTERPRISE,West Bengal,Bankura,Vishnupur,Date of Submission for TOR: ,Date of Submission for EC: 11 Nov 2020 ,Non-Coal Mining,KATNA SAND MINE OF M/S DEBRAJ ENTERPRISE,Delisted,https://environmentclearance.nic.in/TrackState_proposal.aspx?type=EC&status=EC_new&statename=West%20Bengal&pno=SIA/WB/MIN/183020/2020&pid=142777,https://environmentclearance.nic.in/timeline.aspx?pid=SIA/WB/MIN/183020/2020&type=EC&ID=142777
336,SIA/WB/MIN/259966/2022,EN/T-II-1/021/2023,Bhattagram sand mine on Silabati River,West Bengal,West Medinipur,Garhbeta,Date of Submission for TOR: ,Date of Submission for EC: 21 Jan 2023 ,Non-Coal Mining,MR. BABLU SARKAR,Rejection Letter Granted,https://environmentclearance.nic.in/TrackState_proposal.aspx?type=EC&status=EC_new&statename=West%20Bengal&pno=SIA/WB/MIN/259966/2022&pid=200060,https://environmentclearance.nic.in/timeline.aspx?pid=SIA/WB/MIN/259966/2022&type=EC&ID=200060
337,SIA/WB/INFRA2/454099/2023,,Environmental Clearance for proposed Expansion of  Residential Complex “Anantmani” ( Previously known as “Mani Imperial”) by  M/s Kolkata Metropolitan Development Authority,West Bengal,,,Date of Submission for TOR: ,Date of Submission for EC: 02 Dec 2023 ,INFRA-2, ABASAN REALTY LLP,Query raised by SEIAA and pending at PP,https://environmentclearance.nic.in/TrackState_proposal.aspx?type=EC&status=EC_new&statename=West%20Bengal&pno=SIA/WB/INFRA2/454099/2023&pid=228924,https://environmentclearance.nic.in/timeline.aspx?pid=SIA/WB/INFRA2/454099/2023&type=EC&ID=228924
338,SIA/WB/IND2/28702/2017,EN/T-II-1/067/2017,CAPACITY EXPANSION OF ULUBERIA LPG PLANT OF BPCL,West Bengal,Howrah,Uluberia - I,Date of Submission for EC: 13 Aug 2018 ,Date of Ec Granted : 16 Nov 2018,Industrial Projects - 2,BHARAT PETROLEUM CORPORATION LIMITED ULUBERIA,EC Granted,https://environmentclearance.nic.in/TrackState_proposal.aspx?type=EC&status=EC_new&statename=West%20Bengal&pno=SIA/WB/IND2/28702/2017&pid=45300,https://environmentclearance.nic.in/timeline.aspx?pid=SIA/WB/IND2/28702/2017&type=EC&ID=45300
339,SIA/WB/IND2/26203/2017,EN/T-II-1/071/2017,INDIAN OIL CORPORATION LTD,West Bengal,West Medinipur,No Data,Date of Submission for EC: 23 May 2018 ,Date of Ec Granted : 02 Aug 2018,Industrial Projects - 2,INDIAN OIL CORPORATION LTD KHARAGPUR LPG BOTTLING PLANT,EC Granted,https://environmentclearance.nic.in/TrackState_proposal.aspx?type=EC&status=EC_new&statename=West%20Bengal&pno=SIA/WB/IND2/26203/2017&pid=44266,https://environmentclearance.nic.in/timeline.aspx?pid=SIA/WB/IND2/26203/2017&type=EC&ID=44266
340,SIA/WB/MIN/57107/2016,,Sand Mining Project,West Bengal,West Medinipur,No Data,Date of Submission for TOR: ,Date of Submission for EC: 30 Nov 2016 ,Non-Coal Mining,KHAGENDRANATH GHOSH,Delisted,https://environmentclearance.nic.in/TrackState_proposal.aspx?type=EC&status=EC_new&statename=West%20Bengal&pno=SIA/WB/MIN/57107/2016&pid=23192,https://environmentclearance.nic.in/timeline.aspx?pid=SIA/WB/MIN/57107/2016&type=EC&ID=23192
341,SIA/WB/INFRA2/420490/2023,,RUBY,West Bengal,,,Date of Submission for TOR: ,Date of Submission for EC: 01 Mar 2023 ,INFRA-2, SHIV NIKETAN LIMITED,Query raised by SEIAA and pending at PP,https://environmentclearance.nic.in/TrackState_proposal.aspx?type=EC&status=EC_new&statename=West%20Bengal&pno=SIA/WB/INFRA2/420490/2023&pid=217112,https://environmentclearance.nic.in/timeline.aspx?pid=SIA/WB/INFRA2/420490/2023&type=EC&ID=217112
342,SIA/WB/NCP/76041/2018,EN/T-II-1/071/2018,"""Hiland Bonochhaya""- Housing Project",West Bengal,Birbhum,Illambazar,Date of Submission for TOR: ,Date of Submission for EC: 31 Aug 2018 ,INFRA-1,HILAND PROJECTS LIMITED,WithdrawEC,https://environmentclearance.nic.in/TrackState_proposal.aspx?type=EC&status=EC_new&statename=West%20Bengal&pno=SIA/WB/NCP/76041/2018&pid=45161,https://environmentclearance.nic.in/timeline.aspx?pid=SIA/WB/NCP/76041/2018&type=EC&ID=45161
343,SIA/WB/MIN/264055/2022,EN/T-II-1/093/2023,JOYHAT SAND MINE,West Bengal,Uttar Dinajpur,Itahar,Date of Submission for TOR: ,Date of Submission for EC: 27 Mar 2022 ,Non-Coal Mining,JOYHAT SAND MINE OF MR. ABAIDUR RAHAMAN,Rejection Letter Granted,https://environmentclearance.nic.in/TrackState_proposal.aspx?type=EC&status=EC_new&statename=West%20Bengal&pno=SIA/WB/MIN/264055/2022&pid=201134,https://environmentclearance.nic.in/timeline.aspx?pid=SIA/WB/MIN/264055/2022&type=EC&ID=201134
344,SIA/WB/MIN/263826/2022,,HIZAL THAKURANIR CHAK SAND MINE,West Bengal,Murshidabad,Kandi,Date of Submission for TOR: ,Date of Submission for EC: 26 Mar 2022 ,Non-Coal Mining,SUDIP DEY,Under examination of SEIAA ,https://environmentclearance.nic.in/TrackState_proposal.aspx?type=EC&status=EC_new&statename=West%20Bengal&pno=SIA/WB/MIN/263826/2022&pid=201067,https://environmentclearance.nic.in/timeline.aspx?pid=SIA/WB/MIN/263826/2022&type=EC&ID=201067
345,SIA/WB/MIN/263178/2022,,Kawakhali 2 sand mine,West Bengal,Jalpaiguri,Matigara,Date of Submission for TOR: ,Date of Submission for EC: 27 Mar 2022 ,Non-Coal Mining,MAHESH GANDHI,WithdrawEC,https://environmentclearance.nic.in/TrackState_proposal.aspx?type=EC&status=EC_new&statename=West%20Bengal&pno=SIA/WB/MIN/263178/2022&pid=200874,https://environmentclearance.nic.in/timeline.aspx?pid=SIA/WB/MIN/263178/2022&type=EC&ID=200874
346,SIA/WB/MIN/263497/2022,,HIJAL SAND MINE,West Bengal,Murshidabad,Kandi,Date of Submission for TOR: ,Date of Submission for EC: 24 Mar 2022 ,Non-Coal Mining,DULAL BISWAS,Under examination of SEIAA ,https://environmentclearance.nic.in/TrackState_proposal.aspx?type=EC&status=EC_new&statename=West%20Bengal&pno=SIA/WB/MIN/263497/2022&pid=200967,https://environmentclearance.nic.in/timeline.aspx?pid=SIA/WB/MIN/263497/2022&type=EC&ID=200967
347,SIA/WB/MIS/52197/2018,EN/T-II-1/107/2018,M/s. RVD Waste Tech Private Limited,West Bengal,Barddhaman,Mangolkote,Date of Submission for EC: 10 Mar 2020 ,Date of Ec Granted : 08 Jan 2021,INFRA-2,M/S. RVD WASTE TECH PVT. LTD.,EC Granted,https://environmentclearance.nic.in/TrackState_proposal.aspx?type=EC&status=EC_new&statename=West%20Bengal&pno=SIA/WB/MIS/52197/2018&pid=95393,https://environmentclearance.nic.in/timeline.aspx?pid=SIA/WB/MIS/52197/2018&type=EC&ID=95393
348,SIA/WB/IND/226566/2021,,Environmental Clearance for Rolling Mill Plant for MS Round / MS Flat production of M/s Bamlia Steel Udyog (P) Ltd. at Village: Dakshin Bansai; P.O: Raghunathpur; P.S: Uttarpara;  Dist.: Hooghly; West Bengal; PIN - 712245,West Bengal,Hooghly,Serampur Uttarpara,Date of Submission for TOR: ,Date of Submission for EC: 28 Aug 2021 ,Industrial Projects - 1,BAMLIA STEEL UDYOG (P) LIMITED,Delisted,https://environmentclearance.nic.in/TrackState_proposal.aspx?type=EC&status=EC_new&statename=West%20Bengal&pno=SIA/WB/IND/226566/2021&pid=190540,https://environmentclearance.nic.in/timeline.aspx?pid=SIA/WB/IND/226566/2021&type=EC&ID=190540
349,SIA/WB/IND/60630/2021,EN/T-II-1/088/2021,"Expansion of production from 36,000TPA with 3x50 TPD Kiln to 58,500 TPA with the installation of 3x65 TPD Preheaters",West Bengal,Jhargram,Binpur - II,Date of Submission for EC: 28 Apr 2022 ,Date of Ec Granted : 27 Dec 2023,Industrial Projects - 1, ARYAVRATA STEEL PRIVATE LIMITED,EC Granted,https://environmentclearance.nic.in/TrackState_proposal.aspx?type=EC&status=EC_new&statename=West%20Bengal&pno=SIA/WB/IND/60630/2021&pid=199578,https://environmentclearance.nic.in/timeline.aspx?pid=SIA/WB/IND/60630/2021&type=EC&ID=199578
350,SIA/WB/MIN/258165/2022,,Lachhipur Quartz and Quartzite Mine,West Bengal,Bankura,Hirbandh,Date of Submission for TOR: ,Date of Submission for EC: 23 Jan 2023 ,Non-Coal Mining,BISWARUP DUTTA,Delisted,https://environmentclearance.nic.in/TrackState_proposal.aspx?type=EC&status=EC_new&statename=West%20Bengal&pno=SIA/WB/MIN/258165/2022&pid=199579,https://environmentclearance.nic.in/timeline.aspx?pid=SIA/WB/MIN/258165/2022&type=EC&ID=199579
351,SIA/WB/MIN/194546/2021,EN-T-II-1/067/2021,sand river mining Dharalar river in Mahishmuri Mouza,West Bengal,Cooch Behar,alipurduar,Date of Submission for TOR: ,Date of Submission for EC: 31 Jan 2021 ,Non-Coal Mining,JAHANGIR ALAM,Delisted,https://environmentclearance.nic.in/TrackState_proposal.aspx?type=EC&status=EC_new&statename=West%20Bengal&pno=SIA/WB/MIN/194546/2021&pid=160414,https://environmentclearance.nic.in/timeline.aspx?pid=SIA/WB/MIN/194546/2021&type=EC&ID=160414
352,SIA/WB/MIS/195897/2021,EN/T-II-1/047/2021,"Affordable housing at Aerotropolis Township, Andal Mouza, Andal Taluka, District Paschim Bardhaman, West Bengal, India",West Bengal,Paschim bardhaman,Durgapur,Date of Submission for EC: 03 Mar 2021 ,Date of Ec Granted : 30 Jul 2021,INFRA-2,IABA HOUSING PRIVATE LIMITED,EC Granted,https://environmentclearance.nic.in/TrackState_proposal.aspx?type=EC&status=EC_new&statename=West%20Bengal&pno=SIA/WB/MIS/195897/2021&pid=162772,https://environmentclearance.nic.in/timeline.aspx?pid=SIA/WB/MIS/195897/2021&type=EC&ID=162772
353,SIA/WB/MIN/196592/2021,EN/T-II-1/056/2021,Gopiballavpur - II Sand Block MGB - 10 of Ashis Kumar Manna,West Bengal,West Medinipur,Jhargram,Date of Submission for TOR: ,Date of Submission for EC: 05 Feb 2021 ,Non-Coal Mining,ASHIS KUMAR MANNA,Delisted,https://environmentclearance.nic.in/TrackState_proposal.aspx?type=EC&status=EC_new&statename=West%20Bengal&pno=SIA/WB/MIN/196592/2021&pid=162930,https://environmentclearance.nic.in/timeline.aspx?pid=SIA/WB/MIN/196592/2021&type=EC&ID=162930
354,SIA/WB/IND/27663/2017,EN/T-II-1/039/2017,Installation of 3 No. 15 MT Induction Furnaces with Ladle Refining Furnace and Continuous Caster and 1 Nos. 180000 Tonnes/ Annum Rolling mill,West Bengal,Burdwan,Kanksa,Date of Submission for EC: 04 Jun 2018 ,Date of Ec Granted : 04 Dec 2018,Industrial Projects - 1,SHREE WARIS PIYA STEEL COMPANY PRIVATE LIMITED,EC Granted,https://environmentclearance.nic.in/TrackState_proposal.aspx?type=EC&status=EC_new&statename=West%20Bengal&pno=SIA/WB/IND/27663/2017&pid=44415,https://environmentclearance.nic.in/timeline.aspx?pid=SIA/WB/IND/27663/2017&type=EC&ID=44415
355,SIA/WB/NCP/51314/2016,EN/T-II-1/027/2016,Tolly Towers,West Bengal,Kolkata,Kolkata,Date of Submission for EC: 08 Apr 2016 ,Date of Ec Granted : ,INFRA-1,MANIGROUP,EC Granted - Processed offline,https://environmentclearance.nic.in/TrackState_proposal.aspx?type=EC&status=EC_new&statename=West%20Bengal&pno=SIA/WB/NCP/51314/2016&pid=15068,https://environmentclearance.nic.in/timeline.aspx?pid=SIA/WB/NCP/51314/2016&type=EC&ID=15068
356,SIA/WB/NCP/53653/2016,EN/T-II-1/042/2016,Tower Quest,West Bengal,Kolkata,Kolkata,Date of Submission for TOR: ,Date of Submission for EC: 28 May 2016 ,INFRA-1,MANIGROUP,WithdrawEC,https://environmentclearance.nic.in/TrackState_proposal.aspx?type=EC&status=EC_new&statename=West%20Bengal&pno=SIA/WB/NCP/53653/2016&pid=20004,https://environmentclearance.nic.in/timeline.aspx?pid=SIA/WB/NCP/53653/2016&type=EC&ID=20004
357,SIA/WB/NCP/71281/2017,EN/T-II-1/085/2017,Residential Complex by Rishinox Buildwell LLP,West Bengal,North 24 Parganas,Rajarhat,Date of Submission for EC: 13 Dec 2017 ,Date of Ec Granted : 16 Oct 2019,INFRA-1,RISHINOX BUILDWELL LLP,EC Granted,https://environmentclearance.nic.in/TrackState_proposal.aspx?type=EC&status=EC_new&statename=West%20Bengal&pno=SIA/WB/NCP/71281/2017&pid=40483,https://environmentclearance.nic.in/timeline.aspx?pid=SIA/WB/NCP/71281/2017&type=EC&ID=40483
358,SIA/WB/MIN/59763/2016,EN/T-II-1/071/2016,MONDALA BHATINA CLAY MINE,West Bengal,Birbhum,Rampurhat - I,Date of Submission for EC: 17 Oct 2016 ,Date of Ec Granted : 18 Sep 2017,Non-Coal Mining,BIRBHUM KAOLINE AND ALLIED INDUSTRIES P LTD,EC Granted,https://environmentclearance.nic.in/TrackState_proposal.aspx?type=EC&status=EC_new&statename=West%20Bengal&pno=SIA/WB/MIN/59763/2016&pid=32220,https://environmentclearance.nic.in/timeline.aspx?pid=SIA/WB/MIN/59763/2016&type=EC&ID=32220
359,SIA/WB/NCP/28697/2017,EN/T-II-1/034/2018,"Expansion of Calcutta Riverside Township, Batanagar",West Bengal,South 24 Parganas,Thakurpukur Mahestola,Date of Submission for EC: 31 Aug 2018 ,Date of Ec Granted : 11 Feb 2021,INFRA-1,RIVERBANK DEVELOPERS PRIVATE LIMITED,EC Granted,https://environmentclearance.nic.in/TrackState_proposal.aspx?type=EC&status=EC_new&statename=West%20Bengal&pno=SIA/WB/NCP/28697/2017&pid=45298,https://environmentclearance.nic.in/timeline.aspx?pid=SIA/WB/NCP/28697/2017&type=EC&ID=45298
360,SIA/WB/MIN/69847/2017,,Sand Mining,West Bengal,West Medinipur,No Data,Date of Submission for TOR: ,Date of Submission for EC: 25 Sep 2017 ,Non-Coal Mining,SRI SUSISH GHOSH,Delisted,https://environmentclearance.nic.in/TrackState_proposal.aspx?type=EC&status=EC_new&statename=West%20Bengal&pno=SIA/WB/MIN/69847/2017&pid=38711,https://environmentclearance.nic.in/timeline.aspx?pid=SIA/WB/MIN/69847/2017&type=EC&ID=38711
361,SIA/WB/MIN/437954/2023,EN/T-II-1/467/2023,Jagadishpur Sand Mine (MIN_UD_6),West Bengal,,,Date of Submission for EC: 25 Jul 2023 ,Date of Ec Granted : 05 Oct 2023,Non-Coal Mining,WEST BENGAL MINERAL DEVELOPMENT AND TRADING CORPORATION LIMITED,EC Granted,https://environmentclearance.nic.in/TrackState_proposal.aspx?type=EC&status=EC_new&statename=West%20Bengal&pno=SIA/WB/MIN/437954/2023&pid=223151,https://environmentclearance.nic.in/timeline.aspx?pid=SIA/WB/MIN/437954/2023&type=EC&ID=223151
362,SIA/WB/IND1/445085/2023,EN/T-II-1/014/2022,Environmental Clearance for Rolling Mill Plant for MS Round/ MS Flat production of M/s Bamlia Steel Udyog (P) Ltd. at Village: Dakshin Bansai; P.O: Raghunathpur; P.S: Uttarpara; Dist.: Hooghly; West Bengal; PIN - 712245,West Bengal,,,Date of Submission for TOR: ,Date of Submission for EC: 07 Oct 2023 ,Industrial Projects - 1,BAMLIA STEEL UDYOG (P) LIMITED,Under examination of SEIAA after SEAC,https://environmentclearance.nic.in/TrackState_proposal.aspx?type=EC&status=EC_new&statename=West%20Bengal&pno=SIA/WB/IND1/445085/2023&pid=225400,https://environmentclearance.nic.in/timeline.aspx?pid=SIA/WB/IND1/445085/2023&type=EC&ID=225400
363,SIA/WB/MIN/415072/2023,EN/T-II-1/169/2023,Environmental clearance for proposed river bed sand mining having lease area 1.25 Ha of Katigram Sand Block Dwarka River. ,West Bengal,,,Date of Submission for TOR: ,Date of Submission for EC: 09 Feb 2023 ,Non-Coal Mining, GEE DEE MINING PRIVATE LIMITED,Rejection Letter Granted,https://environmentclearance.nic.in/TrackState_proposal.aspx?type=EC&status=EC_new&statename=West%20Bengal&pno=SIA/WB/MIN/415072/2023&pid=216282,https://environmentclearance.nic.in/timeline.aspx?pid=SIA/WB/MIN/415072/2023&type=EC&ID=216282
364,SIA/WB/MIN/194523/2021,EN/T-II-1/065/2021,Andaran Panishala Sand Mine,West Bengal,Cooch Behar,alipurduar,Date of Submission for TOR: ,Date of Submission for EC: 27 Jan 2021 ,Non-Coal Mining,AFIJUL MOHAMMAD,Delisted,https://environmentclearance.nic.in/TrackState_proposal.aspx?type=EC&status=EC_new&statename=West%20Bengal&pno=SIA/WB/MIN/194523/2021&pid=160409,https://environmentclearance.nic.in/timeline.aspx?pid=SIA/WB/MIN/194523/2021&type=EC&ID=160409
365,SIA/WB/MIS/107866/2019,EN/T-II-1/069/2019,Commercial Building for Trading (Business) and other Allied purposes,West Bengal,Howrah,Domjur,Date of Submission for TOR: ,Date of Submission for EC: 17 Sep 2019 ,INFRA-2,SRPM HAAT LLP,WithdrawEC,https://environmentclearance.nic.in/TrackState_proposal.aspx?type=EC&status=EC_new&statename=West%20Bengal&pno=SIA/WB/MIS/107866/2019&pid=56579,https://environmentclearance.nic.in/timeline.aspx?pid=SIA/WB/MIS/107866/2019&type=EC&ID=56579
366,SIA/WB/MIN/189909/2020,,M/s Fiza Brick Field,West Bengal,Malda,Chanchal - I,Date of Submission for TOR: ,Date of Submission for EC: 12 Mar 2021 ,Non-Coal Mining,M/S FIZA BRICK FIELD,Delisted,https://environmentclearance.nic.in/TrackState_proposal.aspx?type=EC&status=EC_new&statename=West%20Bengal&pno=SIA/WB/MIN/189909/2020&pid=152442,https://environmentclearance.nic.in/timeline.aspx?pid=SIA/WB/MIN/189909/2020&type=EC&ID=152442
