,Proposal.No.,File_No,Proposal Name,State,District,Tehsil,Date_1,Date_2,Category,Company,Status,Link,Timeline
627,SIA/WB/MIN/440161/2023,EN/T-II-1/494/2023,Gangarampur Sand Mine (MIN_MD_3),West Bengal,,,Date of Submission for EC: 12 Aug 2023 ,Date of Ec Granted : 01 Dec 2023,Non-Coal Mining,WEST BENGAL MINERAL DEVELOPMENT AND TRADING CORPORATION LIMITED,EC Granted,https://environmentclearance.nic.in/TrackState_proposal.aspx?type=EC&status=EC_new&statename=West%20Bengal&pno=SIA/WB/MIN/440161/2023&pid=223910,https://environmentclearance.nic.in/timeline.aspx?pid=SIA/WB/MIN/440161/2023&type=EC&ID=223910
628,SIA/WB/IND2/29753/2017,EN/T-II-1/008/2017,Proposed synthetic resin manufacturing unit for the production of 6300 TPA synthetic resin,West Bengal,Howrah,Uluberia - II,Date of Submission for EC: 01 Nov 2018 ,Date of Ec Granted : 28 Sep 2020,Industrial Projects - 2,V H POLYMERS,EC Granted,https://environmentclearance.nic.in/TrackState_proposal.aspx?type=EC&status=EC_new&statename=West%20Bengal&pno=SIA/WB/IND2/29753/2017&pid=47527,https://environmentclearance.nic.in/timeline.aspx?pid=SIA/WB/IND2/29753/2017&type=EC&ID=47527
629,SIA/WB/MIN/436782/2023,EN/T-II-1/462/2023,Gopinathpur Sand Mine (MIN_WMED_14),West Bengal,,,Date of Submission for EC: 15 Jul 2023 ,Date of Ec Granted : 05 Oct 2023,Non-Coal Mining,WEST BENGAL MINERAL DEVELOPMENT AND TRADING CORPORATION LIMITED,EC Granted,https://environmentclearance.nic.in/TrackState_proposal.aspx?type=EC&status=EC_new&statename=West%20Bengal&pno=SIA/WB/MIN/436782/2023&pid=222762,https://environmentclearance.nic.in/timeline.aspx?pid=SIA/WB/MIN/436782/2023&type=EC&ID=222762
630,SIA/WB/INFRA2/411145/2022,,Residential Complex by Ganguly Home Search Pvt. Ltd.,West Bengal,,,Date of Submission for TOR: ,Date of Submission for EC: 20 Dec 2022 ,INFRA-2, GANGULY HOME SEARCH PRIVATE LIMITED,Query raised by SEIAA and pending at PP,https://environmentclearance.nic.in/TrackState_proposal.aspx?type=EC&status=EC_new&statename=West%20Bengal&pno=SIA/WB/INFRA2/411145/2022&pid=214084,https://environmentclearance.nic.in/timeline.aspx?pid=SIA/WB/INFRA2/411145/2022&type=EC&ID=214084
631,SIA/WB/MIN/419975/2023,EN/T-II-1/238/2023,Balia Riverbed Sand Mine,West Bengal,,,Date of Submission for TOR: ,Date of Submission for EC: 26 Feb 2023 ,Non-Coal Mining,M/S GREEGO DRIVE PVT. LTD,Rejection Letter Granted,https://environmentclearance.nic.in/TrackState_proposal.aspx?type=EC&status=EC_new&statename=West%20Bengal&pno=SIA/WB/MIN/419975/2023&pid=217003,https://environmentclearance.nic.in/timeline.aspx?pid=SIA/WB/MIN/419975/2023&type=EC&ID=217003
632,SIA/WB/NCP/52721/2016,,High Park Residencies,West Bengal,24 Parganas,North 24 Parganas,Date of Submission for TOR: ,Date of Submission for EC: 09 Apr 2016 ,INFRA-1,CAESCON ENGINEERING SERVICES PVT LTD,Delisted,https://environmentclearance.nic.in/TrackState_proposal.aspx?type=EC&status=EC_new&statename=West%20Bengal&pno=SIA/WB/NCP/52721/2016&pid=17274,https://environmentclearance.nic.in/timeline.aspx?pid=SIA/WB/NCP/52721/2016&type=EC&ID=17274
633,SIA/WB/NCP/51657/2016,EN/T-II-1/026/2016,Business building including Commercial area and Office Area,West Bengal,Kolkata,Kolkata,Date of Submission for TOR: ,Date of Submission for EC: 30 Mar 2016 ,INFRA-1,THE BENGAL BONDED WAREHOUSE ASSOCIATION,WithdrawEC,https://environmentclearance.nic.in/TrackState_proposal.aspx?type=EC&status=EC_new&statename=West%20Bengal&pno=SIA/WB/NCP/51657/2016&pid=15370,https://environmentclearance.nic.in/timeline.aspx?pid=SIA/WB/NCP/51657/2016&type=EC&ID=15370
634,SIA/WB/MIN/434236/2023,EN/T-II-1/439/2023,Shikarpur Riverbed Sand Mine (MIN_EBUR_29),West Bengal,,,Date of Submission for EC: 26 Jun 2023 ,Date of Ec Granted : 31 Aug 2023,Non-Coal Mining,WEST BENGAL MINERAL DEVELOPMENT AND TRADING CORPORATION LIMITED,EC Granted,https://environmentclearance.nic.in/TrackState_proposal.aspx?type=EC&status=EC_new&statename=West%20Bengal&pno=SIA/WB/MIN/434236/2023&pid=221942,https://environmentclearance.nic.in/timeline.aspx?pid=SIA/WB/MIN/434236/2023&type=EC&ID=221942
635,SIA/WB/INFRA2/401725/2022,EN/T-II-1/063/2022,Residential Building,West Bengal,South 24 Parganas,,Date of Submission for EC: 03 Nov 2022 ,Date of Ec Granted : 16 Oct 2023,INFRA-2, REALMARK AWAAS LLP,EC Granted,https://environmentclearance.nic.in/TrackState_proposal.aspx?type=EC&status=EC_new&statename=West%20Bengal&pno=SIA/WB/INFRA2/401725/2022&pid=211089,https://environmentclearance.nic.in/timeline.aspx?pid=SIA/WB/INFRA2/401725/2022&type=EC&ID=211089
636,SIA/WB/NCP/9666/2016,EN/T-II-1/011/2016,"Proposed Expansion of Residential Complex, AVIDIPTA",West Bengal,Kolkata,Kolkata,Date of Submission for EC: 22 Feb 2016 ,Date of Ec Granted : 11 Apr 2017,INFRA-1,BENGAL PEERLESS HOUSING DEVELOPMENT COMPANY LTD,EC Granted,https://environmentclearance.nic.in/TrackState_proposal.aspx?type=EC&status=EC_new&statename=West%20Bengal&pno=SIA/WB/NCP/9666/2016&pid=35507,https://environmentclearance.nic.in/timeline.aspx?pid=SIA/WB/NCP/9666/2016&type=EC&ID=35507
637,SIA/WB/MIN/407316/2022,,PALASH SAND BLOCK,West Bengal,Darjeeling,,Date of Submission for TOR: ,Date of Submission for EC: 21 Nov 2022 ,Non-Coal Mining, ANKUR BIOCHEM PRIVATE LIMITED,Query raised by SEIAA and pending at PP,https://environmentclearance.nic.in/TrackState_proposal.aspx?type=EC&status=EC_new&statename=West%20Bengal&pno=SIA/WB/MIN/407316/2022&pid=212917,https://environmentclearance.nic.in/timeline.aspx?pid=SIA/WB/MIN/407316/2022&type=EC&ID=212917
638,SIA/WB/MIN/421321/2023,EN/T-II-1/397/2023,Kota Riverbed sand mine ,West Bengal,,,Date of Submission for TOR: ,Date of Submission for EC: 24 Apr 2023 ,Non-Coal Mining,RAINBOW INFRASTRUCTURE & HOUSING DEVELOPMENT LTD,Rejection Letter Granted,https://environmentclearance.nic.in/TrackState_proposal.aspx?type=EC&status=EC_new&statename=West%20Bengal&pno=SIA/WB/MIN/421321/2023&pid=219027,https://environmentclearance.nic.in/timeline.aspx?pid=SIA/WB/MIN/421321/2023&type=EC&ID=219027
639,SIA/WB/MIS/60117/2016,EN/T-II-1/078/2016,The Reserve,West Bengal,Kolkata,Kolkata,Date of Submission for EC: 18 Nov 2016 ,Date of Ec Granted : 04 Sep 2018,INFRA-2,TIVOLI PARK APARTMENTS PVT LTD,EC Granted,https://environmentclearance.nic.in/TrackState_proposal.aspx?type=EC&status=EC_new&statename=West%20Bengal&pno=SIA/WB/MIS/60117/2016&pid=32489,https://environmentclearance.nic.in/timeline.aspx?pid=SIA/WB/MIS/60117/2016&type=EC&ID=32489
640,SIA/WB/INFRA2/436559/2023,EN/T-II-1/478/2023,Residential Complex by Sanwaria Apartments Pvt. Ltd.,West Bengal,,,Date of Submission for EC: 28 Jul 2023 ,Date of Ec Granted : 04 Dec 2023,INFRA-2, SANWARIA APARTMENTS PRIVATE LIMITED,EC Granted,https://environmentclearance.nic.in/TrackState_proposal.aspx?type=EC&status=EC_new&statename=West%20Bengal&pno=SIA/WB/INFRA2/436559/2023&pid=223277,https://environmentclearance.nic.in/timeline.aspx?pid=SIA/WB/INFRA2/436559/2023&type=EC&ID=223277
641,SIA/WB/NCP/72216/2018,EN/T-II-1/013/2018,Expansion of Residential Complex by RDB Realty & Infrastructure Limited,West Bengal,Barddhaman,Burdwan - I,Date of Submission for EC: 07 Mar 2018 ,Date of Ec Granted : 02 Jun 2023,INFRA-1,RDB REALTY AND INFRASTRUCTURE LIMITED,EC Granted,https://environmentclearance.nic.in/TrackState_proposal.aspx?type=EC&status=EC_new&statename=West%20Bengal&pno=SIA/WB/NCP/72216/2018&pid=41990,https://environmentclearance.nic.in/timeline.aspx?pid=SIA/WB/NCP/72216/2018&type=EC&ID=41990
642,SIA/WB/IND2/21570/2013,EN/T-II-1/005/2018,METALIK FUEL PRIVATE LIMITED,West Bengal,West Medinipur,No Data,Date of Submission for EC: 17 Jan 2018 ,Date of Ec Granted : 07 May 2018,Industrial Projects - 2,METALIK FUEL PRIVATE LIMITED,EC Granted,https://environmentclearance.nic.in/TrackState_proposal.aspx?type=EC&status=EC_new&statename=West%20Bengal&pno=SIA/WB/IND2/21570/2013&pid=41960,https://environmentclearance.nic.in/timeline.aspx?pid=SIA/WB/IND2/21570/2013&type=EC&ID=41960
643,SIA/WB/NCP/75325/2018,EN/T-II-1/049/2018,"Expansion, Renovation & Modernization of Milan Mela by West Bengal Trade Promotion Organization",West Bengal,Kolkata,Kolkata,Date of Submission for EC: 18 Jun 2018 ,Date of Ec Granted : 28 Sep 2020,INFRA-1,WEST BENGAL TRADE PROMOTION ORGANIZATION,EC Granted,https://environmentclearance.nic.in/TrackState_proposal.aspx?type=EC&status=EC_new&statename=West%20Bengal&pno=SIA/WB/NCP/75325/2018&pid=44465,https://environmentclearance.nic.in/timeline.aspx?pid=SIA/WB/NCP/75325/2018&type=EC&ID=44465
644,SIA/WB/MIN/407688/2022,EN/T-II-1/068/2023,ULIARA SAND MINE,West Bengal,Bankura,,Date of Submission for TOR: ,Date of Submission for EC: 31 Jan 2023 ,Non-Coal Mining,"MS BASU AGROFARMS PRIVATE LIMITED,  ULIARA SAND MINE (DWARAKESHWAR RIVER)",Rejection Letter Granted,https://environmentclearance.nic.in/TrackState_proposal.aspx?type=EC&status=EC_new&statename=West%20Bengal&pno=SIA/WB/MIN/407688/2022&pid=213055,https://environmentclearance.nic.in/timeline.aspx?pid=SIA/WB/MIN/407688/2022&type=EC&ID=213055
645,SIA/WB/MIN/424135/2023,EN/T-II-1/351/2023,River Bed sand Mine at Mouza Nemai,West Bengal,,,Date of Submission for TOR: ,Date of Submission for EC: 30 Mar 2023 ,Non-Coal Mining,KRISHNA AGARWAL,Delisted,https://environmentclearance.nic.in/TrackState_proposal.aspx?type=EC&status=EC_new&statename=West%20Bengal&pno=SIA/WB/MIN/424135/2023&pid=218232,https://environmentclearance.nic.in/timeline.aspx?pid=SIA/WB/MIN/424135/2023&type=EC&ID=218232
646,SIA/WB/MIN/423327/2023,EN/T-II-1/363/2023,Uttar Chakoakheti Sand Mine (MIN_APD_20),West Bengal,,,Date of Submission for EC: 08 Apr 2023 ,Date of Ec Granted : 19 Jun 2023,Non-Coal Mining,WEST BENGAL MINERAL DEVELOPMENT AND TRADING CORPORATION LIMITED,EC Granted,https://environmentclearance.nic.in/TrackState_proposal.aspx?type=EC&status=EC_new&statename=West%20Bengal&pno=SIA/WB/MIN/423327/2023&pid=218584,https://environmentclearance.nic.in/timeline.aspx?pid=SIA/WB/MIN/423327/2023&type=EC&ID=218584
647,SIA/WB/INFRA2/402657/2022,EN/T-II-1/054/2022,Proposed Expansion of Woodlands Multispeciality Hospital by M/s. Woodlands Multispeciality Hospital Limited. ,West Bengal,Kolkata,,Date of Submission for EC: 10 Oct 2022 ,Date of Ec Granted : 14 Aug 2023,INFRA-2,WOODLANDS MULTISPECIALITY HOSPITAL LIMITED,EC Granted,https://environmentclearance.nic.in/TrackState_proposal.aspx?type=EC&status=EC_new&statename=West%20Bengal&pno=SIA/WB/INFRA2/402657/2022&pid=211354,https://environmentclearance.nic.in/timeline.aspx?pid=SIA/WB/INFRA2/402657/2022&type=EC&ID=211354
648,SIA/WB/MIN/453252/2023,EN/T-II-1/385/2023,MIN_BNK_49_I Sand Mine,West Bengal,,,Date of Submission for EC: 24 Nov 2023 ,Date of Ec Granted : 09 Jan 2024,Non-Coal Mining,WEST BENGAL MINERAL DEVELOPMENT AND TRADING CORPORATION LIMITED,EC Granted,https://environmentclearance.nic.in/TrackState_proposal.aspx?type=EC&status=EC_new&statename=West%20Bengal&pno=SIA/WB/MIN/453252/2023&pid=228530,https://environmentclearance.nic.in/timeline.aspx?pid=SIA/WB/MIN/453252/2023&type=EC&ID=228530
649,SIA/WB/NCP/65771/2017,EN/T-II-1/048/2017,Residential Complex by Madgul Developers Pvt. Ltd. & Others,West Bengal,Kolkata,Kolkata,Date of Submission for EC: 11 Jul 2017 ,Date of Ec Granted : 16 Oct 2019,INFRA-1,MADGUL DEVELOPERS PRIVATE LIMITED AND OTHERS,EC Granted,https://environmentclearance.nic.in/TrackState_proposal.aspx?type=EC&status=EC_new&statename=West%20Bengal&pno=SIA/WB/NCP/65771/2017&pid=35690,https://environmentclearance.nic.in/timeline.aspx?pid=SIA/WB/NCP/65771/2017&type=EC&ID=35690
650,SIA/WB/MIS/67287/2017,,Ideal Aurum,West Bengal,South 24 Parganas,Sonarpur,Date of Submission for TOR: ,Date of Submission for EC: 08 Aug 2017 ,INFRA-2,EXULT REALTY PVT LTD,WithdrawEC,https://environmentclearance.nic.in/TrackState_proposal.aspx?type=EC&status=EC_new&statename=West%20Bengal&pno=SIA/WB/MIS/67287/2017&pid=37112,https://environmentclearance.nic.in/timeline.aspx?pid=SIA/WB/MIS/67287/2017&type=EC&ID=37112
651,SIA/WB/MIN/411343/2022,,Mathuratapal sand mine on Dwarkeswar river ,West Bengal,,,Date of Submission for TOR: ,Date of Submission for EC: 20 Dec 2022 ,Non-Coal Mining,NIMAI ARI,Query raised by SEIAA and pending at PP,https://environmentclearance.nic.in/TrackState_proposal.aspx?type=EC&status=EC_new&statename=West%20Bengal&pno=SIA/WB/MIN/411343/2022&pid=214096,https://environmentclearance.nic.in/timeline.aspx?pid=SIA/WB/MIN/411343/2022&type=EC&ID=214096
652,SIA/WB/IND/29818/2017,EN/T-II-1/087/2017,"Proposed expansion of existing Steel Plant by installation of 1x10 T Induction Furnace, CCM & Rolling Mill ",West Bengal,Bankura,Barjora,Date of Submission for EC: 10 Nov 2018 ,Date of Ec Granted : 02 Mar 2020,Industrial Projects - 1,JAI AMBEY METALS PRIVATE LTD,EC Granted,https://environmentclearance.nic.in/TrackState_proposal.aspx?type=EC&status=EC_new&statename=West%20Bengal&pno=SIA/WB/IND/29818/2017&pid=47607,https://environmentclearance.nic.in/timeline.aspx?pid=SIA/WB/IND/29818/2017&type=EC&ID=47607
653,SIA/WB/MIN/419982/2023,EN/T-II-1/233/2023,Kirtansole Riverbed Sand Mine,West Bengal,,,Date of Submission for TOR: ,Date of Submission for EC: 26 Feb 2023 ,Non-Coal Mining,M/S GREEGO DRIVE PVT. LTD,Rejection Letter Granted,https://environmentclearance.nic.in/TrackState_proposal.aspx?type=EC&status=EC_new&statename=West%20Bengal&pno=SIA/WB/MIN/419982/2023&pid=217004,https://environmentclearance.nic.in/timeline.aspx?pid=SIA/WB/MIN/419982/2023&type=EC&ID=217004
654,SIA/WB/MIN/439282/2023,EN/T-II-1/508/2023,Phansidewa Sand Mine (MIN_DJ_18),West Bengal,,,Date of Submission for EC: 04 Aug 2023 ,Date of Ec Granted : 23 Nov 2023,Non-Coal Mining,WEST BENGAL MINERAL DEVELOPMENT AND TRADING CORPORATION LIMITED,EC Granted,https://environmentclearance.nic.in/TrackState_proposal.aspx?type=EC&status=EC_new&statename=West%20Bengal&pno=SIA/WB/MIN/439282/2023&pid=223601,https://environmentclearance.nic.in/timeline.aspx?pid=SIA/WB/MIN/439282/2023&type=EC&ID=223601
655,SIA/WB/NCP/72819/2018,EN/T-II-1/012/2018,Proposed Expansion of Residential Complex by Springcity Buildcon LLP & Others,West Bengal,Kolkata,Kolkata,Date of Submission for EC: 07 Mar 2018 ,Date of Ec Granted : 26 Sep 2022,INFRA-1,SPRINGCITY BUILDCON LLP AND OTHERS,EC Granted,https://environmentclearance.nic.in/TrackState_proposal.aspx?type=EC&status=EC_new&statename=West%20Bengal&pno=SIA/WB/NCP/72819/2018&pid=42379,https://environmentclearance.nic.in/timeline.aspx?pid=SIA/WB/NCP/72819/2018&type=EC&ID=42379
656,SIA/WB/NCP/41530/2016,EN/T-II-1/005/2016,Alpine Heights,West Bengal,Kolkata,Kolkata,Date of Submission for TOR: ,Date of Submission for EC: 25 Jan 2016 ,INFRA-1,MOTIJUG AGENCIES LTD AND OTHERS,WithdrawEC,https://environmentclearance.nic.in/TrackState_proposal.aspx?type=EC&status=EC_new&statename=West%20Bengal&pno=SIA/WB/NCP/41530/2016&pid=10339,https://environmentclearance.nic.in/timeline.aspx?pid=SIA/WB/NCP/41530/2016&type=EC&ID=10339
657,SIA/WB/IND2/22007/2016,EN/T-II-1/076/2016,SIA/WB/IND2/17279/2016,West Bengal,Burdwan,Kanksa,Date of Submission for EC: 14 Feb 2018 ,Date of Ec Granted : 28 May 2018,Industrial Projects - 2,BHARAT PETROLEUM CORPORATION LIMITED RAJBANDH,EC Granted,https://environmentclearance.nic.in/TrackState_proposal.aspx?type=EC&status=EC_new&statename=West%20Bengal&pno=SIA/WB/IND2/22007/2016&pid=42498,https://environmentclearance.nic.in/timeline.aspx?pid=SIA/WB/IND2/22007/2016&type=EC&ID=42498
658,SIA/WB/MIS/29442/2017,EN/T-II-1/059/2018,IDEAL EXOTICA,West Bengal,Kolkata,Kolkata,Date of Submission for EC: 06 Oct 2018 ,Date of Ec Granted : 13 Mar 2019,INFRA-2,IDEAL REAL ESTATES PVT LTD,EC Granted,https://environmentclearance.nic.in/TrackState_proposal.aspx?type=EC&status=EC_new&statename=West%20Bengal&pno=SIA/WB/MIS/29442/2017&pid=46187,https://environmentclearance.nic.in/timeline.aspx?pid=SIA/WB/MIS/29442/2017&type=EC&ID=46187
659,SIA/WB/MIN/427636/2023,EN/T-II-1/419/2023,Chitalgha RIverbed Sand Mine (MIN_UD_09),West Bengal,,,Date of Submission for EC: 30 Apr 2023 ,Date of Ec Granted : 18 Aug 2023,Non-Coal Mining,WEST BENGAL MINERAL DEVELOPMENT AND TRADING CORPORATION LIMITED,EC Granted,https://environmentclearance.nic.in/TrackState_proposal.aspx?type=EC&status=EC_new&statename=West%20Bengal&pno=SIA/WB/MIN/427636/2023&pid=219189,https://environmentclearance.nic.in/timeline.aspx?pid=SIA/WB/MIN/427636/2023&type=EC&ID=219189
660,SIA/WB/MIS/50926/2016,EN/T-II-1/023/2016,MOMENTS101,West Bengal,South 24 Parganas,Bishnupur - I,Date of Submission for TOR: ,Date of Submission for EC: 12 Mar 2016 ,INFRA-2,PS VINAYAK COMPLEX LLP,Rejection Letter Granted,https://environmentclearance.nic.in/TrackState_proposal.aspx?type=EC&status=EC_new&statename=West%20Bengal&pno=SIA/WB/MIS/50926/2016&pid=14699,https://environmentclearance.nic.in/timeline.aspx?pid=SIA/WB/MIS/50926/2016&type=EC&ID=14699
661,SIA/WB/MIN/437300/2023,EN/T-II-1/479/2023,Kashipur Riverbed Sand Mine (MIN_PUR_19),West Bengal,,,Date of Submission for EC: 26 Jul 2023 ,Date of Ec Granted : 16 Oct 2023,Non-Coal Mining,WEST BENGAL MINERAL DEVELOPMENT AND TRADING CORPORATION LIMITED,EC Granted,https://environmentclearance.nic.in/TrackState_proposal.aspx?type=EC&status=EC_new&statename=West%20Bengal&pno=SIA/WB/MIN/437300/2023&pid=223190,https://environmentclearance.nic.in/timeline.aspx?pid=SIA/WB/MIN/437300/2023&type=EC&ID=223190
662,SIA/WB/MIN/408615/2022,,"Sagira Sand Mine on Ajay River, Ashok Kumar Saha",West Bengal,,,Date of Submission for TOR: ,Date of Submission for EC: 30 Nov 2022 ,Non-Coal Mining,ASHOKKUMAR SAHA,WithdrawEC,https://environmentclearance.nic.in/TrackState_proposal.aspx?type=EC&status=EC_new&statename=West%20Bengal&pno=SIA/WB/MIN/408615/2022&pid=213325,https://environmentclearance.nic.in/timeline.aspx?pid=SIA/WB/MIN/408615/2022&type=EC&ID=213325
663,SIA/WB/MIN/210453/2021,EN/T-II-1/110/2021,Desher Mohan sand mine,West Bengal,Barddhaman,Jamuria,Date of Submission for TOR: ,Date of Submission for EC: 27 Apr 2021 ,Non-Coal Mining,DEBNATH ENTERPRISE,Delisted,https://environmentclearance.nic.in/TrackState_proposal.aspx?type=EC&status=EC_new&statename=West%20Bengal&pno=SIA/WB/MIN/210453/2021&pid=183399,https://environmentclearance.nic.in/timeline.aspx?pid=SIA/WB/MIN/210453/2021&type=EC&ID=183399
664,SIA/WB/MIN/262459/2022,,Subarnarekha River Bed Mine MSHB 8,West Bengal,Jhargram,Kharagpur - I,Date of Submission for TOR: ,Date of Submission for EC: 23 Mar 2022 ,Non-Coal Mining,SUBARNAREKHA RIVER BED SAND MINING,Delisted,https://environmentclearance.nic.in/TrackState_proposal.aspx?type=EC&status=EC_new&statename=West%20Bengal&pno=SIA/WB/MIN/262459/2022&pid=200680,https://environmentclearance.nic.in/timeline.aspx?pid=SIA/WB/MIN/262459/2022&type=EC&ID=200680
665,SIA/WB/MIN/263841/2022,,MADANPUR DAFARPUR SAND MINE,West Bengal,Murshidabad,Bharatpur - I,Date of Submission for TOR: ,Date of Submission for EC: 26 Mar 2022 ,Non-Coal Mining,SUDIP DEY,Under examination of SEIAA ,https://environmentclearance.nic.in/TrackState_proposal.aspx?type=EC&status=EC_new&statename=West%20Bengal&pno=SIA/WB/MIN/263841/2022&pid=201071,https://environmentclearance.nic.in/timeline.aspx?pid=SIA/WB/MIN/263841/2022&type=EC&ID=201071
666,SIA/WB/MIN/263462/2022,EN/T-II-1/056/2023,Kotsimul Sand  Mine Maa Tara Builders,West Bengal,Purba Burdwan,Burdwan,Date of Submission for TOR: ,Date of Submission for EC: 27 Dec 2022 ,Non-Coal Mining,"KOTSIMUL SAND MINE, MAA TARA BUILDERS",Rejection Letter Granted,https://environmentclearance.nic.in/TrackState_proposal.aspx?type=EC&status=EC_new&statename=West%20Bengal&pno=SIA/WB/MIN/263462/2022&pid=200957,https://environmentclearance.nic.in/timeline.aspx?pid=SIA/WB/MIN/263462/2022&type=EC&ID=200957
667,SIA/WB/MIN/249790/2022,,Stone Crusher of M/S Patil Rail Infrastructure Pvt Ltd,West Bengal,Purulia,Bandwan,Date of Submission for TOR: ,Date of Submission for EC: 05 Jan 2022 ,Non-Coal Mining,M/S PATIL RAIL INFRASTRUCTURE PVT LTD,Delisted,https://environmentclearance.nic.in/TrackState_proposal.aspx?type=EC&status=EC_new&statename=West%20Bengal&pno=SIA/WB/MIN/249790/2022&pid=197398,https://environmentclearance.nic.in/timeline.aspx?pid=SIA/WB/MIN/249790/2022&type=EC&ID=197398
668,SIA/WB/MIS/46408/2019,EN/T-II-1/049/2019,Southwinds,West Bengal,South 24 Parganas,Sonarpur,Date of Submission for EC: 13 Nov 2019 ,Date of Ec Granted : 30 Jul 2021,INFRA-2,SOUTHWINDS PROJECT LLP,EC Granted,https://environmentclearance.nic.in/TrackState_proposal.aspx?type=EC&status=EC_new&statename=West%20Bengal&pno=SIA/WB/MIS/46408/2019&pid=71888,https://environmentclearance.nic.in/timeline.aspx?pid=SIA/WB/MIS/46408/2019&type=EC&ID=71888
669,SIA/WB/MIN/264952/2022,EN/T-II-1/157/2023,KUNJAPUR SAND MINE,West Bengal,West Medinipur,Medinipur Sadar,Date of Submission for TOR: ,Date of Submission for EC: 30 Mar 2022 ,Non-Coal Mining,UJJWAL SAMANTA,Delisted,https://environmentclearance.nic.in/TrackState_proposal.aspx?type=EC&status=EC_new&statename=West%20Bengal&pno=SIA/WB/MIN/264952/2022&pid=201374,https://environmentclearance.nic.in/timeline.aspx?pid=SIA/WB/MIN/264952/2022&type=EC&ID=201374
670,SIA/WB/MIN/216209/2021,EN/T-II-1/116/2021,"RERAPAL SAND MINE (AREA- 4.33 HECTARES) ON KANGSHABATI RIVER ON Plot No.-552(P) & 700(P).LOCATED AT MOUZA- RERAPAL, P.S. - MEDINIPUR, DISTRICT-PASCHIM MEDINIPUR, STATE- WEST BENGAL, JL NO. -132",West Bengal,West Medinipur,Medinipur Sadar,Date of Submission for TOR: ,Date of Submission for EC: 05 Jul 2021 ,Non-Coal Mining,MA KALI ENTERPRISE,Delisted,https://environmentclearance.nic.in/TrackState_proposal.aspx?type=EC&status=EC_new&statename=West%20Bengal&pno=SIA/WB/MIN/216209/2021&pid=188539,https://environmentclearance.nic.in/timeline.aspx?pid=SIA/WB/MIN/216209/2021&type=EC&ID=188539
671,SIA/WB/MIN/216548/2021,,Kansra sand mine,West Bengal,Barddhaman,Jamalpur,Date of Submission for TOR: ,Date of Submission for EC: 23 Jun 2021 ,Non-Coal Mining,SOUMITRA ADHIKARI,Delisted,https://environmentclearance.nic.in/TrackState_proposal.aspx?type=EC&status=EC_new&statename=West%20Bengal&pno=SIA/WB/MIN/216548/2021&pid=188612,https://environmentclearance.nic.in/timeline.aspx?pid=SIA/WB/MIN/216548/2021&type=EC&ID=188612
672,SIA/WB/MIN/419697/2023,EN/T-II-1/230/2023,MIN_BNK_18_A Sand Mine,West Bengal,,,Date of Submission for EC: 01 Mar 2023 ,Date of Ec Granted : 27 Apr 2023,Non-Coal Mining,WEST BENGAL MINERAL DEVELOPMENT AND TRADING CORPORATION LIMITED,EC Granted,https://environmentclearance.nic.in/TrackState_proposal.aspx?type=EC&status=EC_new&statename=West%20Bengal&pno=SIA/WB/MIN/419697/2023&pid=217101,https://environmentclearance.nic.in/timeline.aspx?pid=SIA/WB/MIN/419697/2023&type=EC&ID=217101
673,SIA/WB/MIN/408992/2022,EN/T-II-1/101/2022,Kawakhali - II Riverbed Project,West Bengal,,,Date of Submission for TOR: ,Date of Submission for EC: 04 Dec 2022 ,Non-Coal Mining,RAINBOW INFRASTRUCTURE & HOUSING DEVELOPMENT LTD,Rejection Letter Granted,https://environmentclearance.nic.in/TrackState_proposal.aspx?type=EC&status=EC_new&statename=West%20Bengal&pno=SIA/WB/MIN/408992/2022&pid=213538,https://environmentclearance.nic.in/timeline.aspx?pid=SIA/WB/MIN/408992/2022&type=EC&ID=213538
674,SIA/WB/INFRA2/407812/2022,EN/T-II-1/073/2022,Residential Cum commercial Complex by RDB Anekant Orbit Properties Pvt. Ltd.,West Bengal,North 24 Parganas,,Date of Submission for EC: 24 Nov 2022 ,Date of Ec Granted : 20 Apr 2023,INFRA-2, RDB ANEKANT ORBIT PROPERTIES PRIVATE LIMITED,EC Granted,https://environmentclearance.nic.in/TrackState_proposal.aspx?type=EC&status=EC_new&statename=West%20Bengal&pno=SIA/WB/INFRA2/407812/2022&pid=213080,https://environmentclearance.nic.in/timeline.aspx?pid=SIA/WB/INFRA2/407812/2022&type=EC&ID=213080
675,SIA/WB/NCP/77716/2018,EN/T-II-1/087/2018,Eastern India Healthcare Foundation Hospital Project,West Bengal,South 24 Parganas,Sonarpur,Date of Submission for TOR: ,Date of Submission for EC: 29 Sep 2018 ,INFRA-1,EASTERN INDIA HEALTHCARE FOUNDATION,WithdrawEC,https://environmentclearance.nic.in/TrackState_proposal.aspx?type=EC&status=EC_new&statename=West%20Bengal&pno=SIA/WB/NCP/77716/2018&pid=45510,https://environmentclearance.nic.in/timeline.aspx?pid=SIA/WB/NCP/77716/2018&type=EC&ID=45510
676,SIA/WB/INFRA2/431778/2023,EN/T-II-1/086/2022,"Establishment of Common Bio-Medical Waste Treatment Facility (CBWTF) at Village- Kaluabari ,P.O. Debithakurbari,P.S-Rajganj, Mouza- Chhatgujrimari,Pargana Baikunthapur, Dist-Jalpaiguri, West Bengal ",West Bengal,,,Date of Submission for EC: 08 Jun 2023 ,Date of Ec Granted : 01 Sep 2023,INFRA-2, UNIQUE UNIVERSAL BIO WASTE LLP,EC Granted,https://environmentclearance.nic.in/TrackState_proposal.aspx?type=EC&status=EC_new&statename=West%20Bengal&pno=SIA/WB/INFRA2/431778/2023&pid=221054,https://environmentclearance.nic.in/timeline.aspx?pid=SIA/WB/INFRA2/431778/2023&type=EC&ID=221054
677,SIA/WB/MIS/60112/2016,,THE RESERVE,West Bengal,Kolkata,Kolkata,Date of Submission for TOR: ,Date of Submission for EC: 18 Nov 2016 ,INFRA-2,TIVOLI PARK APARTMENTS PVT LTD,WithdrawEC,https://environmentclearance.nic.in/TrackState_proposal.aspx?type=EC&status=EC_new&statename=West%20Bengal&pno=SIA/WB/MIS/60112/2016&pid=32485,https://environmentclearance.nic.in/timeline.aspx?pid=SIA/WB/MIS/60112/2016&type=EC&ID=32485
678,SIA/WB/MIN/440247/2023,EN/T-II-1/493/2023,Karanjogerya Sand Mine (MIN_WMED_13),West Bengal,,,Date of Submission for EC: 12 Aug 2023 ,Date of Ec Granted : 01 Dec 2023,Non-Coal Mining,WEST BENGAL MINERAL DEVELOPMENT AND TRADING CORPORATION LIMITED,EC Granted,https://environmentclearance.nic.in/TrackState_proposal.aspx?type=EC&status=EC_new&statename=West%20Bengal&pno=SIA/WB/MIN/440247/2023&pid=223933,https://environmentclearance.nic.in/timeline.aspx?pid=SIA/WB/MIN/440247/2023&type=EC&ID=223933
679,SIA/WB/MIS/70831/2017,,VYOM II,West Bengal,Kolkata,Kolkata,Date of Submission for TOR: ,Date of Submission for EC: 07 Nov 2017 ,INFRA-2,ALLWORTH TRADECOM PVT. LTD. & OTHERS,WithdrawEC,https://environmentclearance.nic.in/TrackState_proposal.aspx?type=EC&status=EC_new&statename=West%20Bengal&pno=SIA/WB/MIS/70831/2017&pid=39199,https://environmentclearance.nic.in/timeline.aspx?pid=SIA/WB/MIS/70831/2017&type=EC&ID=39199
