,Proposal.No.,File_No,Proposal Name,State,District,Tehsil,Date_1,Date_2,Category,Company,Status,Link,Timeline
0,SIA/WB/MIS/48035/2019,EN/T-II-1/005/2020,"Expansion of Existing Common Bio-Medical Waste Treatment Facility at Mouza Mangalpur, Touzi No. 19, Manbhum, Dag No. 457(P), 458(P), JL No. 22, Ranigunj P.O. & P.S., Paschim Bardhaman District.",West Bengal,Barddhaman,Raniganj,Date of Submission for TOR: ,Date of Submission for EC: 15 Feb 2022 ,INFRA-2,MEDICARE ENVIRONMENTAL MANAGEMENT PVT. LTD.,Delisted,https://environmentclearance.nic.in/TrackState_proposal.aspx?type=EC&status=EC_new&statename=West%20Bengal&pno=SIA/WB/MIS/48035/2019&pid=199102,https://environmentclearance.nic.in/timeline.aspx?pid=SIA/WB/MIS/48035/2019&type=EC&ID=199102
1,SIA/WB/MIS/220603/2021,EN/T-II-1/138/2021,Affordable Housing Complex under Pradhan Mantri Awas Yojana,West Bengal,Howrah,Domjur,Date of Submission for EC: 09 Aug 2021 ,Date of Ec Granted : 19 Sep 2022,INFRA-2,IDEAL RIVERVIEW PROJECTS PVT. LTD.,EC Granted,https://environmentclearance.nic.in/TrackState_proposal.aspx?type=EC&status=EC_new&statename=West%20Bengal&pno=SIA/WB/MIS/220603/2021&pid=189352,https://environmentclearance.nic.in/timeline.aspx?pid=SIA/WB/MIS/220603/2021&type=EC&ID=189352
2,SIA/WB/MIN/180373/2020,,Brick earth Mine on Mouza – Laliabari,West Bengal,Malda,Chanchal - I,Date of Submission for TOR: ,Date of Submission for EC: 23 Oct 2020 ,Non-Coal Mining,CRYSTAL CONSULTANTS,Delisted,https://environmentclearance.nic.in/TrackState_proposal.aspx?type=EC&status=EC_new&statename=West%20Bengal&pno=SIA/WB/MIN/180373/2020&pid=141140,https://environmentclearance.nic.in/timeline.aspx?pid=SIA/WB/MIN/180373/2020&type=EC&ID=141140
3,SIA/WB/MIN/197709/2021,,Sujapur Brick Soil Mining Project For M/s Maa Laxmi Brick Field,West Bengal,Malda,Maldah (old),Date of Submission for TOR: ,Date of Submission for EC: 11 Feb 2021 ,Non-Coal Mining,P & M SOLUTION,Delisted,https://environmentclearance.nic.in/TrackState_proposal.aspx?type=EC&status=EC_new&statename=West%20Bengal&pno=SIA/WB/MIN/197709/2021&pid=163203,https://environmentclearance.nic.in/timeline.aspx?pid=SIA/WB/MIN/197709/2021&type=EC&ID=163203
4,SIA/WB/MIN/232070/2021,,"Lodha Sand Mine on Silabati River at plot no: 389(P), J.L. No.-886, Area-0.63 Hectare/1.56 Acres , Mouza: Lodha, P.S. Garhbeta, District: Paschim Medinipur, State: West Bengal.",West Bengal,West Medinipur,Garhbeta,Date of Submission for TOR: ,Date of Submission for EC: 30 Sep 2021 ,Non-Coal Mining,BABLU SARKAR_LODHA,Delisted,https://environmentclearance.nic.in/TrackState_proposal.aspx?type=EC&status=EC_new&statename=West%20Bengal&pno=SIA/WB/MIN/232070/2021&pid=191776,https://environmentclearance.nic.in/timeline.aspx?pid=SIA/WB/MIN/232070/2021&type=EC&ID=191776
5,SIA/WB/MIN/167774/2020,EN/T-II-1/038/2020,"NALDUMRA SAND MINE (AREA- 5.00 HECTARES) ON KANGSHABATI RIVER ON Plot No.-46(P).LOCATED AT MOUZA- NALDUMRA, P.S. - MIDNAPORE, DISTRICT- PASCHIM MEDINIPUR, STATE- WEST BENGAL, JL NO. 82",,,,Date of Submission for TOR: ,Date of Submission for EC: 13 Oct 2020 ,Non-Coal Mining,SHEIKH FIROZUDDIN,Delisted,https://environmentclearance.nic.in/TrackState_proposal.aspx?type=EC&status=EC_new&statename=West%20Bengal&pno=SIA/WB/MIN/167774/2020&pid=123078,https://environmentclearance.nic.in/timeline.aspx?pid=SIA/WB/MIN/167774/2020&type=EC&ID=123078
6,SIA/WB/MIS/186026/2020,EN/T-II-1/079/2018,Parvati Garden,West Bengal,North 24 Parganas,Barrackpur - I,Date of Submission for TOR: ,Date of Submission for EC: 25 Jan 2021 ,INFRA-2,SURADHANI CHEMICALS AND BOARD MFG CO PVT LTD AND OTHERS,Delisted,https://environmentclearance.nic.in/TrackState_proposal.aspx?type=EC&status=EC_new&statename=West%20Bengal&pno=SIA/WB/MIS/186026/2020&pid=145518,https://environmentclearance.nic.in/timeline.aspx?pid=SIA/WB/MIS/186026/2020&type=EC&ID=145518
7,SIA/WB/MIN/259464/2022,,Lodha sand mine on Silabati river,West Bengal,West Medinipur,Garhbeta,Date of Submission for TOR: ,Date of Submission for EC: 05 Mar 2022 ,Non-Coal Mining,BABLU SARKAR_LODHA,Under examination of SEIAA ,https://environmentclearance.nic.in/TrackState_proposal.aspx?type=EC&status=EC_new&statename=West%20Bengal&pno=SIA/WB/MIN/259464/2022&pid=199900,https://environmentclearance.nic.in/timeline.aspx?pid=SIA/WB/MIN/259464/2022&type=EC&ID=199900
8,SIA/WB/MIN/262169/2022,EN/T-II-1/064/2023,Idilpur Sand Mine  Namita Enterprise Kanai Chandra Das,West Bengal,Barddhaman,Burdwan - I,Date of Submission for TOR: ,Date of Submission for EC: 03 Feb 2023 ,Non-Coal Mining,"NAMITA ENTERPRISE, IDILPUR",Rejection Letter Granted,https://environmentclearance.nic.in/TrackState_proposal.aspx?type=EC&status=EC_new&statename=West%20Bengal&pno=SIA/WB/MIN/262169/2022&pid=200601,https://environmentclearance.nic.in/timeline.aspx?pid=SIA/WB/MIN/262169/2022&type=EC&ID=200601
9,SIA/WB/MIN/218051/2021,,M/s MRB Brick Field,West Bengal,Malda,Chanchal - I,Date of Submission for TOR: ,Date of Submission for EC: 16 Jul 2021 ,Non-Coal Mining,M/S MRB BRICK FIELD,Delisted,https://environmentclearance.nic.in/TrackState_proposal.aspx?type=EC&status=EC_new&statename=West%20Bengal&pno=SIA/WB/MIN/218051/2021&pid=188934,https://environmentclearance.nic.in/timeline.aspx?pid=SIA/WB/MIN/218051/2021&type=EC&ID=188934
10,SIA/WB/MIS/133862/2019,,Proposed Tamluk Medical College on the premises of Purba Medinipur District Hospital at Tamralipta Municipality,West Bengal,East Medinipur,Tamluk,Date of Submission for TOR: ,Date of Submission for EC: 27 Dec 2019 ,INFRA-2,PURBA MEDINIPUR DISTRICT HOSPITAL,Delisted,https://environmentclearance.nic.in/TrackState_proposal.aspx?type=EC&status=EC_new&statename=West%20Bengal&pno=SIA/WB/MIS/133862/2019&pid=83939,https://environmentclearance.nic.in/timeline.aspx?pid=SIA/WB/MIS/133862/2019&type=EC&ID=83939
11,SIA/WB/IND/69795/2019,EN/T-II-1/021/2019,Installation of 2 No. 10 MT Induction Furnaces,West Bengal,Paschim bardhaman,Faridpur-Durgapur,Date of Submission for EC: 08 Dec 2021 ,Date of Ec Granted : 18 Jul 2023,Industrial Projects - 1,C.P. RE-ROLLERS LIMITED,EC Granted,https://environmentclearance.nic.in/TrackState_proposal.aspx?type=EC&status=EC_new&statename=West%20Bengal&pno=SIA/WB/IND/69795/2019&pid=194342,https://environmentclearance.nic.in/timeline.aspx?pid=SIA/WB/IND/69795/2019&type=EC&ID=194342
12,SIA/WB/MIS/245576/2021,EN/T-II-1/001/2022,Residential Complex by Nirvana Devcon LLP,West Bengal,Kolkata,Kolkata,Date of Submission for EC: 28 Dec 2021 ,Date of Ec Granted : 12 Apr 2022,INFRA-2,NIRVANA DEVCON LLP,EC Granted,https://environmentclearance.nic.in/TrackState_proposal.aspx?type=EC&status=EC_new&statename=West%20Bengal&pno=SIA/WB/MIS/245576/2021&pid=195107,https://environmentclearance.nic.in/timeline.aspx?pid=SIA/WB/MIS/245576/2021&type=EC&ID=195107
13,SIA/WB/MIN/198437/2021,,"B.N.T Brick Field, Baidya Nath Ta",West Bengal,Barddhaman,Galsi - I,Date of Submission for TOR: ,Date of Submission for EC: 29 Oct 2021 ,Non-Coal Mining,RAY TECHNO SOLUTIONS,Delisted,https://environmentclearance.nic.in/TrackState_proposal.aspx?type=EC&status=EC_new&statename=West%20Bengal&pno=SIA/WB/MIN/198437/2021&pid=164370,https://environmentclearance.nic.in/timeline.aspx?pid=SIA/WB/MIN/198437/2021&type=EC&ID=164370
14,SIA/WB/MIN/188237/2020,EN/T-II-1/146/2021,PAWAN BRICK EARTH,West Bengal,Bankura,Barjora,Date of Submission for TOR: ,Date of Submission for EC: 17 Aug 2021 ,Non-Coal Mining,PAWAN BRICKS FIELD,Delisted,https://environmentclearance.nic.in/TrackState_proposal.aspx?type=EC&status=EC_new&statename=West%20Bengal&pno=SIA/WB/MIN/188237/2020&pid=148039,https://environmentclearance.nic.in/timeline.aspx?pid=SIA/WB/MIN/188237/2020&type=EC&ID=148039
15,SIA/WB/MIN/188839/2020,EN/T-II-1/133/2021,GURU BRICK EARTH,West Bengal,Bankura,Bankura - I,Date of Submission for TOR: ,Date of Submission for EC: 04 May 2021 ,Non-Coal Mining,M/S GURU BRICKS,Delisted,https://environmentclearance.nic.in/TrackState_proposal.aspx?type=EC&status=EC_new&statename=West%20Bengal&pno=SIA/WB/MIN/188839/2020&pid=149171,https://environmentclearance.nic.in/timeline.aspx?pid=SIA/WB/MIN/188839/2020&type=EC&ID=149171
16,SIA/WB/MIS/182626/2020,EN/T-II-1/053/2020,MODIFICATION & EXPANSION OF RESIDENTIAL PROJECT,West Bengal,North 24 Parganas,Barasat - I,Date of Submission for TOR: ,Date of Submission for EC: 09 Nov 2020 ,INFRA-2,TAPAS MITRA & OTHERS,WithdrawEC,https://environmentclearance.nic.in/TrackState_proposal.aspx?type=EC&status=EC_new&statename=West%20Bengal&pno=SIA/WB/MIS/182626/2020&pid=142687,https://environmentclearance.nic.in/timeline.aspx?pid=SIA/WB/MIS/182626/2020&type=EC&ID=142687
17,SIA/WB/MIN/246735/2021,,STONE CRUSHING UNIT OF M/S Mahanty Stone Crushing Unit and Arabinda Mahanty,West Bengal,Purulia,Barabazar,Date of Submission for TOR: ,Date of Submission for EC: 22 Dec 2021 ,Non-Coal Mining,STONE CRUSHING UNIT OF M/S MAHANTY STONE CRUSHING UNIT AND ARABINDA MAHANTY,Delisted,https://environmentclearance.nic.in/TrackState_proposal.aspx?type=EC&status=EC_new&statename=West%20Bengal&pno=SIA/WB/MIN/246735/2021&pid=195460,https://environmentclearance.nic.in/timeline.aspx?pid=SIA/WB/MIN/246735/2021&type=EC&ID=195460
18,SIA/WB/MIS/47419/2019,EN/T-II-1/045/2019,IDEAL AQUAVIEW,West Bengal,North 24 Parganas,Rajarhat,Date of Submission for TOR: ,Date of Submission for EC: 28 Nov 2019 ,INFRA-2,AQUAVIEW PROJECTS PVT.  LTD.,WithdrawEC,https://environmentclearance.nic.in/TrackState_proposal.aspx?type=EC&status=EC_new&statename=West%20Bengal&pno=SIA/WB/MIS/47419/2019&pid=77531,https://environmentclearance.nic.in/timeline.aspx?pid=SIA/WB/MIS/47419/2019&type=EC&ID=77531
19,SIA/WB/MIS/180008/2020,EN/T-II-1/062/2020,"CGEWHO Housing Project, Kolkata",West Bengal,South 24 Parganas,Bishnupur - I,Date of Submission for TOR: ,Date of Submission for EC: 01 Dec 2020 ,INFRA-2,"CENTRAL GOVERNMENT EMPLOYEES WELFARE HOUSING ORGANISATION, KOLKATA PHASE III",Delisted,https://environmentclearance.nic.in/TrackState_proposal.aspx?type=EC&status=EC_new&statename=West%20Bengal&pno=SIA/WB/MIS/180008/2020&pid=140082,https://environmentclearance.nic.in/timeline.aspx?pid=SIA/WB/MIS/180008/2020&type=EC&ID=140082
20,SIA/WB/MIN/185269/2020,,"Dadpur Sand Mine ob Damodar River, Kamal Kumar Ghosh",West Bengal,Barddhaman,Jamalpur,Date of Submission for TOR: ,Date of Submission for EC: 31 Jan 2021 ,Non-Coal Mining,RAY TECHNO SOLUTIONS,Delisted,https://environmentclearance.nic.in/TrackState_proposal.aspx?type=EC&status=EC_new&statename=West%20Bengal&pno=SIA/WB/MIN/185269/2020&pid=145317,https://environmentclearance.nic.in/timeline.aspx?pid=SIA/WB/MIN/185269/2020&type=EC&ID=145317
21,SIA/WB/MIS/143235/2020,,Super Diamond Enterprises,West Bengal,North 24 Parganas,Barasat - I,Date of Submission for TOR: ,Date of Submission for EC: 15 Jul 2020 ,INFRA-2,SUPER DIAMOND ENTERPRISES,WithdrawEC,https://environmentclearance.nic.in/TrackState_proposal.aspx?type=EC&status=EC_new&statename=West%20Bengal&pno=SIA/WB/MIS/143235/2020&pid=91311,https://environmentclearance.nic.in/timeline.aspx?pid=SIA/WB/MIS/143235/2020&type=EC&ID=91311
22,SIA/WB/MIN/141542/2020,EN/T-II-1/009/2020,PALSARA BLACK STONE MINE,West Bengal,,,Date of Submission for EC: 09 Feb 2020 ,Date of Ec Granted : 28 Sep 2020,Non-Coal Mining,WEST BENGAL MINERAL DEVELOPMENT AND TRADING CORPORATION LIMITED,EC Granted,https://environmentclearance.nic.in/TrackState_proposal.aspx?type=EC&status=EC_new&statename=West%20Bengal&pno=SIA/WB/MIN/141542/2020&pid=86967,https://environmentclearance.nic.in/timeline.aspx?pid=SIA/WB/MIN/141542/2020&type=EC&ID=86967
23,SIA/WB/MIS/55424/2020,EN/T-II-1/018/2020,Common Bio Medical Waste Treatment Facility proposed by M/S SNG Envirosolutions Private Limited,West Bengal,Bankura,Barjora,Date of Submission for TOR: ,Date of Submission for EC: 13 Aug 2021 ,INFRA-1,M/S SNG ENVIROSOLUTIONS PRIVATE LIMITED,WithdrawEC,https://environmentclearance.nic.in/TrackState_proposal.aspx?type=EC&status=EC_new&statename=West%20Bengal&pno=SIA/WB/MIS/55424/2020&pid=190054,https://environmentclearance.nic.in/timeline.aspx?pid=SIA/WB/MIS/55424/2020&type=EC&ID=190054
24,SIA/WB/MIS/168212/2020,EN/T-II-1/053/2016,M/s SRINIVAAS INFRA DEVELOERS PVT. LTD.,West Bengal,Kolkata,Kolkata,Date of Submission for EC: 04 Dec 2020 ,Date of Ec Granted : 03 Dec 2021,INFRA-2,SRINIVAAS INFRA DEVELOPERS.PVT. LTD.,EC Granted,https://environmentclearance.nic.in/TrackState_proposal.aspx?type=EC&status=EC_new&statename=West%20Bengal&pno=SIA/WB/MIS/168212/2020&pid=124154,https://environmentclearance.nic.in/timeline.aspx?pid=SIA/WB/MIS/168212/2020&type=EC&ID=124154
25,SIA/WB/MIN/166540/2020,EN/T-II-1/031/2020,"MOLDANGA SAND MINE (AREA- 0.42 HECTARES) ON SILABATI RIVER ON Plot No.- 473(P), MOUZA- MOLDANGA, P.S. - GARHBETA, DISTRICT- PASCHIM MEDINIPUR, STATE- WEST BENGAL",,,,Date of Submission for TOR: ,Date of Submission for EC: 13 Oct 2020 ,Non-Coal Mining,PRASANTA KARAK,Delisted,https://environmentclearance.nic.in/TrackState_proposal.aspx?type=EC&status=EC_new&statename=West%20Bengal&pno=SIA/WB/MIN/166540/2020&pid=121771,https://environmentclearance.nic.in/timeline.aspx?pid=SIA/WB/MIN/166540/2020&type=EC&ID=121771
26,SIA/WB/MIN/166548/2020,,"Chhotapasha Sand Mine (Area: 1.42ha) on Kangshabati River on Plot No. 266 (P), P.S. Keshpur, District Paschim Medinipore",,,,Date of Submission for TOR: ,Date of Submission for EC: 31 Aug 2021 ,Non-Coal Mining,SHEIKH MURSED ALI,Delisted,https://environmentclearance.nic.in/TrackState_proposal.aspx?type=EC&status=EC_new&statename=West%20Bengal&pno=SIA/WB/MIN/166548/2020&pid=121774,https://environmentclearance.nic.in/timeline.aspx?pid=SIA/WB/MIN/166548/2020&type=EC&ID=121774
27,SIA/WB/MIS/182182/2020,EN/T-II-1/004/2021,"Modification & Expansion of Residential Complex,",West Bengal,North 24 Parganas,Rajarhat,Date of Submission for EC: 04 Feb 2021 ,Date of Ec Granted : 17 Jun 2022,INFRA-2,DISPLAY VINIMAY PRIVATE LIMITED,EC Granted,https://environmentclearance.nic.in/TrackState_proposal.aspx?type=EC&status=EC_new&statename=West%20Bengal&pno=SIA/WB/MIS/182182/2020&pid=142579,https://environmentclearance.nic.in/timeline.aspx?pid=SIA/WB/MIS/182182/2020&type=EC&ID=142579
28,SIA/WB/MIN/186847/2020,,Darol Brick Earth Mine,West Bengal,Malda,Harishchandrapur - I,Date of Submission for TOR: ,Date of Submission for EC: 07 Dec 2020 ,Non-Coal Mining,CRYSTAL CONSULTANTS,Delisted,https://environmentclearance.nic.in/TrackState_proposal.aspx?type=EC&status=EC_new&statename=West%20Bengal&pno=SIA/WB/MIN/186847/2020&pid=146715,https://environmentclearance.nic.in/timeline.aspx?pid=SIA/WB/MIN/186847/2020&type=EC&ID=146715
29,SIA/WB/MIN/206941/2021,,M/s Isha Brick Field,West Bengal,Malda,Chanchal - II,Date of Submission for TOR: ,Date of Submission for EC: 30 Mar 2021 ,Non-Coal Mining,M/S ISHA BRICK FIELD,Delisted,https://environmentclearance.nic.in/TrackState_proposal.aspx?type=EC&status=EC_new&statename=West%20Bengal&pno=SIA/WB/MIN/206941/2021&pid=175604,https://environmentclearance.nic.in/timeline.aspx?pid=SIA/WB/MIN/206941/2021&type=EC&ID=175604
30,SIA/WB/MIN/187407/2020,EN/T-II-1/049/2021,BERADA QUARTZ MINE,West Bengal,Purulia,Barabazar,Date of Submission for EC: 10 Feb 2021 ,Date of Ec Granted : 10 Mar 2023,Non-Coal Mining,M/S KALKONS,EC Granted,https://environmentclearance.nic.in/TrackState_proposal.aspx?type=EC&status=EC_new&statename=West%20Bengal&pno=SIA/WB/MIN/187407/2020&pid=146872,https://environmentclearance.nic.in/timeline.aspx?pid=SIA/WB/MIN/187407/2020&type=EC&ID=146872
31,SIA/WB/MIN/229943/2021,,BRICK EARTH MINE IN MOUZA – SRIPUR,West Bengal,Malda,Chanchal - I,Date of Submission for TOR: ,Date of Submission for EC: 18 Sep 2021 ,Non-Coal Mining,SUPER BRICK FIELD,Delisted,https://environmentclearance.nic.in/TrackState_proposal.aspx?type=EC&status=EC_new&statename=West%20Bengal&pno=SIA/WB/MIN/229943/2021&pid=191285,https://environmentclearance.nic.in/timeline.aspx?pid=SIA/WB/MIN/229943/2021&type=EC&ID=191285
32,SIA/WB/MIS/104978/2019,EN/T-II-1/067/2019,“INFOSYS” - IT / ITES building along with M.L.C.P. building and service block,West Bengal,South 24 Parganas,Bhangar - II,Date of Submission for EC: 11 Sep 2019 ,Date of Ec Granted : 17 Sep 2021,INFRA-2,INFOSYS LTD,EC Granted,https://environmentclearance.nic.in/TrackState_proposal.aspx?type=EC&status=EC_new&statename=West%20Bengal&pno=SIA/WB/MIS/104978/2019&pid=55540,https://environmentclearance.nic.in/timeline.aspx?pid=SIA/WB/MIS/104978/2019&type=EC&ID=55540
33,SIA/WB/MIN/202972/2021,EN/T-II-1/073/2021,JOYHAT SAND MINE OF MR. ABAIDUR RAHAMAN,West Bengal,Uttar Dinajpur,Itahar,Date of Submission for TOR: ,Date of Submission for EC: 11 Mar 2021 ,Non-Coal Mining,JOYHAT SAND MINE OF MR. ABAIDUR RAHAMAN,Delisted,https://environmentclearance.nic.in/TrackState_proposal.aspx?type=EC&status=EC_new&statename=West%20Bengal&pno=SIA/WB/MIN/202972/2021&pid=173494,https://environmentclearance.nic.in/timeline.aspx?pid=SIA/WB/MIN/202972/2021&type=EC&ID=173494
34,SIA/WB/MIS/50515/2018,EN/T-II-1/090/2018,Diamond City North,West Bengal,North 24 Parganas,Barrackpur - II,Date of Submission for TOR: ,Date of Submission for EC: 31 Jan 2020 ,INFRA-2,M/S ALCOVE CONSTRUCTION PVT. LTD. & OTHERS,Delisted,https://environmentclearance.nic.in/TrackState_proposal.aspx?type=EC&status=EC_new&statename=West%20Bengal&pno=SIA/WB/MIS/50515/2018&pid=86533,https://environmentclearance.nic.in/timeline.aspx?pid=SIA/WB/MIS/50515/2018&type=EC&ID=86533
35,SIA/WB/MIS/165818/2020,,"ESR Uluberia Logistics Park (A Warehouse Complex) 1,42,287.47 m2 (35.16 Acres) located at Plot Nos. J.L. No. 09, Mouza, Chandipur and J.L. No. 55, Mouza Harinarayanchak and J.L. No. 8, Ambraberia, P.S. Uluberia, District Howrah, Kolkata",West Bengal,Howrah,Uluberia - I,Date of Submission for TOR: ,Date of Submission for EC: 30 Jul 2020 ,INFRA-2,ESR WAREHOUSING PVT. LTD.,Delisted,https://environmentclearance.nic.in/TrackState_proposal.aspx?type=EC&status=EC_new&statename=West%20Bengal&pno=SIA/WB/MIS/165818/2020&pid=121618,https://environmentclearance.nic.in/timeline.aspx?pid=SIA/WB/MIS/165818/2020&type=EC&ID=121618
36,SIA/WB/MIN/262580/2022,,Gopalpur Sand Mining Ashim Panja,West Bengal,Barddhaman,Galsi - II,Date of Submission for TOR: ,Date of Submission for EC: 18 Dec 2022 ,Non-Coal Mining,"KUMIRKOLA SAND MINE, ASHIM PANJA",Query raised by SEIAA and pending at PP,https://environmentclearance.nic.in/TrackState_proposal.aspx?type=EC&status=EC_new&statename=West%20Bengal&pno=SIA/WB/MIN/262580/2022&pid=200720,https://environmentclearance.nic.in/timeline.aspx?pid=SIA/WB/MIN/262580/2022&type=EC&ID=200720
37,SIA/WB/IND2/277881/2022,EN/T-II-1/042/2022,"Proposed Onshore Exploratory drilling of 7 wells in Bengal Onshore OALP-III Block BP-ONHP-2018/1 situated in North 24 Parganas and South 24 Parganas districts, West Bengal by M/s. ONGC Limited, MBA Basin",West Bengal,North 24 Parganas,Gaighata,Date of Submission for EC: 13 Jun 2022 ,Date of Ec Granted : 26 Sep 2022,Industrial Projects - 2, OIL AND NATURAL GAS CORPORATION LIMITED,EC Granted,https://environmentclearance.nic.in/TrackState_proposal.aspx?type=EC&status=EC_new&statename=West%20Bengal&pno=SIA/WB/IND2/277881/2022&pid=204526,https://environmentclearance.nic.in/timeline.aspx?pid=SIA/WB/IND2/277881/2022&type=EC&ID=204526
38,SIA/WB/MIN/216239/2021,EN/T-II-1/114/2021,"KOGRAM SAND MINE (AREA- 3.40 HECTARES) ON AJAY RIVER ON Plot No.-284(P), 285(P)& ORS",West Bengal,Barddhaman,Mangolkote,Date of Submission for TOR: ,Date of Submission for EC: 28 Jun 2021 ,Non-Coal Mining,ASHOK KR. SAHA,Delisted,https://environmentclearance.nic.in/TrackState_proposal.aspx?type=EC&status=EC_new&statename=West%20Bengal&pno=SIA/WB/MIN/216239/2021&pid=188543,https://environmentclearance.nic.in/timeline.aspx?pid=SIA/WB/MIN/216239/2021&type=EC&ID=188543
39,SIA/WB/MIN/206816/2021,,M/s Noor Brick Field,West Bengal,Malda,Harishchandrapur - I,Date of Submission for TOR: ,Date of Submission for EC: 29 Mar 2021 ,Non-Coal Mining,M/S NOOR BRICK FIELD,Delisted,https://environmentclearance.nic.in/TrackState_proposal.aspx?type=EC&status=EC_new&statename=West%20Bengal&pno=SIA/WB/MIN/206816/2021&pid=175559,https://environmentclearance.nic.in/timeline.aspx?pid=SIA/WB/MIN/206816/2021&type=EC&ID=175559
40,SIA/WB/IND2/42446/2018,EN/T-II-1/071/2019,TANDHAN BIOCHEMICALS PRIVATE LIMITED,West Bengal,Howrah,Bagnan - I,Date of Submission for EC: 07 Sep 2019 ,Date of Ec Granted : 17 Nov 2022,Industrial Projects - 2,TANDHAN BIOCHEMICALS PRIVATE LIMITED,EC Granted,https://environmentclearance.nic.in/TrackState_proposal.aspx?type=EC&status=EC_new&statename=West%20Bengal&pno=SIA/WB/IND2/42446/2018&pid=63284,https://environmentclearance.nic.in/timeline.aspx?pid=SIA/WB/IND2/42446/2018&type=EC&ID=63284
41,SIA/WB/MIN/211010/2021,,Becharhat Sand Mine,West Bengal,Barddhaman,Burdwan - II,Date of Submission for TOR: ,Date of Submission for EC: 30 Apr 2021 ,Non-Coal Mining,MATIAR RAHAMAN,Delisted,https://environmentclearance.nic.in/TrackState_proposal.aspx?type=EC&status=EC_new&statename=West%20Bengal&pno=SIA/WB/MIN/211010/2021&pid=183512,https://environmentclearance.nic.in/timeline.aspx?pid=SIA/WB/MIN/211010/2021&type=EC&ID=183512
42,SIA/WB/MIN/261603/2022,EN/T-II-1/560/2023,Bhatpara[Plot No. 172(P) & 194(P); J.L. No.- 84] sand deposit on Kangshabati River,West Bengal,West Medinipur,Medinipur Sadar,Date of Submission for TOR: ,Date of Submission for EC: 15 Dec 2023 ,Non-Coal Mining,SUBHRANGSU KUMAR GHOSH,ADS by SEAC,https://environmentclearance.nic.in/TrackState_proposal.aspx?type=EC&status=EC_new&statename=West%20Bengal&pno=SIA/WB/MIN/261603/2022&pid=200467,https://environmentclearance.nic.in/timeline.aspx?pid=SIA/WB/MIN/261603/2022&type=EC&ID=200467
43,SIA/WB/MIN/192882/2021,EN/T-II-1/071/2021,Dumur,West Bengal,Purba Burdwan,Burdwan,Date of Submission for TOR: ,Date of Submission for EC: 10 Mar 2021 ,Non-Coal Mining,INAAYA ENTERPRISE,Delisted,https://environmentclearance.nic.in/TrackState_proposal.aspx?type=EC&status=EC_new&statename=West%20Bengal&pno=SIA/WB/MIN/192882/2021&pid=160029,https://environmentclearance.nic.in/timeline.aspx?pid=SIA/WB/MIN/192882/2021&type=EC&ID=160029
44,SIA/WB/MIN/188890/2020,,DURGANAGAR BRICK EARTH MINE,West Bengal,South 24 Parganas,Kulpi,Date of Submission for TOR: ,Date of Submission for EC: 22 Dec 2020 ,Non-Coal Mining,M/S RAMESHWAR BRICK INDUSTRIES,Delisted,https://environmentclearance.nic.in/TrackState_proposal.aspx?type=EC&status=EC_new&statename=West%20Bengal&pno=SIA/WB/MIN/188890/2020&pid=149184,https://environmentclearance.nic.in/timeline.aspx?pid=SIA/WB/MIN/188890/2020&type=EC&ID=149184
45,SIA/WB/MIN/198036/2021,,Brick Earth Mine of M/s Bijay Prasad,West Bengal,Darjeeling,Phansidewa,Date of Submission for TOR: ,Date of Submission for EC: 12 Feb 2021 ,Non-Coal Mining,M/S BIJAY PRASAD,Delisted,https://environmentclearance.nic.in/TrackState_proposal.aspx?type=EC&status=EC_new&statename=West%20Bengal&pno=SIA/WB/MIN/198036/2021&pid=163273,https://environmentclearance.nic.in/timeline.aspx?pid=SIA/WB/MIN/198036/2021&type=EC&ID=163273
46,SIA/WB/MIN/177481/2020,EN/T-II-1/023/2020,AMILASAI SAND MINE ON SUBARNAREKHA RIVER,West Bengal,West Medinipur,Keshiary,Date of Submission for TOR: ,Date of Submission for EC: 05 Oct 2020 ,Non-Coal Mining,VARIETY VYAPAAR PRIVATE LIMITED,Delisted,https://environmentclearance.nic.in/TrackState_proposal.aspx?type=EC&status=EC_new&statename=West%20Bengal&pno=SIA/WB/MIN/177481/2020&pid=136580,https://environmentclearance.nic.in/timeline.aspx?pid=SIA/WB/MIN/177481/2020&type=EC&ID=136580
47,SIA/WB/MIN/179964/2020,,Anail Brick Earth,West Bengal,Malda,Habibpur,Date of Submission for TOR: ,Date of Submission for EC: 21 Oct 2020 ,Non-Coal Mining,CRYSTAL CONSULTANTS,Delisted,https://environmentclearance.nic.in/TrackState_proposal.aspx?type=EC&status=EC_new&statename=West%20Bengal&pno=SIA/WB/MIN/179964/2020&pid=139074,https://environmentclearance.nic.in/timeline.aspx?pid=SIA/WB/MIN/179964/2020&type=EC&ID=139074
48,SIA/WB/MIS/240390/2021,,Redevelopment of 21 Residential Quarters by SAIL-ISP,West Bengal,Paschim bardhaman,Durgapur,Date of Submission for TOR: ,Date of Submission for EC: 29 Dec 2021 ,INFRA-2,INDIAN IRON & STEEL COMPANY (IISCO),Delisted,https://environmentclearance.nic.in/TrackState_proposal.aspx?type=EC&status=EC_new&statename=West%20Bengal&pno=SIA/WB/MIS/240390/2021&pid=193698,https://environmentclearance.nic.in/timeline.aspx?pid=SIA/WB/MIS/240390/2021&type=EC&ID=193698
49,SIA/WB/MIS/37316/2018,EN/T-II-1/029/2018,SANKALPA - I,West Bengal,North 24 Parganas,Rajarhat,Date of Submission for EC: 04 Jun 2019 ,Date of Ec Granted : 24 Sep 2020,INFRA-2,WEST BENGAL INFRASTRUCTURE DEVELOPMENT FINANCE CORPORATION LIMITED,EC Granted - Processed offline,https://environmentclearance.nic.in/TrackState_proposal.aspx?type=EC&status=EC_new&statename=West%20Bengal&pno=SIA/WB/MIS/37316/2018&pid=56364,https://environmentclearance.nic.in/timeline.aspx?pid=SIA/WB/MIS/37316/2018&type=EC&ID=56364
50,SIA/WB/MIN/192683/2021,EN/T-II-1/072/2021,Kumirkola,West Bengal,Purba Burdwan,Burdwan,Date of Submission for TOR: ,Date of Submission for EC: 10 Mar 2021 ,Non-Coal Mining,M/S ALAM ENTERPRISE,Delisted,https://environmentclearance.nic.in/TrackState_proposal.aspx?type=EC&status=EC_new&statename=West%20Bengal&pno=SIA/WB/MIN/192683/2021&pid=159990,https://environmentclearance.nic.in/timeline.aspx?pid=SIA/WB/MIN/192683/2021&type=EC&ID=159990
51,SIA/WB/MIN/184106/2020,EN/T-II-1/052/2020,Gopiballavpur – I Sand Block MGB – 103,West Bengal,West Medinipur,Jhargram,Date of Submission for TOR: ,Date of Submission for EC: 20 Nov 2020 ,Non-Coal Mining,PRANESHYAM RAKSHIT,WithdrawEC,https://environmentclearance.nic.in/TrackState_proposal.aspx?type=EC&status=EC_new&statename=West%20Bengal&pno=SIA/WB/MIN/184106/2020&pid=144048,https://environmentclearance.nic.in/timeline.aspx?pid=SIA/WB/MIN/184106/2020&type=EC&ID=144048
