,Sno.,Proposal No.,File No.,Project Name,Company,Proposal Status,Project Type,View
1,1,SIA/CG/MIN/93983/2019,,TAKAM SAND MINES,SARPANCH TAKAM B,Delisted,EC,
2,2,SIA/CG/MIN/33023/2015,OL/EC/SANDMINE/DHAMTARI/161,Gadadih sand Mine,CMO KURUD,EC Granted,EC,
3,3,SIA/CG/MIN/33508/2019,OL/EC/IND/KANKER/795,Capacity Expansion from 0.60 to 1.20 MTPA (1.0 MTPA Iron Ore above threshold value (+45% Fe) & 0.20 MTPA below threshold value Mineral (-45% Fe which is Part of Overburden)) & Installation of a new 0.48 MTPA Iron Ore Beneficiation Plant (Primary Dry/Wet) - M/s. Shri Bajrang Power & Ispat Limited,SHRI BAJRANG POWER ISPAT LIMITED,EC Granted,EC,
4,4,SIA/CG/NCP/72138/2018,OL/EC/NCP/RAIPUR/666,Multistoried Residential and commercial Project,AARTI INFRASTRUCTURE AND BUILDCON LIMITED,Delisted,EC,
5,5,SIA/CG/MIN/42477/2016,OL/EC/LIMESTONE_MINE/RAJNANDGAON/342,Dumardihkala Lime Stone Query,SMT SANGEETA DEVI RUNGTA,Delisted,EC,
6,6,SIA/CG/MIN/34870/2019,OL/EC/SANDMINE/BALODABAZAR_BHATAPARA/834,River Bed Sand Mine -  (Kushgarh Sand Mine),KUSHGARH SAND MINE,EC Granted,EC,
7,7,SIA/CG/MIS/104501/2019,OL/EC/MIS/RAIPUR/859,Multistoried Residential complex by Rajat Realty,RAJAT REALTY,EC Granted,EC,
8,8,SIA/CG/MIN/212617/2021,OL/EC/SANDMINE/GARIABAND/1677,sarkara01 sand mine,SARKARA 01 SAND MINE,EC Granted,EC,
9,9,SIA/CG/MIN/219228/2021,OL/EC/MIN/MUNGELI/1754,"M/S DANESHAWAR SAHU, BRICK EARTH MINE",DANESHAWAR SAHU BRICK EARTH MINE,EC Granted,EC,
10,10,SIA/CG/RIV/189552/2020,OL/EC/MIN/GARIABAND/1499,Upper Sikasar Reservoir Project,"GARIYABAND, WATER RESOURCE DIVISION, CG",Under examination of SEIAA after SEAC,EC,
1,11,SIA/CG/MIN/250119/2022,,Amakoni Limestone Quarry,AMAKONI LIMESTONE QUARRY,Delisted,EC,
2,12,SIA/CG/IND/60799/2021,OL/EC/IND/RAIPUR/1554,,VASWANI  INDUSTRIES LIMITED,EC Granted,EC,
3,13,SIA/CG/MIN/412758/2023,,Salka Ordinary Stone mine of Vivek Jaiswal,VIVEK JAISWAL,Pending at PP due to eds,EC,
4,14,SIA/CG/RIV/30964/2007,,"KELO MAJOR IRRIGATION PROJECT IN THE VILLAGE DANOTE, DISTRICT RAIGARH OF CHHATTISGARH",EXECUTIVE ENGINEER KELO PROJECT SURVEY DIVISION RAIGARH,Pending at PP due to eds,EC,
5,15,SIA/CG/MIN/41526/2019,OL/EC/MIN/KANKER/943,Dharmendra Chopra,SHRI DHARMENDRA CHOPRA,Rejection Letter Granted,EC,
6,16,SIA/CG/MIN/65637/2017,OL/EC/LIME_STONE/BASTAR/616,"Limestone Mine, Village - Chhote Kadma",SHRI REKH CHAND JAIN,EC Granted,EC,
7,17,SIA/CG/MIN/143721/2020,OL/EC/MIN/RAJNANDGAON/1187,Bhagirathi Chakradhari Joratarai Limestone Mine,BHAGIRATHI CHAKRADHARI,EC Granted,EC,
8,18,SIA/CG/MIN/34079/2015,OL/EC/LIMESTONEMINE/DHAMTARI/210,Goji Limestone quarry,GOJI LIMESTONE QUARRY,EC Granted,EC,
9,19,SIA/CG/MIN/173567/2020,OL/EC/MIN/BALRAMPUR/1396,Pachawal sand mine of Hitesh Singh Thakur,PACHAWAL SAND MINE OF HITESH SINGH THAKUR,EC Granted,EC,
10,20,SIA/CG/MIN/203140/2021,OL/EC/MIN/JANJGIR_CHAMPA/1597,Tarod Limestone Mine,NILKAMAL SINGH,EC Granted - Processed offline,EC,
1,21,SIA/CG/MIN/169627/2020,OL/EC/MIN/KANKER/1378,SANJAY KRISHNANI STONE QUARRY,KANKER  STONE,EC Granted,EC,
2,22,SIA/CG/MIN/169678/2020,OL/EC/MIN/J_Champa/1377,Bhogahapara sand mine of Abhishek Agrawal,BHOGAHAPARA SAND MINE OF ABHISHEK AGRAWAL,EC Granted,EC,
3,23,SIA/CG/MIN/63153/2017,OL/EC/SAND_MINE/RAIPUR/569,JANPADPANCHAYAT ABHANPUR SAND MINE VILLAGE PARAGAON,JANPAD PANCHAYAT ABHANPUR SAND MINE PARAGAON,EC Granted,EC,
4,24,SIA/CG/MIN/35348/2015,,M/S Key Stone Infra Pvt. Ltd. Village Bhairamgarh,M/S KEY STONE PVT. LTD. BHAIRAMGARH,Delisted,EC,
5,25,SIA/CG/MIN/146728/2020,OL/EC/MIN/DHAMTARI/1220,Karelibadi sand mine of Ronak Singh Rajput,KARELIBADI SAND MINE OF RONAK SINGH RAJPUT,EC Granted,EC,
6,26,SIA/CG/IND/79354/2018,OL/EC/MIN/SURAJPUR/739,Expansion of Rolling Mill by M/s UB Ventures Pvt. Limited,UB VENTURES PRIVATE LIMITED,EC Granted,EC,
7,27,SIA/CG/MIN/228073/2021,OL/EC/MIN/RAIGARH/1806,tendumundi sand mine,TENDUMUNDI SAND MINE,For further consideration(SEAC),EC,
8,28,SIA/CG/MIN/31723/2015,OL/EC/SANDMINE/JANJGIRCHAMPA/57,sand mine maveshi bazar,CMO CHAPA,EC Granted,EC,
9,29,SIA/CG/MIN/52488/2016,,"M/s Ram Charan Sirdar Lime Stone Mine, Village Pinkapar,Tehsil Dondi Lohara,District Balod, Chhattisgarh",RAM CHARAN SIRDAR LIME STONE MINE,Delisted,EC,
10,30,SIA/CG/MIN/230118/2021,,Maa Kudargarhi Stone Crusher Pvt. Ltd. Ordinary stone Quarry,MAA KUDARGARHI STONE CRUSHER PVT. LTD.,WithdrawEC,EC,
1,31,SIA/CG/MIN/34393/2019,OL/EC/LIMESTONEMINE/GARIABANDH/821,pasaud sand mine,SAND MINE PASAUD,EC Granted - Processed offline,EC,
2,32,SIA/CG/MIN/143441/2020,OL/EC/MIN/RAIGARH/1177,E-2 Kachhar Ordinary Sand Quarry,DHRUV KUMAR AGRAWAL,EC Granted,EC,
3,33,SIA/CG/MIN/222218/2021,OL/EC/MIN/JASHPUR/1750,Boki Ordinary Stone Quarry,SHRI ABHAY KUMAR SONI,For further consideration(SEAC),EC,
4,34,SIA/CG/MIN/217146/2021,OL/EC/MIN/DANTEWADA/1717,Narsinghpur Sand Quarry  of Vijay Kumar Sharma,VIJAY KUMAR SHARMA,EC Granted,EC,
5,35,SIA/CG/MIN/43865/2019,,M/s Bharat Builders (Prop. Smt. Shanti Devi),BHARAT BUILDERS PROP SHANTI DEVI,Delisted,EC,
6,36,SIA/CG/MIN/48449/2018,OL/EC/MIN/DURG/698,A K Verma Pathariya Limestone Mine,A K VERMA LIMESTONE,EC Granted,EC,
7,37,SIA/CG/MIN/138953/2020,OL/EC/MIN/SUKMA/1152,Murtonda Ordinary Stone Quarry 0.62 Ha (M/s Ram Sharan Singh),M/S RAM SHARAN SINGH,EC Granted,EC,
8,38,SIA/CG/IND/243325/2021,OL/EC/IND/RAIPUR/1847,"Expansion of manufacturing capacity of  Re-rolled Products from 30,000 to 59,400 by hot charging and proposed installation Induction Furnace and 150 TPD Slag Crusher.",M/S. SHYAM STEEL INDUSTRIES,Rejection Letter Granted,EC,
9,39,SIA/CG/MIN/420241/2023,OL/EC/MIN/RAIGARH/2347,CHIRODIH ORDINARY STONE MINE OF NAVEEN KUMAR AGRAWAL,NAVEEN AGRAWAL,EC Granted,EC,
10,40,SIA/CG/MIN/443559/2023,OL/EC/MIN/BILASPUR/2664,Gram Panchayat Chhatauna,PREM PAIKRA,Under examination of SEIAA after SEAC,EC,
1,41,SIA/CG/MIN/30922/2015,,hjj,PARMANAND STONE,Delisted,EC,
2,42,SIA/CG/MIN/32920/2015,OL/EC/LIMESTONEMINE/BILASPUR/156,Suraiya Bano Limestone Mine,SARKAR MINERAL,EC Granted,EC,
3,43,SIA/CG/MIN/50073/2018,OL/EC/MIN/BASTAR/705,Baranji Limestone mine,KUSUM TULSHYAN,Under examination of SEIAA after SEAC,EC,
4,44,SIA/CG/MIN/48066/2016,OL/EC/SANDMINE/RAIGARH/364,Nawapara Sand Mining,SARPANCH NAWAPARA MAND,EC Granted,EC,
5,45,SIA/CG/MIN/276033/2022,OL/EC/MIN/RAIPUR/2064,Nakti Khapri Limestone Quarry,TARACHAND AHUJA,Under examination of SEIAA after SEAC,EC,
6,46,SIA/CG/MIN/416379/2023,OL/EC/MIN/BILASPUR/1760,M/s Vandana Enterprises,BELSARA DOLOMITE STONE MINE,For further consideration(SEAC),EC,
7,47,SIA/CG/MIN/17775/2015,OL/EC/IRON_ORE_MINE/KANKER/529,Metabodeli Iron Ore Mine(25 Ha.),JAYASWAL NECO INDUSTRIES LIMITED,EC Granted,EC,
8,48,SIA/CG/MIN/152853/2020,OL/EC/MIN/B_BAZAAR/1300,"M - 2 , Chichpol Sand Quarry,",MOHAMMAD KASIM RAZA,EC Granted,EC,
9,49,SIA/CG/MIN/50515/2016,OL/EC/SANDMINE/RAIGARH/404,kandagarh sand mining,SACHIVKANDAGARH,EC Granted,EC,
10,50,SIA/CG/MIN/55955/2016,,PREM SHANKAR SHUKLA STONE MINE,PREM SHANKAR SHUKLA STONE MINE,Delisted,EC,
1,51,SIA/CG/MIN/199432/2021,OL/EC/MIN/RAIGARH/1564,aurabhata sand mine,AURABHATA SAND MINE,EC Granted,EC,
2,52,SIA/CG/MIN/199434/2021,OL/EC/MIN/SURAJPUR/1566,namadgiri l1 sand mine,NAMADGIRI L1 SAND MINE,EC Granted,EC,
3,53,SIA/CG/MIN/31958/2015,OL/EC/SANDMINE/BEMETARA/89,Sinwar Sande Mine,SARPANCH SINWAR,EC Granted,EC,
4,54,SIA/CG/MIN/96530/2019,,-1,XYZ  MINE,Delisted,EC,
5,55,SIA/CG/MIN/31395/2015,OL/EC/SANDMINE/BEMETARA/26,Mau sand mining,SARPANCH MAU,EC Granted,EC,
6,56,SIA/CG/MIN/31897/2015,OL/EC/SANDMINE/BIJAPUR/81,SAND MINING GRAM PANCHAYAT MANGALNAR,SARPANCH GRAM PANCHAYAT MANGALNAR,EC Granted,EC,
7,57,SIA/CG/MIN/31898/2015,OL/EC/SANDMINE/DANTEWADA/82,SAND MINE GRAM PANCHAYAT BALUD B,GRAM PANCHAYAT BALUD B,EC Granted,EC,
8,58,SIA/CG/MIN/440566/2023,OL/EC/MIN/BALODA_BAZAR/2637,Ganesh Chandra Shukla,GANESH SHUKLA,Under examination of SEIAA after SEAC,EC,
9,59,SIA/CG/MIN/179036/2020,OL/EC/MIN/BILASPUR/1418,Konchara sand mine of Manoj Kumar Pandey,KONCHARA SAND MINE OF MANOJ KUMAR PANDEY,EC Granted,EC,
10,60,SIA/CG/MIN/149534/2020,OL/EC/MIN/J_CHAMPA/1311,Shri. Ram Prakash Jaiswal,RAM  PRAKASH,EC Granted,EC,
1,61,SIA/CG/MIN/53766/2016,,MANDEEP SINGH ARORA STONE MINE,MANDEEP SINGH ARORA STONE MINE,Delisted,EC,
2,62,SIA/CG/MIN/59724/2016,OL/EC/SANDMINE/GARIABAND/511,Hathkhoj Sand Mine,GRAM PANCHAYAT HATHKHOJ,EC Granted - Processed offline,EC,
3,63,SIA/CG/IND/35527/2019,OL/EC/MIN/RAIGARH/858,"Capacity expansion through implementation of additional Induction Furnace, CCM, Hot Charging Rerolling Mill, Wire Drawing unit and MS Pipe Mill at Village – Pali, Khasra No. – 22/12, 22/13, and 22/15, Post – Gerwani, District – Raigarh (Chhattisgarh) – 496001 of S.S. Steel and Power",S S STEEL AND POWER,EC Granted,EC,
4,64,SIA/CG/MIN/35797/2015,,Quartz Mine,ULTIMATE ENVIROLYTICAL SOLUTION,Delisted,EC,
5,65,SIA/CG/MIN/53148/2016,,PANKAJ AGRAWAL DHURAGAON LIMESTONE MINE,PANKAJ AGRAWAL DHURAGAON LIMESTONE MINE,Delisted,EC,
6,66,SIA/CG/MIN/53255/2016,OL/EC/SANDMINE/JANJGIR_CHAMPA/444,radhapur,SARPANCH RADHAPUR,EC Granted,EC,
7,67,SIA/CG/MIN/53511/2016,,ANAND KUMAR AGRAWAL STONE MINE,ANAND KUMAR AGRAWAL STONE MINE,Delisted,EC,
8,68,SIA/CG/MIN/32541/2015,OL/EC/SANDMINE/MAHASAMUND/125,Baldidih Sand Mine,SARPANCH BALDIDIH,Delisted,EC,
9,69,SIA/CG/MIN/32614/2015,OL/EC/SANDMINE/KANKER/130,Aroud Sand Mine,SARPANCH AROUD,EC Granted,EC,
10,70,SIA/CG/MIN/32658/2015,OL/EC/SANDMINE/GARIYABANDH/125,Choubebandha Sand Mine,SARPANCH CHOUBEBANDHA,EC Granted,EC,
1,71,SIA/CG/MIN/135098/2020,OL/EC/STONE_MIN/SURAJPUR/1098,Namna Ordinary Stone Mine,SURESH KUMAR SAHU,EC Granted,EC,
2,72,SIA/CG/MIN/141843/2020,OL/EC/MIN/BALOD/1165,NEWWARIKALA 02 ORDINARY SAND MINE BALOD CG,NEWARIKALA SAND MINES BALOD CG,EC Granted,EC,
3,73,SIA/CG/MIN/189997/2020,OL/EC/MIN/BASTAR/1498,LIMESTONE MINE SIRISGUDA,LIMESTONE MINE SIRISGUDA,Rejection Letter Granted,EC,
4,74,SIA/CG/MIN/131874/2019,,akoldih khapri quarry,MOHAMMAD ALTAF CHAUHAN AKOLDIH,Delisted,EC,
5,75,SIA/CG/MIN/248100/2021,OL/EC/MIN/BALODABAZAR/1893,Saliha Limestone Mine of Hori Lal Chandra,SALIHA LIMESTONE MINE	OF HORI LAL CHANDRA,EC Granted,EC,
6,76,SIA/CG/MIN/266682/2022,OL/EC/MIN/KORIYA/1993,MUKHTIYARPARA ORDINARY STONE QUARRY,BEENA SINGH,Agenda Uploaded by SEIAA,EC,
7,77,SIA/CG/MIN/288683/2022,OL/EC/MIN/MAHASAMUND/2130,Flag Stone Quarry of Bhushan Lal Markandey,BHUSHANLAL,For further consideration(SEAC),EC,
8,78,SIA/CG/MIN/288964/2022,OL/EC/MIN/RAJNANDGAON/2131,Era Brick Earth Quarry Project Proponent Shri Abhishek Chakradhari,SHRI. ABHISHEK CHAKRADHARI,Request for withdraw,EC,
9,79,SIA/CG/MIN/438153/2023,OL/EC/MIN/SURGUJA/2605,Sachin Agrawal Proprietor  of M/s Ashok Kumar Agrawal,ASHOK KUMAR AGRAWAL,For further consideration(SEAC),EC,
10,80,SIA/CG/MIN/440490/2023,OL/EC/MIN/KANKER/2635,Khairkheda Ordinary stone Quarry,MOHAMMAD HANIF,For further consideration(SEAC),EC,
1,81,SIA/CG/MIN/165106/2020,OL/EC/MIN/SURGUJA/1363,Stone Quarry Village Manja 0.700 Ha,DEE VEE GAWAR (J.V.),EC Granted,EC,
2,82,SIA/CG/MIN/33339/2014,OL/EC/MIN/RAJNANDGAON/790,MERHA SAND MINES,MERHA SAND MINE,EC Granted,EC,
3,83,SIA/CG/MIN/34439/2019,OL/EC/LIMESTONEMINE/GARIABANDH/823,pitaiband sand mine,PITAIBAND SAND MINE,EC Granted,EC,
4,84,SIA/CG/IND/213875/2021,OL/EC/IND/RAIPUR/1694,Integration of Steel Plant by P. D. Industries Pvt. Limited,P. D. INDUSTRIES PRIVATE LIMITED,EC Granted,EC,
5,85,SIA/CG/MIN/174500/2020,OL/EC/MIN/RAJNANDGAON/1406,Shri Chetan Anand Choudhary,SHRI CHETAN ANAND CHOUDHARY,EC Granted,EC,
6,86,SIA/CG/MIN/135761/2020,OL/EC/SAND_MINE/BASTAR/1108,Tikanpal Sand Mine,TIKANPAL SAND MINE,EC Granted,EC,
7,87,SIA/CG/MIN/50236/2016,OL/EC/SANDMINE/RAJNANDGAON/402,Salhe Sand Mine,SARPANCH SALHE,EC Granted,EC,
8,88,SIA/CG/MIN/146563/2020,OL/EC/MIN/BILASPUR/1217,Khodri sand mine of Sanjeev Mandal,KHODRI SAND MINE OF SANJEEV MANDAL,EC Granted,EC,
9,89,SIA/CG/MIN/146977/2020,OL/EC/MIN/RAJNANDGAON/1226,LIMESTONE QUARRY,LIMESTONE QUARRY MOHBHATTHA,EC Granted,EC,
10,90,SIA/CG/MIN/42455/2019,OL/EC/MIN/RAJNANDGAON/964,Naresh Lal Talreja,NARESH LAL TAREJA,EC Granted,EC,
1,91,SIA/CG/MIN/134859/2020,OL/EC/SAND_MIN/DANTEWADA/1096,Balpeth Sand Quarry,ASHUTOSH SANYASHI MINING CONSULTANCY,EC Granted,EC,
2,92,SIA/CG/MIN/129632/2019,OL/EC/MIN/DANTEWADA/1046,"B -1 ,Chandur Sand Quarry","B - 1 , CHANDUR SAND QUARRY ,TEHSIL. - BHOPALPATNAM, DIST. - BIJAPUR",EC Granted,EC,
3,93,SIA/CG/IND/29609/2017,OL/EC/IND/RAIPUR/622,KRISHNA IRON STRIPS AND TUBES PVT TD,KRISHNA IRON STRIPS AND TUBES PRIVATE LIMITED,EC Granted,EC,
4,94,SIA/CG/IND/82387/2018,OL/EC/IND/RAIPUR/745,Integration of Existing Rolling Mill,SARTHAK ISPAT PRIVATE LIMITED,EC Granted,EC,
5,95,SIA/CG/MIN/32556/2015,OL/EC/SANDMINE/GARIYABANDH/129,Baherabuda Sand Mine,SARPANCH BAHERABUDA,EC Granted,EC,
6,96,SIA/CG/MIN/276792/2022,,TIPRUNG BRICKS EARTH CLAY QUARRY AND FIX CHIMNEY BRICKS PLANT,SUBHASH VERMA,Delisted,EC,
7,97,SIA/CG/MIN/56883/2016,OL/EC/SANDMINE/Koriya/471,SAND MINE,SARPANCH MANWARI,EC Granted,EC,
8,98,SIA/CG/MIN/417349/2023,OL/EC/MIN/MAHASAMUND/1596,ACHHOLI FLAGSTONE MINING PROJECT,VISHNU PRASAD,EC Granted,EC,
9,99,SIA/CG/MIN/429705/2023,OL/EC/MIN/KANKER/2432,Shyamnagar Ordinary Stone Quarry,MANOJ MANDAL,Rejection Letter Granted,EC,
10,100,SIA/CG/MIN/435684/2023,OL/EC/MIN/RAIPUR/2564,BUDERA LIMESTONE QUARRY,GOVIND SAHU,For further consideration(SEAC),EC,
1,101,SIA/CG/MIN/135557/2020,OL/EC/SAND_MIN/DHAMTARI/1104,kapalphodi sand mine,TIKAM LAL SAHU,EC Granted,EC,
2,102,SIA/CG/MIN/50519/2016,OL/EC/SANDMINE/RAIGARH/405,jaimuratayang sand mining,SACHIVJAIMURATAYANG,EC Granted,EC,
3,103,SIA/CG/MIN/50533/2016,OL/EC/SANDMINE/BILASPUR/407,KARHI KACHAR SAND MINE,PANCHAYAT SACHIV,EC Granted,EC,
4,104,SIA/CG/IND/84430/2018,OL/EC/IND/RAIGARH/749,SIVANA STEELS AND POWER PRIVATE LIMITED,SIVANA STEEL AND POWER PRIVATE LIMITED,EC Granted,EC,
5,105,SIA/CG/MIN/31791/2014,OL/EC/MIN/BASTAR/776,Vimal Lunia,VIMAL LUNIA,EC Granted,EC,
6,106,SIA/CG/MIN/74407/2018,OL/EC/MIN/DURG/694,"Sahegaon Limestone Mine 
Area 4.047 Hects",ROPRELA BROTHERS,EC Granted,EC,
7,107,SIA/CG/MIN/440145/2023,OL/EC/MIN/DURG/2632,Kotni Sand Mine,RAJAN MANIRAJ,Under examination of SEIAA after SEAC,EC,
8,108,SIA/CG/MIN/440385/2023,OL/EC/MIN/MAHASAMUND/1862,"Mudhena Flagstone quarry, Village Mudhena, Prop. Shri Abhishek Soni",SHRI ABHISHEK SONI,Under examination of SEIAA after SEAC,EC,
9,109,SIA/CG/MIN/148025/2020,OL/EC/MIN/SURAJPUR/1244,"G -2 , RUNIYADIH SAND QUARRY","G 2 , RUNIYADIH SAND QUARRY",EC Granted,EC,
10,110,SIA/CG/IND/33391/2019,OL/EC/IND/RAIGARH/800,SADGURU ISPAT PRIVATE LIMITED,SADGURU ISPAT PRIVATE LIMITED,EC Granted - Processed offline,EC,
1,111,SIA/CG/MIN/199627/2021,OL/EC/MIN/KORIYA/1562,Salka Ordinary Stone Temporary Permit Quarry,SALKA ORDINARY STONE TEMPORARY PERMIT QUARRY OF MS RK TRANSPORT AND CONSTRUCTION LTD,EC Granted,EC,
2,112,SIA/CG/MIN/416074/2023,OL/EC/MIN/SURGUJA/2301,Kosanga Brick Earth clay Quarry of Reema Jaiswal,RIMA JAYASVAL,Agenda Uploaded by SEIAA,EC,
3,113,SIA/CG/MIN/438904/2023,OL/EC/MIN/BALODA_BAZAR/2614,Smt. Anita Saluja,ANITA SALUJA,Accepted By SEAC,EC,
4,114,SIA/CG/MIN/144862/2020,OL/EC/MIN/RAJNANDGAON/1203,Om Minerals Joratarai Limestone Mine,OM MINERALS LIME STONE,EC Granted,EC,
5,115,SIA/CG/MIN/257236/2022,,Jokari ordinary stone Quarry,SUBHASH VERMA,Delisted,EC,
6,116,SIA/CG/MIN/220876/2021,OL/EC/MIN/RAIGARH/1739,murra a sand mine,MURRA A RAIGARH SAND MINE,Under examination of SEIAA after SEAC,EC,
7,117,SIA/CG/MIN/180386/2020,OL/EC/MIN/KORBA/1435,Konkona Ordinary Stone Temporary Permit Quarry  (5) of Dilip Buildcon Limited,KONKONA ORDINARY STONE TEMPORARY PERMIT QUARRY  (5)	OF DILIP BUILDCON LIMITED,EC Granted,EC,
8,118,SIA/CG/MIN/256448/2022,OL/EC/MIN/BALODABAZAR/1949,Saliha Limestone Mine,SHIV JAISWAL,For further consideration(SEAC),EC,
9,119,SIA/CG/MIN/418380/2023,OL/EC/MIN/BILASPUR/2310,Itwa Brick Earthclay Quarry  of Shobharam Ratre,SHOBHARAM RATRE,For further consideration(SEAC),EC,
10,120,SIA/CG/MIN/440259/2023,OL/EC/MIN/BILASPUR/2625,Gram Panchayat Karhikachhar,JOSHELAL MINJ,Under examination of SEIAA after SEAC,EC,
1,121,SIA/CG/MIN/149534/2020,OL/EC/MIN/J_CHAMPA/1311,Shri. Ram Prakash Jaiswal,RAM  PRAKASH,EC Granted,EC,
2,122,SIA/CG/MIN/36155/2019,OL/EC/SANDMINE/MAHASAMUND/870,Badgaon Sand Mine,CEO JP MAHASAMUND,EC Granted,EC,
3,123,SIA/CG/MIN/37838/2019,OL/EC/MIN/DHAMTARI/905,jawargoan sand mine,JAWARGAON SAND MINE,Delisted,EC,
4,124,SIA/CG/MIN/212432/2021,OL/EC/MIN/SURAJPUR/1664,Kharsura Brick Earthclay Quarry Mine & Fixed  Chimney Brick Plant of Narendra Jaiswal,KHARSURA BRICK EARTHCLAY QUARRY MINE & FIX CHIMNEY BRICK PLANT	OF NARENDRA KUMAR JAISWAL,EC Granted,EC,
5,125,SIA/CG/MIN/96530/2019,,-1,XYZ  MINE,Delisted,EC,
6,126,SIA/CG/MIN/31395/2015,OL/EC/SANDMINE/BEMETARA/26,Mau sand mining,SARPANCH MAU,EC Granted,EC,
7,127,SIA/CG/MIN/31897/2015,OL/EC/SANDMINE/BIJAPUR/81,SAND MINING GRAM PANCHAYAT MANGALNAR,SARPANCH GRAM PANCHAYAT MANGALNAR,EC Granted,EC,
8,128,SIA/CG/MIN/31898/2015,OL/EC/SANDMINE/DANTEWADA/82,SAND MINE GRAM PANCHAYAT BALUD B,GRAM PANCHAYAT BALUD B,EC Granted,EC,
9,129,SIA/CG/MIN/259569/2022,,Ms CHANDRAHASINI STONE CRUSHER,SUBHASH VERMA,Delisted,EC,
10,130,SIA/CG/MIN/53766/2016,,MANDEEP SINGH ARORA STONE MINE,MANDEEP SINGH ARORA STONE MINE,Delisted,EC,
1,131,SIA/CG/MIN/34076/2019,OL/EC/LIMESTONEMINE/GARYABANDH/816,singhauri sand mine,SINGHAURI SAND MINE,Rejection Letter Granted,EC,
2,132,SIA/CG/MIN/212239/2021,OL/EC/MIN/BASTAR/1653,KORPAL (SHALY) LIMESTONE QUARRY,SHRI RAMGOPAL NETAM,EC Granted,EC,
3,133,SIA/CG/MIN/213496/2021,OL/EC/SANDMINE/KANKER/1687,Tahankapar Sand Quarry,KANKER SAND QUARRY,EC Granted,EC,
4,134,SIA/CG/MIN/215700/2021,OL/EC/MIN/DHAMTARI/1711,Lime stone quarry,REVENDRA CHANDRAKAR LIMESTONE QUARRY GOJI,EC Granted,EC,
5,135,SIA/CG/MIN/40077/2019,OL/EC/MIN/SURAJPUR/926,Karkoti Brick Earthclay Quarry Mine & Fixed Chimney Brick Plant,PRA BRICKS INDUSTRY,Rejection Letter Granted,EC,
6,136,SIA/CG/MIN/257436/2022,OL/EC/MIN/KORIYA/1938,Bundeli Crusher stone Quarry,SUBHASH VERMA,Rejection Letter Granted,EC,
7,137,SIA/CG/MIN/56883/2016,OL/EC/SANDMINE/Koriya/471,SAND MINE,SARPANCH MANWARI,EC Granted,EC,
8,138,SIA/CG/MIN/434928/2023,OL/EC/MIN/KANKER/2596,HALDIJHARIYA ORDINARY STONE QUARRY,SHASHI AGRAWAL,For further consideration(SEAC),EC,
9,139,SIA/CG/IND/226437/2021,OL/TOR/MIN/RAIPUR/1777,Manglam Alloys and Ispat Pvt. Ltd.,MANGLAM ALLOYS AND ISPAT PVT. LTD.,EC Granted,EC,
10,140,SIA/CG/NCP/61492/2017,OL/EC/CONSTRUCTION_PROJECT/RAIPUR/545,Life Spaces,GT HOMES,Rejected - Processed offline,EC,
1,141,SIA/CG/MIN/261157/2022,OL/EC/MIN/JASHPUR/1969,PIDI MURRUM QUARRY,SUBHASH VERMA,EC Granted,EC,
2,142,SIA/CG/MIN/255551/2022,OL/EC/MIN/RAIGARH/1928,usrout sand mine,NAMONARAYAN PATEL,EC Granted,EC,
3,143,SIA/CG/MIN/276626/2022,OL/EC/MIN/MAHASAMUND/2068,Sher Brick Earthclay Quarry & Fix Chimney Brick Plant of Priti Sharma,PRITI SHARMA,Awaiting EC,EC,
4,144,SIA/CG/MIN/416556/2023,OL/EC/MIN/MAHASAMUND/1583,"Proposed Achholi Flagstone Mining Project of Shri Relashwar Chandrakar, Shri Mohan Lal Sahu, Shri. Vishnu sahu and Shri Roshan Dewangan in Achholi Flagstone mining Cluster village, Achholi: TEHSIL & District Mahasamund of Chhattisgarh",RALESHWARCHANDRAKAR S/O SHOBHRAMCHANDRAKAR,EC Granted,EC,
5,145,SIA/CG/MIN/415236/2023,OL/EC/MIN/MAHASAMUND/1595,Achholi Flagstone Mine Cluster Project,SHRI MOHAN LAL SAHU,EC Granted,EC,
6,146,SIA/CG/MIN/416734/2023,OL/EC/MIN/SURGUJA/1607,Changori & Karra Limestone mining cluster,DWITENDRA KUMAR MISHRA,Delisted,EC,
7,147,SIA/CG/INFRA2/417464/2023,OL/EC/INFRA2/RAIPUR/2304,AVINASH CHITWAN,AIM INFRASTRUCTURE AND DEVELOPERS,Site Visit by SEAC(Pending),EC,
8,148,SIA/CG/MIN/57005/2016,OL/EC/SANDMINE/Koriya/472,SAND MINING TENDUDAND,TENDUDAND SARPANCH,EC Granted,EC,
9,149,SIA/CG/MIN/40484/2019,OL/EC/MIN/DURG/934,SHRI VIKAS AGRAWAL LIMESTONE MINE DHAURABHATHA DURG CG,SHRI VIKAS AGRAWAL LIMESTONE MINE DHAURABHATHA DURG CG,EC Granted - Processed offline,EC,
10,150,SIA/CG/MIN/40902/2016,OL/EC/SANDMINE/RAIPUR/307,Kumhari Sand Mine,SACHIV GRAM PANCHAYAT KUMHARI,Delisted,EC,
1,151,SIA/CG/MIN/135686/2020,OL/EC/SAND_MINE/KONDAGAON/1107,Sambalpur Ordinary Sand Mine Kondagaon Chhattisgarh,SAMBALPUR ORDINARY SAND MINE KONDAGAON CG,EC Granted,EC,
2,152,SIA/CG/MIN/136039/2020,OL/EC/SAND_MINE/KANKER/1117,JUNWANI/RAMPUR ORDINARY SAND MINE KANKER CG,JUNWANI/RAMPUR ORDINARY SAND MINE KANKER CHHATTISGARH,EC Granted,EC,
3,153,SIA/CG/MIN/65029/2017,OL/EC/LIME_STONE/DURG/602,"Lalmati Singh 
Sahgaon Limestone mine",LALMATI SINGH,Rejection Letter Granted,EC,
4,154,SIA/CG/MIN/39261/2019,OL/EC/MIN/MAHASAMUND/924,Barbaspur Flag Stone Quarry Mine,RAJENDRA  GUPTA,EC Granted,EC,
5,155,SIA/CG/MIN/149490/2020,OL/EC/MIN/J_CHAMPA/1268,Khurghatti sand mine of Sunil Kumar Chandra,KHURGHATTI SAND MINE OF SUNIL KUMAR CHANDRA,EC Granted,EC,
6,156,SIA/CG/MIN/257839/2022,OL/EC/MIN/BASTAR/1958,Bajawand Sand Quarry (K2),KUSUMLATA SAHU,Awaiting EC,EC,
7,157,SIA/CG/MIN/438803/2023,,Jamrao Clay Bricks,PAWAN PRITWANI,Pending at PP due to eds,EC,
8,158,SIA/CG/IND1/436005/2023,,Expansion of Mini Steel Plant by Shri Bajrang Power and Ispat Ltd.,SHRI BAJRANG POWER ISPAT LIMITED,Under examination of SEIAA,EC,
9,159,SIA/CG/IND/32248/2015,OL/EC/SANDMINE/BALODABAZAR/105,Datrengi Sand Project,SACHIVDATRENGI,EC Granted,EC,
10,160,SIA/CG/IND/74353/2018,,Pankaj Ispat Limited,PANKAJ ISPAT LIMITED,Delisted,EC,
1,161,SIA/CG/IND1/436498/2023,OL/EC/IND1/RAIPUR/2583,"Regularization of  Existing 46,000 TPA Rolling Mill along with Coal Gasifier",SHRI BAJRANG ALLIANCE LIMITED,SEIAA Meeting Cancelled have to be considered for next Agenda,EC,
2,162,SIA/CG/MIN/437308/2023,OL/EC/MIN/BALRAMPUR/2594,"Proposed Maa Kudargarhi Stone Crusher Pvt. Ltd. (Virendranagar Stone Block) Mining Lease for Ordinary Stone over an Area of 2.52 Ha. Production Capacity - 54926.33 TPA (ROM) at Village - Virendranagar, Taluka - Wadrafnagar, Dist.- Balrampur-Ramanujganj, State- Chhattisgarh.",MAA KUDARGARHI STONE CRUSHER PVT. LTD.,Agenda Uploaded by SEAC,EC,
3,163,SIA/CG/NCP/34310/2015,OL/EC/CONSTRUCTION_PROJECT/RAIPUR/215,Raheja Residency,S P BUILDCON PRIVATE LIMITED,EC Granted,EC,
4,164,SIA/CG/MIN/91877/2019,,CRUSHER STONE QUARRY VILLAGE MARKHOHI,HAR HAR MAHADEV CONSTRUCTION,Delisted,EC,
5,165,SIA/CG/MIN/275512/2022,OL/EC/MIN/MAHASAMUND/2056,Sher Brick Earthclay Quarry & Fix Chimney Brick Plant of  Lata Chandrakar,LATA CHANDRAKAR,EC Granted,EC,
6,166,SIA/CG/MIN/419925/2023,OL/EC/MIN/MAHASAMUND/1608,Sher & Salehbhatha mining Cluster,BRIJLAL DIWAN,Rejection Letter Granted,EC,
7,167,SIA/CG/MIN/435862/2023,OL/EC/MIN/KORIYA/2600,M/s Shivam Refractories Partner – Shri. Chhabi Lal Patel,CHHABILAL PATEL,Agenda Uploaded by SEIAA,EC,
8,168,SIA/CG/MIN/31182/2015,OL/EC/SANDMINE/KORBA/13,,CMO CHHURIKALA,EC Granted,EC,
9,169,SIA/CG/IND/70936/2017,OL/EC/IND/RAIPUR/650,SHREE GAHIRA STEEL AND POWER PRIVATE LIMITED,SHREE GAHIRA STEEL AND POWER PRIVATE LIMITED,Rejection Letter Granted,EC,
10,170,SIA/CG/MIN/71721/2017,OL/EC/MIN//BALODABAZAR/656,Bharuadih Limestone Mine,NAVEESH UPADHYAY,EC Granted - Processed offline,EC,
1,171,SIA/CG/MIN/67248/2017,OL/EC/LIME_STONE/DURG/625,Ruplela Brothers Limestone Mines,RUPRELA BROTHERS,Rejection Letter Granted,EC,
2,172,SIA/CG/MIN/416556/2023,OL/EC/MIN/MAHASAMUND/1583,"Proposed Achholi Flagstone Mining Project of Shri Relashwar Chandrakar, Shri Mohan Lal Sahu, Shri. Vishnu sahu and Shri Roshan Dewangan in Achholi Flagstone mining Cluster village, Achholi: TEHSIL & District Mahasamund of Chhattisgarh",RALESHWARCHANDRAKAR S/O SHOBHRAMCHANDRAKAR,EC Granted,EC,
3,173,SIA/CG/MIN/415236/2023,OL/EC/MIN/MAHASAMUND/1595,Achholi Flagstone Mine Cluster Project,SHRI MOHAN LAL SAHU,EC Granted,EC,
4,174,SIA/CG/MIN/146482/2020,OL/EC/MIN/JCHAMPA/1216,Deori Sand Mine of Shashikapur Upadhayay,DEORI SAND MINE OF SHASHIKAPUR UPADHAYAY,EC Granted,EC,
5,175,SIA/CG/MIN/46316/2019,OL/EC/MIN/BIJAPUR/1023,"tarlaguda, sand mine quarry",TARLAGUDA SAND MINE,EC Granted,EC,
6,176,SIA/CG/MIN/33472/2015,OL/EC/BRICKS/BILASPUR/183,Binauri Brick Earth Project,BINAURI BRICK EARTH,EC Granted,EC,
7,177,SIA/CG/NCP/58587/2016,OL/EC/NCP/RAIPUR/484,"Wallfort ""WOODS"" by Wallfort Properties Pvt. Limited",WALLFORT PROPERTIES PRIVATE LIMITED,EC Granted,EC,
8,178,SIA/CG/MIN/74950/2018,OL/EC/MIN/RAJNANDGAON/719,Kirgi Sand Mine,KIRGI SACHIVE,EC Granted,EC,
9,179,SIA/CG/IND/214366/2021,OL/EC/IND/RAIPUR/1698,Trimurti Re-rollers Private Limited,M/S. TRIMURTI RE-ROLLERS PRIVATE LIMITED,EC Granted,EC,
10,180,SIA/CG/MIN/31596/2015,OL/EC/LIMESTONEMINE/RAIPUR/44,Dhansuli Stone Mine (minor mineral)  Quarry of Bamleshwari Stones India Pvt. Ltd.,BAMLESHWARI STONES INDIA PVT LTD,Delisted,EC,
1,181,SIA/CG/MIN/146728/2020,OL/EC/MIN/DHAMTARI/1220,Karelibadi sand mine of Ronak Singh Rajput,KARELIBADI SAND MINE OF RONAK SINGH RAJPUT,EC Granted,EC,
2,182,SIA/CG/MIN/48164/2016,OL/EC/SANDMINE/KANKER/373,Tahkapar Sand Mine,SARPANCH TAHKAPAR,EC Granted,EC,
3,183,SIA/CG/MIN/59677/2016,OL/EC/SANDMINE/MAHASAMUND/510,Sher Sand Mine,SARPANCH SHER,EC Granted,EC,
4,184,SIA/CG/MIN/187518/2020,OL/EC/MIN/DANTEWADA/1490,Balud C sand mine,AHMAD RAZA,EC Granted,EC,
5,185,SIA/CG/MIN/160183/2020,OL/EC/MIN/KORIYA/1331,Telimuda sand mine of Uttam Kumar Bhanu,TELIMUDA SAND MINE OF UTTAM KUMAR BHANU,EC Granted,EC,
6,186,SIA/CG/MIN/34221/2019,,Lai Sand Quarry,SARPANCH GRAM PANCHYAT LAI,Delisted,EC,
7,187,SIA/CG/MIN/423218/2023,OL/EC/MIN/JANJGIR_CHAMPA/2351,"TANAUD BRICKS EARTH CLAY QUARRY AND FIX CHIMNEY BRICKS PLANT, AREA - 1.337 HA. KSHASRA 1469/2, 1488, 1489, 1490/4,",AJAY SAHU,Under examination of SEIAA after SEAC,EC,
8,188,SIA/CG/MIN/441389/2023,OL/EC/MIN/KORBA/2648,Bhilaikhurd Sand Quarry,KHAJANCHI KUMHAR,Under examination of SEIAA after SEAC,EC,
9,189,SIA/CG/MIN/441939/2023,OL/MODIEC/MIN/MAHASAMUND/1841,"Mudhena flagstone quarry, Project Proponant Saroj kumar sahu",SAROJ SAHU,Under examination of SEIAA after SEAC,EC,
10,190,SIA/CG/MIN/32920/2015,OL/EC/LIMESTONEMINE/BILASPUR/156,Suraiya Bano Limestone Mine,SARKAR MINERAL,EC Granted,EC,
1,191,SIA/CG/MIN/48207/2016,OL/EC/SANDMINE/DHAMTARI/376,Budeni Sand Mine,SARPANCH BUDENI,Delisted,EC,
