,Sno.,Proposal No.,File No.,Project Name,Company,Proposal Status,Project Type,View
4,1764,SIA/CG/MIN/32626/2015,OL/EC/SANDMINE/BEMETARA/135,Baherghat Sand Mine,SARPANCH BAHERGHAT,EC Granted,EC,
5,1765,SIA/CG/IND/61151/2016,OL/EC/STEEL&CASTING/RAIGARH/533,Shri Nirmlanand Steels Casting Private Limited,SHRI NIRMLANAND STEELS AND CASTINGS PVT LIMITED,EC Granted,EC,
6,1766,SIA/CG/MIN/273849/2022,OL/EC/MIN/JASHPUR/2038,Chandagarh Brick Earth Mine of Shri Govind Agrawal,GOVIND AGRAWAL,Agenda Uploaded by SEIAA,EC,
7,1767,SIA/CG/MIN/435161/2023,OL/EC/MIN/RAIPUR/2551,Rajesh Kumar Trivedi,RAJESH TRIVEDI,EC Granted,EC,
8,1768,SIA/CG/MIN/438677/2023,OL/EC/MIN/DANTEWADA/2615,"AMALGAMATION ORDINARY STONE QUARRY LEASES, VIRAT MINERALS, DHURLI",RAMESH SURANA,For further consideration(SEAC),EC,
9,1769,SIA/CG/NCP/57254/2016,OL/EC/NCP/RAIPUR/474,GD Logistics Park by LL Logistics Pvt. Limited,L L LOGISTICTS PRIVATE LIMITED,EC Granted - Processed offline,EC,
10,1770,SIA/CG/IND/72171/2018,OL/EC/IND/RAIPUR/668,Expansion of Hot Charged Rolling Mill,AGRAWAL STRUCTURE MILLS PVT LIMITED,EC Granted,EC,
1,1771,SIA/CG/IND/18219/2013,OL/EC/STEEL_&_ POWER/DURG/547,Topworth Steels and Power Private Limited,TOPWORTH STEELS AND POWER PVT LIMITED,EC Granted,EC,
2,1772,SIA/CG/MIS/62100/2017,OL/EC/HOUSING_BOARD_PROJECT/BALOD/554,ATAL VIHAR YOJANA CHITOD BALOD,EE CGHB DHAMTARI,Rejection Letter Granted,EC,
3,1773,SIA/CG/MIN/62249/2017,OL/EC/SAND_MINE/DURG/555,Bagdai Sand Mine,SACHIV BAGDAI,EC Granted,EC,
4,1774,SIA/CG/MIN/22565/2018,OL/EC/MIN/BASTAR/676,Limestone Mine Near Village Chhaperbhan ML Area 1.376 Ha.puri,SHRI RAJIV BAJPAI,EC Granted,EC,
5,1775,SIA/CG/MIN/50727/2016,,stone quarry,SHRI KAMAL SOMANI,Delisted,EC,
6,1776,SIA/CG/MIN/125642/2019,OL/EC/MIN/B_BAZAAR/656,Bharuadih limestone mine,NAAVISH UPADHYAY,EC Granted - Processed offline,EC,
7,1777,SIA/CG/MIN/93871/2019,OL/EC/STONEMINE/KORIYA/772,Akharadand Ordinary Stone Quarry,PRADEEP KUMAR THAKUR,EC Granted,EC,
8,1778,SIA/CG/MIN/263435/2022,OL/EC/MIN/KORIYA/1972,MAJHAULI STONE QUARRY,SUBHASH VERMA,For further consideration(SEAC),EC,
9,1779,SIA/CG/MIN/266308/2022,OL/EC/MIN/KORBA/1984,"Kutelamuda Ordinary Stone Temporary Permit Quarry (1) of M/s. Dilip Buildcon Limited, Bhopal",DILIP BUILDCON LIMITED,Site Visit by SEIAA(Pending),EC,
10,1780,SIA/CG/MIN/266375/2022,OL/EC/MIN/KORBA/1983,"Kutelamuda Ordinary Stone Temporary Permit Quarry (2) of M/s. Dilip Buildcon Limited, Bhopal",DILIP BUILDCON LIMITED,Site Visit by SEIAA(Pending),EC,
1,1781,SIA/CG/MIN/44664/2019,OL/EC/MIN/SUKMA/971,Dhondhara ordinary stone quarry,DHONDHARA ORDINARY STONE QUARRY,EC Granted,EC,
2,1782,SIA/CG/MIN/62622/2017,OL/EC/SAND_MINE/DABHA/559,dabha sand mine,DABHA SAND MINE,EC Granted,EC,
3,1783,SIA/CG/MIN/72154/2018,OL/EC/MIN/BILASPUR/667,Dolomite Quarry Village Semardarri,SUSHILA MINING PRIVATE LTD,EC Granted,EC,
4,1784,SIA/CG/MIN/181936/2020,OL/EC/MIN/RAIPUR/1459,Paragaon Sand Mine of Mohd Salim Memon,PARAGAON SAND MINE OF MOHD SALIM MEMON,EC Granted,EC,
5,1785,SIA/CG/MIN/406445/2022,OL/EC/MIN/BALOD/1605,Kurdi Farshi Pathar Mining Project of Ashwin patel,ASHWIN PATEL,EC Granted,EC,
6,1786,SIA/CG/MIN/446115/2023,OL/EC/MIN/BALODA_BAZAR/2709,"M/s Msk Yadu Bricks, Proprietor- Shatruhan Yadu",SHATRUHAN YADU,Agenda Uploaded by SEAC,EC,
7,1787,SIA/CG/MIN/33199/2015,OL/EC/SANDMINE/BHATAPARA/170,Datan Sand Mine,GRAM PANCHAYAT DATAN,EC Granted,EC,
8,1788,SIA/CG/MIN/43959/2019,OL/EC/MIN/RAJNANDGAON/976,Praveen Chakradhari,PRAVEEN   CHAKRADHARI,EC Granted,EC,
9,1789,SIA/CG/MIN/58634/2016,,ruda sand mine,SARPANCH RUDA,WithdrawEC,EC,
10,1790,SIA/CG/MIN/250656/2022,OL/EC/MIN/RAJNANDGAON/1907,"Brick Earth Quarry , Village – Era (Area -",SMT. KAUSHILYA DEVI CHAKRADHARI,Rejection Letter Granted,EC,
1,1791,SIA/CG/MIN/193204/2021,OL/EC/MIN/SURAJPUR/1520,namna s1 sand mine,NAMNA S1,EC Granted,EC,
2,1792,SIA/CG/MIN/160751/2020,OL/EC/MIN/KANKER/1335,SARADHUNAWAGAON SAND QUARRY,KANKER SAND QUARRY,EC Granted,EC,
3,1793,SIA/CG/MIN/276626/2022,OL/EC/MIN/MAHASAMUND/2068,Sher Brick Earthclay Quarry & Fix Chimney Brick Plant of Priti Sharma,PRITI SHARMA,Awaiting EC,EC,
4,1794,SIA/CG/MIN/416556/2023,OL/EC/MIN/MAHASAMUND/1583,"Proposed Achholi Flagstone Mining Project of Shri Relashwar Chandrakar, Shri Mohan Lal Sahu, Shri. Vishnu sahu and Shri Roshan Dewangan in Achholi Flagstone mining Cluster village, Achholi: TEHSIL & District Mahasamund of Chhattisgarh",RALESHWARCHANDRAKAR S/O SHOBHRAMCHANDRAKAR,EC Granted,EC,
5,1795,SIA/CG/MIN/415236/2023,OL/EC/MIN/MAHASAMUND/1595,Achholi Flagstone Mine Cluster Project,SHRI MOHAN LAL SAHU,EC Granted,EC,
6,1796,SIA/CG/MIN/416734/2023,OL/EC/MIN/SURGUJA/1607,Changori & Karra Limestone mining cluster,DWITENDRA KUMAR MISHRA,Delisted,EC,
7,1797,SIA/CG/INFRA2/417464/2023,OL/EC/INFRA2/RAIPUR/2304,AVINASH CHITWAN,AIM INFRASTRUCTURE AND DEVELOPERS,Site Visit by SEAC(Pending),EC,
8,1798,SIA/CG/MIN/435831/2023,OL/EC/MIN/RAIPUR/2560,Dilharan Lal Yadav,DILHARAN YADAV,Accepted By SEAC,EC,
9,1799,SIA/CG/MIN/435236/2023,OL/EC/MIN/RAIPUR/2578,Amit Chandrakar,AMIT CHANDRAKAR,Agenda Uploaded by SEIAA,EC,
10,1800,SIA/CG/MIN/450908/2023,OL/EC/MIN/MAHASAMUND/2818,Karmanda Lime Stone Mining Project,DUKHI RATHORE,Agenda Uploaded by SEAC,EC,
1,1801,SIA/CG/MIN/53459/2016,,"M/s Praveen Kumar Sharma Ghoghra,Jashpur",PRAVEEN KUMAR SHARMA STONE MINE,Delisted,EC,
2,1802,SIA/CG/MIN/180843/2020,OL/EC/MIN/SURGUJA/1450,Karra Limestone Mine of Virendra Kumar Singh,KARRA LIMESTONE MINE OF VIRENDRA KUMAR SINGH,EC Granted,EC,
3,1803,SIA/CG/MIN/50519/2016,OL/EC/SANDMINE/RAIGARH/405,jaimuratayang sand mining,SACHIVJAIMURATAYANG,EC Granted,EC,
4,1804,SIA/CG/MIN/50533/2016,OL/EC/SANDMINE/BILASPUR/407,KARHI KACHAR SAND MINE,PANCHAYAT SACHIV,EC Granted,EC,
5,1805,SIA/CG/IND/84430/2018,OL/EC/IND/RAIGARH/749,SIVANA STEELS AND POWER PRIVATE LIMITED,SIVANA STEEL AND POWER PRIVATE LIMITED,EC Granted,EC,
6,1806,SIA/CG/MIN/216669/2021,OL/EC/MIN/DHAMTARI/1719,LIME STONE QUARRY MORIKALA,NEERAJ GANGWAL LIMESTONE QUARRY MORIKALA,EC Granted,EC,
7,1807,SIA/CG/MIN/216931/2021,OL/EC/MIN/BASTAR/1723,TIKANPAL NAGO LIMESTONE MINE BASTAR CG 1.05,TIKANPAL LIMESTONE MINE BASTAR CHHATTISGARG 1.050 HA,EC Granted,EC,
8,1808,SIA/CG/MIN/32670/2015,OL/EC/SANDMINE/RAIGARH/144,Aurabhatha sand mine raigarh,GRAM PANCHAYAT AURABHATHA,EC Granted,EC,
9,1809,SIA/CG/MIN/33120/2015,OL/EC/BRICKS/BILASPUR/166,Sagar Brick Earth Quarry,SAGAR BRICK EARTH QUARRY,EC Granted,EC,
10,1810,SIA/CG/MIN/62246/2021,OL/EC/MIN/DURG/1630,M/s. Sao Minerals Limestone Mine,M/S SAO MINERALS LIMESTONE MINE GONDPENDRY DURG CHHATTISGARH,EC Granted,EC,
1,1811,SIA/CG/MIN/412613/2022,OL/EC/MIN/BASTAR/2251,"limestone Mine (Minor Mineral) over an area of 2.664ha, at Khasra No – 175/1, 175/3 &193 Village-Tikanpal, Tehsil–Bastar, District -Bastar, Chhattisgarh",GANESHRAM,EC Granted,EC,
2,1812,SIA/CG/MIN/433333/2023,OL/EC/MIN/KONDAGAON/2525,Gattipalna Granite Mine,KANHANPURI BLACK GRANITE MINE,For further consideration(SEAC),EC,
3,1813,SIA/CG/MIN/454713/2023,,Arun Kumar Goyal,ARUN GOYAL,Pending at PP due to eds,EC,
4,1814,SIA/CG/MIN/455377/2023,,Lokesh Chandra,LOKESH CHANDRA,Pending at PP due to eds,EC,
5,1815,SIA/CG/MIN/38155/2018,OL/EC/MIN/B_BAZAAR/692,Bhatbhera Limestone Mine,BHATBHERA LIMESTONE MINE,EC Granted,EC,
6,1816,SIA/CG/MIN/40563/2019,,Radhapur Sand Mining,GRAM PANCHAYAT RADHAPUR,Delisted,EC,
7,1817,SIA/CG/MIN/137612/2020,OL/EC/MIN/SURGUJA/1139,Jhumarpara Bricks earth Quarry & fix chimney plant,JHUMARPARA BRICKS EARTH CLAY QUARRY,EC Granted,EC,
8,1818,SIA/CG/MIN/138074/2020,,Taalnar Sand Quarry,TAALNAR SAND QUARRY,Delisted,EC,
9,1819,SIA/CG/MIN/59136/2016,OL/EC/SANDMINE/BIJAPUR/498,Timedh Ordinary Sand Mine,SARPANCH GRAM PANCHAYAT TIMEDH,EC Granted - Processed offline,EC,
10,1820,SIA/CG/MIN/CG/MIN/189280/2020,OL/EC/MIN/RAJNANDGAON/1494,M/s Chitrakoot Construction (Partner- Shri A.P. Singh),M/S CHITRAKOOT CONSTRUCTION (PARTNER-SHRI A.P. SINGH),EC Granted,EC,
1,1821,SIA/CG/IND/32250/2015,OL/EC/SANDMINE/BALODABAZAR/106,Malpuri Sand Project,SACHIWMALPURI,EC Granted,EC,
2,1822,SIA/CG/MIN/40902/2016,OL/EC/SANDMINE/RAIPUR/307,Kumhari Sand Mine,SACHIV GRAM PANCHAYAT KUMHARI,Delisted,EC,
3,1823,SIA/CG/MIN/53059/2020,OL/EC/MIN/KORIYA/1298,Darritola Ordinary Stone Temporary Permit Quarry (3),DARRITOLA ORDINARY STONE TEMPORARY PERMIT QUARRY (3),EC Granted,EC,
4,1824,SIA/CG/MIS/104446/2019,OL/EC/MIS/RAIPUR/855,Multistoried Complex by Esteemed Developers and Builders Pvt. Limited,ESTEEMED DEVELOPERS AND BUILDERS PRIVATE LIMITED,EC Granted,EC,
5,1825,SIA/CG/MIN/139410/2020,OL/EC/MIN/BBAZAAR/1150,Pahanda Sand Mine of Mukesh Goyal,PAHANDA SAND MINE OF MUKESH GOYAL,EC Granted,EC,
6,1826,SIA/CG/MIN/42791/2019,OL/EC/MIN//GARIYABANDH/956,Basin Flagstone Mine,MANISH KUMAR SAHU,EC Granted,EC,
7,1827,SIA/CG/MIN/261097/2022,,Mandirhasaud Limestone quarry Motumal Adwani,MOTUMAL ADWANI,Delisted,EC,
8,1828,SIA/CG/MIN/142901/2020,OL/EC/MIN/DHAMTARI/1172,giraud 319 sand mine,ALIF SHAH ZAMA,EC Granted,EC,
9,1829,SIA/CG/MIN/146858/2020,OL/EC/MIN/RAJNANDGAON/1224,Daulat Singh Chandel 0.283 Ha Nawagaon Limestone Mine,DAULAT SINGH CHANDEL LIMESTONE,Rejection Letter Granted,EC,
10,1830,SIA/CG/MIN/74157/2018,,Baranji Limestone Mine,KUSUM TULSHYAN,Delisted,EC,
1,1831,SIA/CG/MIN/42470/2019,OL/EC/MIN/RAJNANDGAON/972,Chaweli Limestone Quarry,BHAGCHAND  JAIN,Awaiting EC,EC,
2,1832,SIA/CG/IND2/435175/2023,OL/EC/IND2/RAIPUR/2249,Greenfield Project comprising of establishment of  200 KLPD Grain based Distillery Plant along with 6.0 MW Cogen. Power Plant,SOLUS FUELS AND MINERALS PRIVATE LIMITED,Agenda Uploaded by SEIAA,EC,
3,1833,SIA/CG/MIN/453569/2024,,Vishnu Prasad Agrawal,VISHNU AGRAWAL,Under examination of SEIAA,EC,
4,1834,SIA/CG/MIN/148025/2020,OL/EC/MIN/SURAJPUR/1244,"G -2 , RUNIYADIH SAND QUARRY","G 2 , RUNIYADIH SAND QUARRY",EC Granted,EC,
5,1835,SIA/CG/MIN/33366/2015,OL/EC/SANDMINE/JANJGIR-CHAMPA/178,Khorsi Sand Project,KHORSI SAND PEROJECT,EC Granted,EC,
6,1836,SIA/CG/MIN/146648/2020,OL/EC/MIN/RAJNANDGAON/1219,Mahesh Kumar Lohani Joratarai Limestone Mine,MAHESH KUMAR LOHANI MINES,EC Granted,EC,
7,1837,SIA/CG/MIN/39314/2016,OL/EC/LIMESTONE_MINE/BILASPUR/298,Durugadih Limestone Quarry Mine of Mahesh Sharma,MAHESH SHARMA,Rejection Letter Granted,EC,
8,1838,SIA/CG/MIN/453631/2023,,PAWAN KUMAR BHATAPAHARI,PAVAN BHATAPAHARI,Pending at PP due to eds,EC,
9,1839,SIA/CG/MIN/36229/2015,,Surya Stone Crusher,SURYA STONE CRUSHER,Delisted,EC,
10,1840,SIA/CG/MIN/36255/2015,OL/EC/sand_MINE/BASTAR/259,tarapur B sand mine,SARPANCH TARAPUR,EC Granted,EC,
1,1841,SIA/CG/MIN/454721/2023,,JAWANGA ORDINARY STONE QUARRY,RAMESH TAVIDISETTY,Under examination of SEIAA,EC,
2,1842,SIA/CG/CMIN/456204/2023,,RANI ATARI UNDERGROUND COAL MINE PROJECT,SOUTH EASTERN COALFIELDS LIMITED,Under examination of SEIAA,EC,
3,1843,SIA/CG/MIN/34070/2015,OL/EC/CLAYMINE/BILASPUR/209,"Surya Prakash gangotri brick earth mine(Mopka,Bilaspur)",SURYA PRAKASH GANGOTRI BRICK EARTH MINE,EC Granted,EC,
4,1844,SIA/CG/MIN/42644/2016,,Bhitghara Stone Quarry Mine,S S V M CONSTRUCTION PVT LTD,Delisted,EC,
5,1845,SIA/CG/IND/19496/2012,OL/EC/IND/RAIPUR/603,Baldev Alloys Private Limited Unit 2,BALDEV ALLOYS PVT LIMITED UNIT II,Rejection Letter Granted,EC,
6,1846,SIA/CG/MIN/42392/2019,OL/EC/MIN/RAJNANDGAON/1002,Palturam Uike,PALTU RAM UIKE,EC Granted,EC,
7,1847,SIA/CG/MIN/48341/2016,OL/EC/BRICKS/MAHASAMUND/377,Brick Earth quarry Village Beltukri,CHEEMA BRICKS,EC Granted,EC,
8,1848,SIA/CG/MIN/58980/2016,,kumhariC sand mine,SARPANCH KUMHARIC,Delisted,EC,
9,1849,SIA/CG/MIN/180833/2020,OL/EC/MIN/BALRAMPUR/1457,Bhelaikhurd Limestone Mine of Mukesh Agrawal,BHELAIKHURD LIMESTONE MINE OF MUKESH AGRAWAL,EC Granted,EC,
10,1850,SIA/CG/MIN/429557/2023,OL/EC/MIN/BASTAR/2442,Madhota Limestone mine,RAMGOPAL NETAM,Agenda Uploaded by SEAC,EC,
1,1851,SIA/CG/MIN/261729/2022,OL/EC/MIN/RAIPUR/1970,NARDAHA LIMESTONE QUARRY,SUBHASH VERMA,Rejection Letter Granted,EC,
2,1852,SIA/CG/MIN/61827/2021,OL/EC/MIN/BALOD/1605,"Kurdi Farshi Patthar Mining Project of Ashwin Patel (Area: - 2.65 Hect. with Production Capacity: 18,881.25 TPA) at  Village-Kurdi, Tehsil-Gunderdehi & District:- Balod (Chhattisgarh)",ASHWIN PATEL,EC Granted - Processed offline,EC,
3,1853,SIA/CG/IND1/404417/2022,OL/EC/IND1/RAIPUR/2168,SRS STEEL & POWER,VIVEK SAHNI,For further consideration(SEAC),EC,
4,1854,SIA/CG/MIN/446215/2023,OL/EC/MIN/MAHASAMUND/2706,SHRI SAI HANUMANT STONE MUDHENA,SHRI SAI HANUMANT STONE,Agenda Uploaded by SEAC,EC,
5,1855,SIA/CG/MIN/135557/2020,OL/EC/SAND_MIN/DHAMTARI/1104,kapalphodi sand mine,TIKAM LAL SAHU,EC Granted,EC,
6,1856,SIA/CG/MIN/185131/2020,OL/EC/MIN/KONDAGAON/1475,GRAM PANCHAYAT MASORA ORDINARY SAND MINE KONDAGAON CG 5.0 HA,GRAM PANCHAYAT MASORA ORDINARY SAND MINE KONDAGAON CHHATTISGARH 5.0 HA,EC Granted,EC,
7,1857,SIA/CG/MIN/67409/2017,OL/EC/BRICKS_QUARRY/JASHPUR/632,Butkachhar Brick Earthclay Quarry Mine and Fix Chimney Brick Plant of Smt Pushpa Prasad,PUSHPA PRASAD,EC Granted,EC,
8,1858,SIA/CG/MIN/186043/2020,OL/EC/MIN/RAJNANDGAON/1481,Dumardihkala  Limestone Mine,SHREE NAVKAR STONES,EC Granted,EC,
9,1859,SIA/CG/MIN/412879/2023,OL/EC/MIN/JASHPUR/2255,Raghunathpur Ordinary Stone Quarry of Ranjeet Kindo,Ranjeet,EC Granted,EC,
10,1860,SIA/CG/MIN/35786/2015,,Quartz Mine,ULTIMATE ENVIROLYTICAL SOLUTION,Delisted,EC,
1,1861,SIA/CG/IND/65157/2017,OL/EC/IND/RAIGARH/605,Expansion of Steel Plant by Narmada Iron and Steel Pvt Limited,NARMADA IRON AND STEEL PRIVATE LIMITED,EC Granted,EC,
2,1862,SIA/CG/MIN/32839/2015,OL/EC/SANDMINE/DHAMTARI/155,Parkhanda Sand Mine,CMO KURUD,EC Granted,EC,
3,1863,SIA/CG/MIN/226282/2021,OL/EC/MIN/BALRAMPUR/1792,Gopalpur Bricks Earth clay Quarry & Fix Chimney Brick Plant,SHRI RAMKISHUN YADAV,EC Granted,EC,
4,1864,SIA/CG/MIN/147636/2020,OL/EC/MIN/RAJNANDGAON/1246,Sanjay Kumar Sancheti,SANJAY   KUMAR  SANCHETI,EC Granted - Processed offline,EC,
5,1865,SIA/CG/IND/50201/2019,OL/EC/IND/MUNGELI/778,Basudev Trade Link,BASUDEVTRADE LINK,EC Granted,EC,
6,1866,SIA/CG/MIN/453290/2023,,"DOLOMITE (BENEFICIABLE) QUARRY, VILLAGE MATSAGRA, PROJECT PROPONENT SHRI SUKHIRAM KAUSHIK",SUKHIRAM KAUSHIK,Pending at PP due to eds,EC,
7,1867,SIA/CG/MIN/453362/2023,,Sunil Kumar Bhatpahari,SUNIL BHATPAHARI,Pending at PP due to eds,EC,
8,1868,SIA/CG/MIN/34451/2019,OL/EC/SANDMINE/NARAYANPUR/825,brehbeda sand mine,BREHABEDA SAND MINE,EC Granted,EC,
9,1869,SIA/CG/MIN/35615/2019,OL/EC/SANDMINE/RAIPUR/852,Kurud A,GRAM PANCHAYAT KURUD JANPAD PANCHAYAT ARANG,Rejection Letter Granted,EC,
10,1870,SIA/CG/MIN/216669/2021,OL/EC/MIN/DHAMTARI/1719,LIME STONE QUARRY MORIKALA,NEERAJ GANGWAL LIMESTONE QUARRY MORIKALA,EC Granted,EC,
1,1871,SIA/CG/IND/36857/2019,OL/EC/IND/BILAPSUR/881,Hanumant Alloys (India ) Pvt. Ltd. (Expansion of Sponge Iron unit),HANUMANT ALLOYS INDIA PVT LTD,EC Granted,EC,
2,1872,SIA/CG/MIN/430494/2023,OL/EC/MIN/DURG/2456,Kamlesh Kumar Mishra Earth Clay Quarry,KAMLESH MISHRA,For further consideration(SEAC),EC,
3,1873,SIA/CG/MIN/435241/2023,OL/EC/MIN/KANKER/2557,KHAMROUDH CRUSHER STONE QUARRY,RAJESH MISHRA,For further consideration(SEAC),EC,
4,1874,SIA/CG/MIN/34451/2019,OL/EC/SANDMINE/NARAYANPUR/825,brehbeda sand mine,BREHABEDA SAND MINE,EC Granted,EC,
5,1875,SIA/CG/MIN/35615/2019,OL/EC/SANDMINE/RAIPUR/852,Kurud A,GRAM PANCHAYAT KURUD JANPAD PANCHAYAT ARANG,Rejection Letter Granted,EC,
6,1876,SIA/CG/MIN/37416/2019,EL/OC/SANDMINE/RAIPUR/899,Kurud Sand Mine B,KURUD SAND MINE,EC Granted,EC,
7,1877,SIA/CG/MIN/32935/2015,OL/EC/SANDMINE/BILASPUR/157,K. Pramila Naidu Limestone Mine,K PRAMILA NAIDU,EC Granted,EC,
8,1878,SIA/CG/MIN/74407/2018,OL/EC/MIN/DURG/694,"Sahegaon Limestone Mine 
Area 4.047 Hects",ROPRELA BROTHERS,EC Granted,EC,
9,1879,SIA/CG/MIN/38578/2016,OL/EC/SANDMINE/GARIYABANDH/286,Tarra Sand Mine,SARPANCH TARRA,EC Granted,EC,
10,1880,SIA/CG/MIN/412539/2022,,Salka Ordinary Stone mine of Vivek  Jaiswal,VIVEK JAISWAL,Pending at PP due to eds,EC,
1,1881,SIA/CG/MIN/33120/2015,OL/EC/BRICKS/BILASPUR/166,Sagar Brick Earth Quarry,SAGAR BRICK EARTH QUARRY,EC Granted,EC,
2,1882,SIA/CG/MIN/412539/2022,,Salka Ordinary Stone mine of Vivek  Jaiswal,VIVEK JAISWAL,Pending at PP due to eds,EC,
3,1883,SIA/CG/MIN/436318/2023,OL/EC/MIN/KORBA/2573,Kudmura-I Sand Quarry,BIJMOTI RATHIYA,Request for withdraw,EC,
4,1884,SIA/CG/MIN/454738/2023,,Kailash Naik,KAILASH NAIK,Under examination of SEIAA,EC,
5,1885,SIA/CG/MIN/454953/2023,,Rajkishore Tamrakar,RAJ TAMRAKAR,Under examination of SEIAA,EC,
6,1886,SIA/CG/MIN/455210/2023,,MOHRENGA LIMESTONE QUARRY,ARVIND GUPTA,Under examination of SEIAA,EC,
7,1887,SIA/CG/MIN/35786/2015,,Quartz Mine,ULTIMATE ENVIROLYTICAL SOLUTION,Delisted,EC,
8,1888,SIA/CG/MIN/191026/2021,OL/EC/MIN/SURAJPUR/1501,Pampapur Ordinary stone Quarry Mine of Anand Kumar Singhal,PAMPAPUR ORDINARY STONE MINE OF ANAND KUMAR SINGHAL,EC Granted,EC,
9,1889,SIA/CG/MIN/191130/2021,OL/EC/MIN/RAIGARH/1503,Bansjore Ordinary Stone Mine,BANSJORE ORDINARY STONE MINE OF MS SURESH KUMAR AGRAWAL LLP,EC Granted,EC,
10,1890,SIA/CG/MIN/61338/2016,OL/EC/SANDMINE/GARIYABANDH/537,kosamkhuta sand mine,SARPANCH KOSAMKHUTA,EC Granted,EC,
1,1891,SIA/CG/MIN/67035/2021,OL/EC/MIN/DURG/1780,,SHRI SHYAM VENTURES.,EC Granted,EC,
2,1892,SIA/CG/MIN/430100/2023,,M/s Newandraram and Sons Pro- Hemraj Chhabaria Earth Clay Quarry,HEMRAJ CHHABADIYA,Pending at PP due to eds,EC,
3,1893,SIA/CG/IND/71768/2017,OL/EC/IND/RAIPUR/657,Expansion of Hot charged Rolling Mill,HANUMAN ISPAT PRIVATE LIMITED,EC Granted,EC,
4,1894,SIA/CG/MIN/33647/2015,OL/EC/SANDMINE/MUNGELI/186,Thelki Sand Mine,SACHIV THELKI,EC Granted,EC,
5,1895,SIA/CG/MIN/50713/2016,,Limestone quarry,SHRI VIJAY AGRAWAL,Delisted,EC,
6,1896,SIA/CG/MIN/36526/2019,,LIMESTONE QUARRY MINE NARDAHA,INDER KUMAR ATHWANI,Delisted,EC,
7,1897,SIA/CG/MIN/41996/2016,OL/EC/SANDMINE/rajnandgaon/324,khujji sand mine,SARPANCH KHUJJI,EC Granted,EC,
8,1898,SIA/CG/MIN/44084/2019,OL/EC/MIN/MAHASAMUND/968,Barbarik Project Limited chhirralewa B,BARBARIC PROJECT LIMITED SURAJPUR,EC Granted,EC,
9,1899,SIA/CG/MIN/194539/2021,OL/EC/MIN/SURAJPUR/1532,Harratikra-1 Sand Quarry  of Sajjad Khan,SAJJAD KHAN,EC Granted,EC,
10,1900,SIA/CG/MIN/428462/2023,OL/EC/MIN/DANTEWADA/2409,Purushottam Yadav,PURUSHOTTAM YADAV,EC Granted,EC,
1,1901,SIA/CG/MIN/41311/2016,OL/EC/SANDMINE/JANJGIR-CHAMPA/317,Kawlajhar.env@gmail.com,KAWLAJHAR GRAMPANCHAYAT,Rejection Letter Granted,EC,
2,1902,SIA/CG/MIN/37870/2016,OL/EC/SANDMINE/KORIYA/277,Chainpur Sand Mining Plan,SARPANCH CHAINPUR,Rejection Letter Granted,EC,
3,1903,SIA/CG/MIN/64497/2017,OL/EC/SAND_MINE/DHAMTARI/590,mudpar sand mine,MUDPAR SAND MINE,EC Granted,EC,
4,1904,SIA/CG/MIN/32935/2015,OL/EC/SANDMINE/BILASPUR/157,K. Pramila Naidu Limestone Mine,K PRAMILA NAIDU,EC Granted,EC,
5,1905,SIA/CG/MIN/412539/2022,,Salka Ordinary Stone mine of Vivek  Jaiswal,VIVEK JAISWAL,Pending at PP due to eds,EC,
6,1906,SIA/CG/MIN/453290/2023,,"DOLOMITE (BENEFICIABLE) QUARRY, VILLAGE MATSAGRA, PROJECT PROPONENT SHRI SUKHIRAM KAUSHIK",SUKHIRAM KAUSHIK,Pending at PP due to eds,EC,
7,1907,SIA/CG/MIN/453362/2023,,Sunil Kumar Bhatpahari,SUNIL BHATPAHARI,Pending at PP due to eds,EC,
8,1908,SIA/CG/MIN/31719/2015,OL/EC/SANDMINE/BILASPUR/54,Ratkhandi Sand Mining,PANCHAYAT SACHIV,EC Granted,EC,
9,1909,SIA/CG/MIN/42299/2016,OL/EC/LIME_STONE/RAIPUR/332,Khaira Lime Stone T.P. Quarry Mine,SINGHANIA ENTERPRISES,EC Granted,EC,
10,1910,SIA/CG/MIN/37416/2019,EL/OC/SANDMINE/RAIPUR/899,Kurud Sand Mine B,KURUD SAND MINE,EC Granted,EC,
1,1911,SIA/CG/MIN/43975/2017,OL/EC/MIN/RAJNANDGAON/1011,YOGESH  DAKALIYA,YOGESH  DAKALIYA,EC Granted,EC,
2,1912,SIA/CG/MIN/173467/2020,OL/EC/MIN/GARIABAND/1395,purnapani sand mine,AMIT AGENCY,EC Granted,EC,
3,1913,SIA/CG/MIN/136926/2020,OL/EC/MIN/JASHPUR/1136,Kasira Sand Quarry of Sambhu Nath Dubey,SHAMBHU NATH DUBEY,EC Granted,EC,
4,1914,SIA/CG/MIN/172619/2020,OL/EC/MIN/BILASPUR/1389,Manwa sand mine of Ghanshyam Sahu,MANWA SAND MINE OF GHANSHYAM SAHU,EC Granted,EC,
5,1915,SIA/CG/MIN/48404/2018,OL/EC/MIN/DURG/697,A K Verma Pathariya Lime Stone Mine 3.47 Ha,A K VERMA LIMESTONE,EC Granted,EC,
6,1916,SIA/CG/MIN/58937/2019,OL/EC/MIN/DURG/1488-B,Alpa Shrivastava Medesara Limestone Mine,SMT. ALPA SHRIVASTAVA MEDESARA LIMESTONE MINE,EC Granted,EC,
7,1917,SIA/CG/MIN/196257/2021,OL/EC/MIN/DURG/1545,SHRI NATWAR LAL TAMRAKAR DOLOMITE MINE PENDRITARAI DURG CG,NATWAR LAL TAMRAKAR DOLOMITE QUARRY PENDRITARAI,EC Granted,EC,
8,1918,SIA/CG/MIN/127571/2019,OL/EC/MIN/DURG/1035,Arvind Kumar Agrawal Bharda Sandmine,BHARDA SAND MINE,Rejection Letter Granted,EC,
9,1919,SIA/CG/MIN/39314/2016,OL/EC/LIMESTONE_MINE/BILASPUR/298,Durugadih Limestone Quarry Mine of Mahesh Sharma,MAHESH SHARMA,Rejection Letter Granted,EC,
10,1920,SIA/CG/MIN/453631/2023,,PAWAN KUMAR BHATAPAHARI,PAVAN BHATAPAHARI,Pending at PP due to eds,EC,
1,1921,SIA/CG/MIN/33966/2019,,KEWATINTOLA ORDINARY STONE QUARRY,RAMESH PANJWANI,Delisted,EC,
2,1922,SIA/CG/MIN/136940/2020,OL/EC/MIN/KONDAGAON/1138,sonabaal sand mine,UTKARSH ANTHONY 1,EC Granted,EC,
3,1923,SIA/CG/MIN/143504/2020,OL/EC/MIN/J_CHAMPA/1183,Barbaspur Sand Mine of Kumari Kavita Mishra,BARBASPUR SAND MINE OF KUMARI KAVITA MISHRA,EC Granted,EC,
4,1924,SIA/CG/MIN/168227/2020,OL/EC/MIN/BALOD/1369,TILKHAIRI (SALONI) ORDINARY SAND MINE BALOD CG,TILKHAIRI (SALONI) ORDINARY SAND MINE BALOD CG,EC Granted,EC,
5,1925,SIA/CG/MIN/168941/2020,OL/EC/MIN/SUKMA/1372,Murtonda Ordinary Stone Quarry,MURTONDA ORDINARY STONE QUARRY,EC Granted,EC,
6,1926,SIA/CG/MIN/143461/2020,OL/EC/MIN/RAIGARH/1179,E-3 Sahaspuri Ordinary Sand Quarry,DHRUV KUMAR AGRAWAL,EC Granted,EC,
7,1927,SIA/CG/MIN/228140/2021,OL/EC/MIN/SURAJPUR/1837,SEMRA ORDINARY STONE QUARRY,SEMRA ORDINARY STONE QUARRY,For further consideration(SEIAA),EC,
8,1928,SIA/CG/MIN/85791/2018,OL/EC/LIMESTONEMINE/RAJNANDGAON/754,SANGITA JAIN LIMESTONE MINE,SANGITA JAIN STONE MINE,EC Granted,EC,
9,1929,SIA/CG/MIN/206973/2021,OL/EC/MIN/MAHASAMUND/1628,Barbaspur A2 sand mine of Manoj Kumar Chandrakar,BARBASPUR SAND MINE OF  MANOJ KUMAR CHANDRAKAR,EC Granted,EC,
10,1930,SIA/CG/MIN/259276/2022,,HALDIJHARIYA ORDINARY STONE MINE,SUBHASH VERMA,Delisted,EC,
1,1931,SIA/CG/MIN/147784/2020,OL/EC/MIN/RAJNANDGAON/1236,Daulat Singh Chandel 1.215 Ha Nawagaon Limestone Mine,DAULAT SINGH CHANDEL LIMESTONE MINE,Rejection Letter Granted,EC,
2,1932,SIA/CG/MIN/152653/2020,OL/EC/MIN/RAJNANDGAON/1297,Sameer Poddar Chawardhal Limestone Mine,SAMEER PODDAR LIME STONE,EC Granted,EC,
3,1933,SIA/CG/MIN/63693/2017,OL/EC/MOULDING_SAND/RAJNANDGAON/574,"Archana Das  
Bakal Runner Moulding Sandmine",BAKAL RUNNER MOULDING SAND,EC Granted,EC,
4,1934,SIA/CG/IND3/411831/2022,OL/EC/IND3/DURG/2051,Proposed Unit for Manufacturing of Formaldehyde,SHUBHAM SYNDICATE LLP,EC Granted,EC,
5,1935,SIA/CG/MIN/433163/2023,OL/EC/MIN/BILASPUR/1479,M/s Kanha Minerals (Pro-Mukesh Kumar Vidhani),MUKESH VIDHANI,EC Granted,EC,
6,1936,SIA/CG/MIN/454096/2023,,Hajarilal Bhardwaj,HARDEEP KUMAR,Pending at PP due to eds,EC,
7,1937,SIA/CG/MIN/454128/2023,,Kartik Ram Patel,KARTIK PATEL,Pending at PP due to eds,EC,
8,1938,SIA/CG/MIN/454147/2023,,Dinesh Kumar Tiwari,DINESH TIWARI,Under examination of SEIAA,EC,
9,1939,SIA/CG/MIN/454561/2023,,Jai Prakash Verma,JAI VERMA,Under examination of SEIAA,EC,
10,1940,SIA/CG/MIN/454337/2023,,Vinita Jaiswal,BINITA DEVI,Pending at PP due to eds,EC,
1,1941,SIA/CG/MIN/435127/2023,OL/EC/MIN/RAIPUR/2552,Deepak Kumar Chandrakar,DEEPAK CHANDRAKAR,EC Granted,EC,
2,1942,SIA/CG/MIN/35731/2015,OL/EC/SANDMINE/JASHPUR/237,sand mining,SACHIVTEMPOO,EC Granted,EC,
3,1943,SIA/CG/MIN/56580/2016,,PIPLAWAND LIMESTONE DEPOSIT,UNITECH MINERS,Delisted,EC,
4,1944,SIA/CG/MIN/153225/2020,OL/EC/MIN/RAJNANDGAON/1301,Radheshyam Gupta Khamtola Quartz Mine,RADHESHYAM GUPTA QUARTZ,EC Granted,EC,
5,1945,SIA/CG/CMIN/18587/2013,OL/EC/COAL_WASHERY/BILASPUR/1070,Clean Coal Enterprises Private Limited,CLEAN COAL ENTERPRISES PRIVATE LIMITED,EC Granted,EC,
6,1946,SIA/CG/MIN/42870/2019,OL/EC/MIN/RAJNANDGAON/1005,Smt. Rakhi Turhate,SMT RAKHI TURHATE,EC Granted,EC,
7,1947,SIA/CG/MIN/48349/2016,,Phurphundi Stone Mine,PWD BHANUPRATAPPUR,Delisted,EC,
8,1948,SIA/CG/NCP/67764/2017,OL/EC/NCP/RAIPUR/634,AVINASH Capital Homes 2,ANAND SINGHANIA,EC Granted,EC,
9,1949,SIA/CG/IND/202223/2021,OL/EC/IND/RAIPUR/1587,M/s Manav Energy & Steel Pvt Ltd,MS MANAV ENERGY AND STEEL PVT LTD UNIT 2,EC Granted - Processed offline,EC,
10,1950,SIA/CG/MIN/457104/2023,,"Kadampal Ordinary Stone Quarry, Sh. Aman Agrawal, Village- Kadampal, Tehsil-Bade Bacheli, District- South Baster Dantewada (C.G.)",AMAN AGRAWAL,Under examination of SEIAA,EC,
1,1951,SIA/CG/MIN/228346/2021,,Flag Stone Quarry of Indrasen Bhandekar,FLAG STONE QUARRY	OF INDRASEN BHANDEKAR,WithdrawEC,EC,
2,1952,SIA/CG/MIN/135550/2020,OL/EC/MIN/BASTAR/1105,Retawand Sand Mine,SHRI PAARTH CHAVDA,EC Granted,EC,
3,1953,SIA/CG/IND/61151/2016,OL/EC/STEEL&CASTING/RAIGARH/533,Shri Nirmlanand Steels Casting Private Limited,SHRI NIRMLANAND STEELS AND CASTINGS PVT LIMITED,EC Granted,EC,
4,1954,SIA/CG/IND1/434349/2023,OL/EC/MIN/JASHPUR/2534,Jai Ambe Ispat Pvt. Ltd.,ANIL AGRAWAL,Rejected by SEIAA,EC,
5,1955,SIA/CG/MIN/434327/2023,OL/EC/MIN/JASHPUR/2535,"Stone Quarry, Village Silipakhna (East Side) (Temporary Permit)",SHRI SAI MINERAL,Referred Back to SEAC(A),EC,
6,1956,SIA/CG/MIN/454795/2023,,Deepak Kumar Jaiswal,DEEPAK JAISWAL,Pending at PP due to eds,EC,
7,1957,SIA/CG/MIN/37822/1900,,Deogaon Sand Quarry,GRAM PANCHAYAT PIPARHATTA,Delisted,EC,
8,1958,SIA/CG/MIN/30922/2015,,hjj,PARMANAND STONE,Delisted,EC,
9,1959,SIA/CG/MIN/33656/2015,,Dhansuli lime stone mine,DHANSULI LIMESTONE MINES,Delisted,EC,
10,1960,SIA/CG/MIN/51255/2016,OL/EC/SANDMINE/BEMETARA/424,parpoda sand mine,SARPANCH PARPODA,EC Granted,EC,
1,1961,SIA/CG/NCP/33503/2015,OL/EC/CONSTRUCTION-PROJECT/RAIPUR/184,"Group Housing complex at plot no. c-05, sector 30, naya raipur",Delhi Development authority,EC Granted,EC,
2,1962,SIA/CG/MIN/147784/2020,OL/EC/MIN/RAJNANDGAON/1236,Daulat Singh Chandel 1.215 Ha Nawagaon Limestone Mine,DAULAT SINGH CHANDEL LIMESTONE MINE,Rejection Letter Granted,EC,
