,Sno.,Proposal No.,File No.,Project Name,Company,Proposal Status,Project Type,View
5,575,SIA/CG/MIN/186687/2020,,M/s Quality Construction(Prop.-GD Jaswani),M/S QUALITY CONSTRUCTION(PROP.- GD JASWANI),Delisted,EC,
6,576,SIA/CG/MIN/178458/2020,OL/EC/MIN/KORBA/1416,kasrenga sand mine,ABHAY KUMAR GARG,EC Granted,EC,
7,577,SIA/CG/MIN/182536/2020,OL/EC/MIN/BIJAPUR/1466,TIMED ORDINARRY STONE QUARRY,TIMED ORDINARY STONE QUARRY,EC Granted,EC,
8,578,SIA/CG/MIS/256548/2022,OL/EC/MIS/MAHASAMUND/1932,"Installation of Bicable Fixed Grip Ropeway System at Khallari Mata Temple, Chhattisgarh",BIPLAB DAS,Rejection Letter Granted,EC,
9,579,SIA/CG/MIN/38325/2016,OL/EC/SANDSTONE_MINE/BILASPUR/280,Kota Sand Stone Quarry Mine of M/s Royal Seema Concrete Pvt. Ltd.,ROYAL SEEMA CONCRETE PVT LTD,EC Granted,EC,
10,580,SIA/CG/MIN/55376/2016,OL/EC/SANDMINE/BILASPUR/463,KHAPRI (KOHROUDA),SACHIV KOHROUDA KHAPRI,EC Granted,EC,
1,581,SIA/CG/MIN/228757/2021,,Shri Piyush Shrivastava,SHRI PIYUSH SHRIVASTAVA,Delisted,EC,
2,582,SIA/CG/IND/29609/2017,,KRISHNA IRON STRIPS AND TUBES PVT TD,KRISHNA IRON STRIPS AND TUBES PRIVATE LIMITED,EC Granted,EC,
3,583,SIA/CG/MIN/32557/2015,OL/EC/SANDMINE/JASHPUR/129,kujari sand mine,SACHIV KUJARI,EC Granted,EC,
4,584,SIA/CG/MIN/405011/2022,OL/EC/MIN/MUNGELI/2176,Jamunahi Sand Mine of Subhendra Singh,SHUBHENDRA SINGH,EC Granted,EC,
5,585,SIA/CG/MIN/45639/2019,OL/EC/MIN/DHAMTARI/992,rajpur sand mine,ASHISH RAJPUR,EC Granted,EC,
6,586,SIA/CG/MIN/33026/2015,OL/EC/SANDMINE/RAIGARH/162,Gram Panchyat Budiya,SACHIV BUDIYA,EC Granted,EC,
7,587,SIA/CG/NCP/33503/2015,OL/EC/CONSTRUCTION-PROJECT/RAIPUR/184,"Group Housing complex at plot no. c-05, sector 30, naya raipur",Delhi Development authority,EC Granted,EC,
8,588,SIA/CG/MIN/150780/2020,OL/EC/MIN/RAJNANDGAON/1281,Padamchand Jain Dumardihkala Limestone Mine,PADAM CHAND JAIN LIME STONE,EC Granted,EC,
9,589,SIA/CG/IND1/424794/2023,OL/EC/IND1/BILASPUR/2363,Arora (C.G.) Energy & Steel Pvt. Ltd.,JAYANT AIRAN,Agenda Uploaded by SEIAA,EC,
10,590,SIA/CG/MIN/425460/2023,OL/EC/MIN/BIJAPUR/2378,reguda -1 sand mine,BUDHRAM MICHCHA,EC Granted,EC,
1,591,SIA/CG/MIN/244137/2021,OL/EC/MIN/BALRAMPUR/1871,Baikunthpur Stone Quarry,"BAIKUNTHPUR ORDINARY STONE QUARRY , VIRENDRA KUMAR SINGH",For further consideration(SEAC),EC,
2,592,SIA/CG/MIS/256138/2022,,"Installation of Bicable Fixed Grip Passenger Ropeway System at Khallari Mata Temple, Chhattisgarh",ROPEWAY AND RESORTS PRIVATE LIMITED,WithdrawEC,EC,
3,593,SIA/CG/IND1/420819/2023,OL/EC/MIN/RAIPUR/2325,SHREE RAMDOOT ISPAT PRIVATE LIMITED,SHREE RAMDOOT ISPAT PRIVATE LIMITED,Rejected by SEIAA,EC,
4,594,SIA/CG/IND/219921/2021,OL/EC/IND/RAIPUR/1727,Pragati Ingots & Power Private Limited,PRAGATI INGOTS & POWER PVT. LTD.,EC Granted,EC,
5,595,SIA/CG/MIN/57190/2020,OL/EC/MIN/RAIPUR/1412,Nardaha Limestone Quarry,NARDAHA LIME STONE QUARRY,EC Granted - Processed offline,EC,
6,596,SIA/CG/MIN/228757/2021,,Shri Piyush Shrivastava,SHRI PIYUSH SHRIVASTAVA,Delisted,EC,
7,597,SIA/CG/MIN/33457/2015,OL/EC/SANDMINE/DURG/182,gota sand mine,SARPANCH GOTA,EC Granted,EC,
8,598,SIA/CG/MIN/53591/2016,OL/EC/SANDMINE/BALODA_BAZAR/454,Lata Sand Mine,GRAM PANCHAYAT,EC Granted,EC,
9,599,SIA/CG/MIN/429160/2023,OL/EC/MIN/BIJAPUR/2422,Rampuram-1 Sand Quarry,GOTA MEENA,Agenda Uploaded by SEAC,EC,
10,600,SIA/CG/MIN/63389/2021,OL/EC/MIN/DURG/1665,Pathariya Limestone Mine,MUKESH DHODY LIMESTONE MINE PATHARIYA DURG,EC Granted,EC,
1,601,SIA/CG/MIN/435577/2023,OL/EC/MIN/RAIPUR/2553,Budera Limestone Quarry (Area -0.75 Ha.),ASHOK SAHU,For further consideration(SEAC),EC,
2,602,SIA/CG/NCP/52743/2016,OL/EC/B&C/RAIPUR/439,Chatanya Greens,ASHOK  KHUBCHANDANI,EC Granted,EC,
3,603,SIA/CG/MIN/39051/2019,OL/EC/MIN/DURG/917,SMT SHERLY PONNACHAN DOLOMITE MINE PENDRITARAI DURG CG,SMT SHERLY PONNACHAN DOLOMITE MINE PENDRITARAI DURG CG,EC Granted,EC,
4,604,SIA/CG/MIN/53730/2016,,RAJAT KUMAR PARAKH STONE MINE,RAJAT KUMAR PARAKH STONE MINE,Delisted,EC,
5,605,SIA/CG/MIN/51011/2016,,Flagstone quarry village Ghodari,SANTOSH YADAV,Delisted,EC,
6,606,SIA/CG/MIN/51062/2016,,Sand Quarry Grampanchyat Toshgaon,GRAMPANCHYAT,Delisted,EC,
7,607,SIA/CG/MIN/55782/2016,,ANIL KUMAR CHAWDA BRICK EARTH MINE,ANIL KUMAR CHAWDA BRICK EARTH MINE,Delisted,EC,
8,608,SIA/CG/MIN/31820/2015,OL/EC/SANDMINE/KORBA/75,,MUNICIPAL CORPORATION KATGHORA,EC Granted,EC,
9,609,SIA/CG/MIN/32068/2015,,Karhikachhar sand Mining,PANCHAYAT SACHIV,Delisted,EC,
10,610,SIA/CG/MIN/64049/2017,,"Mohini Devi Mishra 1.92 Hectare  
Nandini Khundini Limestone Mine",MOHINI DEVI MISHRA,WithdrawEC,EC,
1,611,SIA/CG/MIN/164547/2020,OL/EC/MIN/raigarh/1353,Sohanpur Ordinary Stone Temporary Permit Quarry of Shree Sunil Kumar Agrawal LLP,SOHANPUR ORDINARY STONE QUARRY OF SHREE SUNIL KUMAR AGRAWAL LLP,EC Granted,EC,
2,612,SIA/CG/MIN/183875/2020,OL/EC/MIN/SURAJPUR/1469,BUDHADAND BRICKS EARTHCLAY QUARRY & FIX CHIMNEY BRICKS PLANT,SMT. SADHANA JAISWAL,EC Granted,EC,
3,613,SIA/CG/MIN/184037/2020,OL/EC/MIN/BALRAMPUR/1470,REWATPUR BRICKS EARTHCLAY QUARRY & FIX CHIMNEY BRICKS PLANT,SHRI ANKIT KUMAR JAISWAL,EC Granted,EC,
4,614,SIA/CG/IND2/20797/2017,OL/TOR/IND/RAIPUR/641,"Augmentation of POL Terminal At Mandir Hasaud Village of District Raipur, Chhattisgarh, PIN-492101",HINDUSTAN PETROLEUM CORPORATION LIMITED,EC Granted,EC,
5,615,SIA/CG/MIN/143461/2020,OL/EC/MIN/RAIGARH/1179,E-3 Sahaspuri Ordinary Sand Quarry,DHRUV KUMAR AGRAWAL,EC Granted,EC,
6,616,SIA/CG/MIN/228140/2021,OL/EC/MIN/SURAJPUR/1837,SEMRA ORDINARY STONE QUARRY,SEMRA ORDINARY STONE QUARRY,For further consideration(SEIAA),EC,
7,617,SIA/CG/MIN/203140/2021,OL/EC/MIN/JANJGIR_CHAMPA/1597,Tarod Limestone Mine,NILKAMAL SINGH,EC Granted - Processed offline,EC,
8,618,SIA/CG/MIN/199432/2021,OL/EC/MIN/RAIGARH/1564,aurabhata sand mine,AURABHATA SAND MINE,EC Granted,EC,
9,619,SIA/CG/MIN/199434/2021,OL/EC/MIN/SURAJPUR/1566,namadgiri l1 sand mine,NAMADGIRI L1 SAND MINE,EC Granted,EC,
10,620,SIA/CG/IND/16758/2016,OL/EC/LPG_BOTTLING_PLANT/RAIPUR/328,,BHARAT PETROLEUM CORPORATION LIMITED,EC Granted - Processed offline,EC,
1,621,SIA/CG/MIN/32038/2015,OL/EC/SANDMINE/BILASPUR/92,saroj sharma stone mine,SAROJ SHARMA STONE MINE,EC Granted,EC,
2,622,SIA/CG/MIN/33647/2015,OL/EC/SANDMINE/MUNGELI/186,Thelki Sand Mine,SACHIV THELKI,EC Granted,EC,
3,623,SIA/CG/MIN/50713/2016,,Limestone quarry,SHRI VIJAY AGRAWAL,Delisted,EC,
4,624,SIA/CG/MIN/34094/2015,OL/EC/SANDMINE/RAIGARH/211,Ghughuwa Sand Mine,GRAM PANCHAYAT GHUGHUWA,EC Granted,EC,
5,625,SIA/CG/MIN/216931/2021,OL/EC/MIN/BASTAR/1723,TIKANPAL NAGO LIMESTONE MINE BASTAR CG 1.05,TIKANPAL LIMESTONE MINE BASTAR CHHATTISGARG 1.050 HA,EC Granted,EC,
6,626,SIA/CG/MIN/186043/2020,OL/EC/MIN/RAJNANDGAON/1481,Dumardihkala  Limestone Mine,SHREE NAVKAR STONES,EC Granted,EC,
7,627,SIA/CG/MIN/147636/2020,OL/EC/MIN/RAJNANDGAON/1246,Sanjay Kumar Sancheti,SANJAY   KUMAR  SANCHETI,EC Granted - Processed offline,EC,
8,628,SIA/CG/IND/50201/2019,OL/EC/IND/MUNGELI/778,Basudev Trade Link,BASUDEVTRADE LINK,EC Granted,EC,
9,629,SIA/CG/MIN/52357/2016,,"M/s Bhana Bai Deshmukh Brick Earth Mine in Village Albaras, Teh & Dist Durg Chhattisgarh",BHANA BAI DESHMUKH BRICK EARTH MINE,Delisted,EC,
10,630,SIA/CG/MIN/424420/2023,OL/EC/MIN/DHAMTARI/2365,"M/s.Dilip Buildcon Limited, Bhopal	-Dhanbuda Ordinary Stone Temporary Permit Quarry (2)",DILIP BUILDCON LIMITED,EC Granted,EC,
1,631,SIA/CG/MIN/182887/2020,OL/EC/MIN/MUNGELI/1477,sahaspur dolomite quarry,SAHASPUR DOLOMITE QUARRY,EC Granted,EC,
2,632,SIA/CG/MIN/50584/2020,OL/EC/MIN/RAIPUR/1158,kumhari a sand mine,SHUBHAM JAJODIA,EC Granted,EC,
3,633,SIA/CG/MIN/43582/2019,OL/EC/MIN/RAJNANDGAON/998,Shiv Agrawal,SHIV  AGRAWAL,EC Granted,EC,
4,634,SIA/CG/MIN/43976/2017,OL/EC/MIN/RAJNANDGAON/997,Abhay Jain,SHRI ABHAY JAIN,EC Granted,EC,
5,635,SIA/CG/MIN/135505/2020,OL/EC/SAND_MIN/BASTAR/1103,Badeamabal Sand Mine,SHHRII VINAAYAK PAANDEY,EC Granted,EC,
6,636,SIA/CG/MIN/152461/2020,OL/EC/MIN/RAJNANDGAON/1292,Manish Kumar Jain Salikjhitiya Flagstone Mine,MANISH KUMAR JAIN STONE MINE,EC Granted,EC,
7,637,SIA/CG/MIN/40346/2019,OL/EC/MIN/RAJNANDGAON/930,Kalkasa Limestone Quarry (Paresh Kumar),PARESH KUMAR,EC Granted,EC,
8,638,SIA/CG/MIN/72067/2020,OL/EC/MIN/RAJNANDGAON/1274,Kalkasa Limestone Quarry(Smt.Aruna Jogewar),SMT ARUNA JOGEWAR,Awaiting EC,EC,
9,639,SIA/CG/MIN/63439/2017,OL/EC/SAND_MINE/KORIYA/581,Sand Mine Plan,SARPANCH MALAKDOL,EC Granted,EC,
10,640,SIA/CG/MIN/146775/2020,OL/EC/MIN/DHAMTARI/1223,HASDA ORDINARY SAND MINE DHAMTARI CG,SAMBALPUR ORDINARY SAND MINE KONDAGAON CG,EC Granted,EC,
1,641,SIA/CG/MIN/213861/2021,OL/EC/SANDMINE/KORBA/1691,Kutesernagoi Sand Mine of Arun Kumar Singhania,KUTESERNAGOI SAND MINE  OF ARUN KUMAR SINGHANIA,EC Granted,EC,
2,642,SIA/CG/MIN/160757/2020,OL/EC/MIN/KANKER/1336,KARIHA SAND QUARRY,KANKER SAND QUARRY,EC Granted,EC,
3,643,SIA/CG/MIN/425025/2023,OL/EC/MIN/JASHPUR/2374,M/s. Dilip Buildcon Limited-Turuama Ordinary Stone Temporary Permit Quarry (2),DILIP BUILDCON LIMITED,EC Granted,EC,
4,644,SIA/CG/MIN/425159/2023,OL/EC/MIN/SURGUJA/2382,M/s. Karra Lime Stone Mine (Pro. - Dwitendra Kumar Mishra),DWITENDRA KUMAR MISHRA,Awaiting EC,EC,
5,645,SIA/CG/MIN/70692/2017,OL/EC/SAND_MINE/JANJGIR_CHAMPA/642,Sand Quarry Village Tusma,TUSMA  SAND  QUARRY,EC Granted,EC,
6,646,SIA/CG/MIN/41027/2016,OL/EC/SANDMINE/SURAJPUR/313,Rajapur Sand Mine,SARPANCH RAJAPUR,Delisted,EC,
7,647,SIA/CG/MIN/35747/2019,,Amdi Sand Mine,AMDI SAND MINE,Pending at PP due to eds,EC,
8,648,SIA/CG/MIN/226855/2021,OL/TOR/MIN/SURAJPUR/1782,Beltikari Ordinary Stone Mine,BELTIKARI ORDINARY STONE MINE OF VISHNU AGRAWAL,Under examination of SEIAA after SEAC,EC,
9,649,SIA/CG/IND/218072/2021,OL/EC/IND/RAIPUR/1724,Venkateshwar Strips (P) Ltd.,VENKATESHWAR STRIPS (P) LTD.,EC Granted,EC,
10,650,SIA/CG/MIN/174001/2020,OL/EC/MIN/KJ_CHAMPA/1399,Tanaud sand mine of Pitambar Agrawal,TANAUD SAND MINE OF PITAMBAR AGRAWAL,EC Granted,EC,
1,651,SIA/CG/CMIN/62224/2019,OL/EC/MIN/JANJGIR_CHAMPA/766,"M/s Inspire Industries Private Limited proposes coal washery of 0.99 MTPA capacity at Bhelai village, Baloda tehsil, Janjgir-Champa district, Chhattisgarh state.",INSPIRE INDUSTRIES PRIVATE LIMITED,EC Granted,EC,
2,652,SIA/CG/MIN/145449/2020,,Bagharra Sand Mine,GANGA PRASAD KASHYAP,Delisted,EC,
3,653,SIA/CG/MIN/44498/2017,OL/EC/MIN/RAJNANDGAON/1083B,Meena Ranglani limestone quarry,MEENA  RANGLANI,EC Granted,EC,
4,654,SIA/CG/MIN/32458/2015,OL/ec/SANDMINE/BILASPUR/122,PASID SAND MINE,PANCHAYAT SACHIV,EC Granted,EC,
5,655,SIA/CG/MIN/182509/2020,OL/EC/MIN/SURAJPUR/1465,"Proposed Project of Ordinary Stone Mining at Khasra No. 196, of Area- 1 Ha, Village - Pasta, Tehsil- Ramanuj Nagar,  District- Surajpur, State- Chhattisgarh.",SMT. ARTI GUPTA W/O SHRI VISHWANATH PRASAD GUPTA,EC Granted,EC,
6,656,SIA/CG/MIN/34898/2019,,River Bed Sand Mine (Darra Sand Mine),GRAM PANCHAYAT DARRA,Pending at PP due to eds,EC,
7,657,SIA/CG/NCP/55386/2016,OL/EC/B&C/RAIPUR/465,The GOLF REPUBLIC by R L Developers,R L DEVELOPERS,EC Granted - Processed offline,EC,
8,658,SIA/CG/IND2/59229/2016,OL/EC/IND2/RAIPUR/502,INDIAN OIL CORPORATION LIMITED RAIPUR LPG BOTTLING PLANT,INDIAN OIL CORPORATION LIMITED RAIPUR LPG BOTTLING PLANT,EC Granted,EC,
9,659,SIA/CG/MIN/213356/2021,OL/EC/SANDMINE/GARIABAND/1676,Parsadajoshi Sand Mine -2 of Sankalp Janghel,PARSADAJOSHI SAND MINE -2 OF SANKALP JANGHEL,EC Granted,EC,
10,660,SIA/CG/MIN/213482/2021,OL/EC/SANDMINE/DHAMTARI/1684,bhursidongri sand mine,DHAMTARI SAND MINE,Under examination of SEIAA after SEAC,EC,
1,661,SIA/CG/MIN/34200/2015,OL/EC/SANDMINE/RAIGARH/213,Gram Panchayat baradoli sand mine,GRAM PANCHAYAT KANCHANPUR SAND MINE,EC Granted,EC,
2,662,SIA/CG/MIN/45264/2019,OL/EC/MIN/GARIYABANDH/982,Barbhata Flagstone Mine,GHANSHYAM YADU,EC Granted,EC,
3,663,SIA/CG/MIN/42479/2019,OL/EC/STONE_MIN/RAJNANDGAON/973,Harmeet Singh Bhatia,HARMEET SINGH BHATIA,EC Granted,EC,
4,664,SIA/CG/MIN/261099/2022,OL/EC/MIN/SUKMA/1965,GOLABEKUR ORDINARY STONE QUARRY,SHEIKH HUSSAIN,EC Granted,EC,
5,665,SIA/CG/MIN/413699/2023,OL/EC/MIN/RAIGARH/2262,Jhulanbar Ordinary Stone Mine of M/s. Sunil Kumar Agrawal (L.L.P),SUNIL KUMAR AGRAWAL LLP,EC Granted,EC,
6,666,SIA/CG/MIN/33732/2015,OL/EC/LIMESTONE/RAIPUR/190,Ms Nardaha Limestone Quarry,MS NARDAHA LIMESTONE QUARRY,EC Granted,EC,
7,667,SIA/CG/MIN/50826/2016,,Flag Stone quarry Village Achholi,SHRI KUSHAL SAHU,Delisted,EC,
8,668,SIA/CG/NCP/59170/2016,OL/EC/NCP/RAIPUR/500,"Commercial Office Campus including Buildings and 				Services on plot no. C03  of  Phase-I, CBD  Complex  , Sector-21",NAYA RAIPUR DEVELOPMENT AUTHORITY,Delisted,EC,
9,669,SIA/CG/MIN/32449/1900,,Bijabhata Bricks earth Quarry,FALESH KUMAR SAHU,Pending at PP due to eds,EC,
10,670,SIA/CG/MIN/148516/2020,OL/EC/MIN/KORBA/1250,C-1 Bango Ordinary Sand Quarry,SMT. SEETA DEVI AGRAWAL,EC Granted,EC,
1,671,SIA/CG/MIN/43871/2019,OL/EC/MIN/RAJNANDGAON/1015,Smt Kavita Parekh (Baldevpur Limestone Mine),KAVITA PARIKH,For further consideration(SEAC),EC,
2,672,SIA/CG/MIN/442525/2023,OL/EC/MIN/BALODA_BAZAR/2662,Mayank Mani Tripathi,MAYANK TRIPATHI,Under examination of SEIAA after SEAC,EC,
3,673,SIA/CG/IND2/20797/2017,OL/TOR/IND/RAIPUR/641,"Augmentation of POL Terminal At Mandir Hasaud Village of District Raipur, Chhattisgarh, PIN-492101",HINDUSTAN PETROLEUM CORPORATION LIMITED,EC Granted,EC,
4,674,SIA/CG/MIN/59517/2016,OL/EC/SANDMINE/MAHASAMUND/507,Garhsiwani Sand Mine,SARPANCH GARHSIWANI,EC Granted,EC,
5,675,SIA/CG/MIN/62847/2020,OL/EC/MIN/GARIABAND/983,Basin Flagstone  Mine of Pramod Singh Chandel,PRAMOD SINGH CHANDEL,EC Granted,EC,
6,676,SIA/CG/MIN/193232/2021,OL/EC/MIN/SURAJPUR/1522,umeshpur m1 sand mine,UMESHPUR M1 SAND MINE,EC Granted,EC,
7,677,SIA/CG/MIN/160757/2020,OL/EC/MIN/KANKER/1336,KARIHA SAND QUARRY,KANKER SAND QUARRY,EC Granted,EC,
8,678,SIA/CG/MIN/404902/2022,,Agrawal Global Infratech Pvt. Ltd. Director Shri Rakesh Agrawal,SMT JAYA MANDAVI  W/O LATE SHRI  S.P. MANDAVI,WithdrawEC,EC,
9,679,SIA/CG/MIN/425025/2023,OL/EC/MIN/JASHPUR/2374,M/s. Dilip Buildcon Limited-Turuama Ordinary Stone Temporary Permit Quarry (2),DILIP BUILDCON LIMITED,EC Granted,EC,
10,680,SIA/CG/MIN/425159/2023,OL/EC/MIN/SURGUJA/2382,M/s. Karra Lime Stone Mine (Pro. - Dwitendra Kumar Mishra),DWITENDRA KUMAR MISHRA,Awaiting EC,EC,
1,681,SIA/CG/IND/61268/2016,OL/EC/ROLLINGMILL&INDUCTION_FURNACE/RAIPUR/536,ISPAT INDIA,ISPAT INDIA,EC Granted - Processed offline,EC,
2,682,SIA/CG/MIN/418380/2023,OL/EC/MIN/BILASPUR/2310,Itwa Brick Earthclay Quarry  of Shobharam Ratre,SHOBHARAM RATRE,For further consideration(SEAC),EC,
3,683,SIA/CG/MIN/435370/2023,OL/EC/MIN/KORIYA/2558,MARKHOHI CRUSHER STONE QUARRY,DURGA MISHRA,For further consideration(SEAC),EC,
4,684,SIA/CG/MIN/44447/2018,OL/EC/MIN/RAJNANDGAON/1022,Sanjay Thakur Lime Stone Quarry,SANJAY THAKUR,EC Granted,EC,
5,685,SIA/CG/MIN/32234/2015,OL/EC/SANDMINE/BILASPUR/98,LAMER SAND MINE,PANCHAYAT SACHIV,EC Granted,EC,
6,686,SIA/CG/IND/71768/2017,OL/EC/IND/RAIPUR/657,Expansion of Hot charged Rolling Mill,HANUMAN ISPAT PRIVATE LIMITED,EC Granted,EC,
7,687,SIA/CG/MIN/33647/2015,OL/EC/SANDMINE/MUNGELI/186,Thelki Sand Mine,SACHIV THELKI,EC Granted,EC,
8,688,SIA/CG/MIN/50713/2016,,Limestone quarry,SHRI VIJAY AGRAWAL,Delisted,EC,
9,689,SIA/CG/MIN/55370/2016,,M/s PRITI ANGARE STONE MINE,MS PRITI ANGARE STONE MINE,Delisted,EC,
10,690,SIA/CG/MIN/65322/2017,,"M/s MUKESH DHODY LIMESTONE MINE
VILLAGE - PATHARIYA
DISTRICT - DURG (C.G.)",MUKESH DHODY LIMESTONE MINE PATHARIYA DURG,Delisted,EC,
1,691,SIA/CG/MIN/136777/2020,OL/EC/BRICK_MINE/SURAJPUR/1130,nakana bricks earth quarry & fixed chimney Bricks plant,NAKANA BRICK EARTH QUARRY & FIXED CHIMNEY BRICKS PLANT,EC Granted,EC,
2,692,SIA/CG/MIN/135098/2020,OL/EC/STONE_MIN/SURAJPUR/1098,Namna Ordinary Stone Mine,SURESH KUMAR SAHU,EC Granted,EC,
3,693,SIA/CG/MIN/34720/2019,OL/EC/SANDMINE/BALODABAZAR_BHATAPARA/832,Siriyadih Sand Mine,SIRIYADIH SAND MINE,EC Granted,EC,
4,694,SIA/CG/MIN/34865/2019,,Semariya Sand Mine A,SEMARIYA SAND MINE,Pending at PP due to eds,EC,
5,695,SIA/CG/MIN/141843/2020,OL/EC/MIN/BALOD/1165,NEWWARIKALA 02 ORDINARY SAND MINE BALOD CG,NEWARIKALA SAND MINES BALOD CG,EC Granted,EC,
6,696,SIA/CG/MIN/127473/2019,,R Andrew Maniraj Kotni Sand Mine,KOTNI SAND MINE,Delisted,EC,
7,697,SIA/CG/MIN/127754/2019,OL/EC/MIN/RAJANANDGAON/1274,Smt.Aruna Jogewar,SMT ARUNA JOGEWAR,EC Granted,EC,
8,698,SIA/CG/MIN/142833/2020,OL/EC/MIN/KONDAGAON/1170,SINGANPUR ORDINARY SAND MINE KONDAGAON CG,SINGANPUR ORDINARY SAND MINE KONDAGAON CG,EC Granted,EC,
9,699,SIA/CG/MIN/143295/2020,OL/EC/MIN/RAJNANDGAON/1176,Shivlal Chakradhari Joratarai Limestone Mine,SHIVLAL CHAKRADHARI,EC Granted,EC,
10,700,SIA/CG/MIN/56113/2016,,DINESH KUMAR RUPRELA STONE MINE,DINESH KUMAR RUPRELA STONE MINE,Delisted,EC,
1,701,SIA/CG/MIN/42455/2019,OL/EC/MIN/RAJNANDGAON/964,Naresh Lal Talreja Chaweli Limestone Mine,NARESH LAL TAREJA,Awaiting EC,EC,
2,702,SIA/CG/INFRA2/423055/2023,OL/EC/INFRA2/RAIPUR/2343,AVINASH CHITWAN,AIM INFRASTRUCTURE AND DEVELOPERS,Rejected by SEIAA,EC,
3,703,SIA/CG/MIN/417409/2023,OL/EC/MIN/SURGUJA/1784,Changori & Karra Limestone mining Cluster,ADITYA BHAGAT,Delisted,EC,
4,704,SIA/CG/MIN/32038/2015,OL/EC/SANDMINE/BILASPUR/92,saroj sharma stone mine,SAROJ SHARMA STONE MINE,EC Granted,EC,
5,705,SIA/CG/MIN/135098/2020,OL/EC/STONE_MIN/SURAJPUR/1098,Namna Ordinary Stone Mine,SURESH KUMAR SAHU,EC Granted,EC,
6,706,SIA/CG/MIN/141843/2020,OL/EC/MIN/BALOD/1165,NEWWARIKALA 02 ORDINARY SAND MINE BALOD CG,NEWARIKALA SAND MINES BALOD CG,EC Granted,EC,
7,707,SIA/CG/MIN/127473/2019,,R Andrew Maniraj Kotni Sand Mine,KOTNI SAND MINE,Delisted,EC,
8,708,SIA/CG/MIN/127754/2019,OL/EC/MIN/RAJANANDGAON/1274,Smt.Aruna Jogewar,SMT ARUNA JOGEWAR,EC Granted,EC,
9,709,SIA/CG/MIN/142833/2020,OL/EC/MIN/KONDAGAON/1170,SINGANPUR ORDINARY SAND MINE KONDAGAON CG,SINGANPUR ORDINARY SAND MINE KONDAGAON CG,EC Granted,EC,
10,710,SIA/CG/MIN/39091/2016,OL/EC/STONE_MINE/KORIA/296,"Anil Buildcon Pvt Ltd Partner Pradeep Kumar Verma
Stone Quarry ( Village-Bhakhar Tehsil - Baikunthpur District-Koriya",ANIL BUILDCON PVT LTD PARTNER PRADEEP KUMAR VERMA,EC Granted,EC,
1,711,SIA/CG/MIN/257159/2022,OL/EC/MIN/RAJNANDGAON/1944,M/s Shree Minerals (Prop- Shri Kamlesh Kumar Singh),KAMLESH SINGH,EC Granted,EC,
2,712,SIA/CG/MIN/402432/2022,OL/EC/MIN/MMA/2161,M/s Mahaveer India Pvt. Ltd.  (Director- Shri. Sunil Jain),SHREE NAVKAR STONES,EC Granted,EC,
3,713,SIA/CG/INFRA2/423055/2023,OL/EC/INFRA2/RAIPUR/2343,AVINASH CHITWAN,AIM INFRASTRUCTURE AND DEVELOPERS,Rejected by SEIAA,EC,
4,714,SIA/CG/MIN/417409/2023,OL/EC/MIN/SURGUJA/1784,Changori & Karra Limestone mining Cluster,ADITYA BHAGAT,Delisted,EC,
5,715,SIA/CG/MIN/60578/2016,OL/EC/LIMESTONE/DURG/528,"Sanjay Agrawal
Nandini-Khundini Limestone mine",SANJAY AGRAWAL LIMESTONE,Rejection Letter Granted,EC,
6,716,SIA/CG/MIN/432857/2023,OL/EC/MIN/BASTAR/2511,Badekadma Limestone Quarry,SANTOSH NAG,For further consideration(SEAC),EC,
7,717,SIA/CG/MIN/52624/2016,OL/EC/SANDMINE/KONDAGAON/437,BANIYAGAON SAND MINE,BANIYAGAON SAND MINE,EC Granted,EC,
8,718,SIA/CG/MIN/31633/2015,OL/EC/SANDMINE/BILASPUR/48,Chichgohna Sand Mining,SACHIV VILLAGE CHICHGOHNA,EC Granted,EC,
9,719,SIA/CG/MIN/31638/2015,,Manora Sand Mining,SACHIV VILLAGE MANORA,Delisted,EC,
10,720,SIA/CG/MIN/42479/2019,OL/EC/STONE_MIN/RAJNANDGAON/973,Harmeet Singh Bhatia,HARMEET SINGH BHATIA,EC Granted,EC,
1,721,SIA/CG/MIN/141855/2020,OL/EC/MIN/BALOD/1166,MULLEGUDA ORDINARY SAND MINE BALOD CG,MULEGUDA SAND MINES BALOD CG,EC Granted,EC,
2,722,SIA/CG/MIS/152281/2020,,"Construction of Residential Complex (Staff Quarter, Hostel and Amenity Block) for AIIMS, Raipur","ALL INDIA INSTITUTE OF MEDICAL SERVICES (AIIMS), RAIPUR",Delisted,EC,
3,723,SIA/CG/MIN/128109/2019,OL/EC/MIN/JAGDALPUR/1036,Kalcha Sand Mine,KALCHA SAND MINE,EC Granted,EC,
4,724,SIA/CG/MIN/33901/2015,OL/EC/SANDMINE/JANJGIRCHAMPA/204,Bhoghapara sand project,BHOGHAPARA SAND PROJECT,EC Granted,EC,
5,725,SIA/CG/MIN/36759/2019,M/s R D MINERALS (Partner– Shri Rahul Golchha),M/s R D MINERALS (Partner – Shri. Rahul Golchha),R D MINERALS,EC Granted,EC,
6,726,SIA/CG/MIN/32271/2015,OL/EC/SANDMINE/GARIABANDH/109,pitaibandh sand mine,SARPANCH PITAIBANDH,EC Granted,EC,
7,727,SIA/CG/MIN/251386/2022,,DHANSULI LIMESTONE QUARRY (VASUDEV PRITWANI),VASUDEV PRITWANI,Request for withdraw,EC,
8,728,SIA/CG/MIN/445027/2023,OL/EC/MIN/DURG//2333,Sao Minerals,M/S SAO MINERALS LIMESTONE MINE GONDPENDRY DURG CHHATTISGARH,Under examination of SEIAA after SEAC,EC,
9,729,SIA/CG/MIN/52357/2016,,"M/s Bhana Bai Deshmukh Brick Earth Mine in Village Albaras, Teh & Dist Durg Chhattisgarh",BHANA BAI DESHMUKH BRICK EARTH MINE,Delisted,EC,
10,730,SIA/CG/MIN/279298/2022,OL/EC/MIN/BASTAR/2093,CHHAPARBHANPURI LIMESTONE QUARRY,NARPAT RAM,Awaiting EC,EC,
1,731,SIA/CG/MIN/428141/2023,OL/EC/MIN/KORIYA/2403,"Chitajhor  Crusher stone Quarry , Area - 0.45 ha(1.11 Acre) , Shri Akshay Chaturvedi",AKSHAY CHATURVEDI,For further consideration(SEAC),EC,
2,732,SIA/CG/MIN/443152/2023,OL/EC/MIN/JANJGIR_CHAMPA/1597,Taraod limestone mine,NEEL SINGH,Agenda Uploaded by SEAC,EC,
3,733,SIA/CG/MIN/135709/2020,OL/EC/STONE_MINE/JASHPUR/1110,Batura Bahar Ordinary Stone Temporary Permit Quarry (3),MS TIRUPATI BUILD CON PVT LTD,EC Granted,EC,
4,734,SIA/CG/MIN/59350/2016,OL/EC/SANDMINE/MAHASAMUND/504,Bamhani Sand Mine,SARPANCH BAMHANI,EC Granted,EC,
5,735,SIA/CG/MIN/174500/2020,OL/EC/MIN/RAJNANDGAON/1406,Shri Chetan Anand Choudhary,SHRI CHETAN ANAND CHOUDHARY,EC Granted,EC,
6,736,SIA/CG/MIN/73882/2020,OL/EC/MIN/RAJNANDGAON/969,Chaweli Limestone Mine,GIRDHARI  LAL  TALREJA,Awaiting EC,EC,
7,737,SIA/CG/MIN/447517/2023,OL/EC/MIN/MAHASAMUND/2696,Priti Sharma,PRITI SHARMA,Agenda Uploaded by SEAC,EC,
8,738,SIA/CG/MIN/151640/2020,OL/EC/MIN/KANKER/1288,BODELI H1 SAND QUARRY,KANKER SAND QUARRY,EC Granted,EC,
9,739,SIA/CG/MIN/36148/2019,,Bodeli Sand Mines,GRAM PANCHAYAT PIPRAUD,Delisted,EC,
10,740,SIA/CG/MIN/36425/2019,OL/EC/IND/RAIPUR/874,MANDIR HASAUD LIMESTONE QUARRY,MADNIR HASAUD LIMESTONE QUARRY,Rejection Letter Granted,EC,
1,741,SIA/CG/MIN/148102/2020,OL/EC/MIN/SURAJPUR/1248,"D - 2, KHADGAWAKALAN SAND QUARRY",SHRI VIVEK GUPTA,EC Granted,EC,
2,742,SIA/CG/MIN/53908/2016,OL/EC/SANDMINE/GARIYABANDH/458,Patharri Sand Mine,SARPANCH BHENDRI,EC Granted,EC,
3,743,SIA/CG/MIN/53911/2016,OL/EC/SANDMINE/BILASPUR/459,Hathbandh Sand Mine,SARPANCH AMLIDIH HATHBANDH,EC Granted,EC,
4,744,SIA/CG/MIN/152550/2020,OL/EC/MIN/RAJNANDGAON/1296,Hirobai Gond Devdongar Limestone Mine,KRIPAL GOAND,EC Granted,EC,
5,745,SIA/CG/MIN/55637/2016,,CHHEDILAL CHAKRADHARI BRICK EARTH MINE,CHHEDILAL CHANDRAKAR BRICK EARTH MINE,Delisted,EC,
6,746,SIA/CG/MIN/184418/2020,OL/EC/MIN/BALRAMPUR/1473,REWATPUR BRICKS EARTHCLAY QUARRY & FIX CHIMNEY BRICKS PLANT,DILEEP JAISWAL,EC Granted,EC,
7,747,SIA/CG/MIN/204135/2021,OL/EC/MIN/SURAJPUR/1615,Kharsura  Brick Earthclay Quarry & Brick Kiln of Adarsh Jaiswal,KHARSURA  BRICK EARTHCLAY QUARRY & BRICK KILN OF ADARSH JAISWAL,EC Granted,EC,
8,748,SIA/CG/MIN/31825/1900,,A Mines,XYZ  MINE,WithdrawEC,EC,
9,749,SIA/CG/MIN/34335/2019,,Dumariya Sand Quarry,SARPANCH DUMARIYA VILLAGE,Delisted,EC,
10,750,SIA/CG/MIN/34026/2019,OL/EC/SANDMINE/GARIYABANDH/809,lachkera sand mine,LACHKERA SAND MINE,EC Granted - Processed offline,EC,
1,751,SIA/CG/MIN/48449/2018,OL/EC/MIN/DURG/698,A K Verma Pathariya Limestone Mine,A K VERMA LIMESTONE,EC Granted,EC,
2,752,SIA/CG/MIN/138953/2020,OL/EC/MIN/SUKMA/1152,Murtonda Ordinary Stone Quarry 0.62 Ha (M/s Ram Sharan Singh),M/S RAM SHARAN SINGH,EC Granted,EC,
3,753,SIA/CG/IND/243325/2021,OL/EC/IND/RAIPUR/1847,"Expansion of manufacturing capacity of  Re-rolled Products from 30,000 to 59,400 by hot charging and proposed installation Induction Furnace and 150 TPD Slag Crusher.",M/S. SHYAM STEEL INDUSTRIES,Rejection Letter Granted,EC,
4,754,SIA/CG/IND1/402837/2022,OL/EC/IND1/RAIPUR/2165,Expansion of Sunil Steels,ANIL NACHRANI,EC Granted,EC,
5,755,SIA/CG/MIN/420241/2023,OL/EC/MIN/RAIGARH/2347,CHIRODIH ORDINARY STONE MINE OF NAVEEN KUMAR AGRAWAL,NAVEEN AGRAWAL,EC Granted,EC,
6,756,SIA/CG/MIN/443559/2023,OL/EC/MIN/BILASPUR/2664,Gram Panchayat Chhatauna,PREM PAIKRA,Under examination of SEIAA after SEAC,EC,
7,757,SIA/CG/MIN/453766/2023,,Nandlal jaswani,NANDLAL JASWANI,Pending at PP due to eds,EC,
8,758,SIA/CG/MIN/453303/2023,,Heeramani Dubey,HEERA DUBEY,Pending at PP due to eds,EC,
9,759,SIA/CG/MIN/33656/2015,,Dhansuli lime stone mine,DHANSULI LIMESTONE MINES,Delisted,EC,
10,760,SIA/CG/NCP/65186/2017,,Atal Vihar Yojna Shriram Nagar,CHHATTISGARH HOUSING BOARD,Delisted,EC,
1,761,SIA/CG/MIN/72320/2018,OL/EC/MIN/RAIPUR/671,"Akhilesh Kumar Singh
Lalpur Limestone mine",AKHILESH KUMAR SINGH,EC Granted - Processed offline,EC,
2,762,SIA/CG/IND/21680/2015,OL/EC/IND/RAIGARH/713,CHANDRAHASNI ISPAT PRIVATE LIMITED (BILLETS AND TMT DIVISION),CHANDRAHASNI ISPAT PRIVATE LIMITED,EC Granted,EC,
3,763,SIA/CG/MIN/39261/2019,OL/EC/MIN/MAHASAMUND/924,Barbaspur Flag Stone Quarry Mine,RAJENDRA  GUPTA,EC Granted,EC,
4,764,SIA/CG/MIN/152124/2020,OL/EC/MIN/RAJNANDGAON/1304,Khairagarh Minerals Baldeopur Limestone Mine,RAHUL MHASKEY,Awaiting EC,EC,
5,765,SIA/CG/MIN/428406/2023,OL/EC/MIN/KORBA/2404,Gram Tarda for River Bed Mining of Sand of area 4 hectares,SUNITA MANJHI,For further consideration(SEAC),EC,
6,766,SIA/CG/MIN/31559/2015,OL/EC/SANDMINE/RAIPUR/38,Tila Sand Mine,SARPANCH,EC Granted,EC,
7,767,SIA/CG/MIN/31563/2015,OL/EC/SANDMINE/SURGUJA/39,Kawalgiri sand mining,SARPANCH KAWALGIRI,EC Granted,EC,
8,768,SIA/CG/MIN/61154/2016,OL/EC/LIME_STONE/DURG/534,NANDANI KHUNDANI LIMESTONE MINE,SANTOSH MINERALS,Rejection Letter Granted,EC,
9,769,SIA/CG/MIN/35068/2019,,M/s AMIT KUMAR BELCHANDAN LIMESTONE MINE SIBDI BBALOD CG,AMIT KUMAR BELCHANDAN LIMESTONE MINE SIBDI BALOD CG,Pending at PP due to eds,EC,
10,770,SIA/CG/MIN/62849/2017,OL/EC/LIME_STONE/DURG/565,"Vikas Agrawal
Sahgaon Limestone Mine",VIKASH AGRAWAL,Rejection Letter Granted,EC,
1,771,SIA/CG/MIN/31452/2015,OL/EC/SANDMINE/SOUTHBASTAR/27,SAND MINE GRAM PANCHAYAT GUMDA,SARPANCH GRAM PANCHAYAT GUMDA,EC Granted,EC,
2,772,SIA/CG/MIN/172980/2020,OL/EC/MIN/GARIABAND/1393,passaud sand mine,PASSAUD SAND MINE,EC Granted,EC,
