,Sno.,Proposal No.,File No.,Project Name,Company,Proposal Status,Project Type,View
1,1161,SIA/CG/MIN/61477/2021,OL/EC/MIN/BALOD/1582,"Kurdi Limestone Mining Project  M/s of Singhaniya Enterprises (Area:-2.58 hect, Production Capacity - 2,00,023.69 TPA) at  Village-Kurdi, Tehsil-Gunderdehi & District:- Balod (Chhattisgarh)",ROHIT SINGHANIA,EC Granted,EC,
2,1162,SIA/CG/MIN/35933/2015,,Quartz Mine,DINESH SHARMA,Delisted,EC,
3,1163,SIA/CG/MIN/31172/2015,,Chhurikala Sand mine,MINING OFFICE KORBA,Delisted,EC,
4,1164,SIA/CG/MIN/31194/2015,OL/EC/SENDMINE/KORBA/17,Dullapur Sand Mine,GRAM PANCHAYAT DULLAPUR,EC Granted,EC,
5,1165,SIA/CG/MIN/31766/2015,OL/EC/SANDMINE/DHAMTARI/62,,SARPANCH,Rejection Letter Granted,EC,
6,1166,SIA/CG/MIN/31964/2015,,Shri Prashant sing Brick Earth Mine,SHRI PRASHANT SINGH BRICK EARTH MINE,Delisted,EC,
7,1167,SIA/CG/MIN/36315/2015,OL/EC/sand_mine/BASTAR/262,Nandpura sand Mine,SARPANCH NANDPURA,Rejection Letter Granted,EC,
8,1168,SIA/CG/MIN/33416/2015,OL/EC/SANDMINE/MAHASAMUND/181,Badgaon Sand Project Mahasamund,BADGAON SAND PROJECT MAHASAMUND,EC Granted,EC,
9,1169,SIA/CG/IND/79354/2018,OL/EC/MIN/SURAJPUR/739,Expansion of Rolling Mill by M/s UB Ventures Pvt. Limited,UB VENTURES PRIVATE LIMITED,EC Granted,EC,
10,1170,SIA/CG/THE/28604/2017,OL/EC/THE/JANJGIR_CHAMPA/638,SIA/CG/THE/20256/2017,NUVOCO VISTAS CORP. LTD.,EC Granted,EC,
1,1171,SIA/CG/MIN/40601/2019,,Pratapgarh Sand Mining Project,GRAM PANCHAYAT PRATAPGARH,Delisted,EC,
2,1172,SIA/CG/MIN/58588/2016,OL/EC/SANDMINE/KABIRDHAM/485,andharikachhar sand mine,SARPANCH ANDHARIKACHHAR,EC Granted,EC,
3,1173,SIA/CG/MIN/196106/2021,OL/EC/MIN/KABIRDHAM/1546,Lime stone quarry,NARAYAN YADAV LIME STONE MINE,EC Granted,EC,
4,1174,SIA/CG/MIN/32609/2019,OL/EC/MIN/KANKER/782,Bhilai Sand Mine Distt Kanker,BHILAI SAND MINE,EC Granted,EC,
5,1175,SIA/CG/MIN/32651/2019,,JHARRIPARA SOAP STONE,GEO MANOJ KUMAR,Delisted,EC,
6,1176,SIA/CG/IND3/402589/2022,OL/EC/IND3/MAHASAMUND/1925,Expansion of Fertilizer Manufacturing Unit,SHRI TULSI PHOSPHATE LIMITED,Under examination of SEIAA after SEAC,EC,
7,1177,SIA/CG/MIN/405088/2022,OL/EC/MIN/DHAMTARI/2177,Devpur Ordinary Stone Quarry Project,KHEMENDRA NATH SAHU,For further consideration(SEAC),EC,
8,1178,SIA/CG/MIN/447010/2023,OL/EC/MIN/BILASPUR/2685,LALWANI BRICK EARTH QUARRY,SUNIL LALWANI,Agenda Uploaded by SEAC,EC,
9,1179,SIA/CG/MIN/76070/2018,OL/EC/MIN/DURG/736,Pitora Limestone Mine,TEKENDRA CHANDRAKAR,EC Granted,EC,
10,1180,SIA/CG/MIN/138653/2020,,Tenduwahi Murum,GEO MANOJ KUMAR,Delisted,EC,
1,1181,SIA/CG/MIN/212432/2021,OL/EC/MIN/SURAJPUR/1664,Kharsura Brick Earthclay Quarry Mine & Fixed  Chimney Brick Plant of Narendra Jaiswal,KHARSURA BRICK EARTHCLAY QUARRY MINE & FIX CHIMNEY BRICK PLANT	OF NARENDRA KUMAR JAISWAL,EC Granted,EC,
2,1182,SIA/CG/IND/58857/2016,OL/EC/ROLLING_MILL/DUEG/492,Expansion of Induction Furnace and Rolling mill by Hariom Ingots and Power Pvt Limited,HARIOM INGOTS AND POWER PRIVATE LIMITED,EC Granted,EC,
3,1183,SIA/CG/MIN/50519/2016,OL/EC/SANDMINE/RAIGARH/405,jaimuratayang sand mining,SACHIVJAIMURATAYANG,EC Granted,EC,
4,1184,SIA/CG/MIN/50533/2016,OL/EC/SANDMINE/BILASPUR/407,KARHI KACHAR SAND MINE,PANCHAYAT SACHIV,EC Granted,EC,
5,1185,SIA/CG/IND/84430/2018,OL/EC/IND/RAIGARH/749,SIVANA STEELS AND POWER PRIVATE LIMITED,SIVANA STEEL AND POWER PRIVATE LIMITED,EC Granted,EC,
6,1186,SIA/CG/IND/104154/2019,OL/EC/IND/RAIPUR/851,Expansion of Mini Steel Plant,MAHENDRA STRIPS PRIVATE LIMITED,Rejection Letter Granted,EC,
7,1187,SIA/CG/MIN/66865/2017,OL/EC/LIME_STONE/BALODABAZAAR/621,Bhatbhera Limestone Mine,ASHOK KUMAR JOHN,EC Granted,EC,
8,1188,SIA/CG/MIN/226218/2021,OL/EC/MIN/SURGUJA/1791,Sonpurkhurd Bricks Earth Clay Quarry & Fix Chimney Brick Plant,SONPUR KHURD BRICKS,EC Granted,EC,
9,1189,SIA/CG/MIN/145516/2020,OL/EC/MIN/KORBA/1208,Gevra Ordinary Sand Quarry,GAGANDEEP BHATIYA,EC Granted,EC,
10,1190,SIA/CG/MIN/42663/2019,OL/EC/MIN/JANJGIR_CHAMPA/955,Akaltara Limestone Quarry Mine,MS SATGURU MINERALS,EC Granted,EC,
1,1191,SIA/CG/MIN/454712/2023,,Harishankar Mishra,HARISHANKAR MISHRA,Pending at PP due to eds,EC,
2,1192,SIA/CG/MIN/29560/2018,OL/TOR/MIN/DANTEWADA/746,Chhattisgarh Mineral Development Corporation Ltd Nagaras and Sonakukanar Corundum Mines,CMDCLTD,EC Granted,EC,
3,1193,SIA/CG/MIN/52311/2016,OL/EC/SANDMINE/KANKER/433,TARASGAON SAND MINE,GRAM PANCHAYAT TARASGAON,EC Granted,EC,
4,1194,SIA/CG/MIN/136940/2020,OL/EC/MIN/KONDAGAON/1138,sonabaal sand mine,UTKARSH ANTHONY 1,EC Granted,EC,
5,1195,SIA/CG/MIN/143504/2020,OL/EC/MIN/J_CHAMPA/1183,Barbaspur Sand Mine of Kumari Kavita Mishra,BARBASPUR SAND MINE OF KUMARI KAVITA MISHRA,EC Granted,EC,
6,1196,SIA/CG/MIN/168227/2020,OL/EC/MIN/BALOD/1369,TILKHAIRI (SALONI) ORDINARY SAND MINE BALOD CG,TILKHAIRI (SALONI) ORDINARY SAND MINE BALOD CG,EC Granted,EC,
7,1197,SIA/CG/MIN/168941/2020,OL/EC/MIN/SUKMA/1372,Murtonda Ordinary Stone Quarry,MURTONDA ORDINARY STONE QUARRY,EC Granted,EC,
8,1198,SIA/CG/MIN/33396/2015,OL/EC/LIMESTONE_MINE/BILASPUR/179,RIAZ AHMED SIDDIQUE LIME STONE MINES,RIAZ AHMED SIDDIQUE,EC Granted,EC,
9,1199,SIA/CG/IND/20079/2017,,-1,PRIME ISPAT LIMITED,EC Granted,EC,
10,1200,SIA/CG/MIN/55782/2016,,ANIL KUMAR CHAWDA BRICK EARTH MINE,ANIL KUMAR CHAWDA BRICK EARTH MINE,Delisted,EC,
1,1201,SIA/CG/MIN/445337/2023,OL/EC/MIN/JASHPUR/2676,"M/s Vidyasagar Infrastructure, Partner Shri Mukesh Kumar Jain",VIDYASAGAR INFRASTRUCTURES,Agenda Uploaded by SEAC,EC,
2,1202,SIA/CG/MIN/32738/2019,,MANDIR HASAUD LIMESTONE QUARRY OF PRIYESH SINGH THAKUR,UGEM,Pending at PP due to eds,EC,
3,1203,SIA/CG/IND/84533/2018,OL/EC/IND/RAIGARH/750,JAGDAMBA SPONGE PRIVATE LIMITED,JAGDAMBA SPONGE PRIVATE LIMITED,EC Granted,EC,
4,1204,SIA/CG/MIN/35896/2019,,ordinary quarry,ORDINARY STONE,WithdrawEC,EC,
5,1205,SIA/CG/MIN/179769/2020,OL/EC/MIN/SURAJPUR/1425,Ramnagar Bricks Earthclay Quarry & Fix Chimney Bricks Plant,GANESH JAISWAL,Rejection Letter Granted,EC,
6,1206,SIA/CG/MIN/437655/2023,OL/EC/MIN/BILASPUR/2685,"M/s PADHEE BRICKS INDUSTRIES, BALAJHAR EARTH CLAY QUARRY AND FIX CHIMNEY BRICKS PLANT",SUBHASH VERMA,Agenda Uploaded by SEAC,EC,
7,1207,SIA/CG/MIN/7605/2007,OL/EC/IND/DANTEWADA/521,Lakharas Tin Ore Mines,PRECIOUS MINERALS AND SMELTING LIMITED,Delisted,EC,
8,1208,SIA/CG/MIN/66814/2017,OL/EC/LIME_STONE/RAIPUR/620,Mohrenga Limestone Mine,YOGENDRA VARMA,Rejection Letter Granted,EC,
9,1209,SIA/CG/IND/212672/2021,OL/EC/IND/RAIPUR/1667,Shivam Steel Corporation,M/S. SHIVAM STEEL CORPORATION,EC Granted,EC,
10,1210,SIA/CG/MIN/33183/2015,OL/EC/SANDMINE/KORBA/169,Telsara Sand Mine,TELSARA SAND MINE,EC Granted,EC,
1,1211,SIA/CG/MIN/446595/2023,OL/EC/MIN/JANJGIR_CHAMPA/1854,Gurushree Minerals Pvt. Ltd,GURUSHREE MINERALS PRIVATE LIMITED,Agenda Uploaded by SEAC,EC,
2,1212,SIA/CG/MIN/33249/2019,OL/EC/MIN/KANKER/789,KISHOR KUMAR CHOURASIA (Jharripara Soap Stone Quarry),KISHOR KUMAR CHOURASIA,EC Granted,EC,
3,1213,SIA/CG/MIN/50528/2016,OL/EC/SANDMINE/RAIGARH/406,nandgaon sand mining,SACHIVNANDGAONMINING,EC Granted,EC,
4,1214,SIA/CG/IND/214366/2021,OL/EC/IND/RAIPUR/1698,Trimurti Re-rollers Private Limited,M/S. TRIMURTI RE-ROLLERS PRIVATE LIMITED,EC Granted,EC,
5,1215,SIA/CG/MIN/31596/2015,OL/EC/LIMESTONEMINE/RAIPUR/44,Dhansuli Stone Mine (minor mineral)  Quarry of Bamleshwari Stones India Pvt. Ltd.,BAMLESHWARI STONES INDIA PVT LTD,Delisted,EC,
6,1216,SIA/CG/MIN/31945/2015,OL/EC/SANDMINE/RAIGARH/86,Pusalda sand mine,PUSALDA SAND MINE,EC Granted,EC,
7,1217,SIA/CG/MIN/31950/2015,Please submit the information/Documents sought on,Darri Limestone Quarry (Landmark Engineer Pro. Nishant Jain Bilaspur CG),LANDMARK ENGINEER BILASPUR CG NISHANT JAIN,EC Granted,EC,
8,1218,SIA/CG/MIN/52630/2016,,"Stone quarry, village Jagatpur",KRISHNA KUMAR KHEDIYA,Delisted,EC,
9,1219,SIA/CG/MIN/53104/2016,OL/EC/SANDMINE/DURG/444,Titurghat Sand Mine,SARPANCH TITURGHAT,EC Granted,EC,
10,1220,SIA/CG/MIN/53149/2016,,RANA PREM KUMAR SINGH PATORA LIMESTONE MINE,RANA PREM KUMAR SINGH,Delisted,EC,
1,1221,SIA/CG/MIN/445090/2023,,"Stone quarry, village Jagatpur, Project Propoject Proponent Smt. Rekha Agrawal",REKHA AGRAWAL,Pending at PP due to eds,EC,
2,1222,SIA/CG/MIN/454702/2023,,Harishankar Mishra,HARISHANKAR MISHRA,Pending at PP due to eds,EC,
3,1223,SIA/CG/MIN/424661/2023,OL/EC/MIN/DHAMTARI/2370,"M/s. Dilip Buildcon Limited, Bhopal	-Gondlanala Ordinary Stone Temporary Permit Quarry (2)",DILIP BUILDCON LIMITED,EC Granted,EC,
4,1224,SIA/CG/MIN/449575/2023,,M/s Shelke Construction Pvt. Ltd.,SHELKE CONSTRUCTIONS PRIVATE LIMITED,Under examination of SEIAA,EC,
5,1225,SIA/CG/MIN/175743/2020,OL/EC/MIN/BALRAMPUR/1409,Talkeshwarpur sand mine of Ramesh Patel,TALKESHWARPUR SAND MINE OF RAMESH PATEL,EC Granted,EC,
6,1226,SIA/CG/IND/31935/2015,,Shri Krishna Metal Works Partner  Smt Kiran Gupta Flat no.601 6th floor Grand Tower GT Exotica Shankar Nagar Raipur CG 492001,SHRI KRISHNA METAL WORKS,Delisted,EC,
7,1227,SIA/CG/MIN/31951/2015,OL/EC/SANDMINE/RAIPUR/88,Charoda Sand Mine,SARPANCH CHARODA,EC Granted,EC,
8,1228,SIA/CG/MIN/50150/2016,,MAHUAPALI DOLOMITE DEPOSIT,PILABABU PATEL,Delisted,EC,
9,1229,SIA/CG/MIN/34785/2015,OL/EC/LIMESTONE_MINE/RAIPUR/224,Nardaha Limestone quarry Project Proponent Vinay Bajaj,NARDAHA LIMESTONE QUARRY PROJECT PROPONENT VINAY KUMAR BAJAJ,Delisted,EC,
10,1230,SIA/CG/MIN/36212/2019,OL/TOR/SANDMINE/MAHASAMUND/869,Chingroud Sand Mine,SARPANCH CHINGROUD,Delisted,EC,
1,1231,SIA/CG/MIN/65409/2017,OL/EC/LIME_STONE/BASTAR/611,"Limestone Mine, Village -Rajoor",MAGRAJ KHATRI PROPRIETOR PANKAJ STONE CRUSHER INDUSTRIES,EC Granted,EC,
2,1232,SIA/CG/MIN/43964/2019,OL/EC/MIN/RAJNANDGAON/1017,Hari Chand Sahu,HARICHAND SAHU,EC Granted,EC,
3,1233,SIA/CG/MIN/138286/2020,OL/EC/MIN/DHAMTARI/1143,kulkharikoth sand mine,CHANDRAKANT SAHU,EC Granted,EC,
4,1234,SIA/CG/MIN/208136/2021,OL/EC/MIN/JANJGIR_CHAMPA/1634,Chhitapadariya Dolomite Quarry of Gurushree Minerals Pvt Ltd,CHHITAPADARIYA DOLOMITE QUARRY OF GURUSHREE MINERALS PVT LTD,EC Granted,EC,
5,1235,SIA/CG/MIN/446983/2023,OL/EC/MIN/JANJGIR_CHAMPA/1854,Rajesh Kumar Singhaniya,RAJESH SINGHANIYA,Agenda Uploaded by SEAC,EC,
6,1236,SIA/CG/MIN/31538/2015,,"Saroj sharma stone mine, Bilaspur",SAROJ SHARMA STONE MINE,WithdrawEC,EC,
7,1237,SIA/CG/IND/84533/2018,OL/EC/IND/RAIGARH/750,JAGDAMBA SPONGE PRIVATE LIMITED,JAGDAMBA SPONGE PRIVATE LIMITED,EC Granted,EC,
8,1238,SIA/CG/MIN/34076/2019,OL/EC/LIMESTONEMINE/GARYABANDH/816,singhauri sand mine,SINGHAURI SAND MINE,Rejection Letter Granted,EC,
9,1239,SIA/CG/MIN/41834/2016,OL/EC/SANDMINE_QUARRY/SURAJPUR/321,namadgiri sand quarry,NAMADGIRI GRAMPANCHAYAT,WithdrawEC,EC,
10,1240,SIA/CG/MIN/215700/2021,OL/EC/MIN/DHAMTARI/1711,Lime stone quarry,REVENDRA CHANDRAKAR LIMESTONE QUARRY GOJI,EC Granted,EC,
1,1241,SIA/CG/MIN/431191/2023,OL/EC/MIN/BALODABAZAR/2482,"Farhada Low Grade Limestone Quarry, Pro-Ekant Parpyani",AMAN LOHIYA,Agenda Uploaded by SEAC,EC,
2,1242,SIA/CG/MIN/430848/2023,OL/EC/MIN/RAIPUR/1870,Lalpur Limestone Mine Proprietor  Harshit Sharma,LALPUR LIMESTONE MINE OF HARSHIT SHARMA,Awaiting EC,EC,
3,1243,SIA/CG/MIN/449892/2023,OL/EC/MIN/BALODA BAZAAR/2723,Pankaj Kumar Chandrakar,PANKAJ CHANDRAKAR,Agenda Uploaded by SEAC,EC,
4,1244,SIA/CG/MIN/133378/2019,OL/EC/MIN/RAJNANDGOAN/1076,"D -2, CHANDO SAND QUARRY","D -2 , CHANDO SAND QUARRY , TEHSIL - CHHURIYA, DIST. - RAJNANDGAON",EC Granted,EC,
5,1245,SIA/CG/MIN/61462/2016,OL/EC/SANDMINE/KORIA/551,SAND MINE HARCHOKA,SARPANCH HARCHOKA,EC Granted,EC,
6,1246,SIA/CG/MIN/32650/2015,OL/EC/SANDMINE/DURG/140,Jhola Sand Mine,SARPANCH JHOLA,EC Granted,EC,
7,1247,SIA/CG/MIN/199437/2021,OL/EC/MIN/SURAJPUR/1567,namadgiri l2 sand mine,NAMADGIRI L2 SAND MINE,EC Granted,EC,
8,1248,SIA/CG/IND/61268/2016,OL/EC/ROLLINGMILL&INDUCTION_FURNACE/RAIPUR/536,ISPAT INDIA,ISPAT INDIA,EC Granted - Processed offline,EC,
9,1249,SIA/CG/MIN/82960/2021,OL/EC/MIN/DHAMTARI/1528,,GAGAN NAHATA,For further consideration(SEAC),EC,
10,1250,SIA/CG/MIN/454027/2023,,Santru Banjare,SANTARU BANJARE,Pending at PP due to eds,EC,
1,1251,SIA/CG/MIN/32619/2015,OL/EC/SANDMINE/RAJNANDGAON/132,Baghmar Sand Mine,SARPANCH BAGHMAR DARRI,Delisted,EC,
2,1252,SIA/CG/MIN/32643/2015,OL/EC/SANDMINE/BEMETARA/137,Tabalghor sand Mine,SARPANCH BHARCHATTI,EC Granted,EC,
3,1253,SIA/CG/MIN/32647/2015,OL/EC/SANDMINE/KANKER/138,Charama Sand MIne,CMO CHARAMA,EC Granted,EC,
4,1254,SIA/CG/MIN/61473/2017,OL/EC/SAND_STONE/RAJNANDAGOAN/544,Parag Badhe SAND STONE Quarry,PARAG BADHE,EC Granted,EC,
5,1255,SIA/CG/MIN/41526/2019,OL/EC/MIN/KANKER/943,Dharmendra Chopra,SHRI DHARMENDRA CHOPRA,Rejection Letter Granted,EC,
6,1256,SIA/CG/MIN/41924/2019,OL/EC/MIN//RAJNANDGAON/947,Nirmal Chand Jain,NIRMAL CHAND JAIN,EC Granted,EC,
7,1257,SIA/CG/MIN/52225/2016,OL/EC/SANDMINE/RAJNANDGAON/432,Dhodiya Sand Mine,SARPACH DHODIYA,EC Granted,EC,
8,1258,SIA/CG/MIN/213861/2021,OL/EC/SANDMINE/KORBA/1691,Kutesernagoi Sand Mine of Arun Kumar Singhania,KUTESERNAGOI SAND MINE  OF ARUN KUMAR SINGHANIA,EC Granted,EC,
9,1259,SIA/CG/MIN/198140/2021,OL/EC/MIN/KORBA/1552,Ghatadwari Sand Stone Mine  of Matadin Jaiswal,GHATADWARI SAND STONE MINE OF MATADIN JAISWAL,EC Granted,EC,
10,1260,SIA/CG/MIN/263082/2022,,Shanti Vijay Minerals Prop. Shri Vinod Jain,VINOD JAIN,Delisted,EC,
1,1261,SIA/CG/IND1/407060/2022,OL/EC/IND1/RPR/1594,"Proposed Greenfield Project to Produce Sponge Iron - 62700 TPA through DRI Kiln (190 TPD X 1 No.), MS Ingot/Billets 99000 TPA through Induction Furnace with CCM & Captive Power Generation - 4.5 MW through WHRB at Village - Parsada, Tahsil - Tilda, District - Raipur (CG) by M/s. Nandan Smelters Pvt. Ltd.",NANDAN SMELTERS PRIVATE LIMITED,Under examination of SEIAA after SEAC,EC,
2,1262,SIA/CG/MIN/453838/2023,,Dhaniram Kanvar,DHANIRAM KANVAR,Pending at PP due to eds,EC,
3,1263,SIA/CG/MIN/40295/2019,OL/EC/MIN/RAJNANDGAON/928,Deepak Chawda,DEEPAK  CHAWDA,EC Granted,EC,
4,1264,SIA/CG/MIN/31910/1900,OL/EC/MIN/SURAJPUR/784,Kedarpur Ordinary Stone Quarry,NAGENDRA PRATAP SINGH,EC Granted,EC,
5,1265,SIA/CG/MIN/42395/2016,OL/EC/SANDMINE/DHAMTARI/340,Sarangpuri Sand Mine,SARPANCH SARANGPURI,EC Granted,EC,
6,1266,SIA/CG/MIN/35896/2019,,ordinary quarry,ORDINARY STONE,WithdrawEC,EC,
7,1267,SIA/CG/IND/67229/2017,OL/EC/IND/BILASPUR/624,MAA MAHAMAYA STEELS PRIVATE LIMITED,MAA MAHAMAYA STEELS PRIVATE LIMITED,EC Granted,EC,
8,1268,SIA/CG/MIN/53045/2016,,M/s Santosh Kumar Pade Brick Earth in Village Albaras,MS SANTOSH PADE BRICK EARTH MINE,Delisted,EC,
9,1269,SIA/CG/MIN/189470/2020,OL/EC/MIN/KORIYA/1497,darritola ordinary quarry,PYARELAL SAHU,EC Granted,EC,
10,1270,SIA/CG/MIN/131555/2019,,Shri Rajesh Chandrakar,RAJESHEC,Delisted,EC,
1,1271,SIA/CG/MIN/36741/2015,OL/EC/sand_mine/BALODA_BAZAR/268,gram panchayat riwadih sand mine,GRAM PANCHAYAT RIWADIH SAND MINE,EC Granted,EC,
2,1272,SIA/CG/MIN/43871/2019,OL/EC/MIN/RAJNANDGAON/1015,Smt Kavita Parekh (Baldevpur Limestone Mine),KAVITA PARIKH,For further consideration(SEAC),EC,
3,1273,SIA/CG/MIN/425025/2023,OL/EC/MIN/JASHPUR/2374,M/s. Dilip Buildcon Limited-Turuama Ordinary Stone Temporary Permit Quarry (2),DILIP BUILDCON LIMITED,EC Granted,EC,
4,1274,SIA/CG/MIN/60453/2016,OL/EC/LIME_STONE/DURG/513,"Nand Kumar Kumbhakar
Limestone Mine",NAND STONE CRUSHER LIMESTONE MINE,Delisted,EC,
5,1275,SIA/CG/MIN/162753/2020,OL/EC/MIN/KANKER/1346,NARA ORDINARY SAND MINE KANKER CG,NARA ORDINARY SAND MINE KANKER CG,EC Granted,EC,
6,1276,SIA/CG/MIN/31825/1900,,A Mines,XYZ  MINE,WithdrawEC,EC,
7,1277,SIA/CG/MIN/193111/2021,OL/EC/MIN/SURAJPUR/1547,Kandrai Sand Mine,KANDRAI SAND MINE OF RAJA SONI,EC Granted,EC,
8,1278,SIA/CG/MIN/194950/2021,OL/EC/MIN/SURAJPUR/1541,"U -1, Premnagar Sand Quarry",PREMNAGAR SAND QUARRY,EC Granted,EC,
9,1279,SIA/CG/IND/186594/2020,OL/EC/IND/DURG/1489,M R Enterprises,M R ENTERPRISES,EC Granted,EC,
10,1280,SIA/CG/MIN/32542/2015,OL/EC/SANDMINE/MAHASAMUND/126,Kanekera Sand Mine,SARPANCH KANEKERA,EC Granted,EC,
1,1281,SIA/CG/MIN/209129/2021,OL/EC/MIN/KORBA/1642,L-1 Kasaniya Ordinary Sand Quarry,SUSHEEL KUMAR GARG,EC Granted,EC,
2,1282,SIA/CG/MIN/263082/2022,,Shanti Vijay Minerals Prop. Shri Vinod Jain,VINOD JAIN,Delisted,EC,
3,1283,SIA/CG/MIN/429498/2023,OL/EC/MIN/KORBA/2426,"Dullapur for River Bed Mining of Sand of area 4.04 hectares for proposed production capacity of 60600 Cum/Y (ROM) at Village Dullapur, Tehsil Pasan & District Korba (C.G.)",ASHOK BINJHWAR,EC Granted,EC,
4,1284,SIA/CG/MIN/450683/2023,OL/EC/MIN/JASHPUR/2734,"Lodhma Bricks Earth Clay Quarry & Fix (VSBK) Chimney Brick Plant , Lease Area - 2.590 ha. , Lessee - Shri Vijay Prasad Gupta",VIJAY GUPTA,Agenda Uploaded by SEAC,EC,
5,1285,SIA/CG/MIN/61378/2016,OL/EC/MOLDING_SAND/DURG/539,"Nnadini Khundini Limestone Mine,
Area-0.955 Ha.of Lessee Bhagat Ram Sahu, Durg",GEO MANOJ KUMAR,EC Granted - Processed offline,EC,
6,1286,SIA/CG/MIN/34754/2019,OL/EC/EARTHMINE/DURG/835,Kumhari  Brick Earthclay Quarry Mine & Fixed Chimney Brick Plant,NARENDRA KUMAR PRITWANI,EC Granted,EC,
7,1287,SIA/CG/MIN/59412/2016,OL/EC/SANDMINE/MAHASAMUND/505,Birkol Quartzite Quarry,ASHOK KUMAR JOHN,EC Granted - Processed offline,EC,
8,1288,SIA/CG/MIN/227127/2021,OL/EC/MIN/SURGUJA/1789,Manja Ordinary Stone Mine of Shri Shubham Agrawal,SHUBHAM AGRAWAL,For further consideration(SEAC),EC,
9,1289,SIA/CG/MIN/31722/2015,OL/EC/SANDMINE/DHAMTARI/56,sand mine,SARPANCH,EC Granted,EC,
10,1290,SIA/CG/MIS/248317/2021,OL/EC/MIS/DANTEWADA/1895,"Constriction of Residencial Towers at NMDC Townhip, Kirundul",NMDC LIMITED,EC Granted,EC,
1,1291,SIA/CG/MIS/243327/2021,OL/EC/MIS/RAIPUR/1843,"Environmental Clearance for Proposed “Academic Block At AIIMS, Raipur” located at, Tatibandh, Raipur, C.G",AIIMS RAIPUR,For further consideration(SEAC),EC,
2,1292,SIA/CG/MIS/283964/2022,OL/EC/MIN/RAIPUR/2109,"Expansion of:  L.K. Corporate and Logistics Park,  Proposed by Sun & Sun Inframetric Pvt. Limited and others",LK CORPORATE AND LOGISTICS PARK,EC Granted,EC,
3,1293,SIA/CG/MIN/170353/2020,OL/EC/MIN/KORIYA/1380,dandhanswahi sand mine,DANDHANSWAHI SAND MINE,EC Granted,EC,
4,1294,SIA/CG/MIN/206973/2021,OL/EC/MIN/MAHASAMUND/1628,Barbaspur A2 sand mine of Manoj Kumar Chandrakar,BARBASPUR SAND MINE OF  MANOJ KUMAR CHANDRAKAR,EC Granted,EC,
5,1295,SIA/CG/MIS/286760/2022,,MS SHIVAY INFRA,RAJESH KUKREJA,Delisted,EC,
6,1296,SIA/CG/MIN/288419/2022,OL/EC/MIN/DHAMTARI/1711,Goji Limestone Quarry Project Proponent Revendra Chandrakar,REVENDRA CHANDRAKAR LIMESTONE QUARRY GOJI,EC Granted,EC,
7,1297,SIA/CG/MIN/435127/2023,OL/EC/MIN/RAIPUR/2552,Deepak Kumar Chandrakar,DEEPAK CHANDRAKAR,EC Granted,EC,
8,1298,SIA/CG/MIN/449892/2023,OL/EC/MIN/BALODA BAZAAR/2723,Pankaj Kumar Chandrakar,PANKAJ CHANDRAKAR,Agenda Uploaded by SEAC,EC,
9,1299,SIA/CG/MIN/31798/2015,OL/EC/LIME_STONE/DURG/70,MOHINI DEVI MISHRA LIMESTONE MINE 1.92 Ha,MOHINI DEVI MISHRA,EC Granted,EC,
10,1300,SIA/CG/MIN/32055/2015,OL/EC/SANDMINE/KORBA/94,Ghamota Sand Mine,GRAN PANCHAYAT DHANRAS,EC Granted,EC,
1,1301,SIA/CG/MIN/35740/2015,OL/EC/SANDMINE/JASHPUR/239,sand mining,SACHIVCHADIYA,EC Granted,EC,
2,1302,SIA/CG/MIN/57721/2020,OL/EC/MIN/KORBA/1434,Konkona Ordinary Stone Temporary Permit Quarry  (4),KONKONA ORDINARY STONE TEMPORARY PERMIT QUARRY  (4) OF DILIP BUILDCON LIMITED,EC Granted,EC,
3,1303,SIA/CG/MIN/153225/2020,OL/EC/MIN/RAJNANDGAON/1301,Radheshyam Gupta Khamtola Quartz Mine,RADHESHYAM GUPTA QUARTZ,EC Granted,EC,
4,1304,SIA/CG/CMIN/18587/2013,OL/EC/COAL_WASHERY/BILASPUR/1070,Clean Coal Enterprises Private Limited,CLEAN COAL ENTERPRISES PRIVATE LIMITED,EC Granted,EC,
5,1305,SIA/CG/MIN/192658/2021,OL/EC/MIN/SURAJPUR/1521,Lakhanpur sand mine of Nadhir Kumar Paikra,LAKHANPUR SAND MINE OF NADHIR KUMAR PAIKARA,EC Granted,EC,
6,1306,SIA/CG/MIN/191125/2021,OL/EC/MIN/RAIGARH/1502,Sohanpur Ordinary Stone  Quarry,SOHANPUR ORDINARY STONE QUARRY OF MS SUNIL KUMAR AGRAWAL LLP,EC Granted,EC,
7,1307,SIA/CG/MIN/191172/2021,OL/EC/MIN/RAIGARH/1504,Sohanpur Ordinary Stone Quarry,SOHANPUR ORDINARY STONE  QUARRY OF MS SUNIL KUMAR AGRAWAL LLP,EC Granted,EC,
8,1308,SIA/CG/NCP/67764/2017,OL/EC/NCP/RAIPUR/634,AVINASH Capital Homes 2,ANAND SINGHANIA,EC Granted,EC,
9,1309,SIA/CG/IND/202223/2021,OL/EC/IND/RAIPUR/1587,M/s Manav Energy & Steel Pvt Ltd,MS MANAV ENERGY AND STEEL PVT LTD UNIT 2,EC Granted - Processed offline,EC,
10,1310,SIA/CG/MIN/435127/2023,OL/EC/MIN/RAIPUR/2552,Deepak Kumar Chandrakar,DEEPAK CHANDRAKAR,EC Granted,EC,
1,1311,SIA/CG/MIN/51255/2016,OL/EC/SANDMINE/BEMETARA/424,parpoda sand mine,SARPANCH PARPODA,EC Granted,EC,
2,1312,SIA/CG/NCP/65186/2017,,Atal Vihar Yojna Shriram Nagar,CHHATTISGARH HOUSING BOARD,Delisted,EC,
3,1313,SIA/CG/MIN/157551/2020,,Kharsura Brick Earthclay Quarry Mine & Fix Chimney Brick Plant	 of Narendra Kumar Jaiswal,KHARSURA BRICK EARTHCLAY QUARRY MINE & FIX CHIMNEY BRICK PLANT	OF NARENDRA KUMAR JAISWAL,Delisted,EC,
4,1314,SIA/CG/MIN/223746/2021,OL/EC/MIN/KORIYA/1759,Salka Ordinary Stone Mine,SALKA ORDINARY STONE MINE OF MAMTA  CHOUBEY,EC Granted,EC,
5,1315,SIA/CG/MIN/429674/2023,OL/EC/MIN/KORIYA/2458,Penari Crusher Stone Quarry,GAJRUP SINGH,For further consideration(SEAC),EC,
6,1316,SIA/CG/MIN/428403/2023,OL/EC/MIN/KORIYA/2459,"Sarbhoka Crusher stone Quarry , Area - 0.405 ha. Lessee - Shri Akshay Kumar Chaturvedi",AKSHAY CHATURVEDI,For further consideration(SEAC),EC,
7,1317,SIA/CG/MIN/440625/2023,OL/EC/MIN/BALODA_BAZAR/2710,Abhishek Singh Thakur,ABHISHEK THAKUR,Agenda Uploaded by SEAC,EC,
8,1318,SIA/CG/MIN/446667/2023,OL/EC/MIN/RAIGARH/2695,Jamjhor Low Grade Limestone Mine of Chiranjiv Mohanti,CHIRANJIV MOHANTI,Agenda Uploaded by SEAC,EC,
9,1319,SIA/CG/MIN/48477/2018,OL/EC/MIN/DURG/710,Ratna Pandey Sahgaon Limestone Mine,RATNA PANDEY MINE,EC Granted,EC,
10,1320,SIA/CG/MIN/48677/2016,OL/EC/MIN/DURUG/539,Bhagat Ram Sahu Nandini Khundini Limestone Mine,BHAGAT RAM SAHU,EC Granted,EC,
1,1321,SIA/CG/IND/16758/2016,OL/EC/LPG_BOTTLING_PLANT/RAIPUR/328,,BHARAT PETROLEUM CORPORATION LIMITED,EC Granted - Processed offline,EC,
2,1322,SIA/CG/MIS/208573/2021,OL/EC/MIN/RAIPUR/1635,Central Public Works Department of India  (General Pool Residential Accommodation Quarters),CENTRAL PUBLIC WORKS DEPARTMENT.,EC Granted - Processed offline,EC,
3,1323,SIA/CG/MIN/429498/2023,OL/EC/MIN/KORBA/2426,"Dullapur for River Bed Mining of Sand of area 4.04 hectares for proposed production capacity of 60600 Cum/Y (ROM) at Village Dullapur, Tehsil Pasan & District Korba (C.G.)",ASHOK BINJHWAR,EC Granted,EC,
4,1324,SIA/CG/MIN/452941/2023,OL/EC/MIN/BALODA BAZAR/2778,Shikari Keshli Low Grade Limestone Quarry,SANJAY MAKKAD,Agenda Uploaded by SEAC,EC,
5,1325,SIA/CG/MIN/29560/2018,OL/TOR/MIN/DANTEWADA/746,Chhattisgarh Mineral Development Corporation Ltd Nagaras and Sonakukanar Corundum Mines,CMDCLTD,EC Granted,EC,
6,1326,SIA/CG/MIN/164547/2020,OL/EC/MIN/raigarh/1353,Sohanpur Ordinary Stone Temporary Permit Quarry of Shree Sunil Kumar Agrawal LLP,SOHANPUR ORDINARY STONE QUARRY OF SHREE SUNIL KUMAR AGRAWAL LLP,EC Granted,EC,
7,1327,SIA/CG/MIN/430991/2023,OL/EC/MIN/BALODABAZAR/2475,"Dilip Jain Low Grade Limestone Quarry, Otebandh",DILIP JAIN,Agenda Uploaded by SEAC,EC,
8,1328,SIA/CG/MIN/451811/2023,OL/EC/MIN/BALODA_BAZAR/2100,Amakoni Limestone Quarry Mining,BHAGWATI VERMA,Agenda Uploaded by SEAC,EC,
9,1329,SIA/CG/MIN/43830/2019,OL/EC/MIN/RAJNANDGAON/1010,Pawan Wadhwa,PAWAN WADHWA,EC Granted,EC,
10,1330,SIA/CG/IND/31935/2015,,Shri Krishna Metal Works Partner  Smt Kiran Gupta Flat no.601 6th floor Grand Tower GT Exotica Shankar Nagar Raipur CG 492001,SHRI KRISHNA METAL WORKS,Delisted,EC,
1,1331,SIA/CG/MIN/178704/2020,OL/EC/MIN/RAJNANDGAON/1437,Shri Atul Goyal,ATUL GOYAL,EC Granted,EC,
2,1332,SIA/CG/MIN/180630/2020,OL/EC/MIN/RAJNANDGAON/1438,PUSHPLATA OSWAL,PUSHPLATA  OSWAL,EC Granted,EC,
3,1333,SIA/CG/MIN/180636/2020,OL/EC/MIN/KORBA/1439,Ajgarbahaar Ordinary Stone Temporary Permit Quarry (1),AJGARBAHAAR ORDINARY STONE QUARRY 01 OF MS DC CONSTRUCTION,EC Granted,EC,
4,1334,SIA/CG/MIN/48662/2016,OL/EC/MIN/DURG/542,B L Ramani Nandini Khundini Limestone Mine,SHRI B L RAMANI,EC Granted,EC,
5,1335,SIA/CG/MIN/149213/2020,,Abdul Sajid Khan Dumerdihkala Limestone Mine,ABDUL SAJID KHAN,Delisted,EC,
6,1336,SIA/CG/MIN/34981/2015,OL/EC/LIMESTONE_MINE/BILASPUR/228,Manpahri Limestone quarry,MANPAHRI LIMESTONE QUARRY,EC Granted,EC,
7,1337,SIA/CG/MIN/42671/2016,,Limestone Quarry Village Amdi,LIMESTONE QUARRY PRO SHRI RAJENDRA GUPTA,Delisted,EC,
8,1338,SIA/CG/MIN/175723/2020,OL/EC/MIN/DANTEWADA/1407,Manjhipadar Sand Mine,ASHISH KUMAR CHAUHAN,EC Granted,EC,
9,1339,SIA/CG/MIN/62817/2020,OL/EC/MIN/GARIABABA/982,Barbhata Flagstone  Mine of Ghanshyam Yadu,GHANSHYAM YADU,EC Granted,EC,
10,1340,SIA/CG/MIN/429597/2023,OL/EC/MIN/KANKER/2430,Ghotiawahi Ordinary Stone Quarry,YASHWANT SINHA,For further consideration(SEAC),EC,
1,1341,SIA/CG/MIN/65261/2017,OL/EC/LIME_STONE/BASTAR/607,"Limestone Mine, Village - Rajoor",SMT USHA RAJPURIA,Rejection Letter Granted,EC,
2,1342,SIA/CG/MIN/128570/2019,OL/EC/MIN/RAJNANDGAON/1080,Shri Prashant Singh,SHRI PRASHANT SINGH,EC Granted,EC,
3,1343,SIA/CG/MIN/408802/2022,OL/EC/MIN/JC/2219,"Tanaud Bricks Earth Clay Quarry & Fix Chimney Brick Plant, Area  - 1.337 ha. , Applicant - Shri Ajay Kumar sahu",AJAY SAHU,Rejection Letter Granted,EC,
4,1344,SIA/CG/MIN/31308/2015,OL/EC/SANDMINE/DURG/21,sipkona sand mine,SARPANCH SIPKONA,EC Granted,EC,
5,1345,SIA/CG/MIN/42463/2019,OL/EC/MIN/RAJNANDGAON/995,Naveen Kumar Jain,NAVEEN  KUMAR JAIN,EC Granted,EC,
6,1346,SIA/CG/MIN/64512/2017,,Dhiri sand mine,GRAM PANCHYAT DHIRI,Delisted,EC,
7,1347,SIA/CG/IND/64628/2017,OL/EC/IND/RAIPUR/599,Rooplaxmi Industries India Pvt Ltd,RUPLAXMI  INDUSTRIES INDIA PVT LTD,EC Granted,EC,
8,1348,SIA/CG/MIN/53446/2016,OL/EC/SANDMINE/DHAMTARI/449,Mohrenga Sand Mine,SARPANCH MOHRENGA,EC Granted,EC,
9,1349,SIA/CG/MIN/269128/2022,OL/EC/MIN/BALRAMPUR/1999,VIRENDRANAGAR ORDINARY STONE QUARRY,SUBHASH VERMA,EC Granted,EC,
10,1350,SIA/CG/MIN/412376/2023,OL/EC/MIN/RAJNANDGAON/2252,M/s Bharat Builders (Prop – Smt. Shanti Devi),BHARAT BUILDERS PROP SHANTI DEVI,EC Granted,EC,
1,1351,SIA/CG/MIN/432857/2023,OL/EC/MIN/BASTAR/2511,Badekadma Limestone Quarry,SANTOSH NAG,For further consideration(SEAC),EC,
