,Sno.,Proposal No.,File No.,Project Name,Company,Proposal Status,Project Type,View
8,1178,SIA/CG/MIN/415260/2023,,Baturabahar Ordinary Stone Temporary Permit Quarry of M/s. Tirupati Buildcon Pvt. Ltd.,TIRUPATI BUILD-CON PRIVATE LIMITED,Request for withdraw,EC,
9,1179,SIA/CG/MIN/411932/2022,OL/EC/MIN/KORIYA/2241,"Hastinapur Crusher stone Quarry , shri Dev kumar Patel , area - 1.070 ha.",DEV PATEL,Rejection Letter Granted,EC,
10,1180,SIA/CG/MIN/435188/2023,OL/EC/MIN/MAHASAMUND/2577,Smt. Archana Sharma,ARCHANA SHARMA,Agenda Uploaded by SEIAA,EC,
1,1181,SIA/CG/IND/75984/2018,OL/EC/IND/RAIPUR/735,VANDANA ROLLING MILLS LIMITED,VANDANA ROLLING MILLS LIMITED,EC Granted,EC,
2,1182,SIA/CG/MIN/45984/2019,OL/EC/MIN/BALOD/1003,BHARDAKHURD ORDINARY SAND MINE BALOD CHHATTISGARH (5 Ha),M/S NITIMA MINERALS DURG CHHATTISGARH,EC Granted,EC,
3,1183,SIA/CG/MIN/42333/2016,OL/EC/SANDMINE/SUKMA/337,SAND MINA CHHINDGARH,CHHINDGARH SARPANCH,Delisted,EC,
4,1184,SIA/CG/IND/219924/2021,OL/EC/IND/RAIPUR/1728,Laxmi Kripa Ispat Private Limited,LAXMI KRIPA ISPAT PRIVATE LIMITED,EC Granted,EC,
5,1185,SIA/CG/IND/104574/2019,OL/EC/IND/RAIPUR/860,Integration of Rolling Mill by Ishwar Ispat Industries Pvt Limited unit 4,ISHWAR ISPAT INDUSTRIES PRIVATE LIMITED UNIT IV,Rejected - Processed offline,EC,
6,1186,SIA/CG/MIN/429597/2023,OL/EC/MIN/KANKER/2430,Ghotiawahi Ordinary Stone Quarry,YASHWANT SINHA,For further consideration(SEAC),EC,
7,1187,SIA/CG/MIN/451428/2023,OL/EC/MIN/RAIPUR/2747A,Arivand Kumar Bansal Earth Clay Bricks Quarry,ARVIND BANSAL,Agenda Uploaded by SEAC,EC,
8,1188,SIA/CG/MIN/172980/2020,OL/EC/MIN/GARIABAND/1393,passaud sand mine,PASSAUD SAND MINE,EC Granted,EC,
9,1189,SIA/CG/MIN/62844/2017,OL/EC/LIME_STONE/DURG/564,"A K Verma (3.47 Hectare)
Pathariya Limestone Mine",A K VERMA LIMESTONE,Rejection Letter Granted,EC,
10,1190,SIA/CG/MIN/228073/2021,OL/EC/MIN/RAIGARH/1806,tendumundi sand mine,TENDUMUNDI SAND MINE,For further consideration(SEAC),EC,
1,1191,SIA/CG/MIN/227365/2021,,Khanda Bricks Earth Clay Quarry &fix chimney Bricks plant,KHANDA BRICKS EARTHCLAY QUARRY MINE AND FIX CHIMNEY BRICKS PLANT,Under examination of SEIAA,EC,
2,1192,SIA/CG/MIN/431312/2023,OL/EC/MIN/KANKER/2485,Gram Panchayat Bhiraud,PARAU JURRI,EC Granted,EC,
3,1193,SIA/CG/MIN/432857/2023,OL/EC/MIN/BASTAR/2511,Badekadma Limestone Quarry,SANTOSH NAG,For further consideration(SEAC),EC,
4,1194,SIA/CG/MIN/451971/2023,OL/EC/MIN/KORBA/2756,M/s. Dilip Buildcon Limited Bhopal	-Gidhauri Ordinary Stone Quarry,DILIP BUILDCON LIMITED,Agenda Uploaded by SEAC,EC,
5,1195,SIA/CG/MIN/42016/2016,OL/EC/LIMESTONE_quarry/RAJNANDGAON/326,Chaveli Lime Stone Quarry,SHASHI KALA GUPTA,Delisted,EC,
6,1196,SIA/CG/MIN/42235/2019,,Girdhari Lal Talreja,GIRDHARI LAL TALREJA,Delisted,EC,
7,1197,SIA/CG/MIN/37329/2015,OL/EC/SANDMINE/JANJGIR_CHAMPA/271,Mironi Sand project,MIROUNI GRAM PANCHAYAT,EC Granted,EC,
8,1198,SIA/CG/MIN/227173/2021,OL/TOR/MIN/SURAJPUR/1787,Ramnagar Brick Earthclay Quarry Mine & Fix Chimney Brick Plant,RAMNAGAR BRICK EARTHCLAY QUARRY MINE & FIX CHIMNEY BRICK PLANT OF SUNNY AGRAWAL,EC Granted,EC,
9,1199,SIA/CG/MIN/228080/2021,OL/EC/MIN/RAIGARH/1807,deradih sand mine,DERADIH SAND MINE,Rejection Letter Granted,EC,
10,1200,SIA/CG/MIN/202557/2021,OL/EC/MIN/SURGUJA/1589,Manja Ordinary Stone Quarry of dee Vee Gawar (JV),MANJA ORDINARY STONE QUARRY OF  DEE VEE GAWAR (JV),EC Granted,EC,
1,1201,SIA/CG/MIN/453812/2023,,M/s S.J. Minerals,SHUBHAM AGRAWAL,Pending at PP due to eds,EC,
2,1202,SIA/CG/MIN/64051/2017,,"Mohini Devi Mishra 4.55 Hectare  
Nandini Khundini Limestone Mine",MOHINI DEVI MISHRA,WithdrawEC,EC,
3,1203,SIA/CG/MIN/74110/2018,OL/EC/MIN/BASTAR/681,Rajoor Limestone Mine,SMT USHA RAJPURIA,Rejection Letter Granted,EC,
4,1204,SIA/CG/MIN/150393/2020,OL/EC/MIN/KORBA/1250,Murki Sand Mine of Shrawan Kumar Jaiswal,MURKI SAND MINE OF SHRAWA KUMAR JAISWAL,EC Granted,EC,
5,1205,SIA/CG/MIN/435737/2023,OL/EC/MIN/RAIPUR/2554,Smt. Hema Pandey,HEMA PANDEY,EC Granted,EC,
6,1206,SIA/CG/MIN/451811/2023,OL/EC/MIN/BALODA_BAZAR/2100,Amakoni Limestone Quarry Mining,BHAGWATI VERMA,Agenda Uploaded by SEAC,EC,
7,1207,SIA/CG/MIN/42884/2019,,M/s Kusum Stone Minerals (Prop. Arti Mudliyar),KUSUM STONE MINERALS ARTI MUDLIYAR,Delisted,EC,
8,1208,SIA/CG/IND/31935/2015,,Shri Krishna Metal Works Partner  Smt Kiran Gupta Flat no.601 6th floor Grand Tower GT Exotica Shankar Nagar Raipur CG 492001,SHRI KRISHNA METAL WORKS,Delisted,EC,
9,1209,SIA/CG/MIN/31951/2015,OL/EC/SANDMINE/RAIPUR/88,Charoda Sand Mine,SARPANCH CHARODA,EC Granted,EC,
10,1210,SIA/CG/MIN/32623/2015,OL/EC/SANDMINE/DHAMTARI/133,Karelibadi Sand Mine,SARPANCH KARELIBADI,EC Granted,EC,
1,1211,SIA/CG/MIN/208265/2021,OL/EC/MIN/BALRAMPUR/1633,Bheski Limestone Quarry Mine of Madan Goyal,BHESKI LIMESTONE QUARRY MINE OF MADAN GOYAL,EC Granted,EC,
2,1212,SIA/CG/MIN/48289/2018,OL/EC/MIN/DURUG/735-E,Nand Kumar Kumbhakar Nandini Khundini Limestone Mine,NAND STONE CRUSHER LIMESTONE MINE,EC Granted,EC,
3,1213,SIA/CG/MIN/43982/2017,OL/EC/MIN/RAJNANDGAON/1007,Vijay Agrawal,VIJAY  AGRAWAL,EC Granted,EC,
4,1214,SIA/CG/MIN/165951/2020,OL/EC/MIN/DHAMTARI/1366,semra b sand mine,SEMRA B DHAMTARI,EC Granted - Processed offline,EC,
5,1215,SIA/CG/MIN/32996/2015,OL/EC/LIMESTONE/RAIPUR/159,KAMLESH BHAWNANI LIMESTONE MINOR MINERAL MINE,KAMLESH BHAWNANI,EC Granted,EC,
6,1216,SIA/CG/MIS/114377/2019,OL/EC/MIS/BILASUR/942,"Super Specialty Hospital, under PMSSY (Phase-IV), Bilaspur",CHHATTISGARH INSTITUTE OF MEDICAL SCIENCES,EC Granted,EC,
7,1217,SIA/CG/MIN/46353/2019,OL/EC/MIN/BIJAPUR/1018,K-1 Mangalnar Sand Mine,MANGALNAR SAND  MINE,EC Granted,EC,
8,1218,SIA/CG/MIN/31780/2015,,,SHREE SIDDHIVINAYAK CRUSHER UDYOG,WithdrawEC,EC,
9,1219,SIA/CG/MIN/430705/2023,OL/EC/MIN/KABEERDHAM/2478,SHRI LAL SHOURYAJEET SINGH,LAL SINGH,For further consideration(SEAC),EC,
10,1220,SIA/CG/MIN/450974/2023,OL/EC/MIN/MAHASAMUND/2818,Ranijaroud Limestone Quarry,ANANDI SHARMA,Agenda Uploaded by SEAC,EC,
1,1221,SIA/CG/MIN/169627/2020,OL/EC/MIN/KANKER/1378,SANJAY KRISHNANI STONE QUARRY,KANKER  STONE,EC Granted,EC,
2,1222,SIA/CG/MIN/169678/2020,OL/EC/MIN/J_Champa/1377,Bhogahapara sand mine of Abhishek Agrawal,BHOGAHAPARA SAND MINE OF ABHISHEK AGRAWAL,EC Granted,EC,
3,1223,SIA/CG/MIN/33139/2019,OL/EC/LIMESTONEMINE/RAJNANDGAON/788,M/s SHREE NAVKAR STONES(Dumardihkala Limestone Quarry),SHREE NAVKAR STONES,EC Granted - Processed offline,EC,
4,1224,SIA/CG/MIN/63874/2017,OL/EC/SAND_MINE/DHAMTARI/577,bharari sand mine,BHAWARMARA SAND MINE,EC Granted,EC,
5,1225,SIA/CG/IND/63939/2017,OL/EC/INDUSTRY/RAIPUR/579,Hanukripa Ispat Private Limited,HANU KRIPA ISPAT PRIVATE LIMITED,EC Granted,EC,
6,1226,SIA/CG/MIN/86980/2018,OL/EC/SANDMINE/RAIPUR/754A,Baronda Sandmine,GRAM PANCHAYAT BARONDA SAND,Delisted,EC,
7,1227,SIA/CG/MIN/32609/2019,OL/EC/MIN/KANKER/782,Bhilai Sand Mine Distt Kanker,BHILAI SAND MINE,EC Granted,EC,
8,1228,SIA/CG/MIN/32651/2019,,JHARRIPARA SOAP STONE,GEO MANOJ KUMAR,Delisted,EC,
9,1229,SIA/CG/MIN/425021/2023,OL/EC/MIN/JASHPUR/2373,M/s. Dilip Buildcon Limited -Turuama Ordinary Stone Temporary Permit Quarry (1),DILIP BUILDCON LIMITED,EC Granted,EC,
10,1230,SIA/CG/MIN/447010/2023,OL/EC/MIN/BILASPUR/2685,LALWANI BRICK EARTH QUARRY,SUNIL LALWANI,Agenda Uploaded by SEAC,EC,
1,1231,SIA/CG/MIN/402432/2022,OL/EC/MIN/MMA/2161,M/s Mahaveer India Pvt. Ltd.  (Director- Shri. Sunil Jain),SHREE NAVKAR STONES,EC Granted,EC,
2,1232,SIA/CG/INFRA2/423055/2023,OL/EC/INFRA2/RAIPUR/2343,AVINASH CHITWAN,AIM INFRASTRUCTURE AND DEVELOPERS,Rejected by SEIAA,EC,
3,1233,SIA/CG/MIN/417409/2023,OL/EC/MIN/SURGUJA/1784,Changori & Karra Limestone mining Cluster,ADITYA BHAGAT,Delisted,EC,
4,1234,SIA/CG/MIN/43867/2019,OL/EC/MIN/RAJNANDGAON/986,Shashikala Gupta,SHASHIKALA GUPTA,EC Granted,EC,
5,1235,SIA/CG/MIN/46225/2019,OL/EC/MIN/BALOD/1014,DEVINAWAGAON ORDINARY SAND MINE BALOD CHHATTISGARH (5.0 Ha),SHRI SUDESH KUMAR SIWANA SAND MINE,EC Granted,EC,
6,1236,SIA/CG/MIN/42496/2016,OL/EC/SANDMINE/JANJGIR-CHAMPA/346,birhabhanta sand mine,SACHIV BIRHABHANTA,EC Granted,EC,
7,1237,SIA/CG/MIN/127473/2019,,R Andrew Maniraj Kotni Sand Mine,KOTNI SAND MINE,Delisted,EC,
8,1238,SIA/CG/MIN/127754/2019,OL/EC/MIN/RAJANANDGAON/1274,Smt.Aruna Jogewar,SMT ARUNA JOGEWAR,EC Granted,EC,
9,1239,SIA/CG/MIN/142833/2020,OL/EC/MIN/KONDAGAON/1170,SINGANPUR ORDINARY SAND MINE KONDAGAON CG,SINGANPUR ORDINARY SAND MINE KONDAGAON CG,EC Granted,EC,
10,1240,SIA/CG/MIN/143295/2020,OL/EC/MIN/RAJNANDGAON/1176,Shivlal Chakradhari Joratarai Limestone Mine,SHIVLAL CHAKRADHARI,EC Granted,EC,
1,1241,SIA/CG/MIN/42409/2019,OL/EC/MIN/RAJNANDGAON/965,Girish Talreja,GIRISH  TALREJA,EC Granted,EC,
2,1242,SIA/CG/IND/37241/2019,OL/EC/IND/RAIPUR/893,Expansion of Steel Plant by M/s Gopal Sponge and Power Pvt. Limited,GOPAL SPONGE AND POWER PRIVATE LIMITED,Rejected - Processed offline,EC,
3,1243,SIA/CG/MIN/430705/2023,OL/EC/MIN/KABEERDHAM/2478,SHRI LAL SHOURYAJEET SINGH,LAL SINGH,For further consideration(SEAC),EC,
4,1244,SIA/CG/MIN/450974/2023,OL/EC/MIN/MAHASAMUND/2818,Ranijaroud Limestone Quarry,ANANDI SHARMA,Agenda Uploaded by SEAC,EC,
5,1245,SIA/CG/MIN/31568/2015,OL/EC/SANDMINE/RAIGARH/41,Jabalpur Sand Mining,SARPANCH JABALPUR,EC Granted,EC,
6,1246,SIA/CG/MIN/36462/2015,OL/EC/CLAY_MINE/BILASPUR/264,CLAY BRICKS QUARRY OF SHRI RAJKUMAR YADAV,RAJKUMAR AYADAV,EC Granted,EC,
7,1247,SIA/CG/MIN/151640/2020,OL/EC/MIN/KANKER/1288,BODELI H1 SAND QUARRY,KANKER SAND QUARRY,EC Granted,EC,
8,1248,SIA/CG/MIN/35183/2019,OL/EC/SANDMINE/BALODABAZAR_BHATAPARA/845,thakurdiya sand mine,THAKURDIYA SAND MINE,Delisted,EC,
9,1249,SIA/CG/NCP/62813/2017,OL/EC/NCP/RAIPUR/562,Avinash CAPITAL HOMES 2,ANAND SINGHANIA,Delisted,EC,
10,1250,SIA/CG/MIN/44502/2018,OL/EC/MIN/RAJNANDGAON/988,Pradeep Sharma China Clay Quarry,PRADEEP  SHARMA,EC Granted,EC,
1,1251,SIA/CG/MIN/32738/2019,,MANDIR HASAUD LIMESTONE QUARRY OF PRIYESH SINGH THAKUR,UGEM,Pending at PP due to eds,EC,
2,1252,SIA/CG/MIN/58588/2016,OL/EC/SANDMINE/KABIRDHAM/485,andharikachhar sand mine,SARPANCH ANDHARIKACHHAR,EC Granted,EC,
3,1253,SIA/CG/IND/67229/2017,OL/EC/IND/BILASPUR/624,MAA MAHAMAYA STEELS PRIVATE LIMITED,MAA MAHAMAYA STEELS PRIVATE LIMITED,EC Granted,EC,
4,1254,SIA/CG/MIN/53045/2016,,M/s Santosh Kumar Pade Brick Earth in Village Albaras,MS SANTOSH PADE BRICK EARTH MINE,Delisted,EC,
5,1255,SIA/CG/MIN/215700/2021,OL/EC/MIN/DHAMTARI/1711,Lime stone quarry,REVENDRA CHANDRAKAR LIMESTONE QUARRY GOJI,EC Granted,EC,
6,1256,SIA/CG/MIN/132719/2019,OL/EC/MIN/SURGUJA/1072,Jajga Sand Mine of Uday Kumar Sharma,JAJGA SAND MINE OF UDAY KUMAR SHARMA,EC Granted,EC,
7,1257,SIA/CG/MIN/246493/2021,OL/EC/MIN/BASTAR/1882,CHHINDGAON LIMESTONE QUARRY,ONKAR SINGH,Under examination of SEIAA after SEAC,EC,
8,1258,SIA/CG/MIN/81635/2020,OL/EC/MIN/RAJNANDGAON/1438,,PUSHPLATA  OSWAL,Awaiting EC,EC,
9,1259,SIA/CG/IND1/407060/2022,OL/EC/IND1/RPR/1594,"Proposed Greenfield Project to Produce Sponge Iron - 62700 TPA through DRI Kiln (190 TPD X 1 No.), MS Ingot/Billets 99000 TPA through Induction Furnace with CCM & Captive Power Generation - 4.5 MW through WHRB at Village - Parsada, Tahsil - Tilda, District - Raipur (CG) by M/s. Nandan Smelters Pvt. Ltd.",NANDAN SMELTERS PRIVATE LIMITED,Under examination of SEIAA after SEAC,EC,
10,1260,SIA/CG/MIN/424712/2023,OL/EC/MIN/DHAMTARI/2372,"M/s. Dilip Buildcon Limited, Bhopal-Gondlanala Ordinary Stone Temporary Permit Quarry (4)",DILIP BUILDCON LIMITED,EC Granted,EC,
1,1261,SIA/CG/MIN/227205/2021,OL/EC/MIN/KORBA/1804,dhawaipur sand mine,DHAWAIPUR KORBA SAND MINE,For further consideration(SEAC),EC,
2,1262,SIA/CG/MIN/35433/2015,OL/EC/SANDMINE/MUNGELI/231,Lagra Sand Mine,SACHIVLAGRA,EC Granted,EC,
3,1263,SIA/CG/MIN/36312/2015,OL/EC/sand_MINE/BASTAR/261,Talnar Sand Mine,SARPANCH TALNAR,EC Granted,EC,
4,1264,SIA/CG/MIN/250835/2022,OL/EC/MIN/BALOD/1908,Shri Arvind Kumar Jain,SHRI. ARVIND KUMAR JAIN,Rejection Letter Granted,EC,
5,1265,SIA/CG/MIN/252113/2022,OL/EC/MIN/KORBA/1915,Ghatadwari Sand Stone Mine,MATADIN JAISWAL,For further consideration(SEAC),EC,
6,1266,SIA/CG/IND/273722/2022,OL/EC/IND/RAIPUR/2040,KAILASH CASTINGS PVT. LTD.,KAILASH CASTINGS PRIVATE LIMITED,EC Granted,EC,
7,1267,SIA/CG/MIN/148503/2020,OL/EC/MIN/SURAJPUR/1251,Koreya sand mine 1(mine code F1) of Dilip Kumar Gupta,KOREYA SAND MINE 1(MINE CODE F1) OF DILIP KUMAR GUPTA,EC Granted,EC,
8,1268,SIA/CG/THE/28604/2017,OL/EC/THE/JANJGIR_CHAMPA/638,SIA/CG/THE/20256/2017,NUVOCO VISTAS CORP. LTD.,EC Granted,EC,
9,1269,SIA/CG/MIN/46225/2019,OL/EC/MIN/BALOD/1014,DEVINAWAGAON ORDINARY SAND MINE BALOD CHHATTISGARH (5.0 Ha),SHRI SUDESH KUMAR SIWANA SAND MINE,EC Granted,EC,
10,1270,SIA/CG/NCP/72097/2018,OL/EC/NCP/RAIPUR/665,Expansion of Building Project by Aarti Colonizer Company,AARTI COLONIZER COMPANY,EC Granted,EC,
1,1271,SIA/CG/MIN/219228/2021,OL/EC/MIN/MUNGELI/1754,"M/S DANESHAWAR SAHU, BRICK EARTH MINE",DANESHAWAR SAHU BRICK EARTH MINE,EC Granted,EC,
2,1272,SIA/CG/MIN/153489/2020,OL/EC/MIN/SURAJPUR/1302,KANTIPUR SAND QUARRY,ASHUTOSH SANYASHI MINING CONSULTANCY,EC Granted - Processed offline,EC,
3,1273,SIA/CG/IND/198136/2021,,m/s mahindra steeps pvt.Ltd,URLA INDUSTRIES AREA,WithdrawEC,EC,
4,1274,SIA/CG/MIN/35797/2015,,Quartz Mine,ULTIMATE ENVIROLYTICAL SOLUTION,Delisted,EC,
5,1275,SIA/CG/MIN/53148/2016,,PANKAJ AGRAWAL DHURAGAON LIMESTONE MINE,PANKAJ AGRAWAL DHURAGAON LIMESTONE MINE,Delisted,EC,
6,1276,SIA/CG/MIN/53255/2016,OL/EC/SANDMINE/JANJGIR_CHAMPA/444,radhapur,SARPANCH RADHAPUR,EC Granted,EC,
7,1277,SIA/CG/MIN/33218/2018,OL/EC/MIN/RAJNANDGAON/793,Girdhari lal Tareja (Chaveli Lime Stone Quarry),GIRDHARI LAL TALREJA,EC Granted,EC,
8,1278,SIA/CG/MIN/33384/2019,OL/EC/MIN/MAHASAMUND/791,Barbaspur Sand Mine Khasra No1,SACHIV BARBASPUR,EC Granted,EC,
9,1279,SIA/CG/MIN/33539/2019,OL/EC/MIN/BEMETARA/799,KANDRAKA SAND MINE,SARPANCH KANDRAKA,Rejection Letter Granted,EC,
10,1280,SIA/CG/MIN/33508/2019,OL/EC/IND/KANKER/795,Capacity Expansion from 0.60 to 1.20 MTPA (1.0 MTPA Iron Ore above threshold value (+45% Fe) & 0.20 MTPA below threshold value Mineral (-45% Fe which is Part of Overburden)) & Installation of a new 0.48 MTPA Iron Ore Beneficiation Plant (Primary Dry/Wet) - M/s. Shri Bajrang Power & Ispat Limited,SHRI BAJRANG POWER ISPAT LIMITED,EC Granted,EC,
1,1281,SIA/CG/MIN/38764/2016,OL/EC/SANDMINE/KORIA/293,SAND MINING PLAN LAI,SARPANCH LAI,EC Granted,EC,
2,1282,SIA/CG/MIN/58986/2016,,kumharic,SARPANCH KUMHARIC,Delisted,EC,
3,1283,SIA/CG/MIN/57734/2016,,KONDAGAON SAND QUARRY,KONDAGAON SAND QUARRY,Delisted,EC,
4,1284,SIA/CG/MIN/432560/2023,OL/EC/MIN/KORIYA/2513,Smt. Shobha Choudha (Proprietor of  M/s. Koriya Stone Crusher ),SHOBHA CHOUDHA,For further consideration(SEIAA),EC,
5,1285,SIA/CG/MIN/453503/2023,,"FLAGSTONE QUARRY, VILLAGE DEOGAON, PROJECT PROPONENT MOHAMMAD SALIM",MOHAMMAD SALIM,Pending at PP due to eds,EC,
6,1286,SIA/CG/MIN/453921/2023,,Mehfooz Ahmed,MOHAMMED YAKIN,Pending at PP due to eds,EC,
7,1287,SIA/CG/MIN/179036/2020,OL/EC/MIN/BILASPUR/1418,Konchara sand mine of Manoj Kumar Pandey,KONCHARA SAND MINE OF MANOJ KUMAR PANDEY,EC Granted,EC,
8,1288,SIA/CG/MIN/149534/2020,OL/EC/MIN/J_CHAMPA/1311,Shri. Ram Prakash Jaiswal,RAM  PRAKASH,EC Granted,EC,
9,1289,SIA/CG/MIN/35943/2015,,Quart Minez,RAJESH SHARMA,Delisted,EC,
10,1290,SIA/CG/MIN/38609/2016,OL/EC/SAND_MINE/DURG/289,Birejhar Sand Mine,SARPANCH BIREJHAR,EC Granted,EC,
1,1291,SIA/CG/MIN/32658/2015,OL/EC/SANDMINE/GARIYABANDH/125,Choubebandha Sand Mine,SARPANCH CHOUBEBANDHA,EC Granted,EC,
2,1292,SIA/CG/MIN/33722/2015,OL/EC/SANDMINE/DHAMTARI/188,Mandraud Sand Mine,SARPANCH MANDRAUD,Delisted,EC,
3,1293,SIA/CG/MIN/50857/2016,,Yuva Sam Vikas Sahkari Samiti Maryadit(Stone Mine),LALIT RAM,Delisted,EC,
4,1294,SIA/CG/MIN/50858/2016,,Stone quarry village Gumdha,KAMAL SOMANI,Delisted,EC,
5,1295,SIA/CG/CMIN/19653/2015,OL/EC/IND/JANJGIR_CHAMPA/2022,Paras Power and Coal Benefication Limited,PARAS POWER AND COAL BENEFICIATION LIMITED,EC Granted,EC,
6,1296,SIA/CG/MIN/34994/2015,OL/EC/LIMESTONE_MINE/BILASPUR/229,Mohtara & Masturi Limestone quarry,MS KANHAIYA MINERALS,EC Granted,EC,
7,1297,SIA/CG/MIN/35469/2015,OL/EC/SANDMINE/KORIYA/232,Gadhter Sand Mine,GRAM PANCHAYAT GADHTER,EC Granted,EC,
8,1298,SIA/CG/MIN/48207/2016,OL/EC/SANDMINE/DHAMTARI/376,Budeni Sand Mine,SARPANCH BUDENI,Delisted,EC,
9,1299,SIA/CG/MIN/196701/2021,OL/EC/MIN/RAJNANDGAON/1550,Smt.Sangeeta Devi Rungta,SMT.SANGEETA DEVI RUNGTA,Rejected by SEIAA,EC,
10,1300,SIA/CG/MIN/424447/2023,OL/EC/MIN/DHAMTARI/2367,"M/s.Dilip Buildcon Limited, Bhopal	-Dhanbuda Ordinary Stone Temporary Permit Quarry (3)",DILIP BUILDCON LIMITED,EC Granted,EC,
1,1301,SIA/CG/MIN/221813/2021,OL/EC/MIN/DHAMTARI/1752,PAIKBHATA CRUSHER STONE QUARRY,PAIKBHATA CRUSHER STONE QUARRY 1.20 HA,EC Granted,EC,
2,1302,SIA/CG/NCP/61403/2016,OL/EC/CONSTRUCTION_PROJECT/RAIPUR/540,Wallfort SAPPHIRE,WALLFORT PROPERTIES PRIVATE LIMITED,EC Granted - Processed offline,EC,
3,1303,SIA/CG/MIN/275383/2022,OL/EC/MIN/JASHPUR/2063,F 1 RATAMATI SAND QUARRY,SUBHASH VERMA,EC Granted,EC,
4,1304,SIA/CG/MIN/440625/2023,OL/EC/MIN/BALODA_BAZAR/2710,Abhishek Singh Thakur,ABHISHEK THAKUR,Agenda Uploaded by SEAC,EC,
5,1305,SIA/CG/MIN/446667/2023,OL/EC/MIN/RAIGARH/2695,Jamjhor Low Grade Limestone Mine of Chiranjiv Mohanti,CHIRANJIV MOHANTI,Agenda Uploaded by SEAC,EC,
6,1306,SIA/CG/MIN/41554/2016,OL/EC/SANDMINE/KORIYA/319,SAND MINING PLAN DUMARIYA,SARPANCH DUMARIYA,Rejection Letter Granted,EC,
7,1307,SIA/CG/RIV/21689/2014,OL/EC/RIV/JANJGIR_CHAMPA/1222,"Construction of Barrage on Hasdeo River at Janjgir Champa, Chhattisgarh by Water Resource Department",WATER RESOURCE DEPARTMENT GOVERNMENT OF CHHATISGARH,EC Granted,EC,
8,1308,SIA/CG/MIN/65261/2017,OL/EC/LIME_STONE/BASTAR/607,"Limestone Mine, Village - Rajoor",SMT USHA RAJPURIA,Rejection Letter Granted,EC,
9,1309,SIA/CG/MIN/42463/2019,OL/EC/MIN/RAJNANDGAON/995,Naveen Kumar Jain,NAVEEN  KUMAR JAIN,EC Granted,EC,
10,1310,SIA/CG/MIN/64512/2017,,Dhiri sand mine,GRAM PANCHYAT DHIRI,Delisted,EC,
1,1311,SIA/CG/MIN/42528/2016,OL/EC/STONEMINE/RAIPUR/347,GANESH STONES STONE MINE,GANESH STONES,Delisted,EC,
2,1312,SIA/CG/MIN/42566/2016,OL/EC/SANDMINE/KORIYA/348,SAND MINING PLAN PIPARIYA,SARPANCH PAPRIYA,EC Granted,EC,
3,1313,SIA/CG/IND/10815/2016,,Expansion of Rolling Mill,R R ISPAT A UNIT OF GODAWARI POWER AND ISPAT LIMITED,EC Granted,EC,
4,1314,SIA/CG/IND/64893/2017,OL/EC/IND/RAIPUR/601,SHIV REAL ISPAT PRIVATE LIMITED,SHIV REAL ISPAT PVT LTD,EC Granted,EC,
5,1315,SIA/CG/MIN/33339/2014,OL/EC/MIN/RAJNANDGAON/790,MERHA SAND MINES,MERHA SAND MINE,EC Granted,EC,
6,1316,SIA/CG/MIN/34439/2019,OL/EC/LIMESTONEMINE/GARIABANDH/823,pitaiband sand mine,PITAIBAND SAND MINE,EC Granted,EC,
7,1317,SIA/CG/MIN/129978/2019,OL/EC/MIN/BIJAPUR/1047,J-2 Mingachal Sand Quarry,J-1 MINGACHAL SAND QUARRY,EC Granted,EC,
8,1318,SIA/CG/MIN/81231/2020,OL/EC/MIN/RAJNANDGAON/1296,,HIROBAI GOND,Awaiting EC,EC,
9,1319,SIA/CG/MIN/443152/2023,OL/EC/MIN/JANJGIR_CHAMPA/1597,Taraod limestone mine,NEEL SINGH,Agenda Uploaded by SEAC,EC,
10,1320,SIA/CG/MIN/61454/2016,OL/EC/LIME_STONE/DURG/542,"Limestone Quarry, Village - Nandini-Khundini",SHRI B L RAMANI,EC Granted,EC,
1,1321,SIA/CG/MIN/149213/2020,,Abdul Sajid Khan Dumerdihkala Limestone Mine,ABDUL SAJID KHAN,Delisted,EC,
2,1322,SIA/CG/MIN/33656/2015,,Dhansuli lime stone mine,DHANSULI LIMESTONE MINES,Delisted,EC,
3,1323,SIA/CG/MIN/51255/2016,OL/EC/SANDMINE/BEMETARA/424,parpoda sand mine,SARPANCH PARPODA,EC Granted,EC,
4,1324,SIA/CG/NCP/65186/2017,,Atal Vihar Yojna Shriram Nagar,CHHATTISGARH HOUSING BOARD,Delisted,EC,
5,1325,SIA/CG/MIN/157551/2020,,Kharsura Brick Earthclay Quarry Mine & Fix Chimney Brick Plant	 of Narendra Kumar Jaiswal,KHARSURA BRICK EARTHCLAY QUARRY MINE & FIX CHIMNEY BRICK PLANT	OF NARENDRA KUMAR JAISWAL,Delisted,EC,
6,1326,SIA/CG/MIN/215684/2021,OL/EC/MIN/DANTEWADA/1712,GUMDA SAND QUARRY,DANTEWADA MINING,Under examination of SEIAA after SEAC,EC,
7,1327,SIA/CG/MIN/180834/2020,OL/EC/MIN/RAIPUR/1441,"Nakti Khapri Limestone Mine of Khetan Buildcon Pvt,Ltd.",NAKTI KHAPRI LIMESTONE MINE OF KHETAN BUILDCON PVT.LTD.,EC Granted,EC,
8,1328,SIA/CG/MIN/132301/2019,OL/EC/MIN/JASHPUR/1071,Batura Bahar Ordinary Stone Temporary Permit Quarry (1),MS TIRUPATI BUILD CON PVT LTD,EC Granted,EC,
9,1329,SIA/CG/IND2/289051/2022,OL/EC/IND2/DHAMATARI/2226,ANANT BIOFUEL AND BIOTECH,AVIN ANANT,Rejection Letter Granted,EC,
10,1330,SIA/CG/MIN/446464/2023,OL/EC/MIN/BALODA_BAZAR/2708,Umadev Yadav,UMA YADAV,Agenda Uploaded by SEAC,EC,
1,1331,SIA/CG/MIN/34393/2019,OL/EC/LIMESTONEMINE/GARIABANDH/821,pasaud sand mine,SAND MINE PASAUD,EC Granted - Processed offline,EC,
2,1332,SIA/CG/MIN/263901/2022,,Semai Stone Quarry of M/s. Maa Jagdambey Bhavani Stone Works,DEVENDRA CHAUBEY,WithdrawEC,EC,
3,1333,SIA/CG/MIN/33852/2015,OL/EC/SANDMINE/MAHASAMUND/198,Nandgaon sand project,NANDGAON SAND PROJECT,EC Granted,EC,
4,1334,SIA/CG/MIS/50592/2019,OL/EC/NCP/DURG/909,IIT near Bhilai,INDIAN INSTITUTE OF TECHNOLOGY BHILAI,EC Granted,EC,
5,1335,SIA/CG/MIN/172529/2020,OL/EC/MIN/BILASPUR/1386,Rahatator sand mine of Ghanshyam Sahu,RAHATATOR SAND MINE OF GHANSHYAM SAHU,EC Granted,EC,
6,1336,SIA/CG/MIN/141563/2020,OL/EC/MIN/JCHAMPA/1161,Baijalpur Limestone Quarry Mine,MS M.M. ENTERPRISES PROP.  MAHENDRA KUMAR MITTAL,EC Granted,EC,
7,1337,SIA/CG/MIN/242268/2021,OL/EC/MIN/RAJNANDGAON/1842,Shri Atal Kumar Godwani,SHRI ATAL GODWANI,EC Granted - Processed offline,EC,
8,1338,SIA/CG/MIN/258893/2022,OL/EC/MIN/BILASPUR/1952,M s Rashi Steel And Power Limited,RASHI STEEL AND POWER LIMITED,EC Granted,EC,
9,1339,SIA/CG/MIN/420241/2023,OL/EC/MIN/RAIGARH/2347,CHIRODIH ORDINARY STONE MINE OF NAVEEN KUMAR AGRAWAL,NAVEEN AGRAWAL,EC Granted,EC,
10,1340,SIA/CG/MIN/443559/2023,OL/EC/MIN/BILASPUR/2664,Gram Panchayat Chhatauna,PREM PAIKRA,Under examination of SEIAA after SEAC,EC,
1,1341,SIA/CG/IND1/434455/2023,OL/EC/IND1/RAIPUR/2540,M/s. Satyam Steel,GAUTAM PATEL,Rejected by SEIAA,EC,
2,1342,SIA/CG/MIN/31224/2015,OL/EC/SANDMINE/BASTAR/20,badekilepal sand mining,SARPANCH BADEKILEPAL,EC Granted,EC,
3,1343,SIA/CG/MIN/40693/2016,OL/EC/LIMESTONE_MINE/DURG/304,Gondpendri Limestone Quarry,GONDPENDRI LIMESTONE QUARRY,EC Granted,EC,
4,1344,SIA/CG/MIN/62867/2019,OL/EC/MIN/MAHASAMUND/924,M/S BARBASPUR FLAGSTONE MINES,RAJENDRA  GUPTA,EC Granted,EC,
5,1345,SIA/CG/MIN/446595/2023,OL/EC/MIN/JANJGIR_CHAMPA/1854,Gurushree Minerals Pvt. Ltd,GURUSHREE MINERALS PRIVATE LIMITED,Agenda Uploaded by SEAC,EC,
6,1346,SIA/CG/MIN/179070/2020,OL/EC/MIN/SURAJPUR/1419,Maheshpur Brick Earthclay Quarry Mine & Fix Chimney Brick Plant,MAHESHPUR BRICK EARTHCLAY QUARRY MINE & FIX CHIMNEY BRICK PLANT,EC Granted,EC,
7,1347,SIA/CG/MIN/149475/2020,OL/EC/MIN/J_CHAMPA/1267,Manjharkhurd sand mine of Sunil Kumar Chandra,MANJHARKHURD SAND MINE OF SUNIL KUMAR CHANDRA,EC Granted,EC,
8,1348,SIA/CG/MIN/155577/2020,OL/EC/MIN/J_CHAMPA/1314,Kawlajhar Sand Mine of Pankaj Patel,KAWLAJHAR SAND MINE OF PANKAJ PATEL,EC Granted,EC,
9,1349,SIA/CG/MIN/42463/2019,OL/EC/MIN/RAJNANDGAON/995,Naveen Kumar Jain,NAVEEN  KUMAR JAIN,EC Granted,EC,
10,1350,SIA/CG/MIN/58981/2016,,kumhariC sand mine,SARPANCH KUMHARIC,Delisted,EC,
1,1351,SIA/CG/MIN/430634/2023,OL/EC/MIN/BALOD/2487,SHRI RAMCHARAN SIRDAR,RAM SIRDAR,For further consideration(SEAC),EC,
2,1352,SIA/CG/IND1/451124/2023,OL/TOR/MIN/SARANGARH_BILAIGARH/2667,"Proposed Aluminium Hydrate of 19900 TPA along with steam generated Boiler of 10TPH capacity by Madhya Bharat Minerals Pvt. Ltd at Kh No 201/3 & plot no A1 & A2, Village-Harinchhapara, Tehsil-Bodla, Dist.-Kabirdham, Chhattisgarh",MADHYA BHARAT MINERALS PRIVATE LIMITED,Agenda Uploaded by SEAC,EC,
3,1353,SIA/CG/MIN/37910/2019,OL/EC/MIN/DURG/906A,SMT GEETA DEVI DESHMUKH BRICK EARTH MINE ALBARAS DURG CHHATTISGARH,SMT GEETA DEVI DESHMUKH BRICK EARTH MINE ALBARAS DURG CHHATTISGARH,EC Granted,EC,
4,1354,SIA/CG/MIN/32226/2015,OL/EC/SANDMINE/BILASPUR/96,Khargahna Sand Mine,PANCHAYAT SACHIV,EC Granted,EC,
5,1355,SIA/CG/MIN/37391/2015,OL/EC/sand_mine/KANKER/272,Nara Sand Mine,SARPANCH NARA,EC Granted,EC,
6,1356,SIA/CG/MIN/38381/2016,OL/EC/SANDMINE/DANTEWADA/283,SAND MINE KARLI,SACHIV GRAM PANCHAYAT KARLI,Delisted,EC,
7,1357,SIA/CG/MIN/182256/2020,OL/EC/MIN/RAIPUR/1462,gkc project limited,GKC PROJECTS LIMITED BENDRI,EC Granted,EC,
8,1358,SIA/CG/IND/202183/2021,OL/EC/IND/RAIPUR/1586,M/s Manav Energy & Steel pvt ltd,MS MANAV ENERGY AND STEEL PVT LTD,EC Granted,EC,
9,1359,SIA/CG/MIN/202399/2021,OL/EC/MIN/SURAJPUR/1588,Amandon Ordinary Stone Quarry Mine of Sunil Goyal,AMANDON ORDINARY STONE MINE OF SUNIL GOYAL,EC Granted,EC,
10,1360,SIA/CG/IND/29823/2018,OL/EC/IND/RAIPUR/752,Prakash Industries Ltd. [Rolling Mill Division Unit # 1],Ashok Kumar Chaturvedi,For further consideration(SEAC),EC,
1,1361,SIA/CG/IND1/451124/2023,OL/TOR/MIN/SARANGARH_BILAIGARH/2667,"Proposed Aluminium Hydrate of 19900 TPA along with steam generated Boiler of 10TPH capacity by Madhya Bharat Minerals Pvt. Ltd at Kh No 201/3 & plot no A1 & A2, Village-Harinchhapara, Tehsil-Bodla, Dist.-Kabirdham, Chhattisgarh",MADHYA BHARAT MINERALS PRIVATE LIMITED,Agenda Uploaded by SEAC,EC,
2,1362,SIA/CG/MIN/7605/2007,OL/EC/IND/DANTEWADA/521,Lakharas Tin Ore Mines,PRECIOUS MINERALS AND SMELTING LIMITED,Delisted,EC,
3,1363,SIA/CG/MIN/134772/2020,OL/EC/SAND_MIN/DHAMTARI/1090,sargi sand mine,SSARGI SAND MINE,EC Granted,EC,
4,1364,SIA/CG/MIN/134941/2020,OL/EC/SAND_MIN/DHAMTARI/1097,RAJPUR SANDSTONE QUARRY(D),CHEVROX CONSTRUCTION,EC Granted,EC,
5,1365,SIA/CG/MIN/135432/2020,OL/EC/SAND_MIN/DHAMTARI/1101,mandraud sand mine,CHANDRA PRAKASH VERMA,EC Granted,EC,
6,1366,SIA/CG/MIN/141756/2020,OL/EC/MIN/RAJNANDGAON/1178,Dhamansara Sand Mines (Shri Vaibhav Saluja),VAIBHAV SALUJA,Rejection Letter Granted,EC,
7,1367,SIA/CG/MIN/38795/2019,OL/EC/IND/BALRAMPUR/914,"Kundru Sand Quarry of Sheshnath Dubey, Sachiv, Gram Panchayat Talkeshwarpur.",SACHIV GRAM PANCHAYAT TALKESHWARPUR,EC Granted,EC,
8,1368,SIA/CG/MIN/70899/2017,OL/EC/SAND_MINE/JANJGIR_CHAMPA/647,Khorsi Sand Mine,KHORSI SAND MINE,Delisted,EC,
9,1369,SIA/CG/MIN/42493/2016,OL/EC/SANDMINE_QUARRY/JANJGIR-CHAMPA/344,"sand quarry
gram panchayat chandali",CHANDALI GRAM PANCHAYAT,Delisted,EC,
