"","X","Proposal.No.","File.No.","Project.Name","Company","Proposal.Status","Project.Type","View"
"1180",4,"SIA/KL/MIN/148469/2020","1710/EC6/2020/SEIAA","Laterite Building Stone of Ali N","LATERITE BUILDING STONE OF ALI N","EC Granted","EC",NA
"1181",5,"SIA/KL/MIS/148576/2020","1645/EC1/2020/SEIAA","Artech Grand Tower, Residential Building Project at Sasthamangalam, Thiruvananthapuram","ARTECH REALTORS PVT. LTD.","EC Granted","EC",NA
"1182",8,"SIA/KL/MIN/137300/2020","","LATERITE BUILDING STONE QUARRY OF MR. BABU K.","LATERITE QUARRY OF MR BABU K","Delisted","EC",NA
"1183",1,"SIA/KL/MIN/72954/2022","","Granite Building Stone Quarry of Mr. Haridasan","QUARRY PROJECT OF HARIDASAN","Delisted","EC",NA
"1184",4,"SIA/KL/MIN/140950/2020","","REJI P CHERIYAN 02","REJI P CHERIYAN 02","Delisted","EC",NA
"1185",6,"SIA/KL/MIN/278602/2022","1213/EC2/2019/SEIAA","Mohammad Shareef","GRANITE BUILDING STONE QUARRY OWNED BY MOHAMMED SHAREEF","EC Granted","EC",NA
"1186",7,"SIA/KL/MIN/146392/2020","1594/EC4/2020/SEIAA","ORDINARYEARTH MINING PROJECT OF MR ABDUL SAMAD","ORDINARY EARTH MINIG PROJECT OF MR ABDUL SAMAD","Rejection Letter Granted","EC",NA
"1187",8,"SIA/KL/MIN/148582/2020","1690/EC4/2020/SEIAA","Laterite Building Stone Quarry of Mr. Gopi","LATERITE BUILDING STONE QUARRY OF MR GOPI","Delisted","EC",NA
"1188",9,"SIA/KL/MIN/165193/2020","1941/EC2/SEIAA/2022","Granite Building Stone Quarry of M/s. Malom Crushers","M/S. MALOM CRUSHERS","Rejection Letter Granted","EC",NA
"1189",10,"SIA/KL/MIN/165625/2020","1440/EC1/2019/SEIAA","Granite Building Stone Quarry of Mr. C. Krishna Pillai ( Conversion ToR- EC)","BUILDING STONE QUARRY OF MR C KRISHNA PILLAI","EC Granted","EC",NA
"1190",4,"SIA/KL/MIN/134486/2020","1790/EC4/2020/SEIAA","Shamseer VK","SHAMSEER VK","EC Granted","EC",NA
"1191",2,"SIA/KL/MIN/59610/2016","1087/EC3/SEIAA/2016","H and P Granites","H AND P GRANITES","EC Granted - Processed offline","EC",NA
"1192",3,"SIA/KL/NCP/60654/2016","1115/EC/SEIAA/KL/2017","Artech Malabar Hills","PEEVEEKAY PROPERTIES AND HOTELS PVT LTD","Site Visit by SEAC - EC ISSUED BY 82 SEIAA","EC",NA
"1193",4,"SIA/KL/MIN/437379/2023","2342/EC3/2023/SEIAA","Building Stone Minor Mineral Mining (Quarry) project of M/s Chattupara Granites Private Limited located at at Re-Survey Nos. 734/1B-1, 734/1B-4, 734/1B-5, 734/1B-6, 734/1B-7, 734/1B-8, 734/1B-9 of Kalloorkkad Village, Muvattupuzha Taluk, Ernakulam District, Kerala  for an area of 3.0274 hectares","CHATTUPARA GRANITES PRIVATE LIMITED","Site Visit by SEAC(Pending)","EC",NA
"1194",5,"SIA/KL/MIN/52387/2016","","Quarry project of M/s Sakthi Metals is situated at Varandarappilly Village, Chalakudy Taluk, Thrissur District, Kerala for an area of 2.3560 hectares.","SAKTHI METALS","TransferToDEIAA","EC",NA
"1195",3,"SIA/KL/MIN/134531/2020","1836/EC6/2020/SEIAA","Laterite Building Stone Quarry of Mr. Harshan","LATERITE/BUILDING STONE QUARRY OF MR.HARSHAN","Rejection Letter Granted","EC",NA
"1196",9,"SIA/KL/MIN/43931/2019","1472/EC3/2019/SEIAA","Silica San","ANCY ANTONY MINE","EC Granted","EC",NA
"1197",10,"SIA/KL/MIN/43996/2019","1487/EC3/2019/SEIAA","Granite Bu","GRANITE BUILDING STONE QUARRY OF SRI K GANGADHARAN","EC Granted","EC",NA
"1198",6,"SIA/KL/NCP/60677/2016","1116/EC/SEIAA/KL/2017","Environment Clearance for Proposed Hotel & Convention Centre Project to be developed by M/s Lulu Convention Center Calicut (Pvt.) Ltd.","LULU CONVENTION CENTER CALICUT (PVT) LTD.","Site Visit by SEAC - EC ISSUED BY 76 SEIAA","EC",NA
"1199",7,"SIA/KL/NCP/60612/2016","1113/EC/SEIAA/KL/2017","Environmental Clearance for Proposed I.T. Building project to be developed by  M/s Geon Air Air Condition & Refrigeration Manufacturers (P) Ltd.","GEON AIR AIR CONDITION AND REFRIGERATION MANUFACTURERS PVT LTD","Site Visit by SEAC - EC ISSUED BY 75 SEIAA","EC",NA
"1200",8,"SIA/KL/INFRA2/453077/2023","2478/EC3/2023/SEIAA","Environmental Clearance for the proposed Residential project to be developed by M/s Shanoor  Projects & Realtors Pvt. Ltd.","SHANOOR PROJECTS AND REALTORS PRIVATE LIMITED","Accepted By SEAC","EC",NA
"1201",9,"SIA/KL/MIN/457206/2023","","Granite Building Stone quarry of Mr. J Roberters","ROBERTERSE JAMES NADAR","Under examination of SEIAA","EC",NA
"1202",10,"SIA/KL/MIN/58760/2016","","GRANITE BUILDING STONE QUARRYING PROJECT","M K PADMANABHAN NAIR","TransferToDEIAA","EC",NA
"1203",7,"SIA/KL/MIN/147850/2020","1697/EC4/2020/SEIAA","Granite Building Stone Quarry of Kunjali Marakkar V M","GRANITE BUILDING STONE QUARRY OF KUNJALI MARAKKAR V M","EC Granted","EC",NA
"1204",9,"SIA/KL/MIN/126088/2019","1525/EC1/2019/SEIAA","Mr Deepak N D Managing Partner M/s Quality Rocks","DEEPAK  N D","EC Granted","EC",NA
"1205",10,"SIA/KL/MIN/155712/2020","1688/EC1/2020/SEIAA","Building Stone Mine ( Quarry, Minor Mineral Mining ) project of Mr. V. Sudhakaran at Re  Survey Nos. 270/1, 2, 3, 4, 4-1, 5, 5-1, 5-2, 5-3, 5-4, 5-18,  5-19, 12,12-1, 12-2, 14, 15, 15-1, 16, 17 of Pal","V. SUDHAKARAN","EC Granted","EC",NA
"1206",1,"SIA/KL/MIS/72910/2022","","Development of Technocity Technology Park at Trivandrum","TECHNOPARK PHASE 3","Pending at PP due to eds","EC",NA
"1207",7,"SIA/KL/MIS/209935/2021","1896/EC1/2021/SEIAA","Environmental Clearance for the proposed building construction project as part of development of IT/ITES campus (Phase-1) to be developed by M/s Tata Consultancy Services Ltd.","M/S TATA CONSULTANCY SERVICES LTD.","EC Granted","EC",NA
"1208",8,"SIA/KL/MIN/207633/2021","1912/EC2/SEIAA/2021","Laterite Building Stone Quarry of Divakaran K","DIVAKARAN K","EC Granted","EC",NA
"1209",4,"SIA/KL/MIN/180596/2020","","Bharathapuzha RB 10","DISTRICT COLLECTOR MALAPPURAM","Delisted","EC",NA
"1210",8,"SIA/KL/MIN/179449/2020","1814/EC3/2020/SEIAA","ORDINARY EARTH MINING PROJECT OF MR MATHACHAN PJ","ORDINARY EARTH MINING PROJECT OF MR MATHACHAN PJ","EC Granted","EC",NA
"1211",7,"SIA/KL/MIN/147088/2020","1593/EC4/2020/SEIAA","ORDINARY EARTH MINING PROJECT OF M/S LARSEN & TOUBRO LTD","ORDINARY EARTH MINIG PROJECT OF M/S LARSEN & TOUBRO LTD","Delisted","EC",NA
"1212",1,"SIA/KL/MIN/31502/2019","","M/s Kinalu","KINALUR ROCK SAND","Under examination of SEIAA - Processed offline","EC",NA
"1213",3,"SIA/KL/MIN/280117/2022","2098/EC6/2022/SEIAA","LATERITE BUILDING STONE QUARRY OF Mr. MUHAMMED FAISAL KANNADAN","MUHAMMED FAISAL KANNADAN","EC Granted","EC",NA
"1214",7,"SIA/KL/MIN/280927/2022","2102/EC3/2022/SEIAA","Pradeep A B","PRADEEP BHASKARAN","EC Granted","EC",NA
"1215",5,"SIA/KL/MIN/132700/2019","","CLAY MINING PROJECT","KORAH AND CONSULTANTS","WithdrawEC","EC",NA
"1216",6,"SIA/KL/MIN/133048/2019","1657/EC6/2020/SEIAA","Building stone quarry of shri.Abdul Azeez.K.K","BUILDING STONE QUARRY OF SRI ABDUL AZEEZ  K K","Delisted","EC",NA
"1217",7,"SIA/KL/MIN/248006/2021","","George Antony Managing Partner M/s.G K Granites","GEORGE ANTONY","WithdrawEC","EC",NA
"1218",8,"SIA/KL/MIN/266526/2022","2040/EC6/2022/SEIAA","GRANITE BUILDING STONE QUARRY OF Mr KRISHNA KUMAR. E","ERIKKALIL KRISHNAKUMAR","Agenda Uploaded by SEIAA","EC",NA
"1219",9,"SIA/KL/MIN/265597/2022","2434/EC2/2019/SEIAA","SHIBIN WILLIAM VARGHESE","SHIBIN VARGHESE","EC Granted","EC",NA
"1220",4,"SIA/KL/MIN/204370/2021","1913/EC2/SEIAA/2021","Laterite Building Stone Quarry of T.Kunhikannan","T. KUNHIKKANNAN","EC Granted","EC",NA
"1221",2,"SIA/KL/MIN/72956/2022","","Quarry owned by M/s Sreedhanya Metals","SREEDHANYA METALS","Delisted","EC",NA
"1222",6,"SIA/KL/IND2/30723/2017","","HPCL Expansion project, Palghat","Hindustan Petroleum Corporation Limited","Delisted","EC",NA
"1223",7,"SIA/KL/MIN/423603/2023","","Ordinary Earth Quarry Project of Shri. Abbas P.S","ABBAS SULAIMAN","Pending at PP due to eds","EC",NA
"1224",8,"SIA/KL/MIN/449132/2023","2415/EC1/2023/SEIAA","Granite Building Stone Quarry of Biju M K","BIJU KARUNAKARAN","Agenda Uploaded by SEAC","EC",NA
"1225",9,"SIA/KL/MIN/436077/2023","2400/EC1/2023/SEIAA","Granite building Stone Quarry of M/s Perumalil Infrastructure Private Limited","PERUMALIL INFRASTRUCTURE PRIVATE LIMITED","Site Visit by SEAC(Pending)","EC",NA
"1226",1,"SIA/KL/MIN/144145/2020","1685/EC1/2020/SEIAA","Laterite Building Stone of Koyamon","LATERITE BUILDING STONE OF KOYAMON","WithdrawEC","EC",NA
"1227",6,"SIA/KL/MIN/175381/2020","1421/EC1/2019/SEIAA","Granite Building Stone Quarry of M/s Malabar Blue Metals (Conversion ToR to EC)","BUILDING STONE QUARRY OF M/S MALABAR BLUE METALS","Delisted","EC",NA
"1228",9,"SIA/KL/MIN/46367/2019","2051/EC3/2022/SEIAA","Mr Vinod B","VINOD BHASKAR","Delisted","EC",NA
"1229",5,"SIA/KL/MIN/446501/2023","2425/EC4/2023/SEIAA","Laterite Building Stone Quarry of Manikandan K","MANIKANDAN","For further consideration(SEAC)","EC",NA
"1230",6,"SIA/KL/MIN/448740/2023","2429/EC1/2023/SEIAA","Laterite Building Stone Quarry of Rajan M","RAJAN MATTAYI","For further consideration(SEAC)","EC",NA
"1231",7,"SIA/KL/NCP/92651/2019","1228/EC1/2019/SEIAA","“VKL Towers” – Proposed Expansion of Residential cum Commercial Unit of M/s.  K V Apartments Pvt. Ltd.,","K V APARTMENTS PVT LTD","Under examination of SEIAA - Processed offline","EC",NA
"1232",8,"SIA/KL/INFRA2/443168/2023","2394/EC1/2023/SEIAA","Proposed Apartment 'Confident Ambiance' at Poonithura Village, Kanayannur Taluk, Ernakulam District, Kerala","MEENA THOMAS","For further consideration(SEAC)","EC",NA
"1233",1,"SIA/KL/MIN/45319/2019","1499/EC3/2019/SEIAA","T. Abdul Rahiman Quarry","T ABDUL RAHIMAN QUARRY","Delisted","EC",NA
"1234",2,"SIA/KL/MIN/143624/2020","1652/EC4/2020/SEIAA","Laterite Building Stone of Mr. Moolakaran Rajan","LATERITE BUILDING STONE QUARRY OF MR. RAJAN M.","EC Granted","EC",NA
"1235",4,"SIA/KL/MIN/291136/2022","2111/EC1/2022/SEIAA","Granite Building Stone Quarry of Mr. Jayesh Thomas","JAYESH THOMAS","Agenda Uploaded by SEAC","EC",NA
"1236",5,"SIA/KL/NCP/67916/2017","1153/EC/SEIAA/KL/2017","Environmental Clearance for proposed construction of New Building Project within existing campus to be developed by REGIONAL CANCER CENTRE","REGIONAL CANCER CENTRE","Accepted By SEAC - EC ISSUED IN 82 SEIAA","EC",NA
"1237",2,"SIA/KL/MIN/415955/2023","2221/EC1/2023/SEIAA","Laterite Building Stone of Abdu Rasak","ABDU RAZAK","Agenda Uploaded by SEAC","EC",NA
"1238",3,"SIA/KL/MIN/405841/2022","2153/EC3/2022/SEIAA","Mr. SAJI K ELIAS M/s. MANAGING DIRECTOR,MARIYEM GRANITES PRIVATE LIMITED","MARIYEM GRANITES PRIVATE LIMITED","For further consideration(SEAC)","EC",NA
"1239",4,"SIA/KL/MIN/411076/2022","2251/EC3/2023/SEIAA","SHIBIN WILLIAM VARGHESE,DIRECTOR,M/s.NALAYYATH GRANITES Pvt Ltd","NALAYYATH GRANITES PRIVATE LIMITED","Rejection Letter Granted","EC",NA
"1240",5,"SIA/KL/MIN/437437/2023","2354/EC4/2023/SEIAA","Laterite Building Stone Quarry of Ambujakshan P","PUTHUKUDIAN AMBUJAKSHAN","Agenda Uploaded by SEAC","EC",NA
"1241",6,"SIA/KL/MIN/414508/2023","1763/EC6/2020/SEIAA","AbduRahoof","ABDU RAHOOF","Site Visit by SEAC","EC",NA
"1242",7,"SIA/KL/MIN/92526/2019","1223/EC2/2019/SEIAA","Granite Building Stone Quarry of Mr Haridas P G","BUILDING STONE QUARRY OF HARIDAS P G","Under examination of SEIAA - Processed offline","EC",NA
"1243",2,"SIA/KL/MIN/438659/2023","2418/EC1/2023/SEIAA","Granite Building Stone Quarry of Mr. Amjath M.A","AMJATH ALIYAR","For further consideration(SEAC)","EC",NA
"1244",3,"SIA/KL/MIN/27748/2014","","Mining of heavy mineral sand in Panmana and Alapad villages in Karunagapally taluk,Kollam district for an area of 40.566Ha in NK block IV","INDIAN RARE EARTHS LIMITED","EC Granted - Processed offline","EC",NA
"1245",4,"SIA/KL/MIN/435329/2023","2385/EC2/2023/SEIAA","Granite Building Stone Quarry of Shiju Thomas (Revalidation of EC by DEIAA to SEIAA)","SHIJU THOMAS","For further consideration(SEAC)","EC",NA
"1246",5,"SIA/KL/NCP/60531/2016","1110/EC/SEIAA/KL/2017","Environmental Clearance for Expansion of the Proposed Special Residential cum Commercial Complex Project by M/s Sree Gokulam Hotel (India) Pvt. Ltd.","SREE GOKULAM HOTELS (INDIA) PVT. LTD.","Under examination of SEIAA - Processed offline","EC",NA
"1247",6,"SIA/KL/NCP/65628/2017","1140/EC/SEIAA/KL/2017","Amendment to Environmental Clearance for the Proposed Residential Project to be developed by M/s Malabar Developers Pvt. Ltd.","M/S MALABAR DEVELOPERS PRIVATE LIMITED","Delisted","EC",NA
"1248",7,"SIA/KL/MIN/438095/2023","2033/EC2/2022/SEIAA","Granite Building Stone Quarry of M/s.Perattur Rocks N Sands","SUKUMARAN EROOLKUNNUMMAL","Site Visit by SEAC(Pending)","EC",NA
"1249",8,"SIA/KL/MIN/430102/2023","2292/EC4/2023/SEIAA","Laterite Building Stone Quarry of K V Krishnan","KEZHE VEETTIL KRISHNAN","Awaiting EC","EC",NA
"1250",9,"SIA/KL/MIN/72365/2018","1174/EC/SEIAA/KL/2018","Building Stone Quarry of Mr. T.P Abdul Hameed","BUILDING STONE QUARRY OF MR T P ABDUL HAMEED","Under examination of SEIAA - Processed offline","EC",NA
"1251",10,"SIA/KL/MIN/434229/2023","2307/EC1/2023/SEIAA","GRANITE BUILDING STONE QUARRY OF M/S.  EMPIRE CRUSHERS PRIVATE LIMITED","EMPIRE CRUSHERS PRIVATE LIMITED","Agenda Uploaded by SEAC","EC",NA
"1252",5,"SIA/KL/MIN/179900/2020","","GRANITE BUILDING STONE","KORAH AND CONSULTANTS","WithdrawEC","EC",NA
"1253",9,"SIA/KL/MIN/129061/2019","1531/EC3/2019/SEIAA","Mr sabu Varghese Managing Partner M/s Kuriakose Granites","SABUVARGHESE","EC Granted","EC",NA
"1254",8,"SIA/KL/MIN/409822/2022","2161/EC1/2022/SEIAA","Granite building stone quarry of Thomas Varghese","THOMAS VARGHESE","Delisted","EC",NA
"1255",9,"SIA/KL/NCP/65445/2017","1138/EC/SEIAA/KL/2017","Environmental Clearance for expansion of existing hospital campus Project developed by M/s Jubilee Mission Medical College & Research Institute","JUBILEE MISSION MEDICAL COLLEGE & RESEARCH INSTITUTE","Delisted","EC",NA
"1256",10,"SIA/KL/MIN/93359/2019","1239/EC2/2019/SEIAA","Quarry owned by Ummer Kutty K","IGT PVT LTD","EC Granted - Processed offline","EC",NA
"1257",4,"SIA/KL/MIS/132525/2019","1663/EC1/2020/SEIAA","Environmental Clearance for the proposed construction within the existing campus of Govt. Medical College, Thiruvananthapuram to be developed by Department of Health & Family Welfare, Govt. of Kerala","GOVT. MEDICAL COLLEGE, THIRUVANANTHAPURAM","EC Granted","EC",NA
"1258",6,"SIA/KL/MIN/129777/2019","1561/EC1/2019/SEIAA","Granite Building Stone Quarry of Mr. Haridasan.T","GRANITE BUILDING STONE QAURRY OF MR. HARIDASAN.T","EC Granted","EC",NA
"1259",8,"SIA/KL/MIN/136195/2020","1587 (A)/EC3/2020/SEIAA","Mr Babu Jacob Director M/s Mannari Granites Pvt Ltd Pulparayil House Mannathoor P O Muvattupuzha","BABU   JACOB","EC Granted","EC",NA
"1260",10,"SIA/KL/MIN/130246/2019","1582/EC2/2019/SEIAA","Granite Building Stone Quarry of Mr.K.V Thaj","GRANITE BUILDING STONE QUARRY OF MR K.V THAJ","EC Granted","EC",NA
"1261",2,"SIA/KL/MIN/260217/2022","","OTTAPALAM TALUK KARINKAL QUARRY OPERATORS","OTTAPPALAM TALUK KARINKAL QUARRY OPERATORS INDUSTRIAL CO-OPERATIVE SOCIETY","WithdrawEC","EC",NA
"1262",3,"SIA/KL/MIN/53095/2020","1668/EC6/2020/SEIAA","Proposed Granite Building Stone Quarry of Ernad Associates","GRANITE BUILDING STONE QUARRY OF M/S ERNAD ASSOCIATES","Agenda Uploaded by SEAC","EC",NA
"1263",8,"SIA/KL/MIN/148227/2020","1648/EC4/2020/SEIAA","Laterite Building Stone Quarry of Mr. Aneesh P.V","LATERITE BUILDING STONE QUARRY OF MR ANEESH P.V","EC Granted","EC",NA
"1264",1,"SIA/KL/MIN/265640/2022","1277/EC2/2019/SEIAA","GRANITE BUILDING STONE","BUILDING STONE QUARRY OF MICHAEL GRANITES","EC Granted","EC",NA
"1265",9,"SIA/KL/NCP/30819/2018","","","ADLUX MEDICITY & CONVENTION CENTRE PVT. LTD","EC Granted - Processed offline","EC",NA
"1266",2,"SIA/KL/INFRA2/447068/2023","2423/EC2/2023/SEIAA","Environmental Clearance for the Proposed Commercial Complex Project at Sy. No. 2/1B (ReSy. Nos. 2/793,794,795,796), Kedavur Village, Kattippara Panchayat, Thamarassery Taluk, Kozhikode District, Kerala by M/s Thamarassery Lands  LLP","THAMARASSERY LANDS LLP","For further consideration(SEAC)","EC",NA
"1267",3,"SIA/KL/MIN/410119/2022","2190/EC2/2023/SEIAA","Granite Building Stone Quarry of Najeem A","ALIAKBAR NAJEEM","EC Granted","EC",NA
"1268",4,"SIA/KL/MIN/426226/2023","2267/EC1/2023/SEIAA","Granite Building Stone Quarry of Ottappalam Taluk Karinkal Quarry Operators Industrial  Co-operative Society Limited","OTTAPPALAM TALUK KARINKAL QUARRY OPERATORS INDUSTRIAL CO-OPERATIVE SOCIETY","Agenda Uploaded by SEIAA","EC",NA
"1269",5,"SIA/KL/INFRA2/441661/2023","2393/EC1/2023/SEIAA","Expansion of Commercial Building in Ward No: 31 at Tirur Municipality","PARAPPURATH HAJI","For further consideration(SEAC)","EC",NA
"1270",6,"SIA/KL/MIN/64845/2017","1136/EC/SEIAA/KL/2017","STONE QUARRY OF HABEEBU RAHIMAN","HABEEB RAHMAN","Site Visit by SEAC - EC ISSUED 79","EC",NA
"1271",7,"SIA/KL/MIN/445784/2023","","Granite Building Stone Quarry of Mr.Habeebu Rahiman P.M (Reappraisal of EC from DEIAA)","QUARRY OF HABEEBU RAHIMAN","Pending at PP due to eds","EC",NA
"1272",8,"SIA/KL/MIN/440361/2023","2184/EC1/2023/SEIAA","Granite Building Stone Quarry of M/s.Amayoor Granites","AMAYOOR GRANITES","Agenda Uploaded by SEAC","EC",NA
"1273",9,"SIA/KL/NCP/50466/2016","","Environmental Clearance for the Proposed Residential Project to be developed by M/s Kalyan Jewellers India Pvt. Ltd.","KALYAN JEWELLERS INDIA PVT LTD","Delisted","EC",NA
"1274",10,"SIA/KL/MIN/446941/2023","","M/s. Rahmath Granite Crushers","RAHMATH GRANITE CRUSHERS","Pending at PP due to eds","EC",NA
"1275",10,"SIA/KL/MIN/149391/2020","1651/EC4/2020/SEIAA","LATERITE BUILDING STONE QUARRY OF MR VINEESH","LATERITE BUILDING STONE QUARRY OF MR VINEESH","Delisted","EC",NA
"1276",6,"SIA/KL/MIN/63191/2017","1131/EC/SEIAA/KL/2017","Building Stone Quarry Of Mr. Shajith V.P","QUARRY OF MR SHAJITH","Site Visit by SEAC - EC ISSUED BY 80 SEIAA","EC",NA
"1277",6,"SIA/KL/MIN/265633/2022","2804/EC2/2019/SEIAA","GRANITE BUILDING STONE QUARRY OF SRI THRESSIAMA THOMAS","THRESSIAMMA THOMAS","EC Granted","EC",NA
"1278",3,"SIA/KL/NCP/37129/2015","1067/EC4/2016/SEIAA","Environment Clearance for Proposed Commercial Complex Project (“4-M Mall”) to be developed by Mr. K.V. JOSE","K V JOSE","Accepted By SEAC - EC ISSUED IN 74 SEIAA MEETING","EC",NA
"1279",4,"SIA/KL/MIN/434282/2023","2377/EC4/2023/SEIAA","Granite Building stone Quarry of Mr.Sreejith M S","MARUNVATHAMKAL SREEJITH","For further consideration(SEAC)","EC",NA
"1280",5,"SIA/KL/MIN/92857/2019","1232/EC2/2019/SEIAA","Granite Bilding Stone Quarry of Mr Roby P K","HARITHA CONSULTANTS","Delisted","EC",NA
"1281",6,"SIA/KL/MIN/440610/2023","1788/EC2/2020/SEIAA","M/s Pulpally Stone Crushers","MS PULPALLY STONE CRUSHERS","EC Granted","EC",NA
"1282",7,"SIA/KL/MIN/451721/2023","2455/EC2/2023/SEIAA","Laterite Building Stone Quarry of Mr. Kunhimuhammed","KUNHIMUHAMMED","For further consideration(SEAC)","EC",NA
"1283",4,"SIA/KL/MIN/32452/2019","1481/EC3/2019/SEIAA","Stone Quar","NATTANPARA METALS LLP","EC Granted","EC",NA
"1284",6,"SIA/KL/MIN/182038/2020","","Bharathapuzha River Basin Kadavu 15","BHARATHAPUZHA RIVER BASIN","Delisted","EC",NA
"1285",5,"SIA/KL/MIN/404161/2022","2152/EC4/2022/SEIAA","Granite Building Stone Quarry of Mr. Abdul Gafoor","ABDUL GAFOOR","Delisted","EC",NA
"1286",6,"SIA/KL/NCP/60959/2016","1118/EC/SEIAA/KL/2017","Environmental Clearance for the Proposed Residential (“Aura Esta”) Project by M/s Midhun Markose Builders and Developers India Pvt. Ltd.","MIDHUN MARKOSE BUILDERS AND DEVELOPERS INDIA PVT. LTD.","Delisted","EC",NA
"1287",10,"SIA/KL/MIN/266045/2022","2047/EC1/2022/SEIAA","GRANITE BUILDING STONE QUARRY OF MANNARKKAD TALUK KARINKAL QUARRY OPERATORS INDUSTRIAL CO OPERATIVE SOCIETY LTD","MANNARKKAD TALUK QUARY OPERATORS INDUSTRIAL COOPERATIVE SOCIETY LTD","Delisted","EC",NA
"1288",1,"SIA/KL/MIN/429631/2023","2276/EC4/2023/SEIAA","Laterite Building Stone Quarry of Saibunnessa Ismail","SAIBUNNEESA ISMAIL","Awaiting EC","EC",NA
"1289",2,"SIA/KL/MIN/94447/2019","1260/EC2/2019/SEIAA","Building Stone Quarry of M/s K.T Crushers & Aggregates Pvt. Ltd","BUILDING STONE QUARRY OF M/S K.T CRUSHERS & AGGREGATES PVT. LTD","Under examination of SEIAA - Processed offline","EC",NA
"1290",3,"SIA/KL/MIN/402921/2022","2146/EC3/2022/SEIAA","GRANITE BUILDING STONE QUARRY OF SRI. K. J. THOMASKUTTY","THOMASKUTTY KANNAMTHANAMJOSEPH","EC Granted","EC",NA
"1291",4,"SIA/KL/MIN/447663/2023","2484/EC2/2023/SEIAA","Granite Building Stone Quarry of Mr.Vinay James Kynadi(Reappraisal of EC from DEIAA to SEIAA)","VINAY KYNADI","Accepted By SEAC","EC",NA
"1292",5,"SIA/KL/MIN/425079/2023","2306/EC4/2023/SEIAA","Laterite Building Stone Quarry of Unnikrishnan P","UNNIKRISHNAN PALAKKIL","Awaiting EC","EC",NA
"1293",6,"SIA/KL/MIN/452003/2023","","Granite Building Stone Quarry of Shri. Biju Thomas","BIJU THOMAS","Pending at PP due to eds","EC",NA
"1294",7,"SIA/KL/MIN/90345/2019","1205/EC1/2018/SEIAA","Granite Building Stone Quarry of M/s.Vismaya Rock Products","GRANITE BUILDING STONE QUARRY OF VISMAYA ROCKS PRIVATE LIMITED","WithdrawEC","EC",NA
"1295",8,"SIA/KL/MIN/446706/2023","2404/EC1/2023/SEIAA","Laterite Building Stone Quarry of Muhammad Rajil","MUHAMMAD RAJIL","Site Visit by SEAC(Pending)","EC",NA
"1296",9,"SIA/KL/MIN/412128/2022","","Laterite Building Stone of Prasad K M","KOOVAYIL MADAPPURAKKAL PRASAD","WithdrawEC","EC",NA
"1297",10,"SIA/KL/MIN/411459/2022","2197/EC2/2023/SEIAA","Laterite building stone quarry project of Vijayan. H","HOSADEVASTHANA VIJAYAN","EC Granted","EC",NA
"1298",1,"SIA/KL/MIN/418896/2023","2220/EC1/2023/SEIAA","Laterite building stone quarry of Mr. Sahajan. P","PETTIKUZHI SAHAJAN","EC Granted","EC",NA
"1299",2,"SIA/KL/MIN/407901/2022","1812/EC3/2020/SEIAA","Granite Building Stone Quarry Project","JOSEPH VARKEY","Awaiting EC","EC",NA
"1300",3,"SIA/KL/MIN/440531/2023","2361/EC4/2023/SEIAA","Laterite Building Stone Quarry of Suresh K","KAZHAKAKKARAN SURESH","Agenda Uploaded by SEAC","EC",NA
"1301",4,"SIA/KL/MIN/41951/2016","","Building Stone quarry of M/s New Pannippara Bricks & Metals","OVERSEAS MINTECH CONSULTANT PVT LTD","TransferToDEIAA","EC",NA
"1302",5,"SIA/KL/MIN/405925/2022","1527/EC1/2019/SEIAA","Granite building Stone Quarry of Shri. K M Stephen","SHRI. K. M. STEPHEN","Awaiting EC","EC",NA
"1303",3,"SIA/KL/MIN/181270/2020","","File Transferring to ToR to EC Proponent is Bobby Joseph","KORAH AND CONSULTANTS","WithdrawEC","EC",NA
"1304",4,"SIA/KL/MIN/183924/2020","","Bharathapuzha River Basin Kadavu 22","BHARATHAPUZHA RIVER BASIN","Delisted","EC",NA
"1305",3,"SIA/KL/MIN/141204/2020","1802/EC6/2020/SEIAA","Muhammed Shafi C T","MUHAMMED SHAFI C T","Rejection Letter Granted","EC",NA
"1306",8,"SIA/KL/NCP/60202/2016","1104/EC/SEIAA/KL/2017","Environmental Clearance for proposed Hospital Project to be developed by M/s Nilambur Hospitals Pvt. Ltd.","NILAMBUR HOSPITALS PVT LTD","Site Visit by SEAC - EC ISSUED BY 81 SEIAA","EC",NA
"1307",9,"SIA/KL/MIN/40868/2019","1447/EC2/2019/SEIAA","QUARRY UNI","QUARRY UNIT OF MR. K.M. SALIM","Referred Back to SEAC(A)","EC",NA
"1308",6,"SIA/KL/MIN/453860/2023","2476/EC3/2023/SEIAA","Laterite Building Stone Quarry of  Mr.Manikandan  P. V","MANIKANDAN VELAYUDHAN","Accepted By SEAC","EC",NA
"1309",1,"SIA/KL/NCP/56905/2016","","Environmental Clearance for the Proposed Residential Project by M/s Noel Villas & Apartments","NOEL VILLAS AND APARTMENTS","WithdrawEC","EC",NA
"1310",2,"SIA/KL/MIN/407128/2022","2154/EC3/2022/SEIAA","NISSAMUDEEN K S","NISSAMUDHEEN","Agenda Uploaded by SEAC","EC",NA
"1311",3,"SIA/KL/MIN/94364/2019","1259/EC2/2019/SEIAA","BUILDING STONE QUARRY OF M/S VIGNESWARA GRANITES","BUILDING STONE QUARRY OF VIGNESWARA GRANITES","EC Granted - Processed offline","EC",NA
"1312",4,"SIA/KL/NCP/70680/2017","1159/EC/SEIAA/KL/2017","Environmental Clearance for the proposed building construction of Working Women’s Hostel Project by Kerala State Housing Board","KERALA STATE HOUSING BOARD","Delisted","EC",NA
"1313",5,"SIA/KL/MIN/57256/2016","1105/EC/SEIAA/KL/2017","Building Stone Quarry","MS VAZHATHARA GRANITES AND AGGREGATES PVT LTD","Delisted","EC",NA
"1314",6,"SIA/KL/MIN/454227/2023","","Granite Building Stone Quarry of Mr.Shafir .P (Reappraisal of EC from DEIAA as per OM dated 28/4/2023)","SHAFIR POYILAN","Pending at PP due to eds","EC",NA
"1315",7,"SIA/KL/MIN/436307/2023","2360/EC4/2023/SEIAA","Laterite Building Stone Quarry of Ajikumar ATV","AJIKUMAR VEETIL","Agenda Uploaded by SEAC","EC",NA
"1316",8,"SIA/KL/MIN/93594/2019","1245/EC2/2019/SEIAA","GRANITE STONE QUARRY OF MR.ABDUL SALAM K.T KAVANUR","GRANITE(BUILDING STONE) QUARRY OF MR. ABDUL SALAM","EC Granted - Processed offline","EC",NA
"1317",9,"SIA/KL/MIN/433176/2023","2312/EC2/2023/SEIAA","Laterite Building Stone Quarry of Mr. K. Raveendran","KANHANGAD RAVEENDRA","Agenda Uploaded by SEIAA","EC",NA
"1318",10,"SIA/KL/MIN/452277/2023","2464/EC4/2023/SEIAA","Laterite Building Stone Quarry of Subin Thomas","SUBIN VAZHAKUZHA","Accepted By SEAC","EC",NA
"1319",2,"SIA/KL/MIN/144086/2020","1597/EC4/2020/SEIAA","Laterite building stone quarry of Mr Ramachandran.P","LATERITE BUILDING STONE QUARRY OF MR. RAMACHANDRAN P.","EC Granted","EC",NA
"1320",3,"SIA/KL/MIN/169224/2020","","Granite Building stone Quarry of Mr.Noushad (conversion ToR to EC)","BUILDING STONE QUARRY OF MR NOUSHAD","Delisted","EC",NA
"1321",8,"SIA/KL/MIN/405320/2022","","LATERITE BUILDING STONE QUARRY OF H. HARISH SHETTY","HOSABETTU SHETTY","Pending at PP due to eds","EC",NA
"1322",1,"SIA/KL/MIN/93810/2019","1249/EC2/2019/SEIAA","GRANITE BUILDING STONE QUARRY OF Mr KRISHEEB MR","GRANITE BUILDING STONE QUARRY OF MR KRISHEEB MR","Rejected - Processed offline","EC",NA
"1323",2,"SIA/KL/MIN/58604/2016","","AL-MADEENA HOLLOW BLOCKS","AL MADEENA HOLLOW BLOCKS","TransferToDEIAA","EC",NA
"1324",3,"SIA/KL/MIN/95144/2019","1269/EC2/2019/SEIAA","Abdul Gafoor","ABDUL GAFOOR QUARRY","EC Granted - Processed offline","EC",NA
"1325",4,"SIA/KL/MIN/450543/2023","2475/EC3/2023/SEIAA","Granite Building Stone Quarry of M/s BTL Rocks & Minerals (Reappraisal of EC from SEIAA as per OM dated 28/4/2023)","BTL ROCKS AND MINERALS","Accepted By SEAC","EC",NA
"1326",1,"SIA/KL/MIN/59109/2016","","SURYA GRANITES","AL MADEENA HOLLOW BLOCKS","TransferToDEIAA","EC",NA
