,Sno.,Proposal No.,File No.,Project Name,Company,Proposal Status,Project Type,View
8,639,SIA/PB/IND3/246448/2021,SEIAA/PB/IND/2022/EC/06,"M/s Akums Life Sciences Ltd. at Free Enterprise Zone in Village Sundran, Mubarakpur, Derabassi, Punjab, India",AKUMS LIFESCIENCES LIMITED,EC Granted,EC,
9,640,SIA/PB/NCP/75343/2018,SEIAA/PB/NCP/EC/2018/11,sushma prestine,DREAMCITY REALTORS PVT LTD,EC Granted,EC,
0,641,SIA/PB/MIS/266649/2022,,"Building & Construction Project “Atal Apartments” located at Shaheed Karnail Singh Nagar, Pakhowal Road, Ludhiana, Punjab by Ludhiana Improvement Trust.",SAT SACHDEVA,Pending at PP due to eds,EC,
1,642,SIA/PB/INFRA2/432318/2023,SEIAA/PB/MIS/2023/EC/18,UMBERA ORCHARD APARTMENTS,UMBERA GROUP,Under examination of SEAC,EC,
2,643,SIA/PB/NCP/52903/2016,SEIAA/PB/NCP/BC/EC/2016/26,"Judicial Court Complex-cum-District Administrative Complex, Tarn Taran",PUBLIC WORKS DEPTT BUILDING AND ROADS,Delisted,EC,
3,644,SIA/PB/IND2/31084/2017,,Expansion of Sugar Mill (7000 TCD to 12000 TCD) and Co-generation power plant 37MW,A B SUGARS LTD,WithdrawEC,EC,
4,645,SIA/PB/MIS/244741/2021,SEIAA/PB/MIS/2021/EC(Exp)/07,PRESTIGE TOWER,VERA DEVELOPERS PVT LTD,ADS by SEAC,EC,
5,646,SIA/PB/MIN/177777/2020,SEIAA/PB/MIN/EC/2020/25,Chamb Sand mining Project,PRIME VISION INDUSTRIES PVT LTD,EC Granted,EC,
6,647,SIA/PB/NCP/87900/2018,SEIAA/PB/NCP/EC/2019/01,UMBERA HOMEZ,UMBERA GROUP,EC Granted,EC,
7,648,SIA/PB/MIN/42321/2016,,ANIL AND CO VILLAGE KHUDAL KALAN TEHSIL BUDHLADA DISTT MANSA,ANIL KUMAR AND CO,Delisted,EC,
8,649,SIA/PB/NCP/90237/2019,SEIAA/PB/NCP/2021/EC/02,"Group Housing Project “MUIRWOODS ECO-GLADES” in Residential Township (“MUIRWOODS ECOCITY”), New Chandigarh, District SAS Nagar (Mohali), Punjab by M/s. Altus Space Builders Pvt. Ltd.",M/S ALTUS SPACE BUILDERS PVT. LTD.,Delisted,EC,
9,650,SIA/PB/MIS/235639/2021,SEIAA/PB/MIS/2022/EC/02,CENTRAL STREET,ALAKNANDA ENTERPRISES,EC Granted,EC,
0,651,SIA/PB/INFRA2/432906/2023,,ATAL APARTMENTS (HIG-MIG),SAT SACHDEVA,Pending at PP due to eds,EC,
1,652,SIA/PB/MIS/161556/2020,,Uptown Skylla,ARTIQUE INFRATECH,WithdrawEC,EC,
2,653,SIA/PB/MIN/37216/2015,,"SHREE GANESH BRICK KILN VILLAGE JAITU, TEHSIL KOTKAPURA, DISTT. FARIDKOT",SHREE GANESH BRICK KILLAN,Delisted,EC,
3,654,SIA/PB/MIN/37229/2015,,"JAITU BKO, VILLAGE JAITU, BATHINDA ROAD, TEHSIL KOTKAPURA, DISTT. FARIDKOT",JAITU BKO,Delisted,EC,
4,655,SIA/PB/NCP/74901/2018,SEIAA/PB/NCP/2018/EC/17,EL-SPAZIA,ALLWIN INFRASTRUCTURE LTD,EC Granted,EC,
5,656,SIA/PB/IND2/214088/2021,,"Proposed Expansion in distillery unit from 120 KLPD to 192 KLPD ofalcohol (40KLPD RS/ENA and 152 KLPD of Ethanol) Village Sangat Kalan, Tehsil and District-Bathinda, Punjab by M/s. Om Sons Marketing Private Limited.",M/S OM SONS MARKETING PRIVATE LIMITED,Delisted,EC,
6,657,SIA/PB/MIN/145209/2020,SEIAA/PB/MIN/EC/2020/16,Sand Mining Project,M/S MAHADEV ENCLAVE PRIVATE LIMITED,Delisted,EC,
7,658,SIA/PB/MIS/115414/2019,SEIAA/PB/NCP/EC/2019/24,The Eastern Park by Garav Basera,GAURAV LAND DEVELOPER,EC Granted,EC,
8,659,SIA/PB/NCP/63271/2017,SEIAA/PB/NCP/EC/2017/7,AGI Smart Homes,A G I INFRA LIMITED,EC Granted,EC,
9,660,SIA/PB/MIS/270773/2022,SEIAA/PB/MIS/2022/EC/20,AGI Sky Villas by AGI Infra Limited at Village Dad Pakhowal road Tehsil and District Ludhiana Punjab,AGI INFRA LIMITED,EC Granted,EC,
0,661,SIA/PB/MIS/284629/2022,SEIAA/PB/MIS/2022/EC/27,"Commercial Project “Fintech Square” at CP-2 Industrial Focal Point, Phase-8A, Sector-75, Mohali (Punjab) by M/s VRS Infrastructures",VRS INFRASTRUCTURES,EC Granted,EC,
1,662,SIA/PB/IND1/401374/2022,SEIAA/PB/IND/2022/EC/19,"Shree Punjab Cement Plant (Clinker Grinding Unit) with cement production capacity of 5.0 Million TPA and D.G. Sets of 1250 KVA {1000 KVA or (2 x 500 KVA) & 250 KVA} along with Railway Siding at Village: Deh-Kalan, Tehsil & District: Sangrur (Punjab) by Shree Cement North Private Limited",SHREE CEMENT NORTH PRIVATE LIMITED,ADS by SEAC,EC,
2,663,SIA/PB/INFRA2/426534/2023,SEIAA/PB/MIS/2023/EC/11,Residential Plotted Project namely “Amulyam” by M/s SRV Infrastructure,SRV INFRASTRUCTURE,ADS by SEAC,EC,
3,664,SIA/PB/NCP/58465/2016,SEIAA/PB/NCP/EC/2016/32,"Group Housing Project “City Of Dreams - II” located at Village Sante Majra, Sector-116, Kharar, Distt. SAS Nagar (Greater Mohali), Punjab",CREDO ASSETS PRIVATE LIMITED,EC Granted,EC,
4,665,SIA/PB/MIN/42603/2016,,Mining of Brick Earth in Village Hiyatpur by m/s K S Bricks,K S BRICKS,Delisted,EC,
5,666,SIA/PB/MIN/39192/2019,,"Mining of Sand from River Sutlej situated in Village Molana, District Rupnagar, Punjab proposed by M/s Kuldeep Singh & Bros",M/S KULDEEP SINGH & BROS,Pending at PP due to eds,EC,
6,667,SIA/PB/INFRA2/429960/2023,SEIAA/PB/MIS/2023/EC/16,"Expansion of SUNTEC CITY by M/s.The India Co-op Housing building society LTD located at village Palheri (H.B. No. 173), Tehsil-Kharar and village Raihmanpur (H.B. No.172), Tehsil-Majri, District-SAS Nagar, New Chandigarh, Punjab",SUNTEC CITY BY M/S. THE INDIAN CO-OP HOUSE BUILDING SOCIETY LTD,Under examination of SEAC,EC,
7,668,SIA/PB/MIN/50694/2016,,M/s Sachdeva Brods BKO,SACHDEVA BROTHER BKO,Delisted,EC,
8,669,SIA/PB/MIN/34678/2015,,"Proposed Brick Clay Mining Project for M/s Batra Industries at Village Tutwala, Teh. Abohar, District- Fazilka, Punjab",BATRA INDUSTRIES,Delisted,EC,
9,670,SIA/PB/NCP/25677/2018,SEIAA/PB/NCP/EIA/2018/05,Devlopment of Township namely IT City,GREATER MOHALI AREA DEVELOPMENT AUTHORITY GMADA,EC Granted,EC,
0,671,SIA/PB/INFRA2/432456/2023,,Residential Township project namely “Janta Township” by M/s Janta Land Promoters Pvt. Ltd.,JANTA LAND PROMOTERS PVT. LTD.,Pending at PP due to eds,EC,
1,672,SIA/PB/MIN/36938/2015,,MODERN BKO MINING SITE AT VILL PANJGRAIN KALAN KOTKAPURA,MODERN BKO,Delisted,EC,
2,673,SIA/PB/IND2/204489/2021,,"Proposed installation of 200 KLPD grain based Ethanol Plant (Biofuel) and 10 MW of Power Cogeneration at the existing grain based distillery plant located at Village Machhana and Sangat Kalan, Tehsil Sangat, District Bathinda, Punjab",BCL INDUSTRIES LTD.,Delisted,EC,
3,674,SIA/PB/NCP/62471/2017,SEIAA/PB/NCP/EC/2018/03,INDIA TRADE TOWER & INTERNATIONAL TRADE TOWER,BHANU INFRABUILD PVT LIMITED,EC Granted,EC,
4,675,SIA/PB/IND3/247434/2021,SEIAA/PB/IND/2022/EC/08,"M/s Akums Lifesciences Ltd. at Village Chhachrauli, Tehsil Derabassi, Distt. Mohali, Punjab, India.",AKUMS LIFESCIENCES LIMITED,EC Granted,EC,
5,676,SIA/PB/INFRA2/405718/2022,SEIAA/PB/MIS/2022/EC/38,JUBILEE WESTGROVE,JUBILEE JOY HOMES LLP,ADS by SEAC,EC,
6,677,SIA/PB/NCP/52903/2016,SEIAA/PB/NCP/BC/EC/2016/26,"Judicial Court Complex-cum-District Administrative Complex, Tarn Taran",PUBLIC WORKS DEPTT BUILDING AND ROADS,Delisted,EC,
7,678,SIA/PB/MIN/151329/2020,,"Maulana Gravel Mine” Block No. – 1, Hadbast No. –110, having total area of 1.30 hectare (Non- Forest), proposed production 32612.26MT Khasra No.–21//6/2, 15, 16/1, 22//10/2, 11, 20/1.  in Village – Ma",RAKESH GRAVEL MINE,Delisted,EC,
8,679,SIA/PB/NCP/87900/2018,SEIAA/PB/NCP/EC/2019/01,UMBERA HOMEZ,UMBERA GROUP,EC Granted,EC,
9,680,SIA/PB/MIN/42321/2016,,ANIL AND CO VILLAGE KHUDAL KALAN TEHSIL BUDHLADA DISTT MANSA,ANIL KUMAR AND CO,Delisted,EC,
0,681,SIA/PB/NCP/75990/2018,,Development of Business Park,RITESH PROPERTIES AND INDUSTRIES LIMITED,Delisted,EC,
1,682,SIA/PB/INFRA2/433564/2023,,MK HARMONY,MAHAKALI DEVELOPERS & RESORTS PRIVATE LIMITED,Pending at PP due to eds,EC,
2,683,SIA/PB/MIS/268615/2022,SEIAA/PB/MIS/2022/EC/25,"Affordable Group Housing Project at H.B no. 54, Village Kishanpura, Zirakpur, Distt. SAS Nagar, Punjab by M/s Nandita Apartments and Land Developers Private Limited",NANDITA APARTMENTS AND LAND DEVELOPERS PRIVATE LIMITED,EC Granted,EC,
3,684,SIA/PB/IND/28850/2017,SEIAA/PB/IND/EIA/2018/02,M/s R.P. Multimetals (P) Limited,RP MULTIMETALS PRIVATE LIMITED,EC Granted,EC,
4,685,SIA/PB/INFRA2/413995/2023,SEIAA/PB/MIS/2023/EC/02,"M/s Spirit Infratech Private Limited  located at Ajnala road, near International Airport, Amritsar, Punjab.",M/S SPIRIT INFRATECH PVT. LTD.,EC Granted,EC,
5,686,SIA/PB/MIN/434489/2023,,"Gillanwala Sand Mining Project, Executive Engineer/Ferozepur, Drainage-Cum-Mining & Geology Division Water Resources Department, Ferozepur, Punjab",EXECUTIVE ENGINEER CUM DISTRICT MINING OFFICER GOLEWALA DRAINGE DIVISION,Under examination of SEIAA,EC,
6,687,SIA/PB/MIS/201862/2021,SEIAA/PB/MIS/EC/02,Mohali Citi Centre,M/S KLG JEWELLERS,EC Granted,EC,
7,688,SIA/PB/IND/63124/2020,SEIAA/PB/IND/EC/10,"Expansion in the existing Steel Manufacturing Unit namely ""M/s J.N. Tayal Steels Private Limited"" at village- Bhagwanpura, Dehlon road, Tehsil- Ludhiana East, District- Ludhiana, Punjab",M/S J.N. TAYAL STEELS (P) LTD.,EC Granted,EC,
8,689,SIA/PB/IND/74668/2021,SEIAA/PB/IND/2022/EC/12,Expansion in the existing Steel Manufacturing Unit Surya Steel Industries at Village Ambey Majra Mandi Gobindgarh Tehsil Amloh District Fatehgarh Sahib,M/S SURYA STEEL INDUSTRIES,EC Granted,EC,
9,690,SIA/PB/MIN/42017/2016,,Brick Earth Minning,HARBANS LAL AND SONS,Delisted,EC,
0,691,SIA/PB/NCP/63271/2017,SEIAA/PB/NCP/EC/2017/7,AGI Smart Homes,A G I INFRA LIMITED,EC Granted,EC,
1,692,SIA/PB/MIN/35360/2015,,"earth mining for brick killn in the revenue estate of vill. karhali,tehsil and distt. patiala by m/s siddhi vinayak bko,mardaheri.",SIDHI VINAYAK  BKO,Delisted,EC,
2,693,SIA/PB/MIS/82403/2020,SEIAA/PB/MIS/2022/EC/31,,SUNTEC CITY BY M/S. THE INDIAN CO-OP HOUSE BUILDING SOCIETY LTD,Request for withdraw,EC,
3,694,SIA/PB/MIN/35724/2015,,"Mining of Clay by GS Chahal BKO Jatwahar Prop Rajiv Soni, Tehsil Anandpur Sahib . District Ropar 140199",G S CHAHAL BKO JATWAHAR,Delisted,EC,
4,695,SIA/PB/NCP/75718/2018,,Gaurav Basera,GAURAV LAND DEVELOPER,WithdrawEC,EC,
5,696,SIA/PB/NCP/31425/2015,,"Construction of Commercial Building GBP Centrum, Proponent Gupta Builders and Promoters Pvt Ltd",GUPTA BUILDERS AND PROMOTERS PVT LIMITED,Delisted,EC,
6,697,SIA/PB/MIN/37056/2015,,THE DEEPAK GRAM UDYOG SAMITI MINING SITE AT DHUDHI FARIDKOT,THE DEEPAK GRAM UDYOG SAMITI,Delisted,EC,
7,698,SIA/PB/MIS/270773/2022,SEIAA/PB/MIS/2022/EC/20,AGI Sky Villas by AGI Infra Limited at Village Dad Pakhowal road Tehsil and District Ludhiana Punjab,AGI INFRA LIMITED,EC Granted,EC,
8,699,SIA/PB/MIN/415348/2023,SEIAA/PB/MIN/2023/EC/02,"Behak Hasta Uttar/Ghurka Sand Mining Project by Executive Engineer Cum District Mining Officer, Drainage-Cum-Mining & Geology Division, Water Resources Department, Fazilka Division",EXECUTIVE ENGINEER CUM DISTRICT MINING OFFICER DRAINAGE CONST DIV FAZILKA,EC Granted,EC,
9,700,SIA/PB/MIN/434650/2023,,"Rampur/Thamuwal Sand Mining Project by Executive Engineer/Jalandhar, Drainage-Cum-Mining & Geology Division Water Resources Department, Jalandhar, Punjab",EXECUTIVE ENGINEER -CUM- DISTRICT MINING OFFICER JALANDHAR,Under examination of SEIAA,EC,
0,701,SIA/PB/MIS/246234/2021,SEIAA/PB/MIS/2022/EC/01,"Jalandhar Heights-III by M/s AGI Infra Limited at Village- Phollriwal (H.B.NO.-52), Tehsil- Jalandhar,  District- Jalandhar, Punjab.",ASHWANI KANT,EC Granted,EC,
1,702,SIA/PB/MIS/265451/2022,SEIAA/PB/MIS/2022/EC/17,"Commercial Project “Mohali Citi Centre Walk” (5.69 acres) at Pocket No. 2, Block-E, Aerocity, SAS Nagar, Punjab by KLG Infra.",KLG INFRA,EC Granted,EC,
2,703,SIA/PB/MIN/37194/2015,,earth mining for brick killin in the revenue estate of vill. hakimpur tehsil bharso distt. patiala by gupta bricks industries.,GUPTA BRICKS INDUSTRIES,Delisted,EC,
3,704,SIA/PB/IND/42770/2018,SEIAA/PB/IND/EC/2020/24,"Expansion of Steel Manufacturing Unit namely ""Punjab Steel Forging & Agro Industries"" located at GT Road, Khanna side, Mandi Gobindgarh, District- Fatehgarh Sahib, Punjab",M/S PUNJAB STEEL FORGING & AGRO INDUSTRIES,EC Granted,EC,
4,705,SIA/PB/MIN/60702/2016,SEIAA/PB/MINING(NON-COAL)/EC/2017/13,chakli kasab sand mining project,DIC LUDHIANA,EC Granted,EC,
5,706,SIA/PB/IND2/28816/2016,SEIAA/PB/IND/EIA /2018/03,"EIA / RA STUDY FOR INSTALLATION OF PETROLEUM STORAGE TANKS FOR STORAGE CAPACITY  AUGMENTATION AT IOCL PETROLEUM TERMINAL,  VILLAGE KAMMOMAJRA KHURD, JIND ROAD SANGRUR, PUNJAB",INDIAN OIL CORPORATION LTD PUNJAB,Delisted,EC,
6,707,SIA/PB/MIN/37794/2016,,EARTH MINING FOR BRICK KILLN IN THE REVENUE ESTATE OF VILL. JAWALAPUR TEHSIL PATRAN BY MOHAN LAL GURNAM SINGH,MOHAN LAL GURNAM SINGH,Delisted,EC,
7,708,SIA/PB/MIN/34160/2015,,PUNJAB  BRICKS,MILHKI RAM BKO,WithdrawEC,EC,
8,709,SIA/PB/MIS/288363/2022,SEIAA/PB/MIS/2022/EC/29,"Sohana Hospital located at Sector-77, Mohali, Punjab by Shri Guru Harkrishan Sahib C Eye Hospital Trust.",SRI GURU HARKRISHAN SAHIB C EYE HOSPITAL TRUST,EC Granted,EC,
9,710,SIA/PB/MIN/36938/2015,,MODERN BKO MINING SITE AT VILL PANJGRAIN KALAN KOTKAPURA,MODERN BKO,Delisted,EC,
0,711,SIA/PB/NCP/71252/2017,SEIAA/PB/NCP/2017/EC/23,PRESTIGE TOWERS,VERA DEVELOPERS PVT LTD,EC Granted,EC,
1,712,SIA/PB/NCP/87900/2018,SEIAA/PB/NCP/EC/2019/01,UMBERA HOMEZ,UMBERA GROUP,EC Granted,EC,
2,713,SIA/PB/MIN/42321/2016,,ANIL AND CO VILLAGE KHUDAL KALAN TEHSIL BUDHLADA DISTT MANSA,ANIL KUMAR AND CO,Delisted,EC,
3,714,SIA/PB/IND/66130/2021,,,Shree Cement Ltd.,Request for withdraw,EC,
4,715,SIA/PB/MIS/290585/2022,SEIAA/PB/MIS/2022/EC/32,"Group Housing project namely “Radiance Homes” at Urban Estate Phase 2, Patiala, Punjab by M/s AVR Group",AVR GROUP,EC Granted,EC,
5,716,SIA/PB/INFRA2/432965/2023,SEIAA/PB/MIS/2023/EC/19,THE SILICON COURTYARD,HI-TECH BUILDERS & PROMOTERS,Under examination of SEAC,EC,
6,717,SIA/PB/MIN/41269/2016,,SURINDER KUMAR BATRA BKO VILLAGE ARNIWALA SEKH SUBHAN TEHSIL AND DISTT FAZILKA,SURINDER KUMAR BATRA BKO,Delisted,EC,
7,718,SIA/PB/MIN/59628/2016,SEIAA/PB/MINING(NON-COAL)/EC/2017/31,Rarra Sand mining Project,DIC HOSHIARPUR,EC Granted,EC,
8,719,SIA/PB/IND/74668/2021,SEIAA/PB/IND/2022/EC/12,Expansion in the existing Steel Manufacturing Unit Surya Steel Industries at Village Ambey Majra Mandi Gobindgarh Tehsil Amloh District Fatehgarh Sahib,M/S SURYA STEEL INDUSTRIES,EC Granted,EC,
9,720,SIA/PB/NCP/31689/2015,,PALACE ENCLAVE,PALACE INFRATECH PVT LTD,Delisted,EC,
0,721,SIA/PB/MIN/150436/2020,,"River Bed Sand Mining project Located at Village-Bhajoke, Tehsil-Patti,District –Tarn Taran, Punjab. having an area of 3.80 ha",FRIENDS AND CO.,Delisted,EC,
1,722,SIA/PB/NCP/4680/2015,,Hero Realty Pvt Ltd,HERO REALTY PVT LTD,Pending at PP due to eds,EC,
2,723,SIA/PB/IND2/10718/2015,SEIAA/PB/IND Project/EIA/2016/1,Proposed LPG Bottling Plant,INDIAN OIL CORPORATION LIMITED,EC Granted,EC,
3,724,SIA/PB/NCP/59654/2016,SEIAA/PB/NCP/EC/2016/35,GBP CAMELLIA BUSINESS CENTER,GUPTA BUILDERS AND PROMOTERS PVT LIMITED,EC Granted,EC,
4,725,SIA/PB/MIS/218932/2021,SEIAA/PB/MIS/EC/06,"Residential Group Housing namely “WMK Mid Town” at Near Gillco & SBP Colony  Village, Chajju Majra,  Tehsil Kharar, Distt. S.A.S Nagar Mohali by M/s WMK Buildtech LLP",M/S WMK BUILDTECH LLP,EC Granted,EC,
5,726,SIA/PB/IND2/15957/2016,,-1,INDIAN OIL CORPORATION LIMITED,EC Granted,EC,
6,727,SIA/PB/MIN/34503/2015,,Extraction of Brick Earth for Brick Kiln M/S Shiv Shakti BKO,SHIV SHAKTI BKO,Delisted,EC,
7,728,SIA/PB/NCP/35782/2015,SEIAA/PB/Bldg const/2015/4,HAMILTON MAYFAIR,HAMILTON LAND DEVELOPERS PVT LTD,EC Granted,EC,
8,729,SIA/PB/IND1/433862/2023,,"Proposed Steel Manufacturing Unit namely “M/s Dang Special Steels Pvt. Ltd.” at G.T Road, Doraha, Tehsil Payal, District Ludhiana, Punjab.",DANG SPECIAL STEELS PRIVATE LIMITED,Pending at PP due to eds,EC,
9,730,SIA/PB/NCP/57420/2016,SEIAA/PB/NCP/BC/EC/2016/28,ATHENS,BRAWN BUILDTECH PVT LIMITED,EC Granted,EC,
0,731,SIA/PB/IND/50002/2018,SEIAA/PB/IND/EC/2020/08,"Expansion in the existing Steel Manufacturing unit namely ""M/s Samana Concast"" located in village Tooran, Amloh road, Mandi Gobindgarh, District- Fatehgarh Sahib, Punjab",M/S SAMANA CONCAST,EC Granted,EC,
1,732,SIA/PB/MIN/42851/2016,,Maluka Bricks Industry Village Maluka Sub Tehsil Bhagta Bhaika District Bathinda,MALUKA BRICKS INDUSTRY,Delisted,EC,
2,733,SIA/PB/IND/28850/2017,SEIAA/PB/IND/EIA/2018/02,M/s R.P. Multimetals (P) Limited,RP MULTIMETALS PRIVATE LIMITED,EC Granted,EC,
3,734,SIA/PB/MIS/156308/2020,SEIAA/PB/MIS/EC/2020/10,NIRWANA HEIGHTS,EAST AVENUE INFRACON PVT LTD,EC Granted,EC,
4,735,SIA/PB/MIS/32119/2015,,RAKSHA BUSINESS CENTER,ABC SITES LIMITED,Delisted,EC,
5,736,SIA/PB/INFRA2/413995/2023,SEIAA/PB/MIS/2023/EC/02,"M/s Spirit Infratech Private Limited  located at Ajnala road, near International Airport, Amritsar, Punjab.",M/S SPIRIT INFRATECH PVT. LTD.,EC Granted,EC,
6,737,SIA/PB/MIN/434489/2023,,"Gillanwala Sand Mining Project, Executive Engineer/Ferozepur, Drainage-Cum-Mining & Geology Division Water Resources Department, Ferozepur, Punjab",EXECUTIVE ENGINEER CUM DISTRICT MINING OFFICER GOLEWALA DRAINGE DIVISION,Under examination of SEIAA,EC,
7,738,SIA/PB/MIS/36573/2015,,Rehabilitation and up-gradation of NH 64 from KM 28.110 to 50.000 (Zirkpur to Patiala section) to 4 Lane in the state of Punjab on EPC Basis under NHDP-IV on behalf of “Ministry of Road and Transport & Highways”,CENTRODORSTRY INDIA PVT LTD,Delisted,EC,
8,739,SIA/PB/MIS/61019/2018,,"Residential Pocket 1 of Super Mega Mixed Use Integrated Industrial Park namely “Falcon View” by M/s Janta Land Promoters Pvt. Ltd. at Sector- 66A, District SAS Nagar (Mohali), Punjab",JANTA LAND PROMOTERS PRIVATE LIMITED,Delisted,EC,
9,740,SIA/PB/MIN/61269/2016,SEIAA/PB/MINING(NON-COAL)/EC/2017/5,Majara kalan sand mining project,DIC LUDHIANA,WithdrawEC,EC,
0,741,SIA/PB/MIN/83011/2018,SEIAA/PB/MIN/2022/EC/01,,PREMDEEP SINGH SHERGILL S/O AMARJIT SINGH,EC Granted,EC,
1,742,SIA/PB/MIN/48869/2016,,M/s. G.M. Bricks Industries Village Peer Bakash Chouhan Tehsil Jalalabad (w) Distt.Fazilka (Punjab),G M BRICKS INDUSTRIES,Delisted,EC,
2,743,SIA/PB/MIN/36427/2015,,"DIC Sand Mining Project at Village- Chugatewala,District-Firozpur,Punjab.",DIC PUNJAB,Delisted,EC,
3,744,SIA/PB/MIN/59471/2016,SEIAA/PB/MINING(NON-COAL)/EC/2017/25,Mianwal Sand mining,GM CUM MINING OFFICER DIC PUNJAB,EC Granted,EC,
4,745,SIA/PB/IND1/411440/2022,SEIAA/PB/IND/2022/EC/22,"Expansion of the existing steel manufacturing unit namely “M/s Devbhoomi Casting Pvt. Ltd.” for increasing the production capacity from 84 TPD  (29,400 TPA) to 288 TPD (1,00,800 TPA) located at Transport Nagar, Village Kumbra, Mandi Gobindgarh, Distt. Fatehgarh Sahib, Punjab.",M/S DEVBHOOMI CASTING PVT. LTD.,ADS by SEAC,EC,
5,746,SIA/PB/MIN/74942/2018,SEIAA/PB/MIN/2018/EC/01,Rattangarh Sand Mining Project,TANVIR SINGH GANDHI,EC Granted,EC,
6,747,SIA/PB/NCP/74967/2018,SEIAA/PB/NCP/EC/2018/16,CITY OF DREAMS 115,GK RESIDENCY PVT LTD,EC Granted,EC,
7,748,SIA/PB/MIN/35392/2015,,Aggarwal BVKO,AELIYA BHAVANJI MAGANJI,Delisted,EC,
8,749,SIA/PB/MIS/175313/2020,SEIAA/PB/MIS/2021/EC(EXPANSION)/04,"Expansion of Group Housing Project ""Homeland Heights"" by Homeland Buildwell Pvt. Ltd.",HOMELAND BUILDWELL P LTD.,EC Granted,EC,
9,750,SIA/PB/INFRA2/409898/2022,SEIAA/PB/MIS/2022/EC/35,aeroplaza,SHUDH GOLD,Delisted,EC,
0,751,SIA/PB/MIN/40696/2016,,"M/S SURINDER MOHAN & CO. MINING SITE AT AGWARD KASHMIRI, KOTKAPURA",SURINDER MOHAN AND COMPANY,Delisted,EC,
1,752,SIA/PB/MIS/255945/2022,SEIAA/PB/MIS/2022/EC/06,AFFINITY BELGRAVIA,AFFINITY BUILDTECH,EC Granted,EC,
2,753,SIA/PB/MIN/37229/2015,,"JAITU BKO, VILLAGE JAITU, BATHINDA ROAD, TEHSIL KOTKAPURA, DISTT. FARIDKOT",JAITU BKO,Delisted,EC,
3,754,SIA/PB/MIN/37056/2015,,THE DEEPAK GRAM UDYOG SAMITI MINING SITE AT DHUDHI FARIDKOT,THE DEEPAK GRAM UDYOG SAMITI,Delisted,EC,
4,755,SIA/PB/MIS/268718/2022,SEIAA/PB/MIS/2022/EC/19,"Warehouse Project at (H.B. No. 79), Village Chamaru, Tehsil Rajpura, Distt. Patiala, Punjab by M/s Xplent Logistics Park Pvt. Ltd.",XPLENT LOGISTICS PARK PRIVATE LIMITED,EC Granted,EC,
5,756,SIA/PB/MIN/35360/2015,,"earth mining for brick killn in the revenue estate of vill. karhali,tehsil and distt. patiala by m/s siddhi vinayak bko,mardaheri.",SIDHI VINAYAK  BKO,Delisted,EC,
6,757,SIA/PB/INFRA2/417319/2023,SEIAA/PB/MIS/2023/EC/05,"""GREENWOODS"" by M/s CEE DEE Developers Pvt. Ltd.",CEE DEE DEVELOPERS PRIVATE LIMITED,ADS by SEAC,EC,
7,758,SIA/PB/MIN/434650/2023,,"Rampur/Thamuwal Sand Mining Project by Executive Engineer/Jalandhar, Drainage-Cum-Mining & Geology Division Water Resources Department, Jalandhar, Punjab",EXECUTIVE ENGINEER -CUM- DISTRICT MINING OFFICER JALANDHAR,Under examination of SEIAA,EC,
8,759,SIA/PB/NCP/74901/2018,SEIAA/PB/NCP/2018/EC/17,EL-SPAZIA,ALLWIN INFRASTRUCTURE LTD,EC Granted,EC,
9,760,SIA/PB/CMIN/41829/2016,,jagjit singh,JAGJIT SINGH BKO,Delisted,EC,
0,761,SIA/PB/MIS/253518/2022,SEIAA/PB/MIS/2022/EC/05,"Group Housing project namely “Sheesh Mahal Skyline” in pocket A of the already existing residential colony namely Sheesh Mahal on Dabwali road, Bhatinda, Punjab by M/s Sheesh Mahal Developers Ltd.",SHEESH MAHAL DEVELOPERS LIMITED,EC Granted,EC,
1,762,SIA/PB/MIS/69508/2021,SEIAA/PB/MIS/2022/EC/14,Aerotropolis Residential Project,GREATER MOHALI DEVELOPMENT AUTHORITY GMADA,Delisted,EC,
2,763,SIA/PB/MIN/49249/2016,,Mining of Brick Earth in Village Kotli by M/S Dashmesh Trading Co BKO,DASHMESH TRADING COM BKO,Delisted,EC,
3,764,SIA/PB/MIN/49260/2016,,M/s Kamboj BKO,MS KAMBOJ BKO,Delisted,EC,
4,765,SIA/PB/MIN/53113/2016,,Mining of Brick Earth in Village Sanana by M/S S M BRICK AND CO,OM BKO,Delisted,EC,
5,766,SIA/PB/MIS/258960/2022,SEIAA/PB/MIS/2022/EC/10,"Max Super Speciality Hospital (A Unit of Hometrail Buildtech Pvt Ltd) located near Civil Hospital, Phase VI, SAS Nagar, Mohali",HOMETRAIL BUILDTECH PRIVATE LIMITED,EC Granted,EC,
6,767,SIA/PB/IND1/425692/2023,,Steel manufacturing unit namely M/s Bassi Alloys Pvt. Ltd.,BASSI ALLOYS PRIVATE LIMITED,Pending at PP due to eds,EC,
7,768,SIA/PB/MIS/105312/2019,SEIAA/PB/MIS/2022/EC/24,"Commercial Project “LIC Complex” at Sector-49, SAS Nagar Mohali, Punjab. by M/s LIFE INSURANCE CORPORATION OF INDIA",MS LIFE INSURANCE CORPORATION OF INDIA,ADS by SEAC,EC,
8,769,SIA/PB/MIS/230381/2021,SEIAAPB/MIS/2021/EC/18,"Affordable residential colony (Plotted) project namely “Aadhaar Enclave” is planned at Ram Tirath Road, village Wadala Bhittewad, Distt. Amritsar, Punjab by M/s Aadhaar Developers.",RESIDENTIAL COLONY BELONGS TO AADHAAR DEVELOPERS AT VILLAGE WADALA BHITTEWADH,EC Granted,EC,
9,770,SIA/PB/NCP/94495/2019,SEIAA/PB/NCP/2019/EC/09,"Warehouse/Logistics/ Industrial Assembling Light Engineering Park at Plot No. 8, Super Mega Industrial Estate at revenue estate of Village Chamaru & Mehtabgargh, Tehsil Rajpura, Distt Patiala, Punjab by M/s Ishanvi Industrial  & Logistics Park  Pvt L",ISHANVI INDUSTRIAL AND LOGISTICS PARK PVT LTD,EC Granted,EC,
0,771,SIA/PB/NCP/6383/2015,,"HERO HOMES, BIRMI",HERO REALTY PVT LTD,Pending at PP due to eds,EC,
1,772,SIA/PB/MIS/260840/2022,,Dayanand Medical College and Hospital at Civil Lines Tagore Nagar Ludhiana,DAYANAND MEDICAL COLLEGE & HOSPITAL MANAGING SOCIETY,Delisted,EC,
2,773,SIA/PB/IND/33954/2015,,Puri Bricks Kiln Industry Vill Mehatpur Vill Jahan Khelan via Mehlanwali brick earth site at Mehlanwali,Jasmeen,Delisted,EC,
3,774,SIA/PB/NCP/71249/2017,SEIAA/PB/NCP/2017/EC/19,AFFINITY GRRENS,AFFINITY BUILDERS AND PROMOTERS,EC Granted,EC,
4,775,SIA/PB/MIN/150641/2020,SEIAA/PB/MIN/EC/2020/09,"Mining Lease Behak Pachharian located at  Village- Behak Pachharian  , Tehsil-Zira, District–Ferozepur, Punjab on the Agricultural Land having an area of  1.79 ha.",PRIME VISION INDUSTRIES PVT LTD,EC Granted,EC,
5,776,SIA/PB/MIS/284601/2022,SEIAA/PB/MIS/2022/EC/28,Dayanand Medical College and Hospital at Civil Lines Tagore Nagar Ludhiana,DAYANAND MEDICAL COLLEGE & HOSPITAL MANAGING SOCIETY,Rejection Letter Granted,EC,
6,777,SIA/PB/MIN/35839/2015,,"BRICK EARTH MINING SITE (2.16 HECTARES) of M/s Shiv Shankar Bricks Manufacures Village-Bhunerheri, tehsil and District-Patiala",SHIV SHANKER BRICKS MANUFACTURES,WithdrawEC,EC,
7,778,SIA/PB/INFRA2/428361/2023,SEIAA/PB/MIS/2023/EC/12,Residential Colony namely “Queenstown” by M/s Queenstown Infra Projects LLP,QUEENSTOWN INFRA PROJECTS LLP,Under examination of SEIAA after SEAC,EC,
8,779,SIA/PB/NCP/74998/2018,SEIAA/PB/NCP/EC/2018/11,SUSHMA PRESTINE,DREAMCITY REALTORS PVT LTD,WithdrawEC,EC,
9,780,SIA/PB/MIS/227267/2021,SEIAA/PB/MIS/2021/EC/15,LONDON STREET,METRO DEVELOPERS & BUILDERS,EC Granted,EC,
0,781,SIA/PB/INFRA2/430419/2023,,"Expansion of Construction of Residential Project “AGI Sky Villas”  by M/s AGI Infra Private Limited at Village- Dad, Pakhowal road, Tehsil & District- Ludhiana, Punjab",AGI INFRA LIMITED,Pending at PP due to eds,EC,
1,782,SIA/PB/NCP/5243/2015,SEIAA/PB/NCP/Exp/EC/2017/1,EXPANSION OF GROUP HOUSING PROJECT “ATS GOLF MEADOWS LIFESTYLE” by M/s. ATS ESTATES (P) LTD.,ATS ESTATES P LTD,EC Granted,EC,
2,783,SIA/PB/NCP/59330/2016,SEIAA/PB/NCP/EC/Exp/2016/4,SBP HOUSING PARK,SINGLA BUILDERS AND PROMOTERS  LIMITED,EC Granted,EC,
3,784,SIA/PB/NCP/59342/2016,,Dental College & Hospital,BABA JASWANT SINGH DENTAL COLLEGE AND HOSPITAL,Delisted,EC,
4,785,SIA/PB/MIN/147874/2020,,Mahespur Sand Mine,M/S PRIME VISION INDUSTRIES PRIVATE LIMITED (MINE),Delisted,EC,
5,786,SIA/PB/MIS/226348/2021,SEIAA/PB/MIS/2021/EC/16,PARK HEIGHTS,GEETU CONSTRUCTIONS PRIVATE LIMITED,EC Granted,EC,
6,787,SIA/PB/IND3/249003/2021,SIA/PB/IND/2022/EC(EXP)/02,"Proposed Expansion of API Drug Manufacturing Unit by ""M/s Vardhman Chemtech Limited"" at Village-Nimbua, P.O Rampur Sainian, Derabassi, SAS Nagar, Punjab.",VARDHMAN CHEMTECH LIMITED,EC Granted,EC,
7,788,SIA/PB/NCP/60551/2016,SEIAA/PB/NCP/EC/2016/38,GREEN LOTUS SAKSHAM,BARNALA DEVELOPERS,WithdrawEC,EC,
8,789,SIA/PB/MIN/42219/2016,,malwa bricks,MALWA BRICKS,Delisted,EC,
9,790,SIA/PB/NCP/25837/2017,SEIAA/PB/NCP/NCP/EIA/2018/03,"Integrated Township namely “Mohali Hills” at Sectors-98, 99, 105, 106, 108, 109 and 110, SAS Nagar, Mohali, Punjab by M/s. Emaar MGF Land Limited",EMAAR MGF LAND LTD,EC Granted,EC,
0,791,SIA/PB/NCP/64266/2017,SEIAA/PB/NCP/EC/2017/15,GBP HIGHWAY TERMINAL (LOGISTIC PARK),GUPTA BUILDERS AND PROMOTERS PVT LIMITED,EC Granted,EC,
