,Sno.,Proposal No.,File No.,Project Name,Company,Proposal Status,Project Type,View
0,1,SIA/PB/NCP/60555/2016,,"Punjabi University, Guru Kashi Campus Talwandi Sabo",PBI UNIVERSITY GURU KASHI CAMPUS,Delisted,EC,
1,2,SIA/PB/NCP/63459/2017,SEIAA/PB/NCP/EC/2017/11,"Atal Apartments at Shaheed Karnail Singh Nagar, Pakhowal Road, Ludhiana, Punjab by Ludhiana Improvement Trust.",LUDHIANA IMPROVEMENT TRUST,EC Granted,EC,
2,3,SIA/PB/MIN/48029/2016,,"M/S FRIENDS BRICKS CO, VILL LAMOCHAR KALAN UTTAR, TEHSIL JALALABAD, DISTT FAZILKA",FRIENDS BRICKS CO,Delisted,EC,
3,4,SIA/PB/NCP/56077/2016,SIA/PB/BC/EC/22/2016,"Commercial  Project “Copious Mall” located at Ladowali Road, Jalandhar, Punjab by M/s. Parv Promoters Pvt. Ltd.",PARV PROMOTERS PRIVATE LIMITED,EC Granted,EC,
4,5,SIA/PB/INFRA2/422259/2023,SEIAA/PB/MIS/2023/EC/09,Group Housing project namely “Melody of Life” by M/s Manglam Infra,MANGLAM INFRA,Awaiting EC,EC,
5,6,SIA/PB/MIS/61949/2019,SEIAA/PB/MIS/2022/EC(MOD)/01,Modernization of Residential Township,UNITECH LTD.,EC Granted,EC,
6,7,SIA/PB/MIS/53933/2016,SEIAA/PB/NCP/EC/EXPN/2016/3,"Expansion of  Estate One Residential Colony
at Village Rajpura Hussainpura and Bhatian 
District Ludhiana 
Eldeco Infrastructure & Properties Ltd",ELDECO INFRASTRUCTURES AND PROPERTIES LTD,EC Granted,EC,
7,8,SIA/PB/MIN/61251/2016,,Majara kalan Sand mining project,DIC LUDHIANA,Delisted,EC,
8,9,SIA/PB/NCP/22969/2018,SEIAA/PB/NCP/EIA-VIO/2018/1,"Coral Mall” at Nakodar Road Jalandhar, Punjab",SHALIMAR CORP LIMITED,EC Granted,EC,
9,10,SIA/PB/MIS/135168/2020,SEIAA/PB/MIS/EC/2020/06,"Commercial Project at Village-Bishangarh & Bishanpura Zirakpur, Tehsil Derabassi, S.A.S Nagar, Punjab by M/s V.R. Developers.",M/S V R DEVELOPERS,EC Granted,EC,
0,11,SIA/PB/NCP/73356/2018,SEIAA/PB/NCP/EC/2018/05,"Group Housing Project namely “Ambika Homes” located at Site No. 2, IT City, Sector 66-Beta, S.A.S. Nagar (Mohali), Punjab by M/s. Ambika Realcon Pvt. Ltd.",AMBIKA REALCON PRIVATE LIMITED,EC Granted,EC,
1,12,SIA/PB/MIN/42633/2016,,Malhotra Brothers,MALHOTRA BROS,Delisted,EC,
2,13,SIA/PB/MIN/60099/2016,SEIAA/PB/MINING(NON-COAL)/EC/2017/11,Sarota Sand & Gravel mining Project,DIC PATHANKOT,Delisted,EC,
3,14,SIA/PB/THE/25814/2018,SEIAA/PB/THE/EIA/2019/1,Proposed 18 MW Biomass based Power Plant,MS SUKHBIR AGRO ENERGY LTD,EC Granted,EC,
4,15,SIA/PB/MIN/421126/2023,SEIAA/PB/MIN/2023/EC/05,"Proposed Sand Mining (boulder, gravel, sand) project as per approved DSR No. SEIAA/MS/2022/1318 with production capacity of 28471 TPA over an area of 4.70 ha on the agricultural bed/patta land located at Village- Aalowal, Tehsil Rupnagar, District Rupnagar, Punjab through XEN/DMO District Rupnagar Govt. of Punjab",Department of Irrigation,ADS by SEAC,EC,
5,16,SIA/PB/MIN/35867/2015,,Mining of Brick Earth in Village  manakpur sharif by M/S MAJRA BRICK AND MANUFACTURING COMPANY,MAJRA BRICK AND MANUFACTURING COMPANY,Delisted,EC,
6,17,SIA/PB/MIS/99617/2019,SEIAA/PB/NCP/2019EC/12,"Warehouse Project namely Indoswift Logistics on NH-1 (New NH-44), Village Baprour Tehsil Rajpura, District Patiala, Punjab by M/s Indoswift Logistics.",INDOSWIFT LOGISTICS,EC Granted,EC,
7,18,SIA/PB/IND/22600/2018,SEIAA/PB/IND/2019/EIA/09,Steel manufacturing unit for increasing the production capacity to 1000 TPD.,JOGINDRA CASTINGS PVT. LTD.,EC Granted,EC,
8,19,SIA/PB/MIN/33610/2015,,"DIC- Sand minig project at village- Gatti harike, firozpur",DIC PUNJAB,Delisted,EC,
9,20,SIA/PB/MIS/235981/2021,SEIAA/PB/MIS/2021/EC/19,AMAYRA EMPORIO,OMNI PACIFIC COLONIZERS (P) LTD,EC Granted,EC,
0,21,SIA/PB/NCP/75914/2018,,GAURAV BASERA,GAURAV LAND DEVELOPER,Delisted,EC,
1,22,SIA/PB/NCP/19203/2017,SEIAA/PB/IND/2018/EIA/02,"Hi-Tech ""Cycle Valley""",PUNJAB SMALL INDUSTRIES AND EXPORT CORPORATION LIMITED,EC Granted,EC,
2,23,SIA/PB/IND/50328/2016,,"M/S HANDA BRICKS INDUSTRIES, VILLAGE: MIYAPUR, TEHSIL: DERA BASSI, DISTRICT: SAS NAGAR",.............,Delisted,EC,
3,24,SIA/PB/NCP/42969/2016,SEIAA/PB/BLDG CONST/EC/2016/10,Emerging Heights III,EMERGING INDIA HOUSING CORPORATION PVT LTD,EC Granted,EC,
4,25,SIA/PB/MIN/59428/2016,SEIAA/PB/MINING(NON-COAL)/EC/2017/22,Chak Bahmanian Sand mining Project,GM CUM MINING OFFICER DIC PUNJAB,EC Granted,EC,
5,26,SIA/PB/MIN/59433/2016,SEIAA/PB/MINING(NON-COAL)/EC/2017/24,Chak Budala Sand Mining Project,GM CUM MINING OFFICER DIC PUNJAB,EC Granted,EC,
6,27,SIA/PB/MIS/251736/2022,SEIAA/PB/MIS/2023/EC/03,"Expansion of Group Housing project namely “Leela Orchid Greens” located at Sector-115, Village Khuni Majra, Tehsil Kharar, Distt. S.A.S Nagar, Punjab by M/s Leela Residencies Pvt. Ltd.",LEELA RESIDENCIES PRIVATE LIMITED,Agenda Uploaded by SEIAA,EC,
7,28,SIA/PB/MIN/42342/2016,,BRICK EARTH MINING IN THE REVENUE ESTATE OF VILL. KHANPUR GANDIYA TEHSIL. RAJPURA DISTT. PATIALA BY M/S SHRI MAHALAXMI BRICKS,SHREE MAHALAXMI BRICKS BKO,Delisted,EC,
8,29,SIA/PB/MIN/180150/2020,SEIAA/PB/MIN/EC/2020/32,"Sariana -1& sariana   Gravel (Minor Mineral) Mining Project of M.L Area 1.62 ha. & 2.43ha Respectively at Near village: Sariana -1 & sariana   District: Hoshiarpur, Punjab for Production capacity of Sariana -1 22008.83MT/Year & Production capacity of",PRIME VISION INDUSTRIES PRIVATE LIMITED,EC Granted,EC,
9,30,SIA/PB/MIN/63033/2017,,Aaspur sand bajri mining project,AASPUR SAND BAJRI MINING PROJECT,TransferToDEIAA,EC,
0,31,SIA/PB/MIS/174962/2020,SEIAA/PB/MIS/EC/03,AGI Smart Homes,A G I INFRA LIMITED,EC Granted,EC,
1,32,SIA/PB/MIN/151329/2020,,"Maulana Gravel Mine” Block No. – 1, Hadbast No. –110, having total area of 1.30 hectare (Non- Forest), proposed production 32612.26MT Khasra No.–21//6/2, 15, 16/1, 22//10/2, 11, 20/1.  in Village – Ma",RAKESH GRAVEL MINE,Delisted,EC,
2,33,SIA/PB/MIS/235639/2021,SEIAA/PB/MIS/2022/EC/02,CENTRAL STREET,ALAKNANDA ENTERPRISES,EC Granted,EC,
3,34,SIA/PB/MIN/60821/2016,SEIAA/PB/MINING(NON-COAL)/EC/2017/3,Kanian Hussaini Sand mining project,DIC LUDHIANA,WithdrawEC,EC,
4,35,SIA/PB/MIN/61266/2016,SEIAA/PB/MINING(NON-COAL)/EC/2017/4,Heatewal Sand Mining Project,DIC LUDHIANA,EC Granted,EC,
5,36,SIA/PB/MIN/59644/2016,,Basantpur Gravel mining Project,DIC HOSHIARPUR,Delisted,EC,
6,37,SIA/PB/MIN/42052/2019,,Brick earth excavation project by M/s Sharma & Company BKO,M/S SHARMA & COMPANY BKO,Pending at PP due to eds,EC,
7,38,SIA/PB/MIN/419779/2023,SEIAA/PB/MIN/2023/EC/08,"Proposed Sand mining project (boulder, gravel, sand), as per DSR No. SEIAA/MS/2023/87 with production capacity of 21767 TPA over an area of 3.81 ha on the agricultural bed/patta land located at village Bhukhari khurd and village-Dhananshu-2, Tehsil- Ludhiana East, District-Ludhiana, Punjab through XEN/DMO District Ludhiana Govt. of Punjab",EXECUTIVE ENGINEER CUM DISTRICT MINING OFFICER LUDHIANA,EC Granted,EC,
8,39,SIA/PB/NCP/71252/2017,SEIAA/PB/NCP/2017/EC/23,PRESTIGE TOWERS,VERA DEVELOPERS PVT LTD,EC Granted,EC,
9,40,SIA/PB/IND2/176029/2020,SEIAA/PB/IND2/EC/06,"Expansion of Chemicals and APIs production unit at Village Fatehgarh Channa, Mansa Road District Barnala – 148101, Punjab By IOL Chemicals and Pharmaceuticals Limited",IOL CHEMICALS AND PHARMACEUTICALS LIMITED,EC Granted,EC,
0,41,SIA/PB/MIS/228147/2021,SEIAA/PB/MIS/2021/EC/17,HORIZON BELOMOND,HORIZON INFRASTRUCTURE & DEVELOPERS LLP,EC Granted,EC,
1,42,SIA/PB/MIS/253518/2022,SEIAA/PB/MIS/2022/EC/05,"Group Housing project namely “Sheesh Mahal Skyline” in pocket A of the already existing residential colony namely Sheesh Mahal on Dabwali road, Bhatinda, Punjab by M/s Sheesh Mahal Developers Ltd.",SHEESH MAHAL DEVELOPERS LIMITED,EC Granted,EC,
2,43,SIA/PB/IND3/76857/2022,SEIAA/PB/IND/2022/EC/14,Bansal and Bansal Organics at Plot A5 Industrial focal Point Raikot District Ludhiana punjab,BANSAL & BANSAL ORGANICS,EC Granted,EC,
3,44,SIA/PB/IND2/37896/2009,,Environment Clearance for Expansion of Integrated Complex (a) Addition of Ethanol Facilities in Molasses Distillery (b) Addition of Ethanol Facilities in existing Grain/Cane Juice Syrup Distillery (c),CHADHA SUGARS AND INDUSTRIES PRIVATE LIMITED,Delisted,EC,
4,45,SIA/PB/MIN/51630/2016,,M/s Shankar Bricks Co.,SHANKAR BRICKS CO,Delisted,EC,
5,46,SIA/PB/IND2/30118/2018,,expansion of BPCL LPG Bottling Plant,BPCL BATHINDA,Delisted,EC,
6,47,SIA/PB/MIN/35640/2015,,Mining of Brick Earth in Village By M/S LALA BRICK TRADERS,LALA BRICK TRADERS,Delisted,EC,
7,48,SIA/PB/NCP/63176/2017,SEIAA/PB/NCP/EC/2017/9,"Proposed construction of Multistoreyed integrated corporate office complex at Badungar, Patiala by Punjab State Power Corporation Limited.",PUNJAB STATE POWER CORPORATION LIMITED PATIALA,EC Granted,EC,
8,49,SIA/PB/MIN/49063/2016,,M/s. Gill Bricks Company Village Suddan Tehsil Zira Distt. Ferozepur   (Punjab),GILL BRICKS COMPANY,Delisted,EC,
9,50,SIA/PB/MIS/41929/2018,SEIAA/PB/MIS/EC/2019/29,SIEL INDUSTRIAL ESTATE LIMITED,SIEL INDUSTRIAL ESTATE LIMITED,EC Granted,EC,
0,51,SIA/PB/MIN/49874/2016,,Gian Bricks Industries,MS GIAN BRICKS INDUSTRIES,Delisted,EC,
1,52,SIA/PB/NCP/63179/2017,SEIAA/PB/NCP/EC/EXPN/2017/6,JALANDHAR HEIGHTS - II,A G I INFRA LIMITED,EC Granted,EC,
2,53,SIA/PB/MIN/64286/2017,SEIAA/PB/MIN/NON-COAL//2017/35,"Sand Mining Project at Village: Arzidarya Bramad Paragpur, Tehsil: Balachaur, District: SBS Nagar, State: Punjab",DIC PUNJAB,EC Granted,EC,
3,54,SIA/PB/IND2/156711/2020,SEIAA/PB/IND/EC/2020/21,CADCHEM LABORATORIES LIMITED,M/S- CADCHEM LABORATORIES LIMITED.,EC Granted,EC,
4,55,SIA/PB/MIS/164609/2020,SEIAA/PB/MIS/EC/2020/15,GOLDEN SAND,GOLDEN SAND APPARTMENTS & SRK APARTMENTS,EC Granted,EC,
5,56,SIA/PB/NCP/76175/2018,,Affordable group housing,RITESH PROPERTIES AND INDUSTRIES LIMITED,Delisted,EC,
6,57,SIA/PB/MIS/243835/2021,SEIAA/PB/MIS/2022/EC/16,"Group Housing project namely “Amritsar One” at  Shubham Enclave, Besides NH-1, Amritsar, Punjab by M/s ATM Estates Pvt. Ltd.",M/S ATM ESTATES PVT. LTD.,EC Granted,EC,
7,58,SIA/PB/NCP/71352/2017,SEIAA/PB/NCP/2017/EC/24,JOYNEST MOH 1,AMAZING REAL ESTATE PVT LTD,EC Granted,EC,
8,59,SIA/PB/NCP/71433/2017,SEIAA/PB/NCP/2017/EC/2017,AGI Palace,A G I INFRA LIMITED,EC Granted,EC,
9,60,SIA/PB/MIS/17044/2014,SEIAA/PB/CETP/EIA/2017/1,Common Effluent Treatment Plant for Jalandhar Effluent Treatment Society,JALANDHAR EFFLUENT TREATMENT SOCIETY FOR ELECTROPLATING INDUSTRIES,EC Granted,EC,
0,61,SIA/PB/MIN/423947/2023,SEIAA/PB/MIN/2023/EC/12,Mehlanwali Sand Mine (Choe Bed-Lease code: ML 01),"EXECUTIVE ENGINEER, HOSHIARPUR DRAINAGE DIVISION, HOSHIARPUR",Agenda Uploaded by SEIAA,EC,
1,62,SIA/PB/MIN/423699/2023,SEIAA/PB/MIN/2023/EC/16,"Jaloke Sand Mine Cluster 01 [Cluster: Jaloke And Jaloke-2] by Executive Engineer-Drainage Cum-Mining & Geology Division Tarn Taran, Canal Complex, Near Railway Station, Amritsar, Punjab",BARI DOAB DRAINAGE DIVISION AMRITSAR,Under examination of SEIAA after SEAC,EC,
2,63,SIA/PB/MIN/150611/2020,SEIAA/PB/MIN/EC/2020/17,"Mining lease Mamdot Uttar-2 Located at Village- Mamdot Uttar, Tehsil- Ferozepur, District-Ferozepur, Punjab on the Agricultural Land having an area of 1.01 ha",PRIME VISION INDUSTRIES PVT LTD,EC Granted,EC,
3,64,SIA/PB/NCP/25837/2017,SEIAA/PB/NCP/NCP/EIA/2018/03,"Integrated Township namely “Mohali Hills” at Sectors-98, 99, 105, 106, 108, 109 and 110, SAS Nagar, Mohali, Punjab by M/s. Emaar MGF Land Limited",EMAAR MGF LAND LTD,EC Granted,EC,
4,65,SIA/PB/MIS/222773/2021,SEIAA/PB/MIS/EC/13,Hotel Project namely Medallion Edge,M/S TURNSTONE REALTY LLP,EC Granted,EC,
5,66,SIA/PB/MIN/42070/2019,,Brick earth excavation project M/s Khanduja Brothers (Brick Kiln)),M/S KHANDUJA BROTHERS,Pending at PP due to eds,EC,
6,67,SIA/PB/MIN/35192/2015,,RAM SINGH,RAM,Delisted,EC,
7,68,SIA/PB/NCP/73833/2018,,JAMUNA APPARTMENT,JAMUNA DEVELOPERS,Delisted,EC,
8,69,SIA/PB/MIS/136532/2020,SEIAA/PB/MIS/EC/2020/04,city of dreams 5,CREDO ASSETS PRIVATE LIMITED,EC Granted,EC,
9,70,SIA/PB/MIS/136949/2020,,Mixed use project by M/s Silicon Construction Pvt. Lmt,MIX USE PROJECT BY M/S SILICON CONSTRUCTIONS PVT. LTD.,Delisted,EC,
0,71,SIA/PB/MIN/41269/2016,,SURINDER KUMAR BATRA BKO VILLAGE ARNIWALA SEKH SUBHAN TEHSIL AND DISTT FAZILKA,SURINDER KUMAR BATRA BKO,Delisted,EC,
1,72,SIA/PB/MIN/59628/2016,SEIAA/PB/MINING(NON-COAL)/EC/2017/31,Rarra Sand mining Project,DIC HOSHIARPUR,EC Granted,EC,
2,73,SIA/PB/INFRA2/419298/2023,SEIAA/PB/MIS/2023/EC/08,"Proposed Group Housing Project namely “The Medallion Aurum” at Sector 67, Mohali, Distt. SAS Nagar, Punjab by M/s Turnstone Realty LLP",TURNSTONE REALTY LLP,Awaiting EC,EC,
3,74,SIA/PB/NCP/53359/2016,SEIAA/PB/BC/EC/2016/18,International Cricket Stadium cum sports Complex by PCA,PUNJAB CRICKET ASSOCIATION,EC Granted,EC,
4,75,SIA/PB/MIN/61265/2016,SEIAA/PB/MINING(NON-COAL)/EC/2017/14,Bounker Gujran Sand mining project,DIC LUDHIANA,EC Granted,EC,
5,76,SIA/PB/MIN/40978/2016,,luxmibrick,LUXMI BRICKS UDYOG,Delisted,EC,
6,77,SIA/PB/NCP/63507/2017,SEIAA/PB/NCP/EC/2017/10,BUS TERMINAL CUM COMMERCIAL COMPLEX,C AND  C TOWERS LTD,Delisted,EC,
7,78,SIA/PB/MIS/201862/2021,SEIAA/PB/MIS/EC/02,Mohali Citi Centre,M/S KLG JEWELLERS,EC Granted,EC,
8,79,SIA/PB/IND/63124/2020,SEIAA/PB/IND/EC/10,"Expansion in the existing Steel Manufacturing Unit namely ""M/s J.N. Tayal Steels Private Limited"" at village- Bhagwanpura, Dehlon road, Tehsil- Ludhiana East, District- Ludhiana, Punjab",M/S J.N. TAYAL STEELS (P) LTD.,EC Granted,EC,
9,80,SIA/PB/IND/69676/2021,SEIAA/PB/IND/2021/EC/21,"Steel Manufacturing Unit ""M/s Ambey Industries"" at G.T. road, Sirhind side, Backside Modern Steel Ltd., Mandi Gobindgarh, Tehsil- Amloh, District- Fatehgarh Sahib, Punjab.",M/S AMBEY INDUSTRIES,EC Granted,EC,
0,81,SIA/PB/NCP/32425/2015,,"GBP Centrum 
Proponent Gupta Builders & Promoters Pvt. Ltd.",GUPTA BUILDERS AND PROMOTERS PVT LIMITED,Delisted,EC,
1,82,SIA/PB/MIN/48129/2016,,M/s Kamboj Bricks Co.Mohan Ke Hithar Tehsil Guruharsahai Distt. Ferozepur,SP BRICKS COMPANY,Delisted,EC,
2,83,SIA/PB/NCP/58204/2016,SEIAA/PB/NCP/EC/2016/29,ATHENS II,BRAWN BUILDTECH PVT LIMITED,EC Granted,EC,
3,84,SIA/PB/MIN/41269/2016,,SURINDER KUMAR BATRA BKO VILLAGE ARNIWALA SEKH SUBHAN TEHSIL AND DISTT FAZILKA,SURINDER KUMAR BATRA BKO,Delisted,EC,
4,85,SIA/PB/MIN/42613/2016,,Mining of Brick Earth in village Bassali by M/S Shivam Brick Kiln,SHIVAM BRICK KILN,Delisted,EC,
5,86,SIA/PB/MIN/58917/2016,SEIAA/PB/MINING(NON-COAL)/EC/2017/6,Gurchak Sand Mining Project,GURCHAK SAND MINING PROJECT,EC Granted,EC,
6,87,SIA/PB/MIS/272060/2022,SEIAA/PB/MIS/2022/EC/22,"Commercial Project namely “Medallion 68” located at Plot No. 2 & 3, Sector 68, Distt. SAS Nagar, Mohali, (Punjab) by M/s Turnstone Realty LLP.",M/S TURNSTONE REALTY LLP,EC Granted,EC,
7,88,SIA/PB/INFRA2/419298/2023,SEIAA/PB/MIS/2023/EC/08,"Proposed Group Housing Project namely “The Medallion Aurum” at Sector 67, Mohali, Distt. SAS Nagar, Punjab by M/s Turnstone Realty LLP",TURNSTONE REALTY LLP,Awaiting EC,EC,
8,89,SIA/PB/NCP/53359/2016,SEIAA/PB/BC/EC/2016/18,International Cricket Stadium cum sports Complex by PCA,PUNJAB CRICKET ASSOCIATION,EC Granted,EC,
9,90,SIA/PB/MIN/61265/2016,SEIAA/PB/MINING(NON-COAL)/EC/2017/14,Bounker Gujran Sand mining project,DIC LUDHIANA,EC Granted,EC,
0,91,SIA/PB/MIN/419740/2023,,"Proposed Sand Mining (boulder, gravel, sand) as per DSR No. SEIAA/MS/2023/87 with production capacity of 9810 TPA over an area of 2.30 ha on the agricultural bed/patta land located at Village- Koomkalan, Tehsil Ludhiana East, District Ludhiana, Punjab through XEN District Ludhiana Govt. of Punjab.",EXECUTIVE ENGINEER CUM DISTRICT MINING OFFICER LUDHIANA,Pending at PP due to eds,EC,
1,92,SIA/PB/MIN/60823/2016,SEIAA/PB/MINING(NON-COAL)/EC/2017/16,kutbewal arian sand mining project,DIC LUDHIANA,EC Granted,EC,
2,93,SIA/PB/NCP/71387/2017,SEIAA/PB/NCP/2017/EC/18,VICTORIA RESIDENCY,VROMS BUILDCON PVT LTD,EC Granted,EC,
3,94,SIA/PB/NCP/16518/2016,SEIAA/PB/Bldg /23/2016,World Trade Centre Commercial project,WTC NOIDA DEVELOPMENT COMPANY PVT LTD,EC Granted,EC,
4,95,SIA/PB/MIS/136535/2020,SEIAA/PB/MIS/EC/2020/05,carpe diem,CREDO ASSETS PRIVATE LIMITED,EC Granted,EC,
5,96,SIA/PB/MIN/136681/2020,SEIAA/PB/MIN/EC/2020/21,Ordinary Earth Mining,SH. BALWANT SINGH,Delisted,EC,
6,97,SIA/PB/MIN/35640/2015,,Mining of Brick Earth in Village By M/S LALA BRICK TRADERS,LALA BRICK TRADERS,Delisted,EC,
7,98,SIA/PB/IND/25954/2018,SEIAA/PB/IND/EC/11,M/s Shiva Castings Pvt. Ltd.,M/S SHIVA CASTINGS PVT. LTD.,EC Granted,EC,
8,99,SIA/PB/MIS/105880/2019,SEIAA/PB/NCP/EC/2019/22,Warehousing Project (Freight Complex),MS PRAGATI WAREHOUSTER LLP,EC Granted,EC,
9,100,SIA/PB/THE/25814/2018,SEIAA/PB/THE/EIA/2019/1,Proposed 18 MW Biomass based Power Plant,MS SUKHBIR AGRO ENERGY LTD,EC Granted,EC,
0,101,SIA/PB/NCP/63459/2017,SEIAA/PB/NCP/EC/2017/11,"Atal Apartments at Shaheed Karnail Singh Nagar, Pakhowal Road, Ludhiana, Punjab by Ludhiana Improvement Trust.",LUDHIANA IMPROVEMENT TRUST,EC Granted,EC,
1,102,SIA/PB/NCP/80201/2018,SEIAA/PB/NCP/EC/2019/04,UPTOWN SKYLLA,ARTIQUE INFRATECH,EC Granted,EC,
2,103,SIA/PB/NCP/58466/2016,SEIAA/PB/NCP/EC/2016/31,"Group Housing Project “City Of Dreams - I” located at Village Sante Majra, Sector-116, Kharar, Distt. SAS Nagar (Greater Mohali), Punjab",CREDO ASSETS PRIVATE LIMITED,EC Granted,EC,
3,104,SIA/PB/MIN/145209/2020,SEIAA/PB/MIN/EC/2020/16,Sand Mining Project,M/S MAHADEV ENCLAVE PRIVATE LIMITED,Delisted,EC,
4,105,SIA/PB/MIN/59446/2016,SEIAA/PB/MINING(NON-COAL)/EC/2017/23,Vehran Sand mining Project,GM CUM MINING OFFICER DIC PUNJAB,EC Granted,EC,
5,106,SIA/PB/MIN/42851/2016,,Maluka Bricks Industry Village Maluka Sub Tehsil Bhagta Bhaika District Bathinda,MALUKA BRICKS INDUSTRY,Delisted,EC,
6,107,SIA/PB/MIN/59087/2016,SEIAA/PB/MINING(NON-COAL)/EC/2017/8,Raji Beli Sand Mining Project,RAJI BELI SAND MINING PROJECT,EC Granted,EC,
7,108,SIA/PB/IND2/21582/2018,SEIAA/PB/IND/EC/2019/07,-1,KANSAI NEROLAC PAINTS LIMITED,EC Granted,EC,
8,109,SIA/PB/IND/63870/2018,SEIAA/PB/IND/EC/15,"New Manufacturing Unit ""M/s RN Gupta & Company Ltd."" at G.T. road, Doraha, Tehsil- Payal, District- Ludhiana, Punjab",M/S RN GUPTA & COMPANY LTD.,EC Granted,EC,
9,110,SIA/PB/NCP/91661/2019,,Chandigarh Builders & Promoters,M/S CHANDIGARH BUILDERS AND PROMOTERS,WithdrawEC,EC,
0,111,SIA/PB/NCP/51872/2016,SEIAA/PB/BC/New/EC/2016/17,"Group Housing Project “Ambika City” at Village Dhodhe Majra, New Chandigarh, Distt. SAS Nagar (Mohali), Punjab By M/s. Ambika Realcon Private Limited",AMBIKA REALCON PRIVATE LIMITED,EC Granted,EC,
1,112,SIA/PB/MIS/212093/2021,SEIAA/PB/MIS/EC/09,THE ZIRK,URBAN NEST PROJECTS LLP,EC Granted,EC,
2,113,SIA/PB/INFRA2/430419/2023,,"Expansion of Construction of Residential Project “AGI Sky Villas”  by M/s AGI Infra Private Limited at Village- Dad, Pakhowal road, Tehsil & District- Ludhiana, Punjab",AGI INFRA LIMITED,Pending at PP due to eds,EC,
3,114,SIA/PB/MIS/212226/2021,SEIAA/PB/MIS/EC/04,Expansion of Warehouse Project (Agro based & Non-agro based),M/S LUDHIANA LOGISTICS PARK LLP,EC Granted,EC,
4,115,SIA/PB/MIN/150530/2020,,"Environment Clearance of Dhun Dhaywala River Bed Sand Mining project Located at Village-Dhun Dhaywala , Tehsil & District –Tarn Taran, Punjab having an area of 4.45 ha",FRIENDS AND CO.,Delisted,EC,
5,116,SIA/PB/MIS/260181/2022,SEIAA/PB/MIS/2022/EC/18,Proposed Warehouse Project,STAR ENTERPRISES,EC Granted,EC,
6,117,SIA/PB/MIS/259742/2022,SEIAA/PB/MIS/2022/EC/11,ATULYAM THE BLISS,APOORVA LEASING FINANCE AND INVESTMENT COMPANY LIMITED,EC Granted,EC,
7,118,SIA/PB/MIN/35805/2015,,M/S JAI  MAA SHARDA BKO VILLAGE BANAWALA TEHSIL AND DISTT MANSA,JAI MAA SHARDA BKO,Delisted,EC,
8,119,SIA/PB/IND2/207127/2021,SEIAAPB/IND/2021/EC/20,Sarv Bio Pharma Pvt. Ltd.,SARV BIO PHARMA PRIVATE LIMITED,EC Granted,EC,
9,120,SIA/PB/MIS/223101/2021,SEIAA/PB/MIS/2021/EC(EXPANSION)/05,"Expansion of Commercial Project namely “Mohali Citi Centre” located at Block-F, Aerocity, Mohali, SAS Nagar (Punjab)",M/S KLG JEWELLERS,EC Granted,EC,
0,121,SIA/PB/MIN/34706/2015,,K.P. BRICKS MANUFACTURER,K P BRICKS MANUFACTURER,WithdrawEC,EC,
1,122,SIA/PB/NCP/62959/2017,SEIAA/PB/NCP/EC/2017/8,GREEN LOTUS SAKSHAM,MAYA BUILDERS,EC Granted,EC,
2,123,SIA/PB/NCP/25696/2018,SEIAA/PB/NCP/EIA/2018/06,"AIIMS, Bhatinda",HLL INFRA TECH SERVICES LTD,EC Granted,EC,
3,124,SIA/PB/MIN/151302/2020,,MAMOON-2 GRAVEL MINE Block No. – 6 Hadbast No. – 378,M/S SAINIK INDUSTRIES PVT. LTD DELHI,Delisted,EC,
4,125,SIA/PB/NCP/71464/2017,SEIAA/PB/NCP/2017/EC/21,ESCON PRIMERA,MALWA PROJECTS PVT LTD,EC Granted,EC,
5,126,SIA/PB/NCP/11539/2016,SEIAA/PB/BLDG/EIA/2018/1,WAVE ESTATE,COUNTRY COLONISERS PVT LIMITED,EC Granted,EC,
6,127,SIA/PB/NCP/63304/2017,SEIAA/PB/NCP/EC/2017/5,LA - PRISMA,UNITED BUILDERS,EC Granted,EC,
7,128,SIA/PB/MIN/178555/2020,SEIAA/PB/MIN/EC/2020/27,Sand Mining project at Village Joura Area 1.57 Ha,PRIME VISION INDUSTRIES PVT LTD,EC Granted,EC,
8,129,SIA/PB/MIN/35277/2015,,OM SAI RAM BRICK KILN,OM SAI RAM BRICK  KILN,WithdrawEC,EC,
9,130,SIA/PB/NCP/80197/2018,SEIAA/PB/NCP/EC/2018/18,JUBILEE WALK,JUBILEE JOY HOMES LLP,EC Granted,EC,
0,131,SIA/PB/IND3/419316/2023,SEIAA/PB/IND/2023/EC/01,"New Chemical Manufacturing unit at village Dhamanheri, Siel Chemical Complex, Tehsil-Rajpura, District-Patiala , State-Punjab. by M/s Chemoro Industries Limited.",CHEMORO INDUSTRIES LIMITED,EC Granted,EC,
1,132,SIA/PB/NCP/53111/2016,SEIAA/PB/NCP/BC/EC/2016/21,"“Curo North Square” at Village Mullanpur Garibdass, Distt. SAS Nagar (Mohali), Punjab by M/s. Curo India Pvt. Ltd.",CURO INDIA PVT LTD,EC Granted,EC,
2,133,SIA/PB/MIN/34160/2015,,PUNJAB  BRICKS,MILHKI RAM BKO,WithdrawEC,EC,
3,134,SIA/PB/NCP/42935/2016,SEIAA/PB/BLDG CONST/EC/2016/9,SUSHMA ELITE CROSS,SUSHMA BUILDTECH LTD,EC Granted,EC,
4,135,SIA/PB/MIN/59475/2016,SEIAA/PB/MINING(NON-COAL)/EC/2017/28,Rampur Sand Mining project,GM CUM MINING OFFICER DIC PUNJAB,EC Granted,EC,
5,136,SIA/PB/MIN/148725/2020,SEIAA/PB/MIN/EC/2020/24,SANDWAL GRAVELS GRAVELS,M/S PRIME VISION INDUSTRIES PRIVATE LIMITED (MINE),EC Granted,EC,
6,137,SIA/PB/MIS/101664/2019,SEIAA/PB/NCP/2019/EC/10,"""Guildford Square"" by Chandigarh Builders & promoters",M/S CHANDIGARH BUILDERS AND PROMOTERS,EC Granted,EC,
7,138,SIA/PB/NCP/64632/2017,,La Saison Hotels Chandigarh Pvt Limited,LA SAISON HOTELS CHANDIGARH PVT LTD,Delisted,EC,
8,139,SIA/PB/MIN/74942/2018,SEIAA/PB/MIN/2018/EC/01,Rattangarh Sand Mining Project,TANVIR SINGH GANDHI,EC Granted,EC,
9,140,SIA/PB/IND2/28816/2016,SEIAA/PB/IND/EIA /2018/03,"EIA / RA STUDY FOR INSTALLATION OF PETROLEUM STORAGE TANKS FOR STORAGE CAPACITY  AUGMENTATION AT IOCL PETROLEUM TERMINAL,  VILLAGE KAMMOMAJRA KHURD, JIND ROAD SANGRUR, PUNJAB",INDIAN OIL CORPORATION LTD PUNJAB,Delisted,EC,
0,141,SIA/PB/NCP/56377/2016,SIA/PB/BLDG/EC/23/2016,PALACE ENCLAVE,PALACE INFRATECH PVT LTD,Delisted,EC,
1,142,SIA/PB/MIS/82060/2022,SEIAA/PB/MIS/2022/EC(EXP)/13,,SHIWALIK SITE PLANNERS PRIVATE LIMITED,ADS by SEAC,EC,
2,143,SIA/PB/MIN/419775/2023,SEIAA/PB/MIN/2023/EC/15,"Proposed Sand Mining (boulder, gravel, sand) Project Site No. PO_LD_LD2_ST_44 as per DSR No. SEIAA/MS/2023/87 with production capacity of 68312 TPA over an area of 3.77 Ha on the Sutlej River bed located at Village- Jamalpur Leli and Shujatwal, District- Ludhiana, Punjab through Executive Engineer/Ludhiana, Drainage cum Mines and Geology, WRD Punjab.",EXECUTIVE ENGINEER CUM DISTRICT MINING OFFICER LUDHIANA,Pending at PP due to eds,EC,
3,144,SIA/PB/MIN/37263/2015,,earth mining for brick killn in the revenue estate of vill. aman nagar tehsil patiala by gupta bko,GUPTA BKO ASMANPUR,Delisted,EC,
4,145,SIA/PB/MIN/48237/2016,,ad gram udyog samiti,A D GRAM UDYOG SAMITI,Delisted,EC,
5,146,SIA/PB/MIS/260840/2022,,Dayanand Medical College and Hospital at Civil Lines Tagore Nagar Ludhiana,DAYANAND MEDICAL COLLEGE & HOSPITAL MANAGING SOCIETY,Delisted,EC,
6,147,SIA/PB/MIN/49038/2016,,M/s Baweja Brick Co.,BAWEJA BRICKS CO,Delisted,EC,
7,148,SIA/PB/MIN/63095/2017,,Pragpur Sand Mining Project,PRAGPUR SAND MINING PROJECT,TransferToDEIAA,EC,
8,149,SIA/PB/NCP/74716/2018,SEIAA/PB/NCP/EC/2018/09,HERMITAGE CENTRALIS,HERMITAGE INFRA DEVELOPERS,EC Granted,EC,
9,150,SIA/PB/MIN/35021/2015,,DASS BRICKS INDUSTRY,DASS BRICKS INDUSTRIES,WithdrawEC,EC,
0,151,SIA/PB/MIN/37855/2016,,"BRICK EARTH MINING SITE (2.16 HECTARES) of M/s Shiv Shankar Bricks Manufactures Village-Bhunerheri, Tehsil and District-Patiala",SHIV SHANKER BRICKS MANUFACTURES,Delisted,EC,
1,152,SIA/PB/MIS/221712/2021,,Group Housing Project namely “Acme Shivalik Heights”  by M/s Acme Heights Infrastructure Pvt. Ltd.,M/S ACME HEIGHTS INFRASTRUCTURE (P) LTD.,Delisted,EC,
2,153,SIA/PB/IND/77225/2021,SEIAA/PB/IND/2022/EC/17,"Proposed Clinker Grinding Unit with Cement Production Capacity of 3.0 Million TPA and D.G. Set (2 x 6 MW) at Village: Sadhroar, Tehsil: Rajpura, District: Patiala and Village: Haripur, Tehsil & District: Fatehgarh Sahib (Punjab) by M/s. UltraTech Cement Limited (Unit: Rajpura Cement Works)",M/s. UltraTech Cement Ltd.,EC Granted,EC,
3,154,SIA/PB/MIS/101416/2019,SEIAA/PB/NCP/EC/2019/14,HLP GALLERIA,KCB INFRA,EC Granted,EC,
4,155,SIA/PB/NCP/51202/2016,,Maya Garden Avenue,BARNALA DEVELOPERS,Delisted,EC,
5,156,SIA/PB/MIN/60844/2016,SEIAA/PB/MINING(NON-COAL)/EC/2017/2,Ratthangarh Sand Mining Project,DIC LUDHIANA,EC Granted,EC,
6,157,SIA/PB/MIN/37386/2015,,AGGARWAL BRICKS MFG MINING SITE AT KOTKAPURA,AGGARWAL BRICKS MFG CO,Delisted,EC,
7,158,SIA/PB/MIN/59438/2016,,Mau Sahib Sand mining Project,GM CUM MINING OFFICER DIC PUNJAB,WithdrawEC,EC,
8,159,SIA/PB/MIN/48438/2016,,M/s Kay Kay Bhatha Vill.Jeewan Arain Teh. Guruharsahai Distt.Ferozepur,KAY KAY BHATHA,Delisted,EC,
9,160,SIA/PB/MIS/148864/2020,,Trishla City Developed by Trishla Buidtech (P) Ltd.,TRISHLA BUILDTECH PVT LIMITED,WithdrawEC,EC,
0,161,SIA/PB/MIS/260181/2022,SEIAA/PB/MIS/2022/EC/18,Proposed Warehouse Project,STAR ENTERPRISES,EC Granted,EC,
1,162,SIA/PB/MIS/259742/2022,SEIAA/PB/MIS/2022/EC/11,ATULYAM THE BLISS,APOORVA LEASING FINANCE AND INVESTMENT COMPANY LIMITED,EC Granted,EC,
