,Sno.,Proposal No.,File No.,Project Name,Company,Proposal Status,Project Type,View
2,163,SIA/PB/MIN/151335/2020,,"Sariana-1 Gravel Mining Project, Village-Sariana, District-Hosiyarpur, Punjab, Production-70635",PRIME VISION INDUSTRIES PRIVATE LIMITED,Delisted,EC,
3,164,SIA/PB/MIS/108792/2019,SEIAA/PB/NCP/EC/2019/23,"Warehouse Project at Plot Nos. B-3 to B-8 and A-4, Focal Point, Ludhiana, Punjab by M/s Nahar Industrial Enterprises Ltd.",NAHAR INDUSTRIAL ENTERPRISES LIMITED,EC Granted,EC,
4,165,SIA/PB/MIN/64286/2017,SEIAA/PB/MIN/NON-COAL//2017/35,"Sand Mining Project at Village: Arzidarya Bramad Paragpur, Tehsil: Balachaur, District: SBS Nagar, State: Punjab",DIC PUNJAB,EC Granted,EC,
5,166,SIA/PB/MIN/33615/2015,,"DIC-Sand mining project at village- kot karor kalan, firozpur",DIC PUNJAB,Delisted,EC,
6,167,SIA/PB/IND/36822/2018,SEIAA/PB/IND/EC/2019/15,M/s H.L. Chopra Steel Rolling Mills,M/S H.L.CHOPRA STEEL ROLLING MILLS,EC Granted,EC,
7,168,SIA/PB/MIS/128629/2019,SEIAA/PB/MIS/EC/2019/28,"Commercial Project namely “Orbit Signature Walk” at VIP Road, Zirakpur, SAS Nagar (Punjab) by M/s Orbit Apartment Construction Pvt. Ltd.",M/S ORBIT APARTMENT CONSTRUCTION PVT. LTD.,EC Granted,EC,
8,169,SIA/PB/NCP/71596/2017,,Hotel Lasaison,LA SAISON HOTELS CHANDIGARH PVT LTD,Delisted,EC,
9,170,SIA/PB/NCP/63938/2017,,Sunny Heights,BAJWA DEVELOPERS LIMITED,Delisted,EC,
0,171,SIA/PB/NCP/42969/2016,SEIAA/PB/BLDG CONST/EC/2016/10,Emerging Heights III,EMERGING INDIA HOUSING CORPORATION PVT LTD,EC Granted,EC,
1,172,SIA/PB/MIN/59428/2016,SEIAA/PB/MINING(NON-COAL)/EC/2017/22,Chak Bahmanian Sand mining Project,GM CUM MINING OFFICER DIC PUNJAB,EC Granted,EC,
2,173,SIA/PB/MIN/59433/2016,SEIAA/PB/MINING(NON-COAL)/EC/2017/24,Chak Budala Sand Mining Project,GM CUM MINING OFFICER DIC PUNJAB,EC Granted,EC,
3,174,SIA/PB/MIS/66039/2021,SEIAA/PB/MIS/2021/EC/(EXPANSION)/06,ROYAL RESIDENCY,ROYAL RESIDENCY BY OMAXE LIMITED,EC Granted,EC,
4,175,SIA/PB/IND/72389/2021,SEIAA/PB/IND/2022/EC/09,"Expansion in the existing Steel Manufacturing Unit M/s  K.J. International Village- Khingran Choe, Tehsil- Bhogpur, District- Jalandhar, Punjab",K. J. INTERNATIONAL,EC Granted,EC,
5,176,SIA/PB/MIN/150482/2020,,"KOT RAJADA-2 River Bed Sand Mining project Located at Village-Kot Rajada, Tehsil-Ajnala, District -Amritsar, Punjab",FRIENDS AND CO.,Delisted,EC,
6,177,SIA/PB/MIN/180150/2020,SEIAA/PB/MIN/EC/2020/32,"Sariana -1& sariana   Gravel (Minor Mineral) Mining Project of M.L Area 1.62 ha. & 2.43ha Respectively at Near village: Sariana -1 & sariana   District: Hoshiarpur, Punjab for Production capacity of Sariana -1 22008.83MT/Year & Production capacity of",PRIME VISION INDUSTRIES PRIVATE LIMITED,EC Granted,EC,
7,178,SIA/PB/MIN/75813/2018,SEIAA/PB/MIN/EC/2018/02,Bounkar Gujran Sand Mine.,SANJEEV GUPTA ENGINEERS AND GOVERNMENT CONTRACTORS.,EC Granted,EC,
8,179,SIA/PB/MIN/42561/2016,,Mining of  Brick Earth in Village Dehar by M/s Sewa Singh & Company,SEWA SINGH AND COMPANY,Delisted,EC,
9,180,SIA/PB/MIS/181321/2020,,"Group Housing Project ""Medallion"" by M/s JMT Housing Pvt. Ltd.",M/S JMT HOUSING PVT. LTD.,WithdrawEC,EC,
0,181,SIA/PB/MIS/165935/2020,,"Group Housing Project namely “Ludhiana Heights” at Village- Balloke (Hadbast No.103), Tehsil and Distt. Ludhiana (Punjab) by M/s Chatly Estate Pvt. Ltd.",CHATLY ESTATES PVT. LTD.,WithdrawEC,EC,
1,182,SIA/PB/MIN/48262/2016,,Anand Bricks Company Village Bhamaba Wattu Tehsil Jalalabad Distt. Fazilka  (Punjab),ANAND BRICKS COMPANY,Delisted,EC,
2,183,SIA/PB/MIN/50129/2016,,Arun BKO,ARUN BKO,Delisted,EC,
3,184,SIA/PB/IND1/425225/2023,SEIAA/PB/IND/2023/EC/06,"Expansion in the existing Steel Manufacturing unit M/s Natural castings at village- Mullanpur Kalan, Mandi Gobindgarh, Tehsil- Amloh, District- Fatehgarh Sahib, Punjab",M/S NATURAL CASTINGS,Agenda Uploaded by SEIAA,EC,
4,185,SIA/PB/MIS/48842/2019,SEIAA/PB/MIS/EC/2019/27,Chitkara University,CHITKARA EDUCATIONAL TRUST,EC Granted,EC,
5,186,SIA/PB/MIN/150652/2020,,"Fatehwala Sand Mining project Located at Village- Fatehwala, Tehsil-Sultanpur Lodhi, District– Kapurthala having an area of  3.29 ha",FRIENDS AND CO.,Delisted,EC,
6,187,SIA/PB/NCP/71368/2017,SEIAA/PB/NCP/2017/EC/16,SUSHMA CAPITAL,TOWNCITY REALTORS (P) LTD,EC Granted,EC,
7,188,SIA/PB/MIN/37082/2015,,Aggarwal BKO,AGGARWAL BKO,Delisted,EC,
8,189,SIA/PB/NCP/63325/2017,SEIAA/PB/NCP/EC/2017/16,"""Call Centre & Residential Training Centre""- Commercial Project",HDFC BANK LTD,WithdrawEC,EC,
9,190,SIA/PB/MIN/37194/2015,,earth mining for brick killin in the revenue estate of vill. hakimpur tehsil bharso distt. patiala by gupta bricks industries.,GUPTA BRICKS INDUSTRIES,Delisted,EC,
0,191,SIA/PB/IND/42770/2018,SEIAA/PB/IND/EC/2020/24,"Expansion of Steel Manufacturing Unit namely ""Punjab Steel Forging & Agro Industries"" located at GT Road, Khanna side, Mandi Gobindgarh, District- Fatehgarh Sahib, Punjab",M/S PUNJAB STEEL FORGING & AGRO INDUSTRIES,EC Granted,EC,
1,192,SIA/PB/MIS/153867/2020,SEIAA/PB/MIS/EC/2020/11,AMAYRA LUXURY ONE,OMNI PACIFIC COLONIZERS (P) LTD,EC Granted,EC,
2,193,SIA/PB/MIS/246234/2021,SEIAA/PB/MIS/2022/EC/01,"Jalandhar Heights-III by M/s AGI Infra Limited at Village- Phollriwal (H.B.NO.-52), Tehsil- Jalandhar,  District- Jalandhar, Punjab.",ASHWANI KANT,EC Granted,EC,
3,194,SIA/PB/MIS/265451/2022,SEIAA/PB/MIS/2022/EC/17,"Commercial Project “Mohali Citi Centre Walk” (5.69 acres) at Pocket No. 2, Block-E, Aerocity, SAS Nagar, Punjab by KLG Infra.",KLG INFRA,EC Granted,EC,
4,195,SIA/PB/MIS/288363/2022,SEIAA/PB/MIS/2022/EC/29,"Sohana Hospital located at Sector-77, Mohali, Punjab by Shri Guru Harkrishan Sahib C Eye Hospital Trust.",SRI GURU HARKRISHAN SAHIB C EYE HOSPITAL TRUST,EC Granted,EC,
5,196,SIA/PB/IND2/28816/2016,SEIAA/PB/IND/EIA /2018/03,"EIA / RA STUDY FOR INSTALLATION OF PETROLEUM STORAGE TANKS FOR STORAGE CAPACITY  AUGMENTATION AT IOCL PETROLEUM TERMINAL,  VILLAGE KAMMOMAJRA KHURD, JIND ROAD SANGRUR, PUNJAB",INDIAN OIL CORPORATION LTD PUNJAB,Delisted,EC,
6,197,SIA/PB/MIN/74942/2018,SEIAA/PB/MIN/2018/EC/01,Rattangarh Sand Mining Project,TANVIR SINGH GANDHI,EC Granted,EC,
7,198,SIA/PB/MIS/265285/2022,,"Group Housing Project “Orchard County” by M/s Ansal Lotus Melange Projects Pvt. Ltd. located at Village Sante Majra, Kharar-Landran Road, Kharar, District S.A.S Nagar, (Mohali), Punjab.",M/S ANSAL LOTUS MELANGE PROJECTS PVT LTD,Delisted,EC,
8,199,SIA/PB/MIN/37794/2016,,EARTH MINING FOR BRICK KILLN IN THE REVENUE ESTATE OF VILL. JAWALAPUR TEHSIL PATRAN BY MOHAN LAL GURNAM SINGH,MOHAN LAL GURNAM SINGH,Delisted,EC,
9,200,SIA/PB/MIN/148404/2020,SEIAA/PB/MIN/EC/2020/03,"of Mining lease Located at Village Dastul Sahib Wala, Tehsil & District Ferozepur on the Agricultural Land having an area of  4.57 ha",PRIME VISION INDUSTRIES PVT LTD,EC Granted,EC,
0,201,SIA/PB/MIN/42603/2016,,Mining of Brick Earth in Village Hiyatpur by m/s K S Bricks,K S BRICKS,Delisted,EC,
1,202,SIA/PB/MIN/39192/2019,,"Mining of Sand from River Sutlej situated in Village Molana, District Rupnagar, Punjab proposed by M/s Kuldeep Singh & Bros",M/S KULDEEP SINGH & BROS,Pending at PP due to eds,EC,
2,203,SIA/PB/MIS/164505/2020,SEIAA/PB/MIS/EC/2021/01,THE HERMITAGE PARK,PARADIGM BUSINESS VENTURES,EC Granted,EC,
3,204,SIA/PB/MIN/33991/2015,,KAUSHAL BROTHERS,KAUSHAL BROTHERS,WithdrawEC,EC,
4,205,SIA/PB/MIS/153588/2020,SEIAA/PB/MIS/EC/2020/09,SUSHMA METROPOL,SUKSHA DEVELOPERS PVT LIMITED,EC Granted,EC,
5,206,SIA/PB/MIN/147925/2020,,"Bianpur Sand Mine, Beas River, Block No. –4, Hadbast No.–683, (River Bed Material)",M/S PRIME VISION INDUSTRIES PRIVATE LIMITED (MINE),Delisted,EC,
6,207,SIA/PB/NCP/56497/2016,SEIAA/PB/NCP/BC/EC/2016/23,HOMELAND MALL,A B ALOCOBEV P LIMITED,EC Granted,EC,
7,208,SIA/PB/MIS/103833/2019,,HLP GALLERIA,KCB INFRA,Delisted,EC,
8,209,SIA/PB/MIN/42368/2016,,M/s Faquir Chand & Co. BKO,MS FAQUIR CHAND AND CO BKO,Delisted,EC,
9,210,SIA/PB/MIN/42370/2016,,national bricks vill. paroul,MATIONAL BRICKS,Delisted,EC,
0,211,SIA/PB/NCP/72694/2018,SEIAA/PB/NCP/EC/2018/06,"Group Housing Project namely “Belliston Avenue” at Village Gazipur, Zirakpur, Distt. S.A.S Nagar, Punjab by M/s. GVT Infra",GVT INFRA,EC Granted,EC,
1,212,SIA/PB/IND2/19466/2016,,"Storage capacity expansion of IOCL Sangrur Terminal  plant at Jind Road, Sangrur , (Punjab)-148001",INDIAN OIL CORPORATION LTD PUNJAB,Delisted,EC,
2,213,SIA/PB/MIN/37386/2015,,AGGARWAL BRICKS MFG MINING SITE AT KOTKAPURA,AGGARWAL BRICKS MFG CO,Delisted,EC,
3,214,SIA/PB/MIN/59438/2016,,Mau Sahib Sand mining Project,GM CUM MINING OFFICER DIC PUNJAB,WithdrawEC,EC,
4,215,SIA/PB/MIN/48438/2016,,M/s Kay Kay Bhatha Vill.Jeewan Arain Teh. Guruharsahai Distt.Ferozepur,KAY KAY BHATHA,Delisted,EC,
5,216,SIA/PB/MIN/48254/2016,,M/s  Rajinder Kumar Raj Kumar BKO   Village Ghubaya Tehsil Jalalabad Distt. Fazilka  (Punjab),RAJINDERKUMARRAJKUMARBKO,Delisted,EC,
6,217,SIA/PB/MIN/49421/2016,,Shiv Bricks Company,SHIVBRICKSCOMPANY,Delisted,EC,
7,218,SIA/PB/MIN/37855/2016,,"BRICK EARTH MINING SITE (2.16 HECTARES) of M/s Shiv Shankar Bricks Manufactures Village-Bhunerheri, Tehsil and District-Patiala",SHIV SHANKER BRICKS MANUFACTURES,Delisted,EC,
8,219,SIA/PB/MIS/262614/2022,SEIAA/PB/MIS/2022/EC/12,MULTI SPECIALTY HOSPITAL,METAPHYSICAL HEALTHCARE PRIVATE LIMITED,EC Granted,EC,
9,220,SIA/PB/MIN/48128/2016,,M/s Kamboj Bricks Co.,SP BRICKS COMPANY,Delisted,EC,
0,221,SIA/PB/MIN/34498/2015,,Extraction of Brick Earth for Brick Kiln M/S Shiv Shakti BKO,SHIV SHAKTI BKO,WithdrawEC,EC,
1,222,SIA/PB/NCP/59681/2016,,"“QuarkCity” at Plot Nos. A-40A & A-45, Focal Point Industrial Area, Phase-VIIIB, Mohali, Punjab.",QUARK CITY  INDIA PVT LTD,Delisted,EC,
2,223,SIA/PB/MIN/148039/2020,SEIAA/PB/MIN/EC/2020/18,"Mining  lease Located at Village Sadhu Shah Wala, Tehsil  & District Ferozepur on the Agricultural Land having an area of  4.02 ha",PRIME VISION INDUSTRIES PVT LTD,Delisted,EC,
3,224,SIA/PB/MIS/179894/2020,,"Expansion of Pragma Medical Institute at Dabwali Road, Bathinda, Punjab by Pragma Medical Institute (A Unit of Gill Medicare Private Limited)",PRAGMA MEDICAL INSTITUTE (A UNIT OF GILL MEDICARE PRIVATE LIMITED),WithdrawEC,EC,
4,225,SIA/PB/MIN/423891/2023,SEIAA/PB/MIN/2023/EC/10,"Naushehra Simbli Gravel Mine, (Agriculture Site: SR 01)","EXECUTIVE ENGINEER, HOSHIARPUR DRAINAGE DIVISION, HOSHIARPUR",Agenda Uploaded by SEIAA,EC,
5,226,SIA/PB/MIS/136539/2020,SEIAA/PB/MIS/EC/2020/03,Primegate tower,PRIMEGATE DEVELOPERS (INDIA),EC Granted,EC,
6,227,SIA/PB/MIS/211389/2021,SEIAA/PB/MIS/2021/EC/14,"Residential Project namely “Absolute Residency” located at Village Chappar Chiri, H.B.No. 195, Tehsil Mohali, Distt. S.A.S Nagar, Punjab by M/s Absolute Builders and Promoters",ABSOLUTE BUILDERS AND PROMOTERS,EC Granted,EC,
7,228,SIA/PB/MIS/211039/2021,SEIAA/PB/MIS/EC/11,"Residential colony namely “Gulnaar Meadows” at Hadbast No. 47, Village Baltana, Tehsil Derabassi, District SAS Nagar, Punjab by M/s SAV Infosystems LLP",SAV INFOSYSTEMS LLP,EC Granted,EC,
8,229,SIA/PB/MIS/141329/2020,SEIAA/PB/MIS/EC/2020/13,"IT/ITES Project namely “Infosys Campus” at Plot no. I-3, Sector-83 Alpha, IT City, S.A.S. Nagar (Mohali), Punjab on 50 acres (or 2,02,343 sq.m) by M/s Infosys Limited.",M/S INFOSYS LIMITED,EC Granted,EC,
9,230,SIA/PB/MIN/36196/2015,,Mining of Brick Earth in Village Bhutta By M/S FINE BRICKS,FINE  BRICKS,Delisted,EC,
0,231,SIA/PB/MIN/37739/2016,,SAI TRADERS,SAI TRADERS,Delisted,EC,
1,232,SIA/PB/MIS/253790/2022,SEIAA/PB/MIS/2022/EC(EXP)/03,Expansion of Warehouse Project (Agro and Non-Agro based),M/S LUDHIANA LOGISTICS PARK LLP,EC Granted,EC,
2,233,SIA/PB/MIS/17690/2016,,Shivalik,SHIVALIK TOURISM DEVELOPMENT BOARD,WithdrawEC,EC,
3,234,SIA/PB/MIN/161508/2020,SEIAA/PB/MIN/EC/2020/20,"Environment Clearance for Booh Sand Mining project (off river bed) Located at village-Booh, Tehsil-Patti ,District- Tarn Taran, Punjab having an area of 1.66 ha.",FRIENDS AND CO.,Delisted,EC,
4,235,SIA/PB/MIN/178189/2020,SEIAA/PB/MIN/EC/2020/29,Behak Gujjran Sand mining project,PRIME VISION INDUSTRIES PVT LTD,EC Granted,EC,
5,236,SIA/PB/MIN/178584/2020,SEIAA/PB/MIN/EC/2020/26,Sand Mining Project at Village Jalata area 1.43 ha,PRIME VISION INDUSTRIES PVT LTD,EC Granted,EC,
6,237,SIA/PB/MIN/37126/2015,,Narang Intt Udyog,NARANG INTT UDYOG,Delisted,EC,
7,238,SIA/PB/MIS/60557/2021,IA3-21/9/2021-IA.III,"Group Housing Residential Pocket 2B namely “Galaxy Heights II” at Sector 66A, 82 & 83, Distt. SAS Nagar, Mohali, Punjab by M/s Janta Land Promoters Private Limited.",JANTA LAND PROMOTERS PVT. LTD.,Delisted,EC,
8,239,SIA/PB/INFRA2/417590/2023,SEIAA/PB/MIS/2023/EC/06,“Connaught Estate”  by M/s Pamposh Town Planners Private Limited,PAMPOSH TOWN PLANNERS PRIVATE LIMITED,EC Granted,EC,
9,240,SIA/PB/NCP/57309/2016,SEIAA/PB/NCP/EC/2017/13,BRAMPTON HEIGHTS,M/s Cornerstone Buildcon Private Limited,EC Granted,EC,
0,241,SIA/PB/IND2/15957/2016,SEIAA/PB/IND2/EIA/2017/2,-1,INDIAN OIL CORPORATION LIMITED,EC Granted,EC,
1,242,SIA/PB/IND2/15957/2016,,-1,INDIAN OIL CORPORATION LIMITED,EC Granted,EC,
2,243,SIA/PB/MIN/59444/2016,,Pipli Sand mining Project,GM CUM MINING OFFICER DIC PUNJAB,Delisted,EC,
3,244,SIA/PB/IND3/419316/2023,SEIAA/PB/IND/2023/EC/01,"New Chemical Manufacturing unit at village Dhamanheri, Siel Chemical Complex, Tehsil-Rajpura, District-Patiala , State-Punjab. by M/s Chemoro Industries Limited.",CHEMORO INDUSTRIES LIMITED,EC Granted,EC,
4,245,SIA/PB/IND/30880/2018,SEIAA/PB/IND/EIA/2019/03,M/s Salasar Castings,SALASAR CASTINGS,EC Granted,EC,
5,246,SIA/PB/MIN/148404/2020,SEIAA/PB/MIN/EC/2020/03,"of Mining lease Located at Village Dastul Sahib Wala, Tehsil & District Ferozepur on the Agricultural Land having an area of  4.57 ha",PRIME VISION INDUSTRIES PVT LTD,EC Granted,EC,
6,247,SIA/PB/MIS/101664/2019,SEIAA/PB/NCP/2019/EC/10,"""Guildford Square"" by Chandigarh Builders & promoters",M/S CHANDIGARH BUILDERS AND PROMOTERS,EC Granted,EC,
7,248,SIA/PB/MIN/148725/2020,SEIAA/PB/MIN/EC/2020/24,SANDWAL GRAVELS GRAVELS,M/S PRIME VISION INDUSTRIES PRIVATE LIMITED (MINE),EC Granted,EC,
8,249,SIA/PB/MIN/37194/2015,,earth mining for brick killin in the revenue estate of vill. hakimpur tehsil bharso distt. patiala by gupta bricks industries.,GUPTA BRICKS INDUSTRIES,Delisted,EC,
9,250,SIA/PB/MIN/34611/2015,,gobindgramudyogsamitibko,GOBIND GRAM UDYOG SAMITI BKO,WithdrawEC,EC,
0,251,SIA/PB/NCP/19203/2017,SEIAA/PB/IND/2018/EIA/02,"Hi-Tech ""Cycle Valley""",PUNJAB SMALL INDUSTRIES AND EXPORT CORPORATION LIMITED,EC Granted,EC,
1,252,SIA/PB/MIN/38456/2016,,BB & CO BKO MINING SITE AT WARHA DRAKA KOTKAPURA FARIDKOT,BB BKO COMPANY,Delisted,EC,
2,253,SIA/PB/NCP/42969/2016,SEIAA/PB/BLDG CONST/EC/2016/10,Emerging Heights III,EMERGING INDIA HOUSING CORPORATION PVT LTD,EC Granted,EC,
3,254,SIA/PB/MIN/59428/2016,SEIAA/PB/MINING(NON-COAL)/EC/2017/22,Chak Bahmanian Sand mining Project,GM CUM MINING OFFICER DIC PUNJAB,EC Granted,EC,
4,255,SIA/PB/MIN/59433/2016,SEIAA/PB/MINING(NON-COAL)/EC/2017/24,Chak Budala Sand Mining Project,GM CUM MINING OFFICER DIC PUNJAB,EC Granted,EC,
5,256,SIA/PB/MIS/255430/2022,SEIAA/PB/MIS/2022/EC/07,FUTURE HEIGHTS,SANJIV KUMAR,EC Granted,EC,
6,257,SIA/PB/MIN/63033/2017,,Aaspur sand bajri mining project,AASPUR SAND BAJRI MINING PROJECT,TransferToDEIAA,EC,
7,258,SIA/PB/MIN/42273/2016,,Mining of Brick Earth in Village Bhagwantpur By M/s Milkhi Ram BKO,MILHKI RAM BKO,Delisted,EC,
8,259,SIA/PB/MIS/66039/2021,SEIAA/PB/MIS/2021/EC/(EXPANSION)/06,ROYAL RESIDENCY,ROYAL RESIDENCY BY OMAXE LIMITED,EC Granted,EC,
9,260,SIA/PB/MIN/42893/2016,,"brick earth mining in the revenue estate of vill.nurpur,tehsil dera baba nanak distt.gurdaspur by the m/s priyanka gram udyog samiti,shahzada",PRYANKA GRAM UDYOG SAMITI,Delisted,EC,
0,261,SIA/PB/IND/22215/2018,SEIAA/PB/IND/EC/2020/18,Steel Manufacturing Unit for increasing the production capacity to 330 TPD by M/s Punjab Steels,PUNJAB STEELS,EC Granted,EC,
1,262,SIA/PB/NCP/22969/2018,SEIAA/PB/NCP/EIA-VIO/2018/1,"Coral Mall” at Nakodar Road Jalandhar, Punjab",SHALIMAR CORP LIMITED,EC Granted,EC,
2,263,SIA/PB/MIN/427705/2023,,"Proposed sand mining project (Boulder, gravel, sand) as per DSR NO. SEIAA/MS/2022/1318 with production capacity of  21174 TPA over an area of 2.09 Ha on the agricultural land  located at village- Dollowal, tehsil & District-RupnagarPunjab through XEN/DMO District Rupnagar, Government of Punjab.",Department of Irrigation,Pending at PP due to eds,EC,
3,264,SIA/PB/MIN/150650/2020,SEIAA/PB/MIN/EC/2020/08,"Mining lease Kohala located at  Village- Kohala  , Tehsil-Zira, District–Ferozepur, Punjab on the Agricultural Land having an area of  1.99 ha",PRIME VISION INDUSTRIES PVT LTD,EC Granted,EC,
4,265,SIA/PB/IND/35216/2015,,BRICK KILN,.............,Delisted,EC,
5,266,SIA/PB/MIS/127933/2019,SEIAA/PB/NCP/2019/26,Aura Gazania,AURA BUILDTECH PVT LTD,EC Granted,EC,
6,267,SIA/PB/MIN/38213/2016,,BRICK EARTH MINNING,SHIVALIK BRICKS INDUSTRIES,Delisted,EC,
7,268,SIA/PB/MIS/135168/2020,SEIAA/PB/MIS/EC/2020/06,"Commercial Project at Village-Bishangarh & Bishanpura Zirakpur, Tehsil Derabassi, S.A.S Nagar, Punjab by M/s V.R. Developers.",M/S V R DEVELOPERS,EC Granted,EC,
8,269,SIA/PB/IND1/411440/2022,SEIAA/PB/IND/2022/EC/22,"Expansion of the existing steel manufacturing unit namely “M/s Devbhoomi Casting Pvt. Ltd.” for increasing the production capacity from 84 TPD  (29,400 TPA) to 288 TPD (1,00,800 TPA) located at Transport Nagar, Village Kumbra, Mandi Gobindgarh, Distt. Fatehgarh Sahib, Punjab.",M/S DEVBHOOMI CASTING PVT. LTD.,ADS by SEAC,EC,
9,270,SIA/PB/MIS/61949/2019,SEIAA/PB/MIS/2022/EC(MOD)/01,Modernization of Residential Township,UNITECH LTD.,EC Granted,EC,
0,271,SIA/PB/MIN/37386/2015,,AGGARWAL BRICKS MFG MINING SITE AT KOTKAPURA,AGGARWAL BRICKS MFG CO,Delisted,EC,
1,272,SIA/PB/MIN/174029/2020,SEIAA/PB/MIN/EC/2020/28,"ADB Rail Part – I Sand Mining Project, village- Arzi Derya Bramd Rail,  District- SBS Nagar, State Punjab by M/s Mahadev Enclave Private Limited",M/S MAHADEV ENCLAVE PRIVATE LIMITED,EC Granted,EC,
2,273,SIA/PB/NCP/32084/2015,,WESTERN TOWER,STAR REALTECH AND DEVELOPERS PRIVATE LTD,WithdrawEC,EC,
3,274,SIA/PB/MIN/36157/2015,,Ranjan Kumar BKO,RANJAN KUMAR BKO,Delisted,EC,
4,275,SIA/PB/MIN/48254/2016,,M/s  Rajinder Kumar Raj Kumar BKO   Village Ghubaya Tehsil Jalalabad Distt. Fazilka  (Punjab),RAJINDERKUMARRAJKUMARBKO,Delisted,EC,
5,276,SIA/PB/MIN/49421/2016,,Shiv Bricks Company,SHIVBRICKSCOMPANY,Delisted,EC,
6,277,SIA/PB/MIN/416003/2023,SEIAA/PB/MIN/2023/EC/03,"Sukhera Bodla-I , II & III Sand Mining Project by Executive Engineer Cum District Mining Officer, Drainage-Cum-Mining & Geology Division, Water Resources Department, Fazilka Division",EXECUTIVE ENGINEER CUM DISTRICT MINING OFFICER DRAINAGE CONST DIV FAZILKA,EC Granted,EC,
7,278,SIA/PB/MIN/70521/2017,SEIAA/PB/NCP/Min/Non-Coal/EC/2017/36,Shero Nigah Sand Mining project,AMRITSAR SAND MINING PROJECT,Delisted,EC,
8,279,SIA/PB/IND/77225/2021,SEIAA/PB/IND/2022/EC/17,"Proposed Clinker Grinding Unit with Cement Production Capacity of 3.0 Million TPA and D.G. Set (2 x 6 MW) at Village: Sadhroar, Tehsil: Rajpura, District: Patiala and Village: Haripur, Tehsil & District: Fatehgarh Sahib (Punjab) by M/s. UltraTech Cement Limited (Unit: Rajpura Cement Works)",M/s. UltraTech Cement Ltd.,EC Granted,EC,
9,280,SIA/PB/IND2/205298/2021,SEIAA/PB/IND2/EC/12,Manufacturing of Bulk drugs and Drug Intermediate of 420 MTPA capacity by DBN Chemicals Pvt. Ltd.,M/S D.B.N. CHEMICALS PVT. LTD.,EC Granted,EC,
0,281,SIA/PB/NCP/57309/2016,SEIAA/PB/NCP/EC/2017/13,BRAMPTON HEIGHTS,M/s Cornerstone Buildcon Private Limited,EC Granted,EC,
1,282,SIA/PB/NCP/73971/2018,SEIAA/PB/NCP/EC/2018,ROYAL AVENUE,V V BUILDERS,EC Granted,EC,
2,283,SIA/PB/INFRA2/417590/2023,SEIAA/PB/MIS/2023/EC/06,“Connaught Estate”  by M/s Pamposh Town Planners Private Limited,PAMPOSH TOWN PLANNERS PRIVATE LIMITED,EC Granted,EC,
3,284,SIA/PB/NCP/71644/2017,SEIAA/PB/NCP/2017/EC/29,PUNJAB LEGISLATORS FLATS,PUNJAB LEGISLATURE CO OPERATIVE HOUSE BUILDING SOCIETY LTD,EC Granted,EC,
4,285,SIA/PB/IND/37520/2010,SEIAA/PB/IND/EC/2019/12,"Steel Manufacturing Unit M/s Madhav Alloys Pvt. Ltd. for increasing the production capacity to 5,25,000 TPA of Billets/Steel Ingots,  5,25,000 TPA of TMT bars, 1,20,000 TPA of ERW & M.S Black pipes/Ga",MADHAV ALLOYS PVT LTD,EC Granted,EC,
5,286,SIA/PB/MIN/41088/2016,,Excavation of Brick Earth/Ordinary Earth for Brick Kiln of M/s Vinod Kumar B.K.O.,VINOD KUMAR B K O,Delisted,EC,
6,287,SIA/PB/MIS/262424/2022,SEIAA/PB/MIS/2022/EC/13,Industrial & Warehouse Project,COLOSSAL WAREHOUSE AND LOGISTICS PRIVATE LIMITED,EC Granted,EC,
7,288,SIA/PB/MIN/423181/2023,,"Proposed Sand Mining (boulder, gravel, sand) project (site no PO_SN_BL_ST_4A_4B)as per approved DSR No. SEIAA/MS/2023/212 with production capacity of 51629 TPA over an area of 3.87 ha on the Sutlej riverbed located at Village- ADB Rail, Tehsil- Balachaur District- SBS Nagar, State Punjab through Executive Engineer/SBS Nagar, Drainage cum Mines and Geology WRD Punjab",EXECUTIVE ENGINEER-CUM- DISTRICT MINING OFFICER,Pending at PP due to eds,EC,
8,289,SIA/PB/IND1/423731/2023,SEIAA/PB/IND/2023/EC/03,M/s Belco Special Steels Pvt. Ltd.,BELCO SPECIAL STEELS PVT. LTD.,ADS by SEIAA,EC,
9,290,SIA/PB/MIN/49321/2016,,M/s Ganesh Bricks Company,GANESH BRICKS COMPANY,Delisted,EC,
0,291,SIA/PB/NCP/71644/2017,SEIAA/PB/NCP/2017/EC/29,PUNJAB LEGISLATORS FLATS,PUNJAB LEGISLATURE CO OPERATIVE HOUSE BUILDING SOCIETY LTD,EC Granted,EC,
1,292,SIA/PB/MIN/33599/2015,,"DIC-Sand mining project at Village-Behkfattu, Firozpur",DIC PUNJAB,Delisted,EC,
2,293,SIA/PB/IND/32054/2018,SEIAA/PB/IND/EIA/2019/05,M/s Dasmesh Castings (P) Limited,DASMESH CASTINGS PVT LTD,EC Granted,EC,
3,294,SIA/PB/IND2/415253/2023,SEIAA/PB/IND/2023/EC/05,Sanathan Polycot Pvt. Ltd. Proposed greenfield Project for Manufacturing of Manmade Fiber,SANATHAN POLYCOT PRIVATE LIMITED,Agenda Uploaded by SEIAA,EC,
4,295,SIA/PB/MIN/178189/2020,SEIAA/PB/MIN/EC/2020/29,Behak Gujjran Sand mining project,PRIME VISION INDUSTRIES PVT LTD,EC Granted,EC,
5,296,SIA/PB/MIN/178584/2020,SEIAA/PB/MIN/EC/2020/26,Sand Mining Project at Village Jalata area 1.43 ha,PRIME VISION INDUSTRIES PVT LTD,EC Granted,EC,
6,297,SIA/PB/MIS/42719/2018,SEIAA/PB/MIS/EC/2020/02,"Expansion of Group Housing Project "" Hero Homes"" by M/s Hero Realty Pvt Ltd",MS HERO REALTY PVT LTD,EC Granted,EC,
7,298,SIA/PB/NCP/73971/2018,SEIAA/PB/NCP/EC/2018,ROYAL AVENUE,V V BUILDERS,EC Granted,EC,
8,299,SIA/PB/MIN/41088/2016,,Excavation of Brick Earth/Ordinary Earth for Brick Kiln of M/s Vinod Kumar B.K.O.,VINOD KUMAR B K O,Delisted,EC,
9,300,SIA/PB/MIS/262424/2022,SEIAA/PB/MIS/2022/EC/13,Industrial & Warehouse Project,COLOSSAL WAREHOUSE AND LOGISTICS PRIVATE LIMITED,EC Granted,EC,
0,301,SIA/PB/IND/61014/2021,SEIAA/PB/IND/2022/EC/05,"M/s Madhav KRG HRC Pvt. Ltd. (MKHPL) proposed Steel Manufacturing Unit at Village Akalgarh & Bhagwanpura, Amloh-Bhadson Road, Near Toll Plaza, Tehsil Nabha & Amloh, Distt. Patiala & Fatehgarh Sahib, Punjab.",MADHAV KRG HRC PVT. LTD.,EC Granted,EC,
1,302,SIA/PB/NCP/31689/2015,,PALACE ENCLAVE,PALACE INFRATECH PVT LTD,Delisted,EC,
2,303,SIA/PB/NCP/42930/2016,SEIAA/PB/BC/EC/2016/14,"Group Housing Project Site No. 1 “Hero Homes” located at Sector-88, Distt. SAS Nagar (Mohali), Punjab By M/s. Hero Realty Pvt. Ltd.",HERO REALTY LIMITED,EC Granted,EC,
3,304,SIA/PB/NCP/32425/2015,,"GBP Centrum 
Proponent Gupta Builders & Promoters Pvt. Ltd.",GUPTA BUILDERS AND PROMOTERS PVT LIMITED,Delisted,EC,
4,305,SIA/PB/MIN/423699/2023,SEIAA/PB/MIN/2023/EC/16,"Jaloke Sand Mine Cluster 01 [Cluster: Jaloke And Jaloke-2] by Executive Engineer-Drainage Cum-Mining & Geology Division Tarn Taran, Canal Complex, Near Railway Station, Amritsar, Punjab",BARI DOAB DRAINAGE DIVISION AMRITSAR,Under examination of SEIAA after SEAC,EC,
5,306,SIA/PB/MIN/49249/2016,,Mining of Brick Earth in Village Kotli by M/S Dashmesh Trading Co BKO,DASHMESH TRADING COM BKO,Delisted,EC,
6,307,SIA/PB/MIN/49260/2016,,M/s Kamboj BKO,MS KAMBOJ BKO,Delisted,EC,
7,308,SIA/PB/NCP/5356/2015,,"HERO HOMES, BIRMI, LUDHIANA",HERO REALTY PVT LTD,Delisted,EC,
8,309,SIA/PB/MIS/230381/2021,SEIAAPB/MIS/2021/EC/18,"Affordable residential colony (Plotted) project namely “Aadhaar Enclave” is planned at Ram Tirath Road, village Wadala Bhittewad, Distt. Amritsar, Punjab by M/s Aadhaar Developers.",RESIDENTIAL COLONY BELONGS TO AADHAAR DEVELOPERS AT VILLAGE WADALA BHITTEWADH,EC Granted,EC,
9,310,SIA/PB/MIS/206248/2021,SEIAA/PB/MIS/EC/04,"Group Housing Residential Pocket 2B namely “Galaxy Heights II” at Sector 66A, 82 & 83, Distt. SAS Nagar, Mohali, Punjab by M/s Janta Land Promoters Private Limited.",JANTA LAND PROMOTERS PVT. LTD.,EC Granted,EC,
0,311,SIA/PB/MIN/38270/2016,,AMBAY BRICK KILN CO VILLAGE GORKHNATH TEHSIL BUDHLADA DISTT MANSA,AMBAY BRICKS KILAN CO,Delisted,EC,
1,312,SIA/PB/NCP/74916/2018,SEIAA/PB/NCP/EC/2018/10,IMPERIAL APARTMENTS,HARMONY COLONISERS PVT LTD,EC Granted,EC,
2,313,SIA/PB/NCP/74930/2018,SEIAA/PB/NCP/EC/Exp./2018/01,SUSHMA GRANDE NXT,SBL BUILDERS PVT LTD,EC Granted,EC,
3,314,SIA/PB/NCP/27851/2018,,SIA/PB/NCP/22969/2018,SHALIMAR CORP LIMITED,Pending at PP due to eds,EC,
4,315,SIA/PB/MIN/421294/2023,SEIAA/PB/MIN/2023/EC/07,"Proposed Sand Mining (boulder, gravel, sand) project as per approved DSR No. SEIAA/MS/2022/1318 with production capacity of 52554 TPA over an area of 4.74 ha on the Sutlej River Bed located at Village- Malewal, Tehsil Shri Chamkaur Sahib, District Rupnagar, Punjab through XEN/DMO District Rupnagar Govt. of Punjab",Department of Irrigation,ADS by SEAC,EC,
5,316,SIA/PB/MIN/423427/2023,SEIAA/PB/MIN/2023/EC/17,"Tangri-1 Sand Mining Project by Executive Engineer/SAS Nagar Drainage Cum-Mines & Geology Water Resources Department, Punjab",EXECUTIVE ENGINEER NANGAL MECHANICAL DIVISION WITH HEAD QUARTER MOHALI,Under examination of SEIAA after SEAC,EC,
