,index,project_number,file_number,project_name,company,proposal_status,project_type
0,,SIA/WB/IND/105345/2019,EN/T-II-1/012/2019,"PROPOSED EXPANSION OF CAPACITY OF STANDALONE CEMENT GRINDING UNIT FROM 1.6 MTPA TO 2 MTPA, AT MOHITNAGAR, NEAR JALPAIGURI, WEST BENGAL",STAR CEMENT LIMITED,EC Granted,EC
1,,SIA/WB/IND/19745/2016,EN/T-II-1/091/2018,"Expansion of Existing Cement Grinding Unit from 3.6 MTPA to 4.8 MTPA to produce Portland Slag Cement (PSC), Portland Pozzolana Cement (PPC), Ordinary Portland Cement (OPC), Composite Cement & Ground Granulated Blast Furnace Slag (GGBS) at Salboni, District: Paschim Medinipur (West Bengal) by M/s. JSW Cement Ltd.",JSW CEMENT LTD,EC Granted,EC
2,,SIA/WB/IND/208916/2021,,"Expansion of existing Cement Grinding Plant from 0.96 MTPA (2 x 600 TPD Ball mill + 1 x 2000 TPD VRM) to 1.2596 MTPA under Clause 7 II (b) of EIA Notification, 2006 by process optimization, increasing the number of working hours per day and annual wo",RASHMI CEMENT LIMITED,Delisted,EC
3,,SIA/WB/IND/219918/2021,,"Proposed Upgradation & Expansion of Existing Rolling Mill at NH-2, Delhi Road, Mouza- Belumilky, Vill: Chotobelu, Payarapur, Block: Serampore, Dist: Hooghly, West Bengal",BRAND ALLOYS PVT. LTD.,WithdrawEC,EC
4,,SIA/WB/IND/220466/2021,,Rolling mill steel plant,M/S GREAT EASTERN INFRACON (P) LTD.,WithdrawEC,EC
5,,SIA/WB/IND/220476/2021,,Rolling Mill Steel Plant,M/S GREAT EASTERN INFRACON (P) LTD.,WithdrawEC,EC
6,,SIA/WB/IND/221205/2021,,Expansion of Rolling Mill Steel Plant,M/S GREAT EASTERN INFRACON (P) LTD.,WithdrawEC,EC
7,,SIA/WB/IND/226566/2021,,Environmental Clearance for Rolling Mill Plant for MS Round / MS Flat production of M/s Bamlia Steel Udyog (P) Ltd. at Village: Dakshin Bansai; P.O: Raghunathpur; P.S: Uttarpara;  Dist.: Hooghly; West Bengal; PIN - 712245,BAMLIA STEEL UDYOG (P) LIMITED,Delisted,EC
8,,SIA/WB/IND/227505/2021,,Rolling Mill Steel Plant,M/S GREAT EASTERN INFRACON (P) LTD.,Delisted,EC
9,,SIA/WB/IND/29902/2016,,"Expansion from 90,000 TPA steel billets and 1,62,000 TPA wire rods to 1,92,000 TPA wire rods and 60,000 TPA HB wires.",SUPERSHAKTI METALIKS LIMITED,Delisted,EC
10,,SIA/WB/IND/31555/2019,EN/T-II-1/020/2019,"Installation of 2 X 20 MT Induction Furnaces with Continuous Caster and 1,48,800MT/Annum Rolling Mill",SHREE RAMDOOT ROLLERS PVT LTD,EC Granted,EC
11,,SIA/WB/IND/34029/2016,EN/T-II-1/069/2018,"Proposed expansion of existing Plant by additional installation of 4x15 T Induction Furnaces along with 1,00,000 TPA capacity Rolling Mill",CALSTAR SPONGE LIMITED,EC Granted,EC
12,,SIA/WB/IND/35205/2018,EN/T-II-1/106/2018,"Expansion from 90,000 TPA steel billets and 1,62.000 TPA Wire rods to 1,92,000 TPA Wire rods and 60,000 TPA HB wire",SUPERSHAKTI METALIKS LIMITED,EC Granted,EC
13,,SIA/WB/IND/36650/2018,EN/T-II-1/102/2018,"Enhancement in production capacity from  1,56,000 TPA to 2, 46,000 TPA of coke oven plant of M/s Metakik Fuel Private Limited, J.L no. 115, Mouza-Amba, Vill: Gokulpur, P.O: Samraipur, Kharagpur, Dist:",METALIK FUEL PRIVATE LIMITED,EC Granted,EC
14,,SIA/WB/IND/41755/2018,EN/T-II-1/066/2018,"Setting up DI Pipe Manufacturing Unit of capacity 97,200 MT/ Annum",KEJRIWAL CASTINGS LIMITED,EC Granted,EC
15,,SIA/WB/IND/41967/2018,EN/T-II-1/067/2018,Installation of 4 No. 15 MT Induction Furnaces with Ladle Refining Furnace and Continuous Caster and Rolling Mill and Wire Block Mill with installed capacity 600 TPD,RATTAN ISPAT PRIVATE LIMITED,EC Granted,EC
16,,SIA/WB/IND/43110/2018,EN/T-II-1/099/2018,"Environmental Clearance for Proposed set up of Induction Furnace, Rolling Mill Plant & Wire Rod Mill for manufacturing of billets, TMT Bars & wire rods of M/s Amiya Steel Private Limited - Unit II at ",AMIYA STEEL PRIVATE LIMITED,EC Granted,EC
17,,SIA/WB/IND/50308/2019,,"Installation of 2 X 20 MT Induction Furnaces and 1,48,800 MT/Annum Rolling Mill",SHREE RAMDOOT ROLLERS PVT LTD,WithdrawEC,EC
18,,SIA/WB/IND/56059/2019,EN/T-II-1/020/2019,"Installation of 2 X 20 MT Induction Furnaces with Continuous Caster and 1,48,800 MT/Annum Rolling Mill",SHREE RAMDOOT ROLLERS PVT LTD,Delisted,EC
19,,SIA/WB/IND/57057/2019,EN/T-II-I/019/2019,"Installation of 2x10 Tonnes lnduction Furnaces with Ladle Refining Furnace, Continuous Caster and 3000 MT/Month Rolling Mill",RUHR ISPAT PVT LTD,EC Granted,EC
20,,SIA/WB/IND/57255/2018,,"Proposed Expansion of Existing Steel Plant by installation of additional 2x10 tonne Induction Furnace, 1x10 tonne Ladle refining Furnace, 1 no. 2 strand continous Caster and rolling mill of capacity 120000 TPA by M/S Expandable Enterprises Pvt. Ltd.",EXPANDABLE ENTERPRISES (P) LTD.,WithdrawEC,EC
21,,SIA/WB/IND/57318/2018,EN/T-II-1/053/2018,"Proposed expansion of Steel Melting Shop Project of M/s R.S. Concast Limited, AT:  Bamunara Industrial Estate, P.O. Bamunara, P.S.  Kanksa , Dist : Paschim  Burdwan, West Bengal",R S CONCAST LIMITED,EC Granted,EC
22,,SIA/WB/IND/58870/2018,EN/T-II-1/003/2018,"Proposed Expansion of Existing Steel Plant by installation of additional 2x10 tonneInduction Furnace, 1x10 tonne Ladle refining Furnace, 1 no. 2 strand continous Casterand rolling mill of capacity 120000 TPA by M/S Expandable Enterprises Pvt. Ltd.",EXPANDABLE ENTERPRISES (P) LTD.,Delisted,EC
23,,SIA/WB/IND/58900/2020,EN/T-II-1/066/2020,"Expansion of Cement Production Capacity of Existing Stand-alone Clinker Grinding Unit (2.0 to 5.0 MTPA) at Sonar Bangla Cement Works, Village: Dhalo, P.O: Gankar, Block: Raghunathganj-I, District: Murshidabad (West Bengal) by M/s. UltraTech Cement Limited (Unit: Sonar Bangla Cement Works).",M/s. UltraTech Cement Ltd.,EC Granted,EC
24,,SIA/WB/IND/60630/2021,EN/T-II-1/088/2021,"Expansion of production from 36,000TPA with 3x50 TPD Kiln to 58,500 TPA with the installation of 3x65 TPD Preheaters", ARYAVRATA STEEL PRIVATE LIMITED,EC Granted,EC
25,,SIA/WB/IND/61179/2019,,"Proposed expansion of existing Steel Plant by installation of 3x15 T Induction Furnaces instead of 2x8 T Induction Furnaces with matching LRF & CCM and by increasing Rolling Mill capacity from 48,000 TPA to 96,000 TPA and setting up a Galvanizing unit of 160 MT/day",GAJANAN IRON PRIVATE LIMITED,WithdrawEC,EC
26,,SIA/WB/IND/61186/2021,EN/T-II-1/057/2021,"Proposed 56,000 TPA GREEN FIELD Coal Tar Distillation Plant for production of 30,800 TPA of Coal Tar Pitch; 22,120 TPA of Creosote Oil (light and heavy) and 1680 TPA of Crude Naphthalene",B S TAR PVT. LTD.,Transfered SEIAA To MOEFCC,EC
27,,SIA/WB/IND/61389/2019,EN/T-II-1/054/2019,"Expansion Project by Installation of 1 x 8 Ton Induction Furnace with production capacity of 24,960 Tons/Annum at JL No. 22, WBIDC Plasto Steel Park, Village – Kadasole, PO – Ghutgoria, PS – Barjora, District – Bankura, Pin 722202, West Bengal.",SURYA ALLOY INDUSTRIES LIMITED,Delisted,EC
28,,SIA/WB/IND/61399/2014,EN/T-II-1/058/2019,"Proposed Expansion of existing Steel Plant by installation of 3x15 T Induction Furnaces instead of 2x8 T Induction Furnaces with matching LRF & CCM and by increasing Rolling Mill capacity from 48,000 TPA to 96,000 TPA and setting up a Galvanising Unit of 160 MT/day capacity",GAJANAN IRON PRIVATE LIMITED,EC Granted,EC
29,,SIA/WB/IND/61664/2019,EN/T-II-1/052/2019,"Proposed expansion of MS Billet/Ingot and TMT BAR from 92,160 MTPA to 2,00,160 MTPA installing 3 nos of induction furnace with capacity of 12 MT each",HR ISPAT PVT LTD,EC Granted,EC
30,,SIA/WB/IND/61759/2019,EN/T-II-1/076/2019,"Proposed Expansion for Production of M.S. Ingots/Billets by installation of Induction Furnace at Village: Suboljote, P.O Nemai, Via Matigara, P.S –Matigara, Darjeeling, by North East Ferro Alloys’ Co. Pvt. Ltd",NORTH EAST FERRO ALLOYS CO PVT LTD,Delisted,EC
31,,SIA/WB/IND/66688/2010,,"Proposed Expansion of the existing Steel Plant by installation of 4x30 T Induction Furnaces with 1x40T LRF & two (2-strand each) CCM and enhancement of the capacity of the Rolling Mill from 2,22,000 TPA to 5,02,000 TPA",ADHUNIK INDUSTRIES LTD,WithdrawEC,EC
32,,SIA/WB/IND/67558/2010,EN/T-II-1/156/2021,"Proposed Expansion of the existing Steel Plant by installation of 4x30 T Induction Furnaces with 1x40T LRF & two (2-strand each) CCM and enhancement of the capacity of the Rolling Mill from 2,22,000 TPA to 5,02,000 TPA",ADHUNIK INDUSTRIES LTD,Transfered SEIAA To MOEFCC,EC
33,,SIA/WB/IND/69795/2019,EN/T-II-1/021/2019,Installation of 2 No. 10 MT Induction Furnaces,C.P. RE-ROLLERS LIMITED,EC Granted,EC
34,,SIA/WB/IND/70202/2018,,"Proposed Expansion of Cast Iron Casting Product at Kulgachia, P.O. Mahishrekha, P.S. Uluberia & District – Howrah, West Bengal",CRESCENT FOUNDRY COMPANY PRIVATE LIMITED,Pending at PP due to eds,EC
35,,SIA/WB/IND/78453/2018,,"Proposed Expansion of Cast Iron Casting Product at Kulgachia, P.O Mahishrekha, P.S Uluberia & District – Howrah, West Bengal.",CRESCENT FOUNDRY COMPANY PRIVATE LIMITED,Delisted,EC
36,,SIA/WB/IND2/152174/2020,EN/T-II-1/013/2020,"Exploratory drilling (10 wells) in NELP VII block WB-ONN-2005/4 situated in North 24 Parganas and Nadia districts, West Bengal.",HSE MBA BASIN,EC Granted,EC
37,,SIA/WB/IND2/207364/2021,EN/T-II-1/112/2021,PROPOSED MANUFACTURING OF PHARMA INTERMEDIATE AND ACTIVE PHARMACEUTICAL INTERMEDIATE (API) / BULK DRUGS,AURIO PHARMA LABORATORIES PVT. LTD,Delisted,EC
38,,SIA/WB/IND2/240548/2021,EN/T-II-1/018/2022,"Proposed Grain-based Distillery Unit for production of 160 KLD Anhydrous Ethanol along with Captive Power Plant (4.4 MW) of M/s. Pratishtha Spirits Private Limited at Plot No. A9 & A10 near WBIDC Office, Panagarh Industrial Park, Paschim Bardhhaman, ",PRATISHTHA SPIRITS PRIVATE LIMITED,WithdrawEC,EC
39,,SIA/WB/IND2/254703/2022,EN/T-II-1/020/2022,O2 Chemicals Private Limited, O2 CHEMICALS PRIVATE LIMITED,Transfered SEIAA To MOEFCC,EC
40,,SIA/WB/IND2/277881/2022,EN/T-II-1/042/2022,"Proposed Onshore Exploratory drilling of 7 wells in Bengal Onshore OALP-III Block BP-ONHP-2018/1 situated in North 24 Parganas and South 24 Parganas districts, West Bengal by M/s. ONGC Limited, MBA Basin", OIL AND NATURAL GAS CORPORATION LIMITED,EC Granted,EC
41,,SIA/WB/IND2/278404/2022,EN/T-II-1/043/2022,"Drilling of 20 Shale gas Exploratory Wells in Raniganj (South) CBM Block, West Bengal by Great Eastern Energy Corporation Limited",M/S. GREAT EASTERN ENERGY CORPORATION LTD,EC Granted,EC
42,,SIA/WB/IND2/28964/2006,EN/T-II-1/081/2018,Proposed Expansion of PTA manufacturing capacity by setting up a plant of 1.25 MTPA capacity.,MCPI,EC Granted,EC
43,,SIA/WB/IND2/38362/2018,,Establishment of one LPG yard (storage facility) consisting of 2 nos. 10 MT Bullet,EXIDE INDUSTRIES LIMITED,Pending at PP due to eds,EC
44,,SIA/WB/IND2/42446/2018,EN/T-II-1/071/2019,TANDHAN BIOCHEMICALS PRIVATE LIMITED,TANDHAN BIOCHEMICALS PRIVATE LIMITED,EC Granted,EC
45,,SIA/WB/IND2/44360/2016,EN/T-II-1/010/2020,"Proposed 200 KLPD Grain Based Distillery along with 5.0 MW Co-Generation Power Plant at Village Jorsha & Teghoria, Tehsil Mejhia, District Bankura (West Bengal) by Ankoor Distilleries Private Limited",ANKOOR DISTILLERIES PRIVATE LIMITED,Delisted,EC
46,,SIA/WB/IND2/99131/2019,,Sai Fertilizers Pvt. Ltd.,SAI FERTILIZERS PVT LTD,Delisted,EC
47,,SIA/WB/IND3/247368/2021,EN/T-II-1/017/2022,"Proposed Expansion of existing Bulk Drug Manufacturing Unit (API) of M/s. East India Pharmaceutical Works Limited at Raturia, Waria Road, P.O – Durgapur-15, P.S. – Coke Oven, District – Paschim Burdwan , PIN – 713215", EAST INDIA PHARMACEUTICAL WORKS LIMITED,Delisted,EC
48,,SIA/WB/IND3/72391/2020,EN/T-II-1/021/2020,"Proposed Synthetic Resin Production Plant (UF Resin, PF Resin & MF Resin) for Laminate Manufacturing Unit of M/s Intim Laminates Pvt. Ltd.",M/S INTIM LAMINATES PVT. LTD.,EC Granted,EC
49,,SIA/WB/MIN/125834/2019,,PALSARA BLACK STONE MINE,WEST BENGAL MINERAL DEVELOPMENT AND TRADING CORPORATION LIMITED,Delisted,EC
50,,SIA/WB/MIN/133590/2019,EN/T-II-1/01/2020,Palsara Black Stone Mine,WEST BENGAL MINERAL DEVELOPMENT AND TRADING CORPORATION LIMITED,Delisted,EC
51,,SIA/WB/MIN/141542/2020,EN/T-II-1/009/2020,PALSARA BLACK STONE MINE,WEST BENGAL MINERAL DEVELOPMENT AND TRADING CORPORATION LIMITED,EC Granted,EC
52,,SIA/WB/MIN/166218/2020,EN/T-II-1/033/2020,"Malbagicha Sand Mine (Area- 1.14 Hectares) on Silabati River on Plot No. 48(P), 56, 57(P), 58(P), 59, 60, 61(P), & 62(P)",ATAUR RAHAMAN MONDAL,Delisted,EC
53,,SIA/WB/MIN/166284/2020,EN/T-II-1/040/2020,Bhattagram Sand Mine (Area- 0.80 Hectares) on Silabati River on Plot No. 680(P),MR. BABLU SARKAR,Delisted,EC
54,,SIA/WB/MIN/166343/2020,EN/T-II-1/030/2020,"Bhalukmura Sand Mine (Area- 2.02 Hectares) on Silabati River on Plot No. 16(P), 63(P) & 77(P)",PRASANTA KARAK,Delisted,EC
55,,SIA/WB/MIN/166404/2020,EN/T-II-1/034/2020,"Baranda Sand Mine (Area- 0.90 Hectares) on Silabati River on Plot No. 1(P), Mouza-Baranda, P.S-Garhbeta, Dist-Paschim Medinipur.",ATAUR RAHAMAN MONDAL,Delisted,EC
56,,SIA/WB/MIN/166445/2020,EN/T-II-1/036/2020,"Bhimbar Sand Mine (Area: 0.88 ha) on Kangshabati River Plot No. 392(P) & 393(P),, P.S. Keshpur, District- Paschim Medinipore",SWAPAN DAS BHOWMIK,Delisted,EC
57,,SIA/WB/MIN/166486/2020,EN/T-II-1/025/2020,"River Bed Sand Mining by M/s Excel Movers at Bhagabankhali 1, Purba Medinipur, West bengal",EXCEL MOVERS,Delisted,EC
58,,SIA/WB/MIN/166540/2020,EN/T-II-1/031/2020,"MOLDANGA SAND MINE (AREA- 0.42 HECTARES) ON SILABATI RIVER ON Plot No.- 473(P), MOUZA- MOLDANGA, P.S. - GARHBETA, DISTRICT- PASCHIM MEDINIPUR, STATE- WEST BENGAL",PRASANTA KARAK,Delisted,EC
59,,SIA/WB/MIN/166548/2020,,"Chhotapasha Sand Mine (Area: 1.42ha) on Kangshabati River on Plot No. 266 (P), P.S. Keshpur, District Paschim Medinipore",SHEIKH MURSED ALI,Delisted,EC
60,,SIA/WB/MIN/167675/2020,EN/T-II-1/039/2020,"BHATPARA SAND MINE (AREA-2.30 HECTARES) ON KANGSHABATI RIVER ON Plot No.-172(P)& 194(P),LOCATED AT MOUZA- BHATPARA, P.S. - MEDINIPUR, DISTRICT- PASCHIM MEDINIPUR, STATE- WEST BENGAL,JL NO. 84",SUBHRANGSU KUMAR GHOSH,Delisted,EC
61,,SIA/WB/MIN/167774/2020,EN/T-II-1/038/2020,"NALDUMRA SAND MINE (AREA- 5.00 HECTARES) ON KANGSHABATI RIVER ON Plot No.-46(P).LOCATED AT MOUZA- NALDUMRA, P.S. - MIDNAPORE, DISTRICT- PASCHIM MEDINIPUR, STATE- WEST BENGAL, JL NO. 82",SHEIKH FIROZUDDIN,Delisted,EC
62,,SIA/WB/MIN/168432/2020,EN/T-II-1/037/2020,"CHAKMANSUR SAND MINE (AREA- 2.16HECTARES) ON KANGSHABATI RIVER ON Plot No.-193(P) LOCATED AT MOUZA- CHAKMANSUR, P.S. -KESHPUR, DISTRICT- PASCHIM MEDINIPUR, STATE- WEST BENGAL,JL NO. 617",SEK BARIK,Delisted,EC
63,,SIA/WB/MIN/171096/2020,EN/T-II-1/035/2020,"RAGHUNATHPUR SAND MINE (AREA- 4.89 HECTARES) ON KANGSHABATI RIVER ON Plot No.-1041(P), 1003(P) & 1002(P), MOUZA- RAGHUNATHPUR, P.S. -MIDNAPORE, DISTRICT- PASCHIM MEDINIPUR, STATE- WEST BENGAL,JL NO. 271",SK. REJABUL,Delisted,EC
64,,SIA/WB/MIN/171781/2020,EN/T-II-1/022/2020,"Granite Stone Quarry Upardanga Nort Block at  Talsankra,Purulia, WestBengal",M/S TODI MINERALS,EC Granted,EC
65,,SIA/WB/MIN/172750/2020,EN/T-II-1/068/2020,Sk Sajahan Propitor,SK SAJAHAN PROPITOR,Delisted,EC
66,,SIA/WB/MIN/172808/2020,EN/T-II-1/069/2020,Manik Bera Proprietor,MANIK BERA PROPRIETOR,Delisted,EC
67,,SIA/WB/MIN/172925/2020,EN/T-II-1/067/2020,Suvendu Debnath proprietor,SUVENDU DEBNATH PROPRIETOR,Delisted,EC
68,,SIA/WB/MIN/173919/2020,,Riverbed Materials From Damodar River,SABIR ANSARI,Delisted,EC
69,,SIA/WB/MIN/174437/2020,EN/T-II-1/061/2020,Rajab Brick Field,SK. RAHIM,Delisted,EC
70,,SIA/WB/MIN/174530/2020,EN/T-II-1/024/2020,SAND MINING PROJECT AT RIVERBED OF KANGSABATI RIVER,SABIR ANSARI,Delisted,EC
71,,SIA/WB/MIN/175087/2020,EN/T-II-1/029/2020,"CHAKDAULAT SAND MINE (AREA- 1.47 HECTARES) ON KANGSHABATI RIVER ON Plot No.- 324(P), MOUZA- CHAKDAULAT, P.S. - MEDINIPUR, DISTRICT- PASCHIM MEDINIPUR, STATE- WEST BENGAL, JL NO. -285",IYAMIN MONDAL,Delisted,EC
72,,SIA/WB/MIN/175223/2020,EN/T-II-1/001/2021,"Subarnarekha river bed sand mining possesses by Srikanta Mondal over an area  4.99 hectare/ 5.00 Hectare at mouza - Dangariai, Dist - Jhargram for ordinary sand mining",SRIKANTA MONDAL - MGB 162,Delisted,EC
73,,SIA/WB/MIN/177481/2020,EN/T-II-1/023/2020,AMILASAI SAND MINE ON SUBARNAREKHA RIVER,VARIETY VYAPAAR PRIVATE LIMITED,Delisted,EC
74,,SIA/WB/MIN/177970/2020,EN/T-II-1/056/2020,ULIARA SAND MINE OF M/S BASU AGROFARMS PRIVATE LIMITED,"MS BASU AGROFARMS PRIVATE LIMITED,  ULIARA SAND MINE (DWARAKESHWAR RIVER)",Delisted,EC
75,,SIA/WB/MIN/179490/2020,,Dakhsin Rasulpur Brick Earth Mining project,CRYSTAL CONSULTANTS,Delisted,EC
76,,SIA/WB/MIN/179541/2020,,Bagbari Brick Soil Mining Project,CRYSTAL CONSULTANTS,Delisted,EC
77,,SIA/WB/MIN/179547/2020,,Bagbari Brick Soil Mining Project,CRYSTAL CONSULTANTS,Delisted,EC
78,,SIA/WB/MIN/179956/2020,,Gopiballavpur - I Sand Block MGB - 123 of Ashok kr. Bala,ASHOK KR. BALA,Delisted,EC
79,,SIA/WB/MIN/179964/2020,,Anail Brick Earth,CRYSTAL CONSULTANTS,Delisted,EC
80,,SIA/WB/MIN/180009/2020,,Brick Earth Mine Mouza Adna,CRYSTAL CONSULTANTS,Delisted,EC
81,,SIA/WB/MIN/180117/2020,EN/T-II-1/043/2020,Gopiballavpur - I Sand Block MGB - 123 of Ashok kr. Bala.,ASHOK KR. BALA,Delisted,EC
82,,SIA/WB/MIN/180162/2020,,Brick Earth Mine Mouza – Bahuthar,CRYSTAL CONSULTANTS,Delisted,EC
83,,SIA/WB/MIN/180186/2020,,Purba Bejpura Brick Earth,CRYSTAL CONSULTANTS,Delisted,EC
84,,SIA/WB/MIN/180294/2020,,Kamancha Brick Earth Mine,CRYSTAL CONSULTANTS,Delisted,EC
85,,SIA/WB/MIN/180347/2020,,Kumarganj Brick Soil Mining Project,CRYSTAL CONSULTANTS,Delisted,EC
86,,SIA/WB/MIN/180373/2020,,Brick earth Mine on Mouza – Laliabari,CRYSTAL CONSULTANTS,Delisted,EC
87,,SIA/WB/MIN/180560/2020,EN/T-II-1/041/2020,Gopiballavpur - I Sand Block MGB - 124 of  Ezaharul Hossain,EZAHARUL HOSSAIN,Delisted,EC
88,,SIA/WB/MIN/180576/2020,EN/T-II-1/042/2020,Gopiballavpur - I Sand Block MGB - 125 of Sk. Karim.,SK. KARIM,Delisted,EC
89,,SIA/WB/MIN/181121/2020,EN/T-II-1/002/2021,Subarnarekha river bed project by Sushanta Mondal,SUBRANAREKHA RIVER BED MINING BY SUSHANTA MONDAL,WithdrawEC,EC
90,,SIA/WB/MIN/181252/2020,EN/T-II-1/003/2021,"Subarnarekha river Bed project of Mandiara Dasadhikari Chanda, MSHB-1",MANDIRA DASADHIKARI CHANDA - MSHB 1,Delisted,EC
91,,SIA/WB/MIN/181566/2020,EN/T-II-1/045/2020,Hinjuri Sand Block 0117DR002,PRADIP MUKHERJEE,Delisted,EC
92,,SIA/WB/MIN/181602/2020,EN/T-II-1/044/2020,Hinjuri Sand Block 0117DR001 of Jana Engineering Works,JANA ENGINEERING WORKS,Delisted,EC
93,,SIA/WB/MIN/181622/2020,EN/T-II-1/046/2020,Damodar Mohan Sand Block 0105DM004 of Nikhil Kumar Roy,NIKHIL KUMAR ROY,Delisted,EC
94,,SIA/WB/MIN/183020/2020,EN/T-II-1/048/2020,KATNA SAND MINE OF M/S DEBRAJ ENTERPRISE,KATNA SAND MINE OF M/S DEBRAJ ENTERPRISE,Delisted,EC
95,,SIA/WB/MIN/183225/2020,EN/T-II-1/051/2020,River Bed Sand Mining project on Ajay River of M/s National Traders,M/S NATIONAL TRADERS,Delisted,EC
96,,SIA/WB/MIN/183441/2020,EN/T-II-1/047/2020,Rerapal Sand Block MSB-44 of Md. Moshiur Rahaman Khan,MD. MOSHIUR RAHAMAN KHAN,Delisted,EC
97,,SIA/WB/MIN/183457/2020,EN/T-II-1/049/2020,River Bed Sand Mining Project on Ajay River of Shri Laltu Dutta,RIVER BED SAND MINING PROJECT ON AJAY RIVER OF SHRI LALTU DUTTA,Delisted,EC
98,,SIA/WB/MIN/183586/2020,EN/T-II-1/050/2020,River Bed Sand Mining Project on Ajay River of Shri Laltu Dutta,RIVER BED SAND MINING PROJECT ON AJAY RIVER (3.50 HA.) OF SHRI LALTU DUTTA,Delisted,EC
99,,SIA/WB/MIN/183731/2020,EN/T-II-1/030/2021,Sand Mining On Damoder River Bed,SANJAY BHAKTA,Delisted,EC
100,,SIA/WB/MIN/183734/2020,EN/T-II-1/055/2020,River Bed Sand Mining Project on Ajay River of M/s Ganesh Nandy,M/S GANESH NANDY,Delisted,EC
101,,SIA/WB/MIN/183741/2020,EN/T-II-1/054/2020,Garhbeta Sand Block MGARB-29 of Prabhas Ghosh,PRABHAS GHOSH,Delisted,EC
102,,SIA/WB/MIN/183803/2020,,Jamalpur  Sand Mining(Selimabad)-Manas Kumar Dharas Kuma,RAY TECHNO SOLUTIONS,Delisted,EC
103,,SIA/WB/MIN/183978/2020,EN/T-II-1/064/2020,"MALYAN SAND MINE (AREA- 1.55 HECTARES) ON KANGSHABATI RIVER ON Plot No.-68(P) & 69(P) LOCATED AT MOUZA- MALYAN, P.S. - KESHPUR, DISTRICT- PASCHIM MEDINIPUR, STATE- WEST BENGAL, JL NO. 625",SITESH DHARA,Delisted,EC
104,,SIA/WB/MIN/184106/2020,EN/T-II-1/052/2020,Gopiballavpur – I Sand Block MGB – 103,PRANESHYAM RAKSHIT,WithdrawEC,EC
105,,SIA/WB/MIN/184139/2020,EN/T-II-1/014/2021,Gopiballavpur – I Sand Block MGB – 104,KARAMCHAND PAL,Delisted,EC
106,,SIA/WB/MIN/184355/2020,EN/T-II-1/015/2021,Gopiballavpur - I Sand Block MGB - 105,SK. KARIM,Delisted,EC
107,,SIA/WB/MIN/184626/2020,,BRICK SILT MINING FOR M/S MAMTA BRICK WORKS,M/S MAMTA BRICK WORKS,Delisted,EC
108,,SIA/WB/MIN/184855/2020,EN/T-II-1/060/2021,Subarnarekha River bed Project,CHAKRABORTY ENTERPRISE,Delisted,EC
109,,SIA/WB/MIN/184883/2020,,"Kotsimul Sand Mining on Kanki River, Maa Tara Builders",RAY TECHNO SOLUTIONS,Delisted,EC
110,,SIA/WB/MIN/184961/2020,,"Bangpur Sand Mine, Shri Dinanath Chawdhery",RAY TECHNO SOLUTIONS,Delisted,EC
111,,SIA/WB/MIN/184993/2020,EN/T-II-1/032/2021,PURBATOR SAND MINE,PURBATOR SAND MINE OF SHRI SANTOSH KUMAR CHOURASIA,Delisted,EC
112,,SIA/WB/MIN/185178/2020,EN/T-II-1/016/2021,Gopiballavpur – II Sand Block MGB – 166,SHAKTIPADA RAY,Delisted,EC
113,,SIA/WB/MIN/185269/2020,,"Dadpur Sand Mine ob Damodar River, Kamal Kumar Ghosh",RAY TECHNO SOLUTIONS,Delisted,EC
114,,SIA/WB/MIN/185370/2020,EN/T-II-1/027/2021,Gopiballavpur - II Sand Block MGB - 165,ANURAN KUMAR SENAPATI,Delisted,EC
115,,SIA/WB/MIN/185547/2020,,Akalpur Brick Soil Mining Project,CRYSTAL CONSULTANTS,Delisted,EC
116,,SIA/WB/MIN/185661/2020,,Diagram Brick Soil Mining Project For M/s Jodupur Bricks Field,CRYSTAL CONSULTANTS,Delisted,EC
117,,SIA/WB/MIN/185700/2020,,Dakshin Sahar Brick Soil Mining Project For M/s K.D. Brick Works-II,CRYSTAL CONSULTANTS,Delisted,EC
118,,SIA/WB/MIN/185745/2020,,Agampur Brick Earth Mining Project,CRYSTAL CONSULTANTS,Delisted,EC
119,,SIA/WB/MIN/185748/2020,,Lakhipur Brick Soil Mining Project For M/s No. 1 Lakhipur Brick Field (Extension Unit),CRYSTAL CONSULTANTS,Delisted,EC
120,,SIA/WB/MIN/185870/2020,,Kaligram Brick Soil Mining Project For M/s Radha Brick Field & Co. Unit - I,CRYSTAL CONSULTANTS,Delisted,EC
121,,SIA/WB/MIN/185968/2020,,Lakshmipur Brick Soil Mining Project,CRYSTAL CONSULTANTS,Delisted,EC
122,,SIA/WB/MIN/185978/2020,,Mobarakpur Brick Soil Mining Project For M/s Highway Brick Field Unit – II,CRYSTAL CONSULTANTS,Delisted,EC
123,,SIA/WB/MIN/186054/2020,EN/T-II-1/072/2020,Mankyapal Sand Block M.BIN.B-34 of Bidhan Patra,BIDHAN PATRA,Request for withdraw,EC
124,,SIA/WB/MIN/186103/2020,,Sujapur Brick Soil Mining Project For M/s Gupta Brick Field,CRYSTAL CONSULTANTS,Delisted,EC
125,,SIA/WB/MIN/186119/2020,,Jhanjra Brick Soil Mining Project,CRYSTAL CONSULTANTS,Delisted,EC
126,,SIA/WB/MIN/186224/2020,,Moulpur Brick Soil Mining Project For M/s Agarwala Brick Manufacturer’s,CRYSTAL CONSULTANTS,Delisted,EC
127,,SIA/WB/MIN/186261/2020,EN/T-II-1/071/2020,Katna Sand Block 0117DR010 of Patit Makur,PATIT MAKUR,Delisted,EC
128,,SIA/WB/MIN/186275/2020,EN/T-II-1/070/2020,Katna Sand Block 0117DR009 of Prasenjit Maji,PRASENJIT MAJI,Delisted,EC
129,,SIA/WB/MIN/186334/2020,,Suti Brick Earth Mine For A.B.F. Brick Field,CRYSTAL CONSULTANTS,Delisted,EC
130,,SIA/WB/MIN/186341/2020,,Berada Quartz Mine,RSP GREEN DEVELOPMENT AND LABORATORIES PVT. LTD.,WithdrawEC,EC
131,,SIA/WB/MIN/186827/2020,EN/T-II-1/031/2021,PALLA SAND MINE ON DAMODAR RIVER,PALLA SAND MINE OF SHRI CHANDAN GARAI,Delisted,EC
132,,SIA/WB/MIN/186847/2020,,Darol Brick Earth Mine,CRYSTAL CONSULTANTS,Delisted,EC
133,,SIA/WB/MIN/186855/2020,EN/T-II-1/023/2021,M/s Elora Brick Field,M/S ELORA BRICK FIELD,WithdrawEC,EC
134,,SIA/WB/MIN/186932/2020,,Meghdumra Brick Earth Mine,CRYSTAL CONSULTANTS,Delisted,EC
135,,SIA/WB/MIN/186940/2020,,Sripur Brick Earth Mine,CRYSTAL CONSULTANTS,Delisted,EC
136,,SIA/WB/MIN/187125/2020,,Basilhat Brick Earth Mine For J. J. Brick Field,CRYSTAL CONSULTANTS,Delisted,EC
137,,SIA/WB/MIN/187340/2020,,"Haibatpur Sand Mine on Damodar River, (Santilata Roy)",RAY TECHNO SOLUTIONS,Delisted,EC
138,,SIA/WB/MIN/187407/2020,EN/T-II-1/049/2021,BERADA QUARTZ MINE,M/S KALKONS,EC Granted,EC
139,,SIA/WB/MIN/187556/2020,,M/s PADMA BRICK INDUSTRIES,M/S PADMA BRICK INDUSTRIES,Delisted,EC
140,,SIA/WB/MIN/187562/2020,EN/T-II-1/135/2021,SEEMA BRICKS WORKS,MS SEEMA BRICKS,Delisted,EC
141,,SIA/WB/MIN/187843/2020,EN/T-II-1/147/2021,M/s SARADA BRICK FIELD,M/S SARADA BRICK FIELD,Delisted,EC
142,,SIA/WB/MIN/188022/2020,EN/T-II-1/132/2021,FRIENDS BRICK FIELD,M/S FRIENDS BRICK,Delisted,EC
143,,SIA/WB/MIN/188034/2020,,T.R.S. Brick Field,M/S T.R.S. BRICK FIELD,Delisted,EC
144,,SIA/WB/MIN/188237/2020,EN/T-II-1/146/2021,PAWAN BRICK EARTH,PAWAN BRICKS FIELD,Delisted,EC
145,,SIA/WB/MIN/188839/2020,EN/T-II-1/133/2021,GURU BRICK EARTH,M/S GURU BRICKS,Delisted,EC
146,,SIA/WB/MIN/188890/2020,,DURGANAGAR BRICK EARTH MINE,M/S RAMESHWAR BRICK INDUSTRIES,Delisted,EC
147,,SIA/WB/MIN/188946/2020,,GOYAL DANGA ARRAH BRICK EARTH MINE,M/S DURGA BRICKS,Delisted,EC
148,,SIA/WB/MIN/189120/2020,,"POSHTANKA SAND MINE (AREA- 0.81 HECTARES) ON KANGSHABATI RIVER ON Plot No.-1(P) LOCATED AT MOUZA-POSHTANKA, P.S. - DASPUR, DISTRICT- PASCHIM MEDINIPUR, STATE- WEST BENGAL, JL NO. 121",JOY GURU CONSTRUCTION,Delisted,EC
149,,SIA/WB/MIN/189216/2020,EN/T-II-1/022/2021,M/s Lux Brick Field,M/S LUX BRICK FIELD,Delisted,EC
150,,SIA/WB/MIN/189642/2020,EN/T-II-1/024/2021,Sayed mia Brick Field,M/S SAYED MIA BRICK FIELD,Delisted,EC
151,,SIA/WB/MIN/189700/2020,EN/T-II-1/148/2021,ARYAN STONE QUARRY,M/S ARYAN STONE QUARRY,Rejection Letter Granted,EC
152,,SIA/WB/MIN/189712/2020,,M/s Sayed Mia Brick Field,M/S BIRLA BRICK FIELD,Delisted,EC
153,,SIA/WB/MIN/189797/2020,,M/s Ajanta Brick Field,M/S AJANTA BRICK FIELD,Delisted,EC
154,,SIA/WB/MIN/189879/2020,,M/s B.K.S Brick Field,BKS BRICK FIELD,Delisted,EC
155,,SIA/WB/MIN/189890/2020,,M/s N.S.B Brick Field,M/S N.S.B BRICK FIELD,Delisted,EC
156,,SIA/WB/MIN/189895/2020,,M/s Tekriwal Brick Field,M/S TEKRIWAL BRICK FIELD,Delisted,EC
157,,SIA/WB/MIN/189909/2020,,M/s Fiza Brick Field,M/S FIZA BRICK FIELD,Delisted,EC
158,,SIA/WB/MIN/189916/2020,,M/s Oriental Brick Field,M/S ORIENTAL BRICK FIELD,Delisted,EC
