,Sno.,Proposal No.,File No.,Project Name,Company,Proposal Status,Project Type,View
7,3707,SIA/TG/INFRA2/416661/2023,SIA/TG/INFRA2/416661/2023,Construction of Residential Apartments by M/s. Namishree Projects,NAMISHREE PROJECTS,EC Granted,EC,
8,3708,SIA/TG/MIN/72579/2018,SIA/TG/MIN/72579/2018,Sri. Dhadigela Sravan Kumar,SRI.DHADIGELA SRAVAN KUMAR,EC Granted - Processed offline,EC,
9,3709,SIA/TG/MIN/425712/2023,SIA/TG/MIN/425712/2023,"Proposed sand mining within a mining lease area of 24.90Ha of Ordinary Sand Reach, Rampur Village, Wazeedu Mandal, Mulugu District, Telangana State.",TMDC,EC Granted,EC,
10,3710,SIA/TG/MIN/427701/2023,,Midwest Granite Private Limited Extent-3.237 Ha,MIDWESTGRANITE PVT LTD,Pending at PP due to eds,EC,
1,3711,SIA/TG/MIN/72460/2018,SIA/TG/MIN/72460/2018,M/s. SADGURU CONSTRUCTIONS,SADGURUCONSTRUCTIONS,EC Granted - Processed offline,EC,
2,3712,SIA/TG/MIN/411548/2022,SIA/TG/MIN/411548/2022,M/s Vij Mohan Constructions (P) Ltd,CHAKRADHAR REDDY DENDI,EC Granted,EC,
3,3713,SIA/TG/MIN/70413/2017,SIA/TG/MIN/70413/2017,TUMMUNURI SUDHAKAR RAO,TUMMUNURI SUDHAKAR RAO,WithdrawEC,EC,
4,3714,SIA/TG/NCP/83590/2018,SIA/TG/NCP/83590/2018,270 Sampoornam Flats by Telangana Housing Board,SAMPOORNAM FLATS BY TELANGANA HOUSING BOARD,Delisted,EC,
5,3715,SIA/TG/INFRA2/401677/2022,SIA/TG/INFRA2/401677/2022,M/s Sumadhura Infracon Private Limited,"M/S SUMADHURA INFRACON PRIVATE LIMITED,",EC Granted,EC,
6,3716,SIA/TG/MIN/407418/2022,SIA/TG/MIN/407418/2022,M/s Swetha Stone Crushers,SWAMY GOUD VANGALA,EC Granted,EC,
7,3717,SIA/TG/NCP/61052/2016,SIA/TG/NCP/61052/2016,Pioneer Holiday Resorts Limited,PIONEER HOLIDAY RESORTS LIMITED,Delisted,EC,
8,3718,SIA/TG/MIN/63561/2017,SIA/TG/MIN/63561/2017,Proposed Laterite Quarry of M/s. Jeevan Jyothi Minerals,M/S. JEEVANA JYOTHI MINERALS,EC Granted,EC,
9,3719,SIA/TG/INFRA2/425721/2023,SIA/TG/INFRA2/425721/2023,M/s. R3 Capital,R3 CAPITAL,EC Granted,EC,
10,3720,SIA/TG/INFRA2/427187/2023,SIA/TG/INFRA2/427187/2023,M/s. Dilpreet Tubes Pvt. Ltd.,DILPREET TUBES PRIVATE LIMITED,EC Granted,EC,
1,3721,SIA/TG/NCP/55690/2016,001/2016/SEIAA,"Girija Marvel By  M/s Girija Builders Pvt. Ltd.,",GIRIJA BUILDERS PVT LTD,EC Granted,EC,
2,3722,SIA/TG/MIN/432628/2023,SIA/TG/MIN/432628/2023,"M/s.Vishruth Minerals-3, 6.566 Ha, Rough Stone and Road Metal Mine, Sy. No. 95,Mudhivennu Village, Kadthal Mandal, RangaReddy District, Telangana State",M/S.VISHRUTH MINERALS,EC Granted,EC,
3,3723,SIA/TG/MIN/67679/2017,SIA/TG/MIN/67679/2017,Shambavi Stone Crusher,SHAMBAVI STONE CRUSHER,EC Granted - Processed offline,EC,
4,3724,SIA/TG/INFRA2/426485/2023,SIA/TG/INFRA2/426485/2023,Building No.9 By M/s Mindspace Business Parks Private Limited,MINDSPACE BUSINESS PARKS PRIVATE LIMITED,EC Granted,EC,
5,3725,SIA/TG/MIN/58481/2016,SIA/TG/MIN/58481/2016,PROPOSED RIVER SAND MINING PROJECT OF ORDINARY SAND IN LAKNAVARAM/JAMPANNA VAGU RIVER BASIN,TELANGANA STATE MINERAL DEVELOPMENT CORPORATION LIMITED,EC Granted,EC,
6,3726,SIA/TG/MIN/90009/2018,,"Smt. K. Teena Devi, Quartz & Feldspar Mine, 1.355 Ha.",SMT. K. TEENA DEVI,Delisted,EC,
7,3727,SIA/TG/NCP/67756/2017,SIA/TG/NCP/67756/2017,ANANTHA INFRA,ANANTHA INFRA,EC Granted - Processed offline,EC,
8,3728,SIA/TG/MIN/415982/2023,SIA/TG/MIN/415982/2023,"Assistant Director of Mines & Geology, Mahabubnagar, 1.72 Ha.",VIJAY GURRAM,Delisted,EC,
9,3729,SIA/TG/INFRA2/436476/2023,SIA/TG/INFRA2/436476/2023,Proposed Residential Villas Project by M/s.  Greenmark Developers Private Limited.,GREENMARK DEVELOPERS PRIVATE LIMITED,EC Granted,EC,
10,3730,SIA/TG/MIN/74238/2018,,Sri Md. Zameer,MD. ZAMEER,Delisted,EC,
1,3731,SIA/TG/INFRA2/431439/2023,SIA/TG/INFRA2/431439/2023,Vertex Rock Castle by M/s. Vertex Viva Private Limited,VERTEX VIVA PRIVATE LIMITED,EC Granted,EC,
2,3732,SIA/TG/MIN/57121/2016,,M//s HII-TECH ROCK PRODUCTS & AGGREGATES LIIMIITED,HI TECH ROCK PRODECTS AND AGGREEGATES LTD,TransferToDEIAA,EC,
3,3733,SIA/TG/MIN/435760/2023,SIA/TG/MIN/435760/2023,"M/s. SR Mining Industries Mine 4.15Ha, Rough Stone & Road Metal Mine ,4.15 Ha. Sy.No.263/1 (Govt. Land) Arur Village, Sadashivpet Mandal, Sangareddy District, Telangana State",M/S. SR MINING INDUSTRIES,Under examination of SEIAA after SEAC,EC,
4,3734,SIA/TG/MIN/59102/2016,,Colour Granite Mine of Baba Enterprises,BABA ENTERPRISES,TransferToDEIAA,EC,
5,3735,SIA/TG/NCP/65520/2017,SIA/TG/NCP/65520/2017,Sukhii Constructions LLP,SUKHII CONSTRUCTIONS LLP,EC Granted,EC,
6,3736,SIA/TG/MIN/66993/2017,SIA/TG/MIN/66993/2017,"M/s Tulip Granites Pvt Ltd.  3.214 ha, Sy no: 469&470, Nagulamalyal V, Kothapalli M, Karimnagar Dist.",MS TULIP GRANITES PVT LTD,EC Granted - Processed offline,EC,
7,3737,SIA/TG/MIN/61885/2017,SIA/TG/MIN/61885/2017,Quartz and Feldspar Mining Project,C SUJATHA,EC Granted,EC,
8,3738,SIA/TG/INFRA2/432161/2023,SIA/TG/INFRA2/432161/2023,Vasavi Avasa by M/s Vasavi Estate LLP,VASAVI ESTATES LLP,EC Granted,EC,
9,3739,SIA/TG/MIN/76169/2018,,"M/S. Balaji Stone Crusher, Building Stone & Road Metal Quarry, 2.0 Ha","M/S. BALAJI STONE CRUSHER, BUILDING STONE & ROAD METAL QUARRY, 2.0 HA",Delisted,EC,
10,3740,SIA/TG/MIN/66984/2017,SIA/TG/MIN/66984/2017,"M/s Tulip Granites Pvt Ltd 2.751 ha colour granite mine located in sy.no.473,483 & 484 of nagulamalyal V, Kothapally M, Karimnagar D",MS TULIP GRANITES PVT LTD,EC Granted - Processed offline,EC,
1,3741,SIA/TG/IND2/403131/2022,SIA/TG/IND2/403131/2022,"Proposed Expansion of Existing Grain Based Distillery from 150 KLPD (150 KL x 365 days = 54,750 KLPA) to 180 KLPD (180 KL x 365 days = 65,700 KLPA)  along with existing 6.5 MW Power Plant by M/s. Allied Blenders and Distillers Private Limited",M/S ALLIED BLENDERS AND DISTILLERS PVT. LTD.,EC Granted,EC,
2,3742,SIA/TG/MIN/426923/2023,SIA/TG/MIN/426923/2023,"M/s.TSMDC Ltd. Malluru-I Ordinary Sand Reach in Godavari River Bed Malluru Village, Mangapeta (M) Mulugu District, and Telengana State",TMDC,EC Granted,EC,
3,3743,SIA/TG/MIN/75592/2018,,Etteri Kumaraswamy -Building Stone & Road Metal Quarry-0.50 ha.,KUMARASWAMY BUILDING STONE METAL QUARRY,Delisted,EC,
4,3744,SIA/TG/NCP/60066/2016,SIA/TG/NCP/60066/2016,"M/s. GKRS PROPERTIES 
Sy No. 41/E & 13 (P), 
Bandlaguda Jagir Village, 
Rajendranagar Mandal, 
Ranga Reddy District, 
Telangana State",GKRS PROPERTIES,EC Granted,EC,
5,3745,SIA/TG/MIN/425185/2023,SIA/TG/MIN/425185/2023,Sri Gantla Vijay Kumar Reddy,RAM SANIKOMMU,EC Granted,EC,
6,3746,SIA/TG/MIN/75960/2018,,M/s VEERABHADRA STONE CRUSHER,M/S VEERABHADRA STONE CRUSHER,Delisted,EC,
7,3747,SIA/TG/MIN/87479/2018,SIA/TG/MIN/87479/2018,Sri Manikala Chenna Rao- 24.069ha,SRI MANIKALA CHENNA RAO,WithdrawEC,EC,
8,3748,SIA/TG/MIN/437804/2023,SIA/TG/MIN/437804/2023,Smt. Aroori Kavitha Kumari,KAVITHA AROORI,Under examination of SEIAA after SEAC,EC,
9,3749,SIA/TG/INFRA2/414749/2023,SIA/TG/INFRA2/414749/2023,Proposed expansion of construction project of University Complex,PINAKIN EDUCATIONAL TRUST,EC Granted,EC,
10,3750,SIA/TG/MIN/421289/2023,SIA/TG/MIN/421289/2023,"Assistant Director of Mines and Geology - Adilabad - 1 Ha.,",NAGARAJA ELURI,EC Granted,EC,
1,3751,SIA/TG/MIN/57899/2016,SIA/TG/MIN/57899/2016,M/s. Sri Sai Mines & Minerals - 8.09 Ha,SRI SAI MINES AND MINERALS,Delisted,EC,
2,3752,SIA/TG/MIN/71863/2017,SIA/TG/MIN/71863/2017,Sri S. H. Saheb Quadri,S.H. SAHEB QUADRI,EC Granted - Processed offline,EC,
3,3753,SIA/TG/INFRA2/413872/2023,SIA/TG/INFRA2/413872/2023,Sri Sreenivasa Infra,SRI SREENIVASA INFRA,EC Granted,EC,
4,3754,SIA/TG/MIN/74523/2018,,"M/s. SSR Granites - 1.254 ha 
Survey No. 296/1, 296/111,296/112,296/118,296/119,296/120, Mahamoodpatnam Village and 399/80, Kesamudram Village and Mandal, Warangal District",M/S SHARADA STONEX,Delisted,EC,
5,3755,SIA/TG/INFRA2/435888/2023,SIA/TG/INFRA2/435888/2023,SVASA by M/s. ACE Giridhari Homes & Others,ACE GIRIDHARI HOMES,Under examination of SEIAA after SEAC,EC,
6,3756,SIA/TG/MIN/430184/2023,SIA/TG/MIN/430184/2023,M/s LNS Infrastructures,LNS INFRASTRUCTURES,EC Granted,EC,
7,3757,SIA/TG/MIN/61363/2016,SIA/TG/MIN/61363/2016,M/s.Rank Silicon & Industries Pvt Ltd,RANK SILICON AND INDUSTRIES PVT LTD,EC Granted,EC,
8,3758,SIA/TG/NCP/59904/2016,SIA/TG/NCP/60066/2016,Praneeth Pranav Zenith by M/s PRANEETH PROJECTS,PRANEETH PROJECTS,EC Granted,EC,
9,3759,SIA/TG/MIN/72744/2018,SIA/TG/MIN/72744/2018,KSR Infra Projeccts,KRCINFRAPROJECTS,Delisted,EC,
10,3760,SIA/TG/NCP/69480/2017,SIA/TG/NCP/69480/2017,Sattva Knowledge Park,"WORLDWIDE REALCON PVT. LTD.,",EC Granted - Processed offline,EC,
1,3761,SIA/TG/MIN/74388/2018,,Sri D Pandu,D UDAY KUMAR,Delisted,EC,
2,3762,SIA/TG/MIN/413637/2023,SIA/TG/MIN/413637/2023,M/s. Sri Shirdi Sai stones,SRI SHIRIDI SAI STONES,EC Granted,EC,
3,3763,SIA/TG/MIN/412992/2023,SIA/TG/MIN/412992/2023,M/s. Sameer Industries -Road metal & Building Stone quarry -1.0 ha,MOHAMMED WAJID,EC Granted,EC,
4,3764,SIA/TG/MIN/402158/2022,SIA/TG/MIN/402158/2022,M/s. GVR Infra Projects Limited,VENKATESWARA GARIKAPATI,Delisted,EC,
5,3765,SIA/TG/MIN/92434/2019,SIA/TG/MIN/92434/2019,I Ramesh Reddy,I RAMESH REDDY,Rejection Letter Granted,EC,
6,3766,SIA/TG/MIN/427348/2023,SIA/TG/MIN/427348/2023,M/s.Sri Venkata Ramana Stone Crushers_0.760,VENKATA CHITTABATTINI,EC Granted,EC,
7,3767,SIA/TG/NCP/65340/2017,SIA/TG/NCP/65340/2017,M/s.M.K.RAO FOUNDATION,M/S. M.K.RAO FOUNDATION,EC Granted,EC,
8,3768,SIA/TG/IND2/22390/2017,SIA/TG/IND2/22390/2017,,M/S MICRO MOLECULES PVT. LTD.,EC Granted - Processed offline,EC,
9,3769,SIA/TG/NCP/65025/2017,SIA/TG/NCP/65025/2017,M/s. Cresent Spaces Pvt. Ltd.,CRESENT SPACES PVT LTD,EC Granted,EC,
10,3770,SIA/TG/MIN/72675/2018,SIA/TG/MIN/72675/2018,"M/s. Atharva Granites 
(Cluster Granite Mine - 5.0 Ha)",ATHARVAGRANITES,EC Granted - Processed offline,EC,
1,3771,SIA/TG/MIN/425021/2023,SIA/TG/MIN/425021/2023,Sri Andapally Jalander Reddy -Road Metal & Building Stone and Gravel/Murram quarry -3.0 Ha,JALANDER REDDY ANDAPALLY,EC Granted,EC,
2,3772,SIA/TG/INFRA2/436391/2023,SIA/TG/INFRA2/436391/2023,OAKMONT DEVELOPERS,OAKMONT DEVELOPERS LLP,Under examination of SEIAA after SEAC,EC,
3,3773,SIA/TG/MIN/415880/2023,SIA/TG/MIN/415880/2023,12.00 Ha. of Quartz and Feldspar Quarry of   M/s Raging River Mines and Minerals Pvt. Ltd.,RAGING RIVER MINES & MINERALS PRIVATE LIMITED,Rejection Letter Granted,EC,
4,3774,SIA/TG/INFRA2/402675/2022,SIA/TG/INFRA2/402675/2022,Residential Apartments and Commercial Area with Multiplex by titled ‘PMR Mixed Use Development’ by M/s. PMR Housing Private Limited.,PMR HOUSING PRIVATE LIMITED,EC Granted,EC,
5,3775,SIA/TG/INFRA2/435697/2023,SIA/TG/INFRA2/435697/2023,EIPL CONSTRUCTIONS (proposed Residential cum Commercial office complex),EIPL  CONSTRUCTIONS,Under examination of SEIAA after SEAC,EC,
6,3776,SIA/TG/MIN/415971/2023,SIA/TG/MIN/415971/2023,"Assistant Director of Mines & Geology, Mahabubnagar, 2.0 ha.",VIJAY GURRAM,Delisted,EC,
7,3777,SIA/TG/NCP/72774/2018,SIA/TG/NCP/72774/2018,Sri Sreenivasa Constructions,SRI SREENIVASA CONSTRUCTIONS,EC Granted - Processed offline,EC,
8,3778,SIA/TG/NCP/61172/2016,SIA/TG/NCP/61172/2016,Ms. Sneha BHEL Employees Mutually Aided Co Operative Housing Society Ltd,MS SNEHA BHEL EMPLOYEES MUTUALLY AIDED,EC Granted,EC,
9,3779,SIA/TG/MIN/74208/2018,,Smt. M. Saroja,SMT. M. SAROJA,Delisted,EC,
10,3780,SIA/TG/MIN/418582/2023,SIA/TG/MIN/418582/2023,M/s. Thirumala Stone Crusher -Road Metal and Building Stone,HANUMANDLU GUTTA,EC Granted,EC,
1,3781,SIA/TG/MIN/74226/2018,,"2.50 Ha. of Building Stone & Road Metal  Mine of  M/S. SHIVA SAI CONSTRUCTIONS,Sy.No. 1218
Keshpally Village, 
Jakranpally Mandal,
Nizamabad District, 
Telangana.",MS SHIVA SAI CONSTRUCTIONS,Delisted,EC,
2,3782,SIA/TG/NCP/60388/2016,SIA/TG/NCP/60388/2016,"M/s BHAVYA CONSTRUCTIONS PVT. LTD.,","BHAVYA CONSTRUCTIONS PVT. LTD.,",Delisted,EC,
3,3783,SIA/TG/MIN/74605/2018,SIA/TG/MIN/74605/2018,M/s Kuber Mining Works Quartz and Feldspar Mine,M/S KUBER MINING WORKS,Delisted,EC,
4,3784,SIA/TG/INFRA2/425184/2023,SIA/TG/INFRA2/425184/2023,Jains Sri Ram Garden-III by M/s. Jain Constructions,JAIN CONSTRUCTIONS,EC Granted,EC,
5,3785,SIA/TG/NCP/94158/2019,SIA/TG/NCP/94158/2019,M/s. Modi Builders & Realtors Pvt Ltd and M/s. Modi Builders & Infrastructures Pvt Ltd,MODI BUILDERS AND REALTORS PVT LTD,EC Granted,EC,
6,3786,SIA/TG/MIN/401871/2022,SIA/TG/MIN/401871/2022,Smt. Chandu Padmaja,UMA MAHESH CHANDU,EC Granted,EC,
7,3787,SIA/TG/MIN/74256/2018,,Sri Ch. Amar Reddy,CH AMARREDDY,Delisted,EC,
8,3788,SIA/TG/MIN/434915/2023,SIA/TG/MIN/434915/2023,"Sri.Md.Azeez - 5 Ha.,",MOHAMMED AZEEZ,Delisted,EC,
9,3789,SIA/TG/INFRA2/432985/2023,SIA/TG/INFRA2/432985/2023,Sri Sai Harihara Estates Private Limited,SRI SAI HARIHARA ESTATES PRIVATE LIMITED,EC Granted,EC,
10,3790,SIA/TG/MIN/433770/2023,SIA/TG/MIN/433770/2023,Subbampeta Sand Reach 4.99 ha in Godavari River bed By TSMDC Ltd,TSMDCLIMITED,EC Granted,EC,
1,3791,SIA/TG/MIN/62516/2017,SIA/TG/MIN/62516/2017,M/s. SREE MARUTHI RAMA GRANITES (8.40HA),SREE MARUTHI RAMA GRANITES,EC Granted,EC,
2,3792,SIA/TG/INFRA2/436249/2023,SIA/TG/INFRA2/436249/2023,Fortune Heights Mixed Use by M/s Fortune Heights India Private Limited,FORTUNE HEIGHTS INDIA PRIVATE LIMITED,EC Granted,EC,
3,3793,SIA/TG/INFRA2/434866/2023,SIA/TG/INFRA2/434866/2023,Sri. Ravi Suresh,SURESH RAVI,EC Granted,EC,
4,3794,SIA/TG/NCP/75376/2018,,"Proposed Construction of Commercial and Residential towers on open plot with a plot Area 14246.41 Sq.Mts at Annojiguda (V),Ghatkesar (M) , Medchal-Malkajigiri (D),Under HMDA limits Telangana (S) bearing  SY NO 8.",INFOCITY PROJECTS AND SERVICES,WithdrawEC,EC,
5,3795,SIA/TG/NCP/19624/2017,SIA/TG/NCP/19624/2017,MEGA TEXTILE PARK,TELANGANA STATE INDUSTRIAL INFRASTRUCTURE CORPORATION LIMITED,EC Granted,EC,
6,3796,SIA/TG/NCP/59213/2016,SIA/TG/NCP/59213/2016,"Sri. P. Satish Goud & Others 
(Construction of Commercial Cum Residential Apartments Project)
Sy.No.715, 716 & 721 of Adibatla (Village), Ibrahimpatnam (Mandal), Ranga Reddy (Dist), Telangana State",PSATISHGOUD,EC Granted,EC,
7,3797,SIA/TG/MIN/431257/2023,SIA/TG/MIN/431257/2023,Smt Lavudya Janaki,JANAKI LAVUDYA,EC Granted,EC,
8,3798,SIA/TG/NCP/70876/2017,SIA/TG/NCP/70876/2017,Subishi Infra,M/S SUBISHI INFRA,EC Granted - Processed offline,EC,
9,3799,SIA/TG/MIN/74739/2018,,"M/s.SRI SAI MINES & MINERALS
3.30 Hect of Feldspar & Quartz Mine,Sy.Nos. 326 & 330 of Budharam village, Gopalpet Mandal, Wanaparthy district, Telangana State.",M/S.SRI SAI MINES & MINERALS,Delisted,EC,
10,3800,SIA/TG/MIN/437241/2023,,M/S Frasure Creek Mining Pvt Ltd,FRASURE CREEK MINING PRIVATE LIMITED,Under examination of SEIAA,EC,
1,3801,SIA/TG/MIN/78378/2018,,"M/s Jyothi Exports 7.93 Ha of Colour Granite mine in sy.no.62, Kamanpur village, Karimnagar mandal & District, Telangana state",MS JYOTHI EXPORTS,Delisted,EC,
2,3802,SIA/TG/MIN/59385/2016,SIA/TG/MIN/59385/2016,"V.Praveen,Laterite Mine",PRAVEEN V,EC Granted,EC,
3,3803,SIA/TG/IND2/17944/2016,,Divis Pharmaceuticals Pvt. Ltd,DIVIS PHARMACEUTICALS PVT LTD,Pending at PP due to eds,EC,
4,3804,SIA/TG/MIN/412850/2023,SIA/TG/MIN/412850/2023,M/s Santhoshi Industries,PURNIMA KAMIREDDY,Rejection Letter Granted,EC,
5,3805,SIA/TG/MIN/62255/2017,SIA/TG/MIN/62255/2017,M/s R.K. Rocks,M/S R.K. ROCKS,EC Granted - Processed offline,EC,
6,3806,SIA/TG/MIN/435935/2023,SIA/TG/MIN/435935/2023,Rough Stone & Road Metal Over an Extent of 12.84 Ha of M/s. SRINIVASA EDIFICE PRIVATE LIMITED,MS SRINIVASA EDIFICE PVT LTD,Under examination of SEIAA after SEAC,EC,
7,3807,SIA/TG/MIN/433655/2023,SIA/TG/MIN/433655/2023,"M/s. TSMDC Ltd, Bheemavaram-I Sand Reach - 4.90Ha",TMDC,EC Granted,EC,
8,3808,SIA/TG/MIN/67383/2017,SIA/TG/MIN/67383/2017,M/s. Jhuri Mines & Minerals Pvt. Ltd.,JHURI MINES & MINERALS PVT. LTD,WithdrawEC,EC,
9,3809,SIA/TG/NCP/70862/2017,SIA/TG/NCP/70862/2017,SRI SRI KALA KUTEERS,"SNR NIRMAN INDIA. PVT .LTD.,",EC Granted,EC,
10,3810,SIA/TG/MIN/65060/2017,SIA/TG/MIN/65060/2017,SRISAIVENKATESHWARASTONECRUSHER,SRI SAI VENKATESHWARA STONE CRUSHER,EC Granted - Processed offline,EC,
1,3811,SIA/TG/MIN/74382/2018,,"1.25 Ha. of Building Stone & Road Metal  Mine of  Sri B.Thirmala Rao survey no 914 of Makloor  village, Makloor  mandal, Nizamabad District",SRI B THIRMALA RAO,Delisted,EC,
2,3812,SIA/TG/NCP/92875/2019,SIA/TG/NCP/92875/2019,Apex,GLAND CELSUS BIO CHEMICALS PRIVATE LIMITED,EC Granted,EC,
3,3813,SIA/TG/NCP/73290/2018,SIA/TG/NCP/73290/2018,PHOENIX EMBASSY TECH ZONE PVT. LTD. (IT / ITES TOWERS),PHOENIX GROUP,EC Granted - Processed offline,EC,
4,3814,SIA/TG/MIN/65425/2017,SIA/TG/MIN/65425/2017,Sri Shaik Imam-6.176ha,SRI SHAIK IMAM,EC Granted,EC,
5,3815,SIA/TG/MIN/74239/2018,,Sri Md. Zameer,MD. ZAMEER,Delisted,EC,
6,3816,SIA/TG/NCP/63947/2017,SIA/TG/NCP/63947/2017,M/s VAS LOGISTRUCTURE CORPO,M/S VAS LOGISTRUCTURE CORPO,EC Granted,EC,
7,3817,SIA/TG/NCP/57472/2016,SIA/TG/NCP/57472/2016,Tranquil by M/s Hallmark Builders,HALLMARK BUILDERS,EC Granted,EC,
8,3818,SIA/TG/INFRA2/407214/2022,SIA/TG/INFRA2/407214/2022,Rajapushpa Properties Private Limited,RAJAPUSHPA PROPERTIES PRIVATE LIMITED,EC Granted,EC,
9,3819,SIA/TG/MIN/73254/2018,SIA/TG/MIN/73254/2018,Nandita Granites - 4.16 Ha ( Cluster project,NANDITA GRANITES,EC Granted - Processed offline,EC,
10,3820,SIA/TG/NCP/63232/2017,,AVAS HYDERABAD,PACIFICA INDIA PROJECTS PVT LTD,WithdrawEC,EC,
1,3821,SIA/TG/MIN/74525/2018,,"Saicharan Granites 2.0Acres 
Survey No. 149, Nakerekal Village and Mandal, Nalgonda District",M/S SHARADA STONEX,Delisted,EC,
2,3822,SIA/TG/MIN/64901/2017,SIA/TG/MIN/64901/2017,M/S SRINIVASA STONE CRUSHER,SRINIVASA STONE CRUSHER,WithdrawEC,EC,
3,3823,SIA/TG/MIN/74260/2018,SIA/TG/MIN/74260/2018,M/s. K.S.R. STONE CRUSHER,M/S. K.S.R. STONE CRUSHER,Delisted,EC,
4,3824,SIA/TG/MIN/63850/2017,SIA/TG/MIN/63850/2017,M/s. Santhosh Granites - 11ha,SANTHOSH GRANITES,EC Granted,EC,
5,3825,SIA/TG/NCP/71950/2017,SIA/TG/NCP/71950/2017,PHOENIX SPACES PRIVATE LIMITED (IT / ITES Office complex),PHOENIX GROUP,EC Granted - Processed offline,EC,
6,3826,SIA/TG/NCP/60091/2016,SIA/TG/NCP/60091/2016,"SHANTA SRIRAM - LAKE FRONT
GATED COMMUNITY APARTMENTS",SHANTA SRIRAM CONSTRUCTION PVT LTD,Delisted,EC,
7,3827,SIA/TG/MIN/417423/2023,SIA/TG/MIN/417423/2023,Sri J. Lavanya Prasad Raju,J LAVANYA PRASAD RAJU,EC Granted,EC,
8,3828,SIA/TG/MIN/74186/2018,,M/S. Laxmi Stone Crusher (Building Stone & Road Metal),"M/S. SRI. VENKATARAMANA MINERALS- MOSAIC CHIPS QUARRY, 2.110 HA",Delisted,EC,
9,3829,SIA/TG/MIN/59360/2016,SIA/TG/MIN/59360/2016,"Smt Joguraju Swapna ,Laterite Mine",SMT JOGURAJU SWAPNA,EC Granted,EC,
10,3830,SIA/TG/MIN/433944/2023,SIA/TG/MIN/433944/2023,"M/s. Swathi Stones-Building Stone & Road Metal over an extent of 2.96 Ha in Sy. No.245, Vallala Village, Shaligouraram Mandal, Nalgonda District, Telangana State",SWATHI STONES,EC Granted,EC,
1,3831,SIA/TG/MIN/407645/2022,SIA/TG/MIN/407645/2022,M/s Vaishnavi Stone Crusher,MALLA REDDY KARYADA,EC Granted,EC,
2,3832,SIA/TG/INFRA2/435901/2023,SIA/TG/INFRA2/435901/2023,M/s. JB Builders & Developers and M/s JB Homes & Resorts,JB BULIDERS AND  DEVELOPERS,Under examination of SEIAA after SEAC,EC,
3,3833,SIA/TG/NCP/74587/2018,SIA/TG/NCP/74587/2018,"Phoenix IT City Pvt. Ltd.
(IT / ITES Office complex)",PHOENIX GROUP,EC Granted - Processed offline,EC,
4,3834,SIA/TG/INFRA2/424545/2023,SIA/TG/INFRA2/424545/2023,Amaranthine by M/s. Quambiant Design Build Private Limited,QUAMBIANT DESIGN BUILD PRIVATE LIMITED,EC Granted,EC,
5,3835,SIA/TG/NCP/65085/2017,SIA/TG/NCP/65085/2017,"M/s. SHANTA SRIRAM  CONSTRUCTIONS PVT.LTD
Hyderabad – 500016, Telangana

(RESIDENTIAL VILLAS AND APARTMENTS)",SHANTA SRIRAM CONSTRUCTION PVT LTD,Delisted,EC,
6,3836,SIA/TG/MIN/436258/2023,,"1.659 Hectares of Colour Granite Quarry of M/s. G.B.R Minerals Pvt. Ltd., Survey No: 323 of Asifnagar Village, Kothapally Mandal, Karimnagar District, Telangana.",MS G B R MINERLAS PRIVATE LIMITED,Under examination of SEIAA,EC,
7,3837,SIA/TG/MIN/74289/2018,,Srinivasarao Stone Crusher,CH. SRINIVASA RAO CRUSHER,Delisted,EC,
8,3838,SIA/TG/NCP/65529/2017,SIA/TG/NCP/65529/2017,M/s NCC & NCC Urban Infrastructure Ltd.,NCC AND NCC URBAN INFRASTRUCTURE LTD,EC Granted,EC,
9,3839,SIA/TG/IND2/31056/2018,,"Deepak Nitrite Limited (Hyderabad Specialities Division), Unit-III",DEEPAK NITRITE LIMITED,WithdrawEC,EC,
10,3840,SIA/TG/IND1/402815/2022,SIA/TG/IND1/402815/2022,M/s Sri Sai Ram Stone Crusher,SRISAIRAM STONE CRUSHERS,Pending at PP due to eds,EC,
1,3841,SIA/TG/MIN/57872/2016,SIA/TG/MIN/57872/2016,"M/s.Gayatri Granite Industries,8.0 Hect. of Black Granite Mine,Sy No: 134,Chinnanagaram (V),Nellikuduru (M),Warangal (D).T.S.",MS GAYATRI GRANITE INDUSTRIES,Delisted,EC,
2,3842,SIA/TG/MIN/74336/2018,SIA/TG/MIN/74336/2018,Sri Md. Azeez,SRI MD AZEEZ,Delisted,EC,
3,3843,SIA/TG/INFRA2/407094/2022,SIA/TG/INFRA2/407094/2022,Cyberian Towers by M/s Precast Building Systems (India) Private Limited,PRECAST BUILDING SYSTEMS (INDIA) PRIVATE LIMITED,EC Granted,EC,
4,3844,SIA/TG/NCP/72442/2018,SIA/TG/NCP/72442/2018,Aditya Heritage,"SRI ADITYA HOMES PVT. LTD.,",EC Granted - Processed offline,EC,
5,3845,SIA/TG/MIN/413438/2023,SIA/TG/MIN/413438/2023,M/s. Bhagyalaxmi Enterprises,ASHOKREDDY THUPALLI,EC Granted,EC,
6,3846,SIA/TG/NCP/73527/2018,SIA/TG/NCP/73527/2018,Proposed Construction of Residential Units by Mr A. Vinaykumar Reddy,ANATULAVINAYKUMARREDDYRESIDENTIALPROJECT,EC Granted - Processed offline,EC,
7,3847,SIA/TG/MIN/433950/2023,SIA/TG/MIN/433950/2023,"M/s Sai Ganesh Metals , 2.14 Ha, Rough Stone & Road Metal Mine,Survey No. 231, Eardanoor (V), Kandi(M), Sanga Reddy District,  T.S.",PRAKASH SANGAREDDYPETA,EC Granted,EC,
8,3848,SIA/TG/MIN/62912/2017,SIA/TG/MIN/62912/2017,Venkateshwara Stone and Metal - 7.5 Ha,VENKATESHWARA MINES AND MINERALS,EC Granted,EC,
9,3849,SIA/TG/NCP/20209/2013,SIA/TG/NCP/20209/2013,Proposed Industrial Park,TELANGANA STATE INDUSTRIAL INFRASTRUCTURE CORPORATION LIMITED,EC Granted,EC,
10,3850,SIA/TG/MIN/436039/2023,SIA/TG/MIN/436039/2023,Smt. Sivaratri Padma,PADMA SHIVARATRI,Accepted By SS(SEIAA),EC,
1,3851,SIA/TG/IND2/58125/2016,SIA/TG/IND2/58125/2016,BHARAT PETROLEUM CORPORATION LTD,BHARAT PETROLEUM CORPORATION LIMITED,EC Granted,EC,
2,3852,SIA/TG/MIN/404958/2023,SIA/TG/MIN/404958/2023,"Smt A.Krishnaveni Building Stone and Road Metal Mine ,1.0 Hectare",KRISHNAVENI ADDULA,EC Granted,EC,
3,3853,SIA/TG/NCP/70396/2017,SIA/TG/NCP/70396/2017,ICON Homes,ICON HOMES,EC Granted - Processed offline,EC,
4,3854,SIA/TG/MIN/55267/2016,010/2016/SEIAA,"M/s.Ujwal Industries 
Laterite Mine",UJWAL INDUSTRIES,WithdrawEC,EC,
5,3855,SIA/TG/NCP/71964/2017,SIA/TG/NCP/71964/2017,"Proposed New Multistoried Residential Building  “OLYMPUS”  at Sy.nos: 247, 250 & 251, Manikonda Jagir Village, Gandipet Mandal, Ranga Reddy District. Telangana state",PROPOSED NEW RESIDENTIAL BUILDING OLYMPUS,EC Granted - Processed offline,EC,
6,3856,SIA/TG/MIN/432622/2023,SIA/TG/MIN/432622/2023,"M/s. Vishruth Minerals-1, 14.90Ha, Rough Stone and Road Metal Mine, Sy. No. 95, Mudhivennu Village, Kadthal Mandal, RangaReddy District, Telangana State",M/S.VISHRUTH MINERALS,EC Granted,EC,
7,3857,SIA/TG/MIN/55062/2016,011/2016/SEIAA,"M/s Gyanchandani Purshotam Stone Crusher Building Stone & Road Metal Mine in Sy.No:55,Mallapura V,Thimmapur M,Karimnagar D,Telangana state.",MS GYANCHANDANI PURSHOTAM STONE CRUSHER,Delisted,EC,
8,3858,SIA/TG/NCP/73599/2018,SIA/TG/NCP/73599/2018,"Proposed New Residential Building of 
M/s JAAGRUTHI CONSTRUCTIONS",M/S JAAGRUTHI CONSTRUCTIONS,EC Granted - Processed offline,EC,
9,3859,SIA/TG/MIN/436126/2023,SIA/TG/MIN/436126/2023,Proposed Stone & Metal quarry of Sri A. Srinivas Reddy,SRINIVAS REDDY ALLU,Accepted By SS(SEIAA),EC,
10,3860,SIA/TG/MIN/58205/2016,SIA/TG/MIN/58205/2016,"M/S LAKSHMI S T MINING & LEASING LABOUR CONTRACT COOPERATIVE SOCIETY LTD., [BALLEPALLI BARYTES MINE]",LAXMI ST MINING AND LEASING CONTRACT COOPERATIVE SOCIETY LTD,Rejection Letter Granted,EC,
1,3861,SIA/TG/MIN/404029/2022,SIA/TG/MIN/404029/2022,"M/s. Astral Granites (P) Ltd., - 1.0ha (Expansion Project)",RAMA SWAMI REDDY GANAPA,Rejection Letter Granted,EC,
2,3862,SIA/TG/IND2/17115/2016,SIA/TG/IND2/17115/2016,"Lee Pharma Limited, Unit-1",LEE PHARMA LIMITED,EC Granted,EC,
3,3863,SIA/TG/MIN/412350/2022,SIA/TG/MIN/412350/2022,"Assistant Director of Mines & Geology Siddipet - 2.3 Ha.,",GAUTHAM GADPALE,EC Granted,EC,
4,3864,SIA/TG/NCP/61162/2016,SIA/TG/NCP/61162/2016,M/s Rajapushpa Properties Private limited,RAJAPUSHPA PROPERTIES PRIVATE LIMITED,EC Granted,EC,
5,3865,SIA/TG/NCP/62671/2017,SIA/TG/NCP/62671/2017,Mr. K. Anil Reddy,K ANIL REDDY,EC Granted,EC,
6,3866,SIA/TG/MIN/74268/2018,SIA/TG/MIN/74268/2018,"8.09 Ha. of Building Stone & Road Metal  Mine of  M/s Geo-Tech Infrastuture,
Sy.No. 9/1
Khadrabad Village, 
Navelpet Mandal,
Nizamabad District, 
Telangana.",MS GEO TECH INFRASTRUCTURE,Delisted,EC,
7,3867,SIA/TG/MIN/406578/2022,SIA/TG/MIN/406578/2022,Smt. Meena Fatima,MEENA FATHIMA,WithdrawEC,EC,
8,3868,SIA/TG/NCP/73596/2018,SIA/TG/NCP/73596/2018,Hallmark Properties & Others,HALLMARK PROPERTIES & OTHERS,EC Granted - Processed offline,EC,
9,3869,SIA/TG/NCP/70279/2017,SIA/TG/NCP/70279/2017,GULMOHAR RESIDENCY,GULMOHAR RESIDENCY & JADE ESTATES,EC Granted - Processed offline,EC,
10,3870,SIA/TG/INFRA2/417684/2023,SIA/TG/INFRA2/417684/2023,Defination Software Solutions LLP - Expansion of IT Office Building,DEFINATION  SOFTWARE SOLUTIONS LLP,EC Granted,EC,
1,3871,SIA/TG/IND3/433340/2023,SIA/TG/IND3/433340/2023,"Proposed Expansion of Active Pharmaceutical Ingredients (APIs), API Intermediates and Specialty Chemicals Manufacturing Unit along with R&D Facility  located at Plot No.24/A, 24/B, Sy No. 480  and Plot No.32, Sy. Nos. 460/2, 461, 462/2 and 479 to 482, TSIIC, IDA Mankhal, Maheshwaram Mandal, Rangareddy District, Telangana State",VANAMALI ORGANICS PRIVATE LIMITED,EC Granted,EC,
2,3872,SIA/TG/INFRA2/437413/2023,SIA/TG/INFRA2/437413/2023,Subishi’s Jasmine Apartments by M/s Subishi Engineers,SUBISHI ENGINEERS,Under examination of SEIAA after SEAC,EC,
3,3873,SIA/TG/MIN/74522/2018,,SSGK Granites,M/S SSGK GRANITES,Delisted,EC,
