,Sno.,Proposal No.,File No.,Project Name,Company,Proposal Status,Project Type,View
5,1175,SIA/TG/IND2/176389/2020,SIA/TG/IND2/176389/2020,Establishment of Active Pharma Ingredients (Bulk drug and intermediates) manufacturing unit by M/s. Sreevanth Industries,SRIVANTH INDUSTRIES,EC Granted,EC,
6,1176,SIA/TG/IND2/176430/2020,SIA/TG/IND2/176430/2020,M/s. Tagoor Chemicals,TAGOOR CHEMICALS,EC Granted,EC,
7,1177,SIA/TG/IND2/176493/2020,SIA/TG/IND2/176493/2020,Establishment of Active Pharma Ingredients (Bulk drug and intermediates) manufacturing unit by M/s. Syntho Chirals Life Sciences Pvt. Ltd. Unit I,SYNTHO CHIRAL LIFE SCIENCE PVT. LTD.,EC Granted,EC,
8,1178,SIA/TG/MIS/67091/2021,SIA/TG/MIS/67091/2021,TMTC SEZ by M/s Tech Mahindra Limited,TECH MAHINDRA LIMITED,EC Granted,EC,
9,1179,SIA/TG/MIN/239326/2021,SIA/TG/MIN/239326/2021,D Arun Kumar,DARUNKUMAR,EC Granted,EC,
10,1180,SIA/TG/MIS/278595/2022,SIA/TG/MIS/278595/2022,Lake Woods (A Residential Gated Community Villa Project) by M/s. Saridena Constructions Private Limited,SARIDENA CONSTRUCTIONS PRIVATE LIMITED,EC Granted,EC,
1,1181,SIA/TG/MIS/134799/2020,SIA/TG/MIS/134799/2020,2 BHK Housing @ Kollur-I,GREATER HYDERABAD MUNICIPAL CORPORATION (GHMC),EC Granted,EC,
2,1182,SIA/TG/MIS/134797/2020,SIA/TG/MIS/134797/2020,2 BHK Housing @ Batasingaram,GREATER HYDERABAD MUNICIPAL CORPORATION (GHMC),EC Granted,EC,
3,1183,SIA/TG/MIS/134946/2020,SIA/TG/MIS/134946/2020,Construction of Proposed IT Building  By  M/s. BSSR Infratech LLP,M/S.BSSR INFRATECH LLP,EC Granted,EC,
4,1184,SIA/TG/MIN/162448/2020,SIA/TG/MIN/162448/2020,M/s. Mahareddy Infra,M/S. MAHAREDDY INFRA,EC Granted,EC,
5,1185,SIA/TG/IND2/162600/2020,SIA/TG/IND2/162600/2020,"Expansion of Active Pharma Ingredients (Bulk Drugs and Intermediates) Manufacturing Unit (from 1.56 TPD to 6 TPD) by M/s. Selmar Lab Pvt. Ltd., Unit I",DASAMI LAB PVT LTD,EC Granted,EC,
6,1186,SIA/TG/MIN/208540/2021,SIA/TG/MIN/208540/2021,"Ordinary Sand Mining over an extent of 4.87 ha, Veerabhadravaram-I Reach, Veerabhadravarm (V), Venkatapuram (M), Mulugu district, Telangana State",M/S TSMDC LTD,EC Granted,EC,
7,1187,SIA/TG/MIS/232290/2021,SIA/TG/MIS/232290/2021,M/s Pranava Constructions,M/S PRANAVA CONSTRUCTIONS,EC Granted,EC,
8,1188,SIA/TG/MIS/278809/2022,SIA/TG/MIS/278809/2022,M/s. Hitec Cyberspazio LLP,HITEC CYBERSPAZIO LLP,EC Granted,EC,
9,1189,SIA/TG/MIN/278567/2022,SIA/TG/MIN/278567/2022,Sri Ganesh Stone Crusher,BHAVESH RUDANI,Rejection Letter Granted,EC,
10,1190,SIA/TG/MIN/281218/2022,SIA/TG/MIN/281218/2022,"M/s Surya Granites, Black Granite Mining Project (2.0.Hectare",M/S SURYA GRANITES,Delisted,EC,
1,1191,SIA/TG/MIN/180032/2020,SIA/TG/MIN/180032/2020,M/s. New Karimnagar Stone Crusher,M/S NEW KARIMNAGAR STONE CRUSHER,EC Granted,EC,
2,1192,SIA/TG/MIN/178844/2020,,Proposed Limestone Slabs Quarry of Sri Syed Wali Mohammed,SRI SYED WALI MOHAMMED,WithdrawEC,EC,
3,1193,SIA/TG/MIS/132060/2019,SIA/TG/MIS/132060/2019,PHOENIX INFRASTRUCTURE PVT. LTD.,PHOENIX GROUP,EC Granted,EC,
4,1194,SIA/TG/MIS/133162/2019,SIA/TG/MIS/133162/2019,Ayyanna Infra Private Limited,AYYANNA INFRA PRIVATE LIMITED,EC Granted,EC,
5,1195,SIA/TG/IND2/153061/2020,SIA/TG/IND2/153061/2020,DRCMR Industries Pvt. Ltd,DRCMR INDUSTRIES PVT. LTD,EC Granted,EC,
6,1196,SIA/TG/IND2/174466/2020,SIA/TG/IND2/174466/2020,M/s Alkimia Pharma-Chem Private Limited,ALKIMIA PHARMA CHEM PRIVATE LIMITED,EC Granted,EC,
7,1197,SIA/TG/IND2/174464/2020,SIA/TG/IND2/174464/2020,"Manufacturing of Active Pharma Ingredients (Bulk Drugs and Intermediates) manufacturing unit (165 TPM) by M/s. Sapala Health Sciences (P) Ltd.,",M/S. SAPALA HEALTH SCIENCES (P) LTD.,EC Granted,EC,
8,1198,SIA/TG/MIS/166273/2020,SIA/TG/MIS/166273/2020,"PVR Developers India Pvt. Ltd.,","PVR DEVELOPERS INDIA PVT. LTD.,",EC Granted,EC,
9,1199,SIA/TG/IND2/205991/2021,SIA/TG/IND2/205991/2021,Establishment of Active Pharma Ingredients (Bulk Drugs and Intermediates) Manufacturing Unit of capacity 14.9 TPD by M/s. Sanjeevani Pharma,CELEBRITY DRUGS AND PHARMACEUTICALS,EC Granted,EC,
10,1200,SIA/TG/MIS/205816/2021,SIA/TG/MIS/205816/2021,Jubilee Hills Land Mark Projects by M/s Jubilee Hills Land Mark Projects Private Limited,JUBILEE HILLS LANDMARK PROJECTS PRIVATE LIMITED,EC Granted,EC,
1,1201,SIA/TG/MIN/61286/2020,SIA/TG/MIN/61286/2020,Mullakatta - III (17.60Ha.) Sand Reach,TMDC,EC Granted,EC,
2,1202,SIA/TG/MIS/196580/2021,SIA/TG/MIS/196580/2021,BUILDING NO 19 BY M/s Inorbit Mall India Private Limited,INORBIT MALL INDIA PVT. LTD.,EC Granted,EC,
3,1203,SIA/TG/MIN/216871/2021,SIA/TG/MIN/216871/2021,Smt. S. BhagyaLaxmi - 2.0 ha-Building Stone & Road Metal quarry,SMT. S. BHAGYALAXMI,EC Granted,EC,
4,1204,SIA/TG/MIN/252154/2022,SIA/TG/MIN/252154/2022,"2.677 Ha. of White Clay Mine of Sri Sake Shekar,Sy. No. 65/P of Rallapet (V), Rebbena (M), Komurambheem -Asifabad District in T.S.",SRI SAKE SHEKAR,EC Granted,EC,
5,1205,SIA/TG/MIN/252229/2022,SIA/TG/MIN/252229/2022,M/s. Shiva Stone Crusher – 1.50 Ha,M/S. SHIVA STONE CRUSHER,EC Granted,EC,
6,1206,SIA/TG/MIS/269440/2022,,M/s Synergy Anmol Developers LLP & Others,SYNERGY ANMOL DEVELOPERS LLP,WithdrawEC,EC,
7,1207,SIA/TG/MIS/213565/2021,SIA/TG/MIS/213565/2021,M/s. Rasun Exports Private Limited & Others,M/S. RASUN EXPORTS PRIVATE LIMITED & OTHERS,Rejection Letter Granted,EC,
8,1208,SIA/TG/MIN/47928/2019,SIA/TG/MIN/47928/2019,Granite Mining Project of M/s Sri Raja Rajeshwari Granites,M/S SRI RAJA RAJESHWARI GRANITES,EC Granted,EC,
9,1209,SIA/TG/MIS/62772/2021,SIA/TG/MIS/62772/2021,DSR – SSI Builders & Developers,DSR – SSI BUILDERS & DEVELOPERS,EC Granted,EC,
10,1210,SIA/TG/MIN/282327/2022,SIA/TG/MIN/282327/2022,Proposed Building Stone & Road Metal Quarry of M/s. Madeena Stone Crushers,M/S. MADEENA STONE CRUSHERS,EC Granted,EC,
1,1211,SIA/TG/MIS/115307/2019,SIA/TG/MIS/115307/2019,JMS Builders,JMS BUILDERS,EC Granted,EC,
2,1212,SIA/TG/MIS/261105/2022,SIA/TG/MIS/261105/2022,Rishi UBR Charitable and Educational Society,RISHI U B R CHARITABLE &  EDUCATIONAL SOCIETY,EC Granted,EC,
3,1213,SIA/TG/MIN/270467/2022,SIA/TG/MIN/270467/2022,M/s. Gayatri Granites – 1.220 Ha,M/S.  GAYATHRI GRANITES,EC Granted,EC,
4,1214,SIA/TG/MIN/275858/2022,SIA/TG/MIN/275858/2022,Sri Modepally Aditya Chowdary Rough Stone and Road Metal Mine,ADITYA MODEPALLI,EC Granted,EC,
5,1215,SIA/TG/MIS/77749/2022,SIA/TG/MIS/77749/2022,Proposed High Rise Residential Building named Candeur Twin Towers by M/s. Candeur Developers & Builders,CANDEUR DEVELOPERS & BUILDERS,EC Granted,EC,
6,1216,SIA/TG/MIS/276418/2022,SIA/TG/MIS/276418/2022,Organo Kandawada by M/s Organo Eco Habitats Private Limited,ORGANO ECO HABITATS PRIVATE LIMITED,EC Granted,EC,
7,1217,SIA/TG/MIS/255978/2022,SIA/TG/MIS/255978/2022,M/s. IDREAM SAI RK INFRA,M/S. IDREAM SAI RK INFRA,EC Granted,EC,
8,1218,SIA/TG/MIN/271558/2022,SIA/TG/MIN/271558/2022,M/s. Sri Gayatri Minings - 3.760 Ha,M/S. SRI GAYATHRI MININGS,EC Granted,EC,
9,1219,SIA/TG/MIS/272608/2022,SIA/TG/MIS/272608/2022,M/s.Infocity Builders,INFOCITY BUILDERS,EC Granted,EC,
10,1220,SIA/TG/MIS/276026/2022,SIA/TG/MIS/276026/2022,Hyma Developers Pvt. Ltd. (Phase - 3) (Residential complex),HYMA DEVELOPERS PVT. LTD.,EC Granted,EC,
1,1221,SIA/TG/MIN/231557/2021,SIA/TG/MIN/231557/2021,M/s Rock Sand Minerals Private Limited,M/S ROCKSAND MINERALS PVT LTD,Rejection Letter Granted,EC,
2,1222,SIA/TG/MIN/208642/2021,,M/s. Sai Ram Constructions,M/S. SAI RAM CONSTRUCTIONS,Delisted,EC,
3,1223,SIA/TG/MIS/208965/2021,SIA/TG/MIS/208965/2021,Sais Rainbow Valley of Duo Infra Projects,SAIS RAINBOW VALLEY OF DUO INFRA PROJECTS,EC Granted,EC,
4,1224,SIA/TG/IND2/175895/2020,SIA/TG/IND2/175895/2020,M/s. Pavani Cellulose Private Limited,PAVANI CELLULOSE PVT. LTD.,EC Granted,EC,
5,1225,SIA/TG/MIS/132060/2019,SIA/TG/MIS/132060/2019,PHOENIX INFRASTRUCTURE PVT. LTD.,PHOENIX GROUP,EC Granted,EC,
6,1226,SIA/TG/MIS/133162/2019,SIA/TG/MIS/133162/2019,Ayyanna Infra Private Limited,AYYANNA INFRA PRIVATE LIMITED,EC Granted,EC,
7,1227,SIA/TG/MIS/218562/2021,SIA/TG/MIS/218562/2021,M/s NikhilSai Krishna Infra LLP,M/S NIKHILSAI KRISHNA INFRA LLP,EC Granted,EC,
8,1228,SIA/TG/MIN/253658/2022,SIA/TG/MIN/253658/2022,Chinthagudem 4.54Ha. Sand Reach,TMDC,Delisted,EC,
9,1229,SIA/TG/MIS/269193/2022,SIA/TG/MIS/269193/2022,Sarveshvari Constructions & Others,SARVESHVARI CONSTRUCTIONS,EC Granted,EC,
10,1230,SIA/TG/MIS/288533/2022,SIA/TG/MIS/288533/2022,Ketrish Pratista,KETRISH DEVELOPER,EC Granted,EC,
1,1231,SIA/TG/MIN/157513/2020,SIA/TG/MIN/157513/2020,Sri K. Shravan Kumar Goud,SRI K. SHRAVAN KUMAR GOUD,EC Granted,EC,
2,1232,SIA/TG/IND2/151934/2020,SIA/TG/IND2/151934/2020,"Proposed Expansion of APIs and API Intermediates Manufacturing Unit by M/s. Aurobindo Pharma Limited, Unit-V",AUROBINDO PHARMA LIMITED UNIT V,EC Granted,EC,
3,1233,SIA/TG/MIS/133281/2019,SIA/TG/MIS/133281/2019,M/s Smt. M. Lakshmi,M LAKSHMI,EC Granted,EC,
4,1234,SIA/TG/MIN/153319/2020,SIA/TG/MIN/153319/2020,Ms. NOBLE MINERALS,MS. NOBLE MINERALS,WithdrawEC,EC,
5,1235,SIA/TG/MIS/201634/2021,SIA/TG/MIS/201634/2021,Construction of Proposed Hi-Rise Residential Apartment “ORNATE 1”  By M/s. Sri Aditya Squares,M/S. SRI ADITYA SQUARES,EC Granted,EC,
6,1236,SIA/TG/MIN/51788/2020,SIA/TG/MIN/51788/2020,Eppagudem sand reach,TMDC,EC Granted,EC,
7,1237,SIA/TG/MIN/208527/2021,SIA/TG/MIN/208527/2021,"ordinary sand over an Extent of 5.00 ha in Godavari River Kanthanpally Village, Kannaigudem Mandal, Mulugu District, Telangana State",M/S TSMDC LTD,EC Granted,EC,
8,1238,SIA/TG/MIN/211622/2021,SIA/TG/MIN/211622/2021,SEVEN HILLS GRANITE INDUSTRY,SEVEN HILLS GRANITE INDUSTRY,EC Granted,EC,
9,1239,SIA/TG/MIS/119847/2019,SIA/TG/MIS/119847/2019,Sonthalia SKY Villas by Hyderabad Steel Section Mills,HYDERABAD STEEL SECTION MILLS,EC Granted,EC,
10,1240,SIA/TG/IND2/176357/2020,SIA/TG/IND2/176357/2020,"M/s. PSN Medicare Private Limited, Unit-II",PSN MEDICARE PRIVATE LIMITED UNIT II,EC Granted,EC,
1,1241,SIA/TG/MIS/259200/2022,SIA/TG/MIS/259200/2022,Proposed Gated Community Villa Project by M/s Greenstone Infra.,GRENSTONE INFRA,EC Granted,EC,
2,1242,SIA/TG/IND2/153965/2020,SIA/TG/IND2/153965/2020,M/s Sriven Pharmaceuticals,SRIVEN PHARMACEUTICALS,WithdrawEC,EC,
3,1243,SIA/TG/MIS/171630/2020,SIA/TG/MIS/171630/2020,The Botanika,UNIVERSAL REALTORS PRIVATE LIMITED,EC Granted,EC,
4,1244,SIA/TG/IND2/202234/2021,SIA/TG/IND2/202234/2021,Expansion of Active Pharma Ingredients (Bulk Drugs and Intermediates) Manufacturing Unit by M/s. Fleming Laboratories Ltd.,FLEMING LABORATORIES LIMITED,EC Granted,EC,
5,1245,SIA/TG/MIS/64474/2021,SIA/TG/MIS/64474/2021,Building no. 1 by M/s K. Raheja IT Park (Hyderabad) Limited,K. RAHEJA IT PARK (HYDERABAD) LIMITED,Rejection Letter Granted,EC,
6,1246,SIA/TG/IND3/248833/2021,SIA/TG/IND3/248833/2021,"Proposed Establishment of Active Pharmaceutical Ingredients (APIs) and API Intermediates manufacturing unit along with R&D Facility by M/s. Bhagyanagar Chlorides Private Limited, Unit-III","M/S. BHAGAYNAGAR CHLORIDES PRIVATE LIMITED, UNIT-III",EC Granted,EC,
7,1247,SIA/TG/IND3/248907/2021,SIA/TG/IND3/248907/2021,Proposed to establish Bulk Drugs & Drug Intermediates Manufacturing Unit by Ideal Detonators Pvt. Ltd. (Pharma Division),IDEAL DETONATORS PRIVATE LIMITED,EC Granted,EC,
8,1248,SIA/TG/MIN/249802/2022,SIA/TG/MIN/249802/2022,Sri K. Vittal Reddy -1.0 ha-Building Stone & Road Metal,SRI K. VITTAL REDDY - 1.0 HA,EC Granted,EC,
9,1249,SIA/TG/MIN/77957/2021,SIA/TG/MIN/77957/2021,Midwest Granite Private Limited,MIDWEST GRANITE PRIVATE LIMITED,EC Granted,EC,
10,1250,SIA/TG/MIS/105453/2019,SIA/TG/MIS/105453/2019,Risinia Infra Developers LLP,RISINIA INFRA DEVELOPERS LLP,EC Granted,EC,
1,1251,SIA/TG/MIN/125208/2019,SIA/TG/MIN/125208/2019,Proposed Fullers Earth Quarry of Smt K. Saritha,SMT K. SARITHA,EC Granted,EC,
2,1252,SIA/TG/MIS/122846/2019,SIA/TG/MIS/122846/2019,Pavani Homes,SAI SRAVANTHI INFRA PROJECTS PRIVATE LIMTED,EC Granted,EC,
3,1253,SIA/TG/MIN/45397/2019,SIA/TG/MIN/45397/2019,Proposed Limestone Slabs Quarry of M/s. Reddy Stone Industry,M/S REDDY STONE INDUSTRY,EC Granted,EC,
4,1254,SIA/TG/MIN/45455/2019,SIA/TG/MIN/45455/2019,M.Anjaneyulu goud,ANJANEYULU GOUD,Delisted,EC,
5,1255,SIA/TG/MIN/45536/2019,SIA/TG/MIN/45536/2019,M/s Gayatri Granites,M/S GAYATRIGRANITES,EC Granted,EC,
6,1256,SIA/TG/MIN/140536/2020,SIA/TG/MIN/140536/2020,S Shyam Sundhar-Color Granite Mine,SRI. S. SHYAM SUNDER,EC Granted,EC,
7,1257,SIA/TG/IND/50654/2014,SIA/TG/IND/50654/2014,"Proposed Modernization Cum Expansion of Induction Furnace Production (2,05,000TPA TO 6,00,000 TPA) and rolling mill Production (3, 69,000 TPA TO 6,00,000 TPA) at Sy. No. 158 (part) 159 (part), 166-170",MS AGARWAL FOUNDERIES PVT LTD,EC Granted,EC,
8,1258,SIA/TG/IND2/166296/2020,SIA/TG/IND2/166296/2020,M/s Hy-Gro Chemicals Pharmtek Private Limited,M/S HYGRO CHEMICALS PHARMTEK PRIVATE LIMITED,EC Granted,EC,
9,1259,SIA/TG/MIS/219580/2021,SIA/TG/MIS/219580/2021,Proposed High Rised Residential Apartments Building by M/s. GIRIDHARI INFRA,M/S. GIRIDHARI INFRA,EC Granted,EC,
10,1260,SIA/TG/MIS/62582/2021,SIA/TG/MIS/62582/2021,Alliance Inn India Private Limited,ALLIANCE INN INDIA PRIVATE LIMITED,EC Granted,EC,
1,1261,SIA/TG/MIS/124499/2019,SIA/TG/MIS/124499/2019,PHOENIX LOTUS INFRASTRUCTURE PVT. LTD. (Mall cum Multiplex complex),PHOENIX GROUP,EC Granted,EC,
2,1262,SIA/TG/MIN/193986/2021,SIA/TG/MIN/193986/2021,M/s Vinayaka Stone Crusher,M/SVINAYAKASTONECRUSHER,EC Granted,EC,
3,1263,SIA/TG/IND2/171944/2020,SIA/TG/IND2/171944/2020,M/s. Veena Life Sciences India Pvt. Ltd.,VEENA LIFE SCIENCES INDIA PVT. LTD.,EC Granted,EC,
4,1264,SIA/TG/MIN/45834/2019,SIA/TG/MIN/45834/2019,M/s. Shiva Shakthi Granites,M/S. SHIVA SHAKTHI GRANITES,Rejection Letter Granted,EC,
5,1265,SIA/TG/MIN/40568/2019,SIA/TG/MIN/40568/2019,M/s. Sree Vijaya Laxmi Narshimha Stone Crusher,M/S. SREE VIJAYA LAXMI NARSHIMHA STONE CRUSHER,Delisted,EC,
6,1266,SIA/TG/MIN/161303/2020,SIA/TG/MIN/161303/2020,M/s. VMNR Stone Crushers Pvt. Ltd,M/S. VMNR STONE CRUSHERS PVT.LTD.,EC Granted,EC,
7,1267,SIA/TG/IND2/175237/2020,SIA/TG/IND2/175237/2020,"Proposed Establishment of Active Pharmaceutical Ingredients (APIs) and API Intermediates Manufacturing unit by M/s. Raghava Life Sciences Private Limited, Unit-III",RAGHAVA LIFE SCIENCES PRIVATE LIMITED,EC Granted,EC,
8,1268,SIA/TG/MIN/69624/2019,SIA/TG/MIN/69624/2019,Sri M. Gopal-Opencast fully mechanized mining production of Quartz @ 59175 TPA and Feldspar @ 98625 TPA -14.57 Ha,SRI M. GOPAL,EC Granted,EC,
9,1269,SIA/TG/MIS/260453/2022,,GREEN BIOFUELS,GREEN BIO FUELS,Delisted,EC,
10,1270,SIA/TG/MIS/72167/2022,SIA/TG/MIS/72167/2022,PHOENIX SPACES PVT. LTD. (Expansion) (Commercial Office cum Residential complex),PHOENIX GROUP,WithdrawEC,EC,
1,1271,SIA/TG/MIN/162441/2020,SIA/TG/MIN/162441/2020,Sri. K.Venkatesh Goud,SRI.K.VENKATESH GOUD,EC Granted,EC,
2,1272,SIA/TG/MIN/215566/2021,SIA/TG/MIN/215566/2021,"River Sand Mining Project for mining of ordinary sand in Godavari river basin at Lingapeta village, Wazeedu Mandal, Mulugu District,Telangana.",M/S TSMDC LTD,EC Granted,EC,
3,1273,SIA/TG/MIN/215285/2021,SIA/TG/MIN/215285/2021,Sri Mudda Naganath - Rough Stone & Road Metal,SRI MUDDA NAGANATH,EC Granted,EC,
4,1274,SIA/TG/MIS/233307/2021,SIA/TG/MIS/233307/2021,Janapriya Engineers Syndicate Private Limited,"JANAPRIYA ENGINEERS SYNDICATE PVT. LTD.,",EC Granted,EC,
5,1275,SIA/TG/MIS/239312/2021,SIA/TG/MIS/239312/2021,Proposed Residential Project by  Meenakshi Infrastructures Pvt. Ltd.,MEENAKSHI INFRASTRUCTURES PVT. LTD.,EC Granted,EC,
6,1276,SIA/TG/MIS/238546/2021,SIA/TG/MIS/238546/2021,Anuhar Homes Private Limited & Others,ANUHAR HOMES PRIVATE LIMITED & OTHERS,EC Granted,EC,
7,1277,SIA/TG/MIS/259863/2022,SIA/TG/MIS/259863/2022,VENKATADRI DEVELOPERS LIMITED,VENKATADRI DEVELOPERS LIMITED,EC Granted,EC,
8,1278,SIA/TG/MIN/283422/2022,SIA/TG/MIN/283422/2022,M/s. KNR Granite Industries - Gravel quarry,M/S.K.N.R GRANITE INDUSTRIES,Rejection Letter Granted,EC,
9,1279,SIA/TG/MIS/79363/2022,SIA/TG/MIS/79363/2022,"Proposed Development of Special Food Processing Park at Wargal Village, Wargal Mandal, Siddipet District, Telangana By M/s.TSIIC",TELANGANA STATE INDUSTRIAL INFRASTRUCTURE CORPORATION,EC Granted,EC,
10,1280,SIA/TG/MIN/282685/2022,SIA/TG/MIN/282685/2022,Kiran Stone Crushers,M/S KIRAN STONE CRUSHERS,EC Granted,EC,
1,1281,SIA/TG/MIS/166273/2020,SIA/TG/MIS/166273/2020,"PVR Developers India Pvt. Ltd.,","PVR DEVELOPERS INDIA PVT. LTD.,",EC Granted,EC,
2,1282,SIA/TG/MIS/223698/2021,,Residential Apartment Project by M/s Divine Homes.,M/S DIVINE HOMES,WithdrawEC,EC,
3,1283,SIA/TG/MIS/226617/2021,SIA/TG/MIS/226617/2021,New Residential Apartment Project by Mr. Mohd Yakub and Others,MR. MOHD YAKUB AND OTHERS.,EC Granted,EC,
4,1284,SIA/TG/MIS/72058/2022,SIA/TG/MIS/72058/2022,Green Space Marvel by Greenspace Housing and Engineers Private Limited,GREENSPACE HOUSING & ENGINEERS PRIVATE LIMITED,EC Granted,EC,
5,1285,SIA/TG/NCP/53899/2020,SIA/TG/NCP/53899/2020,"Proposed Development of “Siddipet Industrial Park” at Mandapally and Mittapally (V) in Siddipet Urban (M), Rajgopalpet and Mundrai (V) in Nangoor (M), Siddipet (D), Telangana  by TELANGANA STATE INDUSTRIAL INFRASTRUCTURE CORPORATION LIMITED (TSIICL)",TELANGANA STATE INDUSTRIAL INFRASTRUCTURE CORPORATION LIMITED,EC Granted,EC,
6,1286,SIA/TG/MIN/283574/2022,SIA/TG/MIN/283574/2022,Dhanala Ramanaiah,DHANALA RAMANIAH,EC Granted,EC,
7,1287,SIA/TG/MIS/283947/2022,SIA/TG/MIS/283947/2022,Rajapushpa Properties Private Limited,RAJAPUSHPA PROPERTIES PRIVATE LIMITED,EC Granted,EC,
8,1288,SIA/TG/MIS/100349/2019,SIA/TG/MIS/100349/2019,Venkata Gajanana Developers,VENKATA GAJANANA DEVELOPERS,EC Granted,EC,
9,1289,SIA/TG/IND2/176146/2020,SIA/TG/IND2/176146/2020,"Proposed expansion of Active Pharmaceutical Ingredients (APIs) and API Intermediates Manufacturing unit by M/s Spica Laboratories Pvt. Ltd.,",SPICA LABORATORIES PRIVATE LIMITED,EC Granted,EC,
10,1290,SIA/TG/IND2/176202/2020,SIA/TG/IND2/176202/2020,M/s. Arch Pharma Labs Limited,M/S ARCH PHARMALABS LIMITED,EC Granted,EC,
1,1291,SIA/TG/MIS/207239/2021,SIA/TG/MIS/207239/2021,Golden Key Mayura Sriven by  M/s Golden Key Prime Properties LLP,GOLDEN KEY PRIME PROPERTIES LLP,EC Granted,EC,
2,1292,SIA/TG/MIN/435942/2023,SIA/TG/MIN/435942/2023,Rough stone and Road Metal Quarry over an extent of 4.09 Ha. of M/s. SRINIVASA EDIFICE PRIVATE LIMITED,MS SRINIVASA EDIFICE PVT LTD,Under examination of SEIAA after SEAC,EC,
3,1293,SIA/TG/INFRA2/434153/2023,SIA/TG/INFRA2/434153/2023,Sri. Mahaveer Golechha & Others,MAHAVIR GOLECHHA,EC Granted,EC,
4,1294,SIA/TG/MIN/74527/2018,,M/S. SCR Nirman Pvt Ltd,M/S SCR NIRMAN PVT LTD- STONE & METAL QUARRY,Delisted,EC,
5,1295,SIA/TG/MIN/39191/1900,SIA/TG/MIN/39191/1900,Apoorva Munigela,APOORVA MUNIGELA,EC Granted,EC,
6,1296,SIA/TG/MIS/112114/2019,SIA/TG/MIS/112114/2019,Vertex Pristine Park,K. JAYARAM REDDY,EC Granted,EC,
7,1297,SIA/TG/MIS/195026/2021,SIA/TG/MIS/195026/2021,Building 5B By  M/s Intime Properties Ltd,INTIME PROPERTIES  LIMITED,EC Granted,EC,
8,1298,SIA/TG/MIS/146859/2020,,M/s Venkateswara Enterprises.,M/S VENKATESWARA ENTERPRISES.,WithdrawEC,EC,
9,1299,SIA/TG/IND2/17950/2016,SIA/TG/IND2/17950/2016,"Expansion of M/s Divis Laboratories Limited (Unit – 1) Sy.No. 238, 247 to 250, 260 to 279, 289 to 293 & 302 of Lingojigudam (V), and 505 & 506 of Aregudem (hemlet of Pantagi (V)), Choutuppal (M), Yada",DIVIS LABORATORIES LIMITED,Delisted,EC,
10,1300,SIA/TG/IND2/171132/2020,SIA/TG/IND2/171132/2020,Sahasra Pharma Chem,M/S. SAHASRA PHARMA CHEM,EC Granted,EC,
1,1301,SIA/TG/MIS/166287/2020,SIA/TG/MIS/166287/2020,Subishi's Polam Luxury,SUBISHI ENGINEERS,EC Granted,EC,
2,1302,SIA/TG/MIS/225506/2021,SIA/TG/MIS/225506/2021,M/s. Nikhila Constructions and Developers,M/S. NIKHILA CONSTRUCTIONS AND DEVELOPERS,EC Granted,EC,
3,1303,SIA/TG/MIS/70393/2021,SIA/TG/MIS/70393/2021,Sanali The Edge at Manchiruvelu by M/s Sanali IT Parks,SANALI IT PARKS,EC Granted,EC,
4,1304,SIA/TG/MIN/284770/2022,SIA/TG/MIN/284770/2022,M/s Sri Ganesh Mines & Minerals,SRIGANESH MINES & MINERALS,EC Granted,EC,
5,1305,SIA/TG/MIN/285282/2022,,Black Granite Quarry of  M/s. Parameswara Granites,PARAMESWARA GRANITES,Delisted,EC,
6,1306,SIA/TG/MIS/112526/2019,SIA/TG/MIS/112526/2019,A R Anmol Developers,A R ANMOL DEVELOPERS,EC Granted,EC,
7,1307,SIA/TG/MIN/32993/2019,SIA/TG/MIN/32993/2019,M/s Manika,M/S MANIKANTA STONE CRUSHER,EC Granted,EC,
8,1308,SIA/TG/MIN/276482/2022,SIA/TG/MIN/276482/2022,"M/s SVS Stone Crusher,Stone & Metal Mine",S V S STONE CRUSHERS,EC Granted,EC,
9,1309,SIA/TG/MIN/276371/2022,SIA/TG/MIN/276371/2022,A.K.Reddy Stone Crusher,KRISHNA REDDY AMBATI,EC Granted,EC,
10,1310,SIA/TG/MIS/149247/2020,,M/s. Trishala Infrastructure Pvt Ltd,M/S. TRISHALA INFRASTRUCTURES PVT LTD,WithdrawEC,EC,
1,1311,SIA/TG/MIS/160939/2020,SIA/TG/MIS/160939/2020,M/s Dinesh Projects,M/S DINESH PROJECTS,EC Granted,EC,
2,1312,SIA/TG/MIS/269258/2022,SIA/TG/MIS/269258/2022,Proposed Residential & Commercial Building Project by Milestone Narapally.,GADDAM REDDY,EC Granted,EC,
3,1313,SIA/TG/MIN/277854/2022,SIA/TG/MIN/277854/2022,M/s.Robo Silicon Pvt Ltd,ROBO SILICON PRIVATE LIMITED,Delisted,EC,
4,1314,SIA/TG/MIN/32592/2019,SIA/TG/MIN/32592/2019,Proposed L,SRI T. OBULA REDDY,EC Granted,EC,
5,1315,SIA/TG/MIN/32822/2019,SIA/TG/MIN/32822/2019,M/s. Sunny,SUNNY ENTERPRISES,EC Granted,EC,
6,1316,SIA/TG/MIN/32878/2019,SIA/TG/MIN/32878/2019,Sri O Samm,SRI O SAMMAIAH,Delisted,EC,
7,1317,SIA/TG/MIS/148598/2020,SIA/TG/MIS/148598/2020,LANSUM ELDORADO,LANSUM PROPERTIES LLP,EC Granted,EC,
8,1318,SIA/TG/MIN/170596/2020,SIA/TG/MIN/170596/2020,M/s J Sharada Metal Industries,J SHARADA METAL INDUSTRIES,EC Granted,EC,
9,1319,SIA/TG/MIS/227427/2021,,M/s GreenStoneIndia developers Pvt Ltd,M/S GREEN STONE INDIA DEVELOPERS PVT LTD,WithdrawEC,EC,
10,1320,SIA/TG/IND3/248401/2021,SIA/TG/IND3/248401/2021,Kapil Industries,KAPIL CHAGANTY,EC Granted,EC,
1,1321,SIA/TG/NCP/70585/2020,SIA/TG/NCP/70585/2020,"Industrial Park Project of M/s Telangana State Industrial Infrastructure Corporation (TSIIC) Ltd at Sy.no.228/9, Kucharam village, Manoharabad -mandal, Medak- dist, Telangana State.",TSIIC,EC Granted,EC,
2,1322,SIA/TG/IND3/249012/2021,SIA/TG/IND3/249012/2021,Proposed Active Pharmaceutical Ingredients  (APIs) and Intermediates Manufacturing Unit,ARELI PHARMACEUTICALS,EC Granted,EC,
3,1323,SIA/TG/IND3/247702/2021,SIA/TG/IND3/247702/2021,Proposed to establish Bulk Drugs & Drug Intermediates Manufacturing Unit by M/s. Lindell Pharma,LINDELL PHARMA,EC Granted,EC,
4,1324,SIA/TG/INFRA2/437650/2023,SIA/TG/INFRA2/437650/2023,LAKSHMI INFRATECH INDIA PRIVATE LIMITED,LAKSHMI INFRATECH INDIA PRIVATE LIMITED,Under examination of SEIAA after SEAC,EC,
5,1325,SIA/TG/MIN/70998/2017,,M/s Muppidi Laxmi,MUPPIDI LAXMI,Delisted,EC,
6,1326,SIA/TG/NCP/67855/2017,SIA/TG/NCP/67855/2017,"Aryamithra Projects
(Residential complex)",ANANDA HOMES PRIVATE LIMITED,EC Granted - Processed offline,EC,
7,1327,SIA/TG/MIN/74400/2018,,Sri T Koteswara Rao,SRI  T NAGESWARA RAO,Delisted,EC,
8,1328,SIA/TG/MIN/57438/2016,,Road Metal stone Quarry,SYED KHAJA PASHA ROAD METAL MINES,Delisted,EC,
9,1329,SIA/TG/INFRA2/436925/2023,SIA/TG/INFRA2/436925/2023,M/s Sri Sai Estates and Others,ROHINI MINERALS PRIVATE LIMITED,EC Granted,EC,
10,1330,SIA/TG/MIN/74376/2018,,M/s. Murali Krishna Granites,M/S. MURALI KRISHNA GRANITES,Delisted,EC,
1,1331,SIA/TG/MIN/403683/2022,SIA/TG/MIN/403683/2022,Sri V. Sriman Narayana,V SRIMANNARAYANA,Delisted,EC,
2,1332,SIA/TG/IND2/17699/2005,SIA/TG/IND2/17699/2005,"Mylan Laboratories Limited, Unit - 3",M/S. MYLAN LABORATORIES LIMITED,Delisted,EC,
3,1333,SIA/TG/INFRA2/402732/2022,SIA/TG/INFRA2/402732/2022,Ko-Hub Warehousing by M/s Sai Sankalpa Infra Projects Private Limited,SAI SANKALPA INFRA PROJECTS PRIVATE LIMITED,EC Granted,EC,
4,1334,SIA/TG/MIN/74077/2018,SIA/TG/MIN/74077/2018,"M/s. THIRUMALA MINES AND MINERALS,9.308 Ha. of Quartz and Feldspar Mine ,Sy. No. 162  
Cherikonda Village, 
Amangal  Mandal
Mahabubnagar District 
Telangana.",MS CONTINENTAL MINERALS,Rejection Letter Granted,EC,
5,1335,SIA/TG/MIN/71551/2017,SIA/TG/MIN/71551/2017,M/s. Aryan Precisions (P) Ltd,M/S. ARYAN PRECISIONS (P) LTD,EC Granted - Processed offline,EC,
6,1336,SIA/TG/CMIN/429094/2023,SIA/TG/CMIN/429094/2023,Ravindra Khani No.8 Incline Underground Coal Mining Project,THE SINGARENI COLLIERIES CO LTD,Under examination of SEIAA after SEAC,EC,
7,1337,SIA/TG/MIN/208533/2021,SIA/TG/MIN/208533/2021,"Ordinary Sand mine over an Extent of 4.97 ha, Mutharam (V), Venkatapuram (M), Mulugu district, Telangana State",M/S TSMDC LTD,EC Granted,EC,
8,1338,SIA/TG/MIS/232365/2021,SIA/TG/MIS/232365/2021,Palladium Real Estate Developers LLP,PALLADIUM REAL ESTATE DEVELOPERS LLP,EC Granted,EC,
9,1339,SIA/TG/MIS/246611/2021,SIA/TG/MIS/246611/2021,Beccun Infrastructures Limited,BECCUN INFRASTRUCTURES LIMITED,EC Granted,EC,
10,1340,SIA/TG/MIN/254362/2022,SIA/TG/MIN/254362/2022,Lohitha Minerals,LOHITHA MINERALS,EC Granted,EC,
1,1341,SIA/TG/MIS/283094/2022,SIA/TG/MIS/283094/2022,Building No. 4A & 4B by  M/s. K. Raheja IT Park (Hyderabad) Limited,K. RAHEJA IT PARK (HYDERABAD) LIMITED,EC Granted,EC,
2,1342,SIA/TG/MIN/283110/2022,SIA/TG/MIN/283110/2022,Sri Nam Prabhakar – 1.29 Ha,PRABHAKAR NAM,EC Granted,EC,
3,1343,SIA/TG/MIS/161984/2020,SIA/TG/MIS/161984/2020,"K.S.R Homes India Pvt. Ltd.,",K.S.R HOMES INDIA PRIVATE LIMITED,EC Granted,EC,
4,1344,SIA/TG/MIN/279006/2022,SIA/TG/MIN/279006/2022,M/s. Sri Nagendra Swamy Stone Crusher  1.00 Ha,SRI NAGENDRASWAMY STONE CRUSHER,EC Granted,EC,
5,1345,SIA/TG/MIS/278065/2022,SIA/TG/MIS/278065/2022,IRA FLOAT by M/s IRA Reality Tech Private Limited,IRA REALITY TECH PRIVATE LIMITED,EC Granted,EC,
6,1346,SIA/TG/MIN/34674/2019,SIA/TG/MIN/34674/2019,M/s Sri Sai Vaishnavi Stone Crushers,MS SRI SAI VAISHNAVI STORE CRUSHER,Delisted,EC,
7,1347,SIA/TG/MIS/222729/2021,SIA/TG/MIS/222729/2021,M/s. S.K.T Constructions & Developers,M/S. S.K.T. CONSTRUCTIONS & DEVELOPERS,EC Granted,EC,
8,1348,SIA/TG/MIS/183431/2020,SIA/TG/MIS/183431/2020,Dr. Surendranath Reddy Sura,DR. SURENDRANATH REDDY SURA,EC Granted,EC,
