,Sno.,Proposal No.,File No.,Project Name,Company,Proposal Status,Project Type,View
9,2369,SIA/TG/MIS/268949/2022,SIA/TG/MIS/268949/2022,DSL INFRASTRUCTURE AND SPACE DEVELOPERS PVT.  LTD.  (Residential cum IT Complex),DSL INFRASTRUCTURE AND SPACE DEVELOPERS PRIVATE LIMITED,EC Granted,EC,
10,2370,SIA/TG/MIN/275056/2022,SIA/TG/MIN/275056/2022,Stone and Metal Quarry,M/S. PAVAN STONE CRUSHING MILL,Delisted,EC,
1,2371,SIA/TG/MIS/113558/2019,SIA/TG/MIS/113558/2019,Fortune valley by parupalli constructions,MS PARUPALLI CONSTRUCTIONS,EC Granted,EC,
2,2372,SIA/TG/MIN/142824/2020,SIA/TG/MIN/142824/2020,M/s.Lumbini Stonex,M/S LUMBINI STONEX,Rejection Letter Granted,EC,
3,2373,SIA/TG/MIN/143813/2020,SIA/TG/MIN/143813/2020,M/s. Rocksand Minerals Pvt. Ltd.,ROCK SAND MINERALS (P) LIMITED,EC Granted,EC,
4,2374,SIA/TG/MIN/143488/2020,SIA/TG/MIN/143488/2020,M/s. Sapthagiri Minerals,M/S SAPTHAGIRI MINERALS,EC Granted,EC,
5,2375,SIA/TG/MIS/58528/2020,SIA/TG/MIS/58528/2020,Construction of Proposed IT Building by  M/s. Vamsiram Projects LLP,M/S. VAMSIRAM PROJECTS LLP,EC Granted,EC,
6,2376,SIA/TG/MIS/183095/2020,SIA/TG/MIS/183095/2020,M/s TNR URBAN LLP,M/S TNR URBAN LLP,WithdrawEC,EC,
7,2377,SIA/TG/MIS/74570/2022,SIA/TG/MIS/74570/2022,,NSL SEZ (HYDERABAD) PRIVATE LIMITED,EC Granted,EC,
8,2378,SIA/TG/MIN/289953/2022,SIA/TG/MIN/289953/2022,Sri Bhadradri Granites,SRI BHADRADRI,Delisted,EC,
9,2379,SIA/TG/IND2/17893/2016,SIA/TG/IND2/17893/2016,Sri Gayathri Drugs Pvt. Ltd.,SRI GAYATHRI DRUGS PVT. LTD.,EC Granted,EC,
10,2380,SIA/TG/IND1/400647/2022,SIA/TG/IND1/400647/2022,M/s Sri Sathya Sai Infrastructure Pvt Ltd,BHARGAVACHUNDURI,Pending at PP due to eds,EC,
1,2381,SIA/TG/MIN/129795/2019,SIA/TG/MIN/129795/2019,M/s Crown Enterprises,M/S.CROWN ENTERPRISES,Rejection Letter Granted,EC,
2,2382,SIA/TG/MIN/130503/2019,SIA/TG/MIN/130503/2019,Proposed Mosaic Chips Quarry of M/s Haritha Haram Mineral Industries,M/S. HARITHA HARAM MINERAL INDUSTRIES,EC Granted,EC,
3,2383,SIA/TG/MIN/131940/2019,SIA/TG/MIN/131940/2019,Proposed Limestone Slabs Quarry of Sri M.A. Aziz,SRI M.A. AZIZ,EC Granted,EC,
4,2384,SIA/TG/MIS/154438/2020,SIA/TG/MIS/154438/2020,2 BHK HOUSING @ BAHADURPALLY,GREATER HYDERABAD MUNICIPAL CORPORATION (GHMC),EC Granted,EC,
5,2385,SIA/TG/MIS/153667/2020,SIA/TG/MIS/153667/2020,"Proposed residential villas Affluence under gated community with compound wall in Sy.No’s.490/A/AA,491/AA,492/AA & 493/EE/A, Turkamjal Village, Abdulapur Mandal,Ranga Reddy District, Telangana state.",HARISPRANAVA BUILDERS,EC Granted,EC,
6,2386,SIA/TG/IND2/156665/2020,SIA/TG/IND2/156665/2020,"Expansion of Active Pharma Ingredients (Bulk Drugs and Intermediates) Manufacturing Unit (from 6 TPM to 66 TPM) by Selmar Lab Pvt. Ltd., Unit II",DASAMI LAB PVT LTD,EC Granted,EC,
7,2387,SIA/TG/IND2/175011/2020,SIA/TG/IND2/175011/2020,M/s Vishnu Chemicals Limited,M/S VISHNU CHEMICALS LIMITED,EC Granted,EC,
8,2388,SIA/TG/MIN/67922/2021,SIA/TG/MIN/67922/2021,M/s. Rainbow Enterprises-7.20 Acres or 2.92 ha opencast  mechanized quarry,M/S. RAINBOW ENTERPRISES,EC Granted,EC,
9,2389,SIA/TG/MIS/108526/2019,SIA/TG/MIS/108526/2019,Sri ASVM Anjaneya Prasad,ASVM ANJANEYA PRASAD,EC Granted,EC,
10,2390,SIA/TG/MIN/43573/2019,SIA/TG/MIN/43573/2019,Proposed Fullers Earth Quarry of Sri S. Sudarshan Reddy,SRI S. SUDARSHAN REDDY,EC Granted,EC,
1,2391,SIA/TG/MIN/38047/2019,SIA/TG/MIN/38047/2019,Sri Sampangi Laxmaiah,SRI SAMPANGI LAXMAIAH,Delisted,EC,
2,2392,SIA/TG/MIN/38612/2019,SIA/TG/MIN/38612/2019,M/s. M.V.N Granites,M/S. M.V.N GRANITES,EC Granted,EC,
3,2393,SIA/TG/MIS/190041/2020,SIA/TG/MIS/190041/2020,Blue wings developers LLP,BLUE WINGS DEVELOPERS LLP,EC Granted,EC,
4,2394,SIA/TG/MIS/121996/2019,SIA/TG/MIS/121996/2019,Hallmark Treasor by M/s Hallmark Builders & Others,HALLMARK BUILDERS & OTHERS,EC Granted,EC,
5,2395,SIA/TG/MIN/140536/2020,SIA/TG/MIN/140536/2020,S Shyam Sundhar-Color Granite Mine,SRI. S. SHYAM SUNDER,EC Granted,EC,
6,2396,SIA/TG/IND/50654/2014,SIA/TG/IND/50654/2014,"Proposed Modernization Cum Expansion of Induction Furnace Production (2,05,000TPA TO 6,00,000 TPA) and rolling mill Production (3, 69,000 TPA TO 6,00,000 TPA) at Sy. No. 158 (part) 159 (part), 166-170",MS AGARWAL FOUNDERIES PVT LTD,EC Granted,EC,
7,2397,SIA/TG/NCP/56919/2020,SIA/TG/NCP/56919/2020,Sahitis Sarwani Elite by M/s Sahiti Infratec Ventures India Private Limited,SAHITI INFRATEC VENTURES INDIA PRIVATE LIMITED,EC Granted,EC,
8,2398,SIA/TG/MIS/167677/2020,SIA/TG/MIS/167677/2020,Sri. Kosuru Venkat Surya Subba Raju,SRI. KOSURU VENKAT SURYA SUBBA RAJU,EC Granted,EC,
9,2399,SIA/TG/MIN/214706/2021,SIA/TG/MIN/214706/2021,"River Sand Mining Project for mining of ordinary sand in Godavari river basin at Moravanigudem village, Venkatapuram Mandal, Mulugu District,Telangana.",M/S TSMDC LTD,EC Granted,EC,
10,2400,SIA/TG/MIN/215208/2021,SIA/TG/MIN/215208/2021,"Sri. K,Anji Babu, Stone and Metal Mine",SRI K ANJI BABU,Rejection Letter Granted,EC,
1,2401,SIA/TG/MIN/75004/2018,,"1.000 Ha. of Black  Granite Mine of  M/s. SREE VENKATESHWARA GRANITES,Sy.No. 540 & 541  Naganool  (V),  Nagarkunrool (M),  Nagarkurnool District,  Telangana State.",MS SREE VENKATESHWARA GRANITES,Delisted,EC,
2,2402,SIA/TG/MIN/405945/2022,SIA/TG/MIN/405945/2022,PROPOSED ROUGH STONE & ROAD METAL QUARRY LEASE AREA - 6.77 Ha of M/s SIVAM SHANKARAM METALS,SIVAM SHANKARAM METALS STONE AND METAL MINE,EC Granted,EC,
3,2403,SIA/TG/NCP/61745/2017,SIA/TG/NCP/61745/2017,SHANTA SRIRAM - TECH PARK,SHANTA SRIRAM CONSTRUCTION PVT LTD,Delisted,EC,
4,2404,SIA/TG/MIN/74579/2018,,M/S. Venkateswara Shilpakala Industries,M/S. VENKATESWARA SHILPAKALA INDUSTRIES- COLOR GRANITE QUARRY,Delisted,EC,
5,2405,SIA/TG/MIN/434630/2023,SIA/TG/MIN/434630/2023,M/s. Nava Bharat Ferro Alloys Limited,NAVABHARAT FERRO ALLOYS LIMITED,EC Granted,EC,
6,2406,SIA/TG/MIN/57589/2016,SIA/TG/MIN/57589/2016,BOMMAPUR SAND REACH,TSMDCLTD,EC Granted,EC,
7,2407,SIA/TG/NCP/60795/2016,SIA/TG/NCP/60795/2016,"Commercial building ""TECH PARK "" By M/s Sohini Developers LLP",SOHINI DEVELOPERS LLP,EC Granted,EC,
8,2408,SIA/TG/MIN/405531/2022,SIA/TG/MIN/405531/2022,PROPOSED ROUGH STONE & ROAD METAL QUARRY Lease Area - 15.00Ha of M/s. SIVAM SHANKARAM METALS,SIVAM SHANKARAM METALS STONE AND METAL MINE,EC Granted,EC,
9,2409,SIA/TG/MIN/435742/2023,SIA/TG/MIN/435742/2023,Proposed for Black Granite quarry of M/s. Shakthi Moogambika Granites -3.0 ha,GOVINDASAMY VENUGOPAL,Under examination of SEIAA after SEAC,EC,
10,2410,SIA/TG/INFRA2/410891/2022,SIA/TG/INFRA2/410891/2022,Building no. 8 by M/s K. Raheja IT Park (Hyderabad) Limited,K. RAHEJA IT PARK (HYDERABAD) LIMITED,EC Granted,EC,
1,2411,SIA/TG/MIS/231707/2021,SIA/TG/MIS/231707/2021,Ankura Homes,ANKURA HOMES,EC Granted,EC,
2,2412,SIA/TG/MIS/280405/2022,SIA/TG/MIS/280405/2022,Legend Chimes by Legend Estates Private Limited,SREENATHAREDDY MATLI,Rejection Letter Granted,EC,
3,2413,SIA/TG/MIN/41048/1990,SIA/TG/MIN/41048/1990,M/s.Sri Kanakadurga Mineral Industry,M/S. SRI KANAKA DURGA MINERAL INDUSTRY,Rejection Letter Granted,EC,
4,2414,SIA/TG/MIS/116266/2019,SIA/TG/MIS/116266/2019,Sree Kalpa Projects,SREE KALPA PROJECTS,EC Granted,EC,
5,2415,SIA/TG/IND2/41849/2005,SIA/TG/IND2/41849/2005,Proposed Expansion of Synthetic Organic Chemicals (APIs & API Intermediates) by M/s. Aurore Life Sciences Private Limited,AURORE LIFE SCIENCES PRIVATE LIMITED,EC Granted,EC,
6,2416,SIA/TG/MIN/172551/2020,SIA/TG/MIN/172551/2020,M/s  SAI GEETHIKA EXPORTS,M/S SAI GEETHIKA EXPORTS,Rejection Letter Granted,EC,
7,2417,SIA/TG/MIS/95976/2019,,Gaddipati,SRI GADDIPATI HARI BABU,Delisted,EC,
8,2418,SIA/TG/IND2/164429/2020,,VIRUPAKSHA LABORATORIES PVT. LTD. (UNIT – II),VIRUPAKSHA LABORATORIES PVT. LTD. UNIT-II,Delisted,EC,
9,2419,SIA/TG/MIN/154777/2020,SIA/TG/MIN/154777/2020,M/s. Sri Mallikarjuna Minerals,M/S. SRI MALLIKARJUNA MINERALS,EC Granted,EC,
10,2420,SIA/TG/IND2/198380/2021,SIA/TG/IND2/198380/2021,"Expansion of Active Pharma Ingredients (Bulk Drugs and Intermediates Manufacturing) Unit (From 21.9 TPM to 42.31 TPM) at Survey No. 172, 172/C, 81 & 84, Plot No. 1, 75A, 75B, 105, 110,111 & 112, S.V. Cooperative Industrial Estate, IDA Bollaram, Jinna","DR.REDDYS LABORATORIES LTD., UNIT  II",EC Granted,EC,
1,2421,SIA/TG/MIN/42755/2019,SIA/TG/MIN/42755/2019,Proposed Limestone Slabs Quarry of M/s. Khaliq Stone Industries,M/S KHALIQ STONE INDUSTRIES,EC Granted,EC,
2,2422,SIA/TG/MIS/132116/2019,SIA/TG/MIS/132116/2019,M/s. V Zone Hospitality Private Limited,M/S.V ZONE HOSPITALITY PRIVATE LIMITED,EC Granted,EC,
3,2423,SIA/TG/MIS/133644/2019,SIA/TG/MIS/133644/2019,BVM Energy and Residency Private Limited,BVM ENERGY AND RESIDENCY PRIVATE LIMITED,EC Granted,EC,
4,2424,SIA/TG/MIN/161493/2020,SIA/TG/MIN/161493/2020,M/s.Metamorphic Rocks,M/S. METAMORPHIC ROCKS,EC Granted,EC,
5,2425,SIA/TG/MIS/70526/2021,SIA/TG/MIS/70526/2021,AQUA SPACE DEVELOPERS PVT. LTD. (Residential Complex),MY HOME GROUP,EC Granted,EC,
6,2426,SIA/TG/MIS/70543/2021,SIA/TG/MIS/70543/2021,Luxury Residential Apartments by M/s Mahira Ventures Private Limited,MAHIRA VENTURES PRIVATE LIMITED,EC Granted,EC,
7,2427,SIA/TG/MIS/282302/2022,SIA/TG/MIS/282302/2022,APR Projects,APR PROJECTS,EC Granted,EC,
8,2428,SIA/TG/MIN/283400/2022,SIA/TG/MIN/283400/2022,Road Metal and Building Stone quarry of Ms. Shiva Ganga Aggregates,RAM REDDY BUDIDHI,EC Granted,EC,
9,2429,SIA/TG/MIN/282736/2022,SIA/TG/MIN/282736/2022,Ordinary sand in Manjeera River over an extent of 1.0803 Ha. of Siddapur Village Bodhan Mandal Nizamabad District,RAVI KUMAR VENNAPUSA,EC Granted,EC,
10,2430,SIA/TG/MIS/126965/2019,SIA/TG/MIS/126965/2019,M/s. Aakriti Constructions and Developers Pvt. Ltd.,M/S. AAKRITI CONSTRUCTIONS AND DEVELOPERS PVT. LTD,EC Granted,EC,
1,2431,SIA/TG/NCP/62308/2017,SIA/TG/NCP/62308/2017,M/s. CHJ SECURITIES PRIVATE LIMITED & OTHERS,CHJ SECURITIES PVT LTD AND OTHERS,EC Granted,EC,
2,2432,SIA/TG/MIN/76162/2018,SIA/TG/MIN/76162/2018,"Sri B. Laxmaiah,
Survey No.283, Asifnagar Village, Kothapalli Mandal, Karimnagar District, Telangana State",SRI BLAXMAIAH,Delisted,EC,
3,2433,SIA/TG/MIN/415975/2023,SIA/TG/MIN/415975/2023,"Assistant Director of Mines & Geology, Mahabubnagar, 2.023 ha",VIJAY GURRAM,Delisted,EC,
4,2434,SIA/TG/MIN/435238/2023,SIA/TG/MIN/435238/2023,Md Aslam Khan,MOHAMMED KHAN,EC Granted,EC,
5,2435,SIA/TG/INFRA2/407223/2022,SIA/TG/INFRA2/407223/2022,Risinia Projects,RISINIA PROJECTS,EC Granted,EC,
6,2436,SIA/TG/MIN/419478/2023,SIA/TG/MIN/419478/2023,M/s. Rock Crushing India Pvt Ltd - 10.076 ha  - Rough Stone & Road Metal and Gravel,ROCK CRUSHING INDIA PRIVATE LIMITED,Deferred by SEIAA,EC,
7,2437,SIA/TG/MIN/74269/2018,SIA/TG/MIN/74269/2018,M/s. Telangana minerals,TELANGANAMINERALS,Delisted,EC,
8,2438,SIA/TG/INFRA2/400428/2022,SIA/TG/INFRA2/400428/2022,M/s Jai Sridevi Homes Pvt Ltd,JAISRIDEVI HOMES PRIVATE LIMITED,EC Granted,EC,
9,2439,SIA/TG/INFRA2/437784/2023,,THE GARNETT by M/s Sri Himaghna Constructions Private Limited,SRI HIMAGHNA CONSTRUCTIONS PRIVATE LIMITED,Under examination of SEIAA,EC,
10,2440,SIA/TG/MIN/434531/2023,SIA/TG/MIN/434531/2023,Sri. SYED KHAJA PASHA,KHAJAPASHA SYED,EC Granted,EC,
1,2441,SIA/TG/MIN/67922/2021,SIA/TG/MIN/67922/2021,M/s. Rainbow Enterprises-7.20 Acres or 2.92 ha opencast  mechanized quarry,M/S. RAINBOW ENTERPRISES,EC Granted,EC,
2,2442,SIA/TG/MIN/290307/2022,SIA/TG/MIN/290307/2022,Smt. Datla Padma Haritha,PADMA DATLA,EC Granted,EC,
3,2443,SIA/TG/IND2/194520/2021,SIA/TG/IND2/194520/2021,M/s. Acumeds Pharmaceuticals Unit-I,ACUMEDS PHARMACEUTICALS,EC Granted,EC,
4,2444,SIA/TG/MIS/194501/2021,SIA/TG/MIS/194501/2021,Building 16 By M/s Trion Properties Pvt. Ltd,"TRION PROPERTIES PVT. LTD.,",EC Granted,EC,
5,2445,SIA/TG/MIN/60296/2020,SIA/TG/MIN/60296/2020,"60.50 Hect. of Ordinary Sand Quarry, Padmagudem Sand Reach, Telangana State Mineral Development Corporation Limited.,",MS TSMDC LTD,EC Granted,EC,
6,2446,SIA/TG/MIS/100420/2019,SIA/TG/MIS/100420/2019,Sunshine Green Meadows,SUNSHINE INFRA PRIVATE LIMITED,EC Granted,EC,
7,2447,SIA/TG/MIS/126279/2019,SIA/TG/MIS/126279/2019,GAR Corporation Private Limited,GAVVA AR REAL LLP,EC Granted,EC,
8,2448,SIA/TG/MIN/127397/2019,SIA/TG/MIN/127397/2019,Dhatri granites,DHATRI,EC Granted,EC,
9,2449,SIA/TG/IND2/152063/2020,SIA/TG/IND2/152063/2020,Ms. Sri Karthikeya Bio Pharma Projects Pvt. Ltd,MS. SRI KARTHIKEYA BIO PHARMA PROJECTS PVT. LTD,Delisted,EC,
10,2450,SIA/TG/MIN/150175/2020,SIA/TG/MIN/150175/2020,Sri G. Krishna Murthy,SREE G KRISHNA MURTHY,EC Granted,EC,
1,2451,SIA/TG/NCP/71855/2017,SIA/TG/NCP/71855/2017,GK SQUARE,DEFINATION REALITY LLP,EC Granted - Processed offline,EC,
2,2452,SIA/TG/MIN/74231/2018,,M/S. North East Developers Pvt Ltd,M/S. NORTH EAST DEVELOPERS PVT LTD,Delisted,EC,
3,2453,SIA/TG/MIN/419393/2023,SIA/TG/MIN/419393/2023,Sri Tirumala Stone Sand Metal Industry,PRABHAVATHI BUDIDI,Deferred by SEIAA,EC,
4,2454,SIA/TG/MIN/75175/2018,,"1.500 Ha. of Building Stone & Road Metal  Mine of  M/s Thirumala Metal Industries,Sy.No. 530
Nirmal  Village, 
Nirmal Mandal,
Nirmal   District.
Telangana.",MS THIRUMALA METAL INDUSTRIES,Delisted,EC,
5,2455,SIA/TG/MIN/402860/2022,,Vuyyala Narayana,SRI VUYYALA NARAYANA,Pending at PP due to eds,EC,
6,2456,SIA/TG/MIN/44267/2019,SIA/TG/MIN/44267/2019,Proposed Limestone Slabs Quarry of Sri Mohammed Imdad Hussain,SRI MOHAMMED IMDAD HUSSAIN,EC Granted,EC,
7,2457,SIA/TG/IND2/163462/2020,SIA/TG/IND2/163462/2020,"Proposed Expansion of Active Pharmaceutical Ingredients (APIs)  and API Intermediates Manufacturing Unit by M/s. MSN Life Sciences Private Limited, Unit-I",MSN LIFE SCIENCES PRIVATE LIMITED,EC Granted,EC,
8,2458,SIA/TG/MIN/49976/2020,SIA/TG/MIN/49976/2020,Pathagummuru Sand Reach,TELANGANA STATE MINERAL  DEVELOPMENT CORPORATION LIMITED,EC Granted,EC,
9,2459,SIA/TG/MIS/251335/2022,SIA/TG/MIS/251335/2022,Proposed PANR Mall cum multiplex Project,PANR MALL,EC Granted,EC,
10,2460,SIA/TG/MIS/101676/2019,SIA/TG/MIS/101676/2019,MOHD YAKUB AND OTHERS,MOHD YAKUB AND OTHERS,Delisted,EC,
1,2461,SIA/TG/MIS/62582/2021,SIA/TG/MIS/62582/2021,Alliance Inn India Private Limited,ALLIANCE INN INDIA PRIVATE LIMITED,EC Granted,EC,
2,2462,SIA/TG/MIS/213798/2021,SIA/TG/MIS/213798/2021,Shobha Solitaire by M/s Idea Estates,IDEA ESTATES,EC Granted,EC,
3,2463,SIA/TG/MIS/225887/2021,SIA/TG/MIS/225887/2021,Multistoried Apartment Project by M/s HPR Homes LLP,M/S HPR HOMES LLP,EC Granted,EC,
4,2464,SIA/TG/MIN/226005/2021,SIA/TG/MIN/226005/2021,Colour Granite Mining Project (Minor Mineral) of M/s. Narasimha Granites & Exports,M/S NARASIMHA GRANITES & EXPORTS,Delisted,EC,
5,2465,SIA/TG/MIN/251206/2022,,Proposed Building Stone & Road Metal Quarry of M/s. Madeena Stone Crushers,M/S. MADEENA STONE CRUSHERS,WithdrawEC,EC,
6,2466,SIA/TG/MIN/31001/2019,SIA/TG/MIN/31001/2019,M/s. Rock Sand Minerals (P) Ltd,M/S ROCK SAND MIINERALS PVT. LTD,EC Granted,EC,
7,2467,SIA/TG/MIS/279109/2022,SIA/TG/MIS/279109/2022,PHOENIX IT SPACES PVT. LTD.  (Residential villas),PHOENIX GROUP,EC Granted,EC,
8,2468,SIA/TG/MIN/279786/2022,SIA/TG/MIN/279786/2022,Quartz & Feldspar Quarry of  Sri G. Srinivas,SRINIVAS GALI,EC Granted,EC,
9,2469,SIA/TG/MIS/80213/2022,SIA/TG/MIS/80213/2022,SAMASHTI by M/s Samashti Projects,SAMASHTI PROJECTS,EC Granted,EC,
10,2470,SIA/TG/MIS/80821/2022,SIA/TG/MIS/80821/2022,"Proposed Devlopment of Special Food Processing Park at Lingampally/Jangaon/Karadpally Village, Sadasivanagar Mandal, Kamareddy District by M/s.TSIIC",TSIIC,EC Granted,EC,
1,2471,SIA/TG/MIN/74005/2018,SIA/TG/MIN/74005/2018,Venkateshwaraminingcorporation,SVMININGCORPORATION,Rejection Letter Granted,EC,
2,2472,SIA/TG/INFRA2/430048/2023,SIA/TG/INFRA2/430048/2023,"Proposed construction of High Residential apartment building Consisting of Cellar + 3 Stilts + 33 Upper Floors In Survey Nos. 29/1/AE/2/1, 29/1/AE1/1, 29/1AE, Situated At Bandalguda Jagir Village, Gandipet Mandal, Under Bandlaguda Jagir Municipal Corporation, Ranga Reddy District, Telangana by M/S. Giridhari Constructions and Siri Nivas Infra Jv, Rep. by Its Managing Partners. 1. Sri. S. Raghupathi Reddy 2. Sri. D. Sreenivasula Reddy",GIRIDHARI CONSTRUCTIONS,EC Granted,EC,
3,2473,SIA/TG/NCP/59662/2016,SIA/TG/NCP/59662/2016,Proposed Residential  Apartments By M/s Riddhi Infra Estate LLP,RIDDHI INFRA ESTATE,EC Granted - Processed offline,EC,
4,2474,SIA/TG/INFRA2/435141/2023,SIA/TG/INFRA2/435141/2023,Phoenix Spaces Private Limited,PHOENIX SPACES PRIVATE LIMITED,EC Granted,EC,
5,2475,SIA/TG/MIN/74047/2018,SIA/TG/MIN/74047/2018,M/s Sri Balaji Stone Crusher Industry,M/S SRI BALAJI STONE CRUSHER INDUSTRY,Delisted,EC,
6,2476,SIA/TG/MIN/74052/2018,,Sri Musthyala Hari Prasad,SRI MUSTHYALA HARI PRASAD,Delisted,EC,
7,2477,SIA/TG/MIN/437966/2023,SIA/TG/MIN/437966/2023,Sri Kokkirala Venugopal Rao,RAMILLA BAPU,Under examination of SEAC,EC,
8,2478,SIA/TG/NCP/65108/2017,SIA/TG/NCP/65108/2017,Hyderabad International Trade Exposition Centre,HYDERABAD INTERNATIONAL TRADE EXPOSITION CENTRE,EC Granted - Processed offline,EC,
9,2479,SIA/TG/NCP/76002/2018,SIA/TG/NCP/76002/2018,Jain Sadguru Image Gardens,JAIN SADGURU CONSTRUCTIONS LLP,EC Granted,EC,
10,2480,SIA/TG/MIN/434766/2023,SIA/TG/MIN/434766/2023,"M/s. G.I.Rank Industries, Rough Stone & Road Metal Mine, Acres 42.20  GT /17.07 Hectares at Survey No: 259/1, Erdanoor (V), Sangareddy (M), Sangareddy (D), Telangana State",G.I.RANK INDUSTRIES,EC Granted,EC,
1,2481,SIA/TG/MIN/208552/2021,SIA/TG/MIN/208552/2021,"Ordinary Sand Mining for an extent of 4.99 ha, Lingapet village, Wazeedu Mandal Mulugu district, Telangana State",M/S TSMDC LTD,EC Granted,EC,
2,2482,SIA/TG/MIS/208859/2021,SIA/TG/MIS/208859/2021,M/s. Cascade Enterprises (P) Limited,CASCADE ENTERPRISES PVT.LTD.,EC Granted,EC,
3,2483,SIA/TG/MIS/230187/2021,SIA/TG/MIS/230187/2021,Amogha Grandeur by Sir.  P. Rohan Reddy & Others,P. ROHAN REDDY & OTHERS,EC Granted,EC,
4,2484,SIA/TG/MIS/251074/2022,SIA/TG/MIS/251074/2022,Proposed Hospital and Medical College Neelima Hospitals and Neelima Institute of Medical Sciences by  M/s Gayathri Educational and Cultural Trust,M/S GAYATHRI EDUCATIONAL AND CULTURAL TRUST,Delisted,EC,
5,2485,SIA/TG/MIN/228459/2021,SIA/TG/MIN/228459/2021,M/s. Sai Metals,M/S. SAI METALS,Delisted,EC,
6,2486,SIA/TG/MIN/39648/2019,SIA/TG/MIN/39648/2019,sri molugu gal reddy,SRI MOLUGU GAL REDDY,WithdrawEC,EC,
7,2487,SIA/TG/MIN/39956/2019,SIA/TG/MIN/39956/2019,Sri. Boinpally Ranjith Rao,SRI. BOINPALLY RANJITH RAO,Delisted,EC,
8,2488,SIA/TG/IND2/172513/2020,SIA/TG/IND2/172513/2020,M/s Sritha Chems Private Limited,M/S SRITHACHEMS PRIVATE LIMITED,EC Granted,EC,
9,2489,SIA/TG/MIN/33461/2019,SIA/TG/MIN/33461/2019,M/s. Jeyaa Subhasre Mines,M/S JEYAA SUBHASRE MINES,EC Granted,EC,
10,2490,SIA/TG/MIS/148598/2020,SIA/TG/MIS/148598/2020,LANSUM ELDORADO,LANSUM PROPERTIES LLP,EC Granted,EC,
1,2491,SIA/TG/MIS/48160/2019,SIA/TG/MIS/48160/2019,"Auro Residential Apartment by Mahira Ventures Private Limited, Phase-2",AURO RESIDENTIAL APARTMENT  BY MAHIRA VENTURES PRIVATE LIMITED,EC Granted,EC,
2,2492,SIA/TG/MIS/51451/2019,SIA/TG/MIS/51451/2019,Candeur 40,CANDEUR 40,EC Granted,EC,
3,2493,SIA/TG/MIN/145120/2020,SIA/TG/MIN/145120/2020,Manikanta Granites,M/S MANIKANTA GRANITES,EC Granted,EC,
4,2494,SIA/TG/MIN/148260/2020,SIA/TG/MIN/148260/2020,M/s. M.P.P. Exports,M/S. M.P.P. EXPORTS,EC Granted,EC,
5,2495,SIA/TG/MIN/171193/2020,SIA/TG/MIN/171193/2020,M/s. Gangothri Metal Industry 2.0 ha,GANGOTHRI METAL INDUSTRY,EC Granted,EC,
6,2496,SIA/TG/MIS/196878/2021,SIA/TG/MIS/196878/2021,M. Subramanyam  represented by its AGPA holders M/s Ganapathi Developers,M/S GANAPATHI DEVELOPERS,EC Granted,EC,
7,2497,SIA/TG/MIS/212009/2021,SIA/TG/MIS/212009/2021,Vedamsa Infrastructure Private Limited,VEDAMSA INFRASTRUCTURE PRIVATE LIMITED,EC Granted,EC,
8,2498,SIA/TG/MIN/32908/2019,SIA/TG/MIN/32908/2019,Chinnaravigudem sand Reach by M/s.  TSMDC Ltd,TMDC,EC Granted,EC,
9,2499,SIA/TG/MIN/62546/2020,SIA/TG/MIN/62546/2020,"Kaldurki Sand Reach by Telangana State Mineral Development Corporation Limited.,",TSMDCLIMITED,EC Granted,EC,
10,2500,SIA/TG/MIS/191663/2021,SIA/TG/MIS/191663/2021,"M/s. Esteem Villas Private Limited (Rep. Shri SOURABH MODI), Sterling Avenue Pvt Ltd, Edifice Homes India Pvt Ltd",M/S ESTEEM VILLAS PRIVATE LIMITED,EC Granted,EC,
1,2501,SIA/TG/IND2/176280/2020,SIA/TG/IND2/176280/2020,It is proposed to include Active Pharma Ingredients manufacturing facility by acquiring additional land of 6.02 acres. (Total land area after expansion is 7.27 acres) by M/s. Surabhi Industries India Pvt. Ltd,SURABHI INDUSTRIES,Rejection Letter Granted,EC,
2,2502,SIA/TG/IND2/176600/2020,,"Expansion of Active Pharma Ingredients (Bulk drug and intermediates) manufacturing unit by M/s. Erythro Pharma Pvt. Ltd.,",M/S. ERYTHRO PHARMA PVT. LTD UNIT II.,WithdrawEC,EC,
3,2503,SIA/TG/MIS/236035/2021,SIA/TG/MIS/236035/2021,Poulomi Estates Private Limited,POULOMI ESTATES PRIVATE LIMITED,EC Granted,EC,
4,2504,SIA/TG/MIN/265977/2022,SIA/TG/MIN/265977/2022,M/s. Rajyalaxmi Robo Sand Industries- Rough Stone & Road Metal -annual average production @ 56688 m3/year,RAJYALAXMI ROBO SAND INDUSTRIES,EC Granted,EC,
5,2505,SIA/TG/MIS/283154/2022,SIA/TG/MIS/283154/2022,Bay Leaf by Verdant Builders & Developers Private Limited,VERDANT BUILDERS & DEVELOPERS PRIVATE LIMITED,EC Granted,EC,
6,2506,SIA/TG/MIN/284041/2022,SIA/TG/MIN/284041/2022,"M/s. Srimantha Rocks Survey No. 160/2, Tettalapadu Village, Thirumalayapalem Mandal, Khammam District, Telangana State",SRIMANTHA ROCKS,EC Granted,EC,
7,2507,SIA/TG/MIN/33366/2013,SIA/TG/MIN/33366/2013,M/s Midwes,MIDWEST PVT LTD,Rejection Letter Granted,EC,
8,2508,SIA/TG/MIN/33480/2019,SIA/TG/MIN/33480/2019,M/s Vikesh Metal Industries,M/S VIKESH METAL INDUSTRIES,EC Granted,EC,
9,2509,SIA/TG/MIS/152172/2020,SIA/TG/MIS/152172/2020,M/s. Venkata Praneeth Developers Pvt. Ltd.,VENKATA PRANEETH DEVELOPERS PVT LTD,EC Granted,EC,
10,2510,SIA/TG/IND2/153200/2020,SIA/TG/IND2/153200/2020,"Proposed Expansion of Active Pharmaceutical Ingredients (APIs) , API Intermediates and Specialty chemicals manufacturing unit along with Combined ZLD for Unit-I and only High TDS effluent from Unit-II",THERAPIVA PRIVATE LIMITED,WithdrawEC,EC,
1,2511,SIA/TG/MIN/33060/2019,,M/s Vikesh,VIKESHMETALINDUSTRIES,WithdrawEC,EC,
2,2512,SIA/TG/MIN/33144/2019,SIA/TG/MIN/33144/2019,Sri. Yedla,SRI. YEDLA VENKANNA,EC Granted,EC,
3,2513,SIA/TG/MIN/33190/2019,SIA/TG/MIN/33190/2019,Proposed B,M/S NAGADHAR CONSTRUCTIONS PRIVATE LIMITED,EC Granted,EC,
4,2514,SIA/TG/MIN/33171/2019,SIA/TG/MIN/33171/2019,Proposed C,M/S. MOGHUL GRANITES,EC Granted,EC,
5,2515,SIA/TG/MIS/142984/2020,SIA/TG/MIS/142984/2020,A-Star Logistics Cargo Hub,A-STAR LOGISTICS (INDIA) PRIVATE LIMITED,EC Granted,EC,
6,2516,SIA/TG/IND2/166699/2020,SIA/TG/IND2/166699/2020,Swara Labs Pvt. Ltd.,SWARA LABS PVT LTD,EC Granted,EC,
7,2517,SIA/TG/MIN/126690/2019,SIA/TG/MIN/126690/2019,"M/s.Sri Raja Rajeshwara Gravel Quarry, Survey No. 28/1/A1/5, Gundlapahad Village, Nallabelly Mandal, Warangal Rural District, Telangana State",M/S.SRI RAJA RAJESHWARA GRAVEL QUARRY,EC Granted,EC,
8,2518,SIA/TG/IND2/155900/2020,SIA/TG/IND2/155900/2020,SPANSULES FORMULATIONS PVT. LTD. API DIVISION UNIT-II,SPANSULES FORMULATIONS PVT. LTD. API DIVISION UNIT-II,EC Granted,EC,
9,2519,SIA/TG/MIS/150746/2020,SIA/TG/MIS/150746/2020,Construction of Proposed Multi Storied Residential Buildings By  M/s. Spectra India Mega Projects Pvt. Ltd.,M/S. SPECTRA INDIA MEGA PROJECTS PVT LTD.,Rejection Letter Granted,EC,
10,2520,SIA/TG/IND3/248833/2021,SIA/TG/IND3/248833/2021,"Proposed Establishment of Active Pharmaceutical Ingredients (APIs) and API Intermediates manufacturing unit along with R&D Facility by M/s. Bhagyanagar Chlorides Private Limited, Unit-III","M/S. BHAGAYNAGAR CHLORIDES PRIVATE LIMITED, UNIT-III",EC Granted,EC,
1,2521,SIA/TG/MIN/92390/2019,,PPrabhakarReddy,MS PRABHAKAR REDDY,Delisted,EC,
2,2522,SIA/TG/MIN/63320/2017,SIA/TG/MIN/63320/2017,"M/s.LNS Granites,11.84 Het of Colour Granite Quarry,Sy No:588 to 597, 599 to 621, 779 to 787, 791 to 794 Abadi of 
Elgandal Village, Karimnagar Mandal, Karimnagar District, Telangana State",MS LNS GRANITES,EC Granted,EC,
3,2523,SIA/TG/MIN/407826/2022,SIA/TG/MIN/407826/2022,M/s Anantha Sai Industries Pvt Ltd,ANANTHA SAI INDUSTRIES PRIVATE LIMITED,EC Granted,EC,
4,2524,SIA/TG/MIN/420406/2023,SIA/TG/MIN/420406/2023,M/s. Sree Sai Aggregates,SURENDER REDDY SAMA,Delisted,EC,
5,2525,SIA/TG/MIN/66994/2017,,Sri Vaishnavi Granites (2.31ha),SRI VAISHNAVI GRANITES,Delisted,EC,
6,2526,SIA/TG/NCP/56800/2016,SIA/TG/NCP/56800/2016,Vishnukrupa Developers,VISHNUKRUPA DEVELOPERS,EC Granted,EC,
7,2527,SIA/TG/MIN/58875/2016,,M/s. Vijetha Granites- 4.4ha,M/S. VIJETHA GRANITES,TransferToDEIAA,EC,
8,2528,SIA/TG/NCP/73618/2018,SIA/TG/NCP/73618/2018,Tripura Constructions,TRIPURA CONSTRUCTIONS,EC Granted - Processed offline,EC,
9,2529,SIA/TG/MIN/72590/2018,SIA/TG/MIN/72590/2018,"Smt. K. Teena Devi, Badigadinne Quartz  Mine",SMT TEENA DEVI,Delisted,EC,
10,2530,SIA/TG/MIN/78378/2018,,"M/s Jyothi Exports 7.93 Ha of Colour Granite mine in sy.no.62, Kamanpur village, Karimnagar mandal & District, Telangana state",MS JYOTHI EXPORTS,Delisted,EC,
1,2531,SIA/TG/INFRA2/424763/2023,SIA/TG/INFRA2/424763/2023,“PALM MEADOWS” (Residential Gated Community Villa Project) by M/s. Devis Homes Private Limited,DEVIS HOMES PRIVATE LIMITED,Delisted,EC,
2,2532,SIA/TG/MIN/57237/2016,SIA/TG/MIN/57237/2016,"M/s Sibelco India Pvt Ltd 14.31 hect Quartz & Feldspar mine in Sy.no:147/2/2,147/1,
Balanagar V& M, Mahabubnagar D,T.S",MS SIBELCO INDIA MINERALS PVT LTD,EC Granted,EC,
3,2533,SIA/TG/NCP/67517/2017,SIA/TG/NCP/67517/2017,"Construction of ""2 BHK HOUSING at Muraharipalli(V),
Shameerpet(M), Medchal -Malkajigiri (D) - Telangana"" bearing Sy. No. 60/2.",EXECUTIVE ENGINEER GHMC,EC Granted - Processed offline,EC,
4,2534,SIA/TG/INFRA2/436788/2023,SIA/TG/INFRA2/436788/2023,Proposed Residential Apartments by M/s. Nikhil Sai Krishna Projects,NIKHIL SAI KRISHNA PROJECTS,Under examination of SEIAA after SEAC,EC,
5,2535,SIA/TG/INFRA2/435129/2023,SIA/TG/INFRA2/435129/2023,M/s. Shree Vasavi Infrastructures,SHREE VASAVI INFRASTRUCTURES,EC Granted,EC,
