,Sno.,Proposal No.,File No.,Project Name,Company,Proposal Status,Project Type,View
1,282,SIA/HP/MIN/50182/2016,HPSEIAA/2016/470,"M/s Shiv Shakti Stone Crusher CO-OP. Ind. Society, Sand,
Stone and Bajri Mining Project.",SHIV SHAKTI STONE CRUSHER,EC Granted,EC,
2,283,SIA/HP/MIN/423940/2023,HPSEIAA/2023/1066,Extraction of sand stone and Bajri by Jagdish Raj Thakur,JAGDISH THAKUR,EC Granted,EC,
3,284,SIA/HP/MIN/413280/2023,HPSEIAA/2023/1069,"Mining of Sand, Stone & Bajri from Kunah Khad, situated at Mauza & Mohal Patyahu & Jangal, proposed by Sh. Anmol","MINING OF SAND, STONE & BAJRI FROM KUNAH KHAD, SITUATED AT MAUZA & MOHAL PATYAHU,& JANGAL TEHSIL – NADAUN, DISTRICT – HAMIRPUR, STATE - HIMACHAL PRADESH,  PROPOSED BY SH. ANMOL KUMAR",EC Granted,EC,
4,285,SIA/HP/MIN/169950/2020,,M/s Krishna Stone Crusher,M/S KRISHNA STONE CRUSHER MINING LEASE AREA,Delisted,EC,
5,286,SIA/HP/MIN/49763/2016,HPSEIAA/2016/467,M/S Building Stretch Crushing Zone Vill:Pubowal una H.P,BUILDING STRETCH CRUSHING ZONE,EC Granted,EC,
6,287,SIA/HP/MIN/92686/2019,SEIAA/2019/605,"sand,stone and bajri Mining project by Ah Shyam Kumar",AND STONE AND BAJRI MINING PROJECT BY SHRI SHYAM KUMAR,Delisted,EC,
7,288,SIA/HP/MIN/56692/2016,HPSEIAA/2016/494,"KAPIL SHARMA, SHREE RUDRA STONE CRUSHER",SHREE RUDRA STONE CRUSHER,TransferToDEIAA,EC,
8,289,SIA/HP/MIN/58340/2016,,MAUZA BARDAM MOHAL GAHLI,MAUZA BARDAM MOHAL GAHLI,TransferToDEIAA,EC,
9,290,SIA/HP/MIN/196452/2021,HPSEIAA/2021/820,"“Sand, Stone & Bajri Mining Project” Haler",SH. HARSARAN DUTT,EC Granted,EC,
0,291,SIA/HP/MIN/53352/2016,,Mining of Stone by Shri Chhering Tandup,STONE MINING PROJECT BY CHHERING TANDUP,TransferToDEIAA,EC,
1,292,SIA/HP/MIN/58644/2016,,"Mauja Lodhwan & Mohal Tipri, Mining Project",PUSHPINDER MAINI,WithdrawEC,EC,
2,293,SIA/HP/MIN/64213/2017,,Mining of Stone by Atul Sharma,STONE MINING PROJECT BY SHRI ATUL SHARMA,TransferToDEIAA,EC,
3,294,SIA/HP/MIN/414939/2023,HPSEIAA/2022/1038,"STONE BOULDER, SAND AND BAJRI MINING PROJECT BY SH VIPUL SHARMA",ANIL SHARMA,Delisted,EC,
4,295,SIA/HP/NCP/94888/2019,SEIAA/2019/611,Group Housing Project by M/s N.G. Estate,M/S N.G. ESTATE,EC Granted,EC,
5,296,SIA/HP/MIN/92743/2019,SEIAA/2019/604,Stone Mining Project by Sh Anil Chauhan,STONE MINING PROJECT SH ANIL CHAUHAN,EC Granted,EC,
6,297,SIA/HP/MIN/148342/2020,HPSEIAA/2020/729,Sh. Ashish Shama Mining Lease Area,SH. ASHISH SHARMA,EC Granted,EC,
7,298,SIA/HP/MIN/53455/2016,HPSEIAA/2016/482,Village Dudana Lohian Mining Project,SMT KAILASH THAKUR,EC Granted,EC,
8,299,SIA/HP/MIN/50391/2016,HPSEIAA/2016/466,"M./S OM STONE CRUSHER
Mining of  sand, stone and bajri from River terrace of Chaki khad (a tributary of Beas river) at Village – Hagwal & Gagwal, Tehsil - Nurpur, District –Kangra, H.P (Area-18.9673Ha).",Harsaran Singh Maini,EC Granted,EC,
9,300,SIA/HP/MIS/193365/2021,HPSEIAA/2021/812,"Super Speciality Block, Indira Gandhi Medical College, Malyana","INDIRA GANDHI MEDICAL COLLEGE, SHIMLA",EC Granted,EC,
0,301,SIA/HP/MIN/235151/2021,HPSEIAA/2021/889,Sh. Ashok Thakur Mining Lease Area,SH. ASHOK THAKUR MINING LEASE AREA,EC Granted,EC,
1,302,SIA/HP/MIN/187080/2020,HPSEIAA/2020/794,Stone Mining Project,SH.   P.  L. VERMA,WithdrawEC,EC,
2,303,SIA/HP/MIN/195255/2021,HPSEIAA/2021/808,Sh. Mohammad Soyab Akhter Auctioned area,SH. MOHAMMAD SOYAD AKHTER AUCTIONED AREA,Delisted,EC,
3,304,SIA/HP/MIN/53611/2016,,M/s Shree Rudra Stone Crusher,SHREE RUDRA STONE CRUSHER,WithdrawEC,EC,
4,305,SIA/HP/MIN/33801/2015,HPSEIAA/2015/455',Shree Rudra Stone Crushing and Screening Unit,SHREE RUDRA STONE CRUSHER AND SCREENING PLANT,EC Granted,EC,
5,306,SIA/HP/MIN/290578/2022,HPSEIAA/2022/1003,Smt. Tamanna Thakur  Smt. Seema Devi Mining area at Mauza Mohal Maned Tehsil Dharamshala District Kangra Himachal Pradesh,TAMANNA,EC Granted,EC,
6,307,SIA/HP/MIN/238982/2021,HPSEIAA/2021/898,"Extraction of Minor Minerals by Sh. Ravinder Kumar, Prop. Saraswati Stone Crusher & Screening Plant located at Mauza Pandoga, Upmohal Pandoga Nichla, Sub-Tehsil -Ispur, Tehsil-Haroli, District- Una, State- Himachal Pradesh.",SH. RAVINDER KUMAR PROP. M/S SARASWATI STONE CRUSHER,Awaiting EC,EC,
7,308,SIA/HP/MIN/243191/2021,HPSEIAA/2021/921,M/s AMBIKA STONE CRUSHER,M/S AMBIKA STONE CRUSHER,EC Granted,EC,
8,309,SIA/HP/MIN/401954/2022,HPSEIAA/2022/989,"Extraction of Sand, Stone and Bajri",BAHADUR SINGH,Under examination of SEIAA after SEAC,EC,
9,310,SIA/HP/MIN/423865/2023,HPSEIAA/2023/1063,"Sh. Jatinder Singh, Prop: M/s Singh Stone Crusher",JITENDER SINGH,EC Granted,EC,
0,311,SIA/HP/MIN/58371/2016,,MAUZA MOHAL KARASA MINING PROJECT,MAUZA AND MOHAL KARASA,TransferToDEIAA,EC,
1,312,SIA/HP/MIN/189026/2020,HPSEIAA/2020/790,Boulder Stone Sand and Bajri mining Project by Sh Dalip Singh,BOULDER STONE SAND AND BAJRI MINING PROJECT BY SH DALIP SINGH,EC Granted,EC,
2,313,SIA/HP/MIN/55708/2016,HPSEIAA/2013/212,"Mining of Sand, Stone & Bajri from Chakki Khad proposed by Sh. Sudhir Singh prop. M/s Gold Mine Stone Crusher",GOLD MINE STONE CRUSHER,EC Granted,EC,
3,314,SIA/HP/MIN/62678/2017,HPSEIAA/2017/541,"Mining of Sand, Stone & Bajri from Giri River situated in Mauza Mohal Manpur Devra, proposed by Sh Hakam Chand Chandel & Harish Chandel Prop. M/s  Chandel Associates",MS CHANDEL ASSOCIATES,EC Granted,EC,
4,315,SIA/HP/MIN/402841/2022,HPSEIAA/2022/994,"Extraction of Minor Mineral, Stone",BHINDER SINGH,EC Granted,EC,
5,316,SIA/HP/MIN/54779/2020,HPSEIAA/2021/912,"Extraction/collection of sand, stone & bajri Project",SMT. KAMLESH THAKUR,EC Granted,EC,
6,317,SIA/HP/MIN/234807/2021,HPSEIAA/2021/893,Hill Slope mining for Extraction of Stone proposed by Sh. Rajesh Kumar S/o Late Sh Lachhman Ram,SH RAJESH KUMAR S/O LATE SH LACHMAN DASS,EC Granted,EC,
7,318,SIA/HP/MIN/44379/2019,HPSEIAA/2019/672,"Hill Slope Mining for extraction of Sand, Stone and Bajri (pebbles) from Mauza/Mohal Beetan proposed by M/s Sri Shakti Stone Crusher Partner Sh Ashok Kumar",MS SRI SHAKTI STONE CRUSHER,EC Granted,EC,
8,319,SIA/HP/IND2/226188/2021,HPSEIAA/2021/870,"M/s Shriom Organics Pvt. Ltd. Unit-II at Plot Nos. 30 & 109-113, Gondpur Industrial Area, Paonta Sahib, District Sirmaur, Himachal Pradesh.",M/S SHRIOM ORGANICS PVT. LTD. UNIT-II,Deferred by SEAC,EC,
9,320,SIA/HP/MIN/67548/2021,HPSEIAA/2022/972,,CHANDER BHUSHAN NAG,EC Granted,EC,
0,321,SIA/HP/MIN/166450/2020,HPSEIAA/2020/754,"Mining of Stone Boulder, Bajri and sand from riverbed of Giri River situated in Mauza/ Mohal – Phoolpur Shamshergah, Tehsil Ponta Sahib, Distt. Sirmour, H.P. by Sh. Ashutosh Gupta","MINING OF STONE BOULDER, BAJRI AND SAND FROM RIVERBED OF GIRI RIVER SITUATED IN MAUZA/ MOHAL – PHOOLPUR SHAMSHERGAH, TEHSIL PONTA SAHIB, DISTT. SIRMOUR, H.P. BY SH. ASHUTOSH GUPTA",EC Granted,EC,
1,322,SIA/HP/MIN/48361/2016,HPSEIAA/2016/465,"Vishal Sharma, Him Stone Crusher, HP",HIM STONE CRUSHER HP,EC Granted,EC,
2,323,SIA/HP/MIN/405742/2022,HPSEIAA/2022/1024,"Hill Slope mining for Extraction of Stone proposed by Sh. Bharat Bhushan Verma Prop. M/s Bhushan Stone Crusher situated at Mauza/Mohal Tihana, Tehsil Theog , District Shimla, H.P.",BHARAT VERMA,Rejected by SEIAA,EC,
3,324,SIA/HP/INFRA2/411875/2022,HPSEIAA/2022/1040,"Proposed Construction of Residential colony Terra Grande situated in Mouza Up-Sampada Suchali, Tehsil Pachhad, District Sirmour, H.P by M/s Alternative Habitat Pvt. Ltd",ALTERNATIVE HABITAT PRIVATE LIMITED,EC Granted,EC,
4,325,SIA/HP/MIN/69355/2017,HPSEIAA/2017/562,"Sand, Stone and Bajri Mining Project By Shri Supriyank Walia, Smt Neena Goel and Smt Meena Gupta Partners M/s Himalayan Stone Crusher",SAND STONE AND BAJRI MINING PROJECT BY HIMALAYAN STONE CRUSHER,EC Granted,EC,
5,326,SIA/HP/MIS/139235/2020,HPSEIAA/2020/706,M/s Nirvana Woods & Hotels Pvt. Ltd.,M/S NIRVANA WOODS & HOTELS PVT. LTD.,Delisted,EC,
6,327,SIA/HP/MIN/243471/2021,HPSEIAA/2021/914,Extraction of minor minerals by Sh. Rajinder Singh Mining Area.,SH. RAJINDER SINGH MINING AREA,EC Granted,EC,
7,328,SIA/HP/MIN/246577/2021,HPSEIAA/2022/941,"Extraction of Sand, Stone & Bajri from area falling in Mauza Kutharbeet, Mohal Jadian Kutharbeet, Teh. Haroli, Distt. Una-HP",GURSAJAN BEDI,Delisted,EC,
8,329,SIA/HP/MIN/53429/2016,HPSEIAA/2016/481,M/S Orbit Minerals Udyog Association,MEHTAB SINGH,EC Granted,EC,
9,330,SIA/HP/MIN/180551/2020,HPSEIAA/2020/777,"Minor Mineral Lease for extraction of Stone falling in Mauza Raipur, Tehsil & Distt. Solan, Himachal Pradesh by Shri Sushil Kumar Prop. Sharma Stone Provider","MINOR MINERAL LEASE FOR EXTRACTION OF STONE FALLING IN MAUZA RAIPUR, TEHSIL & DISTT. SOLAN, HIMACHAL PRADESH BY SHRI SUSHIL KUMAR PROP. SHARMA STONE PROVIDER",EC Granted,EC,
0,331,SIA/HP/MIN/422281/2023,HPSEIAA/2023/1077,Sh. Rajinder Singh Auctioned area,RAJINDER SINGH,Pending at PP due to eds,EC,
1,332,SIA/HP/MIN/223224/2021,HPSEIAA/2021/882,"Minor Mineral Lease for extraction of Sand falling in Mauza Top Ki Ber, Tehsil & Distt. Solan, Himachal Pradesh by Shri Chatter Singh, S/o Shri Daulat Ram","MINOR MINERAL LEASE FOR EXTRACTION OF SAND FALLING IN MAUZA TOP KI BER, TEHSIL & DISTT. SOLAN, HIMACHAL PRADESH BY SHRI CHATTER SINGH, S/O SHRI DAULAT RAM",EC Granted,EC,
2,333,SIA/HP/MIN/53940/2016,HPSEIAA/2016/505,Sand And Bajri Mining By Ajay Sharma,SAND AND BAJRI MIN BY AJAY SHARMA,EC Granted - Processed offline,EC,
3,334,SIA/HP/MIN/31441/2019,HPSEIAA/2019/628,"Extraction of sand, stone & bajari from Mauza- Dulehar, Mohal- Heeran, Tehsil- Haroli, District- Una, State- Himachal Pradesh",BRECHER STONE CRUSHER,Delisted,EC,
4,335,SIA/HP/MIN/283096/2022,HPSEIAA/2022/965,Extraction of Sand Stone & Bajri by Maha Luxmi Stone Crusher,PARVESH SHARMA,EC Granted,EC,
5,336,SIA/HP/MIN/404066/2022,HPSEIAA/2022/1007,"Extraction of Sand, Stone and Bajri","HEAD OF PROJECT, DAULASIDH HYDROELECTRIC PROJECT (DSHEP) SJVNL",EC Granted,EC,
6,337,SIA/HP/MIN/44549/2019,HPSEIAA/2019/660,Sher Singh Mining Lease area,M/S CHATURBHUJ SCREENING PLANT,EC Granted,EC,
7,338,SIA/HP/MIN/170183/2020,HPSEIAA/2020/763,"S/Sh. Surjeet Singh, Sh. Navdesh Passi and Sh. Jitender Singh– Mining  Area","S/SH. SURJEET SINGH, SH. NAVDESH PASSI & SH. JITENDER SINGH MINING AREA",Delisted,EC,
8,339,SIA/HP/MIN/67937/2017,HPSEIAA/2017/558,"sand, stone and bajri mining project by Sh Balwant Rai",SAND STONE AND BAJRI MINING PROJECT BY SH BALWANT RAI,EC Granted,EC,
9,340,SIA/HP/MIN/41933/1900,SEIAA/2019/657,"Mining of Sand, Stone & Bajri from Sukkar proposed by Sh Narender Singh S/o Sh Munshi Ram",SH NARENDER SINGH S/O SH MUNSHI RAM,EC Granted,EC,
0,341,SIA/HP/MIN/67937/2017,HPSEIAA/2017/558,"sand, stone and bajri mining project by Sh Balwant Rai",SAND STONE AND BAJRI MINING PROJECT BY SH BALWANT RAI,EC Granted,EC,
1,342,SIA/HP/MIN/53940/2016,HPSEIAA/2016/505,Sand And Bajri Mining By Ajay Sharma,SAND AND BAJRI MIN BY AJAY SHARMA,EC Granted - Processed offline,EC,
2,343,SIA/HP/MIN/41933/1900,SEIAA/2019/657,"Mining of Sand, Stone & Bajri from Sukkar proposed by Sh Narender Singh S/o Sh Munshi Ram",SH NARENDER SINGH S/O SH MUNSHI RAM,EC Granted,EC,
3,344,SIA/HP/MIN/70474/2021,HPSEIAA/2022/942,"""Gauri & Datwal"" River Bed (SukkherKhad-I) Mining Project of Mineral Stone, Sand and Bajri, Area-06-10-05 Hectare, Khasra no-829 (Govt. Land, River Bed), Located Near Village- Gauri & Datwal, Dist- Hamirpur, Rajasthan in favour of Shree Rajkumar",SAND STONE AND BAJRI MINING PROJECT BY SH RAJ KUMAR,EC Granted,EC,
4,345,SIA/HP/MIN/409032/2022,HPSEIAA/2022/1018,Sh. Kamal Singh Prop:M/s Aaryav Stone Crusher Mining Lease Area.,KAMAL SINGH,EC Granted,EC,
5,346,SIA/HP/MIN/58735/2016,HPSEIAA/2016/536,M/s Bhimgoda Limestone Mine proposed by Sh. Chuhi Ram Sharma,MS BHIMGODA LIMESTONE MINE PROPOSED BY CHUHI RAM SHARMA,EC Granted,EC,
6,347,SIA/HP/MIN/28637/2018,HPSEIAA/2018/583,Smt. Sunita Devi- Auctioned Area,SMT. SUNITA DEVI & SMT. MUSKAN THAKUR- AUCTIONED AREA,EC Granted,EC,
7,348,SIA/HP/MIN/79364/2018,HPSEIAA/2018/593,"Mining for extraction of Limestone, proposed by Sh. Kanwar Mrigendra Singh Prop. M/s Durga Limestone Mine situated at Mauza Borli, Tehsil Sangrah, District Sirmaur, Himachal Pradesh",M/S DURGA LIMESTONE MINE,EC Granted,EC,
8,349,SIA/HP/MIN/223224/2021,HPSEIAA/2021/882,"Minor Mineral Lease for extraction of Sand falling in Mauza Top Ki Ber, Tehsil & Distt. Solan, Himachal Pradesh by Shri Chatter Singh, S/o Shri Daulat Ram","MINOR MINERAL LEASE FOR EXTRACTION OF SAND FALLING IN MAUZA TOP KI BER, TEHSIL & DISTT. SOLAN, HIMACHAL PRADESH BY SHRI CHATTER SINGH, S/O SHRI DAULAT RAM",EC Granted,EC,
9,350,SIA/HP/MIN/169950/2020,,M/s Krishna Stone Crusher,M/S KRISHNA STONE CRUSHER MINING LEASE AREA,Delisted,EC,
0,351,SIA/HP/MIN/52145/2016,HPSEIAA/2016/476,Slate Mining,MOHAN SINGH OF THUNAG,EC Granted,EC,
1,352,SIA/HP/MIN/52194/2016,HPSEIAA/2016/488,"Mining for extraction of Stone from Hill slope proposed by Partap Singh M/s Partap Stone Crusher at Mauza Khoksar, District Lahaul & Spiti, Himachal Pradesh",MS PARTAP STONE CRUSHER,Delisted,EC,
2,353,SIA/HP/MIN/403967/2022,HPSEIAA/2022/1005,"Extraction of Minor Minerals (Sand, Stone and Bajri) Measuring 05-12-01 Bighas (0.41 Hecatres) (Govt. Land/Acquired by BBMB) in Mauza & Mohal Dhawal/236, Tehsil Sundernagar, District- Mandi, Himachal Pradesh",DILA RAM,Rejected by SEIAA,EC,
3,354,SIA/HP/MIN/279487/2022,HPSEIAA/2022/957,Extraction of Minor Mineral Stone,HAMIRU,EC Granted,EC,
4,355,SIA/HP/MIN/401487/2022,HPSEIAA/2022/990,"Extraction of  Sand, Stone and Bajri",SH. KAMAL DEV PATHANIA,ADS by SEAC,EC,
5,356,SIA/HP/MIN/180429/2020,HPSEIAA/2021/826,“Stone Mining Project”,SH.GIRIJA NAND,Delisted,EC,
6,357,SIA/HP/MIN/59123/2016,HPSEIAA/2016/522,"Extraction of Limestone from Deolan
Limestone Mine",DEOLAN LIMESTONE MINE,EC Granted,EC,
7,358,SIA/HP/MIN/161378/2020,HPSEIAA/2020/743,"“Sand, Stone & Bajri Mining Project”",SHRI RAJ KUMAR,EC Granted,EC,
8,359,SIA/HP/MIN/263910/2022,HPSEIAA/2022/946,"Extraction of Stone from Khasra no. 220, Measuring 01-12-87 Hectares (Private land, Hill Slope) falling in Mauza Tihana, Tehsil Theog, District Shimla, Himachal Pradesh by Sh. Jagdish Chand.",JAGDISH,EC Granted,EC,
9,360,SIA/HP/MIN/405580/2022,HPSEIAA/2022/1010,"Mining of Sand , Stone  & Bajri from Giri river Proposed by Sh Arun Kumar",SH ARUN KUMAR S/O SH BHARAT SINGH,Pending at PP due to eds,EC,
0,361,SIA/HP/MIN/195255/2021,HPSEIAA/2021/808,Sh. Mohammad Soyab Akhter Auctioned area,SH. MOHAMMAD SOYAD AKHTER AUCTIONED AREA,Delisted,EC,
1,362,SIA/HP/MIN/246998/2021,HPSEIAA/2021/922,"Extraction of Minor Minerals by Sh. Sanjay Chauhan at Mohal-Dharmrol, Mauza- Mewa, Tehsil- Bhoranj, District- Hamirpur, H.P.",SANJAY CHAUHAN,EC Granted,EC,
2,363,SIA/HP/MIN/235151/2021,HPSEIAA/2021/889,Sh. Ashok Thakur Mining Lease Area,SH. ASHOK THAKUR MINING LEASE AREA,EC Granted,EC,
3,364,SIA/HP/MIN/187080/2020,HPSEIAA/2020/794,Stone Mining Project,SH.   P.  L. VERMA,WithdrawEC,EC,
4,365,SIA/HP/MIN/209772/2021,HPSEIAA/2021/835,Stone Mining Project,UTTAM RAM,Delisted,EC,
5,366,SIA/HP/MIN/33801/2015,HPSEIAA/2015/455',Shree Rudra Stone Crushing and Screening Unit,SHREE RUDRA STONE CRUSHER AND SCREENING PLANT,EC Granted,EC,
6,367,SIA/HP/NCP/69536/2017,HPSEIAA/2017/566,Residential Colony “Bohemian Chateaus” by M/s. Aegis Center Point Developer Pvt. Ltd.,AEGIS CENTER POINT DEVELOPER PVT. LTD.,WithdrawEC,EC,
7,368,SIA/HP/MIN/32379/2015,HPSEIAA/2015/443,M/s Matri Stone Crusher,MATRI STONE CRUSHER,EC Granted,EC,
8,369,SIA/HP/MIN/238620/2021,HPSEIAA/2021/896,"Extraction of Minor Minerals by Sh. Ravinder Kumar, Prop. M/s Jagdambay Stone Crusher & Screening Plant at Mauza & Mohal Ghaluwal, Sub-Tehsil Ispur, Tehsil Haroli, Distt-Una, State-Himachal Pradesh.","SH. RAVINDER KUMAR, PROP. M/S JAGDAMBAY STONE CRUSHER & SCREENING PLANT.",EC Granted,EC,
9,370,SIA/HP/MIN/189104/2020,HPSEIAA/2020/805,Hill Slope mining for Extraction of Stone from Mauza/Mohal Lana-Ro proposed by Sh Rajender Singh,SH RAJENDER SINGH S/O SH SHAWNU RAM,EC Granted,EC,
0,371,SIA/HP/MIN/403967/2022,HPSEIAA/2022/1005,"Extraction of Minor Minerals (Sand, Stone and Bajri) Measuring 05-12-01 Bighas (0.41 Hecatres) (Govt. Land/Acquired by BBMB) in Mauza & Mohal Dhawal/236, Tehsil Sundernagar, District- Mandi, Himachal Pradesh",DILA RAM,Rejected by SEIAA,EC,
1,372,SIA/HP/MIN/45772/2018,HPSEIAA/2018/595,"Mining of Sand, Stone & Bajri from Beas River proposed by Smt. Kalpana Devi Prop. M/s Kathla Mata Stone Crusher",MS SMT KALPANA DEVI PROP MS KATHLA MATA STONE CRUSHER,EC Granted,EC,
2,373,SIA/HP/MIN/400525/2022,HPSEIAA/2022/993,"Extraction/Collection of Sand, Stone & Bajri",M/S ANKUR STONE CRUSHER,EC Granted,EC,
3,374,SIA/HP/MIN/401358/2022,HPSEIAA/2022/983,Extraction of Dolomitic Stone (Sand),Sita Devi,EC Granted,EC,
4,375,SIA/HP/MIN/56929/2016,HPSEIAA/2016/497,Sh. Rajender Singh,THAKUR ENTERPRISES UNA HP,EC Granted - Processed offline,EC,
5,376,SIA/HP/MIN/58548/2016,,Sand Stone And Bajri Mining By shri Rajiv Kumar,SAND STONE AND BAJRI MINING PROJECT OF SHRI RAJIV KUMAR,TransferToDEIAA,EC,
6,377,SIA/HP/MIN/228333/2021,HPSEIAA/2021/877,Hill Slope Mining for Extraction of Stone from Mauza Phati Rot-I Kothi Bhallan proposed by Sh Ravinder Singh,SH RAVINDER SINGH,EC Granted,EC,
7,378,SIA/HP/MIN/28625/2018,HPSEIAA/2018/587,Sh. Parshotam Singh-Auctioned area,SH. PARSHOTAM SINGH & SH. BALWINDER SINGH,EC Granted,EC,
8,379,SIA/HP/MIN/59767/2016,HPSEIAA/2016/537,"SAND, STONE AND BAJRI MINING) PROJECT
LOCATED AT
MAUZA LODHWAN, TEHSIL NURPUR, DISTRICT KANGRA, H.P",ANITA MANKOTIA,EC Granted,EC,
9,380,SIA/HP/MIN/70521/2020,HPSEIAA/2022/940,"""Jainan & Datwal"" Sand, Stone & Bajri"" Mining Project, Over an area-07-02-15 Hectare (7.0215 hectare) Khasra no-01, located N/v- Jainan & Datwal, Dist - Hamirpur in favor of Shree Rajkumar",SAND STONE AND BAJRI MINING PROJECT BY SH RAJKUMAR,EC Granted,EC,
0,381,SIA/HP/MIN/43265/2019,,M/S CHHORGIA STONE CRUSHER,M/S CHHORGIA STONE CRUSHER,Delisted,EC,
1,382,SIA/HP/MIN/32379/2015,HPSEIAA/2015/443,M/s Matri Stone Crusher,MATRI STONE CRUSHER,EC Granted,EC,
2,383,SIA/HP/MIN/235151/2021,HPSEIAA/2021/889,Sh. Ashok Thakur Mining Lease Area,SH. ASHOK THAKUR MINING LEASE AREA,EC Granted,EC,
3,384,SIA/HP/MIN/187080/2020,HPSEIAA/2020/794,Stone Mining Project,SH.   P.  L. VERMA,WithdrawEC,EC,
4,385,SIA/HP/MIN/209772/2021,HPSEIAA/2021/835,Stone Mining Project,UTTAM RAM,Delisted,EC,
5,386,SIA/HP/MIN/58107/2016,HPSEIAA/2016-515,UDEESH KUMAR MINING OF SAND STONE AND BAJRI,UDEESH KUMAR,EC Granted,EC,
6,387,SIA/HP/MIN/423873/2023,HPSEIAA/2023/1064,Extraction of minor minerals by Sh. Naveen Goyal Partner M/s Ramsons Stone Crusher,RAM SONS,EC Granted,EC,
7,388,SIA/HP/MIN/134097/2019,HPSEIAA/2020/707,“Sand & Stone Mining Project”,SANGAT  RAM,EC Granted,EC,
8,389,SIA/HP/MIN/53354/2016,,Jai Hari Stone Crusher by vishal deep singh,JAI HARI STONE CRUSHER BY VISHAL DEEP SINGH,TransferToDEIAA,EC,
9,390,SIA/HP/MIN/65200/2017,HPSEIAA/2017/546,Boulder Bajri And Sand by shri gopal Chand,BOULDER SAND AND BAJRI BY SHRI GOPAL CHAND,EC Granted,EC,
0,391,SIA/HP/MIN/40997/2018,HPSEIAA/2018/598,"River Bed Mining Project of Minor Mineral, Sand, Stone & Bajri.",SAND STONE AND BAJRI MINING PROJECT BY RANDEEP SINGH,EC Granted,EC,
1,392,SIA/HP/MIN/225177/2021,HPSEIAA/2021/867,"Sand, Stone & Bajri Mining Project",SHRI BHUPESH SHARMA,ADS by SEAC,EC,
2,393,SIA/HP/MIN/53455/2016,HPSEIAA/2016/482,Village Dudana Lohian Mining Project,SMT KAILASH THAKUR,EC Granted,EC,
3,394,SIA/HP/MIN/50391/2016,HPSEIAA/2016/466,"M./S OM STONE CRUSHER
Mining of  sand, stone and bajri from River terrace of Chaki khad (a tributary of Beas river) at Village – Hagwal & Gagwal, Tehsil - Nurpur, District –Kangra, H.P (Area-18.9673Ha).",Harsaran Singh Maini,EC Granted,EC,
4,395,SIA/HP/MIS/173437/2020,HPSEIAA/2020/767,"Construction of New OPD Block, Trauma Block + Existing Building of IGMC Shimla.",HIMACHAL PRADESH PUBLIC WORK DEPARTMENT,EC Granted,EC,
5,396,SIA/HP/MIS/193365/2021,HPSEIAA/2021/812,"Super Speciality Block, Indira Gandhi Medical College, Malyana","INDIRA GANDHI MEDICAL COLLEGE, SHIMLA",EC Granted,EC,
6,397,SIA/HP/MIN/61020/2021,HPSEIAA/2021/900,"Mining of Stone boulder, Bajri and sand from Giri River Proposed by M/s Venayak Minerals Prop Ashutosh Gupta","MINING OF STONE BOULDER, BAJRI AND SAND FROM GIRI RIVER PROPOSED BY M/S VENAYAK MINERALS, PROP ASHUTOSH GUPTA",EC Granted,EC,
7,398,SIA/HP/RIV/19770/2011,HPSEIAA/2010/84,Surgani Sundla 48MW HEP in Saluni Tehsil of District Chamba Himachal Pradesh,HIMACHAL PRADESH POWER CORPORATION LIMITED,EC Granted,EC,
8,399,SIA/HP/NCP/60996/2016,HPSEIAA/2016/539-II,Expansion of Housing colony project for M/s Isabel  Builders  & Developers Pvt. Ltd.,MS ISABEL BUILDER DEVELOPERS PRIVATE LIMITED,EC Granted,EC,
9,400,SIA/HP/MIN/144161/2020,HPSEIAA/2020/723,"“Sand, Stone & Bajri Mining Project”",RAKSHA  RANI,EC Granted,EC,
0,401,SIA/HP/NCP/94888/2019,SEIAA/2019/611,Group Housing Project by M/s N.G. Estate,M/S N.G. ESTATE,EC Granted,EC,
1,402,SIA/HP/MIN/92743/2019,SEIAA/2019/604,Stone Mining Project by Sh Anil Chauhan,STONE MINING PROJECT SH ANIL CHAUHAN,EC Granted,EC,
2,403,SIA/HP/MIN/58644/2016,,"Mauja Lodhwan & Mohal Tipri, Mining Project",PUSHPINDER MAINI,WithdrawEC,EC,
3,404,SIA/HP/MIN/414939/2023,HPSEIAA/2022/1038,"STONE BOULDER, SAND AND BAJRI MINING PROJECT BY SH VIPUL SHARMA",ANIL SHARMA,Delisted,EC,
4,405,SIA/HP/MIN/148342/2020,HPSEIAA/2020/729,Sh. Ashish Shama Mining Lease Area,SH. ASHISH SHARMA,EC Granted,EC,
5,406,SIA/HP/MIN/40997/2018,HPSEIAA/2018/598,"River Bed Mining Project of Minor Mineral, Sand, Stone & Bajri.",SAND STONE AND BAJRI MINING PROJECT BY RANDEEP SINGH,EC Granted,EC,
6,407,SIA/HP/MIN/61020/2021,HPSEIAA/2021/900,"Mining of Stone boulder, Bajri and sand from Giri River Proposed by M/s Venayak Minerals Prop Ashutosh Gupta","MINING OF STONE BOULDER, BAJRI AND SAND FROM GIRI RIVER PROPOSED BY M/S VENAYAK MINERALS, PROP ASHUTOSH GUPTA",EC Granted,EC,
7,408,SIA/HP/MIN/37748/2019,HPSEIAA/2019/643,"Hill Slope Mining for extraction of Minor Mineral (Sand), in Mauza and Mohal Lavikhurd, Tehsil and District Solan, Himachal Pradesh",RAMESH MEHTA,EC Granted,EC,
8,409,SIA/HP/NCP/60996/2016,HPSEIAA/2016/539-II,Expansion of Housing colony project for M/s Isabel  Builders  & Developers Pvt. Ltd.,MS ISABEL BUILDER DEVELOPERS PRIVATE LIMITED,EC Granted,EC,
9,410,SIA/HP/MIN/144161/2020,HPSEIAA/2020/723,"“Sand, Stone & Bajri Mining Project”",RAKSHA  RANI,EC Granted,EC,
0,411,SIA/HP/MIN/409764/2022,HPSEIAA/2023/1057,"Extraction of Stone, Sand and Bajri from Khasra No. 250/2",SUNDER LAL,EC Granted,EC,
1,412,SIA/HP/MIN/125479/2019,HPSEIAA/2020/730,sand stone and bajri mining project,SAND STONE AND BAJRI MINING PROJECT BY SMT SWAPNA KUMARI,EC Granted,EC,
2,413,SIA/HP/IND3/247844/2021,HPSEIAA/2021/930,API and Intermediate Manufacturing Facility,JAGS PHARMA PRIVATE LIMITED,Deferred by SEAC,EC,
3,414,SIA/HP/MIN/290247/2022,HPSEIAA/2022/978,"Stone Boulder, Sand & Bajri Mining Project along with proposed Crusher Plant” by M/s Himgiri Stone Crusher",RAM SHARMA,Rejected by SEIAA,EC,
4,415,SIA/HP/MIN/409434/2022,HPSEIAA/2022/1022,"Environment Clearance for collection of Sand, Stone and Bajri by Shri Rajinder Kumar",RAJINDER KUMAR,EC Granted,EC,
5,416,SIA/HP/MIN/412013/2022,HPSEIAA/2022/1032,"Extraction of Stone, Sand and Bajri falling in Mauza Thural Mohal Chalah, Thesil Thural, District Kangra, Himachal Pradesh. by Prop. Sh. Rajinder Singh, S/O Sh. Dhani Ram.",RAJINDER RANA,EC Granted,EC,
6,417,SIA/HP/MIN/43042/2019,HPSEIAA/2019/665,Clay(brick earth) mining project by Smt rekha Joshi,SMT REKHA JOSHI PROP MS KIRAN BRICKS KILN,Delisted,EC,
7,418,SIA/HP/MIN/291308/2022,HPSEIAA/2022/981,"“Stone mining (Minor Mineral) Project, Khasra No. 93/5 by Smt Veena Sharma w/o Sh. Sandeep Sharma and construction of Resort.",VEENA SHARMA,EC Granted,EC,
8,419,SIA/HP/MIN/63493/2017,,Mauja Jangal Rajgir & Mohal Sachuhi Mining Project,SACHUHI,TransferToDEIAA,EC,
9,420,SIA/HP/MIN/35184/2019,HPSEIAA/2019/627,stoneboulder mining project by sangam stone crusher,MINING PROJECT BY SANGAM STONE CRUSHER,EC Granted,EC,
0,421,SIA/HP/MIN/134227/2019,HPSEIAA/2020/709,“Sand & Stone Mining Project”,PRABHU  DAYAL,EC Granted,EC,
1,422,SIA/HP/MIS/170157/2020,,Construction of New OPD Block at IGMC Shimla,HIMACHAL PRADESH PUBLIC WORK DEPARTMENT,Delisted,EC,
2,423,SIA/HP/MIN/426945/2023,,"Extraction of Sand, Stone and Bajri by Smt. Veena Thakur W/o Sh. Bhim Singh Thakur",VEENA THAKUR,Pending at PP due to eds,EC,
3,424,SIA/HP/MIN/159880/2020,HPSEIAA/2020/744,"Extraction of Sand from Khasra No’s 86, 89 & 93 Measuring 11-04 Bighas (Private Land, Hill Slope) Falling In Mauza Jokhari, Tehsil & Distt. Solan, Himachal Pradesh",SHREE DALIP SINGH,EC Granted,EC,
4,425,SIA/HP/MIN/45691/2019,HPSEIAA/2019/684,Cut Stone mining project by Sh Muni lal,CUT STONE MINING PROJECT BY SH MUNI LAL,EC Granted,EC,
5,426,SIA/HP/MIN/56569/2016,HPSEIAA/2016/518,"Mining of Sand, Stone & Bajri from Swan River situated in Mauza Gagret, Up- Mohal Ram Nagar Proposed by Sh Ajender Singh Bharti Prop. M/s Ganpati Stone Crusher",GANPATI STONE CRUSHER,TransferToDEIAA,EC,
6,427,SIA/HP/MIS/182508/2020,HPSEIAA/2020/780,"Pt. Jawahar Lal Nehru Medical College and Hospital at Village Sarol, Distt. Chamba, Himachal Pradesh",PT. JAWAHAR LAL NEHRU MEDICAL COLLEGE AND HOSPITAL,EC Granted,EC,
7,428,SIA/HP/MIN/291207/2022,HPSEIAA/2022/987,“Sand Mining Project” Khasra no: 02 by Sh. Pawan Kumar S/o Sh. Hari Ram,PAWAN KUMAR,ADS by SEAC,EC,
8,429,SIA/HP/MIN/407674/2022,HPSEIAA/2022/1016,Hill slope mining for extraction of Stone from Mauza/Mohal Kaduth proposed by Sh. Yogesh Kumar Sood Prop. M/s Uma Stone Crusher,UMA STONE CRUSHER,Rejected by SEIAA,EC,
9,430,SIA/HP/MIN/67912/2017,HPSEIAA/2017/556,"Mining of Sand, Stone & Bajri from Kunah Khad, situated at Mauza & Mohal Patyahu, & Jangal Proposed by Sh. Anmol Kumar",SHRI ANMOL KUMAR,Delisted,EC,
