,Sno.,Proposal No.,File No.,Project Name,Company,Proposal Status,Project Type,View
0,431,SIA/HP/MIN/207242/2021,HPSEIAA/2021/830,"Extraction of Stone, Boulder, Sand and Bajri for proposed Stone Crusher unit namely “M/s Neelkanth Stone Crusher” falling in Mauza/Mohal Bangran, Tehsil Paonta Sahib, District Sirmour, Himachal Pradesh by Sh. Amrik Singh Prop. M/s Neelkanth Stone Cru","EXTRACTION OF STONE, BOULDER, SAND AND BAJRI FOR PROPOSED STONE CRUSHER UNIT NAMELY “M/S NEELKANTH STONE CRUSHER” FALLING IN MAUZA BANGRAN, TEHSIL PAONTA SAHIB, DISTRICT SIRMOUR, HIMACHAL PRADESH BY S",EC Granted,EC,
1,432,SIA/HP/MIN/246226/2021,HPSEIAA/2021/927,"Khanalag Stone Mining Project, Area-13-18 Bighas (1.0460 Hectare) Khasra no-134/2 Located Near Village- Khanalag, Tehsil- Arki, Dist- Solan Himachal Pradesh in Favor of Shree Arun Thakur",ARUN THAKUR,EC Granted,EC,
2,433,SIA/HP/MIN/225739/2021,HPSEIAA/2021/869,Sand Stone & Bajri Minig Project,SHRI  PAWAN KUMAR,EC Granted,EC,
3,434,SIA/HP/MIN/53162/2016,HPSEIAA/2013/206,"Collection/Extraction of Sand ,Stone & Bajri, ( Minor Mineral) from Beas River area of 6-85-77 Ha",UMA PATTI STONE CRUSHER,EC Granted,EC,
4,435,SIA/HP/MIN/43042/2019,HPSEIAA/2019/665,Clay(brick earth) mining project by Smt rekha Joshi,SMT REKHA JOSHI PROP MS KIRAN BRICKS KILN,Delisted,EC,
5,436,SIA/HP/MIN/409764/2022,HPSEIAA/2023/1057,"Extraction of Stone, Sand and Bajri from Khasra No. 250/2",SUNDER LAL,EC Granted,EC,
6,437,SIA/HP/MIN/41044/2019,SEIAA/2019/651,"Sand, Stone and Bajri Mining Project by Sh Mohan Singh",SAND STONE AND BAJRI MINING PROJECT BY SH MOHAN SINGH,EC Granted,EC,
7,438,SIA/HP/RIV/162876/2020,HPSEIAA/2020/761,"Sukahar Irrigation Project in Tehsil Jawali Distt, Kangra H.P","SUKAHAR IRRIGATION PROJECT BY IRRIGATION & PUBLIC HEALTH DEPARTMENT, HIMACHAL PRADESH",EC Granted,EC,
8,439,SIA/HP/MIN/217247/2021,HPSEIAA/2021/847,Stone Mining Project,SHRI NANAK CHAND DHIMAN,Delisted,EC,
9,440,SIA/HP/MIN/65948/2017,HPSEIAA/2017/547,Mohal Dalu Mining Project.,MOHAL DALU MINING PROJECT,EC Granted,EC,
0,441,SIA/HP/MIN/159880/2020,HPSEIAA/2020/744,"Extraction of Sand from Khasra No’s 86, 89 & 93 Measuring 11-04 Bighas (Private Land, Hill Slope) Falling In Mauza Jokhari, Tehsil & Distt. Solan, Himachal Pradesh",SHREE DALIP SINGH,EC Granted,EC,
1,442,SIA/HP/MIN/67995/2017,HPSEIAA/2017/557,"sand,stone and bajri mining project by Sh Kishori Lal",SAND STONE AND BAJRI MINING BY SH KISHORI LAL,EC Granted,EC,
2,443,SIA/HP/IND2/206326/2021,HPSEIAA/2021/829,"New API and Intermediate Bulk Drug Manufacturing Unit namely ""M/S Kinvan Private Limited"" at Village- Plasra, Industrial Area /Kirpalpur Proposed Industrial Area, Tehsil- Nalagarh, Distt. - Solan, H.P.",M/S KINVAN PRIVATE LIMITED,EC Granted,EC,
3,444,SIA/HP/MIN/243943/2021,HPSEIAA/2021/916,"Extraction of Stone from area falling in Mauza & Mohal Kaliyon Pab, Tehsil Rajgarh, Distt. Sirmaur Himachal Pradesh having an area of  07-04 Bighas",RAJNEESH VERMA,EC Granted,EC,
4,445,SIA/HP/MIN/225739/2021,HPSEIAA/2021/869,Sand Stone & Bajri Minig Project,SHRI  PAWAN KUMAR,EC Granted,EC,
5,446,SIA/HP/MIN/53162/2016,HPSEIAA/2013/206,"Collection/Extraction of Sand ,Stone & Bajri, ( Minor Mineral) from Beas River area of 6-85-77 Ha",UMA PATTI STONE CRUSHER,EC Granted,EC,
6,447,SIA/HP/MIN/246226/2021,HPSEIAA/2021/927,"Khanalag Stone Mining Project, Area-13-18 Bighas (1.0460 Hectare) Khasra no-134/2 Located Near Village- Khanalag, Tehsil- Arki, Dist- Solan Himachal Pradesh in Favor of Shree Arun Thakur",ARUN THAKUR,EC Granted,EC,
7,448,SIA/HP/MIN/65948/2017,HPSEIAA/2017/547,Mohal Dalu Mining Project.,MOHAL DALU MINING PROJECT,EC Granted,EC,
8,449,SIA/HP/IND3/247844/2021,HPSEIAA/2021/930,API and Intermediate Manufacturing Facility,JAGS PHARMA PRIVATE LIMITED,Deferred by SEAC,EC,
9,450,SIA/HP/MIN/71107/2017,HPSEIAA/2017/570,"sand, stone and bajri mining project by Sh Tepender Singh Saini",SAND STONE AND BAJRI MINING PROJECT BY SH TEPENDER SINGH SAINI,EC Granted,EC,
0,451,SIA/HP/MIN/168842/2020,HPSEIAA/2020/755,Sh. Om Prakash Mining area,SH. OM PRAKASH MINING AREA,EC Granted,EC,
1,452,SIA/HP/MIN/228333/2021,HPSEIAA/2021/877,Hill Slope Mining for Extraction of Stone from Mauza Phati Rot-I Kothi Bhallan proposed by Sh Ravinder Singh,SH RAVINDER SINGH,EC Granted,EC,
2,453,SIA/HP/MIN/81024/2018,HPSEIAA/2018/594,Stone Mining Project by Sh Devender Singh,STONE MINING PROJECT BY DEVENDER SINGH,EC Granted,EC,
3,454,SIA/HP/MIN/215556/2021,HPSEIAA/2021/850,"“Sand, Stone & Bajri Mining Project”",SHRI VEER SINGH,EC Granted,EC,
4,455,SIA/HP/MIN/189405/2020,HPSEIAA/2021/804,“Sand Mining Project”,M/S BALA TIKKA ASSOCIATES,EC Granted,EC,
5,456,SIA/HP/MIN/28622/2018,HPSEIAA/2018/588,Sh. Ranbir Singh-Mining Lease Area,SH. RANBIR SINGH- MINING LEASE AREA,EC Granted,EC,
6,457,SIA/HP/MIN/189681/2020,HPSEIAA/2021/813,Sh. Ashwani Kumar Mining area,SH. ASHWANI KUMAR MINING AREA,EC Granted,EC,
7,458,SIA/HP/MIN/39914/2011,HPSEIAA/2019/646,"Mining of Sand, Stone & Bajrifrom Sarsa river Proposed by Smt. Asha Rani Dang, Tehsil – Nalagarh,  District – Solan, State – Himachal Pradesh",SMT ASHA RANI DANG,EC Granted - Processed offline,EC,
8,459,SIA/HP/MIN/58672/2020,HPSEIAA/2021/904,"Mining of Stone boulder, Bajri and sand from Giri River Proposed by M/s A-One Minerals Prop. Sh. Rajesh Garg.","MINING OF STONE BOULDER, BAJRI AND SAND FROM GIRI RIVER PROPOSED BY M/S A-ONE MINERALS PROP. SH. RAJESH GARG.",EC Granted,EC,
9,460,SIA/HP/MIN/268885/2022,HPSEIAA/2022/948,"Extraction of Minor Minerals(Sand, Stone and Bajri) Falling in Mauza Singa, Tehsil Haroli Distt. Una, Himachal Pradesh.",SUMIT JOSHI,EC Granted,EC,
0,461,SIA/HP/MIN/59123/2016,HPSEIAA/2016/522,"Extraction of Limestone from Deolan
Limestone Mine",DEOLAN LIMESTONE MINE,EC Granted,EC,
1,462,SIA/HP/MIS/164951/2020,HPSEIAA/2020/746,Proposed Common Bio Waste Treatment Facility cum Plastic Granuels by M/s Enviro Engineers through GPA holder Sh Het Ram Thakur,COMMON BIOMEDICAL WASTE TREATMENT FACILITY CUM PLASTIC GRANUELS BY ENVIRO ENGINEERS,EC Granted,EC,
2,463,SIA/HP/MIN/430677/2023,HPSEIAA/2023/1085,"Extraction of Stone, Sand and Bajri falling in, Mohal Kutballa, Mauza Lambagaon, Tehsil Jaisinghpur, District Kangra, Himachal Pradesh by Sh. Virender Bhateria, & Sh. Joginder Singh",VIRENDER BHATERIA,Accepted By SEAC,EC,
3,464,SIA/HP/MIN/71822/2017,HPSEIAA/2018/600,"Mining of Sand, Stone & Bajri from Yamuna River proposed by Kush Parmar",SH KUSH PARMAR,Delisted,EC,
4,465,SIA/HP/MIN/37636/1900,HPSEIAA/2019/637,Hill slope Mining for extraction of Stone from Mauza/Mohal Than proposed by Smt. Kamla Devi,SMT. KAMLA DEVI,EC Granted,EC,
5,466,SIA/HP/MIN/168817/2020,HPSEIAA/2020/768,"Extraction of Brick Earth falling in Mauza Bhatian, Tehsil Nalagarh, District Solan, Himachal Pradesh by Sh. Satpal Bansal, Prop. M/s Luxmi Brick Kiln Traders","EXTRACTION OF BRICK EARTH FALLING IN MAUZA BHATIAN, TEHSIL NALAGARH, SOLAN, HIMACHAL PRADESH BY SH. SATPAL BANSAL, PROP. M/S LUXMI BRICK KILN TRADERS",Delisted,EC,
6,467,SIA/HP/MIN/17452/2012,HPSEIAA/2016/524,NO.J-11015/193/2011-IA-II (M),SHRI LACHHMI CHAND RIVER BED MINING PROJECT OF MINOR MINERALS,WithdrawEC,EC,
7,468,SIA/HP/MIN/426167/2023,HPSEIAA/2023/1078,“Stone Mining Project”,LACHMI CHANDEL,Pending at PP due to eds,EC,
8,469,SIA/HP/MIN/44452/2019,HPSEIAA/2019/661,M/s Krishna Stone Crusher- Mining Lease Area,M/S KRISHNA STONE CRUSHER,EC Granted,EC,
9,470,SIA/HP/MIN/44476/2019,HPSEIAA/2019/662,Sh. Sher Singh- Mining Lease Area,SH. SHER SINGH - MINING LEASE AREA,EC Granted,EC,
0,471,SIA/HP/MIN/53429/2016,HPSEIAA/2016/481,M/S Orbit Minerals Udyog Association,MEHTAB SINGH,EC Granted,EC,
1,472,SIA/HP/MIN/28636/2018,HPSEIAA/2018/584,Sh. Rakesh Kumar- Auctioned Area,SH. RAKESH KUMAR & SH. AJAY SINGH- AA,Delisted,EC,
2,473,SIA/HP/MIN/220369/2021,HPSEIAA/2021/856,"Extraction of Sand for open sale falling in Mauza Majhawar, Tehsil and District Mandi, Himachal Pradesh by Sh. Subhash Chand S/o Sh. Bhikam Ram","EXTRACTION OF SAND FOR OPEN SALE FALLING IN MAUZA MAJHAWAR, TEHSIL AND DISTRICT MANDI, HIMACHAL PRADESH BY SH. SUBHASH CHAND S/O SH. BHIKAM RAM",EC Granted,EC,
3,474,SIA/HP/MIN/189104/2020,HPSEIAA/2020/805,Hill Slope mining for Extraction of Stone from Mauza/Mohal Lana-Ro proposed by Sh Rajender Singh,SH RAJENDER SINGH S/O SH SHAWNU RAM,EC Granted,EC,
4,475,SIA/HP/MIN/136826/2020,HPSEIAA/2020/708,"Mining of Minor Mineral (Sand), by Sh. Ashok Kumar at Mauza/ Mohal- Neetahr, Tehsil- Neetahr, Distt.- Kullu, Himachal Pradesh",SH. ASHOK KUMAR-MINING LEASE AREA,EC Granted,EC,
5,476,SIA/HP/MIN/232250/2021,HPSEIAA/2021/885,"“Sand, Stone & Bajri Mining Project”","SH. VIJAY KUMAR, SH. DESH RAJ & YADVINDER KUMAR",EC Granted,EC,
6,477,SIA/HP/MIN/180551/2020,HPSEIAA/2020/777,"Minor Mineral Lease for extraction of Stone falling in Mauza Raipur, Tehsil & Distt. Solan, Himachal Pradesh by Shri Sushil Kumar Prop. Sharma Stone Provider","MINOR MINERAL LEASE FOR EXTRACTION OF STONE FALLING IN MAUZA RAIPUR, TEHSIL & DISTT. SOLAN, HIMACHAL PRADESH BY SHRI SUSHIL KUMAR PROP. SHARMA STONE PROVIDER",EC Granted,EC,
7,478,SIA/HP/MIN/58108/2016,,MOHAL SPAIL MINING PROJECT,RANJEET RANA,TransferToDEIAA,EC,
8,479,SIA/HP/MIN/55846/2016,HPSEIAA/2016/522,Mining of stone from hill slope proposed by Chuhi Ram Sharma Prop. M/s Maruti Crushers & Suppliers,MS MARUTI CRUSHERS AND SUPPLIERS,EC Granted - Processed offline,EC,
9,480,SIA/HP/MIN/53448/2016,HPSEIAA/2016/485,M/S Shankar Stone Crusher,SURINDER SINGH JAMWAL,EC Granted - Processed offline,EC,
0,481,SIA/HP/MIN/401562/2022,,BALAJI STONE CRUSHER,BALAJI STONE CRUSHER,Pending at PP due to eds,EC,
1,482,SIA/HP/MIN/132206/2019,HPSEIAA/2020/710,stone mining project by smt sharmila kanwar,MINING PROJECT BY SHARMILA KANWAR,EC Granted,EC,
2,483,SIA/HP/MIN/65818/2017,HPSEIAA/2017/548,"sand, stone and bajri mining project by sh Narinder kumar",SAND STONE AND BAJRI MINING PROJECT BY NARINDER KUMAR,EC Granted,EC,
3,484,SIA/HP/MIN/428294/2023,,"Mining of Sand, Stone & Bajri from riverbed of Yamuna River situated in Mauza/ Mohal – Manpur Devra, Tehsil- Paonta Sahib, Distt. Sirmour, H.P. proposed by Sh. Pankaj Kumar, S/O Sh. Sushil Kumar.",PANKAJ KUMAR,Pending at PP due to eds,EC,
4,485,SIA/HP/MIN/58643/2016,,"Mauja Lodhwan & Mohal Tipri, Mining Project",PUSHPINDER MAINI,WithdrawEC,EC,
5,486,SIA/HP/MIN/50411/2016,HPSEIAA/2016/468,Mouja Padhanu Mining project,SANJEEV GULERIA,EC Granted,EC,
6,487,SIA/HP/MIN/51958/2016,HPSEIAA/2012/134,Mining for extraction of Stone from Hill slope proposed by Sh. Deepak Joshi M/s Ambay Stone Crusher,MS AMBAY STONE CRUSHER,EC Granted,EC,
7,488,SIA/HP/MIN/428129/2023,HPSEIAA/2023/1083,"Extraction of Dolomites/Barytes falling in Mohal/Mauza Gundah, Tehsil Shillai, District Sirmour, H.P. by Sh. Bahadur Singh Prop. M/s Shiv Shakti Dolomites/Barytes Mine Jwana.",BAHADUR CHAUHAN,Under examination of SEAC,EC,
8,489,SIA/HP/MIN/95182/2019,HPSEIAA/2019/615,Hill Slope Stone Mining of Manish Mahendra,MAHENDRA MANISH,EC Granted,EC,
9,490,SIA/HP/IND2/402719/2022,HPSEIAA/2022/988,M/s Hygena Life Sciences Private Limited.,HYGENA LIFE SCIENCES PRIVATE LIMITED,WithdrawEC,EC,
0,491,SIA/HP/MIN/28637/2018,HPSEIAA/2018/583,Smt. Sunita Devi- Auctioned Area,SMT. SUNITA DEVI & SMT. MUSKAN THAKUR- AUCTIONED AREA,EC Granted,EC,
1,492,SIA/HP/MIN/79364/2018,HPSEIAA/2018/593,"Mining for extraction of Limestone, proposed by Sh. Kanwar Mrigendra Singh Prop. M/s Durga Limestone Mine situated at Mauza Borli, Tehsil Sangrah, District Sirmaur, Himachal Pradesh",M/S DURGA LIMESTONE MINE,EC Granted,EC,
2,493,SIA/HP/MIN/53368/2016,HPSEIAA/2016/493,Sand Stone And Bajri Mining By kuldeep Mehta,MINING OF STONE BAJRI AND SAND BY SHRI KULDEEP MEHTA,TransferToDEIAA,EC,
3,494,SIA/HP/MIN/32988/2015,,Hill slope mining lease Proposed by M/s –Raj Stone Crusher for Collection of Stone and Bajri,EKO PRO ENGINEERS PVT LTD,TransferToDEIAA,EC,
4,495,SIA/HP/MIN/291256/2022,HPSEIAA/2023/1055,Stone Mining Project”Khasra No. 5&7 by Dixit Keprate S/o Sh. Hariman Prakash,DIXIT KEPRATE,EC Granted,EC,
5,496,SIA/HP/RIV/20089/2013,HPSEIAA/2013/186,ChanjuIII 48MW HEP in Churah Tehsil of Distt Chamba HP,HIMACHAL PRADESH POWER CORPORATION LIMITED,EC Granted,EC,
6,497,SIA/HP/MIN/69499/2017,HPSEIAA/2017/565,"Mining of Sand, Stone & Bajri from Kunah Khad, situated at Mohal Moonh & Mauza Bhumpal Proposed by Sh. Shammi Soni  S/o Sh. Brij Mohan Soni",SH SHAMMI SONI,EC Granted,EC,
7,498,SIA/HP/MIN/50334/2016,,"M/S MAA BALA SUNDARI STONE CRUSHER
Mining of Sand, Stone &Bajri from Khasra No. 594/542/403/19, 903/12/2, 593/542/403/19, 602/12 & 595/542/403/19 falling in Village Bajari, Mauza/MohalBarmaPapri of Tehsil Nahan, District Sirmour, H.P.",BALBIR SINGH,TransferToDEIAA,EC,
8,499,SIA/HP/MIN/143777/2020,HPSEIAA/2020/717,"Extraction of Brick earth falling in Mauza/ Mohal Ganguwala, Jamniwala, Tehsil Paonta Sahib, District Sirmour, Himachal Pradesh by Sh. Gurbakash Singh Partner M/s Avtar Bricks Company","EXTRACTION OF BRICK EARTH FALLING IN MAUZA/ MOHAL GANGUWALA, JAMNIWALA, TEHSIL PAONTA SAHIB, DISTRICT SIRMOUR, HIMACHAL PRADESH BY SH. GURBAKASH SINGH PARTNER M/S AVTAR BRICKS COMPANY",Delisted,EC,
9,500,SIA/HP/MIN/128254/2019,HPSEIAA/2019/678,"Hill slope mining for extraction of Sand from Mauza/Mohal Deothi, Tehsil & District Solan, Himachal Pradesh",SH AMIT BINDAL PROP MS DEOTHAL SAND MINE,EC Granted,EC,
0,501,SIA/HP/MIN/246998/2021,HPSEIAA/2021/922,"Extraction of Minor Minerals by Sh. Sanjay Chauhan at Mohal-Dharmrol, Mauza- Mewa, Tehsil- Bhoranj, District- Hamirpur, H.P.",SANJAY CHAUHAN,EC Granted,EC,
1,502,SIA/HP/MIN/57776/2016,,Hill slope Mining for extraction of Stone & Bajri from Village Gurdaspura proposed by Sh. Anil Bansal (Prop.)M/s Shiv Stone Crusher,SHIV STONE CRUSHER,TransferToDEIAA,EC,
2,503,SIA/HP/MIN/58768/2016,,"Stone & Bajri Mining Project
Proponent: RL Mohil",SHRI R L MOHIL,TransferToDEIAA,EC,
3,504,SIA/HP/MIN/51645/2016,,"Mining for extraction of Sand, Stone and Bajri from Hill slope proposed by M/s Himachal Crushing Co. Partner Sh. Rajinder Gupta",MS HIMACHAL CRUSHING COMPANY,TransferToDEIAA,EC,
4,505,SIA/HP/MIN/53352/2016,,Mining of Stone by Shri Chhering Tandup,STONE MINING PROJECT BY CHHERING TANDUP,TransferToDEIAA,EC,
5,506,SIA/HP/MIN/189104/2020,HPSEIAA/2020/805,Hill Slope mining for Extraction of Stone from Mauza/Mohal Lana-Ro proposed by Sh Rajender Singh,SH RAJENDER SINGH S/O SH SHAWNU RAM,EC Granted,EC,
6,507,SIA/HP/MIN/93675/2019,HPSEIAA/2019/607,Mining of stone from hill slope proposed by   Sh. Ashok Gupta Partner M/s Sun Shine Mineral & Stone Crusher,SH. ASHOK GUPTA PARTNER M/S SUN SHINE MINERAL AND STONE CRUSHER,EC Granted,EC,
7,508,SIA/HP/NCP/42665/2016,HPSEIAA/2013/184,"Maharishi Markandeshwar Medical Hospital, Village Lado, Kumarhatti, Solan, H.P.",MAHARISHI MARKANDESHWAR MEDICAL HOSPITAL,EC Granted,EC,
8,509,SIA/HP/RIV/20091/2013,HPSEIAA/2013/187,Deothal Chanju 30MW HEP in Churah Tehsil of Distt Chamba,HIMACHAL PRADESH POWER CORPORATION LIMITED,EC Granted,EC,
9,510,SIA/HP/MIN/230414/2021,HPSEIAA/2021/883,"Minor Mineral Lease for extraction of Stone, Sand and Bajri falling in Mauza & Mohal Bhadauri, Tehsil Haroli, District Una, Himachal Pradesh.",DEV RAJ SHARMA,WithdrawEC,EC,
0,511,SIA/HP/MIN/213914/2021,HPSEIAA/2021/842,"Mining of Sand, Stone and Bajri(Gravel) from bed of river Bata by Sh Mokham Singh S/o Sh Trilok Singh",MOKHAM SINGH S/O TRILOK SINGH,EC Granted,EC,
1,512,SIA/HP/MIN/290647/2022,HPSEIAA/2022/986,Sh. Kapil Sharma Partner M/s Shree Rudra Stone Crusher,KAPIL SHARMA,EC Granted,EC,
2,513,SIA/HP/MIN/432942/2023,,"Chowki Mrigwal” Lime Stone Mine, Proposed Limestone Production Expansion from 20000 TPA to 85937.5 TPA, M/s Giri Lime & chemicals Prop. Shri Arun Grover",ARUN GROVER,Pending at PP due to eds,EC,
3,514,SIA/HP/MIN/41933/1900,SEIAA/2019/657,"Mining of Sand, Stone & Bajri from Sukkar proposed by Sh Narender Singh S/o Sh Munshi Ram",SH NARENDER SINGH S/O SH MUNSHI RAM,EC Granted,EC,
4,515,SIA/HP/MIN/44549/2019,HPSEIAA/2019/660,Sher Singh Mining Lease area,M/S CHATURBHUJ SCREENING PLANT,EC Granted,EC,
5,516,SIA/HP/MIN/86868/2018,HPSEIAA/2018/599,Sand stone and Bajri Mining project by M/s Bitta Stone Crusher,SAND STONE AND BAJRI MINING PROJECT BY BITTA STONE CRUSHER,EC Granted,EC,
6,517,SIA/HP/MIN/53433/2016,HPSEIAA/2016/483,"M/S Naina Stone Crusher,Mouza Batohli/41 & Padhanu/46 Mining Site",MOHINDER SINGH,EC Granted,EC,
7,518,SIA/HP/MIN/228029/2021,HPSEIAA/2021/873,Hill Slope mining for Extraction of Stone proposed by Sh. Vinod Shandil S/o Sh Ram Krishan,SH VINOD SHANDIL,EC Granted,EC,
8,519,SIA/HP/MIN/52161/2019,HPSEIAA/2020/724,"Mining of Sand, Stone & Bajri from Yamuna River proposed by Sh Kush Parmar",KUSH PARMAR,Delisted,EC,
9,520,SIA/HP/MIN/161017/2020,HPSEIAA/2020/742,M/s Sianj Valley Sand & Stone Crusher,M/S SIANJ VALLEY SAND & STONE CRUSHER,EC Granted,EC,
0,521,SIA/HP/MIN/81915/2021,HPSEIAA/2021/875,,MAHADEV MINES AND MINERALS MINING PROJECT,EC Granted,EC,
1,522,SIA/HP/MIN/230414/2021,HPSEIAA/2021/883,"Minor Mineral Lease for extraction of Stone, Sand and Bajri falling in Mauza & Mohal Bhadauri, Tehsil Haroli, District Una, Himachal Pradesh.",DEV RAJ SHARMA,WithdrawEC,EC,
2,523,SIA/HP/MIN/81228/2021,HPSEIAA/2020/747,,SH. RAHUL PATHANIA & SMT. SEEMA DEVI - MINING LEASE AREA,Delisted,EC,
3,524,SIA/HP/MIN/428193/2023,HPSEIAA/2023/1081,"Extraction of Sand from hill slope at Mauza/Mohal Mangarh, Tehsil Pachhad, District Sirmaur H.P. Proposed by M/s Sarahan Blues Prop. Sh. Himender Anand, Lakshay Anand & Parmarthi dutt.",THE SARAHAN BLUES,Accepted By SEAC,EC,
4,525,SIA/HP/MIN/40229/2019,HPSEIAA/2020/700,SHIVA BRICK MFG. IND.,SHIVA BRICK MFG IND,Delisted,EC,
5,526,SIA/HP/MIN/41548/2019,SEIAA/2019/659,"“Sand, Stone & Bajri Mining Project”",TRIPTA,Rejected - Processed offline,EC,
6,527,SIA/HP/MIN/45691/2019,HPSEIAA/2019/684,Cut Stone mining project by Sh Muni lal,CUT STONE MINING PROJECT BY SH MUNI LAL,EC Granted,EC,
7,528,SIA/HP/MIN/67995/2017,HPSEIAA/2017/557,"sand,stone and bajri mining project by Sh Kishori Lal",SAND STONE AND BAJRI MINING BY SH KISHORI LAL,EC Granted,EC,
8,529,SIA/HP/MIN/196948/2021,,Sand Stone and Bajri Mining Project by Sh Ved ram,SAND STONE AND BAJRI MINING PROJECT BY SH VED RAM,Delisted,EC,
9,530,SIA/HP/MIN/291207/2022,HPSEIAA/2022/987,“Sand Mining Project” Khasra no: 02 by Sh. Pawan Kumar S/o Sh. Hari Ram,PAWAN KUMAR,ADS by SEAC,EC,
0,531,SIA/HP/MIN/431052/2023,HPSEIAA/2023/1084,"Extraction of Stone falling in Mauza/Mohal  Jhakri, Tehsil Theog, District Shimla, H.P. by  Sh. Rajinder Kumar, S/o Sh. Matha Ram V.P.O. Sarion, Tehsil Theog, District Shimla, Himachal Pradesh",RAJINDER VERMA,Under examination of SEAC,EC,
1,532,SIA/HP/MIN/53719/2016,HPSEIAA/2016/498,M/s Thakur Enterprises,THAKUR ENTERPRISES UNA HP,EC Granted,EC,
2,533,SIA/HP/MIS/139235/2020,HPSEIAA/2020/706,M/s Nirvana Woods & Hotels Pvt. Ltd.,M/S NIRVANA WOODS & HOTELS PVT. LTD.,Delisted,EC,
3,534,SIA/HP/MIN/166450/2020,HPSEIAA/2020/754,"Mining of Stone Boulder, Bajri and sand from riverbed of Giri River situated in Mauza/ Mohal – Phoolpur Shamshergah, Tehsil Ponta Sahib, Distt. Sirmour, H.P. by Sh. Ashutosh Gupta","MINING OF STONE BOULDER, BAJRI AND SAND FROM RIVERBED OF GIRI RIVER SITUATED IN MAUZA/ MOHAL – PHOOLPUR SHAMSHERGAH, TEHSIL PONTA SAHIB, DISTT. SIRMOUR, H.P. BY SH. ASHUTOSH GUPTA",EC Granted,EC,
4,535,SIA/HP/MIN/179322/2020,HPSEIAA/2021/806,"Moin Minor Mineral Lease for Stone, Sand & Bajri",SJVN SHIMLA,EC Granted,EC,
5,536,SIA/HP/MIN/405742/2022,HPSEIAA/2022/1024,"Hill Slope mining for Extraction of Stone proposed by Sh. Bharat Bhushan Verma Prop. M/s Bhushan Stone Crusher situated at Mauza/Mohal Tihana, Tehsil Theog , District Shimla, H.P.",BHARAT VERMA,Rejected by SEIAA,EC,
6,537,SIA/HP/INFRA2/411875/2022,HPSEIAA/2022/1040,"Proposed Construction of Residential colony Terra Grande situated in Mouza Up-Sampada Suchali, Tehsil Pachhad, District Sirmour, H.P by M/s Alternative Habitat Pvt. Ltd",ALTERNATIVE HABITAT PRIVATE LIMITED,EC Granted,EC,
7,538,SIA/HP/MIN/145029/2020,HPSEIAA/2020/714,"Extraction of Brick earth falling in Mauza Ganguwala, Jamniwala, Tehsil Paonta Sahib, District Sirmour, Himachal Pradesh by Smt. Jaspal Kaur, Partner M/s Saini Bricks Industries","EXTRACTION OF BRICK EARTH FALLING IN MAUZA GANGUWALA, JAMNIWALA, TEHSIL PAONTA SAHIB, DISTRICT SIRMOUR, HIMACHAL PRADESH BY SMT. JASPAL KAUR, PARTNER M/S SAINI BRICKS INDUSTRIES",Delisted,EC,
8,539,SIA/HP/MIN/197310/2021,HPSEIAA/2021/820,"Hill slope Mining for extraction of Stone from Mauza Nanto, Tehsil Arki, Distt Solan, Himachal Pradesh by Sh. Vinod Sharma Prop. M/s Ambey Stone Crusher","HILL SLOPE MINING FOR EXTRACTION OF STONE FROM MAUZA NANTO, TEHSIL ARKI, DISTT SOLAN, HIMACHAL PRADESH BY SH. VINOD SHARMA PROP. M/S AMBEY STONE CRUSHER",EC Granted,EC,
9,540,SIA/HP/IND2/59928/2021,HPSEIAA/2021/834,"Expansion of Manmade Fibre Unit (Spandex Elastomeric Yarn) namely “M/s Indorama Industries Limited” located at Plot No. 10, Village- Lodhimajra, Tehsil- Baddi, District- Solan, Himachal Pradesh",M/S INDORAMA INDUSTRIES LTD.,EC Granted,EC,
0,541,SIA/HP/MIN/230181/2021,HPSEIAA/2021/878,"Extraction of Sand, Stone & Bajri for the proposed stone crusher falling in Mauza Neethar, Sub-Tehsil Neethar, District Kullu, Himachal Pradesh by Sh. Subhash Sharma","EXTRACTION OF MINOR MINERALS SAND, STONE & BAJRI FALLING IN MAUZA NEETHAR, SUB-TEHSIL NEETHAR, DISTRICT KULLU, HIMACHAL PRADESH BY SH. SUBHASH SHARMA.",EC Granted,EC,
1,542,SIA/HP/MIN/58069/2016,,Sand and Bajri Mining Project,SAND AND BAJRI MINING PROJECT,TransferToDEIAA,EC,
2,543,SIA/HP/MIN/35184/2019,HPSEIAA/2019/627,stoneboulder mining project by sangam stone crusher,MINING PROJECT BY SANGAM STONE CRUSHER,EC Granted,EC,
3,544,SIA/HP/MIN/197310/2021,HPSEIAA/2021/820,"Hill slope Mining for extraction of Stone from Mauza Nanto, Tehsil Arki, Distt Solan, Himachal Pradesh by Sh. Vinod Sharma Prop. M/s Ambey Stone Crusher","HILL SLOPE MINING FOR EXTRACTION OF STONE FROM MAUZA NANTO, TEHSIL ARKI, DISTT SOLAN, HIMACHAL PRADESH BY SH. VINOD SHARMA PROP. M/S AMBEY STONE CRUSHER",EC Granted,EC,
4,545,SIA/HP/MIN/157655/2020,HPSEIAA/2020/739,Stone Mining Project with Proposed Crusher,AJAY RATHORE,EC Granted,EC,
5,546,SIA/HP/MIN/159804/2020,HPSEIAA/2020/758,Sh. Vinod Kumar Mining area,SH. VINOD KUMAR MINING AREA,Delisted,EC,
6,547,SIA/HP/IND2/59928/2021,HPSEIAA/2021/834,"Expansion of Manmade Fibre Unit (Spandex Elastomeric Yarn) namely “M/s Indorama Industries Limited” located at Plot No. 10, Village- Lodhimajra, Tehsil- Baddi, District- Solan, Himachal Pradesh",M/S INDORAMA INDUSTRIES LTD.,EC Granted,EC,
7,548,SIA/HP/MIN/405368/2022,HPSEIAA/2022/1008,Sh. Tej Parkash Chopra Mining Lease Area,TEJ CHOPRA,EC Granted,EC,
8,549,SIA/HP/MIN/77816/2018,SEIAA/2018/592,"Mining of Sand, Stone & Bajri from Giri River proposed by M/s Dev Raj Stone Crusher.",DEVRAJ STONE CRUSHER,EC Granted,EC,
9,550,SIA/HP/MIN/63471/2017,,"Sand, Stone and Bajri MiningProject by Shri Vijender Jain Prop. M/s Deepika Stone Crusher",SAND STONE AND BAJRI MINING PROJECT BY SHRI VIJENDER JAIN,TransferToDEIAA,EC,
0,551,SIA/HP/MIN/210437/2021,HPSEIAA/2021/837,sand stone and bajri mining project by Sh Balbir Singh,BALBIR SINGH,Delisted,EC,
1,552,SIA/HP/MIN/53368/2016,HPSEIAA/2016/493,Sand Stone And Bajri Mining By kuldeep Mehta,MINING OF STONE BAJRI AND SAND BY SHRI KULDEEP MEHTA,TransferToDEIAA,EC,
2,553,SIA/HP/IND3/244861/2021,HPSEIAA/2021/926,Proposed Setting up a Active Pharmaceutical Ingredient (API) Manufacturing Unit,M/S CMG BIOTECH LIMITED,Deferred by SEAC,EC,
3,554,SIA/HP/MIN/67587/2017,SEIAA/2017/553,Raman Kumar Mining Lease Area,RAMAN KUMAR MINING LEASE AREA,EC Granted,EC,
4,555,SIA/HP/MIN/52887/2016,HPSEIAA/486,PANCHAM SINGH,PANCHAM SINGH,EC Granted,EC,
5,556,SIA/HP/MIN/31441/2019,HPSEIAA/2019/628,"Extraction of sand, stone & bajari from Mauza- Dulehar, Mohal- Heeran, Tehsil- Haroli, District- Una, State- Himachal Pradesh",BRECHER STONE CRUSHER,Delisted,EC,
6,557,SIA/HP/MIN/176979/2020,HPSEIAA/2020/763,"S/Sh. Surjeet Singh, Sh. Navdesh Passi and Jitender Singh– Mining  Area","S/SH. SURJEET SINGH, SH. NAVDESH PASSI & SH. JITENDER SINGH MINING AREA",EC Granted,EC,
7,558,SIA/HP/MIN/277472/2022,HPSEIAA/2022/954,"Extraction of Sand For Open Sale From Khasra No. 203/70/1 Measuring 13-00 Bighas (Private Land, Hill Slope ) Falling In Mauza Bawasi, Tehsil Arki & Distt. Solan, Himachal Pradesh",NARESH KUMAR,EC Granted,EC,
8,559,SIA/HP/MIS/169817/2020,HPSEIAA/2020/764,"Auramah Valley Phase - III, by Club One Estates","""AURAMAH VALLEY PHASE - II"" BY CLUB ONE ESTATE",ADS by SEAC,EC,
9,560,SIA/HP/MIS/243982/2021,HPSEIAA/2021/918,"Residential Project namely “Himachal One Apartment” located at Village Malkumajra, Tehsil Baddi, Distt. Solan, Himachal Pradesh by M/s Ahlawat Developers & Promoters.",M/S AHLAWAT DEVELOPERS AND PROMOTERS,Return to SEIAA(Violation),EC,
0,561,SIA/HP/MIN/290578/2022,HPSEIAA/2022/1003,Smt. Tamanna Thakur  Smt. Seema Devi Mining area at Mauza Mohal Maned Tehsil Dharamshala District Kangra Himachal Pradesh,TAMANNA,EC Granted,EC,
1,562,SIA/HP/IND2/173775/2020,HPSEIAA/2020/775,S R BIO CHEM PVT LTD,S R BIO CHEM PVT LTD,Delisted,EC,
2,563,SIA/HP/MIN/414939/2023,HPSEIAA/2022/1038,"STONE BOULDER, SAND AND BAJRI MINING PROJECT BY SH VIPUL SHARMA",ANIL SHARMA,Delisted,EC,
3,564,SIA/HP/NCP/94888/2019,SEIAA/2019/611,Group Housing Project by M/s N.G. Estate,M/S N.G. ESTATE,EC Granted,EC,
4,565,SIA/HP/MIN/64213/2017,,Mining of Stone by Atul Sharma,STONE MINING PROJECT BY SHRI ATUL SHARMA,TransferToDEIAA,EC,
5,566,SIA/HP/MIN/53455/2016,HPSEIAA/2016/482,Village Dudana Lohian Mining Project,SMT KAILASH THAKUR,EC Granted,EC,
6,567,SIA/HP/MIS/193365/2021,HPSEIAA/2021/812,"Super Speciality Block, Indira Gandhi Medical College, Malyana","INDIRA GANDHI MEDICAL COLLEGE, SHIMLA",EC Granted,EC,
7,568,SIA/HP/MIN/40997/2018,HPSEIAA/2018/598,"River Bed Mining Project of Minor Mineral, Sand, Stone & Bajri.",SAND STONE AND BAJRI MINING PROJECT BY RANDEEP SINGH,EC Granted,EC,
